"asin","title","imgUrl","stars","reviews","price","category_id"
"B07HRCFRQM","Miss Deer Compatible 934 935 Ink Cartridge Replacement for HP 934XL 935XL Work with Officejet 6812 6815 6820 6825 Officejet Pro 6230 6830 6835 Printer (1 Black, 1 Cyan, 1 Magenta, 1 Yellow) 4 Pack","https://m.media-amazon.com/images/I/71UcNxMrzqL._AC_UL320_.jpg","4.0","709","18.59","72"
"B0855QLFXV","Pen+Gear 50-CT Thermal Laminating Pouches Letter Size 9"" x 11.5"" | 3 mil Glossy Professional Finish","https://m.media-amazon.com/images/I/91gX1zAS5JL._AC_UL320_.jpg","4.5","29","27.95","72"
"B07TFCLT83","14In Manual All Metal Frame Cold Roll Laminator Mount Laminating Machine Vinyl Photo Film Mounting Laminator","https://m.media-amazon.com/images/I/41At-XlhA6L._AC_UL320_.jpg","4.7","5","129.99","72"
"B0BJYNCV49","NETUM Bluetooth Wireless 2D Barcode Scanner with Charging Cradle, Hands Free Automatic Sensing Bar Code Reader 1D 2D QR pdf417 Scan Gun Works with MAC OS, Windows, iOS, Android - DS7500","https://m.media-amazon.com/images/I/415jNUukIvL._AC_UL320_.jpg","4.2","27","74.99","72"
"B07YB91QFS","High-Batt WH500 W745 Battery, Replacement Battery 84598-01 82742-01 204755-01 for Plantronics Savi W740 W440-M W440 W740-M W445 86507-01 Wireless Headsets 3.7V 140mAh (Pack of 3)","https://m.media-amazon.com/images/I/61RmEdOvG7L._AC_UL320_.jpg","4.2","54","39.99","72"
"B0096XXQFI","Fellowes 36053 Shredder Bags, 9 Gal, F/99CI,90S, 15-Inch x14-Inch x30-Inch , 100/CT,CL","https://m.media-amazon.com/images/I/71A+o5gHQwL._AC_UL320_.jpg","5.0","5","34.9","72"
"B01LZKLNST","greencycle Compatible Toner Cartridge Replacement for Samsung 103L MLT103 MLT-D103L MLTD103L Use with ML-2955ND ML-2955DW ML-2950ND SCX-4729FW SCX-4729FD Printer (Black, 2-Pack)","https://m.media-amazon.com/images/I/61xIjN3sT8L._AC_UL320_.jpg","4.0","156","42.99","72"
"B09W22XM5L","Label Maker with Keyboard, E1000 Portable Handheld Label Printer Labeler Machine with AC Adapter and 4 Pack JM-231, Green Label Maker for Organization Home Office School","https://m.media-amazon.com/images/I/71MJTqi1KqL._AC_UL320_.jpg","4.1","67","45.99","72"
"B00O4DKNWY","Plantronics PLNHW530 EncorePro HW530 Headset","https://m.media-amazon.com/images/I/71DxqXWz-sS._AC_UL320_.jpg","3.8","17","66.0","72"
"B01J61ZAYY","Kastar 2-Pack AAA 3.6V 1000mAh Ni-MH Rechargeable Battery Replacement for Zebra/Motorola Symbol 82-67705-01 Symbol LS-4278 LS4278-M BTRY-LS42RAAOE-01 DS-6878 Cordless Bluetooth Laser Barcode Scanner","https://m.media-amazon.com/images/I/712A+lgX5LL._AC_UL320_.jpg","4.4","93","11.99","72"
"B089VW931R","Samsill 3mil Thermal Laminating Pouches, Business Card Size, Clear, 2.25 x 3.75 Inch (200 Pack)","https://m.media-amazon.com/images/I/81VLT0JD+yL._AC_UL320_.jpg","4.5","83","9.04","72"
"B0BJFQM43Q","TN 850 Toner Cartridge, Compatible for Brother TN850 High Yield Black , TN-850 TN820 to Use with Brother HL-L6200DW MFC-L5850DW MFC-L5700DW HL-L5200DW MFC-L5900DW (2 Pack)","https://m.media-amazon.com/images/I/71Acl8sxORL._AC_UL320_.jpg","4.6","7","34.98","72"
"B07SCJMTST","Canon 2 Pack CRG 055 Standard Capacity Toner Cartridge for MF743 &amp; MF741 Printers, Black","https://m.media-amazon.com/images/I/618NpzMYlkL._AC_UL320_.jpg","3.8","10","186.75","72"
"B07WVX6MZ6","PGI-2200XL Compatible Canon PGI 2200 XL Pigment Ink Cartridges Work for Canon Maxify MB5420 MB5120 MB5320 MB5020 iB4120 iB4020 Printers (Black/Cyan/Magenta/Yellow, 4-Pack)","https://m.media-amazon.com/images/I/71uWfRWbNnL._AC_UL320_.jpg","4.4","94","18.99","72"
"B0034VGF7Y","Avery Dennison Two-Line Labeler","https://m.media-amazon.com/images/I/61PH7f-lTbL._AC_UL320_.jpg","4.2","38","72.76","72"
"B09CDLNCHM","12 Pieces 8 Digits Thin Calculator Slim Credit Card Design Calculator Solar Power Pocket Calculator Portable Mini Calculator for Home Office School (Black and Gold)","https://m.media-amazon.com/images/I/915KHiMo8KL._AC_UL320_.jpg","3.8","63","14.99","72"
"B083SSZPH7","High-Batt TV Ears 5.0 Battery, Rechargeable NiMH Battery Replacement for 40810 TV Ears 5.0 Digital Wireless Headset (Only Fits 5.0 Version) (3 Pack)","https://m.media-amazon.com/images/I/51vLCOiTm-L._AC_UL320_.jpg","4.6","85","12.99","72"
"B096PS9M7C","ASUS ZenBeam Latte L1 Portable Wi-Fi Projector- 300 Lumens Projector, Built-in Harman Kardon Bluetooth Speaker, 3 Hours Video Playback, Wireless WiFi Projector, HDMI, USB, Remote Control, AptoideTV","https://m.media-amazon.com/images/I/91TXhzU6Y+S._AC_UL320_.jpg","4.0","36","349.0","72"
"B09FP7C7N3","VANBOW BT162342 BT262342 BT183342 BT283342 2.4V 800mah Cordless Phone Batteries Compatible with VTech CS6114 CS6419 CS6719 AT&T EL5210 EL52300 EL52400 CL81101 CL80111 Handset Telephone (Pack 3)","https://m.media-amazon.com/images/I/71u1NBTnIfL._AC_UL320_.jpg","4.6","58","9.99","72"
"B0BM5WTPVH","GALADA Autofill Sublimation Ink Work with ET-2400 ET-2720 ET-2760 ET-2800 ET-2803 ET-2830 ET-4800 ET-3760 ET-2850 ET-7720 ET-15000 Anti-UV/ICC Free","https://m.media-amazon.com/images/I/71C+rx1yudL._AC_UL320_.jpg","4.8","34","10.99","72"
"B07SR7P51K","LxTek Compatible Toner Cartridges Replacement for Canon 131 131H to use with LBP7110Cw MF624Cw MF628Cw MF8280Cw Printer (Black, Cyan, Magenta, Yellow, 4 Pack)","https://m.media-amazon.com/images/I/810motC+FRL._AC_UL320_.jpg","4.2","226","50.99","72"
"B0C39XJFQT","LC401XL Black Ink Cartridges Compatible Replacement for Brother LC401 LC401XL LC-401BK Use with Brother MFC-J1010DW MFC-J1012DW MFC-J1170DW, 1 Black","https://m.media-amazon.com/images/I/716fgLjdl0L._AC_UL320_.jpg","3.6","39","26.99","72"
"B01E0KVS8I","Akiles ACM-EX41+ Model CoilMac-EX41+ All-in-One Electric Coil Punch, Electric Inserter, and Manual Crimper; Special 4 x 5mm Oval Holes; Letter 4:1 (0.248"") Pitch; All 54 Disengageable Pins","https://m.media-amazon.com/images/I/71xTVJtUbxL._AC_UL320_.jpg","5.0","11","1199.0","72"
"B0CDKHPLQR","NUSIGN Label Maker Machine with Tape, Portable Bluetooth Label Printer, Wireless & Rechargeable Sticker Mini Label Makers with Multiple Templates Font Icon, White","https://m.media-amazon.com/images/I/51yKQOrqAoL._AC_UL320_.jpg","3.8","30","13.99","72"
"B09JBFTDZK","NexiGo Smart WiFi Mini Portable Projector, 4K Supported, Android 9.0, [100 ANSI - Over 3000 Lux], DLP Bluetooth Pico Video Projector, 4-Hours Playtime, Neat Projector, Home Entertainment","https://m.media-amazon.com/images/I/61MDFMBmCXL._AC_UL320_.jpg","3.8","49","249.99","72"
"B0BZTZVK2B","1D/2D Automatic Omnidirectional Desktop Wired USB Bar Code Scanner Reader,Plug and Play,Handsfree Barcode Scanner for Warehouse, Supermarket, Retail Store, Bookstore Pos System","https://m.media-amazon.com/images/I/511kzwNd25L._AC_UL320_.jpg","3.8","10","59.99","72"
"B07Q1N3JJR","Sotek Compatible PGI-280XXL CLI-281XXL 280XL 281XL 280 281 Ink Cartridges, Use with PIXMA TS9120 TS8120 TS8220 TS8320 TS8322 TS9120 TS8100 TS8200 TS8300 Printers (with Photo Blue)","https://m.media-amazon.com/images/I/71jMI9u1dvL._AC_UL320_.jpg","4.7","382","25.99","72"
"B07YP2MV27","Plantronics Savi 8220 Wireless DECT Headset System 207325-01 with Cleaning Set","https://m.media-amazon.com/images/I/61oxdji2NfL._AC_UL320_.jpg","4.2","87","249.99","72"
"B09CQF9MQG","GREENBOX Compatible 27X High Yield Black Toner Cartridge Replacement for HP 27X C4127X 27A C4127A for 4050 4050TN 4050N 4000 4000N 4000TN 4000T 4050DN Printer (10,000 Pages High Yield, Black, 1-Pack)","https://m.media-amazon.com/images/I/710YSP-N1SL._AC_UL320_.jpg","3.8","7","47.99","72"
"B092HLZKYY","daily headset QD USB Phone Headset Adapter Cable Compatible with Plantronics Quick Connect, Spk Volume Up Down Mic Mute Unmute in-line Controls","https://m.media-amazon.com/images/I/5163WvY5-GS._AC_UL320_.jpg","3.8","30","15.96","72"
"B0C49JMDHG","4K Projector with WiFi and Bluetooth, TOPTRO 2023 Upgraded X3 Native 1080P Projector 4K Support, 16000 Lumen, 4P/4D Keystone, 300"" Display, 50% Zoom, Outdoor Projector for iOS/Android/ TV Stick/PS5","https://m.media-amazon.com/images/I/81zGd+9pRML._AC_UL320_.jpg","4.4","308","169.99","72"
"B0BN7T9MPB","201A Black, Cyan, Magenta, Yellow Works with HP Color Laserjet Pro MFP M277dw M252dw M277n M277c6 M252n M277 Printer Toner (CF400A CF401A CF402A CF403A )","https://m.media-amazon.com/images/I/81RBGC5IV5L._AC_UL320_.jpg","4.3","11","89.99","72"
"B088QXQTH7","LCL Compatible Ink Bottle Replacement for Canon GI20 GI-20 GI-20PGBK GI-20BK PIXMA G6020 G5020 G7020 (2-Pack,Black Pigment 170ML)","https://m.media-amazon.com/images/I/71vtlwHXJpL._AC_UL320_.jpg","4.6","19","14.59","72"
"B0754MQ5F5","OKLILI PA03670-E985 Input Tray Input Chute Unit Paper Tray Chute Assembly Chuter Unit Compatible with fi-7160 fi-7260 fi-7140 fi-7240 fi-7180 fi-7280","https://m.media-amazon.com/images/I/81MCtURX5GL._AC_UL320_.jpg","4.7","41","17.49","72"
"B09372TYTH","Meihengtong Thermal Label Printer 4x6 Desktop Shipping Label Maker Printer for Small Business Support Windows&Mac and Widely Used for Amazon, Ebay, Shopify, Etsy, USPS","https://m.media-amazon.com/images/I/612A3FhMXXS._AC_UL320_.jpg","4.1","256","69.99","72"
"B0C1JK6HPL","2 Pack Replacement for Porelon 11216 Universal Twin Spool Calculator Ribbon Universal GR24br Compatible with Sharp el-1197piii Nukote BR80c Casio fr-2650tm Adding Machine Ribbons Universal (Black/Red)","https://m.media-amazon.com/images/I/51ek71obW+L._AC_UL320_.jpg","4.6","7","7.99","72"
"B0C2Y9SBBL","Phomemo Label Maker, Pink Label Maker Upgrade Portable Bluetooth Thermal Inkless Labeler for Phomemo Label, Small Business, Clothing, Food Ingredient, Support Phone& PC, with 3 Roll Paper Set","https://m.media-amazon.com/images/I/715EGzJXRfL._AC_UL320_.jpg","4.6","37","102.99","72"
"B07DRWM71P","Nortel T7316 Telephone Charcoal (Renewed)","https://m.media-amazon.com/images/I/61xcJGe5aXL._AC_UL320_.jpg","4.0","50","37.99","72"
"B0B6HCTWN2","BONOCO Ink Cartridge Printers Spare Parts for Epson T502 102 104 ET-2500 ET-2550 ET-2600 ET-2650 ET-2700 ET-2750 ET-2760 ET-2710 ET-3760 Printer Capsules","https://m.media-amazon.com/images/I/61cPVtZ+4JL._AC_UL320_.jpg","4.2","17","24.99","72"
"B07957LJV9","LD Products Compatible Toner Cartridge Replacement for Canon 045H 1246C001 High Yield (Black)","https://m.media-amazon.com/images/I/710TMtPwCxS._AC_UL320_.jpg","3.8","75","28.98","72"
"B0736W8TK6","greencycle Compatible Toner Cartridge Replacement for Canon 104 FX9 FX10 FX-10 FX-9 104 ImageClass MF4100 MF4150 MF4270 MF4350d MF4370dn MF4380dn D420 D480 (Black,4 Pack)","https://m.media-amazon.com/images/I/71zG40LZNzL._AC_UL320_.jpg","4.2","205","43.98","72"
"B00BXDMLTG","Canon imageRUNNER ADVANCE C5240 Waste Toner Bottle (OEM) 20,000 Pages","https://m.media-amazon.com/images/I/41P1GcHUzjL._AC_UL320_.jpg","4.7","5","37.55","72"
"B081P8YMS5","Brother LC20EBK Super High Yield Black Ink Cartridge - 2 Pack","https://m.media-amazon.com/images/I/71cngFiwZ7L._AC_UL320_.jpg","4.4","13","49.99","72"
"B096LY26MZ","Omera 542 T542 Compatible Refill Ink Bottle Replacement for Epson 542 T542 Work with ET-5150 ET-5170 ET-5800 ET-5850 ET-5880 Printer (Black 127ml, CMY 70ml, 4-Pack)","https://m.media-amazon.com/images/I/61LeEkbkWGS._AC_UL320_.jpg","3.9","14","26.99","72"
"B07H7XSP3Y","Discovery - Space Projector, White (Discovey 6000076)","https://m.media-amazon.com/images/I/61ukNXMZhZL._AC_UL320_.jpg","4.3","346","49.0","72"
"B07F9QSRWR","GREENARK Compatible Ink Cartridge Replacement for Canon CLI-251 GY Gray CLI-251GY XL Gray Ink Cartridge Work for Canon PIXMA MG6320 Pixma MG7120 Pixma MG7520 Pixma IP8720 Printers, 4 Pack 251XL GY","https://m.media-amazon.com/images/I/61KaJlQkn4L._AC_UL320_.jpg","4.5","230","10.99","72"
"B0BZWR5SY8","Office Desk Calculator 12 Digits with Solar Power and Easy to Read HD LCD Display, Big Buttons, for Financial Affairs,Home, Office, School, Class and Business,with Battery,Purple，","https://m.media-amazon.com/images/I/61MaGjCglOL._AC_UL320_.jpg","4.2","6","9.99","72"
"B00MOUAGLC","HP 564 | 3 Ink Cartridges with Assorted Photo Paper | Cyan, Magenta, Yellow | Works with HP DeskJet 3500 Series, HP OfficeJet 4600 5500 C6300 6500 7500 Series, B8550, D7560, C510, B209, B210, C309, C310, C410, C510 | CB318WN, CB319WN, CB320WN","https://m.media-amazon.com/images/I/81ckb9v6giL._AC_UL320_.jpg","4.5","573","43.76","72"
"B09QSJYF4S","GREENBOX Compatible Toner Cartridge Replacement for Canon 137 CRG137 9435B001AA MF236n D570 LBP151dw MF247dw MF249dw MF232w MF244dw MF216n MF217w MF212w MF227dw MF229dw Printer (2 Black),Canon CRG137","https://m.media-amazon.com/images/I/713ERd3CZqL._AC_UL320_.jpg","4.2","121","25.25","72"
"B07MTQ6WHN","Hewlett-Packard-HP Laserjet Pro Wireless Monochrome Multifunction M127fw Laser Printer, Copier, Scanner and Fax, Up to 21 ppm, 600 x 600 dpi Black Print Quality","https://m.media-amazon.com/images/I/61ZMI9AGhyL._AC_UL320_.jpg","4.2","19","615.49","72"
"B08P2P9SHY","NoahArk 3 Packs 200XL Remanufactured Ink Cartridge Replacement for Epson 200 XL T200XL use for Expression Home XP-200 XP-300 XP-310 XP-400 XP-410 Workforce WF-2520 WF-2530 WF-2540 Printer (3 Black)","https://m.media-amazon.com/images/I/71U2mQpzXgL._AC_UL320_.jpg","4.1","89","18.98","72"
"B0036SDOII","Dell MW558 1720 1720DN Toner Cartridge (Black)","https://m.media-amazon.com/images/I/81ZJGd7PSEL._AC_UL320_.jpg","4.3","60","124.99","72"
"B074Q2SSFX","MICR Toner International Compatible Magnetic Ink Cartridge Replacement for HP 87A CF287A LaserJet Pro M501 Enterprise M506 MFP M527 Printers","https://m.media-amazon.com/images/I/71Wi8dMlkbL._AC_UL320_.jpg","5.0","6","160.0","72"
"B0BM4DLWZH","Splendidcolor DTF Ink 1000ML 1 Pack Premium DTF Ink Water Base Digital Inkjet Ink Refill for Direct to Film Printers with Epson Printhead L1800 L805 R1390 4720 I3200 XP600 DX7 DX5 5113.","https://m.media-amazon.com/images/I/71en7+IrVxL._AC_UL320_.jpg","4.1","15","52.99","72"
"B081GSXF63","Leize Remanufactured Ink Cartridge Replacement for Epson 702XL 702 XL T702XL use for Workforce Pro WF-3720 WF-3730 WF-3733 (2 Black 1 Cyan 1 Magenta 1 Yellow,5-Pack)","https://m.media-amazon.com/images/I/61hAVYpdKnL._AC_UL320_.jpg","3.9","117","35.99","72"
"B0799JBSPY","Kingjet Compatible for Canon 270 271 Ink Cartridges Replacement for Canon PGI-270XL CLI-271XL 270XL 271XL Work with Pixma MG7720 TS8020 TS9020 Printer, 18 Pack with Gray for 270XL 271XL Ink","https://m.media-amazon.com/images/I/71cX7lzQBHL._AC_UL320_.jpg","4.5","717","24.34","72"
"B09C4LQDSB","GREENBOX Compatible MLT-D203E Toner Cartridge Replacement for Samsung D203E MLTD203E SU890A, 10,000 Pages High Yield for ProXpress M3870FW M3370FD M4070FR M3320ND M3820DW M4020ND M4072 (2 Black)","https://m.media-amazon.com/images/I/61SDSAmSdmL._AC_UL320_.jpg","5.0","5","82.0","72"
"B08YMHNBL3","CR80 Cleaning Cards, Dual Side Card Reader Cleaner, POS Swipe Terminal Cleaning Cards CK-CR80 (50pcs)","https://m.media-amazon.com/images/I/61CTdZyhdIL._AC_UL320_.jpg","4.5","19","24.99","72"
"B07GFJ9TT8","LxTek Compatible Toner Cartridge Replacement for Dell 1250 810WH C5GC3 XMX5D WM2JC to use with 1250c C1760nw C1765nfw C1765nf 1350cnw 1355cn 1355cnw Printer (Black Cyan Magenta Yellow, 4-Pack)","https://m.media-amazon.com/images/I/71eBryw1xbL._AC_UL320_.jpg","4.5","208","27.99","72"
"B096378RS4","Mini WiFi Projector Portable - Salange 2023 Upgraded Pico 1080P Supported Video Projectors for Outdoor Movies, Kids Cartoon, Home Theater, Compatible with iPhone, Laptop, TV Box, HDMI","https://m.media-amazon.com/images/I/619N7-cqNmL._AC_UL320_.jpg","3.9","358","49.99","72"
"B08B5YQBBK","COLORETTO Remanufactured Ink Cartridge Replacement for Epson 79 T079 Used for Epson AStylus Photo 1400 Printer 7 Packs (2 Black, 1 Cyan, 1 Magenta 1 Yellow,1 Light Cyan,1 Light Magenta) Combo Pack","https://m.media-amazon.com/images/I/516abxXdyvL._AC_UL320_.jpg","4.0","115","21.99","72"
"B082L48RXD","Nationwide Calls up to 1660 Minutes & Lowest International Calling Rates, Payphone, Landline & Mobile Phone Calling Card","https://m.media-amazon.com/images/I/41lCET8DHxL._AC_UL320_.jpg","3.9","96","60.0","72"
"B086Z3WY3C","LD Compatible Toner Cartridge Replacement for Brother TN660 TN-660 TN 660 TN630 High Yield use in HL-L2380DW HL-L2300D DCP-L2540DW L2540DW MFC-L2700DW MFC-L2685DW MFCL2700DW (Black, 4-Pack)","https://m.media-amazon.com/images/I/719ni5Rb7nL._AC_UL320_.jpg","4.1","38","39.98","72"
"B07DVL11V4","TAIFU 16V AC Adapter Charger for Fujitsu ScanSnap iX1600 iX1400 iX1300 iX500 iX1500 SV600 S510 S500 S510M S500M Deluxe Bundle Scanner Power Cord P/N:PA03656-B305 PA03656-B005 PA03656-B015 PA03656-B205","https://m.media-amazon.com/images/I/61ynvk2WkWL._AC_UL320_.jpg","4.5","80","19.99","72"
"B00SIKK5ZO","Ricoh 407316 SP 4500 Black Toner Cartridge","https://m.media-amazon.com/images/I/810b713k8GL._AC_UL320_.jpg","3.8","18","49.3","72"
"B07KWYN2X4","CoYlBod Dye Sublimation Ink Heat Transfer Ink Inkjet Printers Ink Cartridge CISS for C88 C88 + WF-7710 WF-7720 ET-2800 ET-2803 ET-2720 WF-7210 WF-7610 WF-7620 WF-3640 WF-2750 ET-2760 ET-4700 ET-15000","https://m.media-amazon.com/images/I/71Wcyqyw5SL._AC_UL320_.jpg","4.6","1389","21.88","72"
"B07PY18XMB","New AC DC Power Adaptor for Yealink T3, T29G, T46S, T46G & T48G IP Phones 5-Volt 2-amp","https://m.media-amazon.com/images/I/41xWd8ytDQL._AC_UL320_.jpg","4.4","243","8.99","72"
"B0799K95KH","Kingjet Compatible for HP Ink 564XL Black and Color Combo Pack Replacement for HP 564 564 XL 564XL, High Yield 10 Pack for Photosmart 7520 5520 6520 7525 Premium C309A C410A DeskJet 3520 3522 Printers","https://m.media-amazon.com/images/I/71bEp6kpxAL._AC_UL320_.jpg","4.4","784","24.75","72"
"B08R6QLGHY","Battery Door Cover for Texas Instruments Graphing Calculator (Black, TI-84 Plus/TI-89)","https://m.media-amazon.com/images/I/61E73LGKTJL._AC_UL320_.jpg","4.6","77","7.45","72"
"B081PQG66Y","ASiNG Advanced Digital Laser Presentation Remote - Red Laser Presentation Pointers with Function of Spotlighting, Highlighting, Magnifying, Air Mouse and PPT Clicker, 8GB Storage Memory","https://m.media-amazon.com/images/I/414bR4TTCfL._AC_UL320_.jpg","3.8","54","59.99","72"
"B07PCKWC6S","Pocket Pointer with Clip Extends to 50cm Length Hand Pointer Extendable Telescopic Retractable Pointer Handheld Presenter Classroom Whiteboard Pointer","https://m.media-amazon.com/images/I/31Z55b1IxfL._AC_UL320_.jpg","4.4","174","6.99","72"
"B08JX8JMDZ","Cartlee Remanufactured Ink Cartridge 60XL 60 XL Replacement for HP Envy 100 110 120 Photosmart C4670 c4680 c4780 c4795 d110 Deskjet D2660 d2680 f2430 f4280 f4440 f4480 f4580 Printer (2 Black, 2 Color)","https://m.media-amazon.com/images/I/71pinNKQfYL._AC_UL320_.jpg","4.3","34","44.0","72"
"B0B2NRYT4D","Remanufactured Ink Cartridges for HP Ink 67 67XL,Black Printer Ink Replacement Combo Pack for HP Envy 6055 6052 6075 Envy Pro 6452 6455 6458 Deskjet 2732 2752 2755 Deskjet Plus 4155 4152 4140","https://m.media-amazon.com/images/I/61u24r7LdsL._AC_UL320_.jpg","4.1","96","30.89","72"
"B0861QSCHF","GREENRHINO Remanufactured Toner Cartridge Replacement for HP 650A CE271A CP5525 CP5525dn CP5525n CP5525xh M750dn M750n M750xh (Cyan, 1-Pack)","https://m.media-amazon.com/images/I/71-u-wvSSqL._AC_UL320_.jpg","4.0","12","89.99","72"
"B09X44YPRX","S2100 Ink Maintenance Box C13S210057 Remanufactured for SureColor SC-F570 T2170 T3170 T5170 F500 F530 F531 F560 F570 T2100 T3100 T5100 T3130 T3160 T3180 T5130 T5160 T5180 Printer","https://m.media-amazon.com/images/I/51QKYTUxgqL._AC_UL320_.jpg","4.5","21","18.88","72"
"B0BVM8SX18","SHUPAN 74 75 Ink Cartridge Combo Pack, Replacement for HP Ink 74 75, for HP DeskJet D4260 C4480 C4280 OfficeJet J5788 J6480 PhotoSmart C4480 D4280 Printer (1x Black, 1x Tri-Color) CB335WN, CB337WN","https://m.media-amazon.com/images/I/71xh4XE8GuL._AC_UL320_.jpg","4.3","9","20.99","72"
"B08HGZ6N3D","Starink 𝗟𝗖𝟰𝟬𝟲 Ink Cartridges(𝗣𝗶𝗴𝗺𝗲𝗻𝘁)Replacement for Brother LC406 LC406XL LC-406 Compatible with MFC-J4335DW MFC-J6555DW MFC-J4345DW MFC-J4535DW Printer(Black Cyan, Magenta, Yellow)4-Pack","https://m.media-amazon.com/images/I/714Ze-OtcGL._AC_UL320_.jpg","4.4","28","89.99","72"
"B07DCNJDML","Inktopia Remanufactured Ink Cartridges Replacement for HP 61XL 61 XL High Yield for HP Envy 4500 5530 5534 5535 Deskjet 2540 1000 1010 1512 1510 3050 Officejet 4630 2620 4635 Printer (1 Black)","https://m.media-amazon.com/images/I/61BnN96cdlL._AC_UL320_.jpg","4.1","473","19.99","72"
"B0BZC393HN","GooDee Projector 4K Supported, Outdoor Projector with Wifi and Bluetooth, Android TV Projector with Auto Focus & Full-Sealed Optical Engine for Movie, Netflix/Prime Video Built-in, 8000+ Apps","https://m.media-amazon.com/images/I/71KhC2AsRgL._AC_UL320_.jpg","4.5","47","599.99","72"
"B0B49WLHW6","JINTUM TL-410H Compatible Toner Cartridge Replacement for Pantum TL-410 TL410H TL-410X for M7102DW P3012DW M6800FDW M7100DW M7200FDW M6802FDW M7102DN M7202FDW (2 Black)","https://m.media-amazon.com/images/I/71lkeFb1tHL._AC_UL320_.jpg","4.2","572","59.99","72"
"B0BG1DM61R","MASME 1set Tray Porous Pad Ink Eject for Epson XP760 XP750 XP860 XP720 XP820 XP620 XP600 XP610 XP630 XP700 XP710 XP800 XP830 1611102","https://m.media-amazon.com/images/I/31alzllU3uL._AC_UL320_.jpg","4.4","14","14.99","72"
"B0020DKHRQ","HP 2716570 10bII+ Financial Calculator, 12-Digit LCD","https://m.media-amazon.com/images/I/61JgLT5UPCL._AC_UL320_.jpg","4.7","313","29.95","72"
"B07RXR423V","Aproca Hard Storage Travel Case,for Epson Workforce ES-50 / ES-55R / ES-60W / ES-65WR / DS-30 / DS-70 / DS-80W Document Scanner","https://m.media-amazon.com/images/I/61lCjoiVP7L._AC_UL320_.jpg","4.8","223","15.99","72"
"B08L5NQ4JT","MADE IN USA TONER Compatible Replacement for Ricoh MP C6003 MP C4503 MP C5503 MPC6004 841849 841851 841852 841850 (Black, Cyan, Yellow, Magenta, 4 Pack)","https://m.media-amazon.com/images/I/61s5FNtmTSL._AC_UL320_.jpg","5.0","7","168.99","72"
"B0BVTNY98N","Callez RJ9 Phone Headset Office Telephone Headset with Microphone Noise Cancelling for Yealink T23G T33G T40G T46G T46S T48S T46U T48U T53W T57W Grandstream GXP2135 GXP2160 GXP2170 Avaya Panasonic","https://m.media-amazon.com/images/I/614ZeIVU4jL._AC_UL320_.jpg","4.3","50","28.99","72"
"B00G000356","Print.Save.Repeat. Lexmark 521X Extra High Yield Remanufactured Toner Cartridge for MS711, MS811, MS812 Laser Printer [45,000 Pages]","https://m.media-amazon.com/images/I/71tiozSTxxL._AC_UL320_.jpg","4.2","14","249.95","72"
"B017BNRCHC","Philips ACC2330 4-Pedal Foot Control for Digital Systems for Professional Dictation with Toe Touch Control","https://m.media-amazon.com/images/I/61vAnB+SiKL._AC_UL320_.jpg","4.0","64","93.0","72"
"B0B1DKNYR8","LxTek Purify Compatible Toner Cartridge Replacement for Canon 137 CRG137 9435B001AA to use with ImageClass D570 LBP151dw MF232W MF216n MF236n MF227dw MF229dw MF244dw MF247dw MF249dw (Black, 4 Pack)","https://m.media-amazon.com/images/I/81NbrfjxE7L._AC_UL320_.jpg","4.7","7","49.99","72"
"B085FRZ616","Houseoftoners Remanufactured Ink Cartridge Replacement for Canon PG-240XL CL-241XL 240 XL 241 XL for PIXMA MG2120 MG3220 MG3222 MG3520 MG3620 MX432 MX452 MX472 MX532 TS5120 (1 Black 1 Color, 2PK)","https://m.media-amazon.com/images/I/61cBHZ+qKrL._AC_UL320_.jpg","4.3","27","34.95","72"
"B0BRKK825K","GREENPRINT Compatible Drum Cartridge Drum Unit Imaging Drum B230 B225 B235 013R00691 Black 12000 Pages for Xerox B225 B225dni B230 B230dni B235 B235dni Printer","https://m.media-amazon.com/images/I/615FkrV-58L._AC_UL320_.jpg","3.7","14","39.8","72"
"B08CY8T747","Ergodyne Squids 3132 Barcode Scanner Harness, Large , Black","https://m.media-amazon.com/images/I/61wyKC6SOBS._AC_UL320_.jpg","4.4","291","12.19","72"
"B0BNV7T989","58X CF258X Toner with Chip LemeroUexpect Remanufactured Toner Cartridge Replacement for HP 58A 58X CF258A CF258X Toner Black for Pro M404dn M428fdw M404n M404dw MFP M404 M428fdn Printer","https://m.media-amazon.com/images/I/71j86FQWkzL._AC_UL320_.jpg","4.4","1239","69.99","72"
"B00HW51BPY","Epson Genuine 200 (T200120) DURABrite Ultra Black Ink Cartridge 2-Pack","https://m.media-amazon.com/images/I/61-cV-nWQkL._AC_UL320_.jpg","4.7","246","37.99","72"
"B09L49P1PQ","212 XL 212XL Ink Cartridges for Epson Printer Remanufactured Replacement for Epson 212 212XL Ink Combo Pack Work with Workforce WF-2850 WF-2830 Expression Home XP-4100 XP-4105 (4-Pack)","https://m.media-amazon.com/images/I/614nKMFjKkL._AC_UL320_.jpg","4.1","229","39.99","72"
"B07BQHQZ1C","HP LaserJet Pro M201dw","https://m.media-amazon.com/images/I/414u9yoUuCL._AC_UL320_.jpg","4.7","17","470.0","72"
"B0971WBCS5","The VoIP Lounge Replacement HD Voice Handset for Polycom VVX 250/350 / 450 IP Business Phone","https://m.media-amazon.com/images/I/515Jaz1uMOL._AC_UL320_.jpg","4.8","6","19.5","72"
"B00T77GB1Y","INK E-SALE 5PK Compatible Toner Cartridge Replacement for Brother TN221 TN225 TN-221 TN-225 BK C M Y Toner Set for Brother HL-3170CDW HL-3140CW HL-3180CDW MFC-9130CW MFC-9330 CDW MFC-9340CDW Printer","https://m.media-amazon.com/images/I/71N-vZXdJ-L._AC_UL320_.jpg","4.4","127","51.98","72"
"B001M082OS","LD Products Compatible Toner Cartridge Replacement for HP 38A Q1338A (Black) for use in Laserjet: 4200, 4200dtn, 4200dtns, 4200dtnsl, 4200n & 4200tn","https://m.media-amazon.com/images/I/617ykc4fp7L._AC_UL320_.jpg","4.3","43","39.98","72"
"B09SGKWM49","beyerdynamic Space Personal Bluetooth/USB Speakerphone (Charcoal)","https://m.media-amazon.com/images/I/71am5w6GIKL._AC_UL320_.jpg","4.3","95","179.0","72"
"B09SHM86FS","Kedida 2D Wireless Barcode Scanner, 1D 2D QR Code Scanner 3-in-1 Bluetooth & 2.4GHz & USB Wired Wireless Barcode Scanner with Charging Cradle, 3000mAh Battery, Work with Tablet Phone Windows","https://m.media-amazon.com/images/I/61k9yJvt6EL._AC_UL320_.jpg","4.1","23","38.99","72"
"B07KCB29S8","Buyink Remanufactured wf-100 Maintenance Box Compatible for WF-100 WF-100W WF-100 WF-110 Printer (2 Pack)","https://m.media-amazon.com/images/I/613RUVfPqIL._AC_UL320_.jpg","4.4","221","12.99","72"
