"asin","title","imgUrl","stars","reviews","price","category_id"
"B08DMVMWJR","Officeuct Thermal Transfer Ribbon 4.33""x244'(110mmx74m)-1 Roll. Resin Enhanced Wax Barcode Black Ribbon 1/2 Inch Core Ink Outside for Zebra Eltron Datamax Zebra TLP2844 TLP2442 GC420t GK420t GX420t","https://m.media-amazon.com/images/I/61+r-KSPE6L._AC_UL320_.jpg","4.4","25","10.58","72"
"B008U7CAJ4","Cross Ink Cartridges/6, 8921 Black Inh","https://m.media-amazon.com/images/I/41PNgCTmvzL._AC_UL320_.jpg","4.7","173","13.87","72"
"B08XQB8Q48","ejet Compatible Ink Cartridge Replacement for HP 920XL 920 XL to use with 6500a 6500 7500a 6000 7500 7000 Plus Printer ( 2 Cyan, 2 Magenta, 2 Yellow, 6-Pack)","https://m.media-amazon.com/images/I/81YbOcXoSIL._AC_UL320_.jpg","4.1","134","19.99","72"
"B092CCZ4KP","GPC Image Compatible Toner Cartridge Replacement for HP 410A CF413A Compatible with Laserjet Pro MFP M477fdw M477fdn M477fnw Pro M452dn M452nw M452dw Toner Printer Tray (1 Magenta)","https://m.media-amazon.com/images/I/7123p89XVjL._AC_UL320_.jpg","4.5","54","29.99","72"
"B08NRBJ167","Be Green Ink Compatible Replacement Black Toner Cartridge for Lexmark MS310dn MS312dn MS315dn MS410dn MS415dn MS510dn MS610dn – 50F1H00 Black Toner (2 Pack 5,000 High Yield)","https://m.media-amazon.com/images/I/81OeVZ1O1OL._AC_UL320_.jpg","4.0","13","99.99","72"
"B072HF89BF","BAOBIAN Model BT-1021 BBTG0798001 Rechargeable Cordles Phone Battery Compatible with Uniden BT1021 BT-1025 BT-1008 BT-1016 Empire CPH-515B Cordless Handset 2.4V 300mAh(Pack of 4)","https://m.media-amazon.com/images/I/71RH9NgZxuL._AC_UL320_.jpg","4.5","273","10.28","72"
"B07HK929M2","BOVKE Scientific Calculator Carrying Case Replacement for Texas Instruments TI-30X IIS 2-Line Scientific BA II Plus Financial Calculator, Black","https://m.media-amazon.com/images/I/71J1EdIRZyL._AC_UL320_.jpg","4.5","188","11.99","72"
"B07HM7GNB9","Discover D713 Over-The-Ear Wired Headset with in Ear Bud for Office, Call Center & Dispatch - Includes 3 Ear Sizes of Ear Tips (Cord to Connect to Phone or Computer Sold Separate)","https://m.media-amazon.com/images/I/311vum61ZGL._AC_UL320_.jpg","3.5","67","89.99","72"
"B09XVCMJLD","Revopoint Portable Turntable for POP/POP2/MINI 3D Scanner","https://m.media-amazon.com/images/I/41ayvYEDezL._AC_UL320_.jpg","4.0","14","39.99","72"
"B019IJB2XM","YATUNINK Remanufactured Replacement for HP 62XL 62 XL Black Color Ink Cartridges to Use with Envy 5640 5642 5643 5646 5660 7640 7645 OfficeJet 5740 5745 5746 200 250 Printer(2 Pack)","https://m.media-amazon.com/images/I/71v3-O-V6-S._AC_UL320_.jpg","3.9","638","46.5","72"
"B091GQ6DDH","Compatible PGI-35 CLI-36 Ink Cartridge Replacement for Canon 35 36 PGI35 CLI36 Ink Work with Canon Pixma iP110 iP100 TR150 Printer (5BK, 3C)","https://m.media-amazon.com/images/I/71VMATqLh5S._AC_UL320_.jpg","4.4","74","17.36","72"
"B089139QG4","OKLILI 1SET X PA03586-0001 PA03586-0002 Consumable Kit Pick Roller + Pad Assy Assembly Pickup Roller Separation Pad Compatible with Fujitsu S1500 S1500M fi-6110 N1800","https://m.media-amazon.com/images/I/81mxeupnMLL._AC_UL320_.jpg","4.3","41","27.99","72"
"B0BG4DLLT4","CLABEL Label Maker, 220B Portable Barcode Label Printer for Address, Clothing, Retail, Jewelry, QR, Code, Small Business, Compatible with Android & iOS System Use for Home & Office, Black","https://m.media-amazon.com/images/I/61XAX4OXyTL._AC_UL320_.jpg","3.9","56","59.99","72"
"B06WGW816Y","Zebra DS2208-SR Handheld 2D Omnidirectional Barcode Scanner/Imager (1D, 2D and PDF417) with USB Cable, DS2208-SR7U2100AZW","https://m.media-amazon.com/images/I/51semn28uiL._AC_UL320_.jpg","3.7","40","101.99","72"
"B096WFGQ4L","DoorStepInk Remanufactured in The USA Ink Cartridge Replacements for HP 60XL 60 XL 2 Black for PhotoSmart C4780 C4795 C4680 C4650 D110 D110a DeskJet F4480 F4280 F4580 D2530 D2545 D2680 Envy 100","https://m.media-amazon.com/images/I/61w9OJLO0gL._AC_UL320_.jpg","3.9","53","26.99","72"
"B09VNCG1KZ","NUCOUN Receipt Printer VCP-80 80mm Thermal Receipt Printer, Serial USB Network Cash Box Interface (80 mm)；Connect VC-7 VC-3 Bill Value Counter","https://m.media-amazon.com/images/I/616QDxAffFL._AC_UL320_.jpg","3.8","8","89.99","72"
"B08XQ9SXWX","ejet Compatible Ink Cartridge Replacement for HP 920XL 920 XL to use with Officejet 6500a 6500 7500a 6000 7500 7000 E709 E710 Plus Printer (2 Large Black)","https://m.media-amazon.com/images/I/719O9iIBysL._AC_UL320_.jpg","3.9","153","18.99","72"
"B0BVQLF2MN","047 Toner Cartridge Compatible with Canon 047 Toner Cartridge for ImageCLASS LBP113W MF113W MF110/LBP110 Series, i-SENSYS LBP113W MF113W MF110/LBP110 Series Printer (1600 Pages, 1Pack)","https://m.media-amazon.com/images/I/71NjKwsBdpL._AC_UL320_.jpg","4.2","572","21.99","72"
"B0849RFFJD","Technica BrandⓇ Compatible Replacement Toner Cartridge for Use in Ricoh Lanier Savin MP2554 MP2555 MP3054 MP3055 MP3554 MP3555 IM2500 IM3000 IM3500 - Type MP3554, 841993, 842124","https://m.media-amazon.com/images/I/518bERD0t2L._AC_UL320_.jpg","4.0","12","58.95","72"
"B08DXQS97W","LCL Compatible Toner Cartridge Replacement for HP 116A W2060A W2061A W2062A W2063A Color Laserjet Pro 150a 150nw 178nw 178nwg 179fnw 179fwg (4-Pack Black Cyan Magenta Yellow)","https://m.media-amazon.com/images/I/71g3bhrRqSL._AC_UL320_.jpg","4.7","11","85.59","72"
"B0083YEB46","Uniden BT1005 Cordless Phone Battery Ni-MH 3 AAA w/Mitz, 3.6 Volt, 700 mAh - Ultra Hi-Capacity - Replacement for RadioShack 23-961, Uniden BT-446, BT-1005, Sanyo GES PC3F02 Rechargeable Battery","https://m.media-amazon.com/images/I/21vlw029sGL._AC_UL320_.jpg","4.3","60","9.25","72"
"B07NHQR1J5","DoorStepInk Remanufactured Ink in The USA Cartridge Replacements for HP 45 51645 51645A 2 Black Twin Pack for HP Printer Color Copier 110, 120, 140, 145, 150, 155, 160, 170","https://m.media-amazon.com/images/I/61E2vFZtttL._AC_UL320_.jpg","3.9","34","34.99","72"
"B0BYN891H5","Vixic Label Maker Machine with Tape, M960 Mini Bluetooth Label Printer Inkless Label Sticker Makers Portable Handheld Labeler with Multi-Templates Font&Icon, Rechargeable for Office Home Organizing","https://m.media-amazon.com/images/I/71Iu6Hi4EuL._AC_UL320_.jpg","4.5","51","19.99","72"
"B01LBIIMRW","ZEBRA GX420d Direct Thermal Desktop Printer Print Width of 4 in USB Serial and Parallel Port Connectivity GX42-202510-000","https://m.media-amazon.com/images/I/71ltE14WzkL._AC_UL320_.jpg","3.6","5","402.5","72"
"B08SBM52QV","Ornin T108 Trimline Corded Telephone, SOS Key, Wall Mountable, Hotel and Home use Phone(Black)","https://m.media-amazon.com/images/I/61N9MRoO6PL._AC_UL320_.jpg","4.0","180","19.98","72"
"B09LJWCM8D","Ooma Office 2602 Business IP Desk Phone. Works only with Ooma Office Cloud-Based VoIP Phone Service with Virtual Receptionist, Desktop app, Video conferencing, Call Recording. Subscription Required.","https://m.media-amazon.com/images/I/51LIdiXRtLL._AC_UL320_.jpg","3.5","23","41.82","72"
"B0CC8XBXBQ","232XL 232 Ink Cartridges Combo Pack Remanufactured Replacement for Epson 232 XL T232 XL T232XL for Expression Home XP-4200 XP-4205 Workforce WF-2930 WF-2950 Printer, 4-Pack","https://m.media-amazon.com/images/I/613sRKS75+L._AC_UL320_.jpg","5.0","6","44.99","72"
"B0CC4QNCP4","ZZWJBCYLE NI-MH AAA Rechargeable Battery for Panasonic, 1.2v 550mah 4-Pack HHR-55AAABU AAA Batteries for Panasonic Cordless Phone Handset, Remote Controls, Electronics","https://m.media-amazon.com/images/I/71+UuDSalHL._AC_UL320_.jpg","4.7","22","11.99","72"
"B07G8372RC","INK E-SALE Remanufactured CF410X Toner Replacement for HP 410X CF410X CF411X CF412X CF413X High Yield 4-Pack Color Set for HP Pro M452dn M452dw M452nw MFP M477fdw M477fnw M477fdn M377dw Printer","https://m.media-amazon.com/images/I/71kch9ilN7L._AC_UL320_.jpg","4.2","145","69.98","72"
"B00265DZFO","CANON PFI-102MBK (0894B001AA) Ink Cartridge (Matte black 1 PACK) IN RETAIL PACKAGING","https://m.media-amazon.com/images/I/61MqyNrp5ZL._AC_UL320_.jpg","4.5","118","68.95","72"
"B0BC7PJTVV","ColorPrint Compatible PGI35 CLI36 Ink Cartridge 35 36 Replacement for Canon PGI-35 CLI-36 Used with PIXMA iP110 TR150 iP100 Mini260 Mini320 Inkjet Laser Printer (2X Black, 2X Tri-Color, 4-Pack)","https://m.media-amazon.com/images/I/81UIpJN9FIL._AC_UL320_.jpg","4.3","5","9.99","72"
"B01ISQBWSG","Datalogic Scanning QBT2430-BK-BTK1 QuickScan QBT2430, Bluetooth, Kit, USB, 2D Imager, Black","https://m.media-amazon.com/images/I/51zJwrLir1L._AC_UL320_.jpg","3.8","11","185.0","72"
"B00BS4D2CU","Panasonic Cordless Phone Handset Accessory Compatible with KX-TG6840 and KX-TG7870 Series Cordless Phone Systems – KX-TGA680S (Black)","https://m.media-amazon.com/images/I/81JtTFccalL._AC_UL320_.jpg","4.1","526","48.64","72"
"B09P4TW63T","DOUBLE D LC3037 Ink Cartridges Compatible Replacement for Brother LC3037 LC3037XXL LC3039, High Yield use with MFC-J6945DW MFC-J5845DW XL MFC-J5945DW MFC-J6545DW XL (1 Each of lc3037 BK/C/M/Y) 4 Pack","https://m.media-amazon.com/images/I/71mJgHYHkmL._AC_UL320_.jpg","3.9","160","27.99","72"
"B00MFG58N6","Brother MFCL2700DW All-In One Laser Printer with Wireless Networking and Duplex Printing, Amazon Dash Replenishment Enabled","https://m.media-amazon.com/images/I/71blixD70zL._AC_UL320_.jpg","4.4","3500","588.83","72"
"B09MS5K32B","BT18433/BT28433 2.4V 800mAh Ni-MH Cordless Phone Battery, Also Compatible with AT&T BT184342/BT284342 BT8300 BT1011 BT1018 BT1022 BT1031 2SN-AAA55H-S-J1 CS6120 CS6209 CL80109 EL52419 (Pack 2)","https://m.media-amazon.com/images/I/715TtM2dACL._AC_UL320_.jpg","4.5","176","8.99","72"
"B088B7WQF1","LCL Compatible Toner Cartridge Replacement for HP 79A 279A CF279A HP Laserjet Pro M12w M12 M12a MFP M26nw MFP M26 MFP M26a(4-Pack Black)","https://m.media-amazon.com/images/I/71BYdzd-LQL._AC_UL320_.jpg","4.5","153","41.99","72"
"B0BG592NBV","Canon PGi-1200XL Compatible Ink Cartridges Value Ink. Works with Maxify MB2720 MB2320 MB2120 MB2350 MB2050 MB2020 Printers. 4 Pack Black, Cyan, Magenta, Yellow","https://m.media-amazon.com/images/I/712Py6IYxCL._AC_UL320_.jpg","4.0","20","29.95","72"
"B08PXTJWML","WiFi Projector, Uyole Outdoor Movie Projector with 100'' Projector Screen, 1080P Full HD Supported & 200'' Video Projector for Outdoor Movies, Wireless Mirroring via WiFi/USB for iPhone/Android/PC/TV","https://m.media-amazon.com/images/I/71HOjA-UfcL._AC_UL320_.jpg","3.9","219","149.99","72"
"B01HJDR9DQ","GEILIENERGY BT-17333 BT-27333 Handset Telephone Rechargeable Battery 2/3AA 3.6V NI-CD Cordless Phone Battery Compatible with Vtech BT17333 BT27333 BT-17233 BT17233 BT-163345 CS5121 (Pack of 1)","https://m.media-amazon.com/images/I/61iOMYQXdJL._AC_UL320_.jpg","4.6","536","6.98","72"
"B072DWX34B","CircuitOffice Package of Three, Compatible Nukote BR80C, BRM233, Porelon 11210 (POR11210), Porelon 11216 (POR11216) Twin Spool Black and Red Calculator Ribbons for Sharp El 1630, El 1197, El 1197 PIII","https://m.media-amazon.com/images/I/51kRwBpi61L._AC_UL320_.jpg","4.6","86","8.98","72"
"B07WLCRZBR","InkNI 245XL Ink Cartridges for Canon PG-245XL, 245 Black Ink Cartridge Compatible for Canon Pixma MX490 MX492 MG2522 TS3100 TS3122 TS3300 TS3322 TS3320 TR4500 TR4520 TR4522 MG2500 Printer(2 Pack)","https://m.media-amazon.com/images/I/61lHkrYVnmL._AC_UL320_.jpg","4.4","415","36.63","72"
"B07ZD5K9LG","F-ink 5 Bottles Ink and Ink Refill Kits Compatible with Hp Inkjet Ink Cartridges 67XL 662XL 664XL 60XL 61XL 62XL 63XL 64XL 65XL 92XL 94XL 901XL-Ink Tools for Reuse The Cartridge","https://m.media-amazon.com/images/I/71zyPC-imfL._AC_UL320_.jpg","4.2","494","21.99","72"
"B0BL372JDM","288XL T288XL High Yield Remanufactured Ink Cartridge Replacement for Epson 288 XL 288XL T288XL to use with XP-430 XP-330 XP-434 XP-440 XP-446 XP-340 Printer (1 Black, 1 Cyan,1 Magenta,1 Yellow)","https://m.media-amazon.com/images/I/71ubAw+9nrL._AC_UL320_.jpg","4.4","64","22.48","72"
"B07SCHHHD1","NADAMOO Wireless 2D Barcode Scanner QR Code Scanner Support Screen Scanning Handheld CMOS Imager Portable USB Bar Code Reader with Auto Sensing, Read 1D 2D QR Code PDF417 for Inventory Library","https://m.media-amazon.com/images/I/61EodbQDoXL._AC_UL320_.jpg","4.1","46","19.99","72"
"B01HS6YFAY","Brother LC205-3PKS Combo Pack Ink Extra High Yield (3x 1,200 Yield)(C/M/Y)","https://m.media-amazon.com/images/I/41dE1I-ZaLL._AC_UL320_.jpg","4.6","57","35.99","72"
"B0BJYYMLJV","2022 New Version Hand Strap with Stylus Pens Replacement Set for Zebra Symbol TC70 TC75 TC72 TC77 PDA Handheld Barcode Scanner, Durable Strap, Easy to Install","https://m.media-amazon.com/images/I/415NC4EJgOL._AC_UL320_.jpg","4.0","6","15.99","72"
"B088ZQGJTH","Cisco CP-8865-K9 8865 IP Phone - Wired/WIRELEL","https://m.media-amazon.com/images/I/81ih2-lFq8L._AC_UL320_.jpg","3.7","7","43.5","72"
"B0CB385CY5","LEDES MP C3503 C3003 Toner Cartridge Replacement for Ricoh Aficio Lanier Savin MP C3503 C3003 C3504 C3004, Part#: 841813 841814 841815 841816, 29,500 Extra High Capacity Toner Cartridge(4 Packs, BCMY)","https://m.media-amazon.com/images/I/81pXNlTnK8L._AC_UL320_.jpg","4.8","6","139.99","72"
"B00CKZUUS0","""Package of Two"" Nakajima AE-500, AE-560, AE-580, AE-710 and Others Typewriter Ribbon, Correctable, Original Nakajima HYC01 Ribbon","https://m.media-amazon.com/images/I/91v7ZP+nB9L._AC_UL320_.jpg","4.5","249","12.25","72"
"B0762BQKJ5","Panasonic PNLV226 AC Adapter Replacement for KX-TGFA30 Panasonic Phones","https://m.media-amazon.com/images/I/81f0ePZUxvL._AC_UL320_.jpg","4.3","32","17.99","72"
"B01241787A","INKXPRO 4 X 100ml Professional True Color Sublimation Ink Refills for EcoTank printer, C88+ Workforce 3640 7520 7610 7620 7710 7720 7210 7310 7840 7820(for Sublimation Printing, ICC Profile Available)","https://m.media-amazon.com/images/I/81VoZgFCNvS._AC_UL320_.jpg","4.7","677","19.98","72"
"B01CLACMPW","TSC 99-125A013-00LF Series TTP-247 Desktop Thermal Transfer Bar Code Printer, 203 dpi Resolution, 7 IPS, 8 MB DRAM, 4 MB Flash, USB/Serial/Parallel Port, Black","https://m.media-amazon.com/images/I/51-Z-b5kZpL._AC_UL320_.jpg","4.0","7","349.0","72"
"B0C13XL6SV","202XL 202 XL Ink Cartridges Remanufactured Replacement for Epson 202 Ink Cartridges Combo Pack T202XL T202 for Expression Home XP-5100 Workforce WF-2860 Printer (1 Black, 1 Cyan, 1 Magenta, 1 Yellow)","https://m.media-amazon.com/images/I/81vrxK6AqjL._AC_UL320_.jpg","4.4","14","25.99","72"
"B01C43QVVM","LCL Compatible Toner Cartridge Replacement for Samsung MLT-D103L MLT-D103S 2500Pages ML-2950 ML-2951 ML-2955 SCX-4729FW SCX-4728FD SCX-4729FD 2955ND ML-2950ND (1-Pack Black)","https://m.media-amazon.com/images/I/71ojNvLqPeL._AC_UL320_.jpg","4.4","78","19.59","72"
"B07QZT7DSD","Intactech 281xxl BK Compatible Ink Cartridges Replacement for Canon CLI-281 XXL Black Ink Tank CLI-281 BK Work with Pixma TS6120 TS8120 TR7520 TR8520 TS9120 TS6220 TS8220 TS9520 TS9521C TS702 Printers","https://m.media-amazon.com/images/I/61oSDlmMlOL._AC_UL320_.jpg","4.5","321","12.99","72"
"B07XMQLKGK","LED Projector 1080P, Full HD Video Movie Projector for Business PowerPoint Presentation Home Theater, Compatible with Laptop Phone Android TV AV HDMI USB White Color","https://m.media-amazon.com/images/I/71xP7Z3tnAL._AC_UL320_.jpg","3.8","31","129.99","72"
"B07H7H9J66","GPC Image Remanufactured Ink Cartridge Replacement for HP 61XL 61 XL Compatible with Envy 4500 5530 4502 Officejet 4630 4632 4635 Deskjet 2540 1000 3050 Printer Tray(1 Black 1 Tri-Color)","https://m.media-amazon.com/images/I/8110HACVSUL._AC_UL320_.jpg","4.4","906","42.99","72"
"B0BZTXSWR4","TN436 TN433 2BK Toner Cartridge Compatible for Brother TN433 tn436 tn431 Toner Replacement for Brother MFC-L8900CDW MFC-L8260CDW MFC-L9570CDWT MFC-L9570CDW MFC-L8410CDW HL L8260CDW L8360CDW L9570CDW","https://m.media-amazon.com/images/I/7189SkTDrML._AC_UL320_.jpg","4.5","89","52.99","72"
"B083JD59KS","AISEN (NO Toner) Compatible Drum Unit Replacement for Brother DR221 DR221CL DR-221CL Drum Unit Used in Brother HL-3140CW HL-3170CDW HL-3180CDW HL-3150CDN MFC-9130CW MFC-9330CDW Printer (4 Pack)","https://m.media-amazon.com/images/I/712MKRANaJL._AC_UL320_.jpg","4.0","130","59.99","72"
"B00VF14EF0","Valuetoner Remanufactured Ink Cartridge Replacement for HP 98 C9364WN & 95 C8766WN for Officejet 150 100 6310, PhotoSmart 8050 C4180 C4150, Deskjet 460 5940 Printer (1 Black, 1 Tri-Color, 2 Pack)","https://m.media-amazon.com/images/I/71i-92c8lML._AC_UL320_.jpg","3.8","1213","26.99","72"
"B08SM1BM1K","TRUE IMAGE Compatible Toner Cartridge Replacement for Canon 054H 054 Black Toner for Canon Color ImageCLASS MF644Cdw MF642Cdw LBP622Cdw MF641Cdw CRG054H CRG 054 High Yield Printer (Black, 1-Pack)","https://m.media-amazon.com/images/I/713ra36OAjL._AC_UL320_.jpg","3.7","93","31.29","72"
"B07SRT52ZZ","(2-Pack) Compatible TN-433BK TN433BK Toner Cartridge TN433 TN-433 Used for Brother HL8260CDN L8360CDWT L9310CDW MFC-L8690CDW L8610CDW L9570CDW(T) Printer (Black), by EasyPrint","https://m.media-amazon.com/images/I/91L1I+w+tRL._AC_UL320_.jpg","4.3","43","32.99","72"
"B098Q31JF8","LCL Remanufactured Toner Cartridge Replacement for Lexmark 64015SA 64035SA T640 T642 T644 T644DN T644DTN T644N T644TN T640DN T640DTN T640N T640TN T642DN T642DTN T642N T642TN (1-Pack Black)","https://m.media-amazon.com/images/I/61WVLhpTZLS._AC_UL320_.jpg","5.0","8","59.59","72"
"B000KJM57C","Dymo Junior Home Embossing Label Maker | 42 Character Wheel with Large Knob | No Batteries Required","https://m.media-amazon.com/images/I/81WNlhhAhQL._AC_UL320_.jpg","4.1","29603","21.94","72"
"B01N6LHB6H","Standard 3.5mm Jack Smartphone Headset Headphone Adapter Cable Converter to RJ9 Plug for Plantronics M22 Amplifier and Cisco Unified 7960 7940G 7941G 7942G 7945G Office Telephone IP Phones","https://m.media-amazon.com/images/I/41Nu62eKsWL._AC_UL320_.jpg","3.5","94","8.97","72"
"B09B2D1VRL","ZU-BATTERY 2 Pack 3.6V 830mAh NIMH AAA Cordless Phone Battery for Panasonic HHR-P104 Replacement Battery","https://m.media-amazon.com/images/I/71p7GsFKBjL._AC_UL320_.jpg","4.3","45","14.99","72"
"B08JYHQY78","Ornin S016+ Big Button Corded Telephone with Speaker, Desk Phone (Black)","https://m.media-amazon.com/images/I/61KeaYuPggL._AC_UL320_.jpg","3.7","88","16.98","72"
"B07MC4WN8G","Plantronics Savi W710 Dect Headset (Renewed)","https://m.media-amazon.com/images/I/7122NsuKrTL._AC_UL320_.jpg","4.2","57","139.99","72"
"B0BF59FT8W","63XL Ink Cartridge Combo Pack Compatible for HP63 HP Ink 63 Black XL HP Printer Ink Cartridges for HP Envy 4520 4512 4516; Officejet 5252 3830 3833 4655 5255 Printer(1 Black, 1 Color)","https://m.media-amazon.com/images/I/71+vmH5iJZL._AC_UL320_.jpg","4.1","95","29.56","72"
"B08GR4KCPF","Dyna-Living Vintage Phone Antique Rotary Dial Telephone Retro Landline Telephones Decor Old Fashioned Antique Phone for Home Hotel Office Decoration","https://m.media-amazon.com/images/I/71N4o6eXltL._AC_UL320_.jpg","4.3","246","79.99","72"
"B09FDTW4DZ","BestXinYin 4x6 Label Printer Thermal Shipping USB Label Maker Printer for Shipping Packages Compatible with Windows, Mac, Amazon, Ebay, UPS, USPS, FedEx, Shopify","https://m.media-amazon.com/images/I/61Yx7SMZ+lL._AC_UL320_.jpg","4.2","223","69.99","72"
"B00UFKOQS2","Astra Superior Platinum Double Edge Blade","https://m.media-amazon.com/images/I/61LFAbTYHcL._AC_UL320_.jpg","4.7","16","9.99","72"
"B00DNKDKRE","""Package of Two"" Smith Corona SL-80, SL-105, SL-460, SL-470 and Others Typewriter Ribbon, Correctable, Compatible","https://m.media-amazon.com/images/I/414CRTV9UcL._AC_UL320_.jpg","4.4","122","11.75","72"
"B082M2V6H7","BNC U12 21-Hole Binding Machine 450 Page Binding Capacity and 12 Page Punching Capacity","https://m.media-amazon.com/images/I/81mIieO5zPL._AC_UL320_.jpg","4.3","227","45.99","72"
"B08X16T1FK","Replacement Battery for 93837-001 Wahl Cordless Magic Clip Designer Sterling 4 Super Taper Cordless 3400mAh","https://m.media-amazon.com/images/I/71+kAnaVxJL._AC_UL320_.jpg","4.3","114","12.99","72"
"B09FX75HFQ","Callez Phone Headset with Noise Cancelling Microphone and Volume Control, Office 2.5mm Telephone Headsets Compatible with Panasonic AT&T ML17929 Vtech Uniden Cisco Grandstream Cordless Phones","https://m.media-amazon.com/images/I/61yFnTDo+mL._AC_UL320_.jpg","4.1","94","22.95","72"
"B0C937DCS8","HA SHI Thermal Laminating Pouches - Static Prevention 11 x 17 inch, 100 Pack, Suited for Menu Size, Education Supplies & Craft Supplies, for Use with Thermal Laminators (5Mil 100 Pouches)","https://m.media-amazon.com/images/I/81hC+Ok59jL._AC_UL320_.jpg","4.9","25","31.85","72"
"B0814JY4RW","Retekess TD157 Restaurant Pager System,Pagers for Restaurants,Mute Function,1-99s Optional,Max 998 Beepers,Touch Keypad,16 Pagers, for Church,Hospital,Clinic(White)","https://m.media-amazon.com/images/I/51usa3QP9DL._AC_UL320_.jpg","4.0","69","109.99","72"
"B09L7Z9YZV","6 Bottles Ink and Ink Refill Kits Compatible with HP 950 951 932 933 60 61 952 902 901 62 63 64 65 21 22 920 940 934 564 711 970 971 95 96 Inkjet Printer Cartridges for Refillable Ink Cartridges","https://m.media-amazon.com/images/I/71GfLPGU9eL._AC_UL320_.jpg","4.3","28","13.99","72"
"B09WHY8R9R","EMEET Bluetooth Headset with Microphone, Professional Wireless PC Headphones, ANC Noise Cancelling with 6 VOICEIA Tech Mics, 3 Modes and 48 Hours Talktime, HS150, Black","https://m.media-amazon.com/images/I/71poiaryL7L._AC_UL320_.jpg","3.9","146","69.99","72"
"B08BHV5N7M","LCL Compatible Toner Cartridge Replacement for Ricoh 841999 842126 4054 5054 6054 6055SP 4055SP 5055SPP High Yield MP 4054 MP 5054 MP 6054 MP 6055SP 4055SP 5055SP 4054SP 5054SP 6054SP (1-Pack Black)","https://m.media-amazon.com/images/I/61ts7EAlHvL._AC_UL320_.jpg","4.1","11","43.99","72"
"B000PF9SOE","Fellowes Glossy Pouches - Legal, 5 mil, 100 pack","https://m.media-amazon.com/images/I/71tCWYa90KL._AC_UL320_.jpg","5.0","24","38.33","72"
"B007WAT9FI","Universal 39912 Clear Roller Ball Retractable Gel Pen, Black Ink, Medium, Dozen","https://m.media-amazon.com/images/I/71nU74opbsL._AC_UL320_.jpg","4.5","117","9.1","72"
"B0BXWM55L7","TOKYOINK 414A Replacement for HP 414A 414X Toner Cartridges 4 Pack Compatible for HP Color Laser Pro MFP M454dw M479fdw","https://m.media-amazon.com/images/I/71Poerum0AL._AC_UL320_.jpg","4.3","33","174.99","72"
"B07SDP3121","Callez Corded RJ9 Telephone Headset Mono with Noise Canceling Mic Compatible with ShoreTel 230 420 480 Polycom VVX310 VVX311 VVX410 VVX411 Avaya 1408 1416 5410 NEC Nortel Office Landline Deskphones","https://m.media-amazon.com/images/I/610dbgY1VlL._AC_UL320_.jpg","4.2","97","22.95","72"
"B00SU059LW","MPF Products 295mAh 14192-00, AHB412434PJ Battery Replacement Compatible with Jabra Pro 9400, Pro 9450, Pro 9460, Pro 9465, 9465 Duo, Pro 9470 Wireless Headsets","https://m.media-amazon.com/images/I/51JXgHfnU6L._AC_UL320_.jpg","4.4","164","13.95","72"
"B07M6PB86J","CoYlBod Printhead Cleaning kit Compatible for Epson WF-7520 WF-7510 WF-7010 WF-2650 WF-2630 WF-2660 WF-2760 WF-2750 WF-3620 WF-3720 WF-3540 WF-3530 WF-3520 XP-340 XP-440 XP-446 Printer Nozzle Cleaner","https://m.media-amazon.com/images/I/61opeZDn6lL._AC_UL320_.jpg","4.2","559","10.99","72"
"B004ELP5G0","Uniden Rechargeable Phone Battery, Nickel Metal Hydride NiMH, DC 2.4V, 650mAh (BT-1008)","https://m.media-amazon.com/images/I/61zpbxgeDzL._AC_UL320_.jpg","4.3","455","5.0","72"
"B09MS2Q1WT","BT183482/BT283482 2.4V 600mAh Ni-MH Cordless Phone Battery Compatible with VTech DS6401 DS6421 DS6422 DS6472 LS6405 LS6425 LS6426 LS6475 LS6476 Handset (Pack 4)","https://m.media-amazon.com/images/I/81n5n2yc0lL._AC_UL320_.jpg","4.4","99","15.99","72"
"B0C2Q1766K","240XL 241XL Combo Pack 240xl 241xl Ink Cartridge for Canon Pixma mg3620 mg3600 mg3520 TS5120 TS5100 mg3222 mx472 mx470(1 Black, 1 Tri-Color)","https://m.media-amazon.com/images/I/61uwUhChDwL._AC_UL320_.jpg","3.9","15","39.98","72"
"B07R69ML2P","DoorStepInk Remanufactured in The USA Ink Cartridge Replacements for Canon Printer PG-245XL 243XL CL-246XL 246 XL 244XL 244 XL Black Color Combo Pack for Pixma iP2820 MG2924 MX492 TS302 MG2920 MG3020","https://m.media-amazon.com/images/I/71v3cRcTtPL._AC_UL320_.jpg","4.0","256","36.99","72"
"B009D0LL9M","Printronic Remanufactured Ink Cartridge Replacement for HP 45 (2 Pack) for Deskjet 1000Cse 1100 1220C/PS 1600 6122 710 720 782 815 820 830 850 870 880 890 895 930 950C 960 970 980C","https://m.media-amazon.com/images/I/61J2KG1NSxL._AC_UL320_.jpg","4.0","85","33.99","72"
"B091383JJ2","Inktopia Remanufactured Ink Cartridge Replacement for HP 67XL 67 XL for Envy 6055e 6052 6058 Envy Pro 6455e 6452 6458 DeskJet 1255 2732 2752 2755e 4140 4155e Printer (1 Black 1 Tri-Color)","https://m.media-amazon.com/images/I/71NmsHUOaJL._AC_UL320_.jpg","4.0","114","39.89","72"
"B0B49XFB9Y","CRG-120 120 Black Toner Cartridge Compatible Toner Cartridge Replacement for Canon 120 CRG-120 Work with imageCLASS D1120 D1550 D1150 D1320 D1350 D1520 D1100 D1370 MF6680DN MF417dw Printer (2 Black)","https://m.media-amazon.com/images/I/71oJ1cx+dUL._AC_UL320_.jpg","3.8","17","55.99","72"
"B08TWQ82L6","Aomya Compatible HP Black Ink Refill Kit 500ml Dye Bulk Ink for HP Inkjet Printers Refillable Cartridge CISS CIS System (16.9 oz) with Syringe&Glove","https://m.media-amazon.com/images/I/61Pc+RcIweL._AC_UL320_.jpg","4.3","117","16.99","72"
"B00UI2NC6Y","Valuetoner Remanufactured Ink Cartridges Replacement for HP 92 & 93 C9513FN C9362WN C9361WN for HP Photosmart 7850 C3150 C3180, Deskjet 5440 5420, PSC 1510 2525 Printer, (1 Black, 1 Tri-Color) 2 Pack","https://m.media-amazon.com/images/I/71aQZ5Zwt5L._AC_UL320_.jpg","3.9","616","25.99","72"
"B00AWL9ZNU","Dell C5GC3 1250 1350 1355 1760 1765 Toner Cartridge (Cyan) in Retail Packaging","https://m.media-amazon.com/images/I/71FOcE5lpQL._AC_UL320_.jpg","4.5","46","70.31","72"
"B008ZLQ686","Epson Matte Black Ultra Chrome XD Ink Cartridge, 350 ml (T693500)","https://m.media-amazon.com/images/I/51ALG7iBkUL._AC_UL320_.jpg","5.0","9","169.0","72"
