"asin","title","imgUrl","stars","reviews","price","category_id"
"B09YQV2SW7","Building Blocks, Developing Tactile Skills, Creativity, Color Sense, Early Education, Development, Building Block Toys for Boys and Girls (70PCS-02)","https://m.media-amazon.com/images/I/61+5Arz4oDL._AC_UL320_.jpg","4.0","6","9.99","270"
"B09W33ZDKV","JDEIFKF Volleyball Sling Bag Chest Bag Sport Volleyball Crossbody Bags For Mens Womens","https://m.media-amazon.com/images/I/61btv626VhL._AC_UL320_.jpg","4.2","59","25.99","270"
"B08T5S31KN","STAR WARS The Mandalorian Toy 9.5-inch Scale The Mandalorian Action Figure, Toys for Kids Ages 4 and Up","https://m.media-amazon.com/images/I/71HRhUUz83L._AC_UL320_.jpg","4.4","925","12.57","270"
"B0C49JSHW2","Infant Rattle Socks Toys 0 to 12 Months, Baby Wrist Rattle Foot Finder Socks Set, Birthday Holiday Present for Newborn Boy Girl 0/3/4/6/7/8/9/12/18 Months Kids Toddler, Gift Box Package","https://m.media-amazon.com/images/I/71TY8nOxEOL._AC_UL320_.jpg","4.6","17","7.95","270"
"B00MYL9H8O","Fisher-Price Laugh & Learn Musical Baby Toy, Storybook Rhymes, Electronic Learning Book With Lights & Songs For Ages 6+ Months","https://m.media-amazon.com/images/I/71xQmlUIgOL._AC_UL320_.jpg","4.7","4249","17.99","270"
"B07PQ1Z9J3","LeapFrog Learn & Groove Shakin' Colors Maracas includes One electronic maraca, one non-electronic maraca, Parent's Guide, Multicolor","https://m.media-amazon.com/images/I/71GY4BcJlmL._AC_UL320_.jpg","4.7","3078","14.97","270"
"B0BR7RVBBV","FUSPWEAO Beach Toys Sand Toys for Kids, 30PCS Dinosaur Sand Toys with Mesh Bag, Sand Castle Toys for Beach, Animal Dinosaur Sand Molds, Sandbox Toys for Toddlers Travel Beach Toys for Boys","https://m.media-amazon.com/images/I/8173H41TjtL._AC_UL320_.jpg","4.5","109","15.99","270"
"B00N9IVJQO","Nerf Dog 5in Spiral Squeak Football - Orange/Black","https://m.media-amazon.com/images/I/91sRt4xhwDL._AC_UL320_.jpg","4.6","2439","12.99","270"
"B075SNJSLC","Liberty Imports Junior Engineer Jackhammer Toy Construction Tool Drill with Earmuffs, Safety Goggles, and Accessories","https://m.media-amazon.com/images/I/71wmnZcmfKL._AC_UL320_.jpg","3.6","252","19.97","270"
"B091FXNDRC","PicassoTiles 200 Piece Large Construction Brick Building Blocks STEM Bricks Toy Set Creative Learning Early Education Playset 5 Colors 4 Unique Shapes Mix & Match Toys for Kids Boys Girls Child Age 3+","https://m.media-amazon.com/images/I/811HtwnNr4L._AC_UL320_.jpg","4.4","194","25.0","270"
"B08HCRSTY9","hahaland 5 Year Old Boy Birthday Gift Ideas - 5 in 1 STEM Toys for Boys 4-6, Take Apart Armored Fighting Vehicles Transform to Robot Toys for 5 Year Old Boys - Building/Construction Toys for Ages 5-7","https://m.media-amazon.com/images/I/81782YfKkNS._AC_UL320_.jpg","4.6","2732","37.5","270"
"B08725XV15","Coogam Spelling Games, Wooden Matching Letters Toy with Flash Cards Words, Montessori ABC Alphabet Learning Educational Puzzle Gift for Preschool Boys Girls Kids Age 3 4 5 Years Old","https://m.media-amazon.com/images/I/71i7yrzQADL._AC_UL320_.jpg","4.6","1106","19.99","270"
"B08VD629LT","Fly Wheels Paw Patrol Movie Ride-On 10"" Tricycle with Sounds - Toddler Bike Trike, Ages 2-4, for Kids 33”-35” Tall and up to 35 Lbs","https://m.media-amazon.com/images/I/71EOnqSfO3S._AC_UL320_.jpg","4.4","361","24.49","270"
"B08JTHBW8S","Reenwee Building Bricks 500 Pieces Set,Classic Colors Building Blocks Toys,Compatible with All Major Brands,Birthday Gift for Kids (Pink-Purple)","https://m.media-amazon.com/images/I/71ZyYKH-22L._AC_UL320_.jpg","4.6","1424","19.99","270"
"B0BS49S1RG","Metal Machines Series 2 Color Change (2 Sets of 3 Pack) Mini Die-Cast Cars (Style May Vary) by ZURU","https://m.media-amazon.com/images/I/91kQASLBEkL._AC_UL320_.jpg","4.7","38","11.99","270"
"B0BLVQZ499","Magic Bean Rotating Cube,Creative Rotating Finger Cube Fidget Puzzle Toy, Fidget Toys Sensory Toys for Autistic Children, Gift for Kids Age 3-5, Birthday Party Gift Boys Girls","https://m.media-amazon.com/images/I/71jcNTj-2wL._AC_UL320_.jpg","4.2","69","11.69","270"
"B0BXNBQRR5","Foamula 3 Inch Gel-Infused Memory Foam Mattress Topper, with Removable Soft Cover, Cooling Sleep and Pressure Relief, CertiPUR-US and Oeko-TEX Certified, Queen/White","https://m.media-amazon.com/images/I/71o9AbQ8QyL._AC_UL320_.jpg","4.8","6","139.99","270"
"B0B9CJBBYL","L.O.L. Surprise! Bubble Surprise Deluxe - Collectible Dolls, Pet, Baby Sister, Surprises, Accessories, Bubble Surprise Unboxing, Color-Change Foam Reaction - Great Gift for Girls Age 4+","https://m.media-amazon.com/images/I/81Y9CbfG2sL._AC_UL320_.jpg","4.7","80","29.97","270"
"B0BQHL411G","Elviros 3 Inch Gel Memory Foam Mattress Topper King Size, Adjustable Cooling Bed Topper for Back Pain, Dual Layer Mattress Pad with Removable Cover (King, White)","https://m.media-amazon.com/images/I/71yieStfHML._AC_UL320_.jpg","4.4","181","179.99","270"
"B0924P7WY3","HONEY JOY Kids Kitchen Playset, Wooden Little Chef Pretend Play Toy Kitchen Set, Stove w/Lights & Sounds, Cookware, Microwave, Water Dispenser, Play Kitchen for Toddlers, Gift for Boys Girls 3+, Gray","https://m.media-amazon.com/images/I/71LYLaWC-JL._AC_UL320_.jpg","4.0","389","85.98","270"
"B098TC7YZH","Marsail 3 Inch Memory Foam Mattress Topper, Queen Mattress Topper Cooling Gel Ventilated Design, Bed Topper with CertiPUR-US Certified","https://m.media-amazon.com/images/I/71m82Vg-3bL._AC_UL320_.jpg","4.5","1223","63.99","270"
"B0C534ZTCM","YOLEO Upgrade 3 Pieces Pikler Triangle Set, Foldable 7 in 1 Montessori Triangle Climber with 2 Sides Ramp & Arch Rocker, Sturdy Fun Indoor Playground and Jungle Gym Climbing Toys for Toddlers 1-6 y.o","https://m.media-amazon.com/images/I/71wlvHUSg2L._AC_UL320_.jpg","4.5","155","179.99","270"
"B07R1YM6QF","Bright Starts Snuggle & Teethe BPA-free Crinkle Teething Plush Baby Toy - Elephant","https://m.media-amazon.com/images/I/81wwdQE5OzL._AC_UL320_.jpg","4.8","10382","6.49","270"
"B09R9DJTN4","17 Pieces Corral Fence Toy Cow Farm Figures Barn Animals Keepers Plastic Animals Figures Realistic Toy Animal Fence Barn Sets with Animals for Preschool Educational Christmas Decorations","https://m.media-amazon.com/images/I/81M8xApHmYL._AC_UL320_.jpg","4.2","36","18.99","270"
"B00I0CWZGW","READY 2 LEARN Paint and Dough Animal Rockers - Set of 4 - Ages 2+ - Easy to Grip Arts and Crafts Stampers for Kids - DIY Textures and Patterns","https://m.media-amazon.com/images/I/81GRsvKJE+L._AC_UL320_.jpg","4.7","278","11.99","270"
"B09PKMHKMQ","LEGO Valentine Lovebirds 40522 Building Toy Set; for Kids, Boys and Girls Ages 8+ (298 Pieces)","https://m.media-amazon.com/images/I/71i690Rim9L._AC_UL320_.jpg","4.8","2342","12.99","270"
"B0C6LYMMJD","Kasfalci 60 PCS Magnetic Money for Kids for Learning, Math Manipulatives, Learning & Education Toys for Classroom, Pretend Play, Math Games for Toddler, Teacher and Homeschool Supplies","https://m.media-amazon.com/images/I/81d3HZwk7sL._AC_UL320_.jpg","4.5","17","22.99","270"
"B00J1XE7B0","Melissa & Doug 7-Piece Poseable Wooden Doll Family for Dollhouse (2-4 inches each) - People Figures For Kids Ages 3+","https://m.media-amazon.com/images/I/81CnA1Ul64L._AC_UL320_.jpg","4.7","3771","25.02","270"
"B0C863R3V8","Automatic Soap Dispenser - 4 Gear Foaming Adjustable, Wall Mounted Sticker - Rechargeable Bathroom Kitchen Soap Pump, 13oz/380ML Touchless Hand & Dish Soap Dispenser for Kids","https://m.media-amazon.com/images/I/512Satkmo6L._AC_UL320_.jpg","4.5","53","25.99","270"
"B093L85N32","100PCS Wooden Building Blocks Stacking Game 1 Inch Rainbow Cubes Blocks Set Preschool Learning Educational Toys for Toddlers Boys Girls","https://m.media-amazon.com/images/I/61-ht2oOljL._AC_UL320_.jpg","4.6","182","24.99","270"
"B0BDK6W3L2","Chargeable Bubble Machine, 9500+ Bubbles/Min Bubble Machine for Kids Toddlers, 720ml/24.4oz Bubble Machine for Parties, Bubble Blower for Parties, Birthday, Wedding,Christmas","https://m.media-amazon.com/images/I/712L5dlExnL._AC_UL320_.jpg","4.0","248","14.99","270"
"B00NIJZISE","Elite Sportz Ring Toss Games for Kids - Outdoor Yard Game for Adults & Family - Backyard Toys, Outdoor Games, Yard Games, Backyard Games, Lawn Games, Outdoor Toys For Kids Ages 4-8, Outdoor Toys","https://m.media-amazon.com/images/I/81ECelelxML._AC_UL320_.jpg","4.5","11901","19.49","270"
"B0BDRNSGQP","53PCS Fruit Scented Markers Set - Art Coloring Drawing Kits for Kids with Unicorn Pencil Case, Art Supplies for Kids Ages 4 6 8,Stationary Set Pencil,Crayon&Markers Stuff,Birthday Gifts Toys for Girls","https://m.media-amazon.com/images/I/81c-fGd0p9L._AC_UL320_.jpg","4.6","271","24.98","270"
"B0BWMP4262","ZHENDUO Bubble Crab Bath Toys, Automatic Bubble Maker Baby Bath Toys for Toddlers, Bubble Bathtub Toys with Music, Bubble Machine Toddlers Bath Toys for Kids (Crab-2)","https://m.media-amazon.com/images/I/71vlj8TwbvL._AC_UL320_.jpg","3.9","24","15.99","270"
"B09329BZ3M","6 Pack Bundle Bluey, Spiderman, and Paw Patrol 24 Piece Jigsaw Puzzles with Rex-Man Door Hanger | Puzzle Pack for Kids Ages 4-8","https://m.media-amazon.com/images/I/91fiLDP7dHL._AC_UL320_.jpg","4.3","258","20.95","270"
"B07QL14424","beiens Quiet Book Montessori Toys, Busy Board for Toddlers 1 2 3 4, Toddler Activities Busy Book, Toddlers Travel Toy, Sensory 3D Cloth Books for Infants Baby Boys and Girls Gift","https://m.media-amazon.com/images/I/71D2S4MF8RL._AC_UL320_.jpg","4.4","1224","13.99","270"
"B082PW58X2","SGQCAR Pretend Play Kids Leaf Blower Toy Tool Garden Set,Outside Construction Work Shop Toy Tool Leaf Blower for Kids That Blows Air with Realistic Sounds and Wind Gift for Boys and Girls","https://m.media-amazon.com/images/I/71UEYma6iHL._AC_UL320_.jpg","3.8","71","24.99","270"
"B0BY1NDKZH","Baby Floor Mirror Tummy Time Toys for Babies 0-6 Months, Newborn Toys for 0-3 Months Boys/Girls, Infant Toys for 3-6 Months Sensory Development, Teething Toys for Babies 6-12 Months","https://m.media-amazon.com/images/I/71ao-ZCGEuL._AC_UL320_.jpg","4.6","44","19.99","270"
"B08VF3GKNS","Minnie's Happy Helpers Bowtique Shopping Cart, Officially Licensed Kids Toys for Ages 3 Up by Just Play","https://m.media-amazon.com/images/I/71IJeolx22L._AC_UL320_.jpg","3.8","15","14.99","270"
"B0C587R41G","15 Pack Two-Toned Butter Slime Kit for Girls,Super Soft and Non-Sticky Toy,DIY Educational Slime Toys for Kids,Party Favor for Kids Girls & Boys","https://m.media-amazon.com/images/I/81E6SlTMdUL._AC_UL320_.jpg","4.3","68","10.98","270"
"B08MJG1F8V","Wooden Power Tool Workbench for Kids, Building Tools Sets Pretend Play Toys - Construction Workbench with Wrench, Screwdriver, Miter Saw and Hammer - Educational Gift for Toddlers Age 3 and Up","https://m.media-amazon.com/images/I/610gvxcjBiL._AC_UL320_.jpg","4.5","109","76.99","270"
"B0C9SRWN45","ELENKER Folding Shower Chair, Fodable Shower Seat Bath Chair with Large Suction Cups and U-Shaped Seat for Easy Cleaning","https://m.media-amazon.com/images/I/61Sz+IS7sgL._AC_UL320_.jpg","4.3","10","119.99","270"
"B0BYQB8B2N","DITOYS Crocky Attack Bite Game Toy | Teeth Toy | Child Bite Toy |Interactive Teeth Toys | Fun Games for Kids | Finger Game | 2-4 Player Games in Spanish","https://m.media-amazon.com/images/I/51znOIn1NiL._AC_UL320_.jpg","4.1","12","12.9","270"
"B0BCXJ3MXH","AnapoliZ Kids Construction Vest plus Hat Set | 2 Pcs Kids Construction Worker Vest & Hat Dress Up | Yellow Reflective Vest Construction, plus Yellow Plastic Childrens Hard Hat | Construction Costume","https://m.media-amazon.com/images/I/81UYKOrvf2L._AC_UL320_.jpg","4.4","191","16.99","270"
"B07P6CPY15","Radio Flyer Little Red Roadster, Toddler Ride on Toy, Ages 1-3 (Amazon Exclusive), 24“ Length","https://m.media-amazon.com/images/I/81mt-7ExmaL._AC_UL320_.jpg","4.6","1979","89.99","270"
"B01JJ5KFMY","NERF Disruptor Elite Blaster - 6-Dart Rotating Drum, Slam Fire, Includes 6 Official Elite Darts - for Kids, Teens, Adults (Amazon Exclusive)","https://m.media-amazon.com/images/I/71ePN1TIO2L._AC_UL320_.jpg","4.6","44200","14.99","270"
"B0C68QQ6XJ","Montessori Tool Bench Set for Toddlers - Mini Wooden Work Bench for Kids, Construction Toys Wooden Tools, Educational Pretend Play Gift Building Toy Tools Set for Boys Girls","https://m.media-amazon.com/images/I/71-hzgJIdJL._AC_UL320_.jpg","4.6","19","25.99","270"
"B09PBGJZDB","Dinosaur World Race Track Toys for Kids - Best Birthday Gifts for Age 3 4 5 6 7 Year Old Boys and Girls, PREPOP Deluxe Dino Sets, 220 pcs","https://m.media-amazon.com/images/I/810OWIAHV8L._AC_UL320_.jpg","4.5","136","39.73","270"
"B07ZYCKR1L","Play-Doh Wheels Front Loader Toy Truck for Kids Ages 3 and Up with Non-Toxic Sand Compound and Classic Compound in 2 Colors","https://m.media-amazon.com/images/I/8167sS9J7rL._AC_UL320_.jpg","4.6","2061","24.99","270"
"B0C5DDR6NZ","Kids Smart Phone Toys for Girls Boys Age 3-8 with HD Touchscreen Dual Camera 28 Games Habit Tracker Audible Story Audible Story Portable Learning Toy for Kids with 8G SD Card Birthday Gifts (Blue)","https://m.media-amazon.com/images/I/61t-LY5RzDL._AC_UL320_.jpg","4.2","25","37.97","270"
"B093K6KCKY","Fat Brain Toys Heap-O-Sheep - Game of Catapulting Sheep, 6 to Adult, 2 to 4 Players","https://m.media-amazon.com/images/I/81W-18SbBJL._AC_UL320_.jpg","4.6","85","29.95","270"
"B0BB6JCPYS","Vanmor Montessori Toys for 18+ Months Old, Baby Sensory Toys for Toddlers, Octopus Silicone Pull String Activity Learning Toys, Bath Travel Teething Toys for Infant 1-3, Gifts for Boys and Girls","https://m.media-amazon.com/images/I/71wcedPn6GL._AC_UL320_.jpg","4.6","101","9.89","270"
"B0BVRXQCQX","Light Up Basketball - Glow in the Dark Basket Ball - NO 7 - Sports Gear Gifts for Boys & Girls 8-15+ Year Old - Kids, Teens Gift Ideas - Cool Boy Toys Ages 8 9 10 11 12 13 14 15 Glowing Night Activity","https://m.media-amazon.com/images/I/81ekGnT8X9L._AC_UL320_.jpg","4.4","317","34.99","270"
"B09NQPF4P4","Polly Pocket Compact Playset, Sushi Shop Cat with 2 Micro Dolls & Accessories, Travel Toys with Surprise Reveals","https://m.media-amazon.com/images/I/71u6LUKJmQL._AC_UL320_.jpg","4.8","958","16.99","270"
"B0BXLH2MSH","IQKidz Remote Control Dump Truck Toys - RC Construction Vehicles with Blue Warning Lights, Trucks Toy for Boys Girls 3 4 5-7 8 9 10 Year Old and Up, Best Birthday Gift Ideas for Kids Age 5-10","https://m.media-amazon.com/images/I/71p6HjKLzSL._AC_UL320_.jpg","4.0","23","39.79","270"
"B07BDZXZVK","Wonder Wheels by Battat – Tractor & Trailer – Toy Tractor & Trailer Combo for Toddlers Age 1 & Up (2 Pc) – 100% Recyclable Red","https://m.media-amazon.com/images/I/711q9cJ6SgL._AC_UL320_.jpg","4.8","1087","13.95","270"
"B0BZRBH6R8","Magnetic Pen Gifts, Fidget Toy Pens Gifts for Men, Birthday Gifts for Him and Kids, Gifts for Teenage Boys and Girls, Best Gifts for 8-12 Years Old, Novelty Toy Gifts for Kids or Friends(Color)","https://m.media-amazon.com/images/I/41WHlhxaEML._AC_UL320_.jpg","4.5","51","13.99","270"
"B0BJL5YLK1","Toddler wooden Learning Montessori toys – wooden peg board bead game baby rainbow stacking matching counting color sorting games for fine motor math skills boys and girls for 3 4 5 years old","https://m.media-amazon.com/images/I/91K1kfDV0fL._AC_UL320_.jpg","4.9","55","29.99","270"
"B07XQXZ7PQ","18 Pack Die-cast Military Vehicles Sets,6 Pack Assorted Alloy Metal Models Car Toys and 12 Pack Soldier Army Men, Mini Army Toy Tank,Panzer,Anti-Air Vehicle,Helicopter Playset for Kids Boys","https://m.media-amazon.com/images/I/714bDa3xirL._AC_UL320_.jpg","4.5","1666","14.95","270"
"B00C4RNL9E","Battat Play Circle Pink Beauty Shop Hairdressing Set – Mirror, Brush Kit, Working Hair Dryer with Sounds & Air, Salon Accessories – Pretend Play Styling Toys for Girls Ages 3 and Up (15 Pieces)","https://m.media-amazon.com/images/I/71vXCRCT07L._AC_UL320_.jpg","4.7","1942","14.95","270"
"B000HGJJ7W","4M Solar System Planetarium - DIY Glow In The Dark Astronomy Planet Model Stem Toys Gift for Kids & Teens, Girls & Boys, Model:3427","https://m.media-amazon.com/images/I/81v6GN-duUL._AC_UL320_.jpg","4.4","6303","12.99","270"
"B07VDVWK1C","Pokemon Pokéball Plush 5-Pack - Includes Poke, Master, Ultra, Quick, Luxury Ball - Soft Stuffed Poke Balls with Weighted Bottom - 4"" Each - Gift for Kids, Ages 2+","https://m.media-amazon.com/images/I/81JUMEWEhIL._AC_UL320_.jpg","4.8","936","42.99","270"
"B086Z5BHMZ","Kid Trax Silly Skaters Unicorn Toddler Foot to Floor Ride On Toy, Kids 1-3 Years Old, Soft and Inflatable, Single Rider, Light Up LED Rollerskates, White (KT1590)","https://m.media-amazon.com/images/I/71N91Cr2drL._AC_UL320_.jpg","4.4","539","33.14","270"
"B08DKPQV1V","LUKAT Building Toys for Girls Age 6 7 8 9 10 11 Year Old, 568pcs Princess Castle STEM Construction Toys Set, 25 Models Educational Toys for Kids Building Blocks Kit Gifts for Birthday Christmas","https://m.media-amazon.com/images/I/81+sDuGrgaL._AC_UL320_.jpg","4.2","745","19.99","270"
"B0BNW91NZQ","LEGO DUPLO Disney 3 in 1 Magic Castle 10998 Building Set for Family Play with 5 Disney Figures Including Mickey, Minnie and Friends, Magical Disney 100 for Kids & Toddlers Ages 3 and Up","https://m.media-amazon.com/images/I/81VawRbucaL._AC_UL320_.jpg","5.0","12","99.99","270"
"B0BMFGFPTW","Zing StikBot Legendz Series 1 - Includes Valor, Ruebell, Dominus and Raze Oni - Collectible Action Figures and Accessories, Stop Motion Animation, Ages 4 and Up","https://m.media-amazon.com/images/I/71dUrmgR7RL._AC_UL320_.jpg","4.6","38","24.99","270"
"B0BV61NWC6","12-Pcs People Figures & Toy Cars Playset - Fireman, Police, Construction workers - Pretend Play Vehicle & Figurine Set Accessories for Kids - Emergency Vehicles and Construction Toys Imaginative Play","https://m.media-amazon.com/images/I/81frNelZ-sL._AC_UL320_.jpg","4.8","271","23.99","270"
"B088Z1CBHR","Learning Resources Coding Critters Go Pets Scrambles the Fox, Screen-Free Early Coding Toy For Kids, Interactive STEM Coding Pet, 14 Pieces, Ages 4+","https://m.media-amazon.com/images/I/81GRS3TpgpL._AC_UL320_.jpg","4.1","174","14.19","270"
"B0BJV5GFSZ","TOYABI 5-in-1 Transforming Fire Truck Robot STEM Toy for Ages 3-8, No Batteries Required, Flashing Lights & Authentic Sounds, Durable ABS, Ideal for Boys and Girls","https://m.media-amazon.com/images/I/81YupKv5oZL._AC_UL320_.jpg","4.5","73","27.99","270"
"B0C64KGDWG","HOGOKIDS Friends Ticket Station Building Set - 258 PCS Magic Carnival Amusement Park Building Block Kit STEM Princess Castle Toys Christmas Birthday Gift for Kids Girls Boys Aged 6 7 8 9 10 Years Old","https://m.media-amazon.com/images/I/71kJochCF4L._AC_UL320_.jpg","3.7","6","12.99","270"
"B08199W8C1","Refasy Piggy Bank Cash Coin Can ATM Bank Electronic Coin Money Bank for Kids-Hot Gift","https://m.media-amazon.com/images/I/61Jmz08At7L._AC_UL320_.jpg","4.5","9025","25.99","270"
"B00146G71U","Melissa & Doug Fridge Food Wooden Play Food Set (9 pcs) - Pretend Play Kitchen Accessories, Play Food Sets For Kids Kitchen, Wooden Play Grocery Sets For Kids Ages 3+","https://m.media-amazon.com/images/I/61aeErpXovL._AC_UL320_.jpg","4.9","7001","18.31","270"
"B089N36HTF","Sanlebi Toy for 4 5 6 7 Year Old Boys Take Apart Dinosaur Toys for Kids Building Toy Set with Electric Drill Construction Engineering Play Kit STEM Learning for Boys Girls Age 3","https://m.media-amazon.com/images/I/81c4L1ccJzL._AC_UL320_.jpg","4.5","7180","19.99","270"
"B07DC2FY3B","UiiQ Pull Back Airplane Toy Set Die Cast Metal Military Themed Fighter Jets, Good for Kids Toy Set Collection - 4 Pcs (Blue)","https://m.media-amazon.com/images/I/61cWYEG6k2L._AC_UL320_.jpg","4.6","416","9.65","270"
"B0CBKX36BW","Milliard Extra Large Wooden Doll House, 31 Bonus Furniture Pieces Included, 4 Story Dollhouse, 4 Ft. Tall, Ages 3+","https://m.media-amazon.com/images/I/715kb-rPzFL._AC_UL320_.jpg","4.6","15","89.99","270"
"B07YZ2DMV8","MAGBLOCK Magnet Building Tiles 130 Pcs 3D Toys Magnets Magnetic Blocks Set Preschool Toys Gifts for 3 4 5 Years Old Age Boys Girls and Toddlers.","https://m.media-amazon.com/images/I/81Ok-FhU7WL._AC_UL320_.jpg","4.8","5623","55.99","270"
"B07CG5S2YB","Step2 Big Builders Pro Kids Workbench – Includes 45 Toy Workbench Accessories, Interactive Features for Realistic Pretend Play – Indoor/Outdoor Kids Tool Bench – Dimensions 34"" H x 38.5"" W x 27.5"" D","https://m.media-amazon.com/images/I/81606iahJKS._AC_UL320_.jpg","4.7","1668","139.99","270"
"B09HZZ6GBJ","KUTOI Toddler Building Blocks for Kids Ages 4-8, Toddler Blocks Stacking Toys, Fun House Big Blocks Building Sets with 10” x 10” Baseplate, Educational Daycare Toys","https://m.media-amazon.com/images/I/81fns8htceL._AC_UL320_.jpg","4.5","43","16.99","270"
"B08YP6N55N","LEGO DUPLO Town Airplane & Airport 10961 Building Toy; Imaginative Playset for Kids; Great, Fun Gift for Toddlers; New 2021 (28 Pieces),Multicolor,One Size","https://m.media-amazon.com/images/I/817egHEzorL._AC_UL320_.jpg","4.9","799","44.4","270"
"B012BNYGJY","PicassoTiles 2 Piece Car Truck Construction Kit Toy Set Vehicle Educational Magnet Building Tile Magnetic Blocks Puzzle Magnets Toys with Re-Enforced Hitch and Long Bed for Girls Boys Toddler Ages 3+","https://m.media-amazon.com/images/I/81AR52elgBL._AC_UL320_.jpg","4.8","9291","9.99","270"
"B0BXCWDTPJ","14 Pages Busy Board for Toddlers 2-4,Montessori Travel Toy for Plane/Car,Educational Sensory Toy for Toddlers 1-3,Preschool Activities Board for Developing Fine Motor Skills,Gift for Boys/Girls","https://m.media-amazon.com/images/I/81CvNSK22KL._AC_UL320_.jpg","4.5","24","26.99","270"
"B0BGMH1ZKG","Funko Cranium Hullabaloo Pre-School Game for 1-6 Players Ages 3 and Up","https://m.media-amazon.com/images/I/714n0Xi33oL._AC_UL320_.jpg","4.3","27","18.91","270"
"B0BQBKY54H","Nueplay Kids Bowling Toys Set, Stacking & Nesting Baby Toys, Learning Toys with 6 Soft Bowling Pins & 2 Ball Playset, Bowling Toys for 6 Months+ Girls, Toddler Toys for 1 2 3","https://m.media-amazon.com/images/I/61LMNlpzA5L._AC_UL320_.jpg","4.4","1040","24.99","270"
"B0B2WC68XB","Suction Cup Spinner Toy for Baby 1 2 Year Old , 3PCS Spinner Sensory Toys for Toddlers 1 3, Cartoon Baby Fidget Spinners Toys 12 Months Kids, High Chair/Dining Table/Window/Travelling (Colorful)","https://m.media-amazon.com/images/I/61fUWrr9y5L._AC_UL320_.jpg","4.8","375","8.89","270"
"B0B4RXCV2S","YISOOPEI 32pcs Stacking Toys Balance Building Blocks, Blocks for Kids Ages 4-8, 2 Player Games for Family Games for Kids and Adults,Travel Games Adult,Party Games.","https://m.media-amazon.com/images/I/71mnr105JUL._AC_UL320_.jpg","3.5","22","14.07","270"
"B0BM8R5693","FS Toddler Pop Up Toy with Music and Light, Cause and Effect Toys for 6 9 12 18 Month Old Baby Toys, Early Learning Educational Toys for 1 2 3 Year Old Boy and Girls Gifts","https://m.media-amazon.com/images/I/614cu4zUZ6L._AC_UL320_.jpg","4.6","656","21.99","270"
"B084P6W6NW","Fisher-Price Blaze and the Monster Machines Toy Cars Playset, Mud Pit Race Track with Blaze & Crusher Plus Slime for Ages 3+ Years","https://m.media-amazon.com/images/I/612aJ7MTiDL._AC_UL320_.jpg","4.8","2294","26.0","270"
"B0BRCMCYYW","Omgouue 24PCS Small Coloring Books for Kids Ages 2-4,4-8,Birthday Party Favors Gifts Goodie Bags Stuffers Holiday Supplies Includes Unicorn Dinosaur Animal Mermaid","https://m.media-amazon.com/images/I/81L-HpMYMNL._AC_UL320_.jpg","4.6","290","11.99","270"
"B072PZKLX9","Melissa & Doug Fresh Mart Grocery Store Play Food and Role Play Companion Set - Kids Pretend Grocery Shopping For Kids Ages 3+","https://m.media-amazon.com/images/I/71mmREL8m1L._AC_UL320_.jpg","4.8","8564","19.49","270"
"B09FSJ4616","Baby Mirror Toys for Tummy Time, Newborn Infant 0-3-4-6-12 Months Old Gift. Boy, Girl Brain Developmental Montessori Sensory Crinkle Black and White Book. Safe Mirror-Floor,Crib,Car Activity Essential","https://m.media-amazon.com/images/I/51ZuKQ8GdIL._AC_UL320_.jpg","4.7","1511","12.99","270"
"B09VT1NVCD","Flash Cards for Toddlers 2-4 Years – Jumbo Learning Box Set with Real Pictures - Alphabet Number Emotions Animal Sight Words Color Shapes – Toddler Flash Cards for Kindergarten Preschool 1st 2nd Grade","https://m.media-amazon.com/images/I/91p--yMniCL._AC_UL320_.jpg","4.7","176","34.95","270"
"B0BBYYR7RS","Toy Cash Register for Kids with Scanner, Play Money, Fake Credit Card, Calculator, Cutting Food & Pot Playset, Hat, Supermarket Grocery Play Store Pretend Cashier Gift for Toddlers Boys Girls","https://m.media-amazon.com/images/I/71V+vize3bL._AC_UL320_.jpg","4.4","1470","29.97","270"
"B01J6HPYFI","Minecraft Toys, Sword and Pickaxe, Minecraft Game Transforming Kid size Role-play Accessory (Amazon Exclusive)","https://m.media-amazon.com/images/I/81CTQTyuDdL._AC_UL320_.jpg","4.8","8165","28.99","270"
"B08YP8S278","LEGO Speed Champions Koenigsegg Jesko 76900 Racing Sports Car Toy with Driver Minifigure, Racer Model Set for Kids","https://m.media-amazon.com/images/I/81aOihnR0qL._AC_UL320_.jpg","4.8","6023","16.99","270"
"B0BX4Q22C3","Dave and Abe Stepping Stones for Kids | Set of 10 Birch Wood | Montessori | Learn Colors | Learn Numbers | Toddler Stepping Stones | Balance Beam | Speech Therapy Toys for Toddlers 1-3","https://m.media-amazon.com/images/I/719bnwwQYFL._AC_UL320_.jpg","4.3","13","19.99","270"
"B0923B2PKF","Educational Insights Playfoam Shape & Learn 4-Pack, Learn Letters, Numbers, Counting & Shapes, Fidget & Sensory Toy, Ages 3+, Amazon Exclusive","https://m.media-amazon.com/images/I/81g1SfgFF8L._AC_UL320_.jpg","4.5","226","12.78","270"
"B005LB9EUA","Green Toys School Bus Yellow, Standard","https://m.media-amazon.com/images/I/61YcZw8OKBL._AC_UL320_.jpg","4.9","2307","29.59","270"
"B000O7PN06","Melissa & Doug Pretty Purse Fill and Spill Soft Play Set Toddler Toy","https://m.media-amazon.com/images/I/81WMMh0Q3-L._AC_UL320_.jpg","4.6","1419","18.43","270"
