"asin","title","imgUrl","stars","reviews","price","category_id"
"B0B2VQHQNK","FiiO FF3 Earbuds Headphones Lossless Wired Earphones 1DD Deep Bass Comes with 3.5/4.4mm Plugs High Resolution for Smartphones/PC/Laptop/Tablet(Silver)","https://m.media-amazon.com/images/I/71AAyQrh4oL._AC_UL320_.jpg","3.9","26","99.99","71"
"B097YHQR4Q","SICCOO Bluetooth Sleep Headphones Wireless Earbuds Soft in-Ear for Sleeping, 30 Hours Music Time Headsets for Insomnia,Side Sleeper - Black","https://m.media-amazon.com/images/I/61HtzS-u7bS._AC_UL320_.jpg","3.5","212","32.99","71"
"B071KGHJN1","Assortit Everyday Wholesale Earbuds Bundle Bulk in-Ear Earphones 24 Pack","https://m.media-amazon.com/images/I/61kbWgyCBkL._AC_UL320_.jpg","3.8","654","18.9","71"
"B09895978Z","Poly (Plantronics + Polycom) EncorePro 545 USB-A and USB-C USB Headset (Plantronics) - Acoustic Hearing Protection - Hold & Call Answer Buttons - Convertible Wearing Style, Black, Standard Version","https://m.media-amazon.com/images/I/71IWTusZI6S._AC_UL320_.jpg","4.5","7","89.13","71"
"B09QCS3MB6","Soundcore by Anker Life P2 Mini True Wireless Earbuds, 10mm Drivers with Big Bass, Custom EQ, Bluetooth 5.2, 32H Playtime, USB-C for Fast Charging, Tiny Size for Commute, Work (Rose Pink) (Renewed)","https://m.media-amazon.com/images/I/61hADrzS7nL._AC_UL320_.jpg","4.2","189","19.59","71"
"B089GDBTR2","A6S TWS Bluetooth Earphone VS Redmi Airdots Wireless Headphone Stereo Headset Mini Earbuds for Xiaomi iPhone Huawei Samsung","https://m.media-amazon.com/images/I/41en7ztMQHL._AC_UL320_.jpg","3.7","42","19.99","71"
"B0BK1HRY3X","TRANYA X1 Wireless Earbuds Bluetooth Headphones 66Hrs Playtime with Wireless Charging Case & LED Display, Over-Ear Waterproof Earphones with Earhook, Headset with 4-Mic for Sports Workout Black","https://m.media-amazon.com/images/I/61ejrWFSTSL._AC_UL320_.jpg","4.2","68","49.99","71"
"B071ZYTRXQ","TechKen Sunglasses Headset Headphone Bluetooth Wireless Music Sunglasses Headsets Compatible with iPhone Samsung LG and Smart Phones PC Tablets","https://m.media-amazon.com/images/I/61dBWAkl1dL._AC_UL320_.jpg","4.0","1535","15.97","71"
"B0CCNYQPB7","ZOHAN Kids Ear Protection 2 Pack,Kids Noise Canceling Headphone for Concerts, Monster Truck, Fireworks","https://m.media-amazon.com/images/I/71iZT5Mup-L._AC_UL320_.jpg","4.7","14","25.99","71"
"B0CCND7ZH9","GOSCIEN Ear Buds Wireless Bluetooth Earbuds 40Hrs Playtime Bluetooth 5.2 with Wireless Charging Case IPX7 Waterproof Wireless Bluetooth Earphones with Earhook for Sports","https://m.media-amazon.com/images/I/61DEd2c+jyL._AC_UL320_.jpg","4.3","104","30.0","71"
"B097V11VZB","MASTER & DYNAMIC MW65 Active Noise-Cancelling Wireless Headphones – Bluetooth Over-Ear Headphones with Mic – Lamborghini Black/Gray Alcantara/Black Metal","https://m.media-amazon.com/images/I/41kdLOfVnvS._AC_UL320_.jpg","4.2","451","299.0","71"
"B07Y2MQMZY","Motorola Vervebuds 110 True Wireless Compact Headphones IPX4 Water Resistant - White","https://m.media-amazon.com/images/I/61rLVFqdV8L._AC_UL320_.jpg","3.8","572","33.49","71"
"B08JPFH17B","Aluratek Bluetooth Wireless Stereo Headset with Boom Microphone and Dongle, Built-in Rechargeable Battery, 27 Hours Continuous Talk and Music Play","https://m.media-amazon.com/images/I/619ZiNrA4fL._AC_UL320_.jpg","4.2","45","39.99","71"
"B0B7X26XMR","Final Audio True Wireless Earbuds Bluetooth Headphones with Charging Case. Earphones with Built-in Mic and Hands Free Touch Controls for iPhone & Android. Evangelion (White)","https://m.media-amazon.com/images/I/51TE4e0PilL._AC_UL320_.jpg","4.4","28","186.03","71"
"B09CGXZ969","TRANYA T40 Wireless Earbuds with Ear Hooks, 13mm Large Driver for Immersive Deep Bass, 8-H Playtime, Button Control, IPX5 Waterproof Sports Headphones Bluetooth 5.1-Black ","https://m.media-amazon.com/images/I/616qiyF4qYL._AC_UL320_.jpg","3.9","725","59.99","71"
"B07LH93PFM","Silent Sound System Starter Package for House Party, Garden Event, Backyard Family Home Movies (9 RF LED Headphones + 1 Transmitter)","https://m.media-amazon.com/images/I/61GXrzvOf4L._AC_UL320_.jpg","4.8","8","739.99","71"
"B0BV6LK9T3","Wireless Earbuds Bluetooth 5.3 Headphone for iPhone 15 Pro Max 14 Plus 13 Noise Canceling HiFi Stereo Headset in-Ear Earphone for Google Pixel 7a 6a 7 6 Samsung A53 A54 Z Flip Fold S23 S22 S21 Android","https://m.media-amazon.com/images/I/613Ah35PMeL._AC_UL320_.jpg","4.0","17","23.99","71"
"B0BWSDKK19","Kaja Audio Go-To's Earbuds Wireless Bluetooth with Dual Mics & Touch Control - Wireless Earbuds for iPhone & Android - Noise Canceling Earbuds Wireless for Gym & Exercise - Cordless Earbuds Bluetooth","https://m.media-amazon.com/images/I/61UG0cSnQHL._AC_UL320_.jpg","5.0","14","79.0","71"
"B0BZP5G1RB","BUGANI Open Ear Headphones Wireless Bluetooth, Touch Control Bluetooth Headphones Bluetooth 5.3, Waterproof Sport Wireless Headphones, Wireless Earphones with Clear Talk, 8 Hours Playtime","https://m.media-amazon.com/images/I/61bF1bCemGL._AC_UL320_.jpg","4.2","89","29.99","71"
"B09HNG4T8D","Soundcore by Anker Life Q35 Multi Mode Active Noise Cancelling Headphones, Bluetooth Headphones with LDAC for Hi Res Wireless Audio, 40H Playtime, Clear Calls, (Renewed)","https://m.media-amazon.com/images/I/61m+KaklSxL._AC_UL320_.jpg","4.4","168","74.99","71"
"B0CBK3PTP9","APAPATEK USB C Headphones for iPhone 15 Pro Samsung Z Flip Fold 5 Type C Wired Earbuds with Mic DAC Chip Noise Isolation in-Ear Headsets Stereo USB-C Earphones for Google OnePlus iPhone 15 iPad Pro","https://m.media-amazon.com/images/I/71g8jtFqY4L._AC_UL320_.jpg","4.5","16","14.99","71"
"B09WDR2N6M","Togetface Bluetooth Headphones Earbuds for Kids Boys True Wireless Earphone 35H Playtime Ear Buds with Charging Case, IPX5 Waterproof Earbuds for Work Gym Study Smart Phone Computer Laptop Sports.","https://m.media-amazon.com/images/I/71Pn4XvRkxL._AC_UL320_.jpg","4.2","147","39.99","71"
"B0BRG1359S","iKF-T1 Pro Wireless Wired Headphones Call Noise Cancelling Bluetooth Headset Bass Stereo Sound 100 Hours Using Time Built-in Microphone Pairing 2 Devices Compatible iOS/Android (Off-White)","https://m.media-amazon.com/images/I/61uRdNaYbOL._AC_UL320_.jpg","3.6","11","57.99","71"
"B08XZ57TGM","YLFASHION Black Cat Cartoon Headphones Wireless FM Headset Music Stereo Bluetooth Headphones with Microphone, Foldable Kids Headphone Over Ear for Study (Black cat)","https://m.media-amazon.com/images/I/61UFUYzh+IL._AC_UL320_.jpg","4.1","247","19.99","71"
"B0922DWRSP","KZ ZS10 Pro in Ear Monitor Earphone, 4BA 1DD Metal Earbuds, HiFi Bass Headphones IEM with Detachable 2 Pin C-Cable(Gold Mic)","https://m.media-amazon.com/images/I/71cLjeP2X5L._AC_UL320_.jpg","4.5","323","48.99","71"
"B0992DXFJP","Mucro Sport Earbuds Wired Neckband Headphone Over The Ear Wrap Around Earphones Foldable Stereo Ear Buds for Night Running Gym Workout","https://m.media-amazon.com/images/I/61Eo7EWm-SL._AC_UL320_.jpg","3.8","78","20.99","71"
"B0C6B7LSQB","Livem Wireless Earbuds Bluetooth 5.3 Headphones 60H Playtime with Charging case IPX7 Waterproof 2023 LED Digital Display Wireless Earphone with Mic Ear Buds for Sport Cycling Workout Running","https://m.media-amazon.com/images/I/61TJQiAmMML._AC_UL320_.jpg","3.6","32","21.99","71"
"B0BG6ZCGK8","SonicPower Noise Cancelling Earbuds, Premium Quality Sound & Materials, Stylish Metallic Finish, Portable Charging Case, Long Battery Life, 2 Color Options","https://m.media-amazon.com/images/I/415neae0X9L._AC_UL320_.jpg","4.6","29","88.0","71"
"B0819MP1D6","Sleep Soundproof Earbuds Headphones, Noise Isolating Soft Earbuds for Sleeping, Nighttime, Insomnia, Side Sleeper, Snoring, Travel, Meditation & Relaxation (Light Green)","https://m.media-amazon.com/images/I/51bACZZKJ3L._AC_UL320_.jpg","4.3","188","12.99","71"
"B0BXWSTYSQ","Mysic Wireless Earbuds,Bluetooth 5.3 Earbuds Built in 4 ENC Stereo Microphone Bluetooth Headphones 42H Playtime with Charging Case IPX7 Waterproof Mini in-Ear Earphones for iOS Android(White) (J8)","https://m.media-amazon.com/images/I/61EFGqE8AFL._AC_UL320_.jpg","4.3","299","16.99","71"
"B078HSVK7M","Bang & Olufsen Beoplay H9i Wireless Bluetooth Over-Ear Headphones with Active Noise Cancellation, Transparency Mode and Microphone – Black - 1645026","https://m.media-amazon.com/images/I/61HahnTbx7L._AC_UL320_.jpg","4.1","1103","369.92","71"
"B07Q73G6CZ","KLOKOL Bluetooth Headphones Neckband V5.0 Wireless Headset Sport Earbuds w/Mic Cordless Noise Canceling Earphones 15Hrs Playtime for Gym Running Compatible with iPhone Samsung Android","https://m.media-amazon.com/images/I/514Cg+CihaL._AC_UL320_.jpg","4.1","1993","15.99","71"
"B07B3Q9GC9","Fashion Retro Phone handset Headset 3.5mm Microphone Prevention Radiation Compatible with iPhone Samsung","https://m.media-amazon.com/images/I/51tLCrR+ErL._AC_UL320_.jpg","3.7","254","20.99","71"
"B074SCQG6J","Mijiaer Rose Earbuds for Small Ears, M30 Wired Ear Buds with Microphone 3.5mm Jack Earphone for Women,Girls,Teen","https://m.media-amazon.com/images/I/51TRy6nSKKL._AC_UL320_.jpg","4.4","1099","18.49","71"
"B09QQG85HM","Xiaomi True Wireless Earbuds Redmi Buds 3 Lite, Bluetooth 5.2, in-Ear Headphones with Mic, IP54 Water-Resistance, Sweatproof, True Wireless Earbuds, Global Version - Black, Small","https://m.media-amazon.com/images/I/51c9d1ye4VL._AC_UL320_.jpg","4.0","3722","30.75","71"
"B07RV42L47","Samsung Galaxy Buds 2019, Bluetooth True Wireless Earbuds (Renewed)","https://m.media-amazon.com/images/I/51zz3ma0NFL._AC_UL320_.jpg","4.3","904","64.99","71"
"B0BVMCHVLW","Eonome-W5s-True-Wireless-Earbuds-Bluetooth 5.3 in-Ear Headphones IPX7 Waterproof - USB-C Charging Sport Wireless Headphones Built-in Mic for iPhone, Samsung, Huawei with Metal Charging Case(Red)","https://m.media-amazon.com/images/I/61Vehibcv0L._AC_UL320_.jpg","4.5","58","14.99","71"
"B07F8ZK7FJ","TFD Supplies Wholesale Bulk Earbuds Headphones 500 Pack for iPhone, Android, MP3 Player - Mixed Colors","https://m.media-amazon.com/images/I/7149FBfaGSL._AC_UL320_.jpg","4.3","6","185.86","71"
"B0BZJ79W8C","HCMOBI Bone Conduction Headphones Bluetooth 5.2 Open-Ear Sports Headphones with Mic, 8H Playtime Waterproof Wireless Headset for Running, Cycling, Driving, Workouts (Grey)","https://m.media-amazon.com/images/I/518memEibOL._AC_UL320_.jpg","3.8","180","29.99","71"
"B0977VLK45","JVC HA-EN15WB Gumy Sport Wireless Earbuds - In Ear Bluetooth Sports Headphones with Secure & Comfortable Soft Nozzle Fit Earpieces, Sweat Proof IPX2, 6.5 Hour Rechargeable Battery Mic & Remote (Black)","https://m.media-amazon.com/images/I/61q-kCv9a2L._AC_UL320_.jpg","4.0","59","13.99","71"
"B086PHF86D","OontZ True Wireless BudZ ULTRA – Active Noise Cancelling True Wireless Earbuds, 5.0 Bluetooth Earbuds, Superior Sound, Customizable Fit, Compact Charging Case, Headset with microphone (Black)","https://m.media-amazon.com/images/I/61C3uYrkuDL._AC_UL320_.jpg","3.8","231","39.99","71"
"B07R77YK1Q","Hongzan 100 Pack Classroom Earbuds Bulk for School Kids Children, Wholesale Durable Earphones Class Set Headphones for Students (White)","https://m.media-amazon.com/images/I/51dZX8AKm1L._AC_UL320_.jpg","4.7","14","39.99","71"
"B0BMTPF3B9","Lankey Pro Ear Buds Wireless,Bluetooth Headphones,180H Playtime Ear Buds with Microphone, IPX8 Waterproof in Ear Headphones with Digital Display,Touch Control for Sports,Work,Gym(Black)","https://m.media-amazon.com/images/I/71IPUyPFcKL._AC_UL320_.jpg","4.3","552","19.99","71"
"B077TJ4BY3","WEUTOP Single Earbud Stereo Headphone [ 3.3ft ] (Black)","https://m.media-amazon.com/images/I/51PP8z3g8eL._AC_UL320_.jpg","3.9","295","6.99","71"
"B00005N6KG","Sony MDR-W08L Vertical In-The-Ear Headphones,Black","https://m.media-amazon.com/images/I/51F2OFqbbmL._AC_UL320_.jpg","4.3","1745","119.99","71"
"B08XZCX8Y4","EMPERSTAR Noise Cancelling Headphones, Over The Ear Headphones Wireless Bluetooth Multipoint Comfortable and Foldable Over Ear Wireless Headset for 40H Music, Built-in Mic for TV,Travel,Work","https://m.media-amazon.com/images/I/714UaMV7CuL._AC_UL320_.jpg","4.2","134","35.0","71"
"B01GDIFF0C","Coby Noise Isolating Metal Wired Earbuds| Wired Headphones w/Tangle Free Braided Wire |Built-in Microphone for Ear Buds| Noise Canceling Headphones w/ 3.5mm AUX| S/M/L Comfort Ear Gels|Black","https://m.media-amazon.com/images/I/61avuiNbQnL._AC_UL320_.jpg","3.5","8","8.33","71"
"B0B14GM5MZ","MAS CARNEY 【2 Pack Black+White】 Digital USB Type C Earphones, TI3/TH4 USB C Earbuds,in-Ear Earbud Noise Isolating Pure Sound and Powerful Bass for USB-C Type-c Music Device","https://m.media-amazon.com/images/I/614yAMENaaL._AC_UL320_.jpg","3.6","724","7.99","71"
"B0BYKTC3ZX","iJoy Headphones Wireless Bluetooth- Wireless Bluetooth Earbuds with Upgraded Bluetooth 5.3 Tech, Built in Button Controls and in-Line Microphone- Bluetooth Earbuds Perfect for Running/Workouts","https://m.media-amazon.com/images/I/61COlq+IDoL._AC_UL320_.jpg","4.3","33","17.99","71"
"B09XMPZNVQ","kolodosa Earphones for Samsung Earbuds Galaxy Wired Ear Buds with Microphone Headphones s5 s7 s8 s9 Note 5 Plus audifonos","https://m.media-amazon.com/images/I/51ie0VmWxzL._AC_UL320_.jpg","3.8","89","6.99","71"
"B01H3F0SDI","SoundMAGIC E10C Wired Earbuds with Microphone HiFi Stereo Earphones Noise Isolating in Ear Headphones Powerful Bass Tangle Free Cord Gunmetal","https://m.media-amazon.com/images/I/61xQG8D4MBL._AC_UL320_.jpg","4.2","3017","32.99","71"
"B0BVYLXV28","realme Buds Air 3 Wireless Earbuds, Active Noise Cancellation, 10mm Dynamic Bass Boost Driver, Up to 30 Hours Playtime, IPX5 Water Resistance - (White)","https://m.media-amazon.com/images/I/512yFhkD9HL._AC_UL320_.jpg","4.1","101","59.99","71"
"B0BHSXPDW5","233621 Hush-X Hybrid Active Noise Cancelling Bluetooth Headphones with 100 Hrs of Playback and Upgraded Design, Flower","https://m.media-amazon.com/images/I/61lmDrggnQL._AC_UL320_.jpg","4.1","493","69.99","71"
"B09T77WD3F","Altec Lansing Nanophones ANC Bluetooth Wireless Active Noise Cancelling Headphones On Ear Headphones 12 Hour Battery Life, Foldable Earcups, Removeable Mic for Working and Learning from Home (Mint)","https://m.media-amazon.com/images/I/61SyqJWLAUL._AC_UL320_.jpg","4.1","76","39.99","71"
"B0C2X6GFC4","Mangohifi Bluetooth Headphones Wireless Earbuds 40+ Hrs Playtime Clear Sound Quality IPX7 Waterproof Built-in Mic in/Over-Ear Earphones Bluetooth Earbud 5.3 Perfect for Sports and Daily Use Black","https://m.media-amazon.com/images/I/61AQmMQuvUL._AC_UL320_.jpg","4.8","8","29.99","71"
"B09PH3F784","WESADN Bluetooth Headphones Wireless with Microphone Fidget Bubbles Cute Cat Ear with LED Light Up Over Ear Headphones for Girls Boys Women Pop Gaming Headset On Ear for Smartphone Tablet PC, Purple","https://m.media-amazon.com/images/I/618vu6Ea8nL._AC_UL320_.jpg","4.5","76","22.99","71"
"B00DJUXO9C","Flips Audio FH2814BK Collapsible HD Headphones and Stereo Speakers, Black","https://m.media-amazon.com/images/I/718qRXca7DL._AC_UL320_.jpg","4.1","538","22.98","71"
"B0B8R1Y5TF","Wireless Earbuds Bluetooth 5.3 Earbuds Wireless Headphones with Mic and Charging Case HiFi Sound Quality 35 Hours Playtime Bluetooth Earbuds with LED Display IPX7 Waterproof Bluetooth Headphones","https://m.media-amazon.com/images/I/71c7VCVJm7L._AC_UL320_.jpg","4.5","235","29.99","71"
"B0CC5B8ST7","USB C Headphone HiFi Stereo Type C Earphone Flat Wired Earbuds for iPhone 15 Pro Max Samsung A53 A54 Galaxy Z Flip 5 S23 S22 S21 S20 FE Google Pixel 7 7a 6 6a in-Ear Noise Canceling Corded Headphones","https://m.media-amazon.com/images/I/71Z181Yy1fL._AC_UL320_.jpg","4.5","15","14.99","71"
"B087RQH577","beyerdynamic DT-990 Pro Acoustically Open Headphones (250 Ohms) with Knox Gear Large Hard Shell Headphone Case Bundle (2 Items)","https://m.media-amazon.com/images/I/81i8rUHYOrL._AC_UL320_.jpg","4.7","323","169.0","71"
"B0CC94Q8Z4","ASIILOVI Open Ear Headphones LK08 2023 Version, Air Conduction Headphones Bluetooth 5.3 Touch Control Wireless Earbuds, Up to 70 Hours Playtime Earphones with Dual 16.2mm Dynamic Drivers Deep Bass","https://m.media-amazon.com/images/I/719zIUeVNYL._AC_UL320_.jpg","4.6","7","78.98","71"
"B07FKJS8V6","Mini Wireless Earbuds, Bluetooth 5.1 in Ear Light-Weight Headphones, IPX7 Waterproof Sport Stereo Earphone, Built in Mic Noise Cancelling Headset with Charging Case, for iPhone/Samsung/Galaxy","https://m.media-amazon.com/images/I/51Ymw89+pCL._AC_UL320_.jpg","4.0","1847","26.99","71"
"B09D5XQQW4","ThinkWrite Technologies / TWT Audio LITE, TW50 | Premium On-Ear Lightweight Noise Reducing Wired Headphones 20 - Pack (3.5mm TRS Jack)","https://m.media-amazon.com/images/I/61k67wDwLtL._AC_UL320_.jpg","4.3","8","189.99","71"
"B09JC4LL1G","Mangotek Replacement for iPhone Headphone Apple Earbuds Lightning Headphones with Microphone MFi Earphones Ear Buds Earphone Earpods Connector for iPhone 14 13 12 11 Pro Max Mini SE 10 X XS XR 7 8","https://m.media-amazon.com/images/I/51uWAnwfk8L._AC_UL320_.jpg","4.0","859","25.99","71"
"B01HONM14I","Far End Gear Short Buds 15"" Cord Single in-Ear Stereo-to-Mono Earbud for Clip-on Music Players, Reinforced Cord","https://m.media-amazon.com/images/I/51uuC+m16sL._AC_UL320_.jpg","4.0","199","18.13","71"
"B0BN1BDKHB","Wired Earbuds With Microphone KBEAR KS1 in-Ear Headphones with 1DD Deep Bass HiFi Stereo Noise Isolating IEM With Tangle-Free Removable Cord Fit in Ear Suitable for Phone Call/Workout (With Mic,Clear)","https://m.media-amazon.com/images/I/61zmvmu7zML._AC_UL320_.jpg","4.6","108","19.99","71"
"B01D5ZFUFG","House of Marley Little Bird: Wired Earphones with Microphone, Noise Isolating Design, and Sustainable Materials, Black","https://m.media-amazon.com/images/I/61biExCVX2L._AC_UL320_.jpg","4.3","3735","7.99","71"
"B0CD7RMSL9","VIKEN Wired Earbuds with Microphone,In-Ear Headphones Heavy Bass Headset with Volume Controller, Noise Isolating Ear Buds Tips(S/M/L),Earphones Wired for Phones iPod iPad MP3 Fits All 3.5mm Jack-Black","https://m.media-amazon.com/images/I/61612VaYWJL._AC_UL320_.jpg","5.0","6","15.99","71"
"B0BYN9H6WV","Cianyyee 6Pack Wired Earbuds in-Ear Headphones, Earphones with Microphone for Clear Calls,Sound-Dynamic, Noise Isolating, for iPhone, iPad, Samsung, Laptop, Computer, Android Smartphones","https://m.media-amazon.com/images/I/61QaPVVR7RL._AC_UL320_.jpg","4.6","7","13.99","71"
"B0921WJYNC","FIGMASU Headphones Wireless Bluetooth Neckband Wireless Headsets for Sport Built-in Microphone, 100 H Playtime Semi-in-Ear Earbuds for Running, Workout, Gym Sweatproof","https://m.media-amazon.com/images/I/6194DsTp2pS._AC_UL320_.jpg","3.8","120","29.98","71"
"B07PWHFWY7","Bang & Olufsen Beoplay H8i Wireless Bluetooth On-Ear Headphones with Active Noise Cancellation, Transparency Mode and Microphone - Pink","https://m.media-amazon.com/images/I/619Qi4f+0YL._AC_UL320_.jpg","4.2","566","299.99","71"
"B09W24BTZY","Wireless Earbuds,Thohia Bluetooth Earphones Wireless Charging/Type-C, Hi-Fi Stereo&Silicone Ear-Cap,White Wireless Earphones Bluetooth, Bluetooth Earbuds for iPhone Android,Touch Control, 3 Modes","https://m.media-amazon.com/images/I/51Zjfd5gTCL._AC_UL320_.jpg","3.9","68","13.98","71"
"B07B9S8SYT","SIMOLIO Wired Noise Isolating Stethoscope Headset with Soft Eartips,Replacement Under-Chin Earphone for Wireless TV Speaker SM-621 SM-621D for Quiet TV Listen","https://m.media-amazon.com/images/I/61Gj73xAHRL._AC_UL320_.jpg","3.9","78","16.99","71"
"B07TD4VDRY","meidong True Wireless Earbuds, Bluetooth Earbuds Headphones V5.0 KY06 in-Ear Earphones (Black)","https://m.media-amazon.com/images/I/51r4jAZzEsL._AC_UL320_.jpg","3.9","386","29.99","71"
"B0B5TMYNRH","Wireless Earbuds, Bluetooth 5.3 Headphones With Noise Cancelling Mic and Clear Call, Bluetooth Earbuds Touch Control Stereo Bass, LED Display, IPX7 Waterproof Running Earphones for Sports/Travel","https://m.media-amazon.com/images/I/51ONJ6xlXoL._AC_UL320_.jpg","4.3","602","9.99","71"
"B07Y8V7CT9","Universal IFB Earpiece 3.5mm & 1/4” Connector Anchor/Broadcaster in Ear Monitor Only On Camera On Stage Professional EarSet Compatible w/iPhone, Andriod, Telex, Clear-Com, Comrex, Lecstronics","https://m.media-amazon.com/images/I/71xfWFOCgvL._AC_UL320_.jpg","4.5","41","73.99","71"
"B08PFL2MXB","Conambo Bluetooth Headset with Microphone,Trucker Bluetooth Headset with Noise Cancelling,22Hrs Call Time,V5.0 Wireless Headset with Mute Button,On Ear Headphones for Cell Phones Business Office","https://m.media-amazon.com/images/I/5133CpbPdgS._AC_UL320_.jpg","4.0","960","36.99","71"
"B0CCDCLD71","H HIFIHEAR ND DD3 in Ear Monitor Headphones,Adjustable Dual Magnetic Dynamic IEM Earphones,4 Tuning Modes Wired Earbuds with Detachable Cable for Audio Engineer,Musician (Black, No Mic)","https://m.media-amazon.com/images/I/51RvkTiRkUL._AC_UL320_.jpg","4.4","89","24.99","71"
"B0B922FW6J","Wired Earbuds with Microphone, TITACUTE 3.5mm Jack Earphone Magnetic in-Ear Headphone Stereo Clear Audio for iPhone iPad Samsung A13 A03s S10e S10 Motorola One 5G Ace/Moto G Stylus Power Android","https://m.media-amazon.com/images/I/71tJ3nUkVOL._AC_UL320_.jpg","4.3","31","8.99","71"
"B088D4QWT7","AKG N400 True Wireless Bluetooth Earphones ANC Canal Type (Black)","https://m.media-amazon.com/images/I/51oexM29pqL._AC_UL320_.jpg","3.8","326","179.0","71"
"B096VCH2N2","MoreJoy Wireless Earbuds, Bluetooth 5.2 Earbuds Stereo Bass Sound, Bluetooth Headphones with Noise Cancelling Mic, IP7 Waterproof for Sports, 26H Playtime, USB-C Fast Charge, for Android iOS","https://m.media-amazon.com/images/I/51kSEANYDOL._AC_UL320_.jpg","3.8","439","9.99","71"
"B0777K1472","Kids Bluetooth Headphones Foldable Volume Limiting Wireless/Wired Stereo On Ear HD Headset with SD Card FM Radio in-line Volume Control Microphone for Children Adults (Blue)","https://m.media-amazon.com/images/I/716vNImo5QL._AC_UL320_.jpg","4.3","2738","22.99","71"
"B09DYNH2KX","KZ EDX Pro in-Ear Monitor Headphones Wired, IEM Earphones Dual DD HiFi Stereo Sound Earphones Noise Cancelling Earbuds(White,No Mic)","https://m.media-amazon.com/images/I/71eE1-HQ1nL._AC_UL320_.jpg","4.4","355","15.99","71"
"B0C2JKPQS4","eKids Guardians of The Galaxy Kids Bluetooth Headphones, Wireless Headphones with Microphone Includes Aux Cord, Volume Reduced Kids Foldable Headphones for School, Home, or Travel","https://m.media-amazon.com/images/I/71Jeci82TVL._AC_UL320_.jpg","4.1","17","19.99","71"
"B07ZMKZJ8V","Wired Earbud Headphones with Microphone, Boost+ Premium Earphones Volume Control Slide-Bar with 3.5mm Port for PCs, Tablets, and Cell Phones in The Office, Classroom or Home, White, 5-Pack","https://m.media-amazon.com/images/I/81665UTmTAL._AC_UL320_.jpg","4.0","198","19.99","71"
"B07WDHBFF7","Dualpow Bluetooth 5.0 Headphones, Wireless Over Ear Gaming Homeschooling Headset 24Hrs Playtime Deep Bass Microphone for iPhone/Android/IPAD/Tablets/TV/PC & ONLY Wired for PS4/PS5,Switch,Xbox (AW)","https://m.media-amazon.com/images/I/61ErkbaNBSS._AC_UL320_.jpg","4.4","2542","44.99","71"
"B09MVR9NQ2","Edifier Bluetooth Wireless Active Noise Cancelling Earbuds – Neckband Headphones 13Hrs Playtime,IP55 Waterproof Stereo Earphones for Gym Running Compatible with iPhone and Android,W280NB Black","https://m.media-amazon.com/images/I/41vm8mq56oL._AC_UL320_.jpg","3.8","33","44.99","71"
"B08TWWXY4G","YINYOO KBEAR OS1PRO in Ear Monitor Earbuds for Musicians, HiFi Headset Earphones Headphones Wired, Graphene Dynamic Bass Boosted, Noise Canceling, Auriculares Detachable Cable (with mic, Black)","https://m.media-amazon.com/images/I/61b12MERuIL._AC_UL320_.jpg","4.4","534","25.99","71"
"B07C3CCY6M","TFD Supplies Wholesale Bulk Earbuds Headphones 500 Pack for iPhone, Android, MP3 Player - Black","https://m.media-amazon.com/images/I/81OSiO3ldhL._AC_UL320_.jpg","4.5","6","181.11","71"
"B09WYRJLNK","KZ EDX Wired Headset in Ear Entry Level HiFi Headset 3.5mm Detachable 2pin IEM bass Music Game Headset (White,Mic)","https://m.media-amazon.com/images/I/51ZBmaDDknL._AC_UL320_.jpg","4.5","39","10.99","71"
"B099NDM7C8","HUYUN Silicone Headsets Cat Kitty Ears Lovely Attachable Accessory Perfect Compatible for SteelSeries Arctis 5, Bose NC700 QC35 Silver Gray White Mercury Headphones","https://m.media-amazon.com/images/I/41g7xjxy5nS._AC_UL320_.jpg","4.7","75","15.99","71"
"B0BVGYDBRY","TWS BX 17 Bluetooth 5.3 Wireless Earbuds 48hour Playtime HiFi Headphones Over-Ear Headset Sports IPX7 Waterproof Built-in Microphone Digital Power LED Display Powerful Stereo Bass Earphone (Black)","https://m.media-amazon.com/images/I/61t8bNG9llL._AC_UL320_.jpg","3.9","13","26.99","71"
"B0C7KPKWXL","TOZO NC9 Hybrid Active Noise Cancelling Wireless Earbuds, in Ear Headphones IPX6 Waterproof Bluetooth 5.3 Stereo Earphones, Immersive Sound Premium Deep Bass Headset Dark Red (Renewed)","https://m.media-amazon.com/images/I/71nq6r1PFeL._AC_UL320_.jpg","4.4","36","33.99","71"
"B0BZ4LSHRK","USB C Headphones for Samsung Galaxy Z Flip5 Fold5 S23 Ultra S22 S21 S20 FE A54,HiFi Stereo Wired Earbuds Magnetic Noise Canceling Headset Digital DAC Type C Earphones with Mic for iPhone 15 Pro Max","https://m.media-amazon.com/images/I/61nvWJN+DVL._AC_UL320_.jpg","4.1","17","13.99","71"
"B06WLGFJKV","JVC HAKD7Y Kid's Headphones (Yellow)","https://m.media-amazon.com/images/I/71kL7urUAQL._AC_UL320_.jpg","4.5","1568","9.99","71"
"B09VG1L6H2","JBL Tune 660NC: Wireless On-Ear Headphones with Active Noise Cancellation - White (Renewed)","https://m.media-amazon.com/images/I/51RQfAqlFJL._AC_UL320_.jpg","4.3","140","79.99","71"
"B0CCVKYWWM","QAWDAWM Open Ear Bone Conduction Headphones Bluetooth 5.3 Wireless Bluetooth with Charging Case,IPX4 Waterproof Earphones Sport, Clip-on Earphones, for Running, Walking, Workout","https://m.media-amazon.com/images/I/61nEQJCTwWL._AC_UL320_.jpg","4.0","73","14.99","71"
"B08L9CS9DD","H HIFIHEAR KBEAR Lark 1BA+1DD in Ear Monitor,HiFi Bass in Ear Earphone, IEM Wired Headphones, HiFi Stereo Sound Earphones Noise Cancelling Ear Buds with Case 0.75mm 2pins Cable(with Mic,Mauve)","https://m.media-amazon.com/images/I/41ANDXsIqrL._AC_UL320_.jpg","4.5","533","29.99","71"
