"asin","title","imgUrl","stars","reviews","price","category_id"
"B00KSCREG8","Funny Guy Mugs Hacky Sacks, Multicolored Crochet Assorted Geometric Pattern Hacky Ball, Foot Bag Kick Sack, Indoor and Outdoor Toys for Kids and Adults, Set of 3","https://m.media-amazon.com/images/I/51oS6CR+2IL._AC_UL320_.jpg","4.4","1758","12.0","228"
"B0BQ73WJSJ","Electric Gel Ball Blaster, High Speed Automatic Splatter Ball Blaster with 40000+ Water Beads and Goggles, JIFTOK Rechargeable Splatter Ball Toys for Outdoor Activities Game Party Favors-Blue","https://m.media-amazon.com/images/I/81ZsBqzTFtL._AC_UL320_.jpg","4.5","139","19.99","228"
"B07TT8TL1B","iPlay, iLearn Kids Golf Toys Set W/Left & Right Club Head, Indoor Outdoor Sport Toy, Training Golf Balls & Club Equipment, Active Exercise Gifts for 3 4 5 6 7 8 Year Olds Boys Toddler Child Girls","https://m.media-amazon.com/images/I/71wpuNDb1LL._AC_UL320_.jpg","4.5","4271","29.99","228"
"B01G3J3238","GoSports Official Kickball with Pump (2 Pack), 10 Inch","https://m.media-amazon.com/images/I/9137Lxxt1IL._AC_UL320_.jpg","4.6","1707","19.77","228"
"B09CBZ2VBP","NERF Rival Fate XXII-100 Blaster, Most Accurate Rival System, Adjustable Rear Sight, Breech Load, Includes 3 Rival Accu-Rounds","https://m.media-amazon.com/images/I/71rs4-MpdTL._AC_UL320_.jpg","4.6","796","8.99","228"
"B0BVW4R3PT","Ball Pit Balls 100 Count Play Plastic Balls for Ball Pit Playpen BPA- Free Crush Proof Crawling Tunnels Balls for Pet Dogs,Soft Plastic Pool Balls for Kids Birthday Party/Decorations","https://m.media-amazon.com/images/I/71RzpfkwVwL._AC_UL320_.jpg","4.1","105","13.49","228"
"B0BQXL6J6T","HUUIDY Beach Toys, 30Pcs Ice Cream Sand Toys, Sandbox Toys with Collapsible Sand Bucket and Sand Castle Kit, Cake, Lollipop, Sea Animal, Unicorn Molds, Shovels Set, Mesh Bag, Travel Toys for Girls 3+","https://m.media-amazon.com/images/I/81ItBU2e8DL._AC_UL320_.jpg","4.6","233","16.99","228"
"B08H8XFJDQ","SwimWays Spring Float Recliner Chair for Swimming Pool, Inflatable Pool Floats Adult with Fast Inflation, Cup Holder & Foot Rest for Ages 15 & Up, Aqua","https://m.media-amazon.com/images/I/81IC0fwF8AL._AC_UL320_.jpg","4.6","7159","33.98","228"
"B08LZRB2MS","Amazon Basics BPA Free Crush-Proof Plastic Pit Ball with Storage Bag, Toddlers Kids 12+ Months, Pack of 400 Balls, 6 Bright Colors","https://m.media-amazon.com/images/I/A1sF5AGPd1L._AC_UL320_.jpg","4.6","3675","65.02","228"
"B082XJRTMG","Rechargeable Laser Tag 360° Sensors + LCDs - Set of 4 - Gift Ideas for Kids Teens and Adults Boys & Girls Family Fun - Cool Teenage Christmas Lazer Group Activity - Teen Gifts Ages 8+ Year Old Boy","https://m.media-amazon.com/images/I/91C3zNjdf3L._AC_UL320_.jpg","4.7","5301","199.99","228"
"B09WV4H4PZ","Big Rocket Boom Bubble Blower - 69 Holes Bubbles Rocket Launcher Gun Machine with Colorful Lights for Adults Kids, Giant Foam Maker Guns Toys Wedding Outdoor Party Favors Gift","https://m.media-amazon.com/images/I/61WHGlzAeqL._AC_UL320_.jpg","4.2","893","11.99","228"
"B0000U11LW","Intex Kiddie Pool - Kid's Summer Sunset Glow Design - 58"" x 13""","https://m.media-amazon.com/images/I/81toBVMP2-L._AC_UL320_.jpg","4.3","13553","14.89","228"
"B0831GD7YH","30 Pack Mini Bubble Wands(6 Style, 6 Colors), Bulk Bubble Party Favors, Goody Bags for Kid, Great Summer Outdoor Indoor Toys Gifts for Boy Girl, Valentine Christmas Party Supplies","https://m.media-amazon.com/images/I/71SFRFqPtxL._AC_UL320_.jpg","4.6","1450","11.98","228"
"B075134Z6P","Jungle Gym Kingdom Swings for Outdoor Swing Set - Pack of 2 Swing Seat Replacement Kits with Heavy Duty Chains - Backyard Swingset Playground Accessories for Kids (Green)","https://m.media-amazon.com/images/I/71zdz7sUWfL._AC_UL320_.jpg","4.8","16351","42.49","228"
"B083MNVRV2","Melissa & Doug Sunny Patch Giddy Buggy Crawl-Through Tunnel - Indoor Outdoor Developmental Activity Toy Tunnel For Toddlers And Kids Ages 3+ (Multi color)","https://m.media-amazon.com/images/I/71T4rwUUwtL._AC_UL320_.jpg","4.8","2062","26.44","228"
"B0C7VTTBYC","Bubble Machine, Upgraded Durable Bubble Blower | 18000+ Big Bubbles Per Minute for Kids Toddler, with 2 Speed, Plug-in or Battery Powered, for Indoor Outdoor Birthday Parties, Black","https://m.media-amazon.com/images/I/81knmVQbsBL._AC_UL320_.jpg","4.5","26","25.99","228"
"B087R5L6WT","Kids Fort Building Kit Construction STEM Toys for 5 6 7 8 9 10 11 12 Years Old Boys and Girls Ultimate Forts Builder Gift Build DIY Building Educational Learning Toy for Indoor & Outdoor","https://m.media-amazon.com/images/I/71cZcICij7L._AC_UL320_.jpg","4.4","10545","28.99","228"
"B003NSBMUI","Little Tikes Jump 'n Slide Inflatable Bouncer Includes Heavy Duty Blower With GFCI, Stakes, Repair Patches, And Storage Bag, for Kids Ages 3-8 Years","https://m.media-amazon.com/images/I/81UlUFMHYOL._AC_UL320_.jpg","4.7","10370","249.99","228"
"B09H24QN75","Nerf Roblox Zombie Attack: Viper Strike Sniper-Inspired Blaster with Scope, Code for Exclusive Virtual Item","https://m.media-amazon.com/images/I/614RrpNnY4L._AC_UL320_.jpg","4.5","1071","27.49","228"
"B08C9KL5JF","Bubbles 24 Pack Party Favor for Kids Bulk Bubble Solution Blowing Wand 2 Dozen Party Supplies Outdoor Toys Wedding Party Christmas Celebration Birthday Fun Gift","https://m.media-amazon.com/images/I/71ZIGH1ONbL._AC_UL320_.jpg","4.5","935","17.99","228"
"B0BJ26TM3M","IOKUKI Beach and Sand Castle Kit, 12 PCS Sand Toys for Kids Outdoor with Sand Castle Bucket, Molds, Rake and Shovel, Great Toys for Beach","https://m.media-amazon.com/images/I/71Ut829LMcL._AC_UL320_.jpg","4.1","191","16.49","228"
"B084ZVSYFB","Duncan Toys Limelight LED Light-Up Yo-Yo, Beginner Level Yo-Yo with LED Lights, Clear and Orange","https://m.media-amazon.com/images/I/915pfZyNWGL._AC_UL320_.jpg","4.4","1005","8.99","228"
"B0B3XR57H2","IOKUKI Sand Castle Toys for Beach – Toddler Beach Toys with Sand Castle Buckets, Sand Castle Molds, Sand Shovel and Rake, Sand Castle Kit with Mesh Beach Bag for Travel 14 PCS","https://m.media-amazon.com/images/I/71i4-wSqTUL._AC_UL320_.jpg","4.0","400","15.99","228"
"B083RBSLXJ","Space World Play Tent Galaxy Dome Playhouse for Boys and Girls Imaginative Play-Astronaut Space for Kids Indoor and Outdoor Fun, Perfect Kid’s Gift- 47"" x 47"" x 43""","https://m.media-amazon.com/images/I/71UEm0dJNKL._AC_UL320_.jpg","4.5","5449","29.99","228"
"B0027IVMWI","Franklin Sports Youth Football Goal-Post Set — Kids’ Football Goal Post with Mini Football — Fun Football Goal for All Ages — Easy Assembly — Adjustable Height — Weighted Base","https://m.media-amazon.com/images/I/71vXBXXHnoL._AC_UL320_.jpg","4.3","2128","37.99","228"
"B099ZYK7K6","GeerWest 3 in 1 Kids Play Tent for Toddler with Baby Ball Pit and Play Tunnel, Children Indoor Outdoor Playhouse with Climbing Tunnel Toy for Toddlers, Boys and Girls Best Birthday Gifts","https://m.media-amazon.com/images/I/71ArInQ5cIL._AC_UL320_.jpg","4.4","1054","36.99","228"
"B0C3HZRWXF","MARPPY Bath Toys - Bathtub Basketball Hoop for Toddlers and Kids - Fun Bathtub and Shower Toys with 4 Soft Balls and Strong Suction Cup - Bath Toys for Toddlers - Boys and Girls","https://m.media-amazon.com/images/I/71CSTb4s4-L._AC_UL320_.jpg","4.4","652","9.97","228"
"B01AD1TDZ8","Melissa & Doug Sunny Patch Trixie Ladybug Flashlight With Easy-Grip Handle","https://m.media-amazon.com/images/I/61Rrc0zMZoL._AC_UL320_.jpg","4.4","3364","12.99","228"
"B08PFFD27Y","Kids Toys,FLYNOVA 2023 Hand Operated Mini Drones,UFO Magic Flying Orb with Lights,Hover Boomerang Fidget Spinner,Cool Christmas Birthday Gift Set Indoor Outdoor Party Boys Girls Teen Age 8 9 10 11+","https://m.media-amazon.com/images/I/717lDMi4rAL._AC_UL320_.jpg","3.6","2114","16.73","228"
"B09MVK5P12","Liberry Kids Golf Set, Retractable Toy Golf Clubs for Toddlers, Mini Golf Set for Children Age 3 4 5 Years Old","https://m.media-amazon.com/images/I/71e2AKhOk5L._AC_UL320_.jpg","4.2","335","14.99","228"
"B07XPJMQKQ","Matty's Toy Stop 30.5"" Heavy Duty Wooden Kids Lawn Rakes with Plastic Rake Head & Handle (Red & Blue) Gift Set Bundle - 2 Pack","https://m.media-amazon.com/images/I/71Se1I07trL._AC_UL320_.jpg","4.6","710","24.95","228"
"B07X1ZCQD8","Wedding Bubbles Bulk - White Heart Top Wands (100 Count) Individual Mini Bubble Wand Favors for Weddings, Celebration Party Favor for Guests - Stock Your Home","https://m.media-amazon.com/images/I/71sGS8A63xL._AC_UL320_.jpg","4.8","608","19.95","228"
"B097BYNMQK","Trymaker Tetherball, Tether Balls and Rope Set for Kids,Replacement Tetherball for Adults Backyard Outdoors","https://m.media-amazon.com/images/I/71VIpQMDRpL._AC_UL320_.jpg","4.3","610","15.99","228"
"B0929DJ42K","makarci Stepping Stones for Kids, 5pcs Non-Slip Plastic Balance River Stones for Promoting Children's Coordination Skills Obstacle Courses Sensory Toys for Toddlers","https://m.media-amazon.com/images/I/71acAqCr-dL._AC_UL320_.jpg","4.8","718","39.99","228"
"B0BKLSD37Z","Nerf Pro Gelfire X MrBeast Full Auto Blaster & 20,000 Gelfire Rounds, 300 Round Hopper, Rechargeable Battery, Eyewear, Ages 14 & Up","https://m.media-amazon.com/images/I/712Bnk8B9kL._AC_UL320_.jpg","4.6","283","57.99","228"
"B07SGX9VNY","AOKESI Indoor Mini Basketball Hoop Set for Kids - 17"" x 12.5"" Door Basketball Hoops for Room&Wall Mounted with Complete Accessories - Basketball Game Toys with Balls Gifts for Kids Boys Teens","https://m.media-amazon.com/images/I/71oBUelAYPL._AC_UL320_.jpg","4.6","3468","29.99","228"
"B01EGC18OY","Top Race Mini Beach Balls Bulk - Mini Inflatable Beach Ball, Sport Ball - Rainbow Blow Up Bulk Beach Balls for Kids, Sport, Beach, Pool Toys and Water Games - Hawaiian Party Decorations or Pool Party","https://m.media-amazon.com/images/I/61ZyINNwvQL._AC_UL320_.jpg","4.4","3786","14.99","228"
"B0BFHCKGB4","Zantrech 6 Pack Playground Balls Kickballs Dodgeballs, 8.5 Inch Rainbow Playground Ball Set for Kids and Adults, Handball Gaga Ball Four Square Balls","https://m.media-amazon.com/images/I/71C4jfrpMgL._AC_UL320_.jpg","4.6","137","16.99","228"
"B01KUHQZG0","EocuSun Kids Ball Pit Large Pop Up Toddler Ball Pits Tent for Toddlers Girls Boys for Indoor Outdoor Baby Playpen w/Zipper Storage Bag, Balls Not Included (Blue)","https://m.media-amazon.com/images/I/613YqcRhoxL._AC_UL320_.jpg","4.5","6890","13.99","228"
"B097NBN254","Stargo Sand Digger Kids Excavator Ride on Toy, Beach Toys Outdoor Sandbox Toy Digger for Kids, Solid Steel Rotates 360, Hard Hat for Role Play, Sand Toys","https://m.media-amazon.com/images/I/61bNcBsh7wL._AC_UL320_.jpg","4.6","747","38.68","228"
"B09CJL9MMV","Waterlife 4-in-1 Pool Hammock 2-Pack, Inflatable Pool Chair Float, Water Hammock (Saddle, Lounge Chair, Hammock, Drifter), Navy & Light Blue, 2 Count (Pack of 1)","https://m.media-amazon.com/images/I/9156Ysc4sOL._AC_UL320_.jpg","4.4","2107","14.01","228"
"B09CBZL8JB","Sports Balls with Hand Pump for Kids - (Pack of 4) 6-Inch Diameter Rubber Sport Ball Toy Set Includes Football, Soccer Ball, Basketball and Playground for Fun Outdoors and Backyard","https://m.media-amazon.com/images/I/81chNrdWzLL._AC_UL320_.jpg","4.4","338","13.49","228"
"B0C4LTGT6J","Golf Club Set for Kids, Indoor Outdoor Sports Toys for Boys Girls Ages 2 3 4 5 6 Year Old, Christmas Birthday Gift Kids 2-5, Toddler Golf Set with 4 Clubs, 8 Balls, 2 Practice Holes, Shoulder Strap","https://m.media-amazon.com/images/I/81lY31lGuiL._AC_UL320_.jpg","4.9","16","24.99","228"
"B0BRJBQPFL","53PCS Outdoor Lawn Carnival Games Bean Bags Ring Toss Set Potato Sack Race Bags Egg and Spoon Race Games Party for Kid Adult Family，Birthday Party Family Reunion Outside Field Day Easter Games","https://m.media-amazon.com/images/I/71UgzlSbmoL._AC_UL320_.jpg","4.6","139","39.99","228"
"B09BFW62XZ","WADDLE Hip Hoppers Bouncy Hopper Inflatable Hopping Animal Bouncer, Supports Up to 250 Pounds, Ages 5 and Up (Brown Bull)","https://m.media-amazon.com/images/I/71jdlioZifL._AC_UL320_.jpg","4.0","510","17.48","228"
"B07VC9KPJC","Battat – Flying Disc Toy – 2 Launchers & 4 Discs – Helicopter Playset – Outdoor Toys for Summer – 3 Years + – Skyrocopter","https://m.media-amazon.com/images/I/812eo+ceFjL._AC_UL320_.jpg","4.5","1649","9.95","228"
"B097CHV5BZ","T Ball Set - Toddler Tball Set for Kids 3-5 with 23"" Batting Tee - Baseball Tee, 8 Soft Baseballs for Kids, Plastic Baseball Bat - Wiffle Ball Set, Outdoor Toys for Kids Ages 3-5 Years Old","https://m.media-amazon.com/images/I/614h49q9axL._AC_UL320_.jpg","3.8","238","17.99","228"
"B0154K459M","GoSports Soft Skin Foam Playground Dodgeballs - 6 Pack Set for Kids - Includes Mesh Carry Bag","https://m.media-amazon.com/images/I/81rGdfNjHNL._AC_UL320_.jpg","4.8","766","49.99","228"
"B07MZ6PZST","LAEGENDARY Tree Swing for Kids - Single Disk Outdoor Climbing Rope w/Platforms, Carabiner & 4 Ft Tree Strap - Playground Accessories - Multicolored","https://m.media-amazon.com/images/I/71DfryZ4WiL._AC_UL320_.jpg","4.8","5402","27.64","228"
"B082N5YV45","NERF MicroShots 6-Blaster Bundle - 6 Mini Dart-Firing Elite Blasters and 6 Official Elite Darts - for Kids, Teens, Adults (Amazon Exclusive), 1.73 x 16.5 x 10.98 inches","https://m.media-amazon.com/images/I/71kfJXy7kBL._AC_UL320_.jpg","4.6","2761","33.99","228"
"B004EIZRZ2","Intex 42"" Jumbo Beach Ball","https://m.media-amazon.com/images/I/71W3pPnCUOL._AC_UL320_.jpg","4.4","3986","8.15","228"
"B0BZW7QB83","Peekoal Reusable Water Balloons,12pcs Latex-Free Silicone Water Balloons,Water Bomb Refillable for Water Games Outdoor Summer Fun Party","https://m.media-amazon.com/images/I/71mu6JQtwyL._AC_UL320_.jpg","4.7","126","32.99","228"
"B0BGKRWK2Y","WICOTOO Sand Construction Kit,Sandbox,2.2lbs Magic Sand W/4 Take Apart Construction Trucks,Tower Crane,8 Sand Molds,4 Worker Figures,4 Road Signs,Toys for Boys Girls Age 4-8","https://m.media-amazon.com/images/I/81gPx0x-foL._AC_UL320_.jpg","4.5","113","27.88","228"
"B0BW83TD8Q","Inflatable Swan Pool Float with Colorful Lights, FlyfreeU Solar Powered LED Color Changing Swan Swim Tube Rings, 42'' Large Pool Beach Floaties Lake and Beach Floaty Summer Pool Raft Lounge for Adults","https://m.media-amazon.com/images/I/718CqHrM6vL._AC_UL320_.jpg","4.6","219","19.99","228"
"B00EVJU2VI","World Footbag Dirtbag Hacky Sack Footbag","https://m.media-amazon.com/images/I/51uXnvk09jL._AC_UL320_.jpg","4.6","2990","8.0","228"
"B079JRLL3X","Play22 Play Tent Princess Castle Pink - Features Glow in The Dark Stars - Portable - Kids Pop Up Tent Foldable Into A Carrying Bag - Indoor and Outdoor Use - Original","https://m.media-amazon.com/images/I/61CXxd1TmnL._AC_UL320_.jpg","4.5","4269","19.99","228"
"B005I62R6G","Skywalker Trampolines Wind Stakes – 4 Pack","https://m.media-amazon.com/images/I/81Coo6n2SeL._AC_UL320_.jpg","4.7","4920","7.43","228"
"B089CS1M3N","GINMIC Kids Explorer Kit & Bug Catching Kit, 11 Pcs Outdoor Exploration Kit for Kids Camping with Binoculars, Adventure, Hunting, Hiking, Educational Toy Gift for 3-12 Years Old Boys Girls","https://m.media-amazon.com/images/I/815BNakvhTL._AC_UL320_.jpg","4.6","1442","22.99","228"
"B09WMZL6L3","Avky Gel Balls Blaster Refill Ammo(7-8 mm, 3 Pack, 90000 Pieces), Water Balls Beads Bullets Made of Non-Toxic Eco Friendly Compatible with Electric Gel Balls Blaster","https://m.media-amazon.com/images/I/81Fq20+WaVL._AC_UL320_.jpg","4.6","912","9.99","228"
"B07MK5H9N2","Step2 Rain Showers & Unicorns Kids Water Tables, Outdoor Toddler Activity Table, Ages 2 – 10 Years Old, 12 Piece Water Toy Accessories, Blue & Purple","https://m.media-amazon.com/images/I/61P3guNqClL._AC_UL320_.jpg","4.8","7754","84.0","228"
"B0C3CD8SNC","V-Opitos 180 Pack Fort Building Kits for Kids Age 4, 5, 6, 7, 8+ Years Old, Creative STEM Building Toys for DIY Castles, Tunnels, Play Tent, Ideal Christmas, Birthday Gifts for Boys & Girls","https://m.media-amazon.com/images/I/71kt49NXWOL._AC_UL320_.jpg","5.0","7","69.99","228"
"B093FFB1SK","Koosh Double Paddle Playset -- Paddles and Ball for Added Koosh Fun! -- Fidget Toy -- For Ages 6+","https://m.media-amazon.com/images/I/61VkjXdtffL._AC_UL320_.jpg","4.6","525","12.95","228"
"B0BGX99YXB","MAGICYOYO K2 Crystal Black Yoyo Professional, Responsive Yoyo for Kids Beginners with Extra Unresponsive Yoyo Bearing, Pro Plastic Trick Yoyo for Adults+12 Yoyo Stings+Bearing Removal Tool+Storage Bag","https://m.media-amazon.com/images/I/717T5DsaYtL._AC_UL320_.jpg","4.5","421","15.81","228"
"B079QSZ8HD","Hape Sand and Beach Toy Watering Can Toys, Green","https://m.media-amazon.com/images/I/51PTIhh3u0S._AC_UL320_.jpg","4.7","1380","6.99","228"
"B09CBMLBP5","NERF Rival Pathfinder XXII-1200 Blaster, Most Accurate Rival System, Adjustable Sight, 12-Round Magazine, 12 Rival Accu-Rounds","https://m.media-amazon.com/images/I/61+5rr0dT4L._AC_UL320_.jpg","4.6","447","24.99","228"
"B071XMG1ZJ","#1 M-jump 3 Pack Colored Telescopic Butterfly Nets - Great for Catching Insects Bugs Fishing - Outdoor Toy for Kids Playing - Extendable from 6.8"" to 34""...","https://m.media-amazon.com/images/I/61Sq--8Hx6L._AC_UL320_.jpg","4.1","3245","8.99","228"
"B09FN956DY","SplatRball SRB400-SUB Gel Ball Water Bead Blaster Gun Kit. Splat R Ball Everything with The Electric Blaster able to Shoot up to 200fps! Splatter Gun","https://m.media-amazon.com/images/I/61izD2gj6gL._AC_UL320_.jpg","4.5","2921","39.39","228"
"B01N0Y6WSB","Gazillion 2 Liter Giant Solution, Multicolor","https://m.media-amazon.com/images/I/61x0XWR74aL._AC_UL320_.jpg","4.4","5117","7.99","228"
"B09WXTV7NB","Gel Blaster Balls, TedKat 120000Pcs 3Pack 7-8mm Gel Balls Ammo Compatible with Gel Blaster Water Blasters Splatter Gall Orbez (3PACK)","https://m.media-amazon.com/images/I/81xeJvSCt1L._AC_UL320_.jpg","4.6","263","9.98","228"
"B07PNJZPZC","NERF Elite Dart Rover- Picks up 100 Darts!","https://m.media-amazon.com/images/I/71YCLIpL4nL._AC_UL320_.jpg","3.9","2973","26.25","228"
"B07VNKDHKM","RongFa Teepee Tent for Kids-Portable Children Play Tent Indoor Outdoor (White)","https://m.media-amazon.com/images/I/71kVYXB-A7L._AC_UL320_.jpg","4.5","305","31.99","228"
"B0BCP2JJXG","X-Shot Fast-Fill Water Blaster by ZURU, Watergun for Summer, XShot Squirt Gun Soaker (Fills with Water in just 1 Second!) Big Water Toy for Children, Boys, Teen, Men (Medium)","https://m.media-amazon.com/images/I/81APhIL+NbL._AC_UL320_.jpg","4.6","3044","11.99","228"
"B08R64RX18","LURLIN Shooting Game Toy for Age 6, 7, 8,9,10+ Years Old Kids, Boys - 2pk Foam Ball Popper Air Guns & Shooting Target & 24 Foam Balls - Ideal Gift - Compatible with Nerf Toy Guns…","https://m.media-amazon.com/images/I/71K9MI3WtJL._AC_UL320_.jpg","4.4","1612","29.99","228"
"B07TS587LF","GIFTEXPRESS 48 Pcs Mini Star Bubble Wands, Assortment Color, Perfect Wand Bubble for Wedding Favor, Anniversaries, Party Favors, Birthday Party, Bubbles Fun Toys for Girls and Boys","https://m.media-amazon.com/images/I/71PJBvYsbzL._AC_UL320_.jpg","4.5","995","12.99","228"
"B071DTDL61","Duncan Toys Limelight LED Light-Up Yo-Yo, Beginner Level Yo-Yo with LED Lights, Clear and Blue","https://m.media-amazon.com/images/I/91hMoTm3aTL._AC_UL320_.jpg","4.5","908","10.09","228"
"B01FVVKXEA","Little Tikes Easy Score Basketball Set, Pink","https://m.media-amazon.com/images/I/81bmggKOALL._AC_UL320_.jpg","4.8","8635","19.99","228"
"B014F03ZA2","G & F Products G & F 10041 JustForKids Kids Wheel Barrel made of real metal kids size","https://m.media-amazon.com/images/I/71dhV3JXkdL._AC_UL320_.jpg","4.5","2664","22.88","228"
"B0BR4XQ9SM","Bubble Gun for Kids and Toddlers Bubble Machine with 1 Bubble Solutions (90ml) Automatic Bubble Maker for Children Outdoor Bubbles Toys","https://m.media-amazon.com/images/I/71VCEVhWVEL._AC_UL320_.jpg","4.4","551","9.99","228"
"B0821N2C12","Hapinest Turtle Steps Balance Stepping Stones Obstacle Course Coordination Game for Kids and Family - Indoor or Outdoor Sensory Play Equipment Toys Toddler Ages 3 4 5 6 7 8 Years and Up","https://m.media-amazon.com/images/I/71zs0IkSuPL._AC_UL320_.jpg","4.8","2609","39.98","228"
"B07Q1JRWG2","Champion Sports Playground Ball Set: Six Large Rhino Skin Soft Inflatable Balls for Kids Outdoor & Backyard Games, School & Gym Class","https://m.media-amazon.com/images/I/81vOdG8kO6L._AC_UL320_.jpg","4.4","1203","29.99","228"
"B08ZL7L6QS","Botabee | 5"" Mini Basketball Balls - Small Inflatable Balls for Boys and Toddler - Toy Accessories Gifts for Mini Hoop Games - PVC Made - Suitable for Bedroom, Play Room, Indoor/Outdoor Play (3 Pack)","https://m.media-amazon.com/images/I/81Ss3NUHXUL._AC_UL320_.jpg","4.5","1078","13.99","228"
"B00WQ5KMU0","US Toy Inflatable Surf Board Luau Decoration Theme Beach Pool Toy - 3 Feet Long","https://m.media-amazon.com/images/I/61bGlyyjYDL._AC_UL320_.jpg","3.7","442","6.89","228"
"B0C3YSX43W","Bath Toys,Bath Basketball Hoop for Toddlers,Bathtub Basketball Hoop for Kids,Strong Suction Cup Basketball Hoop & 4 Soft Balls Set for Boys Girls,Shower Toys for Kids Ages 4-8.","https://m.media-amazon.com/images/I/71gYo+WEtGL._AC_UL320_.jpg","4.5","28","7.95","228"
"B088VPSF4P","Mini Crayon Bubbles for Kids (Pack of 24) Bulk Bubble Wand Bottles in Assorted Crayons Shapes and Colors, Non-Toxic Blowing Bubbles Party Favors for Kids, Outdoor Novelty Summer Toy (0.5 Oz)","https://m.media-amazon.com/images/I/81iWe3AKsJL._AC_UL320_.jpg","4.3","1767","9.89","228"
"B09MFPNGLL","Kids Basketball Hoop for 1 2 3 4 5 6 Year Old Stand Adjustable Height 3.5ft-5.5ft Toddler Indoor Mini Basketball Hoops Goal Ball Games Toys for Girl Boy Age 1-3 2-4 3-5","https://m.media-amazon.com/images/I/714D9pQn98L._AC_UL320_.jpg","4.3","743","41.98","228"
"B08DTDMRGD","PigPigPen 3 in 1 Kids Play Tent with Tunnel, Ball Pit, Basketball Hoop for Boys & Girls, Toddler Pop Up Playhouse Toy Baby Indoor/Outdoor, Gift Year Old Child (3 Tent)","https://m.media-amazon.com/images/I/81p7fBpYsKL._AC_UL320_.jpg","4.5","2463","39.99","228"
"B0C4Y92WK5","ShyLizard Boys Toy Gifts for 3 4 5 6 7 8 Years Old, Kids Basketball Hoop Adjustable Height 3.5FT-6.2FT, Mini Basketball Hoop for Kid Boys, Basketball Goal Toys Outdoor Indoor Game Gifts for Boys","https://m.media-amazon.com/images/I/71fFBY9mnmL._AC_UL320_.jpg","4.1","19","38.99","228"
"B09QFJXTJZ","YUJUN Gem with Treasure Pirate Chest Box Summer Underwater Acrylic Gemstones Set","https://m.media-amazon.com/images/I/71El1nswApL._AC_UL320_.jpg","4.0","641","5.99","228"
"B0CF9JJKT8","OSALON Laser Tag Guns Set of 2 with Digital LED Score Display Vest Multi-Functional Laser Tag Fun Indoor&Outdoor Toys for Kids Ages 8 9 10 11 12+ Years Old Boys Girls Teens Adults Birthday Gift","https://m.media-amazon.com/images/I/81-XX3eZuvL._AC_UL320_.jpg","4.8","45","26.99","228"
"B07G98QSS4","Aqua Luxury Water Pool Lounge – Extra Large – Inflatable Pool Floats for Adults with Headrest, Backrest, Footrest & Cupholder – Multiple Colors/Styles","https://m.media-amazon.com/images/I/81jSd7XJayL._AC_UL320_.jpg","4.4","6904","37.85","228"
"B0C532BGFM","IREMATE 1 Pack Airplane Toys for Boys LED Foam Glider Flight Plane Toy 1 Launcher Outdoor for 5 6 7 8 Year Old Boy Girls Birthday Gift Christmas Easter Thanksgiving Day Gift (1+1)","https://m.media-amazon.com/images/I/71mjykkHrKL._AC_UL320_.jpg","4.3","30","16.99","228"
"B000KHZ044","Intex Inflatable Lounge Pool Recliner Lounger Chair with Cup Holders","https://m.media-amazon.com/images/I/61jV-F6gFcL._AC_UL320_.jpg","4.5","17661","25.46","228"
"B091GH44TL","JOYIN Big Bubble Wands Set Bulk for Kids Summer Outdoor Activity Party Favors, 18 Pcs Giant Bubble Maker with Tray, 12"" Large , 6 Pcs Bubble Solution Suitable for All Age People","https://m.media-amazon.com/images/I/8117s2tbtyL._AC_UL320_.jpg","4.6","1059","16.99","228"
"B093KY7VGL","MUYIZI Mesh Bag for Holding Beach Shell,Toys (Blue&Yellow&Orange 3pack) Shell Collecting Bags for Kids, for Picking Up Shells","https://m.media-amazon.com/images/I/81U47OnAB8L._AC_UL320_.jpg","4.8","2423","12.98","228"
"B083W788TN","LAYCOL Baby Swimming Float Inflatable Baby Pool Float Ring Newest with Sun Protection Canopy,add Tail no flip Over for Age of 3-36 Months","https://m.media-amazon.com/images/I/614e4hp9soL._AC_UL320_.jpg","4.4","16159","26.99","228"
"B0BGF46RDX","Swiss Activa+ Infinity Hoop Smart Weighted Hula Hoop - Smart Hula Hoop Fit- Exercise Hoola Hoop Exercise Equipment- Adult Hula Hoops for Exercise- Hula Hoops for Women Weight Loss","https://m.media-amazon.com/images/I/61DXNrnUqNL._AC_UL320_.jpg","4.1","2593","49.95","228"
"B07571THRT","ToysOpoly Premium Playground Balls 8.5 Inch, Best Kickball Dodgeball for Kids and Adults - Official Size for Dodge Ball, Handball, Square Game, Camps, Picnic, Church & School + Free Pump & Mesh Bag","https://m.media-amazon.com/images/I/91fapAtxO5L._AC_UL320_.jpg","4.6","4394","22.95","228"
"B07PQHSZPR","Climbing Rope with Platforms and Disc Swing Seat Set Playground Accessories Including Bonus Hanging Strap & Carabiner","https://m.media-amazon.com/images/I/617KjzCI1kL._AC_UL320_.jpg","4.7","4005","34.99","228"
"B08R35HW57","Outdoor Indoor Bean Bag Toss Game for Toddlers - Fun Birthday Holiday for Kids Ages 2-4 by SISLAND","https://m.media-amazon.com/images/I/71SbUbxb-4L._AC_UL320_.jpg","4.5","763","21.0","228"
"B087Z2FJF9","Pool Floats Adult Inflatable Chair Floats with Cup Holders & Handles - Happy Colorful Pool Floaties - Pool Float Comes in 2 Fun Colors, Blue & Yellow,","https://m.media-amazon.com/images/I/81WAqdAuQRL._AC_UL320_.jpg","4.3","2374","34.99","228"
"B07HCFZ91W","Eocolz Kids Ball Pit Large Pop Up Childrens Ball Pits Tent for Toddlers Playhouse Baby Crawl Playpen with Basketball Hoop and Zipper Storage Bag, 4 Ft/120CM, Balls Not Included (Blue)","https://m.media-amazon.com/images/I/61XaUg5gsNL._AC_UL320_.jpg","4.5","6932","18.99","228"
"B00B0DWB8U","Little Tikes Easy Store Jr. Picnic Table with Umbrella - Blue / Green","https://m.media-amazon.com/images/I/71PLgAFfNoL._AC_UL320_.jpg","4.7","3579","70.99","228"
