"asin","title","imgUrl","stars","reviews","price","category_id"
"B0C23JKLS6","YIQUDUO Gel Balls Blaster Ammo 7-8mm(5 Pack,150000 Pcs), Water Balls Beads Refill Ammo for Splatter Ball Blaster, Gel Bullets for Splat Ball Blaster, Made of Non-Toxic Eco Friendly Water Beads","https://m.media-amazon.com/images/I/81bxJFeH4XL._AC_UL320_.jpg","4.6","42","14.99","228"
"B07R7NGN82","Carnival Toss Games with 3 Bean Bag, Fun Carnival Game for Kids and Adults in Carnival Party Activities, Great Carnival Decorations and Suppliers (Clown)","https://m.media-amazon.com/images/I/81Fv3EHs8sL._AC_UL320_.jpg","4.2","944","14.99","228"
"B0C784MYRC","Automatic Bubble Machine Gun - Outdoor Toys for Toddlers 1-3 & Kids 4-8| Bubble Blower & Maker | 10,000+ Bubbles/Min | Parties & Backyard Bubble Toys | Birthday Gifts for Boys & Girls","https://m.media-amazon.com/images/I/71UJo0ue-WL._AC_UL320_.jpg","4.7","22","17.99","228"
"B00YHGXT6K","LCR - Left Center Right Dice Game - 2 Sets - (Assorted Color Chips)","https://m.media-amazon.com/images/I/61Xsq7Q0WlL._AC_UL320_.jpg","4.8","1149","13.49","228"
"B09ST4N23Y","EocuSun Pop Up Play Tent, Ball Pit Play Tent Kids Playhouse for Indoor and Outdoor, Foldable Tent for Kids Girls & Boys Toys (Balls Not Included) (Multicolor)","https://m.media-amazon.com/images/I/71NCB7nLlkL._AC_UL320_.jpg","4.4","101","23.99","228"
"B07QC4LKDG","Bundaloo Infant Pool Splash Mat Inflatable with Backrest & Stackable Ring Toys | Summer Fun Activity for Baby Toddlers | Easy Setup","https://m.media-amazon.com/images/I/61kTaMgVZLL._AC_UL320_.jpg","4.0","270","12.99","228"
"B07Z18Y5XX","Win SPORTS 3 in 1 Carnival Outdoor,Combo Games Set,Soft Plastic Cones,Cornhole Bean Bags,Ring Toss Game,Kids Birthday Party Outdoor Games Supplies 26 Piece Set","https://m.media-amazon.com/images/I/71OawR0wg7L._AC_UL320_.jpg","4.5","893","18.99","228"
"B06Y6JQCW3","Nightball Soccer Ball LED Light Up Ball - Glow in The Dark Glow Ball Soccer Ball Gifts - Orange Teal Outdoor and Indoor Soccer Ball - Gifts for Teenage Boys - Gift for Teen","https://m.media-amazon.com/images/I/61ddg1-bImL._AC_UL320_.jpg","4.3","51","29.31","228"
"B093268NTC","ArtCreativity Water Squirters for Kids, Set of 12, 5.5 Inch Blaster Toys for Swimming Pool, Beach, and Outdoor Summer Fun, Cool Birthday Party Favors for Boys and Girls","https://m.media-amazon.com/images/I/61wVnAXlM5S._AC_UL320_.jpg","3.8","678","18.99","228"
"B0948SXYTK","TOY Life Butterfly Kite for Kids Easy to Fly Large Kids Kite 2 Pack- Kites for Kids and Adults Easy to Fly Big Beach Kites for Kids age 4-8-12 Idea Gift for Children Outdoor Game Activities Beach Trip","https://m.media-amazon.com/images/I/71lQf-rEG-L._AC_UL320_.jpg","4.1","629","18.99","228"
"B07VRXBMQ3","2 Pack Pink Swings Seats Heavy Duty 66 Inches Chain Plastic Coated - Playground Swing Set Accessories Replacement with Snap Hooks (Pink)","https://m.media-amazon.com/images/I/619rZj8iSzL._AC_UL320_.jpg","4.8","396","42.99","228"
"B07R8VYG81","WAREMAID Heavy Duty 360° Swivel Swing Hanger, Stainless Steel Swing Hook for Ceiling Wooden Porch Swing Hanging kit Playground Gym Rope Boxing Bag Hammock Chair Yoga Mount 1000 lb Capacity","https://m.media-amazon.com/images/I/61S2AfGvZGL._AC_UL320_.jpg","4.7","1347","14.89","228"
"B0BJSZ8QWW","Duckura Kids Gardening Tools Set, Gardening Set for Kids, Outdoor Backyard Farm Digging Toys, Shovel, Rake, Trowel, Fork, Toddler Halloween Birthday Gifts for Boys Girls Age 3+ Years Old(23pcs)","https://m.media-amazon.com/images/I/81hF90DgHmL._AC_UL320_.jpg","4.8","69","25.99","228"
"B0897J79NY","JOYIN 2 Bubble Guns for Kids with 4 Bottles Bubble Solutions (7 oz), Bubble Maker with Music and Light, Bubble Machine Party Favors, Summer Outdoor Toys for 3 4 5 + Year Old Boys Girls Toddler","https://m.media-amazon.com/images/I/71LV4J7NOuL._AC_UL320_.jpg","4.2","926","11.99","228"
"B0BT9YZWX8","Donut Bubble Wands for Kids Lollipop Candy Land Party Favors Donut Party Favors Goodie Bag Stuffers 24 pcs Small Bubbles for Kids","https://m.media-amazon.com/images/I/71UsHxqvW-L._AC_UL320_.jpg","4.6","13","13.99","228"
"B0BTY33KMY","Zcaukya 65"" Giant Inflatable Wheel Roller, Colorful Water Rolling Wheel Float for Kids Summer Swimming Pool Parties, Rolling on The Lawn, Indoor Outdoor Fun Toys for Games Supplies","https://m.media-amazon.com/images/I/917X7g018vL._AC_UL320_.jpg","3.9","52","38.99","228"
"B096WRMMJR","Water Guns for Kids, Outdoor Water Toys - Shoot Up to 40 Feet, Squirt Gun Pool Toys for 4, 5, 6, 7, 8, 9, 10 Years Old Boys, Water Blasters for Kids and Adults (6 Pack)","https://m.media-amazon.com/images/I/81YK+7oXDlS._AC_UL320_.jpg","4.3","367","16.99","228"
"B0C2Z3BPW1","CLYCTIP Kids Sand Toys,Beach Toys for Kids,Collapsible Beach Bucket, Sand Toy with 2 Beach Bucket, 3 Shovel Rake,10 Sand Molds,1 Mesh Bag,1 Travel Bag.Sand Toys for Toddlers","https://m.media-amazon.com/images/I/71IpWoiQ-aL._AC_UL320_.jpg","4.8","39","17.59","228"
"B0BZTDG64R","Hot Wheels '70 Dodge Hemi Challenger, Muscle Mania 4/10 [Green] 123/250","https://m.media-amazon.com/images/I/71IEU2CkmmL._AC_UL320_.jpg","4.7","9","7.99","228"
"B0BRSQW552","Serrelim Bug Catcher Kit for Kids, Kids Outdoor Explorer Kit with Bug Collector, Whistle, Compass, Magnifying Glass, Bug Catching Kit Toy for Kids Age 3 4 5 6 7","https://m.media-amazon.com/images/I/71r7EYNr9SL._AC_UL320_.jpg","4.6","56","23.59","228"
"B0CBVT7S52","Plencell Squirt Guns,Water Gun Toy,Kids Squirt Gun,Squirt Guns for Kids,Pool Squirt Toys,Pool Water Gun,Ranges up to 40 feet,Outdoor Water Toys for Kids","https://m.media-amazon.com/images/I/61FdNVP3RXL._AC_UL320_.jpg","4.8","19","14.99","228"
"B09NS7WQT1","6 Pcs Inflatable Pool Float Tube Transparent Swimming Ring with Colorful Glitters Pool Floats Kids Adults Inflatable Flotation Transparent Inflatable Inner Tube for Swimming Pool, Beach","https://m.media-amazon.com/images/I/915-DG0Kj3L._AC_UL320_.jpg","4.3","16","32.99","228"
"B0BQQKQXSL","Jasonwell Floating Island Pool Float - Inflatable Lake Floaties Pool Lounger Raft Water Float with Cupholders Lake River Pool Floating Big Multi Person Party Floatie Toys Relaxation Island Adults Kids","https://m.media-amazon.com/images/I/71qRjQ1NHZL._AC_UL320_.jpg","4.1","141","49.99","228"
"B0C1VC7FDK","Yunaking Bubble Gun Bubble Machine Automatic Bubbles Refills Solution,Bazooke Bubble Gun for Kids Bubble Blower Maker, Bubble Machine Gun Toddler Outdoor Toys for Adults Wedding Birthday Parties Gifts","https://m.media-amazon.com/images/I/81CizqOnUTL._AC_UL320_.jpg","4.6","30","19.99","228"
"B01AD1TZ7E","Melissa & Doug Sunny Patch Splash Patrol Sprinkler Toy With Hose Attachment","https://m.media-amazon.com/images/I/71H-eu8PBrL._AC_UL320_.jpg","4.3","2530","9.96","228"
"B000PTZMKO","Pacific Play Tents 19790 Kids Tree House Bed Tent Playhouse - Twin Size","https://m.media-amazon.com/images/I/71gnRBF8RWL._AC_UL320_.jpg","4.6","8905","42.99","228"
"B0B5X4W2QC","Door Swing for Kids,Indoor Pull up bar for Adults,Doorway Swing Kids with 4pcs,Indoor Doorway Gym Set for Kids and Adults-Sensory Swing","https://m.media-amazon.com/images/I/71xY4rzVcrL._AC_UL320_.jpg","4.2","62","89.99","228"
"B09Q82C8RR","Duckura Kids Bow and Arrow Set - Outdoor Indoor Games Activities for Kids, Archery Set with 40 Foam Darts & Target, Halloween Birthday Party Gifts Toys for Boys & Girls Age 3 4 5 6 7 8-12 Years Old","https://m.media-amazon.com/images/I/71xIQSEYTjL._AC_UL320_.jpg","4.1","229","12.98","228"
"B08HMJH1LY","Mermaid Tail Toss Game Banner with 3 Bean Bags - Blue Ocean Theme Bean Bag Game Sets Party Games for Kids Birthday Party Favors Under The Sea World Party Supplies Outdoor Yard Game","https://m.media-amazon.com/images/I/71CnKpi1ASL._AC_UL320_.jpg","4.2","270","9.99","228"
"B000KA4OWU","Champion Sports Catch A Ball Set: Classic Kids Outdoor Party Game for Lawn, Camping & Beach","https://m.media-amazon.com/images/I/61T2chW3YGL._AC_UL320_.jpg","4.4","306","25.39","228"
"B08LBKVWWH","Superhero Themed Toss Games Banner with 6 Bean Bags-Fun Superhero Indoor Outdoor Throwing Game Party Supplies for Kids in Family Games,Superhero Themed Party,Carnival Games、Birthday Party Supplies","https://m.media-amazon.com/images/I/81L5fbCsUKL._AC_UL320_.jpg","4.4","825","12.99","228"
"B00BXVHZ7Q","Swimline Beach Balls for Kids Toddlers and Adults Up to 24 36 Inch Large Sizes Easy Fun Design Classic Rainbow Emoji for Pool Beach Lake Volleyball Inflatable Toys Outdoor Games Summer Water Party","https://m.media-amazon.com/images/I/71+yQUGOR4L._AC_UL320_.jpg","4.0","356","10.77","228"
"B07DM5LBK5","Kiddie Play Toy Basketball Hoop Arcade Game Indoor Sports Toys for Kids","https://m.media-amazon.com/images/I/81iDYEaCaBL._AC_UL320_.jpg","4.3","2038","39.89","228"
"B09ZP4HR3Q","2PCS Inflatable Stick Horse - Inflatable Horse Head on Stick Horse Costume Pony / Halloween / Western Cowboy / Horse Baby Shower Birthday Party Decorations Supplies Favors , 37 Inches (Red)","https://m.media-amazon.com/images/I/51R-FS9QVRL._AC_UL320_.jpg","3.9","61","9.99","228"
"B014KOHYRS","INTEX 57114EP Mushroom Baby Pool: Built-In Mushroom Shade – Soft Inflatable Floor – Durable Vinyl – Ages 1-3 – 40"" x 35""","https://m.media-amazon.com/images/I/71J3yrkAeNL._AC_UL320_.jpg","4.6","3785","14.99","228"
"B09N3BWZHJ","Dylan's cabin Gender Reveal Soccer Ball - Pink and Blue Powder Kit for Baby Boy Girl Gender Reveal Party Supplies","https://m.media-amazon.com/images/I/71DyfzsRLoL._AC_UL320_.jpg","4.3","106","16.98","228"
"B0C52PSRG3","Junbig Inflatable Pool Floats, Solar Powered Large Swan Pool Float Adult, LED Color Changing Swan Floaties for The Pool, 42'' Lake Floats for Adults in Summer Outdoor Seaside, Lake, Pool","https://m.media-amazon.com/images/I/71B+bJAGf4L._AC_UL320_.jpg","4.6","63","23.99","228"
"B0B4W4Y7WX","MAGICYOYO Professional Yoyo Responsive Yoyo V3, Metal Yoyo for Kids Beginners Alloy Yo yo for Adults with Unresponsive Yoyo Bearing + Bearing Kit + Yoyo Storage Bag + 12 Yoyo Strings (Black Red)","https://m.media-amazon.com/images/I/71lUhG7CWcL._AC_UL320_.jpg","4.7","213","20.99","228"
"B09B22M8GX","Max Fun 25Pcs Sand Molds Beach Toys Snowball Maker Tool Winter Snow Toys Kit with Handle for Snow Ball Shapes Maker Fights Duck for Kids Toddlers Adults Outdoor Snow Sand Molds","https://m.media-amazon.com/images/I/81WTgBo1KoL._AC_UL320_.jpg","4.6","791","19.99","228"
"B07R1NS8TG","NERF Elite Goggles, Transparent/Clear Impact-Resistant Tactical Eyewear, for use Blaster - Stay Prepared & Protected for Battle - One Size Fits All","https://m.media-amazon.com/images/I/81aF0WhYBdL._AC_UL320_.jpg","4.6","863","18.99","228"
"B0BWX7TBP7","Soccer Ball Size 2,3,4 Cartoon Mini Ball Outdoor Toys for Kids Ages 4-8 Boys Girls Sports & Outdoor Play Toys for 3 4 5 6 7 8","https://m.media-amazon.com/images/I/71WoFWPmTRL._AC_UL320_.jpg","4.0","13","19.99","228"
"B006PZ0QW6","AppleRound Green Horse Hopper, Pump Included (Inflatable Jumping Horse, Space Hopper, Ride-on Bouncy Animal)","https://m.media-amazon.com/images/I/71NNlTVQMUL._AC_UL320_.jpg","4.7","1696","19.6","228"
"B09CM2TMTV","BooTaa 4 Pack LED Light Airplane,17.5"" Large Throwing Foam Plane,2 Flight Mode Glider,Flying Toy for Kids,Gifts for 3 4 5 6 7 8 9 Years Old Boy,Outdoor Sport Toys Birthday Party Favors Foam Airplane","https://m.media-amazon.com/images/I/71SDA0L3BqL._AC_UL320_.jpg","4.5","181","19.99","228"
"B0006MY7CY","Swimline Speedboat Inflatable Kids Float, Red, 45""/25""/10""","https://m.media-amazon.com/images/I/71XC681sQ6L._AC_UL320_.jpg","4.1","1283","14.86","228"
"B0C1V9YGBT","Ksheat Large Inflatable Swan Pool Floats Adults with Color Changing LED Solar Lights, Pool Float Raft Lounger Inflatable Ride-ons with Cup Holder, Beach Lake Floaties Pool Light Party Decor Relaxation","https://m.media-amazon.com/images/I/71+u6F5fWOL._AC_UL320_.jpg","4.6","58","43.99","228"
"B09Y53WNHC","Little Valentine 2 Pack 15-Dart Quick Reload Clip for Nerf Ultra Series，Compatible Only with Nerf Ultra Darts","https://m.media-amazon.com/images/I/61sdrIcVzkL._AC_UL320_.jpg","4.0","146","16.99","228"
"B0BPXX38RC","Splash Pad for Kids and Dogs, 95"" Extra Large Splash Pad for Toddlers 1-3 and Kids Ages 4-8, Non Slip Thicken Sprinkler Dog Pool Summer Outdoor Water Toys for Backyard","https://m.media-amazon.com/images/I/81fy2g9IgbL._AC_UL320_.jpg","4.2","1721","49.99","228"
"B0BNKS91J9","CHESNIEW Unicorn Bouncy Horse, Toddler Girl Bouncing Animal Plush Toy, Outdoor Indoor Ride-on Inflatable Bouncer for Birthday Gifts 2 3 4 5 Year Old Boys Girls (Pink)","https://m.media-amazon.com/images/I/611V5rjTvmL._AC_UL320_.jpg","4.4","69","31.99","228"
"B01E2WVO60","5-Piece Princess Castle Girls Pop Up Play Tent & Dress Up Costume Bundle - Playhouse Gift for Girls & Toddler for Indoor & Outdoor Use with Pink Fairy Tale Carrying Bag & Glow in The Dark Stars","https://m.media-amazon.com/images/I/71nsUMP0oHL._AC_UL320_.jpg","4.6","5720","29.95","228"
"B092YZFTWK","JANADIO Water Balloon Launcher 500 Yard Long Range,3 Man Slingshot with 500 Biodegradable Water Balloons ,Giant Slingshot T-Shirt Launcher Cannons,Party Game Yard Toys for Kids and Aldults","https://m.media-amazon.com/images/I/71KmOFiAHGS._AC_UL320_.jpg","4.0","131","22.94","228"
"B098NJZGMH","JOYIN Halloween New Frame Toss Game Board with Bean Bag，Party Favor Supplies, Beach Yard Outdoor Activities, Games Pack and Decoration for Kids","https://m.media-amazon.com/images/I/81ANZMn5E3L._AC_UL320_.jpg","4.6","92","21.99","228"
"B07SJZ89WC","Party Supplies Compatible with Nerf-Included Face Mask Tactical Glasses 200 Foam Bullets for Two Teams Durable Birthday Party War Favors Guns","https://m.media-amazon.com/images/I/71PZXN2L5UL._AC_UL320_.jpg","4.6","1002","25.95","228"
"B0B99V1QMB","iBabify Kids Play Tent with Dinosaur Projection Flashlight, Roar Button Dinosaur Sound Effect, Pop Up Kids Tent for Boys, Dinosaur Toys Playhouse","https://m.media-amazon.com/images/I/81l34ZdjSnL._AC_UL320_.jpg","4.5","239","29.99","228"
"B09NNL4K4R","Civaner 20 Pieces Mini Inflatable Balls Baseball Beach Float Ball Basketball Soccer Mini Hoop Ball Pool Ball Toys for Kids Summer Sports Game Party Supplies, 4 Inches (Soccer Style)","https://m.media-amazon.com/images/I/717kNc2z7IL._AC_UL320_.jpg","4.3","132","18.99","228"
"B08R5QF9LP","AESGOGO 4 Pack Kids Squirt Water Guns, Water Pistol for Toddlers, 220CC Soaker Blaster Outdoor Water Toys for 3 4 5 6 7 8 Year Old Boys Girls Beach Pool Yard Summer Fun.","https://m.media-amazon.com/images/I/713y0DuvHrL._AC_UL320_.jpg","4.1","536","12.99","228"
"B076BQRPJT","Leberna Large Beach Bag with Zipper Lightweight Beach Toy Bag Mesh Bag for Swimming Pool Sand Toys","https://m.media-amazon.com/images/I/71TKsMHvUfL._AC_UL320_.jpg","4.7","1093","12.2","228"
"B07W43C1ZS","DIY Kites for Kids Kite Making Kit Bulk, Decorating Coloring Kite Party Pack,White Diamond Kite Kits (6 Pack)","https://m.media-amazon.com/images/I/613s13XY3qL._AC_UL320_.jpg","4.2","3052","19.99","228"
"B0BCQRWZMR","NERF Spiral Grip Football - Junior and Mini Sizes - Patented Spacelace for Ultimate Spirals - Machine Stitched Construction - Pump Included","https://m.media-amazon.com/images/I/81TNoNOr-0L._AC_UL320_.jpg","4.4","109","18.51","228"
"B007LX889E","AppleRound Blue Horse Hopper, Pump Included (Inflatable Space Hopper, Jumping Horse, Ride-on Bouncy Animal)","https://m.media-amazon.com/images/I/71yba3chXeL._AC_UL320_.jpg","4.6","4592","22.6","228"
"B097PPCSQK","Dinoera Dinosaur Toys Shooting Targets Game Toys for Kids Age of 4 5 6 7 8 9 10+ Year Old, 2 in 1 Gun Games for Kids, Foam Ball Popper Air Gun Set Compatible with Nerf Toys, Birthday Gifts Boys Girls","https://m.media-amazon.com/images/I/81hA5UK2dgL._AC_UL320_.jpg","4.5","851","39.99","228"
"B077M44HZ9","Guillow 6 Jetfire Balsa Wood Toy Flying Airplanes Made in USA","https://m.media-amazon.com/images/I/510xI0EQiaL._AC_UL320_.jpg","4.5","221","24.47","228"
"B00CW9AOIK","Atomic Power Popper 12X Foam Ball Blaster - Rapid Fire Pump Shoots Up to 12 Foam Balls - Great Toy Gift for Kids and Teens - Ages 4+","https://m.media-amazon.com/images/I/718wLRXSjZL._AC_UL320_.jpg","4.4","1362","17.97","228"
"B099WNDX5C","Swing Set for Backyard, 440lbs, Heavy-Duty A-Frame Metal Outdoor Stand, 1 Saucer Swing Seat & 1 Swings Seat","https://m.media-amazon.com/images/I/6155vHFIbbL._AC_UL320_.jpg","4.3","354","155.99","228"
"B0BKTQV5P7","JOYIN 14.6"" Big Bubble Wand Set(18 Pack 9 Colour) with Concentrated Bubble Solution Refills, Giant Bubble Wands Toy for Kids Birthday Summer Toy Party Favors, Outdoor Activity Bathroom Bath Toys","https://m.media-amazon.com/images/I/813r1qjjWTL._AC_UL320_.jpg","4.7","83","19.99","228"
"B085H35QPM","KESS Ice Hopper, Ankle Jumping Ball, Toy Hopper Ball, Glitter Skip Ball, Improve Coordination & Exercise in a Fun Way, Great Gift for Birthdays & Party Favors, Color May Vary","https://m.media-amazon.com/images/I/71aKwgjiQVL._AC_UL320_.jpg","3.9","55","10.69","228"
"B0C7K4SQP8","Electric Water Gun, Super Soaker Water Gun with Dual Shooting Mode, Water Blaster with Long Range 32 Ft, Squirt Guns for Kids Ages 8-12 - 650ML Large Capacity, Powerful Water Gun for Kids and Adults","https://m.media-amazon.com/images/I/81ZVxTjOL1L._AC_UL320_.jpg","4.5","33","16.99","228"
"B09WT9H72J","Water Balloon Launcher,2-3 Person Water Slingshot Giant Sling Shot T-Shirt Launcher Cannons Party Game Yard Toys Outdoor Game for Kids and Adults Yellow","https://m.media-amazon.com/images/I/61ILcxogfiL._AC_UL320_.jpg","3.9","64","15.99","228"
"B0BRR731YH","100ft /120ft /150ft Zip Line Kit for Kids and Adult Up to 330 lb with Zipline Spring Brake and Safety Harness, Zip line Trolley with Handle and Thickened Seat,for Backyard Playground Entertainment","https://m.media-amazon.com/images/I/81FC11X1HhL._AC_UL320_.jpg","4.4","1178","169.99","228"
"B00VLX2MGA","MAGICYOYO Unresponsive Metal Yoyo T5 Overlord Professional Yo-Yos Ball with 5 Strings Yo yo Gloves with Yo-yo Bag Red","https://m.media-amazon.com/images/I/61KK9xL8yKL._AC_UL320_.jpg","4.2","684","13.99","228"
"B08YXX6M4M","Plastic Base Ball bat -P","https://m.media-amazon.com/images/I/71xQ0PpnLML._AC_UL320_.jpg","4.6","351","26.99","228"
"B0BTSKGVF3","Tounature 3 Pieces Inflatable Fruit Pool Floats Inflatable Tube Pool Tube Watermelon Orange Lemon Swimming Rings Floaties and 3 Pieces Inflatable Beach Ball for Summer Party Supplies","https://m.media-amazon.com/images/I/71aL5-vdXUL._AC_UL320_.jpg","4.2","12","6.99","228"
"B0C365RM8M","Electric Gel Ball Blaster Gun Orbeez Gun Automatic Splat Guns, M416 Gel Guns for Adults & Kids Orbe Gun, Outdoor Activities Shooting Team Game, Kids Toy for Ages 6+, Blue","https://m.media-amazon.com/images/I/71UJGgFPYTL._AC_UL320_.jpg","4.1","142","33.99","228"
"B0C7BJ84GG","Flying Orb Ball, Flying Spinner Mini Drone Hover Ball Cosmic Globe, Flare Effect Floating Boomerang Ball, Galactic Levitating Fly Orb Magic UFO Toy, Cool Stuff Gift For 6+ Kids Teens Indoor Outdoor","https://m.media-amazon.com/images/I/81EO8bfublL._AC_UL320_.jpg","4.3","32","32.0","228"
"B0B9S16Q6S","32 Pieces Pow Inflatable Baseball Bats 20 Inch Inflatable Toy Bat for Kids Baseball Party Decorations Favors Carnival Birthday Party Supplies Prizes Sports Theme Party Toys, 4 Colors","https://m.media-amazon.com/images/I/81Kjy9Jvk5L._AC_UL320_.jpg","4.1","24","35.99","228"
"B07J9VFQ2N","Liberty Imports Replacement Sticky Balls for Toss and Catch Sport Game (Hook and Loop) Refill Pack 1 Dozen Bulk (Set of 12)","https://m.media-amazon.com/images/I/71bMBB1FphL._AC_UL320_.jpg","4.4","210","14.97","228"
"B072JR8B9G","SWIMLINE Inflatable Floating Mattress Pool Float Lounger Series for Swimming Pool | Comfortable Large Style Base | for Kids Adults Summer Beach Party Relax Rafts |Tanning Floaty Fun Heavy Duty Floats","https://m.media-amazon.com/images/I/71yNiceIUBL._AC_UL320_.jpg","4.5","917","8.84","228"
"B0C5R1QS4S","Bubble Machine, Veoiuo Cute Octopus Automatic Bubble Blower, 10000+ Bubbles Per Minute Bubbles for Kids Age 3 4 5 6 7 8 9 10 11 12,Fun Gifts for Birthday Wedding Party Indoor Outdoor Toy - Blue","https://m.media-amazon.com/images/I/818xHcF8mGL._AC_UL320_.jpg","4.3","180","24.99","228"
"B08L9SJCMF","Swurfer Disco Tree Swing - Swing Sets for Backyard, Outdoor Swing, Swingset Outdoor for Kids, Easy Installation, Heavy Duty, Adjustable Climbing Rope, Weather Resistant, Up to 200lbs","https://m.media-amazon.com/images/I/61WcMu0aFwL._AC_UL320_.jpg","4.6","998","24.99","228"
"B0C9SRNJXH","Tagitary Play Sand Toys for Kids Games, Magic Sand 4 Colors with Ice Cream Toy Shovel Tools and Portable Storage Box, Sandbox Sand Kit Beach Toys for Girls Boys","https://m.media-amazon.com/images/I/81UrrrlncUL._AC_UL320_.jpg","4.1","35","24.99","228"
"B0925YQ9GV","Inflatable Pool Floats 3 Pack Glitter Swim Rings for 2-5 Years Old Kids Pool Tubes Toys, Pool Floats Ring Toys Summer Beach Swimming Pool Floats Party Supplies for Girl Boy","https://m.media-amazon.com/images/I/71Yy8PpzftS._AC_UL320_.jpg","4.2","150","15.99","228"
"B0767QJ1SJ","Liberty Imports 12-Pack Replacement Suction Cup Arrows for Kids Archery Set - 16"" Compatible with Most Brand Archery Set","https://m.media-amazon.com/images/I/618sC3ueiZL._AC_UL320_.jpg","4.3","766","11.99","228"
"B09FDXR97T","Unicorn Headlamp for Kids, Kids Toys for 3-10 Years Old Boys Girls, LED Headlamp Toys with Elastic Headbands, Perfect Kids Christmas Stocking Stuffers, Gift for Camping, Hiking, Reading, Sleepovers","https://m.media-amazon.com/images/I/71pcm1JkFjL._AC_UL320_.jpg","4.6","373","19.99","228"
"B0813Z9NLP","12 Pack Mini Basketball Electronic Handheld Shoot & Score Hoop Game with LED Lights & Sounds, Bulk Toys Birthday Party Favors Prizes for Kids, Adults","https://m.media-amazon.com/images/I/61qMFnxWQ5L._AC_UL320_.jpg","4.5","216","31.95","228"
"B09KBTDZSW","Wow Pool Party Slide - Inline, Multi, Large","https://m.media-amazon.com/images/I/61JjtGujHeL._AC_UL320_.jpg","3.7","142","82.0","228"
"B0C34RL1R4","Hot Wheels '72 Stingray Convertible, HW Roadsters 8/10 [Blue] 132/250","https://m.media-amazon.com/images/I/71KJmGYFYyL._AC_UL320_.jpg","4.8","13","7.99","228"
"B09279JHHL","SUVEUS Trampoline Lights, Waterproof LED Lights for 16Ft 15Ft 14Ft 12Ft 10Ft Trampoline, 16 Colors Change with Remote and App Control, Sync up to Music, Super Bright for Kids to Play at Night","https://m.media-amazon.com/images/I/81hzmSe1+wS._AC_UL320_.jpg","4.0","403","29.97","228"
"B072JVX783","Donald Trump American Pool Float for Summer Pool Party - Fun Inflatable for Adults and Kids","https://m.media-amazon.com/images/I/61kFikubwWL._AC_UL320_.jpg","4.6","2841","16.99","228"
"B0BFRN5ZTS","Wave Runner LED Light-Up Football - Glow in The Dark Football Games- Size 10.35 in. with Pump and Batteries Included | Great for Adults, Teens, Football Fans & Players","https://m.media-amazon.com/images/I/81kWNUjmwpL._AC_UL320_.jpg","4.5","107","44.95","228"
"B097QYQSK6","W&O Rocket Ship Play Tent with Blast Off Button - Rocket Tent - Rocket Ship Toys for Kids - Pop Up Tents for Kids - Rocket Spaceship Tent - Rocketship","https://m.media-amazon.com/images/I/A11LGJvmZbL._AC_UL320_.jpg","4.4","434","25.99","228"
"B0BWHYV1L6","XIPEGPA 60 PCS Glider Planes Bulk Airplane Gliders Toy for Kids Paper Airplane Toys Set for Birthday Party Favor Goodie Bag Stuffers Classroom Prizes Boys and Girls","https://m.media-amazon.com/images/I/81rxhfgWS7L._AC_UL320_.jpg","3.8","23","9.99","228"
"B0C1QJYDD2","Bestway Plastic Play Balls 250ct | for Indoor Play, Ball Pit, Bouncers","https://m.media-amazon.com/images/I/71jXIPRpQqL._AC_UL320_.jpg","4.9","23","34.99","228"
"B08BMQFFVF","JOYIN 2 Bottles 32 OZ Bubble Solution Refill (up to 2.5 Gallon) for Large Summer Party Celebrations, Concentrated Bubbles Refill for Bubble Gun Machine, Bubble Party Favor Supplies","https://m.media-amazon.com/images/I/71e1IHXNx-L._AC_UL320_.jpg","4.5","298","11.99","228"
"B07Q1ZXFTN","FUTUREPLUSX Inflatable Can Drink Holder, 4PCS Sparkling Confetti Drink Cup Holder Floats Inflatable Floating Coasters for Pool Party Kids Bath Toys Shower","https://m.media-amazon.com/images/I/71E7+VfWZkL._AC_UL320_.jpg","4.0","822","7.99","228"
"B0BWKZWQF6","Hot Wheels 1967 Chevy Camaro Offroad, Fast & Furious 2/5","https://m.media-amazon.com/images/I/81h1trRFFbL._AC_UL320_.jpg","5.0","11","8.95","228"
"B0985DW56C","GOOD BANANA Kids’ Rainbow Bed Tent for Twin Beds, Ventilated Indoor Play Tent, Magical Play Fort, Easy Set-Up, Hugs Mattress Firmly, Promotes Independent Play, Stimulates Imagination, 42” x 36” x 76”","https://m.media-amazon.com/images/I/61PRquACSkL._AC_UL320_.jpg","4.5","218","49.99","228"
"B0B5LZ7W8D","Toodly Baby Ball Pit for Toddlers and Babies 40''x 12''x 2'' - Sturdy Foam Baby Ball Pit - Durable Ball Pits for Toddlers 1-3 - Soft Feel Large Ball Pit - Baby Ball Pit Balls NOT Included","https://m.media-amazon.com/images/I/714ObBtpNZL._AC_UL320_.jpg","4.6","89","64.99","228"
"B097J3VR7C","Sunny Days Entertainment Bath Time Sing Along Play Center - Ball Pit Tent with 20 Bonus Play Balls and Music - CoComelon","https://m.media-amazon.com/images/I/41BIknxL5jL._AC_UL320_.jpg","4.4","970","27.05","228"
"B07VZTGT85","Pirate Bean Bag Toss Game for Kids, Pirate Banner with 3 Bean Bags for Kids Pirate Theme Party Decorations and Supplies","https://m.media-amazon.com/images/I/811Axf50mNL._AC_UL320_.jpg","4.3","384","12.99","228"
"B01AD1TI6M","Melissa & Doug Sunny Patch Giddy Buggy Binoculars - Pretend Play Toy - Kids Binoculars, Binoculars For Kids Ages 3+","https://m.media-amazon.com/images/I/61C-JU1Vc5L._AC_UL320_.jpg","4.3","1811","9.99","228"
"B0C8D5GZDM","TEMI Space Shuttle Rocket Toys Rocket Launcher for Kids 3 4 5 6 7 8 9, 5-in-1 STEM Space Toys with Launch Center, Console, Satellite, Astronauts, Projection Lamp, Spaceship Toys Gift for Boys Girls 3+","https://m.media-amazon.com/images/I/812SMCFD7cL._AC_UL320_.jpg","4.3","216","65.99","228"
