"asin","title","imgUrl","stars","reviews","price","category_id"
"B0BHQ9QNC7","24 Pcs Mini Scripture Scrolls Bible Toys Christian Gifts for Kids Sunday School Prizes Religious Toys Bible Verse Stickers Paper Scrolls for Crafts","https://m.media-amazon.com/images/I/71Sa8rtTpqL._AC_UL320_.jpg","3.9","10","8.99","219"
"B005E9K7P0","Colorations® Decorate Your Own Wooden Trains, Set of 12, Craft for Kids & Fun Home Activities, Create Unique & Personal Designs, Fun Kids Craft Project, Craft Project for Boys & Girls, Craft & Enjoy!","https://m.media-amazon.com/images/I/51aAFD3SOsL._AC_UL320_.jpg","4.7","27","35.62","219"
"B0C2HKZ12Z","130 Sheets Watercolor Paper Art Paper for Drawing and Painting, SPOKKI Heavyweight Painting Paper, White Paper Painting Paper for Kids and Artist(300g, 5 x 7 Inch)","https://m.media-amazon.com/images/I/61ipVVHtGTL._AC_UL320_.jpg","4.1","6","14.86","219"
"B01LNCWWZ4","Carykon 100 PCS 12 Inch Glitter Tinsel Creative Arts Stems Chenille Stems Pipe Cleaners(Silver)","https://m.media-amazon.com/images/I/91UdivHLTnL._AC_UL320_.jpg","4.6","597","7.29","219"
"B0B1868KSX","Friendly Loom Party Pack Botanicals 7"" Traditional Size Cotton Loops Makes 18 (6"" x 6"") Potholders by Harrisville Designs Made in The USA","https://m.media-amazon.com/images/I/81hCA8gpncL._AC_UL320_.jpg","4.7","44","48.0","219"
"B08YNR4844","Ranvi 60PCS Children's Eraser, Mini Puzzle Pencil Eraser for Children's Game Award Party, Carnival and School Supplies","https://m.media-amazon.com/images/I/71dj-dcNREL._AC_UL320_.jpg","4.1","46","24.99","219"
"B07FDJPQG3","ArtCreativity Mini Art Sets for Kids - Pack of 12-23-Piece Kits with Watercolors, Crayons, Paint Brush and More - Fun Art Supplies, Party Favors for Girls and Boys, Goody Bag Fillers, Carnival Prize","https://m.media-amazon.com/images/I/81-yMKt5qjL._AC_UL320_.jpg","3.8","105","24.99","219"
"B07T3VP3PX","3-Pack Marvel Spider-Man 12ct #2 Wood Pencils (36 Total)","https://m.media-amazon.com/images/I/61+e3x+m-dL._AC_UL320_.jpg","4.6","22","13.99","219"
"B0BXB53X4T","Kpop Stray Kids Maxident Photocards Stickers 101Pcs Vinyl Waterproof Sticker & 54Pcs Lomo Cards Album Photo Poster","https://m.media-amazon.com/images/I/71DdMbpxHFL._AC_UL320_.jpg","5.0","12","9.99","219"
"B0BX3N6H9B","Flying Childhood 12Pack Kids DIY Picture Frames Craft Kit 4×6 Felt Photo Frames Bulk for Girls Toddlers Arts Supplies Party Games Favors","https://m.media-amazon.com/images/I/81g1EPmDvbL._AC_UL320_.jpg","4.5","27","17.99","219"
"B078X3HDG1","Disney Vampirina Jumbo Coloring & Activity Book Tear and Share Pages","https://m.media-amazon.com/images/I/91AbNsJWYjL._AC_UL320_.jpg","4.5","109","5.87","219"
"B08QR9PZR1","Lisa Frank Coloring Art Activity Super Set Bundle - Giant Lisa Frank Activity Set with Art Pad, Paint with Water Supplies, Crayons, Pencils and More (Party Supplies)","https://m.media-amazon.com/images/I/91sGqx4SfzL._AC_UL320_.jpg","4.4","73","22.95","219"
"B078Y33DFJ","Deluxe Studio","https://m.media-amazon.com/images/I/81vppy0cyjL._AC_UL320_.jpg","4.6","645","44.75","219"
"B0978LJZHK","Outus 12 Pieces Halloween Stained Glass Effect Paper Double-Sided Black Suncatcher Kit Pumpkin Suncatchers Craft with 30 Pieces Colored Paper for Window Classroom Art Craft Party Favors, 6 Styles","https://m.media-amazon.com/images/I/91RSgu4ODeL._AC_UL320_.jpg","3.5","13","9.59","219"
"B08HR9DWGP","Watercolor Pad by Artist's Loft, 6"" x 9""","https://m.media-amazon.com/images/I/61BeugFGaXL._AC_UL320_.jpg","4.5","41","12.63","219"
"B0BDRMXDPM","24 Pcs Thanksgiving Craft Kit Fall Craft for Kids Pilgrim Couple Turkey Craft Autumn DIY Owl Cutouts Paper Gnome Ornaments Decorations for Thanksgiving Holiday Party Favors","https://m.media-amazon.com/images/I/817HvpaYvLL._AC_UL320_.jpg","4.1","19","6.99","219"
"B0B91DY8LV","11.5 Inch LCD Writing Tablet,2 Pack Colorful Doodle Board Drawing Pad, Rechargeable Magic Drawing Tablet for Kids, Reusable Electronic Doodle Pad, Toys Gifts for 3-12 Year Old Boys Girl（red+Blue","https://m.media-amazon.com/images/I/71AOnpBduEL._AC_UL320_.jpg","4.4","88","24.28","219"
"B08HVYFPCP","LEGO DOTS Monster Bracelets 41923 DIY Craft Kit; A Cute, Unique Set for First-Time Crafters, New 2021 (34 Pieces)","https://m.media-amazon.com/images/I/61888Op38-L._AC_UL320_.jpg","4.6","347","8.99","219"
"B09CD2R4L2","Viking Totem Stickers, 100PCs, Aesthetic Vinyl Waterproof Decals, Kawaii Stickers for Hydro Flask, Laptop, Water Bottle, Stickers for Kids, Toddlers, Teens, Girls, Car, Helmet Stickers Viking","https://m.media-amazon.com/images/I/91CAizxqs6L._AC_UL320_.jpg","4.5","134","6.99","219"
"B07TDVLK5B","KINGART Tempera Paint Thin Sticks, 24 Colors Solid Tempera Paint for Kids, Super Quick Drying, Works Great on Paper Wood Glass Ceramic Canvas","https://m.media-amazon.com/images/I/61FihymkqyL._AC_UL320_.jpg","4.8","85","19.28","219"
"B079G9QZ6J","TINYMILLS 24 Pcs Llamas Alpaca Stampers for Kids Assorted Stamps for Kids Self Ink Stamps, Llama Birthday Party, Llama Alpaca Party Favors, Goody Bag Filler Treats, Classroom Rewards Carnival Prizes","https://m.media-amazon.com/images/I/71BGwuNIpgL._AC_UL320_.jpg","4.6","246","10.99","219"
"B0BZP22S69","Pin The Wheels On The Racing Car Game - Race Car Birthday Party Supplies for Boys Kids Two Fast Decorations Poster with 24 Pcs Stickers for Baby Shower Classroom Activities (21"" X 28"")","https://m.media-amazon.com/images/I/81Iv-pZFfdL._AC_UL320_.jpg","4.4","5","5.99","219"
"B095H96HB3","Diamond Art Disney Castle DIY 5D Diamond Painting Kits for Adults and Kids Full Drill Arts Craft by Number Kits for Beginner Home Decoration 12x16 inch DP016","https://m.media-amazon.com/images/I/81dnVycXYTL._AC_UL320_.jpg","4.6","504","17.99","219"
"B097MPQGCC","1000 Pieces Pirate Stickers Fun Pirate Themed Stickers Assorted Pirate Roll Stickers Pirate Wall Decals Pirate Birthday Party Favor Stickers for Girls Boys","https://m.media-amazon.com/images/I/81Z0OlSIG7S._AC_UL320_.jpg","4.8","61","9.99","219"
"B0BYRX86GK","Azuunye Cute Diamond Painting Stickers Kits for Kids Beginners Adults - Diamond Dots Arts and Crafts for Teens Stickers","https://m.media-amazon.com/images/I/81JpolQt+nL._AC_UL320_.jpg","4.7","98","11.99","219"
"B01LY2GVTV","Kid Made Modern Art Supplies Giant Crazy Crayon - Original All-in-One Crayon (64 Colors)","https://m.media-amazon.com/images/I/81i1mbd2fTL._AC_UL320_.jpg","4.4","370","8.22","219"
"B09CGY9BMV","Play-Doh Create and Count Numbers Playset Preschool Toy for Kids 3 Years and Up with 6 Double-Sided Playmats, 10 Counting Flashcards, and 6 Cans of Modeling Compound, Non-Toxic (Amazon Exclusive)","https://m.media-amazon.com/images/I/719OXgvBAfL._AC_UL320_.jpg","4.5","204","14.43","219"
"B084ZQYNG5","Crayola Paper Maker, DIY Craft Kit, Gift for Kids, 8, 9, 10, 11","https://m.media-amazon.com/images/I/81TlyZgA4-L._AC_UL320_.jpg","4.6","3160","28.9","219"
"B0BCP7MR7G","Goody King 4pcs Paint Your Own Stepping Stone - Easter Arts and Crafts for Kids, Perfect Outdoor Activities Garden Walkaway, Easter Birthday Gifts for Kids Boys Girls for Kids Ages 4-6 4-8 6-8","https://m.media-amazon.com/images/I/81AL8fu6dWL._AC_UL320_.jpg","4.7","31","24.99","219"
"B00DOZ6FIO","C&D Visionary Licenses Products Megadeth Silver Logo Sticker","https://m.media-amazon.com/images/I/717vSGFroxL._AC_UL320_.jpg","4.5","91","6.49","219"
"B01AF8EUNY","Ninja Roll Stickers - Stationery - Stickers Roll - 1 Piece","https://m.media-amazon.com/images/I/71bw9tCKHyL._AC_UL320_.jpg","4.6","315","7.09","219"
"B01M6CY5FW","Magnetic Poetry Educational Products - Metal Easel Board - 11x13 Inches","https://m.media-amazon.com/images/I/81FC3l5gskL._AC_UL320_.jpg","4.7","279","24.95","219"
"B09QKFZBH3","Sunny Days Entertainment Hot Wheels Jumbo Chalk Holders | 5 Chalk Sticks with Holders for Kids | Sidewalk Chalk for Toddlers","https://m.media-amazon.com/images/I/81bPTbiXU2L._AC_UL320_.jpg","4.4","94","8.48","219"
"B092SH1CY3","1000 Pieces Cute Unicorn Stickers Roll Easter Labels Stickers Self Adhesive Envelopes Tag Seals Decals for Easter Unicorn Themed Party Favor, Water Bottles, Scrapbooking, Thanksgiving Cards","https://m.media-amazon.com/images/I/81iwiRAppiS._AC_UL320_.jpg","4.6","99","8.99","219"
"B07SG7VW9M","JJ Home Goods Sand Art, 11 lbs. [10 Bottles] Non-Toxic Colored Sand for Crafts, Color Splash Sand Art Kit for Kids 3 Years Above, Colored Sand for Sand Art, Sand Play, Sandbox, Wedding Decorations","https://m.media-amazon.com/images/I/81Qd9LPK-SL._AC_UL320_.jpg","4.7","168","42.89","219"
"B0BX9VX315","Basketball Stickers, Girl Basketball Stickers,Water Bottle Laptop Stickers,Basketball Gifts for Girls","https://m.media-amazon.com/images/I/81PrsGDAn1L._AC_UL320_.jpg","4.6","884","7.99","219"
"B0BCS7GGQ2","Beauty and The Beast Stickers 4 Pack Bundle - 100 Belle Stickers for Beauty and The Beast Decorations Party Supplies Party Favors, More | Belle Stickers for Girls","https://m.media-amazon.com/images/I/81cd8oBUfXL._AC_UL320_.jpg","4.3","24","7.49","219"
"B0017Q42GO","IWAKO Japanese Eraser Dessert Set - Colors Vary","https://m.media-amazon.com/images/I/71wzPgyM10L._AC_UL320_.jpg","4.4","81","6.56","219"
"B0C2H21SDY","CX-Reezy 5.1"" x 8.3"" Watercolor Pad, Pack of 2 (76 Sheets), 110 lb, Acid-Free Paper, Watercolor Book with Linen Bound for Watercolor Techniques and Mixed Media","https://m.media-amazon.com/images/I/914mMQXwMUL._AC_UL320_.jpg","4.6","13","17.99","219"
"B07XYJ7TPP","Garbage Pail Kids Party Favors Sticker Set - Bundle Includes 12 Sheets of Garbage Pail Kids Stickers, Over 160 Stickers Total! (Garbage Pail Kids Stickers and Party Favors)","https://m.media-amazon.com/images/I/81Bqin29CjL._AC_UL320_.jpg","4.5","521","7.45","219"
"B0B7RT4JX3","Funrous 24 Pcs Christmas Crafts Kits for Kids, Christmas Arts and Crafts DIY Christmas Ornaments Kit Make Your Own Christmas Craft Projects for Kids Ages 3 4 5 6 8 12","https://m.media-amazon.com/images/I/81iiYXvb11L._AC_UL320_.jpg","4.5","27","9.99","219"
"B0BW13BDZX","Anime Girl Stickers, Waifu Anime Graffiti DIY, Slutty Anime Stickers, New Car Driver Stickers, PVC Waterproof, Japanese car Stickers,Mixed Set Not Duplicate of 101 (5.5-8.5cm)","https://m.media-amazon.com/images/I/912vurX5miL._AC_UL320_.jpg","4.8","13","12.99","219"
"B079HF2KJM","READY 2 LEARN CE6624 Jumbo Circular Washable Stamp Pad - White - 5.75"" dia. - Non-Toxic - Fade Resistant - Ideal Size for Handprints and Footprints","https://m.media-amazon.com/images/I/81c4eYsAe8L._AC_UL320_.jpg","3.5","48","6.79","219"
"B0BHFBQKN8","TINYMILLS 24 Pcs Dinosaur Stackable Push Pencil Assortment with Eraser for Party Favors Goodie Bag Stuffers VBS Classroom Rewards Pinata Fillers Carnival Prize","https://m.media-amazon.com/images/I/61MOTx0duxL._AC_UL320_.jpg","4.2","12","12.99","219"
"B07S2BTCMD","TINYMILLS 12 Pcs Donuts Stamp Kit for Kids","https://m.media-amazon.com/images/I/91ILJukck5L._AC_UL320_.jpg","4.7","168","6.99","219"
"B093H2YZBP","48 Pieces Make a Face Animal Stickers Make Your Own Animal Stickers Farm Zoo Themed Fun Stickers for Kids Party Favors, Rewards, Art Craft with 8 Designs (Adorable Style)","https://m.media-amazon.com/images/I/81LJ9cgeV6L._AC_UL320_.jpg","4.7","110","7.99","219"
"B0BX3KJT3S","Llama Stickers 100Pcs Funny Alpaca Gifts Vinyl Waterproof Stickers for Water Bottles Kids Boys Girls Cute Animal Aesthetic Decals Llama Party Decorations","https://m.media-amazon.com/images/I/81NrKEXdanL._AC_UL320_.jpg","4.4","6","6.99","219"
"B09MHZ7J9Z","Gersoniel Rainbow Pencils Stackable Crayons for Kids Stacking DIY Crayons Buildable Crayons Party Favors for Office School Supplies, 12 Colors (36 Pieces)","https://m.media-amazon.com/images/I/81PvEhcCYyL._AC_UL320_.jpg","4.5","68","16.49","219"
"B07F2Y4M9L","Nerf Eyeblack Stickers | Orang & Blue | 8 Pairs","https://m.media-amazon.com/images/I/71Z5+4XGyzL._AC_UL320_.jpg","4.4","389","5.25","219"
"B00DARXMS2","Arches Watercolor Pad, 9"" x 12""","https://m.media-amazon.com/images/I/61Fjog90H5L._AC_UL320_.jpg","4.9","307","21.69","219"
"B07HHG1VJ1","Quercetti Peg Brite Light-Up Toy - Design and Create Mosaic Art on The Peg Board with 120 Pegs & Bright LED Lights, Promotes Creative Thinking and Fine Motor Skills, for Kids Ages 3 Years & Up","https://m.media-amazon.com/images/I/81r1Hq3e1JL._AC_UL320_.jpg","4.5","455","24.99","219"
"B00FB4IQ0G","Bendon Publishing Doc McStuffins Imagine Ink Mess Free Game Book","https://m.media-amazon.com/images/I/71Vm-uCM3dL._AC_UL320_.jpg","4.6","79","7.95","219"
"B09TRTTMVX","Mobiusea Creation Happy Birthday Stickers | 90-Pack Waterproof Birthday Stickers | 1.4 inch | General Themed Birthday Party Supplies for Kids Party Favors, Birthday Bag or Cupcake Stickers","https://m.media-amazon.com/images/I/61Wiie--WfL._AC_UL320_.jpg","4.3","13","5.99","219"
"B08H4WHH3W","Kids Paint Set 55pcs Acrylic Paint Set with Rock Painting Set & Dinosaur Painting Kit for Kids Crafts & Kids Arts Set, Include 24 Washable Paints Tabletop Easel Art Smock Paint Brushes Painting Canvas","https://m.media-amazon.com/images/I/81AkA7GA1+L._AC_UL320_.jpg","4.7","394","23.99","219"
"B00NE9KLF8","Disney Frozen 24 Pair Sticker Earrings","https://m.media-amazon.com/images/I/81fu7gtC6YL._AC_UL320_.jpg","4.0","100","5.45","219"
"B0C2C37FK4","Magnetic Drawing Board for Kids 3+Years, Large Magnetic Toys Doodle Board with Magnetic Beads and Pen Drawing Board (Cyan)","https://m.media-amazon.com/images/I/61XYCajlidL._AC_UL320_.jpg","3.5","7","9.99","219"
"B00D0SBV5M","Colorbok TB-48945 Makit and Bakit Suncatcher Kit, Horse","https://m.media-amazon.com/images/I/71C2AkWTPzL._AC_UL320_.jpg","4.6","398","7.99","219"
"B0BVMDKJ5G","HADDIY Felt Bees for Crafts,20 Pcs Small Wool Bumble Bee Plush Decor for Bee Baby Shower Decorations,Bee Party Supplies and Costume DIY","https://m.media-amazon.com/images/I/71oFiZUfFOL._AC_UL320_.jpg","4.8","18","10.99","219"
"B0BJ6WGHLH","Green Stickers Cute Decals 100 Pcs DIY Decoration for Waterproof Kawaii Vinyl Decor to Water Bottle Skateboard Guitar Phone Case Funny Design (Green, 1)","https://m.media-amazon.com/images/I/61haUAf16SL._AC_UL320_.jpg","4.4","13","8.99","219"
"B078XM58NT","ORB Sticky Mosaics Princesses","https://m.media-amazon.com/images/I/81Fx9YESEOL._AC_UL320_.jpg","4.8","356","14.99","219"
"B07SV4WDN8","Just My Style Paint Your Own Rainbow Tea Set by Horizon Group USA Multi","https://m.media-amazon.com/images/I/81xA7AabsgL._AC_UL320_.jpg","4.6","669","18.39","219"
"B074KJF9G1","SmileMakers Glitter Teeth Stickers - Prizes and Giveaways - 75 per Pack","https://m.media-amazon.com/images/I/81RSywLNFBL._AC_UL320_.jpg","4.7","109","11.26","219"
"B00000IV3W","Harrisville Designs Lap Loom Kit, Hand Weaving for Kids and Adults (Style A)","https://m.media-amazon.com/images/I/71nYvijlHRL._AC_UL320_.jpg","4.6","180","48.0","219"
"B00BTTMPIQ","Beistle 4 Sheets Red/White/Blue Patriotic US Flag Stickers For July 4th Celebrations, Memorial Day, Stationary and Scrapbooking Supplies, United States Pride Labor Day Decorations , 4¾"" x 7½""","https://m.media-amazon.com/images/I/71wKyNLnSjL._AC_UL320_.jpg","4.2","52","5.01","219"
"B07R5VK742","Alcohol Ink Paper Roll - Pixiss Heavy Weight Alcohol Ink Watercolor Paper 24 Inches by 5 Feet (610x1524mm), 300gsm, Extra Smooth, for Watercolor, Alcohol Ink","https://m.media-amazon.com/images/I/51J4TVLBI7L._AC_UL320_.jpg","4.2","246","33.99","219"
"B0C7QLD2DM","LCD Writing Tablet for Kids, Kidopire 15-Inch Large Screen Doodle Board Drawing Tablet Writing Pad Educational Toddler Toys, Birthday Gifts for 3-12+ Year Old Girls Boys Message Practice Tablet, Blue","https://m.media-amazon.com/images/I/717xwMxQk1L._AC_UL320_.jpg","4.4","17","26.99","219"
"B09S5Q52S2","Serabeena Make Your Own Robot Stickers - 24 Sheets / 700+ Stickers - Robot Party Decorations","https://m.media-amazon.com/images/I/81U2QyctSlL._AC_UL320_.jpg","4.4","73","7.99","219"
"B00A2WKBL4","Disney Cars Sticker Sheets, 8ct","https://m.media-amazon.com/images/I/71Ty5VGt3nL._AC_UL320_.jpg","4.0","35","6.95","219"
"B07B172SRK","Cool Maker – JoJo Siwa Bow Maker with Rainbow and Unicorn Patterns, for Ages 6 and Up","https://m.media-amazon.com/images/I/81FyMor+O7L._AC_UL320_.jpg","4.4","3130","26.99","219"
"B0BHW1Q76F","Aoibrloy Freshie Making Kit for Beginners, DIY Car Freshie Starter Set with Silicone Molds, Unscented Aroma Beads, Instructions and Accessories for Making Car Air Freshener Multicolor","https://m.media-amazon.com/images/I/71YQknDxNDL._AC_UL320_.jpg","3.9","20","13.99","219"
"B00008D0TQ","BIC Kids Kid Couleur Felt Tip Colouring Pens - Assorted Colours, Cardboard Wallet of 12","https://m.media-amazon.com/images/I/81v5f1dxFVL._AC_UL320_.jpg","4.6","14373","6.91","219"
"B09CH9CT38","Orbeez Water Beads, Activity Orb Fidget Pack, 1600 in 4 Mini- Activity Playsets, Sensory Toys for Kids Aged 5 and Up","https://m.media-amazon.com/images/I/71VXu0u7JSL._AC_UL320_.jpg","4.2","240","10.56","219"
"B07HDJS8TQ","Rolife Build Your Own 3D Wooden Assembly Puzzle Wood Craft Kit Bi-Plane Model,Gifts for Kids and Adults","https://m.media-amazon.com/images/I/61uZg6NoJUL._AC_UL320_.jpg","4.4","531","13.99","219"
"B08DTZHSM7","BIC Kids Crayons, Assorted Colors, Durable Case, 36-Count (BKPCP36-AST)","https://m.media-amazon.com/images/I/81MBYsyTq-L._AC_UL320_.jpg","4.7","106","12.78","219"
"B006GF4LR6","7"" Loops, Makes Two POTHOLDERS - Yellow","https://m.media-amazon.com/images/I/71yGb8vJnGL._AC_UL320_.jpg","4.6","196","11.95","219"
"B07J4NW88M","Cool Maker, KumiKreator Twilight Mini Fashion Pack Refill, Friendship Bracelet Activity Kit,","https://m.media-amazon.com/images/I/81-2gXIkoqL._AC_UL320_.jpg","4.8","68","7.99","219"
"B0BJ97573V","Christmas Erasers for Kids Bulk, 240 PCS Cute Mini Erasers Novelty Pencil Erasers Santa Snowman Stocking Erasers for Christmas Party Favor Gifts Home School Work Reward","https://m.media-amazon.com/images/I/81YurQoihML._AC_UL320_.jpg","3.9","41","9.95","219"
"B09QKFRBK5","Sunny Days Entertainment Barbie Jumbo Chalk Holders | 5 Chalk Sticks with Holders for Kids | Barbie Outdoor Toys","https://m.media-amazon.com/images/I/816k9PeL7XL._AC_UL320_.jpg","4.2","51","8.5","219"
"B089JXWV7B","TINYMILLS 24 Pcs Flamingo Tropical Luau Multi Point Stackable Pencil with Eraser for Flamingo Luau Birthday Party Favor Prize Carnival Goodie Bag Stuffers Classroom Rewards","https://m.media-amazon.com/images/I/71E+APYDEWL._AC_UL320_.jpg","4.7","118","13.99","219"
"B0733171LG","Washable 7"" Large Ink Pads for Kids,GooMart 8 Colors Round Craft Rubber Stamp Pads for Kids, DIY Fingerprint Ink Pad Stamps Partner (8 Pack)","https://m.media-amazon.com/images/I/61ALeBcuHJL._AC_UL320_.jpg","3.6","836","17.99","219"
"B09FNSHLSZ","Outus 224 Pieces Christmas Glitter Foam Stickers Self Adhesive Christmas Tree Craft for Kids Snowflake Santa Bell Gingerbread Man Christmas Stocking Stickers for Xmas Party Decoration DIY","https://m.media-amazon.com/images/I/91+2u1o-IxL._AC_UL320_.jpg","4.6","40","16.99","219"
"B0C9PND5CR","NATIONAL GEOGRAPHIC Multicolor LED Night Light - Color Changing, Space Theme Kids Night Light with 8 Modes, Dimmer, 1000+ Gems & Light Wrap for Decorating, USB Night Light, Space Themed Bedroom Décor","https://m.media-amazon.com/images/I/91k2jl9jDnL._AC_UL320_.jpg","4.7","18","19.99","219"
"B07NVVL5XF","Paper House Productions Enamel Stickers WONDR WOMN, Wonder Woman, Single","https://m.media-amazon.com/images/I/71IhkoSWv1L._AC_UL320_.jpg","4.6","309","6.75","219"
"B073R7YSBQ","Disney Princess Coloring Book Pack with Stickers, Crayons and Coloring Activity Book Bundled with 2 Separately Licensed GWW Specialty Reward Stickers","https://m.media-amazon.com/images/I/81XhDAKeWqL._AC_UL320_.jpg","4.5","51","8.95","219"
"B08BVRK21M","JOYIN 48 PCS Cone Shaped Washable Sidewalk Chalks , Non-Toxic Jumbo Chalk for Art Play, Sidewaalk Colored Outside Washable Set for Summer Outdoor Games and Chalkboard Drawing","https://m.media-amazon.com/images/I/81FQurPOMJS._AC_UL320_.jpg","4.6","1028","11.99","219"
"B09C6LZRG4","Air Dry Clay for Kids 24 Colors, PIERPIER Magic Modeling Clay Kit with Magical Clay Tools Accessories, Squash Clay for Slime， Play Clay Art for Adults and Kids Gift, Craft Clay Air Dry DIY Set","https://m.media-amazon.com/images/I/613dnDnFTNL._AC_UL320_.jpg","4.5","509","7.99","219"
"B07WMVD5KY","Wedding Meal Stickers - White Square Stickers - Wedding Meal Indicator Stickers - Meal Choice Stickers (50 Stickers - Vegan, Gold)","https://m.media-amazon.com/images/I/81s+HxiMMFL._AC_UL320_.jpg","4.8","31","8.59","219"
"B07ZRK297P","Max Fun Rainbow Color Scratch Christmas Ornaments (96 Counts) - Magic Scratch Off Cards Paper Hanging Art Craft Supplies Educational Toys Kit for Kid Party Favor","https://m.media-amazon.com/images/I/81ql502iEiL._AC_UL320_.jpg","4.6","433","14.99","219"
"B07F6YH15D","Coitak Moving Sand Art Picture, Sandscape, Moving Desktop Art for Home Decor and Office, Medium Size 9x7(Blue)","https://m.media-amazon.com/images/I/71p5CToMkUL._AC_UL320_.jpg","4.5","1156","18.98","219"
"B09VWTLGCQ","Jack Skellington Disney Nightmare Before Christmas Stickers Party Favors Bundle - 240 NBC Stickers Featuring Jack, Sally, Oogie Boogie, More Plus Door Hanger (Halloween Party Decorations)","https://m.media-amazon.com/images/I/81LjXJ8g1JL._AC_UL320_.jpg","4.6","14","6.95","219"
"B08GN58F5N","Disney Frozen Paint With Water Super Set for Girls Kids Bundle ~ Deluxe Mess-Free Book with Water Surprise Brush with Mini Coloring Book and Stickers (Disney Frozen Party Supplies)","https://m.media-amazon.com/images/I/91l0Nn14-FL._AC_UL320_.jpg","4.3","71","10.95","219"
"B079PXH2JV","L.O.L. Surprise! Color Change Lip Gloss By Horizon Group USA, Mix & Create 5 Color Changing Multi Flavored ,DIY Lip Gloss Making Kit, Containers & Decorative Stickers Included.Multicolored","https://m.media-amazon.com/images/I/81qu5Nhfy-L._AC_UL320_.jpg","4.6","2125","10.72","219"
"B0B9BQ35G8","1000 Pieces Cute Unicorn Label Stickers DIY Stickers, Unicorn Stickers for Kids,10 Style 1 inch Unicorn Self Adhesive Decoration Stickers for School Birthday Party Gift Bag Decorations Supplies Favors for Girls Kids","https://m.media-amazon.com/images/I/619dwBxPMaL._AC_UL320_.jpg","4.7","25","5.29","219"
"B0C2C339QB","Pipe Cleaners Craft, 100 Pcs Pipe Cleaners Chenille Stem, Pink Pipe Cleaners Craft Supplies for Pipe Cleaners DIY Arts Crafts Decorations","https://m.media-amazon.com/images/I/71K43vy+ywL._AC_UL320_.jpg","4.6","24","6.99","219"
"B0C3CM2R2D","Demon Slayer Party Supplies Anime Merch Includes 10 Anime Wristband 10 Stamper 12 Anime Button Pin 50Pcs Anime Stickers 6 Sheet of Anime Tattoo Stickers","https://m.media-amazon.com/images/I/8111WPskpqL._AC_UL320_.jpg","4.7","7","14.99","219"
"B094W9TH4R","Aowplc Frog Stickers - Waterproof Cute Vinyl Stickers Pack for Water Bottles, Laptops, Phone Case, Luggage Decoration - 103 Pcs/Pack","https://m.media-amazon.com/images/I/81yrLc4KTJL._AC_UL320_.jpg","4.7","254","6.99","219"
"B004N78FSA","Fun Express - Skull And Crossbone Pencils - Stationery - Pencils - Pencils - Printed - 24 Pieces","https://m.media-amazon.com/images/I/81--ESVCaYL._AC_UL320_.jpg","4.4","116","9.94","219"
"B0B11NDGB5","KiwiCo - Levitating Lantern, Cool Wooden Lantern DIY Kit for Ages 9+","https://m.media-amazon.com/images/I/81-T9Yk+asL._AC_UL320_.jpg","4.2","32","27.95","219"
"B07MQFFDDY","How to Train Your Dragon Sticker Sheets - Assorted Designs, 4 Pcs","https://m.media-amazon.com/images/I/71dd1JIQhQL._AC_UL320_.jpg","4.6","176","7.99","219"
"B085YVQK42","LEGO DOTS Rainbow Bracelet 41900 DIY Craft Bracelet Making Kit; A Fun Craft kit for Kids who Like Making Creative Jewelry, That Also Makes a Cool Holiday or Birthday Gift Toy (33 Pieces)","https://m.media-amazon.com/images/I/71NNVtw1CxL._AC_UL320_.jpg","4.7","1106","9.48","219"
"B0BNM4S8HF","6 Pieces LCD Writing Tablet for Kids, 12 Inch Drawing Pads Colorful Drawing Tablet Doodle Board Erasable Doodle Pad Educational Drawing Board for Students School Boys and Girls Aged 3-9, 12 x 8 Inch","https://m.media-amazon.com/images/I/81x09ugXqSL._AC_UL320_.jpg","4.7","12","29.99","219"
"B08C73562Z","Leda Art Supply Mixed-Media Sketch Pad,Pack of 2 artbook (24 Sheets),Crafts,Painting & Drawing Sheet Ideal for Watercolor, Acrylic, Ink, Pens, Markers or Oil Paintings (A3 Size 11.5 x 16.5 Inches)","https://m.media-amazon.com/images/I/91i53PR1iXL._AC_UL320_.jpg","4.6","63","15.99","219"
"B06XRWQS7V","C&D Visionary Van Halen Shield Logo Sticker Stickers","https://m.media-amazon.com/images/I/81htvim4x6L._AC_UL320_.jpg","4.2","43","5.5","219"
"B07B9JLKBH","Crayola Paw Patrol Coloring Kit, Travel Activity, Gift for Kids, Ages 3, 4, 5, 6 includes (1) Plastic storage case, (6) Washable Crayons, (40) Coloring/Activity pages","https://m.media-amazon.com/images/I/71XZDS-NDoL._AC_UL320_.jpg","4.7","188","15.91","219"
"B00006IBP9","Crayola Artista II Washable Tempera Paint in Black, Painting Supplies, 16oz","https://m.media-amazon.com/images/I/51724GKQSTL._AC_UL320_.jpg","4.7","472","7.89","219"
"B081286B78","Crayola Color Wonder Travel Easel Frozen II Pages with Bonus Pages, Markers and Color Wonder Paint Coloring Travel Books and Easel 61 Piece MEGA Set","https://m.media-amazon.com/images/I/81ZsCK8E1SL._AC_UL320_.jpg","4.7","288","20.99","219"
"B01B39PNTY","Playscene Zoo Animal Self Inking Stamps for Kids (Zoo - 24 Pack)","https://m.media-amazon.com/images/I/81IeSOdidTL._AC_UL320_.jpg","4.0","439","7.75","219"
"B0007XDHGO","Arches Watercolor Block, Cold Press 9""X12""","https://m.media-amazon.com/images/I/71gEz1xMqbL._AC_UL320_.jpg","4.9","510","43.09","219"
"B08CVTZ32S","Halloween Stickers for Kids, 800 Pcs Glitter Foam Craft Stickers Self Adhesive Pumpkin Shape Stickers for Kids Party Halloween Decorations","https://m.media-amazon.com/images/I/61bjcpQ35DL._AC_UL320_.jpg","4.7","413","20.99","219"
