"asin","title","imgUrl","stars","reviews","price","category_id"
"B07C58ZGX4","SpriteGru 102pcs Magnetic Numbers for Basic Math Mathematics Education","https://m.media-amazon.com/images/I/71tu7y4k9bL._AC_UL320_.jpg","4.5","920","9.99","230"
"B0BQD572KR","hand2mind Tactile Turtles Math Activity Set, Toddler Numbers and Counting, Math Counters for Kids, Color Sorting Toys, Sensory Turtle Game, Preschool Learning Activities, Montessori Math Materials","https://m.media-amazon.com/images/I/81KD4bG1AmL._AC_UL320_.jpg","4.6","91","11.64","230"
"B09QCC5D7N","Refill Pegs 280PCS for Use with Bopika Creative Light Up Board,Educational Learning Toys for Boys and Girls Ages 4+","https://m.media-amazon.com/images/I/71IJ47a5oWL._AC_UL320_.jpg","4.5","519","8.95","230"
"B01M1CH242","Little Tikes Tap-A-Tune Piano Baby Toy","https://m.media-amazon.com/images/I/71w2cSKHkNL._AC_UL320_.jpg","4.8","1194","14.99","230"
"B08BZ9GNTJ","Infantino Jungle Peek & Roll - Encourages Crawling, Inflatable Activity Toy with Bouncing Balls Inside, Fun & Friendly Animal Characters, Helps Gross Motor Skill Development, for Babies 6M+","https://m.media-amazon.com/images/I/71BfZxzAvLL._AC_UL320_.jpg","4.3","273","12.99","230"
"B07S7D3CPQ","Battat – Shape Sorter – Colorful Sorting Toy – 3 Shapes & Sounds – Educational & Developmental Toy for Toddlers – Shapes & Sound Sorter – 18 Months +","https://m.media-amazon.com/images/I/717P+fI-K1L._AC_UL320_.jpg","4.7","555","12.25","230"
"B0BLNCSWZ7","PandaEar 2 Pack Silicone Baby Fresh Fruit Feeder with 3 Different Size Silicone Pouch for Teething Relief| Baby Food Feeder Pacifier Training Massaging Toy Teether","https://m.media-amazon.com/images/I/61mCREggrqL._AC_UL320_.jpg","4.6","276","7.45","230"
"B0B6TWSYCR","GKDOMS Montessori Learning Toys Sorting & Matching Locks and Keys Toddlers Sensory Car Activity Preschool Fine Motor Skill Toy Gifts for Baby 18-24 Months Boys Girls Age 2-5 Years, with Key Ring","https://m.media-amazon.com/images/I/71gf0AGpgEL._AC_UL320_.jpg","4.2","105","12.99","230"
"B076RHHRN2","Play22 Baby Blocks Shape Sorter Toy - Childrens Blocks Includes 18 Shapes - Learning Color Recognition - Colorful Sorter Cube Box - My First Baby Toys - Toys Gift for Boys & Girls - Original","https://m.media-amazon.com/images/I/814+-wgEHfL._AC_UL320_.jpg","4.7","3544","13.99","230"
"B0BXN8HQ2D","AIQI Interactive Pop-Up Pals Baby Toy - Learning Infant Toy for Sorting Colors and Animals - Pop-Up Activity Toy for Babies, Toddlers - Educational Toy for Boys and Girls 18+ Months","https://m.media-amazon.com/images/I/81Jbho7U-aL._AC_UL320_.jpg","4.7","44","13.99","230"
"B08JH9VW3Y","edxeducation Counting Bears with Matching Bowls - Early Math Manipulatives - 68pc Set - 60 Bear Counters, 6 Bowls & 2 Game Spinners - Home Learning","https://m.media-amazon.com/images/I/71IAL1ndCiL._AC_UL320_.jpg","4.9","352","17.99","230"
"B09HDZTJG8","Mud Pie Golf Cart Teether, Blue","https://m.media-amazon.com/images/I/7165sqvDKQL._AC_UL320_.jpg","4.4","52","16.48","230"
"B09V4SD34P","Fowecelt Wooden Hammer Toys Simulation Hammers Maintenance Tools Educational Toys for Kids Birthday Party Games Supplies","https://m.media-amazon.com/images/I/51vJ18V251L._AC_UL320_.jpg","4.7","63","5.99","230"
"B0BCPWB4KY","Alphabet Letters Sensory Toys for Toddlers: ABC Learning Educational Montessori Toys Preschool Activities for Kids 3 4 5 6 Years Old, 26pcs Squishy Fidget Toys for Autistic Children, Uppercase","https://m.media-amazon.com/images/I/71J4srr7SNL._AC_UL320_.jpg","4.1","138","19.99","230"
"B09TSZ3JWT","Chuya Teething Toys (4 Pack) for Baby, Silicone Teethers with Banana Baby Toothbrush Teeth Brushing,BPA-Free,Chew Toy Infants Toddlers for Babies 0-6 Months","https://m.media-amazon.com/images/I/61f8AG3zDML._AC_UL320_.jpg","4.7","1160","8.99","230"
"B0BXKTD4GY","FBesteam Baby Stroller Arch Toy - Infant Car Seat Toys Adjustable Mobile Activity Arch with Play Accessories, Sensory Travel Crib Bouncer Bassinet Toy for Toddler Boy Girl 0 3 6 9 12 24 Month (Crab)","https://m.media-amazon.com/images/I/61HJhXRuw6L._AC_UL320_.jpg","4.6","178","22.59","230"
"B09Q49R2SZ","Bluey Bath Time 13"" Quick Drying Plush Toy","https://m.media-amazon.com/images/I/61-I13CgkFL._AC_UL320_.jpg","4.8","549","14.99","230"
"B0BFVBGRFP","10-In-1 Wooden Montessori Toys for Toddlers, Carrot Harvest, Shapes Sorting &Matching, Stacking Cups, Fruits Lacing Threading,Preschool Learning Fine Motor Skills Game for 1 2 3 4 Years Old Babies","https://m.media-amazon.com/images/I/818A7bh2KBL._AC_UL320_.jpg","4.6","243","14.99","230"
"B0BWXG3YYN","TOY Life Wooden Animal Puzzles for Toddlers 1-3, 6 Pack Baby Puzzle for Kid Age 1-3, Montessori Toys for 1 2 3+ Year Old, STEM Educational Learning Toy Birthday Gifts for 1 2 3+Year Old Boys Girls","https://m.media-amazon.com/images/I/71i3gscjLFL._AC_UL320_.jpg","4.6","3720","16.97","230"
"B098PD4DR9","Mattel Games UNO Junior Paw Patrol Kids Card Game for Family Night, Educational Game Featuring 3 Levels of Play","https://m.media-amazon.com/images/I/61cJeGq+sNL._AC_UL320_.jpg","4.8","1996","9.56","230"
"B0BQ8BSTYQ","Learning Resources Big Feelings Pineapple Deluxe Set, 50 Pieces, Ages 3+, Social Emotional Learning Toys, Sensory Toys for Toddlers, Speech Therapy Materials, Fine Motor Skills Toys","https://m.media-amazon.com/images/I/71mNSQFF6lL._AC_UL320_.jpg","4.7","3986","19.99","230"
"B094FZLTQ7","Higherbros Yellow Rubber Ducks Farm - Realistic Duckling Figurines for Kids' Toys, Bath Time, and Party Favors (Animal Series)","https://m.media-amazon.com/images/I/61W+iu8dQXS._AC_UL320_.jpg","4.6","320","9.99","230"
"B081P4CN44","Learning Resources 3 Prong Tong, Pencil Grip Tongs, Sensory Bin, Fine Motor Toy, Set of 6, Ages 4+","https://m.media-amazon.com/images/I/618+4c9eqyS._AC_UL320_.jpg","4.6","699","14.72","230"
"B0B568QRLN","Spinning Tops for Kids, Bamugoo 20-Pack LED Light Up Flashing Spinning Tops, Novelty Bulk Toys Party Favors Goodie Bag Fillers Gifts Stuffers for Birthday Party Favors Gift, Spinning Top Toy","https://m.media-amazon.com/images/I/71OKzc3gHcL._AC_UL320_.jpg","3.8","91","12.99","230"
"B098SZQ3WY","miawow 8 Pcs Stacking Rings Soft Toys for Babies Newborn 0 3 4 5 6 12 18 Months 1 Year Old Girls Boys - Toddler Sensory Educational Montessori Baby Blocks - Infant Development Teething Learning Tower","https://m.media-amazon.com/images/I/61Of-DaoqZL._AC_UL320_.jpg","4.6","809","13.99","230"
"B0000A1Z3X","Manhattan Toy Baby Whoozit 6"" Stroller and Travel Activity Toy","https://m.media-amazon.com/images/I/81yI2PTuA2L._AC_UL320_.jpg","4.8","1593","19.9","230"
"B08PYS8C3T","Novelty Place Echo Mic for Kids and Toddlers - Battery-Free Magic Karaoke Microphone Voice Amplifying Retro Toy for Singing, Speech & Communication Therapy - 10"" (Blue & Green)","https://m.media-amazon.com/images/I/816gfiX-y6L._AC_UL320_.jpg","4.1","1126","9.99","230"
"B09SHWWPXS","LED Light Switch Busy Board Montessori Toy with Button for Kids, Wooden Control Panel, Activity Sensory Board Fidget Toy for Toddlers 1 2 3 Year Old","https://m.media-amazon.com/images/I/614BCMu4UVL._AC_UL320_.jpg","4.4","322","24.96","230"
"B0BHSJ7Y1N","ReeRaa Crawling Crab Baby Toy Infant Tummy time Toys 3 4 5 6 Babies boy Girl Sensory Toys Montessori Toys 3-6 6-12 Learning to Crawl 9-12 12-18 Walking Toddler Gifts (Green)","https://m.media-amazon.com/images/I/61J5o-dFmGL._AC_UL320_.jpg","4.2","304","12.59","230"
"B09SVMYVSQ","Learning Resources Skill Builders! Kindergarten Letter & Number Maker, Educational Indoor Games, Preschool Alphabet, Toddler, Brain Toys, 60 Pieces, Age 6+","https://m.media-amazon.com/images/I/81ADwz-q-lL._AC_UL320_.jpg","4.6","87","14.99","230"
"B0B1PQ9LN1","Wooden Counting Ladybugs Montessori Counting Toys for Toddlers Learning Education Toy Ladybugs Puzzle Numbers Matching Preschool Math Board Games Develop Fine Motor Skills for 3 4 5 Year Old Kids","https://m.media-amazon.com/images/I/71LwqBX9fNL._AC_UL320_.jpg","4.6","90","19.99","230"
"B0BY4NJ49B","12 PCS Cowboy Duck with Hat and Sunglasses Mini Duckies Toys for Birthday Swimming Party Gift Favor","https://m.media-amazon.com/images/I/81BN+SyFSVL._AC_UL320_.jpg","4.4","91","12.99","230"
"B0739LBQDM","GoodPlay Gyroscope, 3 Pcs/Set Handmade Painted Wood Spinning Tops, Wooden Toys Educational Toys Kindergarten Toys Standard Tops","https://m.media-amazon.com/images/I/51iwcU+LL5L._AC_UL320_.jpg","4.5","1258","6.99","230"
"B00CQHYX2G","Fisher-Price Baby Crawling Toy, Poppity Pop Musical Dino, Ball Popper Dinosaur With Music & Sounds For Infants Ages 6+ Months","https://m.media-amazon.com/images/I/71ee16Em4ZS._AC_UL320_.jpg","4.6","5650","37.99","230"
"B0CDC7MSDS","Huyerdo Play Money for Kids, 210 Pcs Prop Money for Pretend Play and Education Learning Math Game, Money and Banking Play Toys, Movie Prop Motion Picture Money for Birthday Gifts","https://m.media-amazon.com/images/I/81Ekpl7MAwL._AC_UL320_.jpg","4.6","20","12.99","230"
"B0968TFSYW","Ulanik Balls in Cups Toddler Montessori Toys for 1+ Year Old Kids Wooden Matching Game for Learning Color Sorting and Counting — 12 Balls, 1.18 in","https://m.media-amazon.com/images/I/61Z6XXfnbfL._AC_UL320_.jpg","4.5","465","29.5","230"
"B0B84XNQ83","4 Pack Wooden Lacing Toy,Educational Threading Activity Puzzles,Learning Fine Motor Skill Travel Toy,Wooden Fruit Threading Set for Toddlers Kids 3 4 5 Year 1 Apple,1 Watermelon,1 Pineapple,1 Peach","https://m.media-amazon.com/images/I/71Pm-ePvV9L._AC_UL320_.jpg","4.4","18","10.99","230"
"B0BVZ15NK7","wonuu Car Accessories Rubber Ducks Dashboard Decorations Rubber Duck Pink Accessories Dashboard Duck Car Decorations Car Ducks for Dashboard Car Duck Car Dashboard Decorations, HG&pink-cowboywhitepink","https://m.media-amazon.com/images/I/61AaHLXwL4L._AC_UL320_.jpg","4.6","86","7.99","230"
"B014PA7CE2","edxeducation Student Math Balance - In Home Learning Manipulative for Early Math and Number Concepts - Includes 20 Weights - Beginner Addition, Subtraction and Equations","https://m.media-amazon.com/images/I/61Q+MCVYUqL._AC_UL320_.jpg","4.3","667","9.99","230"
"B0791CNT6L","Jumbo Nuts and Bolts Fine Motor Skills, 24Pcs Occupational Therapy Toddler Toys, Shapes and Colors Matching Toys, Montessori Building Construction Matching Game with Storage Box for Toddlers Baby","https://m.media-amazon.com/images/I/61UaP7qh22L._AC_UL320_.jpg","4.6","437","12.99","230"
"B08WZC6CK5","Little Chubby One Busy Board Set - 8x10 Inches - Learning Activity Toy - Educational, Helps Develop Motor & Dress Skills - Color, Hand Eye Coordination - Learn to Button, Buckle, Zip, Snap, Lace & Tie","https://m.media-amazon.com/images/I/91-AXSIxCyL._AC_UL320_.jpg","4.2","440","17.95","230"
"B09QV3T5LH","Baby Starters Magic Years Soft, Crinkle Activity Book with Teether, Tabs and Strap, 5 inches (Happy Halloween)","https://m.media-amazon.com/images/I/81tEoRfaOqL._AC_UL320_.jpg","4.8","54","12.99","230"
"B09YQNDNYD","JUXUE Spinning Toy, Rainbow Stacking Toys for Toddlers 1-3, Ring Stacker Baby Toys 6 to 12 Months, 1 One Year Old Girl Boy Christmas Birthday Gifts, Montessori Educational Learning Autism Sensory Toys","https://m.media-amazon.com/images/I/61MI-dJc1qL._AC_UL320_.jpg","4.6","240","16.88","230"
"B0C3TWQ829","Maliton 3 Pack Silicone Baby Teething Toys for Infant Toddlers, Teething Toys for Babies 6-12 Months, Baby Gifts for Girl & Boy, Baby Remote Control Shape Teething Toys for Sucking Needs, BPA Free","https://m.media-amazon.com/images/I/71TrWnPMidL._AC_UL320_.jpg","4.7","83","7.99","230"
"B08HNFCDX4","24 Pieces Natural Beech Wood Pacifier Clips Teething Grasping Toy Suspender Clips Charm DIY Pacifier Clips Holder Accessories","https://m.media-amazon.com/images/I/71EM5sPuSaL._AC_UL320_.jpg","4.8","407","13.49","230"
"B07JZ6BX96","Coogam Wooden Letter Number Construction Puzzle Educational Stacking Blocks Toy Set Shape Color Sorter Pegboard Activity Board Sort Game for Kids Gift Preschool Learning STEM Toy","https://m.media-amazon.com/images/I/61Povz2uVDL._AC_UL320_.jpg","4.5","2386","11.99","230"
"B09WJM1Y1K","Ryan & Rose Cutie Clinks Attachable Teether Chew Toy for Babies (Neutral)","https://m.media-amazon.com/images/I/51v-+aAgGqL._AC_UL320_.jpg","4.7","649","16.99","230"
"B09BKNVTDN","Car Seat Toys Baby Toys 0-3 Months Infant Toys Spiral Stroller Toys, Newborn Toys Black and White Baby Toys, High Contrast Baby Toys for Crib Mobile, Baby Toys Gift for 0 3 6 9 12 Months Girls Boys","https://m.media-amazon.com/images/I/71Lt7NF6LnL._AC_UL320_.jpg","4.5","743","16.99","230"
"B084JBMZNL","Bundaloo Duck Fishing Game Contest - Fun Carnival Game and Outdoor Party Toy for Kids - Inflatable Pond, 2 Rope Fishing Poles With Hooks, 6 Floating Ducks","https://m.media-amazon.com/images/I/61miaCnUDhL._AC_UL320_.jpg","3.8","170","19.99","230"
"B01NBAH4HL","Be Happy! Neon Colored Smile Funny Face Stress Ball - Happy Smile Face Squishies Toys Stress Foam Balls for Soft Play - Bulk Pack of 12 Relaxable 2.5"" Stress Relief Smile Squeeze Balls Fun Toys","https://m.media-amazon.com/images/I/71d5st8vxwL._AC_UL320_.jpg","4.6","1714","11.99","230"
"B09Z1R6VCW","8-in-1 Sensory Balls for Infant Toddlers,Rainbow Fabric Baby Toy for Sensory Development,Montessori Toys for Babies 6-12 Months,8 Different Sensory Tactile Textures with Crinkle Rattle Squeakers","https://m.media-amazon.com/images/I/71cfw7m+W7L._AC_UL320_.jpg","4.7","190","17.99","230"
"B07NDCWK9G","Bright Starts Wobble Bobble Activity Ball Toy, Ages 3 Months+","https://m.media-amazon.com/images/I/716bFGGFkEL._AC_UL320_.jpg","4.3","1150","13.62","230"
"B001QKIVO0","Manhattan Toy Skwish Natural Rattle and Teether Grasping Activity Toy","https://m.media-amazon.com/images/I/61gPKLxzbkL._AC_UL320_.jpg","4.7","1632","20.99","230"
"B0B49NH5PB","114pcs Suction Toys Bath Toys for Kids Toddlers Family Game Preschool Learning Sensory Suction Cup Toys Montessori Classroom Toys for Kids 3 4 5 6 7 8, Bathtub Wall Window Toys for Autism PT GT","https://m.media-amazon.com/images/I/71DSyS6nI+L._AC_UL320_.jpg","4.6","164","28.99","230"
"B09H2Q4CCS","Dinosaur Bath Toys Light-Up Cibolar 6 Packs Floating Bath Toys Set for Baby Toddlers Kids in Birthday Easter Christmas Shower Pool Bath Toys Boys Girls Children Preschool Bathtub Bathroom","https://m.media-amazon.com/images/I/61k3hJRi9+L._AC_UL320_.jpg","4.4","996","12.89","230"
"B07QPT8XJD","iPlay, iLearn Dinosaur Baby Rattles, Infant Shaker, Newborn Grab N Shake Rattle, Sensory Teether, Development Learning Teeth Toy, Birthday Shower Gifts for 3 4 5 6 7 8 9 10 12 Month Babies Boy Girl","https://m.media-amazon.com/images/I/71r92lSkRIL._AC_UL320_.jpg","4.7","1460","14.99","230"
"B00005O63Q","Melissa & Doug Beginner Wooden Pattern Blocks Educational Toy With 5 Double-Sided Scenes and 30 Shapes","https://m.media-amazon.com/images/I/71ZYlCMeGwL._AC_UL320_.jpg","4.8","1313","18.99","230"
"B07JB9J966","Melissa & Doug Mine to Love Mealtime Play Set for Dolls with Bottle, Pretend Baby Food Jars, Snack Pouch, More (24 pcs)","https://m.media-amazon.com/images/I/71DV0d8Q61L._AC_UL320_.jpg","4.8","1583","23.99","230"
"B096HLC53Q","Special Supplies Fun Pull and Stretch Tubes for Kids - Pop, Bend, Build, and Connect Toy, Provide Tactile and Auditory Sensory Play, Colorful, Heavy-Duty Plastic (Primary-12)","https://m.media-amazon.com/images/I/91J91BfjJSL._AC_UL320_.jpg","4.7","454","10.98","230"
"B00ZIYF1IO","Bright Starts Safari Beats Musical Drum Toy with Lights, Ages 3 Months +, Multi","https://m.media-amazon.com/images/I/714zG2esc2S._AC_UL320_.jpg","4.5","1652","10.89","230"
"B0CD7JQRGK","Zanktony 140 Pcs Prop Number Learning Education Toys for 3+ Year Old Boys and Girls - Birthday Gifts, Money Toys for Kids Aged 3+ Develops Early Math Skills, Preschool Math Games","https://m.media-amazon.com/images/I/81wFTvlAvNL._AC_UL320_.jpg","4.5","12","9.99","230"
"B08PCYX398","Wooden Baby Rattle Crochet Bunny Baby Toys Handmade Newborn Toy Early Development Grips Stuffed Animal Organic Rattle","https://m.media-amazon.com/images/I/61SRYfrKooL._AC_UL320_.jpg","4.8","356","14.99","230"
"B01LMVP80M","18 Pack Assorted Ocean Animal, Stretchy and Floating Rubber sea Animals Toy Set, Mini Realistic Under The Sea Life Figure for Toddler Bath Bathtub, Shark Octopus Fish Toys Bulk for Kid Squishy Party","https://m.media-amazon.com/images/I/713mgVWLiVL._AC_UL320_.jpg","4.4","2312","16.95","230"
"B085NSDNFP","Lacing Toy for Toddlers, Fine Motor Skill Toys for 3 Year Old, Educational Learning Montessori Activity for Baby Kids, Car Plane Travel Games, Wooden Threading Toys 1 Apple,1 Watermelon, 1 Cheese.","https://m.media-amazon.com/images/I/61KN1WAdyWL._AC_UL320_.jpg","4.8","382","14.99","230"
"B09XTY9WCH","12 Pcs Mini Rubber Ducks with Sunglasses/ Glasses and Hats/ Necklace, Valentine's Day Rubber Duck in Bulk Bathtub Toy for Cruise Valentines Kids Classroom Gift Exchange (Cute Style, Yellow)","https://m.media-amazon.com/images/I/71x++0CH36L._AC_UL320_.jpg","4.4","563","11.99","230"
"B00CQHYZ8I","Fisher-Price Laugh & Learn Toddler Playset, Learning Kitchen with Music Lights & Bilingual Content for Baby to Toddler Pretend Play","https://m.media-amazon.com/images/I/71BbSPqZY3L._AC_UL320_.jpg","4.8","3266","49.99","230"
"B09SVL2JHX","Learning Resources Pia The Fill & Spill Piñata - 11 Pieces, Age 18 Months Top Toddler Toys, Preschool, Fine Motor Skills, Educational Toys,Stocking Stuffers for Kids","https://m.media-amazon.com/images/I/813JVc9-hKL._AC_UL320_.jpg","4.8","207","16.99","230"
"B09V9BPT68","Infantino Peek & Seek Sensory Discovery Cube, Selfie Mirror, Early Fine Motor Skills Development, for Infants & Toddlers 3M+","https://m.media-amazon.com/images/I/81bmXSgMEtL._AC_UL320_.jpg","4.7","298","13.39","230"
"B0BV3FSV4M","Crazy Aaron's Hide Inside!® Gnome Home Thinking Putty®","https://m.media-amazon.com/images/I/91wLnUWoSPL._AC_UL320_.jpg","4.3","1544","14.95","230"
"B073QFBY9L","Timy First Bead Maze Roller Coaster Wooden Educational Circle Toy for Toddlers","https://m.media-amazon.com/images/I/71oDo1B2-GL._AC_UL320_.jpg","4.5","1805","18.99","230"
"B0C2HNVQLL","Bestbase 20 Pcs Educational Toddler Toys - Farm Animals for Toddlers 1-3, Montessori Toys with Finger Puppets Learning Color Matching Sorting Stacking, Baby Gifts Toys for 1+ Year Old Girl/Boy","https://m.media-amazon.com/images/I/810ZO6qJIWL._AC_UL320_.jpg","4.6","58","19.99","230"
"B0C69RJGT5","ShinySong Baby Toy Cars Press and Go Car for Toddlers, Light Up Toys Birthday Gifts for Kids Boys Girls, Giraffe & Tiger","https://m.media-amazon.com/images/I/71noyuUYbGL._AC_UL320_.jpg","4.6","22","12.99","230"
"B08JB3GJ1N","TUMAMA Black and White Baby Toys for 3 6 9 12 Months,Plush Hanging Rattles,Newborn Stroller Toys for Boys and Girls,4 Pack","https://m.media-amazon.com/images/I/71bRN5dzlnL._AC_UL320_.jpg","4.7","511","25.69","230"
"B089W3XF22","OKREVIEW First Birthday Cake Toy - Singing Music Cake Toys with Counting and Blow Candles Toys for 1 2 3 4 Years Old Boys Girls Birthday and Xmas Gift","https://m.media-amazon.com/images/I/51SqQg6xaeL._AC_UL320_.jpg","4.6","599","15.99","230"
"B014LQRTNO","VTech Go! Go! Smart Wheels Starter Pack 3-Pack","https://m.media-amazon.com/images/I/713PH318HyL._AC_UL320_.jpg","4.8","4329","23.99","230"
"B08KDFMTHJ","Joliecraft Woodlands Friends Baby Rattle Shaker Toy with Wooden Teething Ring Gray Elephant","https://m.media-amazon.com/images/I/81AS33NW+vL._AC_UL320_.jpg","4.8","178","14.99","230"
"B093TJSVH1","Baby's My First Golf Bag Playset","https://m.media-amazon.com/images/I/81Cwq6JB9hS._AC_UL320_.jpg","4.3","89","24.95","230"
"B0BYZ9DLKP","ERSIHUA 2-Pack Baby Teething Toys-TV Remote Control Shape Silicone Infants Teething Toys for Babies 0-18 Months,BPA-Free (2packs-Black)","https://m.media-amazon.com/images/I/61KF8yXrQdL._AC_UL320_.jpg","4.7","116","8.29","230"
"B0B3LQY8NV","Qilay Wooden Baby Activity Cube for Toddlers 1-3, 5 in 1 Multipurpose ABC-123 Abacus Early Educational Montessori Toys, Learning Toys for 1 2 3 Year Old | Bead Maze, First Birthday Gifts for Babies","https://m.media-amazon.com/images/I/81L-vgLvA+L._AC_UL320_.jpg","4.4","111","39.99","230"
"B07S698SV9","CozyBomB Monkey Balance Counting Cool Math Games - STEM Toys for 3 4 5 Year olds Cool Math Educational Kindergarten - Number Learning Material for Boys and Girls","https://m.media-amazon.com/images/I/71XVACgsCsL._AC_UL320_.jpg","4.6","3159","16.98","230"
"B09XT4N1ZK","12 Pcs Rubber Ducks with 12 Sunglasses/ Hats/ Headwear/ Scarf, Valentine's Day Mini Rubber Ducks in Bulk Bathtub Toys for Valentines Gift Baby Shower Holiday Cruise (Duck with Sunglasses, Yellow)","https://m.media-amazon.com/images/I/61t0nblLrUL._AC_UL320_.jpg","4.4","405","12.99","230"
"B08G4SYHZ4","Gemileo Wooden ABC Toy Building Blocks for Toddlers 1-3 36 PCS Wood Baby Alphabet Number Blocks for Stacking Learning Preschool Educational Montessori Sensory Toys for Kids Boys Girls Gifts 1.65""","https://m.media-amazon.com/images/I/71rGIVP2xwL._AC_UL320_.jpg","4.7","601","28.51","230"
"B09B9333FB","Fisher-Price Baby Bouncer Fitness Fun Folding Jumperoo Activity Center with Lights Music and Gym Themed Toys, Folds For Storage","https://m.media-amazon.com/images/I/71Yb7Tx5CvL._AC_UL320_.jpg","4.7","257","99.99","230"
"B0C6P79WSY","QANIY Interactive Pop Up Animals Toy with Music & Light, Montessori Early Learning Musical Toys for 9-12-18 Months Baby Toddler Developmental Cause and Effect Toys Gift for 1-2 Year Old Boys Girls","https://m.media-amazon.com/images/I/71OgozCChfL._AC_UL320_.jpg","4.6","14","21.99","230"
"B07PZG8NNF","Skip Hop Baby Bath Toy, Zoo Light Up Squeeze Toy, Unicorn","https://m.media-amazon.com/images/I/51RQUoU9nkL._AC_UL320_.jpg","4.7","3039","6.99","230"
"B0C6F9PLYS","Toddlers Toys for 1 2 3 Years Old Kids, 2 in 1 Pound A Ball Toy & Car Ramp Race Track Playset, Montessori Toys for 12-18 Months Baby, Fine Motor Skills Interactive Game, Birthday Gifts for Boys Girls","https://m.media-amazon.com/images/I/71sTUxM0RML._AC_UL320_.jpg","4.1","17","24.99","230"
"B09MFHLKD4","Car Toys for 1 Year Old Boy, Soft Baby Toys Set, Pull Back Car Vehicle Set Birthday Gifts Toys for Baby Toddlers Age 1 Year Old (7 Sets)","https://m.media-amazon.com/images/I/81DsLsWATmL._AC_UL320_.jpg","4.6","334","23.99","230"
"B0BYP1VNR7","Bath Toys for Toddlers, Turtle Baby Bath Toys with Wind-Up Swimming Turtle Sliding Bathtub Toys with Powerful Suction Cup Mold Free Bath Toys for Kids Shower Toys for Gift","https://m.media-amazon.com/images/I/71ISJX3Hs1L._AC_UL320_.jpg","4.2","12","9.99","230"
"B002ZW365W","Guess How Much I Love You Activity Toy for Babies","https://m.media-amazon.com/images/I/8194XiqvtcL._AC_UL320_.jpg","4.8","1595","14.99","230"
"B095XHSCK9","Multi-Colored Replacement Ball Set for VTech Drop & Go Dump Truck | Vibrant, Colorful Rock Balls Compatible with Vtech Construction Toy | 6","https://m.media-amazon.com/images/I/51uRSFB-c3L._AC_UL320_.jpg","4.8","244","8.99","230"
"B0BLBQBYYG","VIKOS Products Toy Bar for Baby Bouncer - Googly Eyes Toy Plays Music and Balls Make Tinkling Sounds - Baby-Safe Plastic Baby Bouncer Toys - Easy to Install Baby Bouncer Accessory","https://m.media-amazon.com/images/I/61t8cF+dpbL._AC_UL320_.jpg","3.6","23","19.99","230"
"B08865GD55","HOLA Baby Toys 6 to 12 Months Old Baby Piano Toys Infant Toys Elephant Light Up Music 9 Month Old Baby Toys 12-18 Months, Learning Birthday Gifts Toys for 1 Year Old Girl Boy","https://m.media-amazon.com/images/I/61x-LWJ2YOL._AC_UL320_.jpg","4.6","1710","16.99","230"
"B09R6JKQ4R","Itzy Ritzy Teensy Teether - Soothing Silicone Hollow Teether Features Flexible, Easy-to-Hold Handle, Hero Pop","https://m.media-amazon.com/images/I/61rMJVJyBZL._AC_UL320_.jpg","4.7","739","6.98","230"
"B0CDLP45T6","Baby Montessori Toys for 6 to 12 Months, Shape Sorter Sensory Bin with 6 Shape Blocks, Stacking Rings Infant Teething Toys, Suction Cup Spinner Toddler Bath Toy, Baby Toys Gift for Birthday Christmas","https://m.media-amazon.com/images/I/71NT4cQfbCL._AC_UL320_.jpg","5.0","10","24.98","230"
"B00368CQ6Y","BRIO World 33214 - Freight Battery Engine - 1 Piece Wooden Toy Train Set for Kids Age 3 and Up, Green","https://m.media-amazon.com/images/I/719oojQHhnL._AC_UL320_.jpg","4.6","4137","29.99","230"
"B083CNBNZC","ArtCreativity Vinyl Zoo Animals, Pack of 12 Assorted Squeezable Toys, Safari Birthday Party Favors for Kids, Fun Bath Tub and Pool Toys for Children, Educational Learning Aids for Boys and Girls","https://m.media-amazon.com/images/I/61OdI-vLH6L._AC_UL320_.jpg","4.6","611","15.99","230"
"B0CH39MGML","Chewy Necklace for Sensory Kids, Seeway Silicone Sensory chew Necklace Oral Motor Aids for Boys Girls, Autism Chew Toys for Kids Teens Adults with Anxiety ADHD SPD or Other Sensory Needs【2 Pack】","https://m.media-amazon.com/images/I/61NixEgR9oL._AC_UL320_.jpg","4.7","5","9.99","230"
"B01CDLJ2UW","Kicko 2 inches Assorted Rubber Ducks in Bulk - 50 Pack - Ducking Jeeps for Kids - for Sensory Play, Stress Relief - Stocking Stuffers, Classroom Prizes, Decorations, Supplies, Holidays, Pinata Filler","https://m.media-amazon.com/images/I/71-8LZLTOxL._AC_UL320_.jpg","4.7","4754","19.99","230"
"B0C16X8G8Q","JOCY Wooden Montessori Toys for Babies 6-12 Months, Wooden Toys for Babies, Rainbow Spinning Drum, Ball Coin Drop Toy House, Shape Sorter for 1 Year Toddlers","https://m.media-amazon.com/images/I/61oln5DWbHL._AC_UL320_.jpg","4.6","32","27.99","230"
"B0CCJ1MS49","Austion Quick-Fetch Way Mesh Bath Toy Holder, Wide Opening and Large Capacity Bath Toy Storage for Quick Access to Toys, Space-Saving Wall-Mounted Bath Toy Organizer, Quick Dry Bathtub Toy Holder","https://m.media-amazon.com/images/I/81jhCyvFzBL._AC_UL320_.jpg","4.0","5","11.99","230"
"B07J2FRL52","Baby Music Shake Dancing Ball Toy, BPA Free Bouncing Sensory Developmental Ball for Boys and Girls","https://m.media-amazon.com/images/I/61LoDXbubfL._AC_UL320_.jpg","4.3","3088","22.89","230"
