"asin","title","imgUrl","stars","reviews","price","category_id"
"B0BQQBFXZ5","24 Pack Kids Lacing Cards Kits Bulk Children Sewing Set Crafts Activity Summer Flowers Insect Cutouts Preschool Toddlers Classroom School Party Game","https://m.media-amazon.com/images/I/81afLriMUOL._AC_UL320_.jpg","4.2","13","11.99","219"
"B0B8RMDQHG","Banne Magnetic Drawing Doodle Board for Kids Toddlers 14Inch Colorful Travel Size Erasable Sketching Pad Toys for Writing Painting and Learning","https://m.media-amazon.com/images/I/8137NP2NPLL._AC_UL320_.jpg","4.5","891","8.99","219"
"B07SMNCMGD","Giant Art Case Set of 1600+ Pc.– Arts and Crafts Supplies for Kids 6+ – DIY Projects Case Filled with Pom Pom Box Craft Kit Library, Beads, Buttons, Scissors, and Pipe Cleaners with Easy Instructions","https://m.media-amazon.com/images/I/91a2af3+0kL._AC_UL320_.jpg","4.7","899","32.99","219"
"B0BJWL3JBK","Kids Paint Set - 6 Count Kids Paint, Painting Paper Pad, 7 Paint Brushes for Kids - Washable Paint for Kids - Finger Paint Supplies, Paint Paper Book Ultimate Paint Set for Kids","https://m.media-amazon.com/images/I/71qzEhYBYBL._AC_UL320_.jpg","4.1","12","13.29","219"
"B098Q2V4S8","Christmas Stickers for Kids Animal Ornament Ball Bottle Ornaments Sticker Roll Envelopes Seal Gift Tags 500Pcs","https://m.media-amazon.com/images/I/61q176mRvCL._AC_UL320_.jpg","4.8","90","7.99","219"
"B08Y2XG67F","My Scratch Offs - 20 Pack DIY Make Your Own Halloween Party Fortune Teller Scratch Off Cards & Stickers for Party Games, Teacher Rewards, Small Business Promotion & Prizes - 3x4","https://m.media-amazon.com/images/I/91-8KlVXsVL._AC_UL320_.jpg","4.7","522","9.79","219"
"B0B831XXC4","PlayMonster Little Knitty Bittys Fox - Beginner Knitting Craft Kit - Makes 3 Mini Projects - Collect & Trade Clothes - Ages 7+","https://m.media-amazon.com/images/I/61xz4yph+oL._AC_UL320_.jpg","4.4","34","18.99","219"
"B06ZYV47B9","Tiny Mills 50 Pcs Bible Characters Religious Assorted Stampers for Kids","https://m.media-amazon.com/images/I/61glXjE8iQL._AC_UL320_.jpg","4.6","194","12.99","219"
"B07Y9P3VJK","Sylfairy Aprons for Kids Girls Rainbow Unicorn Apron Children Kitchen Chef Aprons Smock (Green+Dinosaur, Small,3-5Years)","https://m.media-amazon.com/images/I/81zRWsgJZXL._AC_UL320_.jpg","4.7","2963","8.99","219"
"B01HZMQ0KE","Colorations SPLITC Double-Dip Divided Paint Cups Multipack for Kids Painting Supplies(Set of 5)","https://m.media-amazon.com/images/I/71vxciWgw+L._AC_UL320_.jpg","4.7","195","21.99","219"
"B0B2JRK3LF","Halloween Witch Broom Pencil Colorful Witch Broom Pens Wizard Pencil Broom Writing Pencils Halloween Party Favors for Kids Adult Goody Bag Filler School Classroom Office Supplies(12 Pieces)","https://m.media-amazon.com/images/I/810tA2gF1jL._AC_UL320_.jpg","4.2","28","10.99","219"
"B0BQHC39S8","Auihiay 144 PCS Printable Shrinky Dink Sheets Kit Include 10 Sheets Shrink Films Papers for Inkjet Printer (8.3 x 11.6 inch), 134 DIY Accessories, Creative Crafts for Kids All Ages","https://m.media-amazon.com/images/I/81+QBzjMNAL._AC_UL320_.jpg","4.7","45","17.99","219"
"B0C3QH1ZDT","102PCS Sports Baseball Stickers for Teens,Baseball Party Favors Sticker for Water Bottles,Baseball Gifts for Boys/Girls/Aldults/Boys， Vinyl Waterproof Decals for Helmets Scrapbooking Hydro Flasks","https://m.media-amazon.com/images/I/71-puarSuaL._AC_UL320_.jpg","4.3","9","6.91","219"
"B09WRJ697V","100 Pcs Cute Dinosaur Stickers for Kids 3-8, 2-4 Water Bottles Dino Stickers","https://m.media-amazon.com/images/I/81lxKpJ8uuL._AC_UL320_.jpg","4.8","102","6.99","219"
"B0B1PY133Y","X1zuue 32 Sets Fall DIY Bookmarks Craft Kit AutumnBlank Bookmark with Maple Leaf Wiggle Eyes Foam Stickers Pom-pom Art Reading Rewards Gift Fall Thanksgiving Party Decorations Favors Supplies for Kids","https://m.media-amazon.com/images/I/91e6zOiKPkL._AC_UL320_.jpg","4.1","6","12.99","219"
"B00HHG7M88","Mickeymouse Clubhouse Stickers 100 per roll","https://m.media-amazon.com/images/I/51Rufd2DihL._AC_UL320_.jpg","4.7","200","12.99","219"
"B0C8CJ73XS","IAGBIBUI Kids Apron and Chef Hat Set, 24 Pieces Boys Girls Kids Apron with 2 Pockets Adjustable for Cooking Classroom Baking Painting, 6-13 Years, Multicolor","https://m.media-amazon.com/images/I/71dE46r-3HL._AC_UL320_.jpg","4.4","19","27.99","219"
"B07V3GM142","Power Rangers Backpack Preschool Boys Set with Stickers, Coloring Books and More","https://m.media-amazon.com/images/I/81Q5tOi--ZL._AC_UL320_.jpg","4.0","455","16.95","219"
"B09BDJGMY9","Curious Toddler™ Activity Cards | 40+ Activities for Toddler & Me (12-24 Months) | Developmentally-Focused and Stimulating Creative Playtime Ideas | Bonus: Two Recipes for Dough & Dyed Pasta","https://m.media-amazon.com/images/I/7139e8sIfjL._AC_UL320_.jpg","4.4","34","34.99","219"
"B09SJ494XS","Hello Kitty Large Kitchen Scissors, Blue","https://m.media-amazon.com/images/I/51I4CgU71EL._AC_UL320_.jpg","5.0","6","16.99","219"
"B084Z1GJLG","Arches A1795103 Bloc Enc 26x36 12H Aquarelle 100% Thick 300g Blanc NAT, White Natural","https://m.media-amazon.com/images/I/71bQ-2YWtbL._AC_UL320_.jpg","4.5","45","23.31","219"
"B0C4Z63W1J","FIFA 2023 Women's World Cup Sticker Collection Starter Pack","https://m.media-amazon.com/images/I/81Y+QzVGYtL._AC_UL320_.jpg","4.3","83","14.89","219"
"B09SS7SJLT","Be Careful Who You Hate It Could Be Someone You Love | LGBT Sticker |Great Gift Idea|Decal Sticker|2 Pack|5 Inch Stickers|S10340","https://m.media-amazon.com/images/I/619uIwKVLtL._AC_UL320_.jpg","4.6","34","8.95","219"
"B098X3XW8G","450 Pieces 30 Sheets Glitter Butterfly Stickers Prismatic Stickers Rainbow Butterfly Stickers Laser Butterfly Decal Colorful Butterfly Wall Decor for Scrapbooking Home Decoration Party Favor DIY Craft","https://m.media-amazon.com/images/I/91vzikTXrDL._AC_UL320_.jpg","4.7","86","8.99","219"
"B0006O31IS","Hangar 9 UltraCote True Red HANU866 Airplane Covering","https://m.media-amazon.com/images/I/61ncwSn2ULL._AC_UL320_.jpg","4.5","71","19.99","219"
"B0722VDJ1S","SmileMakers Paw Patrol Sports Stickers - Prizes and Giveaways - 100 per Pack","https://m.media-amazon.com/images/I/71bLqgArzOL._AC_UL320_.jpg","4.8","75","14.99","219"
"B08ZY3WJZT","Skylety Wool Felt Bees Mini Crafts Ball Bee for Baby Shower Gender Reveal Party Favors Nursery Tent Decoration Craft DIY Car Seat Hat Grasping Bead Toys (30 Pieces)","https://m.media-amazon.com/images/I/71LZIsH4gpL._AC_UL320_.jpg","4.8","263","14.99","219"
"B0BPYL9RGJ","50 PCS Cute Stickers San-riio Stickers Kawaii Stickers for Water Bottle Laptop Computer Phone Case Luggage Notebook Decals Stickers for Kids Teen Adults","https://m.media-amazon.com/images/I/71ME1UBNuxL._AC_UL320_.jpg","4.8","51","5.99","219"
"B09F7PFKQT","Creativity for Kids Quick Knit Headband Making Kit - Kids Knitting Kit for Beginners - DIY Projects for Kids","https://m.media-amazon.com/images/I/919tAIuKj0L._AC_UL320_.jpg","4.6","2649","24.99","219"
"B07NZ8BNPJ","Boley Doodle Boards - 3 Pk Blue & Green Magnetic Drawing Board 4 Pc Stencils Set for Kids - Portable Toddler Writing Tablet & Sketch Pad for Ages 3+","https://m.media-amazon.com/images/I/612A1P02khL._AC_UL320_.jpg","4.4","388","23.99","219"
"B09WHS1Z87","Aoibrloy 58PCS Freshie Making Kit with Instructions, DIY Car Freshie Supplies with Unscented Aroma Beads, Freshies Cutters Molds and Accessories for Making Car Air Freshener","https://m.media-amazon.com/images/I/71X5ucRXiSL._AC_UL320_.jpg","4.4","175","13.99","219"
"B0BN7V3J14","Kawaii Cartoon Stickers 100PCS Cute Lazy Egg Stickers Vinyl Waterproof Stickers for Laptop Water Bottles Skateboard Guitar Boys Girls Kids Teens Adults Birthday Party Supplies","https://m.media-amazon.com/images/I/91CPn8+qb8L._AC_UL320_.jpg","4.5","31","7.99","219"
"B0C5R1P4Q6","imprsv Marquee Numbers, 4FT Marquee Light Up Numbers for 3rd Party Birthday Decorations, Number Three Balloon Frame, Number Blocks Birthday Decor, Mosaic Numbers for Balloons, Large Cardboard Numbers","https://m.media-amazon.com/images/I/716P83b4NrL._AC_UL320_.jpg","4.0","166","33.99","219"
"B095PWRDMW","Paw Patrol Stickers and Tattoos Party Favors Bundle Set ~ 200 Paw Patrol Temporary Tattoos and Stickers (Paw Patrol Party Supplies)","https://m.media-amazon.com/images/I/91sEgVaQT8S._AC_UL320_.jpg","4.2","17","8.95","219"
"B0C1MZJYFC","32PCS Cartoon Make-a-face Stickers, DIY Face Stickers Gift Cartoon Party Sticker,Laptops,Wall,Water Bottle and Party Decorations,Gifts for Boys and Girls. (A1)","https://m.media-amazon.com/images/I/81F2jowCwdL._AC_UL320_.jpg","4.8","7","10.99","219"
"B0BNW2T5DB","50PCS Austin Actor Butler Elvis Stickers Party Supplies Waterproof Graffiti Vinyl Sticker Decals Toy Kid Gifts","https://m.media-amazon.com/images/I/81IsFF-7aZL._AC_UL320_.jpg","4.9","20","7.69","219"
"B09GXGQSSH","Outus 300 Pieces It's My Birthday Stickers Roll Happy Birthday Badge Stickers for Kids Home Classroom Birthday Gifts Party Decoration","https://m.media-amazon.com/images/I/71eF1k1n1kL._AC_UL320_.jpg","4.7","45","13.99","219"
"1338533487","Klutz Make Your Own Glitter Face Masks","https://m.media-amazon.com/images/I/7149ztOV0kL._AC_UL320_.jpg","3.9","195","21.99","219"
"B085H7SDHD","Horizon Group USA Pre-Printed Canvas & Paint Art Set, 3-Pack 5x7 Canvas Panels, 12 Tempera Paints, 6 Easy-Grip Assorted Paintbrushes for Paint Projects, Dino, Food, Glitter Space","https://m.media-amazon.com/images/I/81khRIM+2rL._AC_UL320_.jpg","4.6","831","8.6","219"
"B0C7PPJSWK","Vibrant Seashell Delights:50 Colorful Shell Stickers","https://m.media-amazon.com/images/I/81Ceia83dQL._AC_UL320_.jpg","4.4","13","5.99","219"
"B08B45F8YW","King of The Hill Stickers 50Pcs, American Cartoon TV Series, Funny Cartoon Stickers for Water Bottle Phone Luggage Bike Skateboard, Cool Helmet Bumper Car Vinyl Decal [King of The Hill]","https://m.media-amazon.com/images/I/71q7uoQZDpL._AC_UL320_.jpg","4.6","351","6.99","219"
"B00US4VCXC","Fluid 100 Artist Watercolor Block, 300 lb (640 GSM) 100% Cotton Cold Press Pad for Watercolor Painting and Wet Media w/Easy Block Binding, 4 x 6 inches, 10 Sheets","https://m.media-amazon.com/images/I/71y57lwHTWL._AC_UL320_.jpg","4.5","206","8.99","219"
"B0B56FNP1F","48 Set Bulk Watercolor Paint Set Washable Water Color Paint 8 Colors Travel Watercolor Set with Paintbrushes for Kids and Adults Students Art Party Favors School Classroom Supplies","https://m.media-amazon.com/images/I/913vR-WbbWL._AC_UL320_.jpg","3.6","14","29.99","219"
"B09116ZSMW","Black Alcohol Ink Paper - 25 Sheets Pixiss Heavy Weight Art Paper for Alcohol Ink & Watercolor - Extra Smooth Synthetic Paper A4 8x12 inches, 300gsm","https://m.media-amazon.com/images/I/71ooGDylzXL._AC_UL320_.jpg","4.3","86","19.99","219"
"B07HBM7FLV","Playhouse Candy Shop Cherry Scented Scratch & Sniff Stickers - 1 Pack of Two Sticker Sheets","https://m.media-amazon.com/images/I/71tD9QFoUwL._AC_UL320_.jpg","4.4","76","5.45","219"
"B09D3QSRM8","Diecast Masters CAT D8T Bulldozer Keyring","https://m.media-amazon.com/images/I/41EPQ9ujLbL._AC_UL320_.jpg","4.4","32","12.99","219"
"B079PZ7R6S","L.O.L. Surprise! Light Up Diary By Horizon Group Usa, Decorate & Customize Your Own Fun Diary, Sticker Sheet & Pen Included, Multicolored","https://m.media-amazon.com/images/I/81IWceHL0vS._AC_UL320_.jpg","4.7","810","12.64","219"
"B073645C5G","Hot Wheels Shaped Stickers - Prizes 100 per Pack","https://m.media-amazon.com/images/I/71Ual1IAOQL._AC_UL320_.jpg","4.1","91","10.0","219"
"B08NV8KZP1","FaCraft Nativity Stickers,24 Sheets Make a Nativity Scene Sticker,Funny Christmas Crafts for Religious Party Favor Nativity Scene Party Game for Kids","https://m.media-amazon.com/images/I/81tGtBIEJEL._AC_UL320_.jpg","4.5","60","9.99","219"
"B00ZBOXJD0","Cra-Z-Art Giant Color Craze 20 Dough Pack","https://m.media-amazon.com/images/I/91c6lcxneuL._AC_UL320_.jpg","4.3","125","15.99","219"
"B097D96R2F","YIUO 100 Pieces Animal Stickers Kawaii Cartoon Gift for Kids Teen Birthday Party Vinyl Waterproof Stickers for Water Bottle,Hydro Flasks,Scrapbook,Laptop,Luggage,Phone, Cute Stickers Pack","https://m.media-amazon.com/images/I/811WG3QHDcS._AC_UL320_.jpg","4.7","595","7.99","219"
"B00713LRDS","Rainbow Loom Twistz Bandz Latex Free Rubber Band Refill + C-clips - Black","https://m.media-amazon.com/images/I/91x03sZUUnL._AC_UL320_.jpg","4.6","352","5.49","219"
"B09FYDDCH7","Tara Toys: Disney Princess DIY Jewelry Activity Necklace Advent Calendar, Fun and Easy to do, for Your Little Princess, for Ages 3 and up","https://m.media-amazon.com/images/I/81j0ze6pyfL._AC_UL320_.jpg","4.5","281","21.99","219"
"B09GFNNS55","JOPHMO DIY Fall Thanksgiving Felt Pumpkin Turkey Hanging Decor for Kids Felt Crafts and Kits Adhesive Ornaments Thanksgiving Party Favor Decorations Indoors Outdoors","https://m.media-amazon.com/images/I/81uvhHOgV2L._AC_UL320_.jpg","4.4","39","13.99","219"
"B0C4S9VQWG","Bingo Daubers 6 Dot Markers for Toddlers 1-3 | Easy Hold Dot Art Markers w Bingo Bag | Bingo Set 20 Bingo Cards 6 Bingo Markers | Dot Paints for Toddlers, Bingo Dotters Washable, Bingo Supplies","https://m.media-amazon.com/images/I/81Fwqc6rr6L._AC_UL320_.jpg","5.0","33","15.99","219"
"B00S2XN6LW","Teacher Created Resources® Superhero Mini Stickers Valu-Pak, 3/8 in, Multicolored, 1144 Pieces","https://m.media-amazon.com/images/I/91qr4eIVMBL._AC_UL320_.jpg","4.6","205","9.32","219"
"B09Z2KRY7Y","72 Pieces Mini Magnetic Drawing Board for Kids, Backpack Keychain Clip Drawing Boards Erasable Doodle Board Sketch Pad for Kids Birthday Party Favors, Prizes, Goodie Bag Fillers, Gift Bag Toys","https://m.media-amazon.com/images/I/916bM+UmCaL._AC_UL320_.jpg","4.7","19","59.99","219"
"B09CCWCMQ2","Tree of Life Totem Stickers, 50PCs, Aesthetic Vinyl Waterproof Decals, Stickers for Hydro Flask, Laptop, Water Bottle, Stickers for Kids, Toddlers, Teens, Girls, Car, Helmet Stickers Tree of Life","https://m.media-amazon.com/images/I/91HVD-Is6TL._AC_UL320_.jpg","4.7","49","5.99","219"
"B08289B2KJ","Disney Peter Pan Sticker and Tattoos Party Favors Super Set ~ Bundle Includes Over 200 Peter Pan Temporary Tattoos and Stickers (Peter Pan Party Supplies)","https://m.media-amazon.com/images/I/91xDsQTHWoL._AC_UL320_.jpg","4.4","49","7.95","219"
"B07PBLBG5Q","Craft-tastic – DIY Puffy Charms Craft Kit – Design a Necklace, Charm Bracelets, Pencil Toppers & Shoelace Charms with Puffy Stickers – Fun Creative Activity for Ages 7+","https://m.media-amazon.com/images/I/6111VUnJiPL._AC_UL320_.jpg","4.4","559","16.99","219"
"B0C2Y5G42S","WERNNSAI 2 Pack Kids Aprons for Toddler Art Aprons Kids Toddler Paint Art Smock","https://m.media-amazon.com/images/I/6126YwdRJJL._AC_UL320_.jpg","4.1","12","11.99","219"
"B0BJTKTDV3","Oun Nana Playdough Tools 53 PCS Dough Tools Kits for Kids, Playdough Accessories Various Shape Molds, Animal, Dinosaur, Stamps, Scissors, Extruder, Cutters, Rollers, Dough Mat with Storage Bag","https://m.media-amazon.com/images/I/71TS20uqBZL._AC_UL320_.jpg","4.8","23","18.99","219"
"B00HRO56L0","Stamps by Impression Lips Kiss Rubber Stamp, 1"" x 1.75""","https://m.media-amazon.com/images/I/61nuRBzOQhL._AC_UL320_.jpg","4.5","103","9.99","219"
"B0989DCD9W","JOYIN 12 Pcs Halloween Craft Kid Wooden Magnet Creativity Arts, DIY Halloween Painting Craft Kits for Kids Halloween Party Supplies, Birthday Parties and Toddler Crafts","https://m.media-amazon.com/images/I/81uEgJAQJSL._AC_UL320_.jpg","4.3","97","11.99","219"
"B0B125PP4K","20 Spider Bottle Label Super Hero Water Bottle Stickers Birthday Party Supplies for Girls Boys","https://m.media-amazon.com/images/I/61h-vBuPoeL._AC_UL320_.jpg","4.3","31","7.99","219"
"B09DD9RWW3","BeYumi 1000Pcs Monster Truck Stickers Perforated Roll Checkered Hot Wheels Big Foot Decals with 24 Designs Monster Truck Party Favors Supplies Laptop Water Bottle Birthday Reward Stickers for Kids Boy","https://m.media-amazon.com/images/I/91FMDPqORtL._AC_UL320_.jpg","4.5","102","10.99","219"
"B000BN76H6","Tamiya 300087079 WM Ageing Set A Sand/Light Sand/Mud","https://m.media-amazon.com/images/I/51VWOIYA+NL._AC_UL320_.jpg","4.6","745","13.0","219"
"B006TYYC5U","Color Your Own Zoo Animal Masks - 12 Make Your Own Animal Faces Arts & Crafts for Jungle Safari Party Zoo Animal Birthday Party - Kids Crafts Activities DIY Party favors - Dressup Kids Home Activities","https://m.media-amazon.com/images/I/819uWMHDTeL._AC_UL320_.jpg","4.5","63","9.99","219"
"B08CN58JLP","YOBEYI 5D Diamond Painting Kits for Kids Wooden Frame Diamond Arts and Crafts for Kids Mosaic Gem Stickers by Number Kits DIY Painting Arts Crafts Set Embroidery Christmas Gift (cat)","https://m.media-amazon.com/images/I/61kpbNXHHxL._AC_UL320_.jpg","4.3","30","9.99","219"
"B08N5KBPJ8","Prextex Dinosaur Painting Kit for Kids - 13-Piece Kids Arts and Crafts Set for Boys and Girls | Dinosaur Birthday Party Supplies, Dinosaur Toy Party Favors| Toddler Art Kit Favors, Kid Crafts Sets","https://m.media-amazon.com/images/I/81ud5-9zZAS._AC_UL320_.jpg","4.5","79","10.99","219"
"B000F8R0FA","Creativity Street FLUFF4OZ-6401 Craft Fluffs (100 Pack), 4 oz, Blue","https://m.media-amazon.com/images/I/71JsbJBTvnL._AC_UL320_.jpg","4.4","203","7.11","219"
"B07KRR8RBX","Liberty Imports Glow in The Dark Sand Art Kit for Kids - DIY Arts and Crafts Activity for Kids - Includes 5 Sand Colors, 1 Glow Sand, 5 Sand Art Bottles, and More","https://m.media-amazon.com/images/I/81vCQ16u6zL._AC_UL320_.jpg","4.3","245","10.99","219"
"B077Z9C6F9","Tiny Mills 24 Pcs Spring Flowers Butterfly Stampers for Kids Garden Birthday Party Tea Party Favors Fairies Party Favors Pinata Fillers Goody Bag Stuffers Classroom Rewards Carnival Prizes","https://m.media-amazon.com/images/I/51jzEVBAxQL._AC_UL320_.jpg","4.5","111","10.99","219"
"B0B5JZD45R","81 Pack Halloween Baby Gender Reveal Poster Game with Girl or Boy Voting Stickers 1 Cast Your Vote Sign with Poster 40 Green and 40 Purple Halloween Pumpkin Stickers Gender Reveal Decorations","https://m.media-amazon.com/images/I/81z+KKTZKaL._AC_UL320_.jpg","3.8","10","10.98","219"
"B09Y8MD4RF","48 Pieces Pixel Miner Themed Stackable Multi Point Pencils Fun Pencils with Erasers Non Sharpening Stacking Point Pencil Mini Pencils Party Favor for Craft Classroom Rewards Prizes, 5.8 Inch, 8 Styles","https://m.media-amazon.com/images/I/71OlFfcB2mL._AC_UL320_.jpg","4.1","21","11.99","219"
"B0BKCLKK9D","Boogie Board Scribble n’ Play Authentic Reusable Kids’ Drawing Board Creativity Kit, Includes Doodle Board with Color Burst, Instant Erase Button, Textured Drawing Tools and Styluses for Kids Ages 4+","https://m.media-amazon.com/images/I/61yeRKUd-lL._AC_UL320_.jpg","4.5","27","34.99","219"
"B07CFL4WSH","Play-Doh Single Can Dough, Green","https://m.media-amazon.com/images/I/81PwLFBgBkL._AC_UL320_.jpg","4.4","91","5.49","219"
"B074JF2NP5","Play-Doh 2-Pack of Cans (Blue and Red)","https://m.media-amazon.com/images/I/81zSq4XiHHL._AC_UL320_.jpg","4.3","145","8.99","219"
"B09X3WCJ5L","Dyvicl Watercolor Paper Pad 5.5""x8.5"", 25 Sheets (140 lb/300gsm), Cold Press, Glue Watercolor Sketchbook for Painting, Drawing, Mixed Media, Acrylic, Art Paper for Kids Adults and Students","https://m.media-amazon.com/images/I/7147Iq9fO7L._AC_UL320_.jpg","4.5","62","8.29","219"
"B018IL7AQY","Harry Potter Books Set #1-7 in Collectible Trunk-Like Toy Chest Box, Decorative Stickers Included by Harry Potte","https://m.media-amazon.com/images/I/61FtDKQez2L._AC_UL320_.jpg","4.8","1305","176.89","219"
"B0BQLXHVFP","8 Sheets Kawaii Temporary Tattoos Stickers for Kids, Kawaii Toys Party Favors for Kids Birthday Party Decorations Supplies Decor","https://m.media-amazon.com/images/I/71Scls+sr0L._AC_UL320_.jpg","4.6","14","9.99","219"
"B01M3YBE68","Dreamworks Trolls Coloring and Activity Book Set -- 2 Trolls Books, Trolls Stickers, Posters, and Licensed Door Hanger","https://m.media-amazon.com/images/I/71P1LCRXJzL._AC_UL320_.jpg","4.4","87","9.96","219"
"B0046J8A7Q","Darice 9184-11 Wood Tepee Kit","https://m.media-amazon.com/images/I/61w0v7Ng54L._AC_UL320_.jpg","3.9","100","11.94","219"
"B0BJ2JSZVD","Watercolor Ocean Animal Stickers 50 Pcs Cute Waterproof Sea Life Stickers for Laptop Skateboard Water Bottle Phone Guitar Scrapbook Bike Cars,Vinyl Cartoon Ocean Plants Stickers for Kids Adults","https://m.media-amazon.com/images/I/812RWSROn8L._AC_UL320_.jpg","3.7","17","5.97","219"
"B013TRS9LM","Craft-tastic DIY String Art – Craft Kit for Kids – Everything Included for 3 Fun Arts & Crafts Projects – Space Series Features a Rocket Ship, Planet and Star Patterns, CT1506","https://m.media-amazon.com/images/I/91HTxnmwB1L._AC_UL320_.jpg","4.5","578","19.16","219"
"B0BTTK2ZD4","Easel for Kids - The Ultimate Art Station for Endless Fun, Kids Easel with Paper Roll - Unleash Child's Creativity, Kids Easel with Magnetic Chalkboard & White Board - Bring Out Child's Inner Artist","https://m.media-amazon.com/images/I/91GbtdGkgCL._AC_UL320_.jpg","4.5","27","84.99","219"
"B09TRJB6ZP","24PCS Water Bottle Labels for Encanto Birthday Party Supplies, Encanto Party Supplies Stickers Decorations for Boys Girls Kids Baby Shower Magic Party Favors","https://m.media-amazon.com/images/I/71XIbRMVY1L._AC_UL320_.jpg","4.8","344","8.99","219"
"B07Y37GT5K","120 Sheets Halloween Stickers Sheets Pumpkin Decoration Stickers Lantern Face Stickers for Halloween Party Supplies","https://m.media-amazon.com/images/I/81-ICYaRGDL._AC_UL320_.jpg","4.8","61","12.99","219"
"B09SBW68CN","Paper House Productions Harry Potter Foil Accent 512-Piece Officially Licensed Sticker Folio - Houses, Characters, Planner Stickers and More!","https://m.media-amazon.com/images/I/81NqUW-xupL._AC_UL320_.jpg","4.5","47","19.99","219"
"B07MTTSF8Q","Play-Doh Mysteries Disney Frozen 2 Snow Globe Playset Surprise Toy with 5 Non-Toxic Play-Doh Colors","https://m.media-amazon.com/images/I/81nCnzGG0BL._AC_UL320_.jpg","4.5","1708","15.24","219"
"B0019FJEZM","Schylling Metal Potholder Loom Set, Red","https://m.media-amazon.com/images/I/91X42790xoL._AC_UL320_.jpg","4.5","854","19.75","219"
"B0BK8FBQ2V","Western Party Games Pin the Badge on the Cowboy Game Include Cowboy Poster with 36 Badge Stickers and 1 Black Blindfold for Kids Birthday Party Favors Western Party Supplies","https://m.media-amazon.com/images/I/81bViu+bVYL._AC_UL320_.jpg","3.9","5","10.99","219"
"B007VYLKSO","Sargent Art 85-3150 1-Pound Art-Time Dough, Blue","https://m.media-amazon.com/images/I/61tGVmqOeCL._AC_UL320_.jpg","4.1","40","7.46","219"
"B07NVNHSCL","Playhouse Pizza Party Pizza Scented Scratch & Sniff Sticker Sheets - 1 Pack","https://m.media-amazon.com/images/I/61Da1uyrQVL._AC_UL320_.jpg","4.6","135","5.45","219"
"B00ZAVPAKY","Fun Express Fire Safety Foam Shapes - 300 Pieces - Educational and Learning Activities for Kids","https://m.media-amazon.com/images/I/81ClKNJmF5L._AC_UL320_.jpg","4.8","15","8.99","219"
"B0BCMX9LXX","Innovative Designs Minecraft Creative Coloring Canvas Painting and Activity Set for Kids, 1000+ pcs","https://m.media-amazon.com/images/I/71PFJ4WkatL._AC_UL320_.jpg","4.6","70","19.99","219"
"B074DZB8MV","Jumbo Multicolor Outdoor Sidewalk Chalk - 15 Piece Washable Premium Set","https://m.media-amazon.com/images/I/51-OGC2EqcL._AC_UL320_.jpg","4.5","20","7.49","219"
"B0BFVHZH7M","HAPMARS DIY Block Frame Making Kit, 5x7 Picture Frame, Easter Gifts for Kids, Mosaic Handmade Art Kits for Kids, Creative Activity DIY Toys, Ideal Birthday Gift for Boys and Girls Age 6-12","https://m.media-amazon.com/images/I/71omo+WPJNL._AC_UL320_.jpg","4.3","38","9.99","219"
"B09GVY5JZ2","12 Pieces Mini Magnetic Drawing Board Erasable Mini Doodle Board with Backpack Keychain Clip Classroom Party Favors Birthday Party Goodie Bags Fillers for Boys and Girls, 3 Colors","https://m.media-amazon.com/images/I/81aq1Ny7rcL._AC_UL320_.jpg","4.2","42","15.99","219"
"B0BRLHBZ75","Sky Castle DoodleJamz JellySparks - Sensory Drawing Pads Filled with Non-Toxic Squishy Beads, Gel and Glitter – Includes Stylus, Removable 2-sided Emoji Backer Card (Pink, Blue, Cyan, Purple)","https://m.media-amazon.com/images/I/81GUQxuxyOL._AC_UL320_.jpg","3.9","27","9.99","219"
"B0B4MZZ9C8","48 Pcs Unicorn Scratch Craft Art Ornaments, Scratch Cards Art Set, Unicorn Birthday Decorations for Girls Boys, Unicorn Party Favors, Unicorn Craft with Ribbon and Wood Stylus, School Crafts for Kids","https://m.media-amazon.com/images/I/817RFmVx4vL._AC_UL320_.jpg","4.0","13","10.99","219"
"B09D3YGBXC","Fedyufook Black and Gold 50th Birthday Party Favor Stickers - 2 Inches - 50 Labels","https://m.media-amazon.com/images/I/61iP8Hxc6sL._AC_UL320_.jpg","4.8","48","7.99","219"
"B01MUCQU8A","Winsor & Newton Professional Watercolor Paper Journal, Cold Pressed 140lb, 5x7, White","https://m.media-amazon.com/images/I/81qtgP0tivL._AC_UL320_.jpg","4.6","617","24.49","219"
"B001CZQOY8","ROYAL BRUSH Royal Langnickel 25-Sheet Watercolor Essentials Artist Paper Pad, 9-Inch by 12-Inch","https://m.media-amazon.com/images/I/71PxfDlJpQL._AC_UL320_.jpg","4.6","804","7.17","219"
"B0BYHB6H9D","Alaxciax 100PCS Superhero Stickers, Super Hero Stickers Superhero Stickers for Kids Teens Hero Stickers for Water Bottles Bumper Laptop Bike Party Supplie Guitar Skateboard Luggage","https://m.media-amazon.com/images/I/91KZD8xvl-L._AC_UL320_.jpg","4.9","12","7.99","219"
"B08C3WFH5S","Wanderings Handmade White Deckle Edge Paper with Real Flower Petals - A4 Size Package of 50 - Mixed Media Loose Leaf Paper for Watercolor, Writers, Invitations, Crafts - Thick 150 GSM - 8.25 x 11.7""","https://m.media-amazon.com/images/I/71aI9W-Yp2L._AC_UL320_.jpg","4.7","84","24.99","219"
"B09KT6VCZM","24 Pieces Stackable Crayons Stackable Plastic Bear Pencils Art Party Favors Stacking Crayons Kids Party Favors Pencils Buildable Crayons Pencils Colorful Crayon for Kids Birthday Party School Supplies","https://m.media-amazon.com/images/I/81W24V9oWWL._AC_UL320_.jpg","3.7","44","12.99","219"
