"asin","title","imgUrl","stars","reviews","price","category_id"
"B09QBR1XGX","Mobi Zoomi Hexagon Maze Puzzle Game - 3D Hexagon Maze Gravity Ball Games, Brain Teaser Puzzles, Marble Maze Fidget Toy, Brain Games Road Trip Essentials - for Ages 4+","https://m.media-amazon.com/images/I/71j7QlBxj0L._AC_UL320_.jpg","4.4","72","28.95","270"
"B0C588P8YR","2 Packs Jelly Cube Crunchy Slime Kit for Girls with Duck and Bear(Pink and Blue),Non Sticky and Super Soft Sludge Toy,DIY Crystal Glue Boba Slime Party Favor for Boys,Birthday Gifts for Kids.","https://m.media-amazon.com/images/I/71BPVSgnkGL._AC_UL320_.jpg","4.3","25","6.98","270"
"B000ELSZW0","Schylling Brand Classic Tin Kaleidoscope Original Retro Toy - Ages 3-5 Years","https://m.media-amazon.com/images/I/61KSS5wsPGL._AC_UL320_.jpg","4.6","7468","8.35","270"
"B0B7XSWD8L","Pokémon Battle Figure Toy Set - 6 Piece Playset - Includes 2"" Pichu, Yamper, Turtwig, Piplup, Chimchar & Deino - Generation 4 Diamond & Pearl Starters - Officially Licensed - Gift for Kids Ages 4+","https://m.media-amazon.com/images/I/81TQIxkZz-L._AC_UL320_.jpg","4.6","51","34.98","270"
"B07DWF8YNW","Sophia's 6.5 in White Plush Toy Kitty Cat for Kids, 10 Piece Doll Accessory Set Carrier, Leash with Tag, Cat Bed, Cat Food, and Cat Toys, for Little Girls and Boys Ages 5 Years and Up","https://m.media-amazon.com/images/I/71MUiilftZL._AC_UL320_.jpg","4.5","3790","25.95","270"
"B0C7BGCNBQ","FUUY Girl Toys Robot Dog for Kids Age 7-8 Robot Toys Gifts Interactive Remote Control Dog Follow & Touch Function Robo Dog Pets Robotic Puppy Cool Things for Girl Cute Things for Toddler with Music","https://m.media-amazon.com/images/I/61bWvj-gEJL._AC_UL320_.jpg","3.9","10","39.99","270"
"B0856SSDPJ","Fisher-Price Teething & Rattle Toys Baby Biceps Gift Set, Gym-Themed For Infant Fine Motor & Sensory Play, 4 Pieces","https://m.media-amazon.com/images/I/61O9+I5XTmL._AC_UL320_.jpg","4.9","9165","17.99","270"
"B0BRNVMJPP","Magic Mixies Magic Genie Lamp with Interactive 8"" Pink Plush Toy and 60+ Sounds and Reactions. Perform The Magic Steps to Unlock a Magic Ring and Reveal a Pink Genie Mixie from The Real Misting Lamp","https://m.media-amazon.com/images/I/81Wb7XbOQgL._AC_UL320_.jpg","4.5","40","64.99","270"
"B0BXWG2BY8","Inscraft 40 Pack 14’’ Big Bubble Wands, 8 Colors 5 Hole Wands x40 Bulk for Summer Toy, Outdoor/Indoor Activity, Easter, Birthday, Graduation, Bubbles Party Favors for Kids","https://m.media-amazon.com/images/I/81SW5aHsnrL._AC_UL320_.jpg","4.6","19","36.99","270"
"B09FX2WLD5","Rubik’s Solve The Cube, 4-Pack Bundle Edge 2x2 Mini 3x3 Original 4x4 Master Brain Tease Toy Gift Set, for Adults & Kids Ages 8 and up Amazon Exclusive","https://m.media-amazon.com/images/I/814KMQihCoL._AC_UL320_.jpg","4.6","257","26.99","270"
"B01N4RAZZ2","Brainstorm Toys: Cute and Cuddly Flashlight and Projector, Projects 24 Color Cute and Cuddly Images of Animals Onto Walls and Ceilings, Batteries Included, For Ages 3 and up","https://m.media-amazon.com/images/I/61r2vvSfknL._AC_UL320_.jpg","3.8","6237","8.99","270"
"B0BVDJ78SV","Cheffun Magnetic Drawing Doodle Board for Kids - 12"" x 12"" Magnetic Board Drawing Pad for Kids and Toddlers, Magnetic Toys Drawing Board for Toddlers, Montessori Educational Preschool Toy for Age 3+","https://m.media-amazon.com/images/I/71jadaFCPkL._AC_UL320_.jpg","4.4","63","17.98","270"
"B0863XP2DX","Funko Snapsies Toy, Mix and Match Surprise Blind Capsule (One Capsule) with Accessories, Gift for Girls Ages 5 and Up","https://m.media-amazon.com/images/I/71ZOZS9258L._AC_UL320_.jpg","4.5","2450","5.39","270"
"B0B3QHN5ZQ","SmartGames Penguins Huddle Up Game for 2-4 Players Ages 6 - Adult","https://m.media-amazon.com/images/I/71RzvRxHLOL._AC_UL320_.jpg","4.7","7","24.99","270"
"B08P4T4V5C","Kids Makeup Kit for Girl - Kids Makeup Kit Toys for Girls Washable Real Make-up Kit Toy for Little Girls, Toddler Make up & Non-Toxic Cosmetic Set Age 3-12Year Olds Child Birthday Gift","https://m.media-amazon.com/images/I/91hPuwjo7-L._AC_UL320_.jpg","4.7","1422","19.99","270"
"B0BBHBL8RV","Think Fun ThinkFun Zingo! Booster Pack #2. Expansion Pack for Your Zingo! Game for Kids Ages 4 and Up - One of The Most Popular Board Games for Boys and Girls and Their Parents","https://m.media-amazon.com/images/I/81HbLarbTfL._AC_UL320_.jpg","4.9","55","10.85","270"
"B0BV276937","ZHENHAOKAN 2 Pack Butter Slime Kit for Kids Party Favors, Scents Dual Colors Slime Putty for Boys Girls, Soft & Non-Sticky, School Supplies, Carnival Prizes, Ages 4 and Up (4-Ounce*2)","https://m.media-amazon.com/images/I/718jdyz7tkL._AC_UL320_.jpg","3.6","91","7.98","270"
"B0164WC4RY","ETI Toys | STEM Learning | Original Educational Construction Engineering Building Blocks Set for 3, 4 and 5+ Year Old Boys & Girls | Creative Fun Kit | Best Toy Gift for Kids Ages 3yr – 6yr (101 PCS)","https://m.media-amazon.com/images/I/81wSH0LeuaL._AC_UL320_.jpg","4.6","2734","35.97","270"
"B0BZYJNRDF","GAGAKU Wooden Makeup Toy Set Wood Hair Salon Playset Toddler Wooden Makeup Kit for Girls,Christmas Birthday Gift for 3 4 5 6 7 Years Old Kids","https://m.media-amazon.com/images/I/71UNXX0jp9L._AC_UL320_.jpg","4.5","9","27.99","270"
"B09476GNNK","8"" Airplane Toy,12 Different Designs Planes Toys For Boys,Foam Glider Planes Toys,Birthday Favors Lightweight Paper Airplanes,Individually Packed Outdoor Flying Toys,Party Favors For kids 8-12(12 PCS)","https://m.media-amazon.com/images/I/81SQ+C+nLdS._AC_UL320_.jpg","4.3","118","7.88","270"
"B0BLYX11HY","Robot Toys, Rechargeable RC Robots for Boys, RC Robot Toys for Kids, Kids Toys with Music and LED Eyes, 3+ Years Old Boys/Girls Toys (Pink)","https://m.media-amazon.com/images/I/71EAKzszIUL._AC_UL320_.jpg","4.3","113","23.99","270"
"B09JHSP1PB","LEGO DUPLO Rescue Police Station 10959 Push & Go Car Toy with Lights and Siren Plus Helicopter, Early Learning Toys for Toddlers, Boys & Girls 2 Plus Years Old","https://m.media-amazon.com/images/I/71-W+fhDSWL._AC_UL320_.jpg","4.9","126","43.99","270"
"B0C9GVQ3PY","Retevis RT628S Walkie Talkies for Kids,Safe Mode Long Range Family 2 Way Radio 22 CH,Walkie Talkies 3 Pack for Adults,Toys Gifts for 5 Year Old Boys Girls,Camping Hiking Travel School(Red Blue Yellow)","https://m.media-amazon.com/images/I/71OWUP7BNKL._AC_UL320_.jpg","4.4","9","33.99","270"
"B09QSGWCLG","Remote Control Dinosaur Toys Kids - Jurassic Velociraptor Toys Imitates Walking and Sounds - Robot Toys That Can Sing, Shaking Head and Tail","https://m.media-amazon.com/images/I/81VF-tVCDeL._AC_UL320_.jpg","4.3","679","39.99","270"
"B00O2BLLOM","Playkidz Pretend Play Fake Make Up Toy Set for Little Girl Princess - Kids Makeup Kit for Toddlers. (8 PC - Not Real)","https://m.media-amazon.com/images/I/71FJGUgUTfL._AC_UL320_.jpg","4.6","651","11.99","270"
"B0C33RV25B","Kingci Mini Karaoke Machine, Portable Bluetooth Karaoke Speaker with 2 Wireless Mics for Kids Adults, Toys Gift for Girls Boys 3 4 5 6 7 8 9 10 12 Year Old","https://m.media-amazon.com/images/I/71HiH0eZA9L._AC_UL320_.jpg","4.7","12","36.97","270"
"B084BYTQ7H","Fisher-Price Little People Toddler Musical Toy Caring For Animals Tractor Farm Vehicle & 3 Figures For Ages 1+ Years","https://m.media-amazon.com/images/I/61CchElTPkL._AC_UL320_.jpg","4.9","3700","21.59","270"
"B08V8TJL9Q","Baby Teethers Toys Silicone Soft Ball Easy to Hold Teether for Sensory Ball Exploration & Teething Stress Relief Molar Ball Soothing Teether Toy Baby Ball for Ages 0 Months+","https://m.media-amazon.com/images/I/61Umv4ju2NL._AC_UL320_.jpg","4.7","771","9.99","270"
"B098YVQN3X","Cheerful Children Toys Dress Up Clothes for Kids -Dress Up & Pretend Play - Little Girls & Boys 3-7 Years - Costume Set -Gardener,Explorer,Doctor","https://m.media-amazon.com/images/I/71bcgEEl0AL._AC_UL320_.jpg","4.6","183","49.99","270"
"B0CCS3L7NT","Gaming Blanket Toys Gifts for Boys - Christmas Easter Valentine's Day Birthday Glow in The Dark Gamer Controller Throw Decor Presents for Kids Age 3 4 5 6 7 8 9 10 11 12 13 Year Old Boy 50""x60""","https://m.media-amazon.com/images/I/812MVgeRi7L._AC_UL320_.jpg","4.6","218","14.99","270"
"B083YX21HZ","STAR WARS Mission Fleet Stellar Class Darth Vader TIE Advanced 2.5-Inch-Scale Figure and Vehicle, Toys for Kids Ages 4 and Up (E95985X1)","https://m.media-amazon.com/images/I/71wPBA1J0FL._AC_UL320_.jpg","4.6","918","23.64","270"
"B0B48M3VPY","5 Surprise Dino Strike Series 5 Color Change (2 Pack) by ZURU Mystery Collectible Mini Dinosaur Toys Fossils Capsules for Boys and Kids (2 Pack)","https://m.media-amazon.com/images/I/817wP+fdIyL._AC_UL320_.jpg","4.4","25","12.14","270"
"B0C44B1FJT","Play Money Sets (Bills, Coins & Wallet)","https://m.media-amazon.com/images/I/715101s91nL._AC_UL320_.jpg","4.7","10","11.99","270"
"B0BWLCTWSN","HEXBUG Nanotopia, Sensory Toys for Kids & Cats with Over 130 Pieces & 7 Nano Bugs, STEM Kits & Mini Robot Toy for Kids Ages 3 & Up, Batteries Included","https://m.media-amazon.com/images/I/81hnIRvL5aL._AC_UL320_.jpg","4.6","1114","54.99","270"
"B0BLJ3VWXJ","LEGO Indiana Jones and the Last Crusade Fighter Plane Chase 77012 Building Set, Featuring a Buildable Car and Airplane Toy, 3 Minifigures Including Indiana Jones, Birthday Gift for Kids 8-12 Years Old","https://m.media-amazon.com/images/I/813RTdBEawL._AC_UL320_.jpg","4.9","507","33.99","270"
"B0BRXPK8H3","LeapFrog Match and Learn Cookies","https://m.media-amazon.com/images/I/710fP+QyhXL._AC_UL320_.jpg","4.4","19","21.49","270"
"B0B3J5XMBV","HOFJOS 152 Pcs Building Blocks Kids STEM Toys, Educational Building Toys for Kids, Creative Game Fun Activity Superior Gift, 12-in-1 Models, Toy for Kids Ages 4-8 9-12 Years Old","https://m.media-amazon.com/images/I/81x-FY6c6jL._AC_UL320_.jpg","4.7","30","19.99","270"
"B0BFKYDS9L","Bath Toys for Toddlers 1-3, Baby Toys 12-18 Months, Mold Free Whale Water Spraying Bath Toy with Sprinklers & Shower Head, Bathtub Pool Bathroom Shower Toy Gifts for Toddler Infant Kids Boy Girls","https://m.media-amazon.com/images/I/71Vz47iiDZL._AC_UL320_.jpg","3.6","145","19.99","270"
"B09XVJ4V2S","LEGO Creator 3in1 Sunken Treasure Mission 31130 Building Toy Set for Kids, Boys, and Girls Ages 8+ (522 Pieces)","https://m.media-amazon.com/images/I/81AJ3-JLdCL._AC_UL320_.jpg","4.9","535","27.99","270"
"B0BCWLX7L9","Kids Building Blocks STEM Toys, 120 PCS Create Puzzle Plastic Building Sets That Bends - Safe Material - Toddler Educational Interlocking Toy for Girls and Boys Aged 3+","https://m.media-amazon.com/images/I/81NiL38zUEL._AC_UL320_.jpg","4.5","48","21.99","270"
"B08T91BVLM","COUOMOXA Magnetic Building Sticks Blocks Kids Toys, Stem Educational Construction Montessori Toys 3 4 5 6 8 Year Old Girls and Boys Gifts for Christmas Birthday,Preschool Tinker Counting Toddler Toys","https://m.media-amazon.com/images/I/71yMpB-3akL._AC_UL320_.jpg","4.4","791","16.99","270"
"B0BYTNZ8Q4","hand2mind Sing-Along Numberblock Five, Plush Singing Toys, Music Playing Stuffed Animals, Musical and Light Up Toys, Plush Interactive Toy Figures, Cartoon Plush Toys, Imaginative Play Toys","https://m.media-amazon.com/images/I/81SJ8M1V8UL._AC_UL320_.jpg","4.9","118","18.89","270"
"B0BR3M7JSG","Dolanus Bubble Machine for Kids Boys - Automatic Bubble Gun with Colorful Lights, Leak-Proof Design, 2 Bubble Solution & Batteries, Summer Outdoor Indoor Toy, Gift for Kids Age 3 4 5 6 7 8 Years Old","https://m.media-amazon.com/images/I/71JhEjYXkRL._AC_UL320_.jpg","3.9","40","18.99","270"
"B09YY7KQPB","Rupnoflbui Kids Mini Stainless Steel Cookware Kitchen Cooking Toys Pretend Utensils with SteCookware Play Pots and Pans Playset ,Pot Rack Organizer Storage Bag for Toddlers","https://m.media-amazon.com/images/I/613sYqe3EnL._AC_UL320_.jpg","3.8","15","13.99","270"
"B0BHP88CJV","LINAYE Arts and Crafts Supplies for Kids and Toddlers - Craft Supplies Ages 4-8, All in One Art & Crafts Supplies Kit Age 4 5 6 7 8 Art Supplies and Crafts Kit for Kids Birthday Christmas Gifts","https://m.media-amazon.com/images/I/91UFJiWykEL._AC_UL320_.jpg","4.5","42","13.99","270"
"B0BJVLLWL2","Montessori Toy for 1 2 3 4 Year Old Toddlers - Educational Activity Birthday Gifts Developing Sensory Toys for Pull String Activity Motor Skills - Travel Toys for Plane Car, Gift for Boys Girls","https://m.media-amazon.com/images/I/71pjilG3mEL._AC_UL320_.jpg","4.4","509","9.99","270"
"B08WVN919Z","PJ Masks Glow & Go Cat-Car Preschool Toy Vehicle, Catboy Car Light Up Racer with Catboy Action Figure for Kids Ages 3 and Up","https://m.media-amazon.com/images/I/51dWuq6iOuL._AC_UL320_.jpg","4.6","298","7.37","270"
"B09JKYSWN3","LEGO Speed Champions Mercedes-AMG F1 W12 E 76909 Performance & Project One Toy Car Set, Mercedes Model Car Building Kit, Collectible Race Car Toy, Great Car Gift for Kids and Teens","https://m.media-amazon.com/images/I/81F-37N0DHL._AC_UL320_.jpg","4.9","4706","28.99","270"
"B08HCLPXW6","JOYIN 12 Pcs Bath Books, Nontoxic Fabric Soft Crinkly Cloth Books, Waterproof, Bathtub Pool and Early Education First Toys for Infant Newborn Baby Toddlers Kids Birthday Gifts","https://m.media-amazon.com/images/I/A1+u-Cult3L._AC_UL320_.jpg","4.7","1681","24.99","270"
"B086DKGK91","BAKAM Penguin Balance Math Counting Toys for kids Age 3-6, Number Learning Toys for Toddlers Kindergarten, STEM Counting & Sorting Game for Boys Girls (Penguin)","https://m.media-amazon.com/images/I/61VZDIzir4L._AC_UL320_.jpg","4.4","123","16.99","270"
"B0BS8PMTNR","hand2mind Worry Stone Pals Sensory Wristband, Worry Stones for Anxiety, Fidget Toys, Palm Stone, Calm Down Corner Supplies, Stress Relief Toys, Mood Bracelets for Kids, Play Therapy Activities","https://m.media-amazon.com/images/I/71qy5TpAgUL._AC_UL320_.jpg","4.0","38","11.49","270"
"B085J19D7J","Janod Pure 6 Block Tray - Forest Animals Puzzle - Ages 1+ - J05158","https://m.media-amazon.com/images/I/61vv8NEqPgL._AC_UL320_.jpg","4.4","32","17.99","270"
"B093GVZFYN","Pet Plush Dinosaur Stuffed Animal Backpack for Boys & Girls 3 - 4 - 5 Years Old w/ Removable T Rex Plush Toy - Backpack Dinosaur - Dinosaur Toys for Kids 3-5 w/ Dino Plushie Kid Animal Backpack (Green","https://m.media-amazon.com/images/I/61RwfzeZPAL._AC_UL320_.jpg","4.7","202","17.99","270"
"B01MZ47FF2","Learning Resources Doctor Play Set - 3 Pieces, Ages 3+ Doctor Kit for Kids, Pretend Play, Doctor Dress Up for Kids, Doctor Costume for Kids, Preschool Learning Games","https://m.media-amazon.com/images/I/71Br4qZSKwL._AC_UL320_.jpg","4.7","3264","21.99","270"
"B0BXSG4RQH","XJD 7 in 1 Toddler Slide Set, Kids Slide for Toddlers Age 1+, Toddler Climber Slide PlaySet with Basketball Hoop and Ball,Outdoor Indoor Playground for Toddlers 1-3 (Blue)","https://m.media-amazon.com/images/I/71FELy0XZ1L._AC_UL320_.jpg","4.3","37","269.99","270"
"B0B96ZC67W","MICKYU Montessori Busy Board Toy for Boys | Wooden Screwdriver Tool Set | Fine Motor Skills Travel Toys for Kids Age 3-6","https://m.media-amazon.com/images/I/71IMZk5+ugL._AC_UL320_.jpg","4.0","42","15.99","270"
"B08V3VY1ZS","MEGA HALO Infinite Toy Car Building Toys Set, Unsc Razorback Blitz Vehicle with 303 Pieces, 4 Micro Action Figures and Accessories, Gift Ideas","https://m.media-amazon.com/images/I/71gm9DMecwL._AC_UL320_.jpg","4.7","1507","20.49","270"
"B0BBM5S43X","Remote Control Excavator Toys for Boys, 11 Channel Metal Shovel RC Construction Vehicles, 1/18 Scale Toys Gifts for Kids Boys Girls Age 4-7 8-12 Year Old","https://m.media-amazon.com/images/I/71b4fyQlh3L._AC_UL320_.jpg","4.2","148","49.99","270"
"B0B7WDC16C","Walkie Talkies for Kids - Rechargeable 4 Pack: Walky Talky for Kids with Charger Battery - Walkie-Talkies Long Range Outdoor, Hiking, Camping Toys for 3-12 Year Old Girls Boys","https://m.media-amazon.com/images/I/71Kt2FH8rnL._AC_UL320_.jpg","4.4","230","39.99","270"
"B09NYPDJJD","Mattel Pixar Track Talkers Toy Vehicles, Lightning Mcqueen Talking Car, Collectible Character Car, 5.5-Inch","https://m.media-amazon.com/images/I/71Yi6unS30L._AC_UL320_.jpg","4.9","346","9.97","270"
"B077ZR7BQT","Kids Tool Belt, Monocho Kids Construction Tool Belt Real Suede Leather Children's Tool Pouch with 7 Pockets for Boy and Girl Costumes Dress Up Role Play Adjustable Size for Ages 2-14 (Pink)","https://m.media-amazon.com/images/I/71RtpU7EiyL._AC_UL320_.jpg","4.0","28","22.99","270"
"B0B594JHL7","Innorock 10000+ Space Theme Water Beads Set - with Sensory Bins, Perfect for Autistic Children & Kids Age 8-12 or Above, Water Beads for Kids Non Toxic Sensory Toys Birthday Gifts Playset","https://m.media-amazon.com/images/I/81blvZYCs3L._AC_UL320_.jpg","4.0","25","9.98","270"
"B07SV4CBZ7","Disney Frozen Tara Toy 2 Magnetic Scenes","https://m.media-amazon.com/images/I/81lYDfvNqGL._AC_UL320_.jpg","4.2","186","5.99","270"
"B07FPCM9VK","FUN LITTLE TOYS 24 PCs Bath Toys for Toddlers, Sea Animals Squirter Toys Kids, Car Squirter Toys Boys, Bath Toy Organizer Included Kids Party Favors, Stocking Stuffer","https://m.media-amazon.com/images/I/718QPCZsXfL._AC_UL320_.jpg","4.7","859","24.99","270"
"B083X564X4","Disney Lilo & Stitch 6-Inch Bean Plushie Angel, Stuffed Animal, Alien, Officially Licensed Kids Toys for Ages 2 Up by Just Play","https://m.media-amazon.com/images/I/81Au5UxJPiS._AC_UL320_.jpg","4.7","1475","9.74","270"
"B08PBXWXBK","MITCIEN Camping Toys Play Set, Pretend Campfire, Play Food for Kids with Oil Lantern, Pretend Fruits Vegetables Cutting, S'Mores, Indoor Outdoor Toys for Toddler","https://m.media-amazon.com/images/I/71Ue7GmM28L._AC_UL320_.jpg","4.7","832","26.99","270"
"B0972Y8NNY","65PCS Safari Animal Figurines Toy Set, Realistic Jungle Zoo Figures with Elephant, Lion, Giraffe, Fence, Puzzle Blocks for Kids Ages 3-8","https://m.media-amazon.com/images/I/71vSvIIiOeL._AC_UL320_.jpg","4.5","442","25.95","270"
"B0C7M9MD6C","Mold Free Baby Bath Toys for Toddlers 1-3/Infants 6-12-18 Months,6 Pcs No Hole No Mold Sea Animal Bathtub Toys for 1 2 3 4 Years Old Boys Girls Kids,Baby Shower Toys Pool Toys for Toddlers 1-3","https://m.media-amazon.com/images/I/71bsH4xeh6L._AC_UL320_.jpg","4.7","10","8.97","270"
"B0967Z6DZ2","Flybay Kids Makeup Kit for Girl, Washable Makeup Set Girls Toys, Real Girls Makeup Kit for Kids, Children Toddler Princess Play Make Up Set Christmas Birthday Gifts for Girls Age 3-12 Year Old","https://m.media-amazon.com/images/I/81boFtI-jVL._AC_UL320_.jpg","4.6","597","23.95","270"
"B0BG718T2W","OKOOKO Dress Up House Felt Board 35PCS Double-Sided Foldable Dress Up Teaching Girls Toy Preschool Crafts Storytelling Early Learning Interactive Play Kit for Toddlers Kids","https://m.media-amazon.com/images/I/814cBW-iccL._AC_UL320_.jpg","4.7","269","15.99","270"
"B0BQNBX7JR","Little Live Pets Hug n' Hang Zoogooz - Sensoo Sloth. an Interactive Electronic Squishy Stretchy Toy Pet with 70+ Sounds & Reactions. Stretch, Squish and Link Their Hands","https://m.media-amazon.com/images/I/71rSyYKpkSL._AC_UL320_.jpg","4.3","39","14.99","270"
"B09PGQRDR6","L.O.L. Surprise! Tweens Series 3 Nia Regal Fashion Doll with 15 Surprises Including Accessories for Play & Style, Holiday Toy Playset, Great Gift for Kids Girls Boys Ages 4 5 6+ Years Old","https://m.media-amazon.com/images/I/91tO28v7-xL._AC_UL320_.jpg","4.8","922","19.99","270"
"B011KVZ6PG","Kid Motorz Kiddie Quad Red 6V Ride On","https://m.media-amazon.com/images/I/81qt4jEkuyL._AC_UL320_.jpg","4.2","1600","57.69","270"
"B0BF7YX27P","Disney Frozen Bath Toys for Toddlers - Bundle with Frozen Elsa Bath Set, Crayola Finger Paint Assorted Colors | Elsa Frozen Bath Toy","https://m.media-amazon.com/images/I/71WjnWNjZFL._AC_UL320_.jpg","4.2","5","19.95","270"
"B08MFFBXG3","Wooden Paddle Ball (Set of 2) with Carry Bag Indoor Outdoor Toy: Fun and Classic Paddleball Game for Boys and Girls, Party Favor Toys Ages 4+","https://m.media-amazon.com/images/I/71f8DnDvYwL._AC_UL320_.jpg","4.0","339","14.9","270"
"B09TNLPCXP","DK-SIMINA Large P0pp with Numbers, Rainbow Square Dimples Fidgett Ttoy 100 Bubble Math Toy Learning Tool for Teachers to Make Various Math Operations (1-100 Numbers)","https://m.media-amazon.com/images/I/71mZ77PerVL._AC_UL320_.jpg","4.8","183","7.9","270"
"B09YHDGRB5","Sensory Chew Tubes for Autistic Children, 4 Pack Silicone Chewy Sticks Oral Motor Tool for Sensory Kids with Autistic, Biting ADHD, SPD, Teether Toys for Babies 3-6 6-12 Months, BPA Free","https://m.media-amazon.com/images/I/71BySpJxaqL._AC_UL320_.jpg","4.4","149","11.98","270"
"B0BQNHK4H3","TREASURE X Lost Lands Skull Island Skull Temple Mega Playset, 40 Levels of Adventure. 4 Micro Sized Action Figs. Survive The Traps and Discover Guaranteed Real Gold Dipped Treasure","https://m.media-amazon.com/images/I/8150Wti4SbL._AC_UL320_.jpg","4.9","30","39.99","270"
"B0B3DQKJYP","TEMI Car Toys for 3 4 5 6 7 Year Old Boys, 2 in 1 Watch Toys Pull Back Car Toys for Kids, Engineering Vehicles Fire Truck Toys Toys Truck for Toddler Boys Girls, Christmas Birthday Gifts for Kids","https://m.media-amazon.com/images/I/81PSBc59LJL._AC_UL320_.jpg","3.8","13","8.99","270"
"B09Q82N7DN","Coogam Dinosaur Fine Motor Skills Toy, Spike The Ankylosaurus Toys 13 Pcs, Sorting Stacking Dino Color Recognition Montessori Educational Gift Game for 2 3 4 Year Toddler","https://m.media-amazon.com/images/I/81uSiYkIIkL._AC_UL320_.jpg","4.5","298","14.99","270"
"B0BP89BYH3","Sonic & Sega All-Stars Racing RC: Sonic - NKOK (681), 1:28 Scale 2.4GHz Remote Controlled Car, 6.5"" Compact Design, Officially Licensed Sega Sonic The Hedgehog, Battery Powered, Ages 6+","https://m.media-amazon.com/images/I/71F5HtdxN8L._AC_UL320_.jpg","4.1","22","19.99","270"
"B08K4HZKNM","Costzon Kids ATV, 12V Battery Powered Electric Vehicle w/LED Lights, High & Low Speed, Horn, Music, USB, Treaded Tires, Ride on Car 4 Wheeler Quad for Boys & Girls Gift, Ride on ATV (Pink)","https://m.media-amazon.com/images/I/71IA5Sw1aPL._AC_UL320_.jpg","4.2","1733","199.0","270"
"B084L1ZYNX","Little Tikes Cape Cottage Playhouse with Working Door, Windows, and Shutters - Red| For Kids 2-6 Years Old","https://m.media-amazon.com/images/I/81JAoU97SfL._AC_UL320_.jpg","4.6","2046","139.99","270"
"B09NNL2539","DC Comics, Batman Action Figure, 12-inch The Flash Movie Collectible, Kids Toys for Boys and Girls Ages 3 and up","https://m.media-amazon.com/images/I/71W9gnwPoxL._AC_UL320_.jpg","4.8","445","10.99","270"
"B0BYNVXZFT","4Packs Finger Surfboard, Mini Surfing Toys Finger Surf Boards, Surf The Wind, Fingertip Surfboard for Kids, Teens, Adult","https://m.media-amazon.com/images/I/81c7C08lONL._AC_UL320_.jpg","4.0","22","6.99","270"
"B09HBJWJZ3","Zing Klikbot Complete Set of 4 Poseable Action Figures with Weapons, Translucent, Create Stop Motion Animation, for Ages 6 and Up (Series 3 Guardians)","https://m.media-amazon.com/images/I/71PC-PJl9aL._AC_UL320_.jpg","4.7","569","30.79","270"
"B0BS24QJWC","LELEMON 100 Pieces Jigsaw Puzzles in a Metal Box for Kids Age for 4-8 Boys Girls Toy Puzzles Construction Site Vehicles Children Learning Educational Puzzles Toys","https://m.media-amazon.com/images/I/91PtgmFxxGL._AC_UL320_.jpg","4.4","360","9.99","270"
"B0BBGF3BF7","Science Kidz Mega Gemstone Dig Kit - 20 Real Life Gems & Crystals - Gemstones Excavation Kits for Kids - Gem Stones Digging Kit Set - Dig for Gems, Stones, Crystals & Rocks","https://m.media-amazon.com/images/I/91HjEIa84QL._AC_UL320_.jpg","4.6","303","18.99","270"
"B09BFVG77D","DC Comics, The Batman Batcycle RC with Batman Rider Action Figure, Official Batman Movie Styling, Kids Toys for Boys and Girls Ages 4 and Up","https://m.media-amazon.com/images/I/7124KEwPm1L._AC_UL320_.jpg","4.6","775","28.45","270"
"B08S45YVR6","Barbie Trendy Cash Register with Sounds, Pretend Money, and Credit Card Reader, 9 Piece Playset, Kids Toys for Ages 3 Up by Just Play","https://m.media-amazon.com/images/I/81KzrnFWuUL._AC_UL320_.jpg","4.6","426","12.99","270"
"B08YJ5SBDR","John Deere Kids Floor Puzzle - Large Kids Puzzles - John Deere Tractor Toys - Ages 3 and Up - 3"" x 2"" - 36 Pieces","https://m.media-amazon.com/images/I/81Ktd1dRlaL._AC_UL320_.jpg","4.8","69","7.39","270"
"B0BZ7WF7T3","Sports Scooter Board with Handles, Floor Scooter, Sitting Scooter Board for Kids Sports Activities, Age: Over 6 Years Old","https://m.media-amazon.com/images/I/51gOWJzRWNL._AC_UL320_.jpg","4.8","8","55.99","270"
"B08W8D481R","MEGA BLOKS Paw Patrol Toddler Building Blocks Toy Cars, Ride & Rescue Vehicle Pack with 87 Pieces, 4 Figures, Gift Ideas for Kids Age 3+ Years","https://m.media-amazon.com/images/I/81p1CDRjxnL._AC_UL320_.jpg","4.8","958","53.99","270"
"B09TZJQ85Y","FLYINGSEEDS 106 PCS Flower Garden Building Toys for Girls, Girls Favor STEM Toy Gardening Pretend Play Set for Kids, Stacking Game Educational Activity for Toddlers Kids Age 3 4 5 6 7 8 Year Old","https://m.media-amazon.com/images/I/81t2g7w2niL._AC_UL320_.jpg","4.5","57","19.99","270"
"B095P38HHW","Toys for 3-12 Year Old Girls & Boys, Walkie Talkies for Kids 2 Pack, Kids Toys, 3 4 5 6 7 8 9 10 11 12 Years Old Boys Girls (Pink)","https://m.media-amazon.com/images/I/8146DXFsmLL._AC_UL320_.jpg","4.3","124","17.19","270"
"B09H1X4KCB","MONOPOLY: Marvel Studios' Black Panther: Wakanda Forever Edition Board Game for Families and Kids Ages 8+, Game for 2-6 Players","https://m.media-amazon.com/images/I/81z2hNRTl1L._AC_UL320_.jpg","4.7","642","14.99","270"
"B0B8ZJD6YF","Baby Rattles 0-6 Months - 14 Pcs Baby Rattle Toys Set Infant Toys for 0-3 Months Baby Toys 3-6 Months Newborn Toys with Teething and Wrist Socks Rattle for 0 1 2 3 4 5 6 7 10 12 Month Babies Boy Girl","https://m.media-amazon.com/images/I/81pfDIA2ZfL._AC_UL320_.jpg","4.5","356","19.49","270"
"B0C3R8PQTJ","CHENFAN Dinosaur Toys for 1-12 Year Old Boys Girls,Dino Projection Toys for 3-5 5-7 Year Olds Boys.Birthday Holiday Chirstmas Gifts for 2-10 Year Old Kids Toddler Toys.Dinosaur Projector Light","https://m.media-amazon.com/images/I/81o7+fWz-CL._AC_UL320_.jpg","4.6","14","16.99","270"
