"asin","title","imgUrl","stars","reviews","price","category_id"
"B07D6ZCWJ2","Kids Outdoor Adventure Nature Explorer & Bug Catching Kit w/Binoculars, Magnifying Glass, Compass, Camping & Hiking Gear-Insect Catcher & Collection Set-Butterfly Net-Science Gift Boys & Girls 3-12","https://m.media-amazon.com/images/I/81VUpi-n9ZL._AC_UL320_.jpg","4.6","982","21.9","228"
"B077N8DMGC","iBaseToy 36 Pack Glider Planes for Kids - 8"" Foam Airplane Toys, Airplane Party Favors, Carnival Prizes, Classroom Prizes, Outdoor Flying Toys Foam Planes for Kids Boys Girls Valentines Gifts","https://m.media-amazon.com/images/I/71vwBcI858L._AC_UL320_.jpg","4.3","955","21.99","228"
"B0C33WQ24D","Unibday Luau Party Games, Toss Game Banner with 4 Bean Bags, Hawaiian Toss Game Banner, Hawaiian Game for Kids and Adults Summer Tropical Carnival Party Supplies","https://m.media-amazon.com/images/I/81Ft5goFwVL._AC_UL320_.jpg","3.8","43","9.99","228"
"B088D1HCZW","Baby Canvas Hanging Swing Seat Toddler Secure Indoor & Outdoor Hammock Toy Grey","https://m.media-amazon.com/images/I/61EfZGSUk9L._AC_UL320_.jpg","4.5","490","47.99","228"
"B07RK5P8WD","POKONBOY Upgraded 500-Round Balls Refill Pack Compatible with Nerf Rival Apollo, Zeus, Atlas and Artemis Blasters (Storage Bag Included)","https://m.media-amazon.com/images/I/71V10Jehb9L._AC_UL320_.jpg","4.7","742","33.95","228"
"B08YR4B11H","JOYIN Bubble Bottle 24 Pack - 2oz Blow Bubbles Solution Novelty Summer Toy - Activity Party Favor Assorted Colors Set, Birthday Fun Gift","https://m.media-amazon.com/images/I/71m8ThJ3X7S._AC_UL320_.jpg","4.4","373","11.99","228"
"B097QR232N","Skywin Air Tent Fort Mermaid Playhouse for Kids - Inflatable Kids Fort Sets Up and Stores Away in Seconds, 77 x 50 Inches (Fan NOT Included) (Classic)","https://m.media-amazon.com/images/I/810+BYWgkiL._AC_UL320_.jpg","4.6","384","39.99","228"
"B09VMB616C","Hot Wheels '20 Toyota Tacoma, Hot Trucks 4/10 [Blue]","https://m.media-amazon.com/images/I/61xah8o+1pL._AC_UL320_.jpg","4.8","365","16.99","228"
"B09MDRDLY9","5 Inch Playground Balls, Set of 3 Mini Sports Balls for Soft Play, Rubber Dodge Balls for Indoor and Outdoor Use, Inflated Bouncy Easy Grip for Kids and Toddlers","https://m.media-amazon.com/images/I/81kRTOmD7aL._AC_UL320_.jpg","4.3","211","18.99","228"
"B0BNDBKHYG","Sallyfashion 505PCS Assorted Glass Marbles, 0.6/1 inch Colorful Glass Marbles Sorted Cat Eye Marbles Bulk for Kids Marble Run Games Home Decoration Catapult","https://m.media-amazon.com/images/I/71tDjS04mlL._AC_UL320_.jpg","4.9","10","15.99","228"
"B087CCVD5D","ZURU Bunch O Balloons, 420 Water Balloons, Fill & Tie 100 in 60 Seconds,","https://m.media-amazon.com/images/I/71YbKf7EhdL._AC_UL320_.jpg","4.7","1523","31.25","228"
"B08CZQMYN1","Electronic Shooting Target Scoring Auto Reset Digital Targets for Nerf Guns Toys with a Support Cage & Net, Christmas Birthday Gifts Toy for Kids-Boys & Girls","https://m.media-amazon.com/images/I/81B575n3nxL._AC_UL320_.jpg","4.1","518","17.19","228"
"B0BWKYVPBX","Hot Wheels '90 Honda Civic EF, HW J-Imports 7/10","https://m.media-amazon.com/images/I/61jKdA88YIL._AC_UL320_.jpg","4.2","25","5.8","228"
"B07H7DN5ZZ","PP PICADOR Kids Soccer Ball Size 3, Dinosaur Soccer Balls Toys for Girls Boys Toddler Child 4-8 Gift Outdoor Home Sport with Pump","https://m.media-amazon.com/images/I/81+D0kfS65L._AC_UL320_.jpg","4.6","3398","16.99","228"
"B07BF2CD75","B. toys by Battat Tiki Retreat Bug Catcher Kit – 1 Bug Cage with Tweezers & Magnifying Glass – Bug Toys for Kids 4+","https://m.media-amazon.com/images/I/71Er4GiCs4L._AC_UL320_.jpg","4.7","772","10.39","228"
"B07VDVN6QD","Rainbow Arch 27"" Diamond Kite","https://m.media-amazon.com/images/I/81eyLO5SqPL._AC_UL320_.jpg","4.4","294","10.6","228"
"B07TTKRDXD","ImpiriLux Ice Castle Princess Play Tent | Unique Pop Up Fort for Imaginative Games & Gift | Foldable Playhouse with Storage Bag","https://m.media-amazon.com/images/I/81WN14vRMGL._AC_UL320_.jpg","4.6","1904","29.99","228"
"B0BW2XV9NM","GUESVOT Ball Pit Balls Plastic Balls for Ball Pit BPA Free Plastic Balls Crush and Smash Proof Balls 100pcs 2.2"" Set for Toddlers for Play Tent Tunnel","https://m.media-amazon.com/images/I/71WR5T-pwQL._AC_UL320_.jpg","4.6","32","17.99","228"
"B09RQ2HH28","Craft-Tastic Scavenger Hunt Potions - Nature DIY Craft Kit - Create Magical Nature Potions - Makes 7 Potions - Comes with Recipe Book - Ages 4+ with Adult Help","https://m.media-amazon.com/images/I/814YbhFKPML._AC_UL320_.jpg","4.3","74","19.99","228"
"B01N6E3EWT","Aqua Comfort Pool Float Lounge – Inflatable Pool Floats for Adults with Headrest and Footrest – Bubble Waves","https://m.media-amazon.com/images/I/91nd9R3ty9L._AC_UL320_.jpg","4.5","1774","42.96","228"
"B07DCLFB9C","Cotton Jump Rope for Kids - Wooden Handle - Adjustable Cotton Braided Fitness Skipping Rope - Outdoor Fun Activity, Great Party Favor, Exercise Activity, Pack of 2 (Yellow+Pink)","https://m.media-amazon.com/images/I/41rvIpMLM7L._AC_UL320_.jpg","4.5","1277","12.99","228"
"B09TVKJXFF","2023 New & Upgraded Sunlite Sports Heavy Duty River Tube Inflatable, Premium Water Float to Lounge Above Lake and River, Outdoor Water Raft Sport Fun, Recreational Use","https://m.media-amazon.com/images/I/71Stzb-MzdL._AC_UL320_.jpg","4.5","1757","28.99","228"
"B07WCHKKNT","USA Toyz Astroshot Zero GX Glow in The Dark Shooting Games for Kids - Nerf Compatible Floating Ball Targets for Shooting with 1 Foam Blaster Toy Gun, 10 Floating Ball Targets, and 5 Flip Targets","https://m.media-amazon.com/images/I/8153dE17YCL._AC_UL320_.jpg","4.3","9860","30.63","228"
"B0993Q2DZW","VGMiu 60"" Trampoline for Kids, 5 FT Indoor & Outdoor Small Toddler Trampoline with Basketball Hoop, Safety Enclosure, Baby Trampoline Toys, Birthday Gifts for Kids, Gifts for Boy and Girl, Age 1-8","https://m.media-amazon.com/images/I/81UiAIPso6L._AC_UL320_.jpg","4.4","1385","119.99","228"
"B0B8YHBYNY","2 Set Electric Water Bead Blaster Toy, Splatter with 100000 Gel Ball Beads, Suitable for Outdoor Activities Team Game, Halloween, Christmas, Birthday Party Gift for Kids Ages 12+","https://m.media-amazon.com/images/I/81LJS1dWBjL._AC_UL320_.jpg","4.4","191","49.99","228"
"B07TZ7B7JZ","NARMAY® Play Tent Twinkle Zodiac Dome Tent for Kids Indoor/Outdoor Fun - 48 x 48 x 40 inch","https://m.media-amazon.com/images/I/81M2kQED46L._AC_UL320_.jpg","4.6","3756","32.99","228"
"B0C2NZDYS8","JOYENERGY Foam Ball Pit for Toddlers 35.4 x 11.8 inch Soft Round Baby Ball Pit for Babies Playroom and Indoor Outdoor, Baby Playpen Ball Pool Ball Pit of Ideal Gift for Children - Grey","https://m.media-amazon.com/images/I/51JV2u7VjYL._AC_UL320_.jpg","4.5","40","34.99","228"
"B08RRNZCW9","Outdoor Adventure Set for Kids Boys and Girls Camping Exploration Toys and Backyard Safari Hunting Survival Explorer Gear for Kids","https://m.media-amazon.com/images/I/71ltmb9Ie4L._AC_UL320_.jpg","4.1","237","39.95","228"
"B087GBV786","Trailblaze Climbing Rope Ladder 6ft Wooden Ninja Ladder for Kids | Kids Ninja Warrior Obstacle Course Accessories | Playset Rope Ladder for Swing Set | Playground Ninja Obstacles Swing Rope Ladder","https://m.media-amazon.com/images/I/81sopCcH7wL._AC_UL320_.jpg","4.4","411","33.87","228"
"B004PVTIO4","POOL BLASTER Water Tech Pool Pouch – Versatile Pool Storage for Floats, Balls, Inflatable Toys, Patio Accessories - Heavy Duty Reinforced Attaches to Pool Side, Fence or Free Standing","https://m.media-amazon.com/images/I/81xPh9SnSBL._AC_UL320_.jpg","4.4","3800","20.09","228"
"B07X7ZWFLG","ZIZILAND Replacement Mini Trampoline Leg Cap Tips, 6 Pieces, Black","https://m.media-amazon.com/images/I/61IXmX+Q93L._AC_UL320_.jpg","4.7","159","9.99","228"
"B0000AYGIX","Intex River Rat Swim Tube, 48"" Diameter, for Ages 9+ , Black","https://m.media-amazon.com/images/I/71f1S1VXxRL._AC_UL320_.jpg","4.6","2272","10.99","228"
"B09Y1L6WZN","Inflatable Glitter 5 Inch Confetti Beach Balls Beach Party Decorations Pool Party Favors/ Supplies for Summer Water Play Pool Hawaii Luau (12)","https://m.media-amazon.com/images/I/81qvylKWYGL._AC_UL320_.jpg","4.0","69","13.99","228"
"B07WJKFTQR","TP Toys, Spiro Spin Seesaw | Sit and Spin Teeter Totter with 360 Spin and Bounce Wheel | Kids Outdoor Play Equipment for Backyard, Playground, or Indoor Fun | Boys and Girls Ages 3-8.","https://m.media-amazon.com/images/I/61bItJeiHiS._AC_UL320_.jpg","4.5","404","119.9","228"
"B09YS2T5Z2","DieCast Hot Wheels Mario Kart Bowser Jr, Flame Flyer 1:64 Scale","https://m.media-amazon.com/images/I/51XYCskJYzL._AC_UL320_.jpg","4.9","95","17.99","228"
"B00362RTJ4","USToy Inflatable Trophy Toy 16 Inches, Gold, 1-Pack","https://m.media-amazon.com/images/I/719jecgv-yL._AC_UL320_.jpg","4.3","219","8.09","228"
"B0C1G1NXC9","Pool Floats - 2 Pack Inflatable Pool Floats Rafts, Pool Floats for Adult, 45"" X 27"" Pool Floats Hammock, Non-Stick PVC Pool Float Lounger, 4-in-1 Pool Floaties, Hammock, Saddle, Lounge Chair, Drifter","https://m.media-amazon.com/images/I/819Ou63NRwL._AC_UL320_.jpg","3.8","84","6.99","228"
"B09XZZ5YR7","48 Pieces Ball Party Favor Set 24 Inspirational Sport Ball Wristbands 24 Sports Stress Ball Adjustable Baseball Football Soccer Bracelet Mini Foam Sports Balls for Team Reward Birthday","https://m.media-amazon.com/images/I/81wgu+clWsL._AC_UL320_.jpg","4.6","87","23.99","228"
"B07QS7PP8V","FUN LITTLE TOYS 10Packs Giant Bubble Wands Set with 17oz Bubble Solution, Catchable Big Bubble Wands with Tray Bulk for Kids Adults, Funny Bubble Maker for Summer Outdoor Activity, Easter Party Favors","https://m.media-amazon.com/images/I/61vdSrh0MGL._AC_UL320_.jpg","4.2","989","19.95","228"
"B07HJW8HD8","Sport Squad Precision Basket Tower Toss - Bean Bag Toss Game for Adults and Kids - Indoor or Outdoor Use - Throw the Included Bean Bags and Ping Pong Balls into Bucket Targets to Score Points","https://m.media-amazon.com/images/I/71Wce3nouIL._AC_UL320_.jpg","4.3","422","21.56","228"
"B0BYZCYRRL","Flying Disc Launcher Toy, Kids Outdoor Flying Saucer Toys, Portal Gun, 4 Flying Discs Gun and 1 Light Up Spinning Tops with Flashing LED Lights for Kids Pets Girls and Boys Birthday Gift Ages 3-12+","https://m.media-amazon.com/images/I/710nqK3UDmL._AC_UL320_.jpg","3.7","25","8.99","228"
"B09B9YXLWZ","30 Packs Kids Christmas Party Favors and Classroom Students Gifts, Push Fidget Bubble Fidget Sensory Bulk Mini Pop Keychain,Boys Girls Holiday Camp Small Rainbow Activities Prizes","https://m.media-amazon.com/images/I/81D-TK0ho-L._AC_UL320_.jpg","4.6","264","14.99","228"
"B07VZK5MJZ","NERF Fortnite SMG-E Blaster - Motorized Dart Blasting - 6-Dart Clip, 6 Official Elite Darts - for Youth, Teens, Adults","https://m.media-amazon.com/images/I/81XiCT5syfL._AC_UL320_.jpg","4.7","6645","31.3","228"
"B009QUCVJS","Intex Lil' Whale Ride-On, 60"" X 45"", for Ages 3+","https://m.media-amazon.com/images/I/61gPD7LHQ6L._AC_UL320_.jpg","4.6","557","13.3","228"
"B0BR5HFKWC","ISCSTO Gel Ball Blaster, High Speed Automatic Splatter Ball Blaster with 50000+ Water Beads, Rechargeable Gel Ball Blaster Toys for Outdoor Activities Yard Backyard Shooting Game Party, Ages 8+","https://m.media-amazon.com/images/I/715rHVTpj9L._AC_UL320_.jpg","4.0","92","45.99","228"
"B01N6ZINQR","Coodoo Compatible Darts 100 PCS Refill Pack Bullets for Nerf Guns N-Strike Elite Series Blasters Toys for Nerf Party - Blue with Storage Bag","https://m.media-amazon.com/images/I/91-ECInYfWL._AC_UL320_.jpg","4.7","5051","8.99","228"
"B09N2ZJWGC","Polita Pool Float, Pool Floats Adult with Backrest, 2in1 Pool Floats Adult Size Mesh Bottom, Pool Floats Kids with Cup Holder and Handle, Blow Up Pool Floats for Swimming Pool (Flamingo)","https://m.media-amazon.com/images/I/71RIF+lzwAL._AC_UL320_.jpg","4.4","298","11.66","228"
"B00N7AKJ6K","AppleRound Space Hopper Ball with Air Pump: 28in/70cm Diameter for Age 13 Years and Up, Hop Ball, Kangaroo Bouncer, Hoppity Hop, Jumping Ball, Sit and Bounce","https://m.media-amazon.com/images/I/91l70qnl6BL._AC_UL320_.jpg","4.6","1240","22.6","228"
"B07YSBC59V","A11N Kubb Viking Chess Lawn Game - Premium Yard Game Set with Tote Bag","https://m.media-amazon.com/images/I/71RpqXKWtIL._AC_UL320_.jpg","4.5","299","39.47","228"
"B07SKBSYK2","STALLY Hacky Sack Footbag 3-Pack, Assorted Colors","https://m.media-amazon.com/images/I/81OdNwiVuwL._AC_UL320_.jpg","4.4","246","15.0","228"
"B07BGS8HL1","Beach Sandy - Set of 2 Sand Remover for Beach, Sand Brush for Beach Feet, Ocean & Lakeside Sports Recreation - Eco Friendly","https://m.media-amazon.com/images/I/71tnKXw+TSL._AC_UL320_.jpg","4.6","243","25.0","228"
"B0757GWDC7","YMCtoys Replacement Sticky Balls for Toss and Catch Sport Game (Hook and Loop) Refill Pack 1 Dozen Bulk (Set of 6)","https://m.media-amazon.com/images/I/61rl26eqqML._AC_UL320_.jpg","4.6","302","9.99","228"
"B07R9F6GW8","NERF Fortnite HC-E Mega Dart Blaster - Includes 3 Official Mega Fortnite Darts - for Youth, Teens, Adults","https://m.media-amazon.com/images/I/71dFSTlaAML._AC_UL320_.jpg","4.7","6459","13.84","228"
"B08B4M9415","ImpiriLux Inflatable 5 Foot Tall Double Sided Football Receiver and Baseball Catcher Target Trainer Set | Includes One Inflatable with Two Sided, 2 Plush Footballs, 2 Plush Baseballs","https://m.media-amazon.com/images/I/81JqpM8NvaL._AC_UL320_.jpg","4.0","246","29.99","228"
"B00OMX23BU","Red Floor Circus Tent Indoor Children Play House Outdoor Kids Castle by POCO DIVO","https://m.media-amazon.com/images/I/613O8k7XtnL._AC_UL320_.jpg","4.5","500","29.98","228"
"B09WTDGR8H","Disc Swing for Kids, Swing Set Accessories, KINSPORY 7FT Height Adjustable Gym Monkey Bars, Tree Swing for Backyard, Outdoor Play Equipment - Green","https://m.media-amazon.com/images/I/7179BnCBR4L._AC_UL320_.jpg","4.2","205","27.99","228"
"B0B4NKNLSX","YHWSLYZ Electric Gel Blaster Pistol with 50000 Gel Ball and Goggles+ Three Types of Magazines, 2 Modes Automatic Splatter Ball Gun for Outdoor Shooting Games - Perfect for Adults and Kids (Skeleton)","https://m.media-amazon.com/images/I/81qWq9KmPXL._AC_UL320_.jpg","4.1","41","29.99","228"
"B07S67RTTV","Aitey Bubble Wands Set, 26 Pcs Giant Bubble Wands for Kids Toddlers, Large and Small Bubbles Makers Kit with Tray, Bubble Toys for Summer Outdoor Activities Games Party Favors","https://m.media-amazon.com/images/I/71-oYqx+jDL._AC_UL320_.jpg","4.5","1676","11.99","228"
"B07SGZNWB7","RITONS 4 Pcs Set Inflatable Floating Row Toys, Adult Children Pool Party Water Sports Games Log Rafts to Float Toys","https://m.media-amazon.com/images/I/71kgLBCFWiL._AC_UL320_.jpg","3.5","1012","19.99","228"
"B092VG4Q9S","OJYUDD 4 Pcs Sands Multi-Colored Sand Sifters,Plastic Sand Sifter,Sand Sifter Sieves for Sand and Beach(Red,Blue,Yellow and Green)","https://m.media-amazon.com/images/I/71sxPHh1RrS._AC_UL320_.jpg","4.5","212","9.95","228"
"B0BDMBCGCV","Vinsot 12 Pack 8.5 Inch Playground Balls Kickball Bulk, Bouncy Balls for Kids Inflatable Bouncing Handball with Hand Pump for Indoor Outdoor Games","https://m.media-amazon.com/images/I/81FPco0ql-L._AC_UL320_.jpg","4.3","28","32.99","228"
"B08D6ZCTT9","Nerf Bunkr Battle Stackers Inflatable BattleZone Pack of 4 NERF Shield Bunker Barricade Crates and Barrels - Perfect for NERF Party or NERF War","https://m.media-amazon.com/images/I/91ODqQD+6BL._AC_UL320_.jpg","4.3","210","22.25","228"
"B08RYP9KXC","BestJoy Kids Bubble Gun Machine for Toddlers 1-3, Big Bubble Wand Giant Bubble Blower Bubble Maker, Fun Dinosaur Outside Outdoor Toys Birthday Gifts for Boys Age 4-8","https://m.media-amazon.com/images/I/81V5iWidWTL._AC_UL320_.jpg","4.1","1499","25.99","228"
"B01FC7F0CS","Hydro Swirl Spinning Water Sprinkler for Kids Outdoor Play – Kids Sprinklers for Yard Outdoor Activities – Splashing Outdoor Water Play Toy W. Wiggle Tubes – TIDAL STORM Water Sprinklers for Yard Kids","https://m.media-amazon.com/images/I/A1bEfIpihlL._AC_UL320_.jpg","4.3","2970","18.99","228"
"B0BD6RDYJN","Tagitary Snow Toys for Kids Outdoor, Snowball Maker Toys Outdoor Winter Toys Snow Molds with Snow Duck Maker Tool Clip Shovels, Snow Block Maker with Storage Bag Gifts for Kids Winter Snow Toys Kit","https://m.media-amazon.com/images/I/816rtX7uQyL._AC_UL320_.jpg","4.7","42","23.99","228"
"B00BIK3YFO","Hog Wild Shark Popper Toy - Pop Foam Balls Up to 20 Feet - 6 Balls Included - Age 4+","https://m.media-amazon.com/images/I/71qZiYiAjjL._AC_UL320_.jpg","4.6","1092","12.54","228"
"B08ZLHX3WW","NARMAY® Play Tent Summer Camping Dome Tent for Kids Indoor/Outdoor Fun - 60 x 60 x 44 inch","https://m.media-amazon.com/images/I/81GKzJsC8oS._AC_UL320_.jpg","4.6","580","36.99","228"
"B0BNNPSC5P","Giant Inflatable Beach Ball Jumbo Rainbow Color Ball Big Beach Ball Inflatable Beach Toys Plastic Inflatable Balls for Pool Summer Beach Pool Party Event Massive Games","https://m.media-amazon.com/images/I/61RAvXnIyJL._AC_UL320_.jpg","4.3","12","24.99","228"
"B08SYD2685","NERF Ultra Select Fully Motorized Blaster, Fire for Distance or Accuracy, Includes Clips and Darts, Outdoor Games and Toys, Automatic Electric Full Auto Toy Foam Blasters","https://m.media-amazon.com/images/I/71vwM-lXC+L._AC_UL320_.jpg","4.6","1770","37.0","228"
"B08YZ4S9LM","Back Bay Play 6 Piece Sand Castle Molds Beach Toys kit - Snow & Sand Toys Sets for Kids Outdoor Sandbox Toys for Toddlers 1 Year and Up Made in USA (Multicolor / 2 Shovels)","https://m.media-amazon.com/images/I/71RVuYU9weL._AC_UL320_.jpg","4.6","1066","21.99","228"
"B09C1QCRPG","Dinosaur Toys Gun for Nerf Dino Guns with 40 Soft Foam Darts, Fully Automatic Motorized Shooting Games for Kids, Outdoor Games Toys for 8-12 Year Old Boys Girls - Christmas Birthday Gifts for Children","https://m.media-amazon.com/images/I/716pZNsRw1L._AC_UL320_.jpg","4.3","80","29.99","228"
"B089ST1W8K","Okuna Outpost 24-Pack Mini Foam Fingers for for Sports-Themed Birthday, Mini Party Favors, Game Day Supplies, Mini Foam Hand Fingers It's Going Down, We're #1 (6 Colors, 5.5 in)","https://m.media-amazon.com/images/I/8181gBTndDL._AC_UL320_.jpg","4.3","61","14.99","228"
"B09QKHZXN7","500 Rounds Refill Pack Balls Ammo for Nerf Hyper Blaster Series Stock Up Hyper Games","https://m.media-amazon.com/images/I/71GkuJGuiUL._AC_UL320_.jpg","4.7","33","19.99","228"
"B07KW2V5CG","RedSwing Swing Seat for Kids Outdoor with 57-86"" Rope, Kids Safety Playground Swing Seat Replacement, Belt Swing, Heavy Duty, Blue 1 Pc","https://m.media-amazon.com/images/I/1115chdsmTL._AC_UL320_.jpg","4.7","749","19.99","228"
"B0BZ43QTDR","candyfouse 3 Pack Mesh Beach Bag Kids, Beach Toy Seashell Bags with Zipper, Shell Collecting Bag Beach Seashell Bag for Holding Shells, Beach Toys for Boys and Girls","https://m.media-amazon.com/images/I/81GClFgGKhL._AC_UL320_.jpg","4.5","54","6.99","228"
"B0C36THM9S","Electric Water Gun for Adults&Kids Automatic Water Gun 25 FT Range Strongest Water Blaster Summer Swimming Pool Beach Outdoor Toys（Pink2）","https://m.media-amazon.com/images/I/81C12sqAMiL._AC_UL320_.jpg","4.7","116","9.99","228"
"B09VQ39KHK","Island Genius Boxing Set for Kids Equipment Includes Punching Bag with Stand and Gloves | Active Toys and Gifts for Boys & Girls Ages 5 6 7 8 Years Old","https://m.media-amazon.com/images/I/81acmbsBf1L._AC_UL320_.jpg","4.2","188","19.99","228"
"B0B6QGCB3J","Little Tikes Splash Beach Water Table Splash Pad for Kids, Boys, Girls Ages 2+ Years","https://m.media-amazon.com/images/I/61YaiMjq0EL._AC_UL320_.jpg","4.8","139","76.07","228"
"B08QMX5J6W","Foam Swords Weapons Toy for Boys - 17 inch Foam Sword Axe and Hammer - Pack of 5 Kids Ninja Weapons Foam Swords for Kids - Play Toy Swords Pretend Playset for Boys, Kids Foam Weapons Gift Boys & Girls","https://m.media-amazon.com/images/I/71E7EKJopIL._AC_UL320_.jpg","4.1","89","19.34","228"
"B084ZTZ2W2","Mickey Mouse Kids Ball Pit, 1 Inflatable & 15 Soft-Flex Balls","https://m.media-amazon.com/images/I/810KwF8-d6L._AC_UL320_.jpg","4.5","499","24.99","228"
"B0BMLQRC1Q","Bubble Wand Machine For Kids, Automatic Electric Cartoon Frog Musical & Light USB Rechargeable Bubble Maker With 2 Bubble Solutions For Outdoor, Green Gifts Toys For Boys & Girls 3 4 5 6 7 8 Years Old","https://m.media-amazon.com/images/I/71MqQ0oL3+L._AC_UL320_.jpg","4.3","110","12.89","228"
"B07DL2MVRB","Mozlly Silver, Gold, and Rose Gold Inflatable Pool Floats Tube Set of 3 - Premium Fun Confetti Swim Rings Toys, Adult and Kids Pool Float Water Tubes for River, Beach, Pool Party Decorations - 36 inch","https://m.media-amazon.com/images/I/81qhWKCu0PL._AC_UL320_.jpg","4.6","304","24.78","228"
"B0B1TNZMSF","ASHINER Swimming Arm Floats for Kids - Dual Airbag Design, Durable Material Swimming Arm Bands for Children - Inflatable Roll Up Armbands, The Perfect Summer Essential for Fun and Safety in The Water","https://m.media-amazon.com/images/I/71Py49w2-iL._AC_UL320_.jpg","4.2","493","6.99","228"
"B07HRJ32HY","New Skywalker Trampolines Basketball Game","https://m.media-amazon.com/images/I/A1gFpb8xcwL._AC_UL320_.jpg","4.3","784","31.49","228"
"B0834NY8VV","iGeeKid Baby Inflatable Pool Float with Canopy, Safty Seat for Toddler Infant Car Shaped Babies Swim Ring Pool Spring Floaties Summer Beach Outdoor Play (Blue)","https://m.media-amazon.com/images/I/71y6DjdH0NL._AC_UL320_.jpg","3.9","1960","16.99","228"
"B00B0DWCOI","Little Tikes Junior Play Slide Green/Blue, 5 ft or less","https://m.media-amazon.com/images/I/71rXmlb8r-L._AC_UL320_.jpg","4.6","2280","51.99","228"
"B0BKTJF58J","Duncan Toys Butterfly Yo-Yo, Beginner Yo-Yo with String, Steel Axle and Plastic Body, Purple (3124BU-ECHAP)","https://m.media-amazon.com/images/I/81x2kOA8X1L._AC_UL320_.jpg","4.5","56","9.99","228"
"B07QHGYZBB","Bubbleventi Giant Bubble Mix | Made in USA |100% Vegan Non-Toxic Powder Makes 10 Gallons of Premium, Big Bubble Solution for kids’ STEM fun | Use in Bubble Wands + Machines","https://m.media-amazon.com/images/I/91gnk99krDL._AC_UL320_.jpg","4.3","839","14.95","228"
"B01AD1TZDI","Melissa & Doug Sunny Patch Pretty Petals Flower Watering Can - Pretend Play Toy","https://m.media-amazon.com/images/I/61lFVmA+lgS._AC_UL320_.jpg","4.6","2011","15.99","228"
"B089G62NZJ","Nature Bound Butterfly Net Bug Catcher for Kids with Floating Handle - Boys & Girls Ages 3+","https://m.media-amazon.com/images/I/71mbPu2RwML._AC_UL320_.jpg","4.5","110","11.99","228"
"B0992BSGWH","White Rocket Ship Kids Ball Pit with Play Tent and Play Tunnel, Kids Pop Up Tent for Indoor Outdoor, Spaceship Tent for Boys Girls Babies Toddlers (3 in 1)","https://m.media-amazon.com/images/I/71k+BMSeO8L._AC_UL320_.jpg","4.6","294","45.99","228"
"B004S2CVPS","Pacific Play Tents 19791 Kids Tree House Bed Tent Playhouse - Fits Full Size Mattress , Green","https://m.media-amazon.com/images/I/81iEhnHGUlL._AC_UL320_.jpg","4.7","489","42.99","228"
"B08CX9NHVY","Decoroca Kinetic Wind Spinners Outdoor Metal - 72 Inches Wind Catchers Spinner for Outdoor Yard Patio Lawn Garden Decorations, Double Wind Spinners with Outdoor Stable Metal Stake","https://m.media-amazon.com/images/I/81YPZtdsiUL._AC_UL320_.jpg","4.5","867","98.09","228"
"B09WQT52LH","Trampoline Stakes Anchors Heavy Duty High Wind U Type Sharp Ends Ground Anchors Galvanized Steel Stakes for Soccer Goals, Camping Tents and Huge Garden Decoration","https://m.media-amazon.com/images/I/71C8QVA7AcL._AC_UL320_.jpg","4.7","108","18.95","228"
"B0837K9XPY","StillCool Baby Swimming Float, Inflatable Swimming Ring with Float Seat for 6 Months-6 Years Children (New Pink)","https://m.media-amazon.com/images/I/71xP95EUh9L._AC_UL320_.jpg","4.0","608","9.99","228"
"B092QP5T15","2+1 Heavy Duty 304 Stainless Steel Swivel Ring Double Ended Swivel Eye Hook with SUS304 Snap Hooks for Web Tree Swing, Swing Spinner Hanger, Reliable and Safe (M6)","https://m.media-amazon.com/images/I/71Jnm5Kt0yS._AC_UL320_.jpg","4.7","393","9.99","228"
"B0BWD6M97Z","XIPEGPA 20 PCS Mini Flick Football Games Mini Table Top Sports Games with Foam Footballs Goal Post and Cards Finger Toys Office Indoor Football Sports Party Favors Birthday Gifts Office Desk Toys","https://m.media-amazon.com/images/I/81cV8ecw2pL._AC_UL320_.jpg","4.2","8","13.99","228"
"B07JCR1FJJ","Hey! Play! Water or Sand Sensory Table with Lid and Toys - Portable Covered Activity Playset for The Beach, Backyard or Classroom","https://m.media-amazon.com/images/I/71qEZe3-AFL._AC_UL320_.jpg","4.1","267","22.63","228"
"B09PY2C2PW","Highpro Swing Set Brackets-A-Frame 2 Swing Set Brackets with All Mounting Hardware","https://m.media-amazon.com/images/I/61LP8E6lmlL._AC_UL320_.jpg","4.8","116","49.99","228"
"B0BYQCLX9N","Wood Magnifying Glass for Kids - Wooden Montessori Learning Adventure Toy - Learn and Explore","https://m.media-amazon.com/images/I/61LbQ-DeWhL._AC_UL320_.jpg","4.5","29","11.99","228"
"B0BGJVRRDH","Beetle & Bee Duck Call, FSC Certified Wood-Outdoor Play, Outdoor Adventure Toy, for Boys and Girls 3+","https://m.media-amazon.com/images/I/510k9Z5hHQL._AC_UL320_.jpg","4.0","16","8.0","228"
"B0BLJ4JGP6","Matchbox Volkswagen EV 4","https://m.media-amazon.com/images/I/71oqCva0sVL._AC_UL320_.jpg","4.8","28","6.35","228"
"B00ZPP5E8S","Intex River Run Connect Lounge (Four)","https://m.media-amazon.com/images/I/71k2tq7DtsL._AC_UL320_.jpg","4.4","981","89.69","228"
"B082SN3PP7","Mambobaby Float Add Tail Newest Baby/Infant Swim Float with Canopy, Non-Inflatable Solid Upgrade Soft Waterproof Skin-Friendly Leather Material (Deluxe Edition)","https://m.media-amazon.com/images/I/717o7HQMhPL._AC_UL320_.jpg","4.6","2687","69.0","228"
"B0C2Q32NDR","Ankle Skip Ball for Kids, Foldable Colorful Light Flash Wheel Skip It Ball for Kids, Adults, Indoor Outdoor Game Toys for Kids & Adults, Gift for Boys, Girls Ages 5 6 7 8 9 10 11 12 Years Old","https://m.media-amazon.com/images/I/812NDHyjPyL._AC_UL320_.jpg","4.2","26","14.99","228"
"B09VG7TQM5","Trampoline Stakes Heavy Duty Anchors High Wind Stakes,15.84"" Galvanized Steel Corkscrew Anchors Kit for Trampoline,Field-deployments, Hunting Camp, Canvass Tents(Set of 4)","https://m.media-amazon.com/images/I/71Xg5iW54wL._AC_UL320_.jpg","4.7","186","19.95","228"
