"asin","title","imgUrl","stars","reviews","price","category_id"
"B09QSSL9WB","Kids Headphones with Mic for School, 85dB/94dB Volume Limited Foldable&Adjustable On-Ear Headphones for Kids Boys Girls, 3.5mm Jack Stereo Wired Headphones for Phone, Tablet, Kindle, School/Travel","https://m.media-amazon.com/images/I/61sdxeN0-EL._AC_UL320_.jpg","4.6","429","15.99","71"
"B0BYDC6BL1","Jcurycke Headset Holder with Walnut Wood and Solid Metal, Headphone Holder Adjustable Design Headset Hanger Compatible with all Headphone Sizes (Walnut)","https://m.media-amazon.com/images/I/41OgLVGPYUL._AC_UL320_.jpg","5.0","5","15.98","71"
"B09HBYBR9Z","KLIM F1 USB C Earphones + NEW 2022 version + Excellent Audio Quality + Durable USB C Headphones with microphone + 5-Year Warranty + Wired USB C Earbuds Compatible Huawei Sony Samsung headphones type C","https://m.media-amazon.com/images/I/619xlludspL._AC_UL320_.jpg","4.2","1219","9.97","71"
"B07TN2HJYH","MEE audio BTC2 Bluetooth Wireless Adapter Cable for MX Pro Series and M6 Pro in-Ear Monitors with Qualcomm aptX and aptX Low Latency, Bluetooth 5.0, IPX5 Sweat Resistance, Microphone, Remote, Black","https://m.media-amazon.com/images/I/715h+7toZUL._AC_UL320_.jpg","4.3","53","59.99","71"
"B0C98FZ4SZ","Ortizan Open Ear Headphones-Wireless Earbuds with Earhooks Bluetooth 5.3 and IP67 Sweatproof- Air Conduction Headphones with Dual 16mm Dynamic Drivers HiFi Stereo Sound for Sports(I9,Black)","https://m.media-amazon.com/images/I/614NyQyK25L._AC_UL320_.jpg","4.0","107","29.99","71"
"B0BF4ZMY5Q","KIMAFUN 2.4G Wireless in Ear Monitor System, Stereo IEM System Neckband Headphone Earphone for TIK Tok Live Broadcast, YouTube Live Streaming, Live Sound Card, Speakers, Mixers, Drummers, DJs(G120)","https://m.media-amazon.com/images/I/61ybjjSxWAL._AC_UL320_.jpg","4.3","42","149.99","71"
"B0B9N3ZRXZ","REETEC Wireless Bluetooth Headphones Over Ear - [7 LED Lights Display] Foldable Hi-Fi Stereo Deep Bass Wired and Wireless Headphones with Microphone for iPhone, iPad, Laptop, PC, SD/TF - Black","https://m.media-amazon.com/images/I/61C8YdLyiHL._AC_UL320_.jpg","4.4","954","26.99","71"
"B076FHV6PQ","JVC Wireless Sweatproof Gumy Sport Bluetooth Wireless Earbud Nozzle, Blue (HAEN10BTA)","https://m.media-amazon.com/images/I/71Y8y+cwv2L._AC_UL320_.jpg","4.2","97","11.99","71"
"B019EMMUI4","Batman Kids Safe Over The Ear Headphones HP2-03082 | Kids Headphones, Volume Limiter for Developing Ears, 3.5MM Stereo Jack, Recommended for Ages 3-9, by Sakar,Yellow","https://m.media-amazon.com/images/I/611KL4+Ox3L._AC_UL320_.jpg","3.7","1836","15.67","71"
"B08MZZ94JV","Jelanry for iPhone 15 USB C Headphone with Microphone, USB Type C Earbuds Wired Magnetic Hi-fi Volume Control for iPad Mini Air Galaxy Z Fold 5 4 Flip 3 S23 S22 S21 S20 Pixel 7 OnePlus 10 9 Pro, Black","https://m.media-amazon.com/images/I/71Gf5tEmpiL._AC_UL320_.jpg","4.3","799","14.98","71"
"B099GWB3N1","eKids Love Diana Kids Bluetooth Headphones, Wireless Headphones with Microphone Includes Aux Cord, Volume Reduced Kids Foldable Headphones for School, Home, or Travel","https://m.media-amazon.com/images/I/81c+XQpHX4S._AC_UL320_.jpg","4.4","51","29.99","71"
"B0BF8RT88N","ONANOFF BuddyPhones PlayEars+, On-Ear Bluetooth Kids Headphones with Cat Ears, Volume-Limiting with Microphone, Works Wired or Wireless, 24-Hours Battery Life, for iPhone, iPad, Tablet and More","https://m.media-amazon.com/images/I/61pdE8D9nrL._AC_UL320_.jpg","4.7","30","49.99","71"
"B00YOVPZAQ","KZ ATE KZ-ATE Dynamic Balanced Armature IEMS In Ear HIFI Monitors DJ Studio Stereo Music Earphones Headphone Earbuds For Mobile Phone iPhone Samsung MP3 MP4 Music Player (Black)","https://m.media-amazon.com/images/I/51nW8cGFGlL._AC_UL320_.jpg","4.1","316","15.39","71"
"B005HP3OB0","SoundMAGIC E10 Wired Earphones No Microphone HiFi Stereo Earbuds Noise Isolating in Ear Headphones Powerful Bass Tangle Free Cord Gunmetal","https://m.media-amazon.com/images/I/61SaaSObDYL._AC_UL320_.jpg","4.3","6671","29.99","71"
"B0BF9D8J93","Edifier WH500 Wireless On-Ear Headphones – Bluetooth V5.2 Lightweight and Foldable Headphones with 40-Hours Music Playtime – Personalize EQ -Fast Charging (Black)","https://m.media-amazon.com/images/I/61BXyIsJ5sL._AC_UL320_.jpg","4.2","1392","49.99","71"
"B0C589LT5X","Mnvesz Wireless Open Ear Headphones, Wireless Bone Conduction Headphones Open Ear Clip Headphones Bluetooth, Clip On Wireless Earbuds Headphones Cycling Running Workout Ear Buds (Black)","https://m.media-amazon.com/images/I/61-VYR+dncL._AC_UL320_.jpg","3.5","35","17.99","71"
"B0C9M4Y1ZF","USB C Headphone Magnetic Type C Earbuds for iPhone 15 Pro Max Samsung A53 A54 Galaxy S23 S22 S21 S20 Google Pixel 7 7a 6 6a 5 Wired Earphone HiFi Stereo in-Ear Noise Canceling Corded Headset with Mic","https://m.media-amazon.com/images/I/71DzuxuvhzL._AC_UL320_.jpg","4.4","12","15.99","71"
"B0BP929T63","Jupiter True Wireless Earbuds, Sleek Earbuds Wireless Bluetooth 5.3 with Fast Charging Feature, Professional Wireless Earbuds for Android and iOS Devices - Plug Arena White","https://m.media-amazon.com/images/I/51FmFHArpPL._AC_UL320_.jpg","4.0","28","34.99","71"
"B001TUYQB4","Cospa Evangelion New Theatrical Version: Order Interface Headset Asuka Version 1 Count (Pack of 1)","https://m.media-amazon.com/images/I/51AfuSLIWgL._AC_UL320_.jpg","4.6","190","27.8","71"
"B07CRZ4MCX","Ghostek soDrop Pro Wireless Headphones Headset Active Noise Canceling HD Hi-Def Audio Technology Hi-Fi Stereo Crystal Clear Sound Enhanced Foldable Built in Microphone (White)","https://m.media-amazon.com/images/I/81S0jWuI4zL._AC_UL320_.jpg","4.2","154","59.98","71"
"B08M43GKQP","Samsung Galaxy Buds Live, Earbuds w/Active Noise Cancelling (Mystic Bronze) (Renewed)","https://m.media-amazon.com/images/I/61zjzpk46sL._AC_UL320_.jpg","4.4","349","68.97","71"
"B0BD5LFMNP","KZ ZS10 Pro X 4BA+1DD Hybrid Technology Wired Earbuds in Ear Monitor Earphones with Microphone HiFi bass in-Earphones with Detachable 2 pin Cable (Black Without Mic)","https://m.media-amazon.com/images/I/71FdvhNE4TL._AC_UL320_.jpg","4.6","17","55.99","71"
"B0B2PKS8DY","LORELEI E7 Kids Headphones with Microphone,On-Ear Wired Headset for Children/Boys/Girls,85/94dB Safe Volume,Foldable&Rotatable3.5mm Audio Jack Tangle-Free for School/iPad/Laptop/Travel (Blue&Red)","https://m.media-amazon.com/images/I/71pUKH0KXKL._AC_UL320_.jpg","4.6","40","16.99","71"
"B09NRSNBX1","Earphones with Lightning Connector, MFi Certified Wired Earphones with Microphone and Volume Control, Compatible with iPhone 13/12/11 Pro Max/Xs Max/XR/X/7/8 Plus","https://m.media-amazon.com/images/I/51h1Pho+7XL._AC_UL320_.jpg","4.2","159","16.49","71"
"B01FECPPXK","Far End Gear XDU Pathfinder + Mic Single Stereo-to-Mono Noise Isolating Earphone, Reinforced Cord","https://m.media-amazon.com/images/I/61mhTaFjdkL._AC_UL320_.jpg","3.9","258","23.95","71"
"B09FKHK1NZ","Sony WF-C500 True Wireless Headphones - Up to 20 Hours Battery - Charging case - Voice Assistant Compatible - Built-in mic for Phone Calls - Reliable Bluetooth - Coral Orange","https://m.media-amazon.com/images/I/51wlp1V2WDL._AC_UL320_.jpg","4.4","681","89.99","71"
"0357449118","Reflect Listening & Speaking 1","https://m.media-amazon.com/images/I/71BaKT9Gu7L._AC_UL320_.jpg","4.0","11","46.0","71"
"B0C6LPW491","Kytree Mini Wireless Ear Clip Bone Conduction Earbuds, Black Waterproof Bluetooth Open Ear Headphones, Outer Sports Earphones Cycling Sleep Running Workout Ear Buds, Noise Cancelling Earbuds","https://m.media-amazon.com/images/I/613kB2hgsfL._AC_UL320_.jpg","3.9","7","11.99","71"
"B09WMCQSKK","Link Dream Cleaner Kit for AirPods Pro AirPods 3 2 1 Cleaning Pen Kit for AirPod Samsung Sony Earbud Earphone iPhone and Other Mobile Phone","https://m.media-amazon.com/images/I/61X4pfy1VnL._AC_UL320_.jpg","4.4","68","5.59","71"
"B0BS37NYBN","Yoley 24 Packs Classroom Headphones Bulk for Kids School Students Children, Wholesale Class Set Durable Earphones, Individually Bagged (24 Pack Mixed)","https://m.media-amazon.com/images/I/61ohJrYC8YL._AC_UL320_.jpg","4.3","34","109.97","71"
"B0B56GNGML","Joymiso Wired Small Earbuds for Kids Women Small Ears with Case & 6 Sizes Covers, Comfortable Lightweight in-Ear Headphones w Microphone & Volume Control, Metal Earphones for Cell Phones Laptop Pink","https://m.media-amazon.com/images/I/610nHeiz2GL._AC_UL320_.jpg","4.2","102","14.99","71"
"B08XM4T8FS","Cleer Audio Ally Plus II True Wireless Noise Cancelling Earbuds, Long Lasting 33 Hour Battery, Best Bluetooth Earbuds, Smart Controls Mobile App, Stone","https://m.media-amazon.com/images/I/61uNAklu1-S._AC_UL320_.jpg","4.1","86","99.99","71"
"B0B8175SNK","POFENAL SL300 SL3500e Walkie Talkie Earpiece Radio Headset Compatible with TLK100 SL1K SL1M SL4000 SL7550 Two Way Radio with Mic PTT (C-Shape, 5 Pack)","https://m.media-amazon.com/images/I/61aTX0fngQL._AC_UL320_.jpg","3.5","36","95.95","71"
"B09R1STRRZ","Q5Q6 Sleep Headphones, 3D Bluetooth Sleep Mask, Wireless Sleeping Headphones for Side Sleepers, Sleep Mask with Bluetooth Headphones Insomnia Travel Nap Gifts Men Women","https://m.media-amazon.com/images/I/71-jHXBSkcL._AC_UL320_.jpg","4.1","69","23.37","71"
"B0971X1YD7","JBL Endurance Peak in-Ear Waterproof Sport Headphones Bundle with Deluxe CCI Plush Carry Case (Red)","https://m.media-amazon.com/images/I/41L5ecXpH3S._AC_UL320_.jpg","3.8","10","74.99","71"
"B0B1D35HNJ","Sleep Headphones Bluetooth Headband Wireless: Gifts for Women Men Stocking Stuffers Christmas Birthday Him Husband Wife, 3-in-1 Comfy Sleeping Eye Mask Headset Head Band Electronics Tech Gadgets Sport","https://m.media-amazon.com/images/I/91CfcQsbdKL._AC_UL320_.jpg","4.2","231","14.99","71"
"B0828RX2HW","Sleep Headphones Eyemask, Bluetooth 3D Sleep Eye Mask 2 in 1, 100% Blackout Adjustable Eyeshade with Ultra-Thin Stereo Speaker, Noise Cancelling Music Headsets for Sleep Travel Relaxation, Meditation","https://m.media-amazon.com/images/I/71LWQEps2kL._AC_UL320_.jpg","3.9","173","16.99","71"
"B07C26VM4Y","Harry Potter Bluetooth Headphones for Kids and Adults, Wireless Headphones with Microphone for Video Call or Zoom Meeting, Designed for Fans of Harry Potter Merchandise","https://m.media-amazon.com/images/I/81SlZQcSJrL._AC_UL320_.jpg","4.7","141","29.99","71"
"B0B8CY1MJ4","SIMOLIO Wireless Headphones for TV Watching with Transmitter/Charging Dock 2 in 1, 2.4G Wireless Earbuds for TV Listening, Dialog Mode & Boosted Vol & Spare Battery for Seniors, by-Pass, 100ft Range","https://m.media-amazon.com/images/I/61G9VYvhI0L._AC_UL320_.jpg","4.0","72","79.99","71"
"B098XYHJDP","Amazfit PowerBuds Pro Wireless Earbuds Bluetooth 5.0 Headphones Active Noise Cancelling, with 6-Mic, Multi Music Modes, Sports and Health Monitoring, IP55 Waterproof for Gym Workout Frost White","https://m.media-amazon.com/images/I/51jXSS6dt4S._AC_UL320_.jpg","3.9","503","129.99","71"
"B0052U8UJ6","Philips Stereo Headphones LFH-334 Under-the-Chin Style Stereo Headset for All Philips Desktops","https://m.media-amazon.com/images/I/31yL8N--RLL._AC_UL320_.jpg","4.4","22","67.5","71"
"B0988T5VZ7","Poly - EncorePro 515-M USB-A and USB-C USB Headset (Plantronics) - Optimized for Teams - Hold & Call Answer Buttons - Works with Avaya, Genesys, & Cisco Call Center Platforms - Single Ear/Mono,Black","https://m.media-amazon.com/images/I/71YMXzkwSNS._AC_UL320_.jpg","5.0","7","85.77","71"
"B09B2FBKTG","AIAIAI TMA-2 Studio Professional Studio Headphones with Highly Detailed Audio and Enhanced Comfort, Black","https://m.media-amazon.com/images/I/611CE1n7XEL._AC_UL320_.jpg","3.8","29","230.0","71"
"B0B3Y3W9B8","ANMISON Neckband Bluetooth Headphone,Wireless Earbuds Neckband with ENC Noise Cancelling, HiFi Stereo Clear headsets, 24H Playtime,USB-C Fast Charging,IPX7 Waterproof, Built-in Microphone (Grey)","https://m.media-amazon.com/images/I/71WZewoLxGL._AC_UL320_.jpg","4.0","57","19.99","71"
"B0BZYMVL4S","USB C Headphone, Wired Earbuds USB Type C Earphones Magnetic Noise Canceling in-Ear Earphones with Microphone for Samsung Galaxy S23 Ultra S22 S21 S20 A53 Pixel 7 6a 6 Oneplus iPad","https://m.media-amazon.com/images/I/61Vfa+t7jTL._AC_UL320_.jpg","4.2","37","13.29","71"
"B09X15DVF8","TOZO T6S Bluetooth 5.2 2022 New Version True Wireless Earbuds Environmental Noise Cancellation Stereo Headphones Built in Mic Headset Premium Sound with Deep Bass Support APP Control for Sport","https://m.media-amazon.com/images/I/615GtysQqFL._AC_UL320_.jpg","4.5","102","49.99","71"
"B08K972R42","Sony WH-1000XM4 Wireless Noise Canceling Over-Ear Headphones (Silver) Bundle with 4 Port USB 3.0 Hub and USB Bluetooth Dongle Adapter Work from Home (3 Items)","https://m.media-amazon.com/images/I/51M9uetuHzL._AC_UL320_.jpg","4.6","19","348.0","71"
"B0BZVP2967","AHOKEGE Open Ear Clip-on Earbuds Wireless Bluetooth Headphones for Android iPhone, Earbud & in-Ear Headphones, Bluetooth 5.3 Earbuds for Workout/Running/Exercising, 2023 Upgraded (Black)","https://m.media-amazon.com/images/I/617+3zwdr0L._AC_UL320_.jpg","3.9","58","18.99","71"
"B084WZ3SDF","JVC Wood Series, New Metal Harmonizer, Wood Dome Unit for Hi-res Audio Source and Detachable MMCX Cable - HAFW01, Small","https://m.media-amazon.com/images/I/51PH1UnMwzL._AC_UL320_.jpg","4.3","167","234.99","71"
"B096VP4VW5","YTDTKJ Nakano Miku Bluetooth Headphones,The Quintessential Quintuplets Headphone with Build-in Mic,Foldable Over Ear Wireless Headphones,Hi-Fi Stereo for Cosplay,Blue, 17TTAXXCB06390B63FQTF","https://m.media-amazon.com/images/I/61wxe8h3bwL._AC_UL320_.jpg","4.1","59","25.99","71"
"B0BNXBR3T4","USB Type C Headphone 4 Pack, USB C Earphones Type C Headphones Stereo with Microphone Volume Control Compatible with Samsung Galaxy S20+/S21/S20/Google Pixel/OnePlus/Xiaomi and Android Smartphones","https://m.media-amazon.com/images/I/61Yy0OyrK1L._AC_UL320_.jpg","4.1","154","18.99","71"
"B0BBVNL1TC","TOZO G1 Wireless Earbuds Bluetooth 5.3 Headphones with 45ms Ultra Low-Latency, Cool Breathing Light, Ergonomic Design, Gaming/Deep Bass Music Mode Headset Built-in Micro, Stereo Sound, Matte Black","https://m.media-amazon.com/images/I/41FmbSl-d6L._AC_UL320_.jpg","4.5","52","29.9","71"
"B0C242LN3T","MAS CARNEY USB C Headphones TH6, Built-in Digital Chipset, Microphone, and Remote Control, Compatible with Samsung, Huawei, Oppo, VIVO, Honor, Google Pixel Smartphones, and iPads, Pack of 2","https://m.media-amazon.com/images/I/61qsnUP9qjL._AC_UL320_.jpg","4.0","140","7.99","71"
"B07PWMTLRB","Urbanears Pampas Over-Ear Bluetooth Headphohones, Charcoal Black, Small","https://m.media-amazon.com/images/I/71JSVkKwrbL._AC_UL320_.jpg","3.9","169","59.95","71"
"B00503ZT9E","Yurbuds Focus Black","https://m.media-amazon.com/images/I/813oXXCRmFL._AC_UL320_.jpg","4.1","471","59.99","71"
"B08GMBPBNB","Sony WH-CH710N/L Wireless Bluetooth Noise Cancelling Headphones (Renewed)","https://m.media-amazon.com/images/I/511G0DPMuQL._AC_UL320_.jpg","4.2","29","109.49","71"
"B07RQ6D9G6","KZ HD Bluetooth V5.0 Headphone/Earphone Wireless Cable with Microphone Replacement for (C PIN (KZ-ZSN/ZSNpro/AS16/ZS10pro))","https://m.media-amazon.com/images/I/518YKSGytGL._AC_UL320_.jpg","4.0","292","31.99","71"
"B00SLP52YK","Plantronics 202581-01 Wired Headset, Silver/Black","https://m.media-amazon.com/images/I/61WhdCenlQL._AC_UL320_.jpg","4.3","84","69.99","71"
"B0B86XSVPK","Bengdii Bee Off Ear Headphones, Max Comfort Ear Speakers, Noncontact Earpieces, Lightweight Open Ear Headsets, Microphone, 3.5mm Jack for School/Teens/Kids/Phone/Tablet/Laptop, Korean Made, Mint","https://m.media-amazon.com/images/I/61NVjFMKA1L._AC_UL320_.jpg","4.1","44","49.99","71"
"B0B2DFV83G","Unipows Earbuds with Microphone - in-Ear Earphones with HiFi Stereo Powerful Bass, Wired Ear Buds Noise Cancelling, Headphones with 3.5mm Interface for Phones, Tablets, Laptop, MP3 Players","https://m.media-amazon.com/images/I/61EBi4sW0YL._AC_UL320_.jpg","4.1","33","5.99","71"
"B0BXXSZTBB","Gaming Bluetooth Headphones Wireless Earbuds, 48hrs Playtime Headset Wireless Charging Case, Stereo Sports Running Workout Over Ear Earphones with Earhook, for Android Cell Phone Computer Laptop","https://m.media-amazon.com/images/I/61y7GPrULAL._AC_UL320_.jpg","4.0","22","11.99","71"
"B09C8FGTBH","NexiGo Air T2 Ultra-Thin Wireless Earbuds, Qualcomm QCC3040, Bluetooth 5.2, 4-Mic CVC 8.0 Noise Cancelling for Clear Calls, aptX, 28H Playtime, USB-C, IPX5 Waterproof, Black","https://m.media-amazon.com/images/I/61hanpPC9hL._AC_UL320_.jpg","3.6","601","49.99","71"
"B07WFQX3JR","Cleer Audio Enduro 100 Wireless Bluetooth Headphone - Over Ear Fast Charging Lightweight, Podcasting 100Hr Long Battery | Full Charge 4 Day Playback, Play Music & Take Calls Ironless Driver (Sand)","https://m.media-amazon.com/images/I/61ifIjGLqcL._AC_UL320_.jpg","4.4","255","89.99","71"
"B091CQH6VT","Sony Noise Cancelling Wireless Headphones - 30hr Battery Life - Over Ear Style - Optimised for Alexa and Google Assistant - Built-in mic for Calls - WH-1000XM4L.CE7 - Limited Edition - Midnight Blue","https://m.media-amazon.com/images/I/61YHhQzV+KL._AC_UL320_.jpg","4.6","3335","349.99","71"
"B00005N9D2","Koss 154336 R-80 Over Ear Headphones, Black","https://m.media-amazon.com/images/I/71UqT6L6rxL._AC_UL320_.jpg","4.4","311","43.01","71"
"B07JCQLD3R","JustJamz Bulk Earbuds 50 Pack | Basic Ear Bud, Pearl White in-Ear Earbuds, Disposable Headphones, Class Set of Earphones for Students, Class, School, Kids, Classroom & Library, Wired Earbuds Bundle","https://m.media-amazon.com/images/I/71DSgdpbqbL._AC_UL320_.jpg","4.1","72","26.99","71"
"B07ZQSKLJ4","SmithOutlet 50 Pack Bulk Classroom Headphones Blue","https://m.media-amazon.com/images/I/71zKS6MBaFL._AC_UL320_.jpg","4.6","14","109.95","71"
"B0BLJK5Y5T","Wireless Ear Buds Bluetooth Headphones with Wireless Charging Case and LED Power Display Touch Control 30 Hrs Playtime Earphones HI-FI Stereo Earbuds with Built-in Mic for iPhone Android Samsung","https://m.media-amazon.com/images/I/51nVd9EIUuL._AC_UL320_.jpg","3.7","32","18.99","71"
"B08JLZL3B3","LINHUIPAD k8 Single Side Earphone in-Ear Stereo to Mono Earbud Headphones,3.5mm Plug Metal Noise Isolating Earplugs with mic,Spring Coil Reinforced Cord","https://m.media-amazon.com/images/I/51dV-YSA3IL._AC_UL320_.jpg","3.8","247","12.99","71"
"B0BKSX9WYC","Sordin Supreme MIL CC Slim Active Ear Defenders - Leather Band & Foam Kits - Nexus Radio Downlead - Ear Muffs","https://m.media-amazon.com/images/I/51p1Vf7VofL._AC_UL320_.jpg","4.8","7","729.0","71"
"B0C7BXNXJK","Bluetooth Headphones Over-Ear, Hi-Fi Stereo Foldable Wireless Stereo Headsets Earbuds with Built-in Mic, Volume Control, FM for iPhone/Pad/PC","https://m.media-amazon.com/images/I/71RzHRojKiL._AC_UL320_.jpg","4.4","22","13.99","71"
"B09TGWQH8B","Gaming Wireless Earbuds, Wireless Gaming Ear Buds with Charging Case 30H Playtime Waterproof in-Ear Gaming Earbuds with Microphone Clear Call Earbuds for Android iOS Game Mode","https://m.media-amazon.com/images/I/61pC1opuUKL._AC_UL320_.jpg","3.7","17","22.89","71"
"B0912BD5SM","UrbanX 2021 Stereo Headphones for Samsung Galaxy S21 Ultra 5G, Galaxy S20 FE, Galaxy S20, Note 20 Ultra, Galaxy A33 5G, A53 5G, M52, M53, A73 5G Microphone and Volume Remote Type-C Connector","https://m.media-amazon.com/images/I/51+L-237Y+L._AC_UL320_.jpg","4.0","388","18.75","71"
"B0C1RHDSDC","LFGKeng Kids Wireless Bluetooth Headphones with Colorful LED Lights, Built-in Mic, Bluetooth 5.0, Foldable, Wired HiFi Stereo Over Ear Headphones for Classroom/Home Office/Tablet/Adult (Blue)","https://m.media-amazon.com/images/I/61YO2iGNvUL._AC_UL320_.jpg","4.2","22","16.99","71"
"B0BPSY8DQP","iKF King Wireless Bluetooth V5.3 Headphones - Active Noise Cancelling with Microphone, Game Mode,80Hours Play Time, Foldable, HiFi Sound, for Online Class (Off White)","https://m.media-amazon.com/images/I/41Xlom2Q7uL._AC_UL320_.jpg","4.0","10","63.99","71"
"B07Q7GG2CP","Soundcore Liberty True Wireless Earbuds, 100 Hour Playtime, Graphene Sound, Fast Charging, Secure Fit, Bluetooth 5, Easy Pairing, Sweatproof True Wireless Earbuds with Smart AI, Stereo Handsfree Calls","https://m.media-amazon.com/images/I/61bVYaR5TyL._AC_UL320_.jpg","4.1","600","64.95","71"
"B09WQNKGN6","Perytong Sleep Headphones, Cozy Bluetooth Headphone Headband,Noise Cancelling Headphones for Sleeping, Headphone Band Built in Speakers Perfect for Side Sleepers,Workout,Running,Yoga,Travel,Insomnia","https://m.media-amazon.com/images/I/918D7iE3MGL._AC_UL320_.jpg","4.2","362","19.99","71"
"B09HC3JFVF","Unisex Bluetooth Beanie with Light, Upgraded Musical Knitted Cap with Headphone and Built-in Stereo Speakers & Mic, LED Hat for Running Hiking, for Men Women Dad (Black)","https://m.media-amazon.com/images/I/71rwk1zz91L._AC_UL320_.jpg","4.6","425","21.99","71"
"B0C6ZHR6S3","Hyyeosd Bone Conduction Headphones, Swimming Headphones IP68 Waterproof Wireless Bluetooth 5.3 Earphones Open Ear Sports Headset Built-in 32GB Memory with MP3 Player for Swimming, Hiking, Running","https://m.media-amazon.com/images/I/61uncwD2u-L._AC_UL320_.jpg","4.8","308","79.99","71"
"B08R6FDDQ5","eKids Blues Clues Kids Bluetooth Headphones, Wireless Headphones with Microphone Includes Aux Cord, Volume Reduced Kids Foldable Headphones for School, Home, or Travel","https://m.media-amazon.com/images/I/81+kwUY1DsL._AC_UL320_.jpg","4.6","263","29.99","71"
"B0CBPCFG2T","GOGOSINIS 2 Packs of Earbuds Set with Case for Kids for School, Wired Headphones with Case and Small Size Ear Tips, Ear Buds with Cute Case, Earphones for Phone and PC Laptop (Abstracts)","https://m.media-amazon.com/images/I/810a+EZzc9L._AC_UL320_.jpg","4.3","14","21.98","71"
"B07V6XG4BC","EKids Descendants Kids Bluetooth Headphones for Kids Wireless Rechargeable Foldable Bluetooth Headphones with Microphone Kid Friendly Sound and Bonus Detachable Cord, DE-B50v9M","https://m.media-amazon.com/images/I/819j62D85ML._AC_UL320_.jpg","4.6","654","28.99","71"
"B08GD22B69","Pioneer DJ HC-CP08-G - CUE1 Series Ear Pad and Cord (Green)","https://m.media-amazon.com/images/I/7197EhReToL._AC_UL320_.jpg","4.9","31","29.99","71"
"B08MTGR4Y6","Linsoul BLON BL01 10mm Biology Fiber Diaphragm Driver HiFi in-Ear Earphone with 0.78mm 2Pin Detachable Cable (with mic, Black)","https://m.media-amazon.com/images/I/51Kp3IO8paL._AC_UL320_.jpg","4.2","1686","24.99","71"
"B08P399K7F","DCMEKA in Ear Monitor Headphones, Superior Sound Wired Earbuds with Tesla Magnet, Professional Sound Isolating Earphones for Singers/Drummers/Musicians, MMCX Connector IEM Earphones (Black UV Coating)","https://m.media-amazon.com/images/I/61POKSYQ21L._AC_UL320_.jpg","4.3","197","25.99","71"
"B09X97LM9H","HyperGear Bluetooth Wireless Headphones with Built-in Mic & Controls, Over Ear Noise Isolating Fit Headphones & Memory Foam Ear Cup + Quick paring for Travel, Home Office, Online & More [Black] 15610","https://m.media-amazon.com/images/I/61TBKeB37FL._AC_UL320_.jpg","4.2","25","24.99","71"
"B0C4KHJP7S","mifo FiiTii HiFiDots Wireless Earbuds Active Noise Cancelling, QC 3071 aptX Lossless Sound Bluetooth Earbuds with APP for Custom EQ, Bluetooth 5.3 Earphones Wireless, IPX7 Waterproof Small Earbuds","https://m.media-amazon.com/images/I/61bj7FG2BQL._AC_UL320_.jpg","4.1","43","139.99","71"
"B09NWB8KSG","XLEADER Sport3 Pro Sports Wireless Earbuds Bluetooth in-Ear Headphones with LED Display Charging Case 48H Playtime IPX7 Waterproof Deep Bass Mic for Running Workout Gym","https://m.media-amazon.com/images/I/7101aN+CFmL._AC_UL320_.jpg","4.0","1916","22.99","71"
"B09VB2MQZG","fit Tek 3.3FT Magnetic Charging Cable for Wireless Bluetooth Bone Conduction Headphones, Mojo1 Replacement USB Charger Cord Accessories","https://m.media-amazon.com/images/I/71kODrGZZ5L._AC_UL320_.jpg","4.9","11","9.99","71"
"B0BBVBWG6M","KNTARU Earplugs Earphones ，EarPlug Headphones for Work，slack off，Noise Suppression，Hearing Protection，Study，sleep，travel，Fitness，construction site，production line，Noisy Places","https://m.media-amazon.com/images/I/61TictljyJL._AC_UL320_.jpg","4.0","129","22.99","71"
"B0CFLK85H3","ZONWOO Wireless Earbuds, Bluetooth 5.3 Headphones with Charging Case, Touch Control in-Ear Stereo Earphones with Mic for Cellphone, IPX5 Waterproof Wireless Ear Buds for Running Workout","https://m.media-amazon.com/images/I/51-Un+jgG1L._AC_UL320_.jpg","5.0","6","96.99","71"
"B09F9R6P3J","YINYOO KZ EDX PRO Earphones Headphones with 1DD, EDX PRO Wired in Ear Earbuds HiFi Deep Bass Sound with 1DD New 10mm Dynamic Driver Over Ear Headset with Detachable Cable (Black, Without mic)","https://m.media-amazon.com/images/I/61e+WscPlDL._AC_UL320_.jpg","4.6","1799","16.99","71"
"B0849PZYKQ","CTM CE320 Triple Driver in-Ear Monitor | Noise Isolating Professional Musician Wired in-Ear Monitor | Detachable Cable (Smoke)","https://m.media-amazon.com/images/I/61OvB+ntBsL._AC_UL320_.jpg","4.4","45","349.0","71"
"B07THJBXQZ","Saidbuds 100 Pack Bulk Earbuds Headphones Classroom Student Testing Ear Buds Kids Bulk Headphones Disposable Earbuds Individually Wrapped for Schools, Libraries, Hospitals","https://m.media-amazon.com/images/I/51rXYpvb7SL._AC_UL320_.jpg","4.8","9","69.99","71"
"B09LS5QRPL","Damipow True Wireless Sleep Earbuds, Noise Blocking Technology Bluetooth Headphones in-Ear, Smallest and Lightest, Ultra Comfortable Designed Specifically to Help You Asleep Faster and Sleep Better","https://m.media-amazon.com/images/I/51IgrR-heeL._AC_UL320_.jpg","3.5","251","43.97","71"
"B075VCVNCR","MobileSpec MBS11182 Premium Stereo Bluetooth Headphones - Black","https://m.media-amazon.com/images/I/61+1jfVwXzL._AC_UL320_.jpg","3.9","21","18.99","71"
"B07D41TX5F","JoJo Siwa Kids Bluetooth Headphones for Wireless Rechargeable Foldable Bluetooth Headphones with Microphone Kid Friendly Sound and Bonus Detachable Cord","https://m.media-amazon.com/images/I/611DrI2iyTL._AC_UL320_.jpg","4.5","364","29.99","71"
