"asin","title","imgUrl","stars","reviews","price","category_id"
"B0C163HBCN","Kids Stomp Toy Rocket Refills：Delighkidz 14 Pack Replacement Foam Rockets Toys for 3-12 Year Old Boys Gifts Rocket Toy Launcher for Kids Boys Toys Age 3-11 Gifts for 4-12 Year Old Boys Outdoor Toys","https://m.media-amazon.com/images/I/717PQG03DTL._AC_UL320_.jpg","4.5","113","19.99","270"
"B087CHV49F","Handheld Game Console for Children Ages 4-12 , Built-in 182 Retro Classic Games 2.5"" LCD Screen Portable 8 Bit TV Output Video Game Player Best Birthday Gift for Girls -RED","https://m.media-amazon.com/images/I/61MP+D8ex-L._AC_UL320_.jpg","3.9","2246","26.99","270"
"B016YZDZ8S","Click N' Play Pretend Food & Grocery Basket Toy Set for Kids & Toddlers 3+, 32pcs Plastic Fruits & Vegetables + Shopping Cart for Easy Storage - Play Store, Fake Food Play Set, Fun Children Toy Gifts","https://m.media-amazon.com/images/I/71dEjeWAs+L._AC_UL320_.jpg","4.5","1490","13.99","270"
"B0B2L71C1B","Play Kitchen Accessories for Kids,Pretend Cooking Toys with Cookware Utensils,Play Pots and Pans Set,Kitchen Toys,Fake Food for Kids Kitchen,Learning Toy Birthday Gift for 3 4 5 Years Old Girls Boys","https://m.media-amazon.com/images/I/71XCWIYCDML._AC_UL320_.jpg","4.6","53","22.99","270"
"B009M6G1YC","CP Toys Space Mission Rocket Ship Toy, Includes Astronaut Toys, Aliens and Vehicle, Space Gifts for Birthdays and Holidays, Space Toys for Kids 3 Years and Older","https://m.media-amazon.com/images/I/61rkkggbFLL._AC_UL320_.jpg","4.6","2010","59.99","270"
"B00RBHRM1U","Smoby: Roleplay BBQ Plancha Grill with 16-piece Accessory Set, Black Playset, 19.69 x 14.57 x 28.43 inches, Turn the Button and See Flames Appear, For Ages 3 and up","https://m.media-amazon.com/images/I/61-Xc+ch20L._AC_UL320_.jpg","4.3","1019","45.42","270"
"B09177VCQ5","LCD Writing Tablet Drawing Board 12 Inch Colorful Girls Toys Christmas Birthday Gift for 3 4 5 6 7 Year Old Girls Erasable Drawing Tablet Doodle Board Toddler Learning Toys for Girls Age 3+ (Pink)","https://m.media-amazon.com/images/I/71GfN3IOI2L._AC_UL320_.jpg","4.4","830","14.99","270"
"B07H1NXYNQ","Hot Wheels Stunt & Go Track Set with 1 Toy Car, Transforming Hauler Truck with Launcher, Stores 18 1:64 Scale Cars (Amazon Exclusive)","https://m.media-amazon.com/images/I/61-zXMfx0YL._AC_UL320_.jpg","4.7","4339","23.99","270"
"B0C4XM8BC7","HOGOKIDS Party Favors for Kids, 30 Kinds of Animals Building Block Toy 20 Pack, Goodie Bags Stocking Stuffers Classroom Prizes Building Set, Christmas Birthday Return Gift for Boys Girls Ages 4-12+","https://m.media-amazon.com/images/I/71wBHI50iQL._AC_UL320_.jpg","4.3","56","19.99","270"
"1736952234","Binibi Spanish Musical Book for Toddlers 1-3 Los Pollitos Dicen & Other Nursery Rhymes - Interactive Bilingual Nursery Rhyme Book for Babies & Toddlers- Sound Book- Spanish Learning Toy for Kids","https://m.media-amazon.com/images/I/71ezPLJkUqL._AC_UL320_.jpg","4.6","104","21.99","270"
"B09Q3TBZ5L","Magic Mixies Mixlings Sparkle Magic Mega 4 Pack, Magic Wand Reveals Magic Power, for Kids Aged 5 and Up, Multicolor","https://m.media-amazon.com/images/I/71SbQcnldxL._AC_UL320_.jpg","4.6","3009","12.29","270"
"B0BCVJ4569","MNTL Magstem 2Pcs Large Magnetic Tiles Base Building Toys Set Clear Colors, Transparent Magnetic Blocks Stem Educational Toys Magnet Playboards for Kids Ages 4-8 3-5, Big Size Children Holding Board","https://m.media-amazon.com/images/I/61JIP9sVe0L._AC_UL320_.jpg","4.8","45","19.99","270"
"B089PZD8LZ","ORIENTAL CHERRY Arts and Crafts for Kids Ages 8-12 - Make Your Own GEM Keychains - 5D Diamond Painting by Numbers Art Kits for Girls Kids Toddler Ages 3-5 4-6 6-8 Easter Basket Stuffers","https://m.media-amazon.com/images/I/81tlvcuSGvL._AC_UL320_.jpg","4.6","5866","10.99","270"
"B0C776SKYP","YONCHER YC350 1:14 Brushless Fast RC Cars for Adults, 4WD Remote Control Truck 50+ KM/H, Hobby High Speed RC Monster Trucks, Off Road Remote Control Car with Oil-Filled Shocks for Boys","https://m.media-amazon.com/images/I/71Uoeyw1DNL._AC_UL320_.jpg","4.7","13","129.99","270"
"B0BYNH79V3","Grrrr-Dino Handwriting Practice Book for Kids, Toddlers Preschool Learning Activity 48 Pages Autism Educational Montessori Toys Learn Number Letters Shapes Animal & Sight Words Workbook","https://m.media-amazon.com/images/I/819pMX8h-2L._AC_UL320_.jpg","4.8","16","19.99","270"
"B087CC4RTW","Be Amazing! Toys Weather Science Lab - Kids Weather Science Kit with 20 All Season Projects - Educational STEM Kits for Boys & Girls - Scientific Meteorology Toys for Children Age 8+","https://m.media-amazon.com/images/I/91RuLxysLgL._AC_UL320_.jpg","4.5","3953","23.01","270"
"B0B6QD936C","Channie's Pre-K Dry Erase Activity Book, Preschool Workbook with Fun Educational Learning Activities for Kids, Ages 3-5, 50+ Games, Colors, Letter-Tracing, Counting, Mazes, and More!","https://m.media-amazon.com/images/I/81rXUT+8i7L._AC_UL320_.jpg","4.8","9","16.95","270"
"B0CCTJF88B","RRJF Towel Warmer, Heated Towel Warmer Bucket with LED Display, Large Towel Warmers for Bedroom, Auto Shut Off, Fits Up to Two Oversized Towels, Bathrobes, Blankets, Pajamas and More, White","https://m.media-amazon.com/images/I/616c6LqLCCL._AC_UL320_.jpg","4.7","36","139.98","270"
"B0BFDM6P3M","Toy Refrigerator Fridge with Ice Dispenser for Kids, Kitchen Appliances Toys, Kids Play Kitchen Accessories Set, Pretend Play Kitchen Playset, Christmas Birthday Gifts for 3+ Year Old Boys Girls","https://m.media-amazon.com/images/I/61Jidzm+MYL._AC_UL320_.jpg","3.7","81","38.99","270"
"B0B9FF2K8W","67i Electric Wiggle Car Ride On Toy 2 in 1 Wiggle Car with Rechargeable Battery and Pedal Anti-Rollover Wheels with Colorful Lights Swing Car with Music for Kids Age 3 Year up (Pink Blue)","https://m.media-amazon.com/images/I/710s3PiKk5L._AC_UL320_.jpg","4.3","17","59.99","270"
"B01M2AIBLZ","Playbees 100 Piece Magnetic Building Tiles Set, Clear Vivid Colors and Shapes, 3D Magnet Building Blocks for Kids, Toddlers, Stem Educational Learning Development Toy, Creativity beyond Imagination","https://m.media-amazon.com/images/I/81wBAkDZyoL._AC_UL320_.jpg","4.8","573","29.99","270"
"B0C9D3YBZK","INNOCHEER Ladybug Costume for Girls, Ladybug Costume Toddler Halloween Birthday Dress Up Pretend Play for Kids 2-10","https://m.media-amazon.com/images/I/71IZ3lBHB9L._AC_UL320_.jpg","4.8","18","29.99","270"
"B09P9Z2P45","MGA Entertainment Glitter Baby Marina Finley Baby Doll with 3 Magical Color Changes, Pink Glitter Hair, Mermaid Squad Outfit, Diaper, Bottle, Pacifier Gift for Kids, Toy for Girls Boys Ages 3 4 5+","https://m.media-amazon.com/images/I/81BsIuQN7VL._AC_UL320_.jpg","4.6","168","14.99","270"
"B000J5WU2M","Marvel Legends Series Star-Lord, Guardians of The Galaxy Vol. 3 6-Inch Collectible Action Figures, Toys for Ages 4 and Up","https://m.media-amazon.com/images/I/61XuIrj3w8L._AC_UL320_.jpg","4.6","213","17.99","270"
"B0794XKR3D","Wooden Tea Set for Little Girls, Wooden Toys Toddler Tea Set Play Kitchen Accessories for Kids Tea Party with Play Food for 1 2 3 Years Old Kids","https://m.media-amazon.com/images/I/61z63XOD8IL._AC_UL320_.jpg","4.6","639","18.99","270"
"B09XWV17J9","LEGO City Barn & Farm Animals 60346 Building Toy Set for Kids, Preschool Boys and Girls Ages 4+ (230 Pieces)","https://m.media-amazon.com/images/I/81OYwspjlAL._AC_UL320_.jpg","4.8","195","44.4","270"
"B0931ZVQ49","ROBUD Wooden Play Kitchen Set for Kids Toddlers, Toy Kitchen Gift for Boys Girls, Age 3+","https://m.media-amazon.com/images/I/61+TVrElkSL._AC_UL320_.jpg","4.6","275","151.85","270"
"B08B8W8RYH","4E's Novelty Beach Balls 3 Pack 20"" Inflatable for Kids - Toys & Toddlers, Pool Games, Toy Classic Rainbow Color","https://m.media-amazon.com/images/I/61XRnTshQTS._AC_UL320_.jpg","4.3","5720","7.91","270"
"B09LYDY699","DUMMA Track Cars Dinosaur Race Car Toys for Kids Age 3-5, LED Light Up Replacement Car Compatible with Most Tracks for 4 5 6 7 Years Old Boys and Girls Christmas Birthday Gifts -2Pcs","https://m.media-amazon.com/images/I/51BmXnmk-wL._AC_UL320_.jpg","4.1","99","12.99","270"
"B0BCFPVRQL","Tea Party Set for Little Girls, 38PCS Princess Toddler Tea Time Toy and Kitchen Pretend Play with Tin Tea Set,Doughnut,Candies,Dessert Tower&Carrying Case,Kids Tea Party Set for Girls Boys Age 3-6","https://m.media-amazon.com/images/I/81ZR+K000HL._AC_UL320_.jpg","4.3","66","21.99","270"
"B08QVB5H5Z","Story Magic Large Sticker Book by Horizon Group USA, Create Your Own Magical Adventures Inside a 14"" x 11"" Sticker Book, Over 350 Repositionable Stickers, Sticker Books for Kids 2-4","https://m.media-amazon.com/images/I/815GtL3Gl5L._AC_UL320_.jpg","4.0","160","6.99","270"
"B0BS4GVV4D","Marvel Avengers Ultimate Protectors Pack, 6-Inch-Scale, 8 Action Figures with Accessories, Super Hero Toys, Toys for Boys and Girls Ages 4 and Up","https://m.media-amazon.com/images/I/71aWB2hKzuL._AC_UL320_.jpg","4.7","10","40.82","270"
"B0B5SQYZRY","Wooden Hammering Pounding Toys Xylophone Shape Sorter for Toddlers 1-3, Music Enlightenment & Stacking Toys Educational Gifts","https://m.media-amazon.com/images/I/61Hj4ki3jvL._AC_UL320_.jpg","4.5","31","8.99","270"
"B09CPTZJ5H","ABC Sound Books Interactive Electronic Learning Books for Toddlers with Alphabet, Numbers, Animals, Music, Games Educational Toys for Kids 3 Years+","https://m.media-amazon.com/images/I/71mzs7xcqJL._AC_UL320_.jpg","3.9","262","19.99","270"
"B09FQ5XP6Y","Marvel Heroes Top Trumps Match Board Game; Play with Characters Including Starlord, Spider-Man and Captain America, Family Game for Ages 4 Plus","https://m.media-amazon.com/images/I/91bDp4+GvqL._AC_UL320_.jpg","4.7","3326","15.99","270"
"B09NQJCNB2","Ryan's World Micro Mystery Chest - Series 2; Contents Include Micro Chest and UFO Vehicle, Small Foam Dagger, Kinetic Sand, Spinner, 4 Figures, and a Sticker","https://m.media-amazon.com/images/I/71uMRUqWkXL._AC_UL320_.jpg","4.5","1128","37.95","270"
"B0BFDMX29C","TOOKYLAND Kitchen Set for Kids, Wooden Chef Play Kitchen for Toddler with Sink,Oven,Range Hood,Stove,ice Maker and Microwave, Kids Kitchen Playset for Toddlers 4-8","https://m.media-amazon.com/images/I/612huU8PJ-L._AC_UL320_.jpg","4.4","64","129.99","270"
"B01BVTKFOO","Aurora® Vibrant Bright Fancies™ Jellyroll Unicorn™ Stuffed Animal - Eye-Catching Fun - Delightful Cuddles - Pink 7 Inches","https://m.media-amazon.com/images/I/819t3qdQV7L._AC_UL320_.jpg","4.7","7894","9.28","270"
"B09H1XL28H","Hasbro Gaming Monopoly Indiana Jones Game,Inspired by The Indiana Jones Movies,Board Game for 2-6 Players,for Kids Ages 8 and Up","https://m.media-amazon.com/images/I/91BrZToRlJL._AC_UL320_.jpg","4.8","51","34.99","270"
"B0BZDJ92Y3","Smartivity Magic of Science Experiment Kit for Boys & Girls Age 4-6-8 | Birthday Gift for Kids Age 4-8 | Kids Safe Physics & Chemistry Kit | STEM Educational Fun Toys","https://m.media-amazon.com/images/I/81GcMX+mGBL._AC_UL320_.jpg","4.4","68","34.99","270"
"B0BPSTH3YX","SevenQ Water Games for Kids, 4 Pack Handheld Water Game Ocean Toys, Water Ring Toss Handheld Games, Travel Games for Kids and Family, Retro Toys Small Toys for Party Favor Stocking Stuffers","https://m.media-amazon.com/images/I/81X0bOdQGJL._AC_UL320_.jpg","3.6","62","11.99","270"
"B0CCTF94DR","EooCoo 2 Pack Writing Tablets for Kids, Etch a Sketch 8.5 inch Drawing Doodle Pad, Toddlers Toys Christmas Birthday Gift, Educational Toys for Children Boys Girls 3 4 5 6 Year Old Kids","https://m.media-amazon.com/images/I/71kh+42RjlL._AC_UL320_.jpg","4.6","95","11.99","270"
"B082ZLM39R","NATIONAL GEOGRAPHIC Earth Science Kit - Over 15 Science Experiments for Kids, Crystal Growing Kit, Volcano Science Kit, Dig Kits & Gemstones, STEM Project Toy for Boys and Girls (Amazon Exclusive)","https://m.media-amazon.com/images/I/91AQBSotB2L._AC_UL320_.jpg","4.7","17382","29.99","270"
"B09XWP2ZXD","LEGO Harry Potter Hogwarts Carriage & Thestrals Set 76400, Building Toy for Kids 7 Plus Years Old with 2 Winged Horse Figures and Luna Lovegood Minifigure","https://m.media-amazon.com/images/I/81eDG9Y893L._AC_UL320_.jpg","4.9","1296","15.99","270"
"B076FKRJ9Q","Jurassic World Mini Dinosaur Action Figure with 1 or 2 Movable Joints Iconic to Its Species, Realistic Sculpting & Decoration, Great Collectible Gift Ages 4 Years Old & Up, Styles May Vary","https://m.media-amazon.com/images/I/71t-nfJv1HL._AC_UL320_.jpg","3.7","1737","5.19","270"
"B07C1BCTRT","CHILHOLYD Learning Toys Math Toy Montessori Preschool Learning Educational Counting Game Numbers and Symbols Math Skills Colorful Fridge Kindergarden Educational Tools Math Blocks Great Gift for Kids","https://m.media-amazon.com/images/I/61QdZ4iKERL._AC_UL320_.jpg","4.0","637","15.99","270"
"B078T1CRZC","ToyVelt Kids Drum Set - Drum Set for Toddlers Ages 3 to 5 Years Old Musical Toys for Boys Girls - Birthday for Kids","https://m.media-amazon.com/images/I/71wF6MDkbAL._AC_UL320_.jpg","3.7","5046","36.99","270"
"B0B323PSCQ","Sesame Street Dino Stomp Elmo 13-Inch Plush Stuffed Animal Sings and Dances, Officially Licensed Kids Toys for Ages 18 Month by Just Play","https://m.media-amazon.com/images/I/71+9QdEW3nL._AC_UL320_.jpg","4.4","202","29.97","270"
"B0BRT7YK9W","DC Comics, Superman Man of Steel Action Figure, DC Adventures, 12-inch, 9 Accessories, Collectible Superhero Kids Toys for Boys and Girls, Ages 4+","https://m.media-amazon.com/images/I/715UEZPdy+L._AC_UL320_.jpg","4.8","27","17.99","270"
"B0B1TVTDQV","Auvewilo Wooden Balls and Cups Color Sorting Montessori Toy, Educational Wood Toy Set with 12 Cups, 12 Large 4cm Balls, Bowl, Spoon, and Tong","https://m.media-amazon.com/images/I/61DRkeJekAL._AC_UL320_.jpg","4.3","67","33.99","270"
"B09YXTPMX3","Kids Makeup Kit for Girl, for Girls Real Play Makeup Set Girls Toys for Little Girls Toddlers Dress up Game Age 4 5 6 7 8","https://m.media-amazon.com/images/I/81IZxhnPTwL._AC_UL320_.jpg","4.6","1627","27.55","270"
"B0B3YBQKRH","Hapinest Science Magic Kit Gifts for Kids Boys and Girls Ages 6 7 8 9 10 11 12 Years Old | Hands On Chemistry Set Experiments","https://m.media-amazon.com/images/I/81eD7BxpzFL._AC_UL320_.jpg","4.4","83","14.99","270"
"B088DMDZTH","Little Jupiter Pet Plush Bag Purse Set with 18pc Removable Patch Set & Pink & Rainbow Details - Unicorn Stuffed Animals for Girls - Cute Plushie - Cute Toy Plushies - Girls Toys - Age 4-5 - 6-7","https://m.media-amazon.com/images/I/914j9M0xsEL._AC_UL320_.jpg","4.6","406","19.99","270"
"B0BSB7BDQ2","PlayTape - Neighborhood Road Tape for Toy Cars - Sticks to Flat Surfaces, No Residue, 2 in. x 30 ft. Roll","https://m.media-amazon.com/images/I/61+rutvGBVL._AC_UL320_.jpg","4.1","6406","9.99","270"
"B07Y95H4FZ","Fisher-Price Imaginext DC Super Friends Batman Figure Multipack, Ultimate Hero Villain Match-Up, 10 Characters & 10 Accessories for Ages 3+ Years (Amazon Exclusive)","https://m.media-amazon.com/images/I/71ssSoTiv0L._AC_UL320_.jpg","4.8","2826","29.99","270"
"B01MS1T0HD","Learning Resources Number Turtles Set - 15 Pieces, Ages 18+ months Fine Motor Toys for Toddlers, Counting Toys for Toddlers, Color & Sorting Toy, Turtle Toys for Kids","https://m.media-amazon.com/images/I/81G9tgaz72L._AC_UL320_.jpg","4.7","1088","21.99","270"
"B0BLJSXYMW","Imaginext Jurassic World Dinosaur Toy Ultra Snap Spinosaurus with Lights Sounds & Chomping Action plus Figure for Ages 3+ Years","https://m.media-amazon.com/images/I/61NvIjww92L._AC_UL320_.jpg","4.9","45","59.0","270"
"B07NPFLFPC","Coolplay 11 in 1 Construction Cars and Trucks Toy for Boys Yellow Truck Carrier Toy Set Little Die-cast Vehicles Mini Excavator Backhoe Mixer Dump Truck Cars for Kids Ages 3-8","https://m.media-amazon.com/images/I/716-eV7YMuL._AC_UL320_.jpg","4.5","620","24.99","270"
"B0BY2MV3YN","DSHMIXIA Garbage Mail Truck Small Toys Cars for 3 5 Year Old Boys Magnetic Couplings City Vehicle for Wood Train Set for Children Inside Outside Toys (City Set)","https://m.media-amazon.com/images/I/61UT86w-pSL._AC_UL320_.jpg","4.7","9","9.9","270"
"B07MBMSXNQ","Echo Mic for Kids, Toddlers - Magic Microphone with Multicolored Flashing Light and Fun Rattle - Pink and Yellow - Speech Therapy Feedback Toy - Retro Gift For Boys, Girls Who Love Singing and Music","https://m.media-amazon.com/images/I/81CF4zx0f1L._AC_UL320_.jpg","3.8","3145","14.99","270"
"B09XT7T6BM","Lehoo Castle Bath Toys, Singing Bath Bubble Maker for Baby, Automatic Bubbles Machine Blower for Bathtub, Shower Bathtub Toys for Toddlers Boys Girls","https://m.media-amazon.com/images/I/61kfGN5ERsL._AC_UL320_.jpg","3.5","1631","16.99","270"
"B00I0CEJC0","Learning Resources New Sprouts Healthy Breakfast, Pretend Play Toys for Toddlers, Play food for Kids, Play Breakfast Food, 11 Pieces, Ages 2+","https://m.media-amazon.com/images/I/61rwOhl0dfL._AC_UL320_.jpg","4.9","873","16.99","270"
"B00TZZQKXW","MEGA Bloks Fisher Price Toddler Building Blocks, Build N Learn Activity Table with 30 Pieces, Toy Car and Storage, Blue, Portable Gift Ideas for Kids","https://m.media-amazon.com/images/I/61oFk+YfusL._AC_UL320_.jpg","4.7","6328","48.99","270"
"B0C7TVTJCY","kolegend RC Cars 13 Inch Colorful Bodylight Remote Control Car for Boys 50+min Play with 2 Rechargeable Batteries, 20 km/h All Terrains Off Road RC Trucks Birthday Gift","https://m.media-amazon.com/images/I/81KkxCuA9cL._AC_UL320_.jpg","4.4","29","49.99","270"
"B09P9YCS17","Thomas & Friends Motorized Toy Train Percy Battery-Powered Engine & Brake Car Bruno Rail Vehicle For Ages 3+ Years","https://m.media-amazon.com/images/I/61xgo+ZPWxL._AC_UL320_.jpg","4.7","341","9.99","270"
"B09131HZ8Z","HotMax Bouncy Horse, Inflatable Bouncing Animals Hopper for Toddlers or Kids, Ride on Rubber Jumping Toys for Boy or Girl Birthday Gift (Horse)","https://m.media-amazon.com/images/I/71vr0D-Ww9L._AC_UL320_.jpg","4.4","393","25.49","270"
"B09GXT2M3H","Alilo Starter Learn to Read, 3 Interactive Books 100 Flashcards 500 Recording Stickers ABC Card for Toddlers, Preschool Educational Toys, Age 2-6","https://m.media-amazon.com/images/I/81X188TWBCL._AC_UL320_.jpg","4.2","50","89.99","270"
"B01MUHHSFN","TOWO Wooden Car Ramp Toy- Zig Zag Car Slide with 4 Wooden Cars & Roof Top Car Park Playsets-Click Clack Track Wooden Car Toys for Toddlers -Racing Car Toys for Kids Boys Girls 2 3 4","https://m.media-amazon.com/images/I/81qI2zOMDyL._AC_UL320_.jpg","4.4","2012","24.99","270"
"B0BPSP9J9R","SevenQ Water Games for Kids, 4 Pack Handheld Water Game Animal Toys, Water Ring Toss Handheld Games, Travel Games for Kids and Family, Retro Toys Small Toys for Party Favor Stocking Stuffers","https://m.media-amazon.com/images/I/814TDFZkhML._AC_UL320_.jpg","3.6","62","11.99","270"
"B08LVNPS8X","Kidzone 12V 2-Speeds Electric Ride On Bumper Car for Kids & Toddlers 1.5-5 Years Old, DIY Sticker Baby Bumping Toy Gifts W/Remote Control, LED Lights, Bluetooth & 360 Degree Spin, ASTM Certified","https://m.media-amazon.com/images/I/61gxbJhmDsL._AC_UL320_.jpg","4.4","2118","159.96","270"
"B01ARGC2VQ","Mattel Games UNO Super Mario Card Game Animated Character Themed Collector Deck 112 Cards with Character Images, Gift for Kids Ages 7 Years Old & Up","https://m.media-amazon.com/images/I/81erdkZTUXL._AC_UL320_.jpg","4.8","32962","5.99","270"
"B0C73TZKFD","Blue Slime 2 Pack Jelly Cube Crunchy Slime Non Sticky Super Soft Sludge Toy DIY Crystal Glue Boba Clear Slime for Birthday Gifts Party Favors","https://m.media-amazon.com/images/I/812-EypNuKL._AC_UL320_.jpg","3.8","53","9.99","270"
"B07C3DP7T4","Pillow Pets Paw Patrol Chase Sleeptime Lite, 11"" Nickelodeon Stuffed Animal Nightlight, 1 Count (Pack of 1), Multicolor","https://m.media-amazon.com/images/I/81c5So5xo6S._AC_UL320_.jpg","4.6","5039","24.99","270"
"B0C2CJJH1F","Wooden Climbing Toy for Kids Set - 4 in 1 Triangle Set with Ramp and Arch Climber, Toddlers Foldable Ladder, Safe and Sturdy for Rocking Arch, Climbing Ramp, Climbing Arch, Slide, and Climb Triangle","https://m.media-amazon.com/images/I/613pzF0zdsL._AC_UL320_.jpg","5.0","9","149.99","270"
"B09P3X26K9","INFANS Kids Ride on ATV, 12V 4 Wheeler Quad Toy Vehicle with Music, Horn, High Low Speeds, LED Lights, Electric Ride On Toy, Battery Powered Wheels Car for Kids Over 3 Years Old (Purple)","https://m.media-amazon.com/images/I/71kW-6bkgAL._AC_UL320_.jpg","4.2","169","149.99","270"
"B0BS9JNBTW","Baby Montessori Sensory Toys - Toddler Learning Activities Travel Pull String Toys - Fine Motor Skills Teething Toys - Gifts for 6 9 12 18 Month Age 1 2 3 One Two Year Old Boys Girls Infant Toys","https://m.media-amazon.com/images/I/61h3LNOz68L._AC_UL320_.jpg","4.7","111","14.99","270"
"B09NMKN8FZ","Disney Junior Minnie Mouse Waggin’ Wagon Lights and Sounds Feature Plush, Officially Licensed Kids Toys for Ages 3 Up by Just Play","https://m.media-amazon.com/images/I/71BmcEITVlL._AC_UL320_.jpg","4.4","210","26.34","270"
"B0B15CKS36","TOBBI Electric Motorcycle for Kids 12V Dirt Bike Ride on Toy Battery Powered Motorbike Off-Road Motocross Kid Motorized Vehicles w/ 2 Speeds, 35W Dual Motors, Training Wheels, Green","https://m.media-amazon.com/images/I/71wZdke27-L._AC_UL320_.jpg","4.1","72","129.99","270"
"B09R5NTW31","Cry Babies BFF Kristal Fashion Doll with 9+ Surprises Including Outfit and Accessories for Fashion Toy, Girls and Boys Ages 4 and Up, 7.8 Inch Doll","https://m.media-amazon.com/images/I/819HQ+amjLL._AC_UL320_.jpg","4.8","830","10.99","270"
"B09WTN8DF3","PMT Holdings Playmaker Toys 4 Pack Toy Tractors, Pull-Back Tractors Comes with 1 Blue, 1 Green, 1 Orange, 1 Red (4 Tractors) 9665D 0","https://m.media-amazon.com/images/I/714DyX0y3yL._AC_UL320_.jpg","4.9","47","19.99","270"
"B0037LJ0YG","Casdon Sat Nav Steering Wheel | Toy Steering Wheel For Children Aged 3+ | Provides Endless Excitement With Spoken Commands And Motoring Sounds 32.1 x 21.9 x 9.2 cm","https://m.media-amazon.com/images/I/71DMY0NOOYL._AC_UL320_.jpg","4.2","2552","19.42","270"
"B0BNPPG4G2","Dinosaur Toys, kizplays 251PCS Dinosaur Race Track Toys, Create A Race Car Track Dino World with Flexible Train Tracks, 6 Dinosaur Figures, 2 Cars & 1 Map, Toys for 3 4 5 6 Year Old Boys Girls Gifts","https://m.media-amazon.com/images/I/81j3OmUicEL._AC_UL320_.jpg","4.4","1361","25.99","270"
"B0C43BS2XY","𝐓𝐫𝐞𝐞𝐡𝐨𝐮𝐬𝐞 𝐁𝐮𝐢𝐥𝐝𝐢𝐧𝐠 𝐒𝐞𝐭, 4 in 1 Street View Tree House Building Blocks Toy, Town Collectibles Set, Gift for Boys Girls Age 6+, Teen & Adult(Compatible with Lego Set)","https://m.media-amazon.com/images/I/61c9pFgwQxL._AC_UL320_.jpg","3.6","12","35.99","270"
"B0C5DCJKQM","Niuniu Daddy 4lbs Weighted Stuffed Animals for Anxiety, 25"" Giant Weighted Dinosaur Plush, Soft Stuffed Dino Weighted Plush Pillows, Cute Plush Toys Large Weighted Throw Pillow Gifts for Kids Adults","https://m.media-amazon.com/images/I/71DWKwIfh1L._AC_UL320_.jpg","4.9","43","23.99","270"
"B0C39W3HB8","HAPYAD Dump Truck Toy Metal Cab, Friction Powered Large Dump Trucks for Boys Age 4-7, Big Construction Truck with Lights and Sounds, Construction Vehicle for Kids, 12.5""","https://m.media-amazon.com/images/I/71te1JgcnXL._AC_UL320_.jpg","4.6","38","36.99","270"
"B08M19G12K","60Pcs Train Set for 3 Year Old Boys, Double-Side Wooden Train Set Tracks for Toddlers, Fits Brio, Thomas, Melissa and Doug, Kids Wood Train Toys for 3 4 5 Year Old Boys and Girls (Yellow)","https://m.media-amazon.com/images/I/71Z2lZh4uLL._AC_UL320_.jpg","4.6","122","25.99","270"
"B07GBTHF1T","SainSmart Jr. Wooden ABC Blocks 40PCS Stacking Blocks Baby Alphabet Letters, Counting, Building Block Set with Mesh Bag for Toddlers","https://m.media-amazon.com/images/I/710JsT3TvKL._AC_UL320_.jpg","4.7","1976","19.99","270"
"B07ZQV752C","NKOK 1: 18 Realtree 8Piece Polaris Sportsman Duck Hunting Playset, Allows Children to Pretend Play and Use Their Imagination, Hunting Playset, for Ages 3 and up","https://m.media-amazon.com/images/I/71W75aA7sOL._AC_UL320_.jpg","4.6","286","17.99","270"
"B09YLZ2Z4G","ExploraToy Peg Puzzle Set of 4 (32 pcs), Wooden Knob Puzzles for Toddlers Ages 1-3, Farm Zoo，Forest Animals, Pets, Sea Ocean Animals, Preschool Educational Cognitive Gifts","https://m.media-amazon.com/images/I/71Jh7EbmNlL._AC_UL320_.jpg","4.5","18","29.98","270"
"B01HJ8SCA0","Lewo Wooden Ramp Racer Toddler Toys Race Track Car Games for Kids Boys Girls Gifts with 4 Small Racers","https://m.media-amazon.com/images/I/71jAcFoCb3L._AC_UL320_.jpg","4.4","459","14.99","270"
"B096LZMM9R","WondeRides Ride on Rainbow Unicorn Horse, Rocking Horse Riding Pony Toy (Medium Size 4, Height 36 Inch) for Ages 4-9 Years Kids Toys, Mechanical Moving Giddy up Walking Horse Plush Animal with Wheels","https://m.media-amazon.com/images/I/611jZ6dbotL._AC_UL320_.jpg","4.6","237","199.0","270"
"B01LXLAFJP","VTech Activity Desk 4-in-1 Kindergarten Expansion Pack Bundle for Age 3-5","https://m.media-amazon.com/images/I/814+wfaKcnL._AC_UL320_.jpg","4.7","994","38.68","270"
"B0BDJ6D82L","STAR WARS The Black Series Luke Skywalker & Grogu, The Book of Boba Fett, 6-Inch Action Figures, 2-Pack with 9 Accessories, Ages 4 and Up","https://m.media-amazon.com/images/I/71YX8D-XL0L._AC_UL320_.jpg","4.2","15","35.99","270"
"B091MLLX6Q","Learning Resources New Sprouts Fix It!, Pink Pretend Play Toy Tool Set for Toddlers, Develops Fine Motor Skills with Imaginative Construction Tools, Gift for Boys and Girls, 6 Pieces, Ages 2+","https://m.media-amazon.com/images/I/81czk-yKKoL._AC_UL320_.jpg","4.8","464","21.44","270"
"B003IBMABA","Disney Princess Accessories girls Disney Princess Shoes, Official Disney Costume Accessories, Age Grade 4+, Fits Up to Size 6 Heeled Sandal, As Shown, One Size Up Size US","https://m.media-amazon.com/images/I/81reW7yjq6L._AC_UL320_.jpg","4.4","729","15.95","270"
"B0BYH4MBS6","ERSIHUA 2-Pack Silicone Teething Toys for Baby, TV Remote Chew Toy Teethers for 3-6 Months, Baby Sensory Toys for 6 to 12 Months, TV Remote Control Toys for Boys and Girls (Black+Pink)","https://m.media-amazon.com/images/I/61quOIaQyLL._AC_UL320_.jpg","4.8","305","8.29","270"
