"asin","title","imgUrl","stars","reviews","price","category_id"
"B0C1S3LW8Y","Fall Decorations for Home, DECSPAS 1 PC Double-sided Pumpkin Fall Decor Halloween Decorations Indoor, Orange Green Pumpkin Ornaments Give Thanks Trick Sign Thanksgiving Decorations for Mantel, Table","https://m.media-amazon.com/images/I/71T8s7nA2tL._AC_UL320_.jpg","4.3","112","6.29","165"
"B08SQZR3NY","Leyoue Wax Melting Heater Electric Burning Wax Burner Electric Wax Essential Oil Warmer Incense Wax Melt Warmer Night Light Aroma Decorative Lamp for Gifts & Decor(Ironwork Crystal)","https://m.media-amazon.com/images/I/71QHgS0Zr4L._AC_UL320_.jpg","4.5","1270","19.99","165"
"B07QGSKYRY","Meiliy 60pcs Bulk Rose Leaves Artificial Greenery Fake Rose Flower Leaves for DIY Wedding Bouquets Centerpieces Party Decorations Rose Vine Wreath Garlands Supplies","https://m.media-amazon.com/images/I/71IqeezUpsL._AC_UL320_.jpg","4.5","4254","9.99","165"
"B089VM7D54","18 Inch Black Halloween Wreath Bat Wreath Door Wreath with Glitter Bats Decorations Halloween Party Decorations Halloween Ornament","https://m.media-amazon.com/images/I/815-qIHxPAL._AC_UL320_.jpg","4.0","132","24.99","165"
"B0C1YG36PS","KOZYFLY Boho Runners for Hallways 2x6 ft Washable Hall Carpet Runner Non Slip Kitchen Rug Jute Natural Cotton Entryway Runner Rugs Throw Bedside Rugs for Indoor Hallway Bedroom Kitchen","https://m.media-amazon.com/images/I/A1MfykUPKQL._AC_UL320_.jpg","4.4","670","30.99","165"
"B0BBQNXYX3","Pibeyer Crystal Crush Diamond Wall Candle Holder Set of 2, Rectangle Silver Mirrored Candle Sconces, Home Wall Decoration for Living Room,Dining Room & Bedroom","https://m.media-amazon.com/images/I/71jVDXOMAJL._AC_UL320_.jpg","4.7","484","36.0","165"
"B0851DFNGF","Window Privacy Film: Frosted Glass Window Film Window Cling Privacy Film Door Window Covering Day and Night Privacy Window Film Heat Blocking Decorative Window Film for Home Office Kitchen Kids","https://m.media-amazon.com/images/I/71KRG2DMH1L._AC_UL320_.jpg","4.4","3834","11.99","165"
"B09TTBQL84","White Ceramic Vases- 2 for Modern Home Decor,Round Matte Boho Vase for Decor,Ceramic Vases Minimalist Nordic Style for Wedding Dinner Table Living Room Office Decorative Vase","https://m.media-amazon.com/images/I/61KVbKSnozL._AC_UL320_.jpg","4.7","804","20.79","165"
"B08SK9N5QT","100% Blackout Shield Linen Blackout Curtains 84 Inch Long 2 Panels Set, Clip Rings/Rod Pocket Blackout Curtains No Light, Black Out Curtains & Drapes for Bedroom, 50 inches Wide Each Panel, Beige","https://m.media-amazon.com/images/I/61s6UoPXmOL._AC_UL320_.jpg","4.6","1344","39.99","165"
"B0B4627KKD","Fintie Photo Album 4x6 Photos - 52 Photos Small Mini Capacity Premium Vegan Leather Cover , Portable Wallet Photo Album for Family Wedding Boys Girls, Raining Hearts","https://m.media-amazon.com/images/I/71dCjEorAuL._AC_UL320_.jpg","4.8","429","12.99","165"
"B07TWWWJSY","Hausware Citronella Candles Outdoor Indoor - 2.5 oz Scented Candles Set 12 Pack Natural Soy Wax citronella Candles for Garden Patio Yard Home Balcony Camping Backyard","https://m.media-amazon.com/images/I/41G8GRqHGES._AC_UL320_.jpg","4.1","924","17.99","165"
"B097XJWWVM","idyllic 20"" Artificial Pumpkins White Sunflower Autumn Wreath with Green and Yellow Leaves Flower Wreath for Front Door Indoor Wall Wedding Home Decoration","https://m.media-amazon.com/images/I/81dd27D88tS._AC_UL320_.jpg","4.2","94","29.99","165"
"B0BN2R2DKP","CUCUMI 15pcs Glass Cylinder Vase Hurricane Candle Holder Clear 3 Different Sizes Tall Clear Vases for Wedding Centerpieces Glass Flower Vase for Home Decor Party 4, 8, 12 Inches in Height","https://m.media-amazon.com/images/I/71j5NKe83jL._AC_UL320_.jpg","4.6","409","58.99","165"
"B0C9XW2FPV","YUSPENYE 2 Pack of Halloween Female Ghost Curtain, Window Door Cover, Halloween Decoration, Party Decors","https://m.media-amazon.com/images/I/714IF-x5nRL._AC_UL320_.jpg","4.6","29","19.99","165"
"B084ZRLZB2","Hallmark Keepsake Power Cord (For Storytellers and newer Magic Keepsake Ornaments ONLY)","https://m.media-amazon.com/images/I/61Pb4Hpq4uL._AC_UL320_.jpg","4.7","869","21.98","165"
"B079N91G8C","Set of 18 Palmer's Premium Milk Chocolate Coins - 2 Bags of Coins - Perfect Party Favor, Table Scatter, Easter Egg Filler, and More!","https://m.media-amazon.com/images/I/81ax56+8QOL._AC_UL320_.jpg","4.1","1679","7.99","165"
"B0771QBJXX","D'light Online Long 10 Hour Burn Time Unscented Votive Candles - for Birthdays, Baby Shower, Home Decoration and Weddings (White, 10 Hour - Set of 12)","https://m.media-amazon.com/images/I/51zlKQ3v8FL._AC_UL320_.jpg","4.4","2331","10.0","165"
"B0BY8ZTHWG","Blissful Diary Toddler Pillow with Muslin Cotton Pillowcase, 13x18 Kids Pillows for Sleeping and Traveling, Crib Pillow, Small Kids, Bed (Botanical Leaf)","https://m.media-amazon.com/images/I/71Z5M9ylFeL._AC_UL320_.jpg","4.8","247","16.99","165"
"B09CY8QX96","CHolic 50Pcs Party Favor Candy Box, World Map Mini Suitcase Favor Box, Vintage Kraft Paper with Tags and Burlap Twine for Travel Themed Party, Bridal Shower, Wedding Decorations","https://m.media-amazon.com/images/I/81BpTR91IaL._AC_UL320_.jpg","4.8","709","9.99","165"
"B01MT7OJOD","rabbitgoo Window Privacy Film, Decorative Window Clings, UV Blocking Window Coverings Static Cling Non Adhesive Door Window Stickers, Stained Glass Rainbow Window Vinyl, 3D Pebble, 17.5 x 78.7 inches","https://m.media-amazon.com/images/I/81swJRQo4rL._AC_UL320_.jpg","4.6","8502","9.99","165"
"B0B5DX9287","Velvet Pumpkins, 18 PCS Fall Table Decorations for Home, Artificial Pumpkins Set for Fall Autumn Harvest, Thanksgiving, Wedding","https://m.media-amazon.com/images/I/81Hq9eOvd4L._AC_UL320_.jpg","4.4","76","25.99","165"
"B0BM8L76X9","CEWOR 2 White Ceramic Pots Succulent Artificial Plants, Mini Succulents Plants Artificial, Fake Plants for Shelves Decor, Bathroom, Bedroom, Office Decor, Desk Decorations for Women Pink","https://m.media-amazon.com/images/I/711h84wAc7L._AC_UL320_.jpg","4.5","209","8.99","165"
"B0B9G29PJ3","Popotop Large Photo Album Self Adhesive 4x6 5x7 8x10 Scrapbook Album DIY 40 Pages Picture Book,Gifts for Mom,Family Baby and Wedding,with Metal Pen and Plastic Board Grey","https://m.media-amazon.com/images/I/91kMkWlnoxL._AC_UL320_.jpg","4.6","1179","19.99","165"
"B014K2NKVY","120 Spiral Birthday Candles 60 Pastel and 60 Spiral Brights","https://m.media-amazon.com/images/I/61SrXUXcqpL._AC_UL320_.jpg","4.6","560","7.39","165"
"B0BRZQNBWJ","Onlysky White Floating Shelves with Grey Towel Rack - Set of 2 Wall Mounted Hanging Bathroom Shelves, Decorative Shelves for Stylish Storage in Bathroom, Kitchen, Living Room & Bedroom","https://m.media-amazon.com/images/I/715Cu6nHQ2L._AC_UL320_.jpg","4.7","145","23.99","165"
"B09DCJB5Z5","Nipichsha Coasters for Drinks, Set of 6 Marble Absorbent Ceramic Coasters with Holder and Cork Base, Cute Stone Drink Coasters for Cup Kitchen Home Decor Housewarming Gift, Round 4"", White Gray Gold","https://m.media-amazon.com/images/I/71hO70hI8EL._AC_UL320_.jpg","4.5","266","13.98","165"
"B098DSTP1V","Halloween Wall Decorations DIY Halloween Party Supplies 3D Plastic Spider Decoration Stickers Halloween Decor Home Wall Window Halloween Decorations Indoor Outdoor Scary Spider for Halloween 60 PCS","https://m.media-amazon.com/images/I/918wiKNLBcL._AC_UL320_.jpg","4.5","1092","6.99","165"
"B088CRW35G","J'FLORU Artificial Fall Wreath 22 Inch Fall Wreaths for Front Door Autumn Wreath with Berries Pumpkins Maple Leaves for Wall Window Farmhouse Thanksgiving Harvest Festival Decor","https://m.media-amazon.com/images/I/71U7L2X5-1L._AC_UL320_.jpg","4.5","1009","39.99","165"
"B074332BWR","DREAM ART Anywhere Portable Blackout Curtain/Adjustable Blackout Shades/Temporary Blackout Blinds with Suction Cups for Nursery,Children Kids Bedroom or Travel Use,Black,1 pc W52xL72Inch(132X183cm)","https://m.media-amazon.com/images/I/41dboNUz1LL._AC_UL320_.jpg","4.3","4301","24.29","165"
"B0789CVJZV","Artscape Regent Window Film 24"" X 36""","https://m.media-amazon.com/images/I/81jmzx4B+kL._AC_UL320_.jpg","4.5","154","24.49","165"
"B098PZY89T","VASAGLE 5-Tier Corner Shelf Stand, Corner Bookshelf, Bathroom Organizer, Plant Stand, Tempered Glass, Steel Frame, Modern Style, for Living Room, Bathroom, Kitchen, Metallic Gold ULGT810A01","https://m.media-amazon.com/images/I/61tv6Z0BC5L._AC_UL320_.jpg","4.4","583","64.59","165"
"B000AMCAUG","La Crosse Technology Atomic Analog Wall Clock, 10"", Silver","https://m.media-amazon.com/images/I/81ukH9uDepL._AC_UL320_.jpg","4.6","4844","22.49","165"
"B01FV1H2VM","Americanflat 8x10 Double Picture Frame in Black - Displays Two 4x6 Frame Openings or Use as 8x10 Picture Frame Without Mat - Engineered Wood, Shatter Resistant Glass, Hanging Hardware, and Easel","https://m.media-amazon.com/images/I/61nNbmd1DkL._AC_UL320_.jpg","4.7","880","10.99","165"
"B07JVQPT85","Silicone Coasters For Drinks - 6 Pack Unique Design Spider Drink Coasters, 4"" Black Coaster Set by COASTERFIELD","https://m.media-amazon.com/images/I/715vMl+gOLL._AC_UL320_.jpg","4.9","2035","14.9","165"
"B0C9TTDSZ2","Hananona 40 Pcs Artificial Cedar Sprigs Faux Cedar Spray Branches Cedar Twig Cypress Stems Pine Picks Plastic Greenery Ceder Pine Stems Christmas DIY Accessories for Holiday (40, Green)","https://m.media-amazon.com/images/I/914QEMbxHhL._AC_UL320_.jpg","4.1","21","12.99","165"
"B0CBTR487X","ROGENA Fall Decor Fall Decorations for Home Fall Gnomes Fall Decor for Home","https://m.media-amazon.com/images/I/71FcYnUoMGL._AC_UL320_.jpg","4.3","132","9.99","165"
"B07PFGG8C9","JALL Digital Alarm Clock, with Wooden Electronic LED Time Display, Dual Alarm, 2.5-inch Cubic Small Mini Wood Made Electric Clocks for Bedroom, Bedside, Desk, Black","https://m.media-amazon.com/images/I/61BMamIXqFL._AC_UL320_.jpg","4.3","11128","14.99","165"
"B0BQ3FYB8R","Annecy 24 x 24 Picture Frame Black（1 Pack）, Square Picture Frame for Wall Decoration, Classic Black Minimalist Style 24x24 Frame Suitable for Decorating Houses, Offices, Hotels","https://m.media-amazon.com/images/I/71krdR-rzEL._AC_UL320_.jpg","4.4","257","29.99","165"
"B08GLL3XK9","VNVETYTO Tree of Life Chakra Stones Healing Crystals Feng Shui Hanging Ornament 7 Chakra Wall Ornament Meditation Hanging Car Ornament Window Ornament for Home Decor Christmas Tree Decor","https://m.media-amazon.com/images/I/51DDQj8LuQL._AC_UL320_.jpg","4.7","10274","11.68","165"
"B0BZQPH4B3","Hallmark Disney Tim Burton's The Nightmare Before Christmas Jack Skellington and Zero Christmas Ornament","https://m.media-amazon.com/images/I/A1X2Kj+4DtL._AC_UL320_.jpg","5.0","7","9.48","165"
"B0B66T1VLL","NIDUYONG Thanksgiving Fall Gnomes Autumn 4pcs Plush Gnomes Elf Decorations, Handmade Thanksgiving Day Gift Tomte Swedish Gnome Nisse Scandinavian Faceless Doll for Farmhouse Table Ornaments Gifts","https://m.media-amazon.com/images/I/81tKrMydYDL._AC_UL320_.jpg","4.8","71","19.95","165"
"B0B2QSPXRJ","Digital Wall Clock Large Display, 16.2 Inch , LED Digital Clock with Remote Control for Living Room Decor, Automatic Brightness Dimmer with Date Week Temperature (Orange)","https://m.media-amazon.com/images/I/61F+x1rrlfL._AC_UL320_.jpg","4.4","1303","37.99","165"
"B0BBSJWMPP","Famigmo Artificial Faux Flowers in Vase for Home Decor,Fake Flowers for Home Kitchen Centerpiece Coffee Table Decorations","https://m.media-amazon.com/images/I/71IQfIJPyiL._AC_UL320_.jpg","4.5","256","30.99","165"
"B094BYT575","Magnetic Tiebacks for Curtains, 2 Pack Sparkling Crystal Flower Curtain Tiebacks Curtain Buckle Clips with High-Elastic Spring Wire for Home Office Decoration (White)","https://m.media-amazon.com/images/I/815qqR3lyES._AC_UL320_.jpg","4.3","1590","12.98","165"
"B0BNXKXFQM","Funnli Sister Gifts from Sister Acrylic Puzzle Plaque - Sister Birthday Gift Ideas 3.35 x 2.76 Inch Desk Decorations - Sister Gifts Birthday Christmas Card for Sister","https://m.media-amazon.com/images/I/61LiQSb5E-L._AC_UL320_.jpg","4.6","92","8.99","165"
"B08LMNTRD5","WUKOKU 2pcs Fake Plants 16"" Faux Plants Artificial Potted Plants Indoor for Home Office Farmhouse Kitchen Bathroom Table Shelf Decor","https://m.media-amazon.com/images/I/81YOlcc6sgL._AC_UL320_.jpg","4.5","1399","16.99","165"
"B09HKD3ZTJ","10 Sheets Drawer Liners for Dresser Lavender Scented Drawer Liners Drawer Paper Liner Non Adhesive Scented Liners for Drawers Fragrant Drawer Liners for Home Shelf Closet (Lavender,Lavender)","https://m.media-amazon.com/images/I/71-IVKm1xoL._AC_UL320_.jpg","4.2","1225","16.99","165"
"B07PFPSNF3","Shelving Solution Wall Sconce Candle Holder Metal Wall Decorations for Living Room, Bathroom, Dining Room, Set of 2","https://m.media-amazon.com/images/I/713LlrnvqnL._AC_UL320_.jpg","4.3","4670","28.99","165"
"B079M8DH2F","CYS EXCEL Glass Bubble Bowl (H-4.5"" W-5.5"", Approx. 1/4 Gal.) | Multiple Size Choices Fish Bowl Vase | Glass Round Bowl Terrarium | Globe Flower Vase Centerpiece","https://m.media-amazon.com/images/I/71yzi-a1LdL._AC_UL320_.jpg","4.3","633","12.79","165"
"B0B69RF1R8","LRANFOW Sports Card Stand Baseball Card Stands 24 PCS 2.3"" Tall Trading Card Stand for Display Cards Medals","https://m.media-amazon.com/images/I/71bTPbO9gfL._AC_UL320_.jpg","4.7","453","11.99","165"
"B0C6JS3LRC","DECORKEY Halloween Decorations Indoor, 14.7"" Decorative Spider&Pumpkin Candle Lantern with 78"" LED String Lights(8 Modes), Hanging Spooky Halloween Lanterns, Outdoor Home Room Door Party Decor-Purple","https://m.media-amazon.com/images/I/71fEi0ukPCL._AC_UL320_.jpg","4.5","72","25.99","165"
"B0876XV5P1","ELSKER&HOME 8.5x11 Picture Frame - Certificate Document Frame 6 Pack with Semi-Tempered Glass - Black Sturdy Wood Composite Award Diploma Frame - Includes Hanging Hardware and Desktop Easel","https://m.media-amazon.com/images/I/81-gW9e+cTL._AC_UL320_.jpg","4.6","1339","22.99","165"
"B0BB9RW36V","UIOSANRT Wrap Around Curtain Rods for Windows 32 to 46 Inch,5/8 Inch Small Diameter Adjustable Heavy Duty Curtain Rod With Brackets,Room darkening,Fits Indoor and Outdoor,Black.","https://m.media-amazon.com/images/I/41BcypyxJRL._AC_UL320_.jpg","4.3","239","11.99","165"
"B0BCZHY95X","Reed Diffuser Set of 3 for Bathroom Air Fresheners, Oil Diffuser Sticks | Fresh Linen, Ocean, Eucalyptus & Mint Scent(1.7 fl oz Each Pack) Fragrance with 12 Sticks Defusers | Shelf Decor","https://m.media-amazon.com/images/I/71eYfxFWZ1L._AC_UL320_.jpg","3.8","186","23.99","165"
"B0C6JJKJHT","Halloween Decorations Indoor, DECSPAS 3-Layered Witch Wooden Block Halloween Decor, Orange Black HAPPY HALLOWEEN Sign Hocus Pocus Decorations for Home, Gothic Decor for Halloween Party Decorations","https://m.media-amazon.com/images/I/716oeVsFjvL._AC_UL320_.jpg","4.3","66","7.99","165"
"B0CCLG2TYM","BFAZKXY Hocus Pocus Halloween Decorations Indoor, 7 Pcs Hocus Pocus Halloween Decor with Tombstones, Haunted House, Farmhouse Rustic Tiered Tray Decor Items for Home Table Kitchen Room Decor","https://m.media-amazon.com/images/I/81GPcDqgdpL._AC_UL320_.jpg","4.5","121","17.99","165"
"B07CVT28KP","Medog 11x14 Picture Frame Black Set of 2 Display Pictures 11x14 without Mat For Display Pictures 11 by 14 Inch Document Certificate Frames (11x14 2 Pack)","https://m.media-amazon.com/images/I/9110qT6kYXL._AC_UL320_.jpg","4.5","2872","11.87","165"
"B07GBCD25W","Pavilion Gift Company May All Your Wishes Come True Happy 60th Birthday-8 oz Soy Wax Candle with Wick in A Pink Ceramic Vessel 8 oz-100 Scent: Serenity, 3.5 Inch Tall","https://m.media-amazon.com/images/I/61gBajLd5RL._AC_UL320_.jpg","4.7","459","12.0","165"
"B0CH312T6Q","DAZONGE Ghost Halloween Decorations Indoor, Set of 2 Ceramic Halloween Ghost Decor, Crackle Glaze White Ghost for Fall Halloween Autumn Home Decor","https://m.media-amazon.com/images/I/61AwSLbhM1L._AC_UL320_.jpg","4.7","23","11.99","165"
"B0C2H2BFPY","2 Pieces Acrylic Floating Shelves, 15inch Clear Acrylic Shelf, Invisible Wall Mount Bookshelf with Mounting Kit, Small Bathroom Shelves for Record, Book, Funko Pop Figure Display","https://m.media-amazon.com/images/I/61lBEMcIFdL._AC_UL320_.jpg","4.5","95","8.99","165"
"B0BXM2KCYC","Birthday Gifts for Women Friendship - Gifts for Women Best Friend - Womens Birthday Gifts for Friend, Happy Birthday Gifts for Women, Gifts for Women Birthday Unique, Bestie Lavender Candle 10Oz","https://m.media-amazon.com/images/I/71TEExpjKvL._AC_UL320_.jpg","4.7","56","19.95","165"
"B083SSDPQJ","Artscape Old English Large | Window Privacy Film Textured Leaded Glass Pattern | Non-Adhesive & UV Protection | Easy to Apply & Removable | 36 x 72 inches | Made in USA","https://m.media-amazon.com/images/I/81pBuKaw+bL._AC_UL320_.jpg","4.7","115","41.99","165"
"B0BM3MRNPL","Funny Dark Humor Bestylez No Soliciting Sign Gothic Decor For Kitchen, Home, House, Office 8 x 12 Inch (940)","https://m.media-amazon.com/images/I/81d3JSsawHL._AC_UL320_.jpg","4.8","172","9.99","165"
"B09DP1V53G","24 Pcs Harvest White Mini Artificial Baby Boo Pumpkins Rustic Decorative Pumpkins Foam Pumpkins for Fall Autumn Halloween Thanksgiving Table Centerpiece Wreath Decor Bowl Fillers DIY Projects","https://m.media-amazon.com/images/I/61xa2HvCkPL._AC_UL320_.jpg","4.6","80","11.99","165"
"B07171FR2L","CO-Z Adjustable Ashtray, Smokeless Odorless Indoor Outdoor Floor Standing Ash Tray with Lid for Home Patio Cigarettes Ash Butt Disposal, Windproof Balcony Ashtray in 20"", 27.5"", 35"" Heights, Black","https://m.media-amazon.com/images/I/41MHuriZiGL._AC_UL320_.jpg","4.5","3191","21.99","165"
"B0B5G1D3HJ","Halloween Decorations Window Clings for Glass Windows - Halloween Window Stickers Decals - Halloween Window Clings for Kids Cute Halloween Window Decor for Halloween Party Supplies Home, 9 Sheets","https://m.media-amazon.com/images/I/81I+JyI2PVL._AC_UL320_.jpg","4.4","150","9.95","165"
"B01GS0AKW8","2 Pack Spring Tension Curtain Rods 18 to 28 inches Adjustable,Heavy Duty Small Short Tension Curtain Rod for Windows,Closet,Bathroom,Kitchen,Doorway,Cupboard Bars(White)","https://m.media-amazon.com/images/I/31aIbVGdKyL._AC_UL320_.jpg","4.3","2576","7.99","165"
"B0886434QD","RR ROUND RICH DESIGN 11x14 inch Picture Frames Made of Solid Wood and HD Glass Display Photos 8x10 with Mat or 11x14 Without Mat 3PK Black","https://m.media-amazon.com/images/I/619RPUsWLML._AC_UL320_.jpg","4.5","3181","18.39","165"
"B09ZQX6HQ8","WILLBOND 50 Pieces Orange Marigold Flower Heads and 12 Monarch Butterfly for Dia De Los Muertos Decorations Diwali Indian Home Decor DIY Wreath Garland Craft Halloween Christmas New Year","https://m.media-amazon.com/images/I/81ej6wipZ2L._AC_UL320_.jpg","4.6","50","10.99","165"
"B0C27W51D3","HADOR Double Side Draft Stopper Noise Blocker 36 in for Bottom of Door, Twin Door Stopper Seal Gap Machine-Washable Air Blocker Grey","https://m.media-amazon.com/images/I/61lpAXL3jML._AC_UL320_.jpg","4.3","87","19.99","165"
"B00K939MYI","Hem 12 Assorted Boxes of Incense Cones, (120 total)| Natural Fragrance For Aromatic Rooms | Odor remover Incense For Stress Relief & Relaxation","https://m.media-amazon.com/images/I/6154wCVSCWL._AC_UL320_.jpg","4.4","3545","7.99","165"
"B07XC5NHMM","HANSGO 50 PCS Fall Decorations Artificial Pumpkins and Gourds Set, 8 PCS Fake Pumpkins with 42PCS Pinecones Acorns and Maple Leaves for Harvest Pumpkin Tables Centerpiece Fall Wedding Decor","https://m.media-amazon.com/images/I/71uerjasQiL._AC_UL320_.jpg","4.1","844","9.95","165"
"B0BVGJL2MR","Poo-Pourri Before-You-Go Toilet Spray, Blush Florals, 2 Fl Oz - Blush Florals, Italian Mandarin and Patchouli","https://m.media-amazon.com/images/I/71ZytyNxPSL._AC_UL320_.jpg","4.4","66","8.59","165"
"B08PYK3T2K","Hiasan White Sheer Curtains 84 Inches Long with Tiebacks, Light Filtering Semi Transparent Lightweight Voile Grommet Window Curtains for Bedroom, Living Room, W52 x L84, Set of 2 Drape Panels","https://m.media-amazon.com/images/I/71X3fEktbaL._AC_UL320_.jpg","4.5","2224","17.99","165"
"B0B7WVJRYM","Digital Alarm Clock with Indoor Temperature Large Display, Voice Control Dual Alarm, Update Electronic Desktop Clock with 12/24h Display, Led Clocks for Bedrooms, Bedside, Office & Home (black)","https://m.media-amazon.com/images/I/51qP5bgXkpL._AC_UL320_.jpg","3.5","354","8.99","165"
"B08ZDQNBDR","Naturally KIDS Purple Unicorn Backpack for Toddler Girls, Toddler Backpacks Girls 2-4, Preschool Backpack Girls, Unicorn Toys Girls Age 3 Year Old Girl Birthday Gift Ideas, Toys 3 Year Old Girls Boys","https://m.media-amazon.com/images/I/81fIsqfcPnL._AC_UL320_.jpg","4.8","2387","29.98","165"
"B08V3N319L","SciencePurchase Pirate's Treasure Chest Wooden Nautical Jewelry Box with Functional Lock and 2 Keys, Wood with Iron Accents, Hinged Lid, 8 Inches Long","https://m.media-amazon.com/images/I/A1e1EF4bUqL._AC_UL320_.jpg","4.4","107","26.99","165"
"B07DMZFYQY","calary Candle Wick Trimmer, Candle Snuffer and Wick Dipper & Candle Accessory Set, 3 in 1 Candle Care Kit for Candle Lover (Gold)","https://m.media-amazon.com/images/I/71VnMTSZsAL._AC_UL320_.jpg","4.7","6192","13.85","165"
"B079P4LFRJ","Americanflat 10 Pack Black Picture Frames Collage Wall Decor - Gallery Wall Frame Set with Two 8x10, Four 5x7, and Four 4x6 Frames, Shatter Resistant Glass, Hanging Hardware, and Easel Included","https://m.media-amazon.com/images/I/71APw41FByL._AC_UL320_.jpg","4.7","9197","31.99","165"
"B0719G58VC","DuoMuo Coaster Vinyl Record Disk Coasters for Drinks - Tabletop Protection Prevents Furniture Damage (6 PCS Vinyl)","https://m.media-amazon.com/images/I/71-hDRLrbJL._AC_UL320_.jpg","4.7","5218","5.99","165"
"B08F9WGZJH","Cocod'or COCODOR Reed Diffuser Oil Refill/White Jasmine/6.7oz(200ml)/1 Pack/Aroma Therapy, Home Fragrance, Scented Oils, Oils for Reed Diffuser, Office Décor, Decoration","https://m.media-amazon.com/images/I/41EL2nkLV2L._AC_UL320_.jpg","4.1","6404","9.99","165"
"B07KRZVCYK","Alarm Clock for Bedroom, 7.5"" Large Display LED Digital Clock with 7 Color Night Light,USB Phone Charger,Dimmer,Battery Backup,Easy to Set Loud Bedside Clock for Heavy Sleepers Adult Teen Kid Boy Girl","https://m.media-amazon.com/images/I/71wq8HKyhsL._AC_UL320_.jpg","4.3","6623","19.99","165"
"B076Q1364J","Yankee Candle Spiced Pumpkin ScentPlug Refill 2-Pack","https://m.media-amazon.com/images/I/71sg6prXN-L._AC_UL320_.jpg","4.4","234","18.59","165"
"B09H2GFZN7","Bedside Caddy Storage Organizer, Hanging Storage Bag Pocket for Bunk/Hospital Beds,College Dorm Organizer for Remotes Phone,College Dorm,Camp,Baby Bed Rails(4 Pockets),Black","https://m.media-amazon.com/images/I/81UnlyGLnIL._AC_UL320_.jpg","4.5","790","8.99","165"
"B096H29G4Z","Americanflat 4x4 Picture Frame in Black with Shatter Resistant Glass - Thin Border Frame in Horizontal and Vertical Formats for Wall and Tabletop (2 Pack)","https://m.media-amazon.com/images/I/71VDIrh69PL._AC_UL320_.jpg","4.6","506","6.99","165"
"B08B4L7KZB","Frame Amo Black 12x24 Picture or Poster Frame, 1 inch Wide Border, Smooth Finish, Acrylic Front","https://m.media-amazon.com/images/I/712z4aSuTcS._AC_UL320_.jpg","4.4","1670","35.95","165"
"B0B9JVD63W","DEERWIN Wood Knot Chain Link Decor - 3 Link Boho Wooden Hand Carved Decorative Wooden Links Knots for Coffee Table Entryway Modern Farmhouse Shelf Decoration","https://m.media-amazon.com/images/I/515b5zRsqvL._AC_UL320_.jpg","4.9","29","13.98","165"
"B00DQ0QOYM","Sta-Put Candle Grips (8 Pack)","https://m.media-amazon.com/images/I/51ORIr+e7aL._AC_UL320_.jpg","4.2","767","8.79","165"
"B0833WNHSS","LIFVER Coasters for Coffee Table, Coasters for Drinks Absorbent, Drink Coasters, Housewarming Gift, Home Decor, Set of 6, Farmhouse Coaster Set with Holder, 4 Inches, Sandstone Style","https://m.media-amazon.com/images/I/61b97aanhdL._AC_UL320_.jpg","4.7","5605","14.99","165"
"B097QZMS66","Romadedi Rustic Wooden Tray Candle Holder - Small Wood Decorative Plate Pillar Candle Tray for Farmhouse Kitchen Countertop Bathroom Coffee Table Organizer Home Decor Wedding Centerpiece, 11inch","https://m.media-amazon.com/images/I/81lJMcUXMrL._AC_UL320_.jpg","4.5","1005","12.95","165"
"B07NV4GWR9","Wax Warmer Bulbs,20 Watt Bulbs for Middle Size Scentsy Warmers,G30 Globe E12 Incandescent Candelabra Base Clear Light Bulbs for Candle Wax Warmer,Long Last Lifespan 6 Pack","https://m.media-amazon.com/images/I/61bVwDk5JEL._AC_UL320_.jpg","4.5","2279","8.59","165"
"B0BQJNF3DR","Viking Factory Large Bamboo Box Tray Set with Combination Lock Decorative Box for Home Smell Proof Storage Box -Premium Removable Tray, Roll Kit and All Accessories…","https://m.media-amazon.com/images/I/61-+iiQcG0L._AC_UL320_.jpg","4.5","200","44.99","165"
"B0C27CNMQK","RGB Nightlight LED Digital Alarm Clock with Super Loud Dual alarms, Weekday mode, Easy Snooze, Dimmer, USB Charging Port for Livingroom, Bedroom, Bedside, Heavy Sleeper, Adults, Kids,Teens(Black)","https://m.media-amazon.com/images/I/7136abd+xCL._AC_UL320_.jpg","4.8","106","19.99","165"
"B01BUL7SI4","Stonebriar Large 11.8"" Decorative Rustic Farmhouse Worn Natural Wood and Metal Tray","https://m.media-amazon.com/images/I/61QTkibiVfL._AC_UL320_.jpg","4.5","4294","14.24","165"
"B09QM5XX82","Uieke 3 Pack Artificial Sunflower Garland, 7.5ft/Strand Silk Sunflowers Hanging Vines Flowers with Green Leaves for Room Kitchen Garden Birthday Wedding Baby Shower Party Table Decor Large","https://m.media-amazon.com/images/I/81qgOQNv7KL._AC_UL320_.jpg","4.3","182","12.99","165"
"B08L39FQK4","BAIJIALI 5x7 Picture Frame Distressed Farmhouse Wood Pattern Set of 4 with Tempered Glass,Display 4x6 Photos with Mat or 5x7 Without Mat, Horizontal and Vertical Formats for Wall and Table Mounting,Multicolour","https://m.media-amazon.com/images/I/8174FQLkdWL._AC_UL320_.jpg","4.7","1992","19.99","165"
"B0C9DF9C2N","Popotop Scrapbook Photo Album,8x8in DIY Hardcover Kraft Photo Album with Display Picture Window,Personalized Blank Memory Book for Family, Wedding,Guest Book,Anniversary,80Pages/40Sheet","https://m.media-amazon.com/images/I/71lNQI6v3BL._AC_UL320_.jpg","4.7","23","13.99","165"
