"asin","title","imgUrl","stars","reviews","price","category_id"
"B07PX994XR","SELEWARE Set of 2 Permanent Antirust 304 Stainless Steel Screw Bracket Heavy Duty 180° Swing Hangers, 1800LB Capacity Playground Yoga Hammock Rope Tire Web Chair Sandbag Punching Bag Porch Swing Sets","https://m.media-amazon.com/images/I/61Bbf8HoCCL._AC_UL320_.jpg","4.7","668","15.99","228"
"B0BKSZQBY5","SCIONE Beach Balls Bulk 24 Pack - 9"" Inflatable Swimming Pool Toys for Kids Summer Water Games, Hawaiian Tropical Theme Decorations Favors Supplies","https://m.media-amazon.com/images/I/61SGonr2-YL._AC_UL320_.jpg","4.5","108","14.99","228"
"B07ZV3Z75K","Flybar Maverick 2.0 Foam Pogo Stick for Kids Ages 5 and Up, 40 to 80 Pounds, Outdoor Kids Toys, Pogo Stick for Boys and Girls, Rubber Grip","https://m.media-amazon.com/images/I/71mz9yxJLAL._AC_UL320_.jpg","4.5","301","42.0","228"
"B0BQCCLRS7","Gel Ball Blaster Ammo - Water Beads for Kids Non Toxic (7-8mm, 90,000 Pieces, 3 Packs) – Splatter Ball Gun Ammo Aqua Beads, Colorful Water Gel Beads for Decoration - RoseZain","https://m.media-amazon.com/images/I/61QfllHqSoL._AC_UL320_.jpg","4.1","30","9.99","228"
"B0BVHWX3XN","Bugrtey Double-barreled Toy Gun - Two Modes Realistic Soft Bullet Toy Guns Blaster with Sight - Educational Shooting Toy Revolver Gun - Gifts for Boys Christmas Birthday Halloween Present","https://m.media-amazon.com/images/I/71E2tIYZsLL._AC_UL320_.jpg","4.8","34","27.99","228"
"B0009V89N0","H2OGO! Jumbo Whale Rider Inflatable Pool Float","https://m.media-amazon.com/images/I/71jRHs-FZYL._AC_UL320_.jpg","4.3","1021","20.02","228"
"B0BRXPG3N9","Bazooka Bubble Gun - Upgraded 132 Holes Bubble Machine Gun, Rocket Bubble Machine with Light & Bubble Solutions, Summer Toys Bubble Blaster Maker for Kids, Wedding, Birthday Gift, Party Favors - Pink","https://m.media-amazon.com/images/I/71ewQxbXe0L._AC_UL320_.jpg","4.4","148","19.95","228"
"B08ZN1C71P","Amberr Zen Garden for Desk- Mini Zen Garden with Rock Agate Stones Bridge Pagoda,Sandbox Sand Tray - Meditation Gift Kit-Office Desktop Japanese Decor with Rake Tools and Zen Garden Accessories","https://m.media-amazon.com/images/I/71-5G3SGcgL._AC_UL320_.jpg","4.6","88","16.97","228"
"B09VLG3QJT","Urspasol 20 PCS Baseball Squishy Balls 1.6 inch Mini Foam Baseballs Stress Ball Small Sports Squeeze Ball for Kids Stress Relief Party Favors, Party Goodie Toy for School Carnival Reward Bag Present","https://m.media-amazon.com/images/I/61M7D1L-neL._AC_UL320_.jpg","4.5","82","12.48","228"
"B071CDQL8Y","Gorilla Playsets 09-1014-US American Flag Swing Set Accessory with Mounting Hardware, Red, White, and Blue","https://m.media-amazon.com/images/I/81YJQtDj9xL._AC_UL320_.jpg","4.6","1476","17.0","228"
"B0BW3S7VDL","Skidwedy Potato Sack Race Bags for Kids 3-7, Outdoor Games for Kids and Family, Ring Toss, Egg and Spoon Race Carnival Games for Kids Party, Family Reunion, Outside Yard Lawn","https://m.media-amazon.com/images/I/71E38DIldEL._AC_UL320_.jpg","4.4","42","18.99","228"
"B07D8VJGY3","Ninja Toys Meet Samurai Swords in Glow Battle | Ninja Toys for Boys | Ages 8-12+, 2-4 Players | Kids Sword Game | Glow in The Dark Games | Glow Swords for Kids 8-12+ | A Thrilling Ninja Sword Game!","https://m.media-amazon.com/images/I/9144CedMYDL._AC_UL320_.jpg","3.7","1204","39.9","228"
"B09NT2VV6P","2 PCs Arm Swimming Floaties for Kids - Inflatable Swim Arm Bands Rings Water Wings for Adult Kid - Pink","https://m.media-amazon.com/images/I/51y-99ZNe6L._AC_UL320_.jpg","4.0","188","6.98","228"
"B0BS9BJ5FN","12 Pcs Reusable Water Balloons for Kids Adults, Quick Fill Magnetic Silicone Water Bomb, Outdoor Activities Water Games Toy Outside Summer Pool Party Supplies (12 Pcs)","https://m.media-amazon.com/images/I/819fUAr63XL._AC_UL320_.jpg","4.6","147","19.99","228"
"B09G5Y5RHW","Dinosaur Discovery Kids Play Tent an Extraordinary Adventure Dinosaur Tent, Pop Up Tent for Kids, Dinosaur Toys for Kids Gift for Girls & Boys, Outdoor and Indoor Tents for Kids","https://m.media-amazon.com/images/I/81nhcMHoSCL._AC_UL320_.jpg","4.6","414","27.99","228"
"B07QV671JY","MoKo Swim Arm Bands for Kids, Toddlers Begin to Swim Inflatable Pool Floats Sleeves, Cute Cartoon Swimming Wings Armlets Rings Floaties Tubes, Water Sports Learning Swim Training Aids","https://m.media-amazon.com/images/I/61JyAiBA7CL._AC_UL320_.jpg","4.0","1623","7.99","228"
"B08L5J1NJP","Color Your Own Tent for Kids - Indoor Playhouse Pop Up Tent for Boys and Girl Comes with Six Washable Ink Color Pens","https://m.media-amazon.com/images/I/81ObpkqVYlL._AC_UL320_.jpg","4.5","170","20.89","228"
"B08K2FWP3W","Wlretmci 28 inch Solid Wooden Baseball Bat, Role Playing Props for Women Girls Kids Cosplay, Halloween, Christmas, Birthday Gift","https://m.media-amazon.com/images/I/51WesiVSKaL._AC_UL320_.jpg","4.4","235","35.99","228"
"B073PV3LYY","Playz 5pc Children's Playhouse Popup Tents, Tunnels, and Basketball Hoop for Girls, Boys, Babies, Kids and Toddlers with Zipper Storage Case for Indoor & Outdoor Use (Yellow, Pink, Purple)","https://m.media-amazon.com/images/I/71j1KaPACZL._AC_UL320_.jpg","4.6","4121","49.95","228"
"B081TYZKGX","M & M Sales Enterprises Daniel Tiger's Trolley Pop-up Tent.. Large","https://m.media-amazon.com/images/I/81awt9-rsHL._AC_UL320_.jpg","4.8","605","33.72","228"
"B08V51SGPG","JOYIN 18 Pack 16.5'' Super Water Soaker Blaster Squirt Guns, Bulk Summer Outdoor Swimming Pool, Backyard, Beach Water Game Fighting Play Toys","https://m.media-amazon.com/images/I/81gALjEBpfL._AC_UL320_.jpg","4.5","587","35.99","228"
"B09Y2THVH8","Dinosquad Gun Dinosaur Blasters Toy Gun for Toddlers Age 3-5, Dino Soft Bullet Toy Gun Outside Toy Shooting Dart Gun for Boys Girls 5-7 year old, 50 Soft Foam Darts & 5-Dart in Rotating Barrel","https://m.media-amazon.com/images/I/71DSWVQ0PoL._AC_UL320_.jpg","4.7","92","24.99","228"
"B09YVCR373","Swimbobo Toddler Pool Float Inflatable Car Baby Swim Float with Adjustable Sun Canopy and Safety Seat Pool Toys for Kids 1-4 Years Old","https://m.media-amazon.com/images/I/71R9D9rwziL._AC_UL320_.jpg","4.5","273","28.76","228"
"B07MMMWJLT","LimitlessFunN Teepee Kids Play Tent Bonus Star Lights & Carrying Case for Girls & Boys, Indoor & Outdoor Use (Blue)","https://m.media-amazon.com/images/I/618WKZublOL._AC_UL320_.jpg","4.3","1793","26.97","228"
"B072KFPCQ1","Prextex 4 Pack Water Shooters for Kids - Summer Toy - Swimming Pool Toys - Water Squirter - Water Shooter Toys - Water Blaster - Squirt Guns - Water Gun - Summer Party Favor","https://m.media-amazon.com/images/I/81PJLDCFnkL._AC_UL320_.jpg","3.8","853","13.49","228"
"B09TXMYFJX","Toy Gun Soft Bullet Educational Model Shooting Games for 6+ Boys Toy Gun Soft Bullet Educational Mode","https://m.media-amazon.com/images/I/71B1em1q00L._AC_UL320_.jpg","4.4","351","39.99","228"
"B08FDH9KLB","RETRO JUMP Bouncy House for Kids Outdoor, Kids Bounce House, Inflatable Bounce House with Blower, Bouncing Ball Pit & Basketball Rim, Ocean Balls, Stakes, Repair Kits, Storage Bag Included","https://m.media-amazon.com/images/I/71GOnEeQhbL._AC_UL320_.jpg","4.5","308","279.99","228"
"B09KC9R7TJ","Toy Foam Blasters Guns for Kids,Soft Bullets Shooting Game for Nerf Guns with 6 Hole Automatic Rotating Barrel,Indoor Outdoor Toys Birthday Gifts for 3 4 5 6 7 8+ Years Old Boys Girls, Teens, Adults","https://m.media-amazon.com/images/I/81SWnWeDkeL._AC_UL320_.jpg","4.5","475","13.99","228"
"B000MVE52Q","Schylling Brand Classic Paddle Ball Game - Retro Wooden Ping Pong Fidget Toy - Ages 4 and Up","https://m.media-amazon.com/images/I/51+r95YwW1L._AC_UL320_.jpg","3.7","673","8.82","228"
"B083QZGMB3","NERF Elite 2.0 Phoenix CS-6 Motorized Blaster, 12 Official Darts, 6-Dart Clip, Scope, Tactical Rails, Barrel and Stock Attachment Points","https://m.media-amazon.com/images/I/61jaJgIrHTL._AC_UL320_.jpg","4.5","4432","29.02","228"
"B0B49GDFK8","Paw Patrol Mini Trampoline, Indoor Kids Trampoline for Toddlers with Handle, Features Everest, Chase, Marshall, Skye and Rubble, Multi","https://m.media-amazon.com/images/I/81JwwCciyPL._AC_UL320_.jpg","4.4","62","89.99","228"
"B087YSTFMD","BULZiBUCKET Beach, Tailgate, Camping, Yard Game Indoor/Outdoor by Water Sports, Perfect for Family Game Night, Outdoor Games, Red/White/Blue","https://m.media-amazon.com/images/I/51TQyIlP4SS._AC_UL320_.jpg","4.7","1270","64.16","228"
"B0BWRJS9VH","Leitee 12 Pack Inflatable Volleyball 16 Inch Inflatable Beach Volleyball for Summer Beach Hawaiian Tropical Theme Pool Party Sport for Adults Teens Gift Outdoor Party Decorations Favors Supplies","https://m.media-amazon.com/images/I/71Khz6AyV2L._AC_UL320_.jpg","4.1","8","18.99","228"
"B093PBKZLB","2 Inflatables Barrels, Combat Battlefield Compatible with Nerf, Laser tag, Water Gun, Dart Gun, Perfect for Boys and Girls Birthday Activities, Suitable fot Kids and Adults","https://m.media-amazon.com/images/I/712QyyASF1L._AC_UL320_.jpg","4.4","98","23.99","228"
"B07P53WV6P","4 Pack Inflatable Salad, Food, Drink Buffet Cooler Tray Inflatable Serving Bar/Bufft Cooler Perfect for BBQ, Picnic, Pool Party","https://m.media-amazon.com/images/I/51RNNzukOiL._AC_UL320_.jpg","4.2","634","12.99","228"
"B09WMN9XRX","FUNLIO 2 in 1 Swing Set for Toddler & Baby Jumper, Heavy Duty Kids Swing & Bouncer with 4 Sandbags, Foldable Metal Stand for Indoor/Outdoor Play, Easy to Assemble and Store","https://m.media-amazon.com/images/I/71gxnqtlrIL._AC_UL320_.jpg","4.5","278","129.99","228"
"B09CWFR9BW","NERF Super Soaker RoboBlaster Gun – Automatic Soaker Blasting Machine Drenches You in Water","https://m.media-amazon.com/images/I/813AW2htHEL._AC_UL320_.jpg","4.1","1129","25.49","228"
"B09XCBJNK6","Jecery 32000 Pcs Water Luminous Beads Refill Ammo, Glow in The Dark Gel Balls, Fluorescence Green Splatter Water Based Gel Balls for Toy Teens Adults, 7-8 mm","https://m.media-amazon.com/images/I/71CwT0ZnMoL._AC_UL320_.jpg","4.2","208","12.5","228"
"B000ANIVRG","GONGE River Stones - The Original Non-Slip Stepping Stones for Kids - Balance, Coordination, Motor Skills - Vibrant Colors - Set of 6","https://m.media-amazon.com/images/I/71LKMb1GCHL._AC_UL320_.jpg","4.7","1881","68.38","228"
"B09MLFZVTJ","STARBOLO Ball Pit Balls - 100pcs - Crush Proof Plastic Children's Toy Balls Macaron Ocean Balls for Birthday Parties Games Pool.","https://m.media-amazon.com/images/I/61VK7+srQEL._AC_UL320_.jpg","4.3","695","23.89","228"
"B07HRZW8BV","Liberty Imports 12 Pack Pocket Foam Missile Footballs - Two-Tone Sports Aero Flyers - 1 Dozen Kids Party Favors (9.5 Inches)","https://m.media-amazon.com/images/I/61bYLmhzDvL._AC_UL320_.jpg","4.3","87","33.95","228"
"B08QHTXP6R","HomeMall Bean Bag Toss Outdoor Games - Portable Cornhole Outdoor Board Toy for Kids, 5 Holes Scoring Cornhole Set with 6 Bean Bags and 3 Balls, Families Kids Outdoor Activities Games Gifts Age 3 4 5 6","https://m.media-amazon.com/images/I/71DKdescsgL._AC_UL320_.jpg","4.1","198","22.99","228"
"B006JS2E1A","INTEX Inflatable Floating Fashion Mat: Durable Vinyl – 2 Air Chambers – 220lb Weight Capacity – Style May Vary – One Mat","https://m.media-amazon.com/images/I/81QsWrSTnaL._AC_UL320_.jpg","3.8","1109","7.85","228"
"B09Q3DJG8G","Blomiky 2 Pack SM-4P Blaster Toy Charger Cable Compatible with Electric Gel Water Ball Blaster Toys/Blaster Cable 2","https://m.media-amazon.com/images/I/51ZP09djzNL._AC_UL320_.jpg","4.4","92","7.99","228"
"B0C1SHV2P5","bebikim Soft Ball Pit Balls 170 Plastic Play Pit Balls for Toddlers Ball Pit & Tent,BPA Free Rainbow Pool Balls for Water Toys,2.2"" Playpen Balls for Birthday Party","https://m.media-amazon.com/images/I/61y+8RZIjzL._AC_UL320_.jpg","4.4","148","19.99","228"
"B07XMFJ9LZ","Franklin Sports Over The Door Mini Hoop Basketball Replacements","https://m.media-amazon.com/images/I/81eBvNNTHnL._AC_UL320_.jpg","4.5","880","19.99","228"
"B08YDF67BS","hooroor Slackline Pulley with 52FT Zip Lines, Monkey Bar, Ninja Warrior Obstacle Course for Kids&Adults Backyard Outdoor Toys, Playset, Jungle Gym","https://m.media-amazon.com/images/I/71xkeWAAOTL._AC_UL320_.jpg","4.5","452","99.99","228"
"B01N9R41DG","Matty's Toy Stop 31"" Heavy Duty Wooden Kids Sand Shovels with Plastic Spade & Handle (Red, Blue & Green) Complete Gift Set Bundle - 3 Pack","https://m.media-amazon.com/images/I/71ZvQJTdE7L._AC_UL320_.jpg","4.5","810","29.95","228"
"B08LGC5HPL","GOOX Outdoor Beach Ball Games with Carrying Bag, 3 Balls, Net and Strip Light (ONLY for Light Up Set)- Played Outdoors, Indoors, Beach, Lawn, Yard, Tailgate and Park","https://m.media-amazon.com/images/I/61WR6GAS3HL._AC_UL320_.jpg","4.1","353","39.99","228"
"B0B1VW5Q92","NERF Mega CycloneShock Toy Blaster, Cybershock Color Style, 6-Dart Drum, 6 AccuStrike Mega Darts, Easy Priming (Amazon Exclusive)","https://m.media-amazon.com/images/I/71zYRcYoGLL._AC_UL320_.jpg","4.8","45","21.68","228"
"B003B9AJ5S","Smiffys Baywatch Lifeguard Inflatable Float Prop Red (1)","https://m.media-amazon.com/images/I/51G5JOtuz7L._AC_UL320_.jpg","4.3","1533","9.74","228"
"B07RK6JGKN","POKONBOY 300 Rounds Refill Pack Balls Ammo Compatible with Nerf Rival Gun, Foam Bullet Ball Replacement Refill Pack for Blasters Guns","https://m.media-amazon.com/images/I/718C5dipvfL._AC_UL320_.jpg","4.7","1776","23.92","228"
"B09SV1NMZC","Piecis Gel Ball Beads Toy Gun, Uzi Electric Gel Ball Explosive Toy Gun Gel Gun，Choice for Outdoor Team Games Christmas Birthday Halloween Ideal Gifts for Boys and Girls 12+(red)…","https://m.media-amazon.com/images/I/7194w3CIaHL._AC_UL320_.jpg","4.2","407","19.99","228"
"B08G16YKN4","Lohoee Arrow Spinners Board Game Spinner Arrow Toys for Classroom School Party Home Party Supplies (100Pcs,10Cm/4 Inch,Black)","https://m.media-amazon.com/images/I/71d0SkvXb2L._AC_UL320_.jpg","4.4","45","13.7","228"
"B00IPOR96G","SOLSTICE Super Chill Inflatable River Raft Float Tube Series 1-6 Person With Cupholders Cooler Mesh Bottom Backrest Grab Handles Tie On Rope For River Lake Ocean Pool Floating Snow Heavy Duty Material","https://m.media-amazon.com/images/I/71fclqhyaQL._AC_UL320_.jpg","4.1","595","30.17","228"
"B0B9QVKRS1","Create A Castle Sandcastle Kit as Seen on Shark Tank, 6 Piece Outdoor Beach, Snow or Sandbox Toy Set for Kids and Adults, Sand Castle Towers, Building Tools, Portable Mesh Storage Backpack - Pro Green","https://m.media-amazon.com/images/I/41c919Kzw0L._AC_UL320_.jpg","4.6","25","15.99","228"
"B0BMVX6RMF","Happin Toddler Trampoline, Indoor & Outdoor Playset Ages 1-6, 5FT Kids Trampoline, Ultra Safe Mini Trampoline for Kids with Safety Enclosure Net, Gifts for Birthday Boys & Girls","https://m.media-amazon.com/images/I/91-JGHB+NdL._AC_UL320_.jpg","4.7","20","107.99","228"
"B096TBH41D","Safari Kidz Outdoor Explorer Kit - Children's Camouflage Cargo Vest and Hat Set","https://m.media-amazon.com/images/I/81F4TZFxkEL._AC_UL320_.jpg","4.7","907","19.87","228"
"B0B6625PHP","Toy Airplane Launcher - Outdoor Games - 4 Pack 17.5 Foam Glider Planes + 2 Launchers + 4 Sets of Stickers - LED Lights - Throwing Toys for Kids - Red & Blue Flying Toys – 4 5 6 7 8 Year Old Boys Girls","https://m.media-amazon.com/images/I/81tNcNRkb-L._AC_UL320_.jpg","4.4","71","26.99","228"
"B09MM3611H","Waboba Original Water Bouncing Ball - Water-Proof Beach Toys, Pool Games for Kids","https://m.media-amazon.com/images/I/71qonpXzrbL._AC_UL320_.jpg","4.6","300","9.99","228"
"B089NLHDWZ","Jumbo Castle Model Beach Gear 7"" Large Sand Buckets Pails Beach Water Pool Gardening Bath Toy Environmentally ABS Durable Thick Plastic Complete Gift Set Bundle For Kids Boys Girls- 3 Pack Green Blue","https://m.media-amazon.com/images/I/61epGTa8gKL._AC_UL320_.jpg","4.5","355","16.98","228"
"B099DLMXDT","POKONBOY 2 Pack Blaster Toy Guns for Boys Fit for Nerf Guns Darts, 6-Dart Rotating Barrel Foam Bullets Hand Gun Toys with 80 Refill Darts and 2 Wristbands Gifts for 6 7 8 9 10 Years Kids Christmas","https://m.media-amazon.com/images/I/81DhmuaO5lL._AC_UL320_.jpg","4.3","532","23.99","228"
"B06X1G5JHS","HONBAY 50pcs Blue Bubble Wands","https://m.media-amazon.com/images/I/71vkb93lOML._AC_UL320_.jpg","4.4","108","7.59","228"
"B09MZ4TVFP","GIFTINBOX Outdoor Explorer Kit & Bug Catcher Kit for Kids with Hat, Binocular, Butterfly Net, Whistle with Compass, Magnifying Glass, Bug Collector and Backpack Toy for Boys Girls 3-12 Years Old…","https://m.media-amazon.com/images/I/71KaoWzX8lL._AC_UL320_.jpg","4.6","274","24.99","228"
"B087CNT1XF","FUQUN Treehouse Accessories for Kids,Pulley with Bucket Cable, Kids Playhouse Accessories, Pulleys for Kids, Pirate Ship Accessories Outdoor, Kids Playhouse Accessories, Bucket for Treehouse(Black)","https://m.media-amazon.com/images/I/71kqmCA35IS._AC_UL320_.jpg","4.2","224","26.99","228"
"B07BBGYYQ1","POKONBOY Protective Goggles/Safety Glasses/Motorcycle Eyewear Compatible with Nerf Guns for Kids Teens Game Battle Outdoor","https://m.media-amazon.com/images/I/61rp1mpZx9L._AC_UL320_.jpg","4.5","1041","8.39","228"
"B0BZR5L3QM","BLUEY Ballooble Bubble Machine Amazon Exclusive Huge Inflatable Bubble Machine for Kids Includes a Stand and Bonus 40oz of Bubble Solution 2 in 1 Play Pattern for Maximum Bubble Toy Fun","https://m.media-amazon.com/images/I/61A6BqUc6EL._AC_UL320_.jpg","4.5","34","25.0","228"
"B0BR5N4NCC","splumzer 8 Pack Swimming Arm Float, PVC Arm Floating Inflatable for Kids and Adult","https://m.media-amazon.com/images/I/71eqBuPtxqL._AC_UL320_.jpg","4.2","58","9.98","228"
"B07ZLX1YLB","Honbo Rainbow Soft Octopus Kite for Kids and Audlts-Large Kite with 200ft Flying line-Easy to Fly Toy for Outdoor Games Beach and Activities","https://m.media-amazon.com/images/I/71C4gFZpnyL._AC_UL320_.jpg","4.6","387","12.9","228"
"B0C6B2SVGV","Funwee 2 Pack Electric Water Guns, Full Automatic Electric Squirt Gun High Capacity 500+ Water Blasts, 28-32 FT Range Water Pistol Blaster Soaker, Summer Outdoor Pool Auto Water Toy Gun for Adult Kid","https://m.media-amazon.com/images/I/91Eo4Z0OarL._AC_UL320_.jpg","4.6","55","37.99","228"
"B0CCL215XF","Basketball Party Supplies, 142Pcs Basketball Sports Theme Birthday Party Supplies Tableware Set,Include Basketball Plates and Napkins,Cups,Banner,Tablecloth for Basketball Birthday Decorations","https://m.media-amazon.com/images/I/81Vq7zl+3pL._AC_UL320_.jpg","4.7","29","24.99","228"
"B08KGF6FSL","Paper Airplane Templates for POWERUP Models - 12 Paper Airplane Templates for The POWERUP 2.0, 3.0, & 4.0. Includes Color Templates & Display Stand for POWERUP Models. for Hobbyists and Tinkerers","https://m.media-amazon.com/images/I/71BNiclLZcL._AC_UL320_.jpg","4.1","168","16.99","228"
"B0064G8PZG","Skywalker Trampolines Mini Trampoline with Enclosure Net","https://m.media-amazon.com/images/I/61RsOKE-N3L._AC_UL320_.jpg","4.6","15016","110.18","228"
"B084DW9G8W","GoFloats Wiener Dog Party Tube Inflatable Raft, Float in Style (for Adults and Kids)","https://m.media-amazon.com/images/I/71zCafJ19-L._AC_UL320_.jpg","4.6","1708","21.4","228"
"B0BZPLJ6JK","Bed Tent for Kids Lucky Castle Toddler Bed Tent Foldable Game House for Children Play Tents for Girls Boys Breathable Cottage Combination Sleeping Canopy Playhouse Double Net Curtain with Storage Bag","https://m.media-amazon.com/images/I/71LDvIszgtL._AC_UL320_.jpg","4.3","62","45.99","228"
"B00HIWWI4O","Intex Lil' Sea Turtle Ride-On, 59"" X 50"", for Ages 3+","https://m.media-amazon.com/images/I/71L613ubJzL._AC_UL320_.jpg","4.5","2411","13.9","228"
"B09XTT839B","5 INCH PVC Mini Basketball for Indoor Basketball Mini Hoops, Soft 5"" Rubber Small Repacement Basketball for Over Door Basketball Hoop Sets, Little Basketballs for Adults & Kids (3 PCS with Air Pump)","https://m.media-amazon.com/images/I/717shjm9emL._AC_UL320_.jpg","4.4","167","11.98","228"
"B00O80QKAC","Rockin' Inflatable Lounge, 74"" X 39""","https://m.media-amazon.com/images/I/81DPyBzuH1L._AC_UL320_.jpg","4.6","5387","29.99","228"
"B0C43D36J2","Floatey Palm Tree Pool Float - Xtralarge 48 Inches, Giant Pool Floats Adult Size | Inflatable Coconut River Tubes For Floating | Floating Island Funny Pool Float | Pool Accessories Tropical Pool Float","https://m.media-amazon.com/images/I/71VQdpmtccL._AC_UL320_.jpg","4.1","9","34.97","228"
"B078NSV96H","Tigerdoe Toy Guns – (2 Pack)- Toy Dart Guns for All Ages - Blaster Gun with Darts –Dart Shooter Toys for Kids- 2 Guns and 20 Darts- Fun Activities for Boys and Girls- Toys","https://m.media-amazon.com/images/I/61N71dOGTWS._AC_UL320_.jpg","3.7","323","17.99","228"
"B0BCMV3D28","Big Dot of Happiness Pajama Slumber Party - 4 Girls Sleepover Birthday Party Games - 10 Cards Each - Gamerific Bundle","https://m.media-amazon.com/images/I/81mbc06rn-L._AC_UL320_.jpg","4.6","7","17.99","228"
"B0BD4WBWP7","Topsolid Automatic Machine Toy Gun for Boys 8-12 Years Old, Electric Toy Foam Blasters & Guns with 200 Bullets, 2 Clips, 1 Goggles, Foam Dart Gun Birthday Xmas Gifts for Kids Adults 8+, Blue","https://m.media-amazon.com/images/I/71R1rS1cRRL._AC_UL320_.jpg","4.1","318","42.99","228"
"B09GLVQ6BZ","TRENDBOX Small Memory Foam Ball Pit, 27 inches Indoor Round Ball Pit for Toddler Kids Children - 27 inches (Light Gray)","https://m.media-amazon.com/images/I/51NshL277LL._AC_UL320_.jpg","4.5","36","26.99","228"
"B0BTD8ZM4P","Electric Gel Ball Blaster with Drum, Automatic and Manual Splatter Blaster with 40000+ Gel Balls, Large Splat Blaster for Adults Kids (Green)","https://m.media-amazon.com/images/I/71THrr9mSoL._AC_UL320_.jpg","4.5","188","29.99","228"
"B0BV1LZMYM","Zhanmai 6 Pack Inflatable Volleyball 16 Inch Blow up Beach Ball Large Sport Pool Ball with Pump for Adults Teens Gift Summer Outdoor Party Decorations","https://m.media-amazon.com/images/I/7163fzGjnzL._AC_UL320_.jpg","4.5","33","12.99","228"
"B06XZ1517Y","HONBAY 50pcs Colorful Multihole Bubble Wands","https://m.media-amazon.com/images/I/71+qEwNcuAL._AC_UL320_.jpg","4.0","227","6.99","228"
"B0C5MSKJHJ","Nehcovbo Airplane Launcher Toy, 7.4"" F-35 Foam Catapult Plane for Kids with LED Lights Toys for Boys 4-6, Kids Outdoor Toys Birthday Gifts for Boys Girls 4 5 6 7 8 9 10 11 12 Year Old (6 Pack)","https://m.media-amazon.com/images/I/715y+5RQh2L._AC_UL320_.jpg","4.4","51","15.99","228"
"B00I4EVEGI","Goliath Games Phlat Ball V3 (Blue)","https://m.media-amazon.com/images/I/81I4NUwfcCL._AC_UL320_.jpg","4.0","2878","22.64","228"
"B072K3GW3P","Nerf Rival Helios Outdoor Blaster","https://m.media-amazon.com/images/I/81q-5ofvOOL._AC_UL320_.jpg","4.6","1125","23.49","228"
"B08G5342T1","Zmarthumb - Pack of 100 Balls, 2.17-Inch BPA Free Colorful Crush Proof Play Balls for Ball Pit, Tent, Bounce House, Baby Pool, Playhouse & etc.","https://m.media-amazon.com/images/I/61rkFrkUo-L._AC_UL320_.jpg","4.3","266","20.99","228"
"B0C4Q2GT68","GeerWest Ball Pit Balls for Toddlers - Plastic Balls for Kids Ball Pit - Ball Pit Balls 100 with Mesh Popup Hamper for Storage - Ideal for Birthday Party Playground Pool Indoor Outdoor Games","https://m.media-amazon.com/images/I/71z3ts7HYQL._AC_UL320_.jpg","4.3","36","23.99","228"
"B0BX7NSB93","DreamWorks Gabby's Dollhouse 24""(W) X 45""(L) Soft Toddler Nap Mat with Pillow and Blanket Perfect for Preschool, Daycare, and Travel (100% Official Licensed Product)","https://m.media-amazon.com/images/I/61g5KHnuNqL._AC_UL320_.jpg","4.8","16","32.99","228"
"B0BRQBDJN7","AstarX Sand Toys,30 Pcs Beach Toys for Kids,Beach Ball,Truck,Molds,Beach Tools,Mini Flags,Mesh Bag Include","https://m.media-amazon.com/images/I/712Qs6yyHhL._AC_UL320_.jpg","4.0","270","19.99","228"
"B0CB93Z4G6","LZZAPJ T Ball Sets for Kids 5-8,Tee Ball Set with Plastic Baseball Bat,Toddler Baseball Game Sports & Outdoors Toys, Baseball Training Equipment for Youth 3-5, Tball Set Gifts for Boys Girls 8-12","https://m.media-amazon.com/images/I/71yNiE8-MML._AC_UL320_.jpg","4.5","10","24.99","228"
"B085C7KTQ1","Odoland 24 inch Children Tree Swing, Outdoor Small Saucer Swing Platform Swing for Kid, Round Flying Swing wirh Adjustable Hanging Ropes for Backyard, 220lb Weight Capacity Great for 1-2 Kids","https://m.media-amazon.com/images/I/71X-aJHBTPL._AC_UL320_.jpg","4.7","1684","39.99","228"
"B0BMFG67NY","Nazano Water Ball Beads Refill Ammo (5 Pack–10,000 Per Pack) Water Bullets Beads Made for Non-Toxic, Water Based Balls Bullet (Orange 5 Pack)","https://m.media-amazon.com/images/I/61ICSHrMkTL._AC_UL320_.jpg","4.5","772","6.99","228"
"B0CBK9BJLR","Swing for Kids Disc Swing Tree Swing Set Accessories Rope Swing Adjustable Swing Set with Monkey Bars 1 Carabiner 2 Added Hanging Straps, 3 in 1 Heavy Duty Swingset for Zipline Outdoor Backyard","https://m.media-amazon.com/images/I/81C6GsQW5PL._AC_UL320_.jpg","4.3","58","27.99","228"
"B008J9NDZ8","Easy Playhouse Blank Crafty Cottage - Kids Art and Craft for Indoor Fun, Color, Draw, Doodle on this Blank Canvas – Decorate and Personalize a Cardboard Fort, 32"" x 26.5"" x 40.5"" - Made in USA, Age 3+","https://m.media-amazon.com/images/I/51XAJrBvq7L._AC_UL320_.jpg","4.2","609","32.99","228"
"B075RMG6ST","Pacific Play Tents 60810 Barnyard Playhouse Tent, 48"" x 38"" x 48"", Multi","https://m.media-amazon.com/images/I/81I3WxaEF7L._AC_UL320_.jpg","4.5","299","60.57","228"
"B09YTVYLYZ","jumpfly Trampoline Basketball Hoop with Mini Basketballs-, Soft Materials & Breakaway Rim for Safe Dunking，for All Ages","https://m.media-amazon.com/images/I/71KY5yYHDBL._AC_UL320_.jpg","3.7","152","20.99","228"
"B09PD8FWFC","Sloosh 12 Sets Sand Buckets with Shovels for Kids Beach Pails Toys Party Favors Pail Set Plastic Bucket with Handles","https://m.media-amazon.com/images/I/81KyfUCsQ6L._AC_UL320_.jpg","4.5","120","16.99","228"
"B0C6LXYC4B","Star & Wars Trooper Toys Foam Blaster for 5 6 7 8+ Year Old Boys Girls - Kids Role Play Toy Shooting Game for Kids Teens Adult with 40 Elite Darts Combine with Nerf Guns - Idea Gift for Birthday","https://m.media-amazon.com/images/I/71iRns3kNkL._AC_UL320_.jpg","4.2","7","20.99","228"
"B01M2BR874","Gorilla Playsets 04-0006-G/G 18"" Trapeze Bar Assembly with Rings - Green Bar, Rings, 36.5"" Plastisol Coated Chains","https://m.media-amazon.com/images/I/716Igm6RKxL._AC_UL320_.jpg","4.8","141","27.01","228"
