"asin","title","imgUrl","stars","reviews","price","category_id"
"B083XS3H8Q","BeneLabel Non-Slip Swing Seat with Adjustable Rope and Carabiners - Heavy Duty Playground Swing Set Accessories for Kids and Adults - 220LB Capacity - Orange","https://m.media-amazon.com/images/I/61US4GLHRpL._AC_UL320_.jpg","4.7","696","29.99","228"
"B0C6LQPVXH","2 Pcs Beach Sand Sifter- Shark Tooth Sifter- Sand Scoop Shell Scooper for Beach- Beach Scoop Shovel and Sifter Tool for Picking Up Shells Beachcombing & Rock Hunting","https://m.media-amazon.com/images/I/71o2lw4ZQPL._AC_UL320_.jpg","4.1","64","21.99","228"
"B09QKFD4FN","Pool Floats Kids with Water Gun for Aged 3-12, Toddler Pool Toys for Boys and Girls, Inflatable Ride-on for Children, Pirate Ship Float Gifts for Pool, Beach and Any Summer Party (43’’x 40’’)","https://m.media-amazon.com/images/I/71wxg+cqGIL._AC_UL320_.jpg","4.5","292","29.99","228"
"B07KXW1BJF","Minnie Mouse Ball Pit 20 Balls - Toddler Jungle Gym Playhouse Inflatable for Boys Girls Kids [20 Balls Included]","https://m.media-amazon.com/images/I/91kMD-tCWbL._AC_UL320_.jpg","4.4","210","29.99","228"
"B095HWYF1Q","Treasure Gurus Set 2 40"" Inflatable Silver Gold Electric Guitar Blow Up Toy Swimming Pool Floaties Water Party Float","https://m.media-amazon.com/images/I/6159PS+bWdS._AC_UL320_.jpg","4.1","38","13.29","228"
"B09L4R8FH2","Srcooat Electric Gel Ball Blaster, Splatter Ball Blaster with 20000 Gel Balls Backyard Fun Outdoor Activities Game Toy Gift for Boys and Girls 12+","https://m.media-amazon.com/images/I/71CGVd0vfGL._AC_UL320_.jpg","4.1","622","19.99","228"
"B08XJ8MRHP","ENMOGO Foam Ball Pit for Toddlers Kids Soft Ball Pool Ideal Gift Play Toy for Children Kiddie Pools - Light Gray","https://m.media-amazon.com/images/I/51faGALmxSL._AC_UL320_.jpg","4.6","99","29.99","228"
"B07CVJKPF3","AzBoys 500pcs Small Latex Water Balloons,Colorful Air Balloons,Biodegradable Summer Splash Water Balloon Toys,for Water Bomb Game Fight Sports Fun Party","https://m.media-amazon.com/images/I/51ASv6gi6xL._AC_UL320_.jpg","4.3","1563","8.99","228"
"B001U5SYB6","The Original Giant Bubble Wand Makes The World's Longest Bubbles, Over 36 feet Long, Includes 2.7 Gallons of Giant Bubble Solution, Non-Toxic Certified","https://m.media-amazon.com/images/I/91T5nSixpYL._AC_UL320_.jpg","4.1","1964","14.95","228"
"B09BQH3SNF","CRONDA 60-Hole Rocket Launcher Shape Bubble Maker, Rocket Boom Bubble Gun, Bubble Machine for TIK Tok, Huge Bubble Maker, Bubble Machine for Kids and Toddlers (Pink)","https://m.media-amazon.com/images/I/71ItlZr76tL._AC_UL320_.jpg","3.7","154","24.99","228"
"B09FZ64JDW","2 Pieces Marbleized Bouncy Balls Colorful Inflatable Big Cloud Bouncing Balls PVC Play Balls for Adults Pet Party Supplies Beach Playground School Water Fun (Red,Blue,8.5 Inch)","https://m.media-amazon.com/images/I/61oOuSzTimL._AC_UL320_.jpg","3.8","260","9.99","228"
"B0BVP5Q39Q","6Pcs Big Pool Floats Tubes-Parentswell Pool Floats, Inflatable Pool Float Swimming Rings, Pool Floaties Party Toys for Kids Adults Toddlers","https://m.media-amazon.com/images/I/711mtZqP7tL._AC_UL320_.jpg","4.3","167","18.99","228"
"B07WDHVT2J","MAGICYOYO Professional Yoyo N11 Unresponsive yoyo for Advanced Yoyo Players, Dual Yoyo for Beginners, Pro Yoyo with 12 Yoyo Strings, Yoyo Case Bag, Responsive Yoyo Bearing Kit (Black Blue Silver)","https://m.media-amazon.com/images/I/81mvZpsngLL._AC_UL320_.jpg","4.3","1322","23.81","228"
"B0024M7CGC","Franklin Sports Kids Teeball Tee - 2-in-1 Super Star Batter - Youth Baseball and Teeball Batting Tee + Pitching Machine - Perfect Kids + Toddlers Toy Set","https://m.media-amazon.com/images/I/71JwAueHHhS._AC_UL320_.jpg","4.4","5734","32.32","228"
"B08BQD89W7","Mini Basketballs - (7 Inch, Size 3) Pack of 3 - Mini Hoop Basketball Set for Indoor, Outdoor, Pool Parties, Small Hoops Basketball Game Party Favors for Kids Patriotic Red, White and Blue Colors","https://m.media-amazon.com/images/I/91bA+m5qxJL._AC_UL320_.jpg","4.7","576","19.89","228"
"B0B2L9Y75T","waykito Flower Garden Building Toys for Girls Age 3, 4, 5, 6, 7 Year Old, 150 Pcs with Storage Box, STEM Toy Gardening Pretend Gifts Toys for Kids Age 3-6,Stacking Game for Toddlers Play Set","https://m.media-amazon.com/images/I/81JlqXDayjL._AC_UL320_.jpg","4.7","132","32.99","228"
"B09QH5J95P","Kid's Nap Buddies Character Preschool Nap Mat, Toddler Sleeping Bag with Pillow for Daycare, Ages 3+","https://m.media-amazon.com/images/I/61Ngpoxs0OL._AC_UL320_.jpg","4.4","435","34.99","228"
"B093491HMZ","12 Pack - 3"" Water Bomb Splash Balls - Water Absorbent Ball - Kids Pool Toys, Outdoor Water Activities for Kids, Pool Beach Party Favors. Water Fight Games by 4E's Novelty","https://m.media-amazon.com/images/I/813F5qygQPL._AC_UL320_.jpg","4.2","247","14.99","228"
"B0BZVVP8DX","Nano Tape Bubble Kit for Kids, (9.84ft × 2inch) Nano Tape Plastic Bubbles Balloon DIY Craft Kit Elastic Bubble Nano Creativity Tape Fidget Party Favors Gifts for Girls Boys","https://m.media-amazon.com/images/I/81bqmMtFQPL._AC_UL320_.jpg","4.0","128","9.99","228"
"B07Z6V9367","Waboba Pro Water Bouncing Ball - Water-Proof Beach Toy, Pool and Beach Games for Kids & Adults, Outdoor Fun (Green Dream)","https://m.media-amazon.com/images/I/71J8auh2jFL._AC_UL320_.jpg","4.6","673","9.99","228"
"B098Q56LTM","Kids Princess Tents for Girls Toys, Princess Castle Playhouse Tent, Indoor & Outdoor Toys Play Tent for 3+ Year Old Girls Kids Birthday Gift, Imaginative Games","https://m.media-amazon.com/images/I/71QaSog64mL._AC_UL320_.jpg","4.2","212","29.99","228"
"B09H4DGVVM","Mr. Pen- Inflatable Baby Swim Float, for Ages 6-30 Months, Blue, Waist Ring Inflatable Baby Pool Float, Infant Swim Float, Baby Pool Toys, Infant Floats for Pool, Baby Swimming Float","https://m.media-amazon.com/images/I/81BLwCzym9L._AC_UL320_.jpg","4.2","93","9.99","228"
"B09XN4GJDZ","Hiboom Swimming Pool Water Football, Soft Beach Games Waterproof Ball for Kids, 9.6 Inch PVC Rainbow Colorful Non Slip Underwater 4th of July Party Dive Toys Gift for Adults and Family","https://m.media-amazon.com/images/I/91T-wqNqdPL._AC_UL320_.jpg","3.7","43","10.99","228"
"B0BDK9Y53B","FUNLIO Foldable Swing Stand for Kids with 4 Sandbags, Heavy Duty Metal A-Frame Indoor/Outdoor for Backyard, Suitable Most Toddler/Baby Jumper/Hammock Chair","https://m.media-amazon.com/images/I/61LN+DgBCvL._AC_UL320_.jpg","4.4","107","69.99","228"
"B08SYBNSG9","NERF Ultra Focus Motorized Blaster, 10-Dart Clip (Amazon Exclusive)","https://m.media-amazon.com/images/I/71PkVyhhh3L._AC_UL320_.jpg","4.6","979","35.84","228"
"B07K8HVZJZ","JOYGOGO 32 Pack Glider Planes,8"" Long Flying Glider Plane,8 Different Designs,Easy Assembly,Durable Quality-Kids Party Favors for Valentines Airplanes,Birthday Party, Carnival Prizes","https://m.media-amazon.com/images/I/71k-UHBN9jL._AC_UL320_.jpg","4.5","1117","12.99","228"
"B00UXJGUTS","BANZAI Precious Dive Gems","https://m.media-amazon.com/images/I/71rZbPzQ48L._AC_UL320_.jpg","4.8","1670","8.39","228"
"B0B38SXBG4","Ball Bearing High-Precision Professional Unresponsive Yoyo, Aluminum Yo-Yo for Kids Adults with 1 Glove and 5 Yoyo Strings (Mixed Color Red)","https://m.media-amazon.com/images/I/71+eJ4INMGL._AC_UL320_.jpg","4.3","133","14.99","228"
"B000LL3WE4","Set of 6 Hacky Sacks - Multicolor Design","https://m.media-amazon.com/images/I/71zoOhIwTpL._AC_UL320_.jpg","4.4","1876","18.99","228"
"B0C2VTPBJ9","Chuckle & Roar - Pop Up Play Tunnel - Active Play for Toddlers - Preschool pop up Tent Companion - Ages 3 and up - Rainbow Tunnel","https://m.media-amazon.com/images/I/81ZGhuEWd4L._AC_UL320_.jpg","5.0","12","17.99","228"
"B0C3Z3R6GF","Gel Ball Blaster Toy Guns Pistol for Boys 2 Pack, Splatter Ball Gun with 20000+ Water Beads Without Charge, Toy Gun for Backyard and Outdoor Team Shooting Games, Gifts for Boys Adult Age 12+ Birthday","https://m.media-amazon.com/images/I/71wgXjDHTTL._AC_UL320_.jpg","3.5","31","19.99","228"
"B004S6QWHW","Brainstorm Toys: Space Torch and Projector, Creates Clear, Precise Images up to One Metre Wide, Fun Project Doubles as Handy Torch Flashlight, STEM, For Ages 3 and up","https://m.media-amazon.com/images/I/81UOpN9m1wL._AC_UL320_.jpg","4.0","24914","8.99","228"
"B09YL1V737","Kids Toys Toss and Catch Game Set 12 Paddles 6 Balls Beach Game Outdoor Ball Sports Games Toss and Catch Ball Set with Paddles Ball Nylon Catch Toys for Kids Adults Playground","https://m.media-amazon.com/images/I/81UDJJFtMkL._AC_UL320_.jpg","4.4","67","24.99","228"
"B096FT2JSS","Kiddisie Beach Toys Mesh Beach Bag Kids Shell Collecting Bag Totes with Zipper for Holding Shells Beach Sand Toy for Boys and Girls Shell Bag for Picking Up Shells(Classic, A Set of 4)","https://m.media-amazon.com/images/I/81+fdAahQKL._AC_UL320_.jpg","4.5","333","11.99","228"
"B00MXT4Y3K","NERF N-Sports Turbo Jr. Football","https://m.media-amazon.com/images/I/71zXSWQbK7L._AC_UL320_.jpg","4.5","2581","14.75","228"
"B01AD1U302","Melissa & Doug Sunny Patch Camo Chameleon Watering Can With Tail Handle and Branch-Shaped Spout","https://m.media-amazon.com/images/I/61J50dBQl7L._AC_UL320_.jpg","4.8","967","14.49","228"
"B072FVNTG8","GoFloats Adult Water Wing Floaties - Own The Pool - Available in Multiple Designs (Novelty use only)","https://m.media-amazon.com/images/I/719WwxlLAuL._AC_UL320_.jpg","4.4","466","22.24","228"
"B09DGC9DCL","Perantlb Ninja Warrior Obstacle Course for Kids-2x56ft Double Ninja Slackline with 11 Accessories for Kids,Swing,Climbing Rope Swing,Rope Ladder,1.2M Arm Trainer","https://m.media-amazon.com/images/I/81UIfYuCxZL._AC_UL320_.jpg","4.3","113","109.99","228"
"B091YCRDQ2","Okuna Outpost 2 Pack Blue Foam Fingers #1, It's Goin' Down for Sports Fan Accessories, Cheering, Party Favors, 17.5 Inch Giant Foam Hand","https://m.media-amazon.com/images/I/71b28UnanHL._AC_UL320_.jpg","4.0","131","14.99","228"
"B08Y8W8JL1","Tzsmat 65"" Diameter Kids Colorful Inflatable Wheel Roller Pool Float for Pool Lake Water Toy","https://m.media-amazon.com/images/I/61F3mEYFOkL._AC_UL320_.jpg","4.1","596","49.99","228"
"B07TTWNB8Q","Slingshot Flying with LED Lights Glow The Dark Party,12 Launchers + 12 LED Helicopters,Slingshot Amazing Arrow Helicopter Glow Supplies for Kids (24 Pieces)","https://m.media-amazon.com/images/I/71RiIbTm4oS._AC_UL320_.jpg","4.2","512","15.98","228"
"B0832FK484","Jasonwell Inflatable Dinosaur Pool Float Tube for Boys Girls Adults 93'' T-Rex Floatie Summer Beach Swimming Pool Inflatables T-Rex Ride on Party Pool Raft Lounge Kids Tyrannosaurus Rex Dinosaur Toys","https://m.media-amazon.com/images/I/61S69W8T0rL._AC_UL320_.jpg","4.4","2621","19.99","228"
"B0B46PXN9W","Kite Reel and Kite String with Reel, 8inches Dia Includes 1000ft (70LBS) High Strength Kite String, Large Handle, Safety Lock Design, with Connector, Kite String Spool for Kids and Adults (Blue)","https://m.media-amazon.com/images/I/71xLKrsY8lL._AC_UL320_.jpg","4.4","113","16.99","228"
"B09Y5G729C","2 Pcs Sand Brush Sand Remover Surf Sand Off Brush with Bag Beach Accessories for Vacation, Beach Sports, Pets and More","https://m.media-amazon.com/images/I/61NKhiJRLhL._AC_UL320_.jpg","4.4","63","13.99","228"
"B0773X882D","Dimple Garden Wagon & Tools Toy Set Premium 15Piece Gardening Tools & Wagon Toy Set – Sturdy & Durable - Top Yd, Beach, Sand, Garden Toy - Great for Kids & Toddlers (Garden Toy Set), Green (Single)","https://m.media-amazon.com/images/I/71p3OXRVwPL._AC_UL320_.jpg","4.4","783","29.99","228"
"B0B2VY8J6S","Innotoys Kids Playground Balls, 5 Inches Sports Ball Rubber Dodge Ball Kick Ball for Toddlers 1-3, Indoor Outdoor Balls Game Gifts for Boys Girls 3 4 5 6 Years Old (7 Pcs Balls)","https://m.media-amazon.com/images/I/71JsrpXOQ+L._AC_UL320_.jpg","4.5","45","24.99","228"
"B0BTMR5JXN","Hot Wheels 1988 Jeep Wagoneer, HW The '80s 5/10","https://m.media-amazon.com/images/I/71mP+NwQlsL._AC_UL320_.jpg","4.8","25","5.96","228"
"B08Q3RPGG6","Sunny Days Entertainment Oversized Foam Baseballs for Kids - for Hitting or Replacement Balls | Soft Tball for Toddlers - 5 Pack, White","https://m.media-amazon.com/images/I/71pW7xHgt8L._AC_UL320_.jpg","4.5","391","9.68","228"
"B0C3MBSCFJ","Liliful 3 Pcs Shelling Tools for Beach Include Sand Sifter with Extra Long Adjustable Handle, Mesh Beach Bag and Beach Mesh Shovel, Sand Scoop for Kids Girls Boys Collecting Shells Beach Toys","https://m.media-amazon.com/images/I/81xVEiiEFTL._AC_UL320_.jpg","4.0","12","24.99","228"
"B09B9Y7T5P","Moneer 20 Pieces Responsive Bearing Ball LED Light Up Colorful Plastic Auto Return Entertaining Toy for Beginner Birthday Party Favors Classroom Rewards, Random Colors","https://m.media-amazon.com/images/I/81lr-vamRtS._AC_UL320_.jpg","4.0","125","21.99","228"
"B01B8FFM12","Squirrel Products Pirate Telescope - Swing Set Accessories Replacements & Additions - Active Outdoor Play for Boys & Girls Ages 3 & Older","https://m.media-amazon.com/images/I/71TQIRsZQpL._AC_UL320_.jpg","4.6","1537","12.99","228"
"B0147LMQ7W","Dinosaur Bubble Gun Light Up Bubbles Shooter, Battery Operated Bubble Maker Toy for Toddlers & Kids, Sound-Free (Extra Refill Bottle and Batteries Included)","https://m.media-amazon.com/images/I/71H9UdUbPAL._AC_UL320_.jpg","4.0","5277","13.95","228"
"B0993FFXNR","500 Pieces Color Mixing Glass Marbles 0.56 Inch Cat Eyes Marbles Solid Glass Colorful Marbles Round DIY Marble Bulk for Kids Slingshot Home Decoration Chinese Checkers Game","https://m.media-amazon.com/images/I/814D5qysqaL._AC_UL320_.jpg","4.5","89","20.99","228"
"B0BRTVK3RS","DAUXONE Diving Toys,27 Pcs Pool Toys with Diving Swim Thru Rings for Kids Age 3-12,Dive Sticks,Diving Rings,Diving Gem,Diving Octopus,Pool Torpedo,Mesh Bag Include","https://m.media-amazon.com/images/I/81pNNtFgJOL._AC_UL320_.jpg","4.3","407","26.99","228"
"B08SWHHQJR","GOGOSO Baby Ball Pit Balls - Pack of 100pcs Small Crush Proof Plastic Play Ball Pool Pits with Storage Bag for Kids Play Tent, Birthday Party, Baby Play Yard, Kiddie Pool","https://m.media-amazon.com/images/I/61YN2qQD+ML._AC_UL320_.jpg","4.4","448","21.89","228"
"B09WD1ZVNQ","47"" x 47"" x 12"" Inflatable Kiddie Pools 3 Ring Watermelon Plastic Paddling Pool Baby Swimming Pool for Toddler Backyard Garden Outdoor Blow Up Wading Pools Childrens Pools Pit Ball Pool","https://m.media-amazon.com/images/I/71bSJQdTz4S._AC_UL320_.jpg","4.2","132","11.89","228"
"B0BYSC2QKB","Manmel Diving Gem Pool Toy 7PCS Big Colorful Diamonds Set with Treasure Pirate Box, Summer Swimming Gem Diving Toys for Kids Toddlers, Underwater Dive Gemstone Toy Party Decoration(7pcs Large)","https://m.media-amazon.com/images/I/81vnduRqaqL._AC_UL320_.jpg","4.0","65","5.99","228"
"B01FPJO1W8","SUMMERSDREAM Disk Seat Swing Daisy Disc Monkey Swing Rope Tree Swing (Blue)","https://m.media-amazon.com/images/I/31InAZhFXOL._AC_UL320_.jpg","4.5","789","14.89","228"
"B09MRYN5KW","TOY Life Kids Explorer Kit, Bug Catcher Kit for Kid, Bug Catching Kit with Butterfly Net, 25Pcs Kids Camping Set Gear,Kids Adventure Kit, Insect Catcher, Explorer Costume, Outdoor Explorer Kit for Kid","https://m.media-amazon.com/images/I/81Fo7P-polL._AC_UL320_.jpg","4.6","210","29.97","228"
"B0BYD3QQX6","Defemim 32 Pack Glider Planes for Kids,Foam Glider Plane Toy,Foam Gliders Planes Toys for Kids,16 Designs,for Boys and Girls Birthday Party Favors,Classroom Prizes,party favors kids","https://m.media-amazon.com/images/I/71ye8CUT6+L._AC_UL320_.jpg","4.9","28","7.99","228"
"B09VC43CZS","Zhanmai 8 Pieces Inflatable Clear Beach Ball Inflatable Clear Balloons Transparent Swimming Pool Party Ball for Summer Beach, Pool and Party Favor, 16 Inches, 24 Inches","https://m.media-amazon.com/images/I/514VsNhOUQL._AC_UL320_.jpg","3.8","60","17.99","228"
"B0B4PNNQQY","Hot Wheels Back to The Future Time Machine","https://m.media-amazon.com/images/I/81Vf7W0aNGL._AC_UL320_.jpg","4.7","252","17.45","228"
"B0948PBFV3","Adventure Kidz - Outdoor Exploration Kit, Children’s Toy Binoculars, Flashlight, Compass, Whistle, Magnifying Glass, Backpack. Great Kids Gift Set for Camping, Hiking, Educational and Pretend Play.","https://m.media-amazon.com/images/I/71y8doRKsxL._AC_UL320_.jpg","4.5","4539","19.99","228"
"B000CPGYQM","Spielstabil Large Sand Pail Beach Toy (One Bucket Included - Colors Vary) - Holds 2.5 Liters - Made in Germany","https://m.media-amazon.com/images/I/51ZwJ-e3mDL._AC_UL320_.jpg","4.5","821","14.99","228"
"B0C4CKKVBS","NATIONAL GEOGRAPHIC Volcano Bean Bag Toss Game for Kids - Kids Cornhole Game Set with 5 Backyard Games, Bean Bags for Tossing, Yard Games for Kids, Outdoor Kids Games, Patio Games (Amazon Exclusive)","https://m.media-amazon.com/images/I/91OJycpQKZL._AC_UL320_.jpg","4.4","15","49.99","228"
"B0BCP1WXPB","Hanaive 4 Pcs 2 Size Toss and Catch Ball Game Replacement Balls Catch Balls Set for 3 4 5 6 7 8 9 10 Year Boys Girls and Adults, 2.5 inches and 1.8 inches","https://m.media-amazon.com/images/I/71AI4DjpbjL._AC_UL320_.jpg","4.3","40","8.99","228"
"B09VX235TY","Pack of 12 Marble Game Sets, Bag of Marbles Glass Marble Pack Fun Shooter Marbles with Black Drawstring Storage Bag for Indoor and Outdoor Game Party Favors, 11 Marbles and 1 Shooter Per Pack","https://m.media-amazon.com/images/I/81YmBDIy03L._AC_UL320_.jpg","4.4","55","16.99","228"
"B0BP9LN7VQ","REFUN Kids Bow and Arrow Set Toys for 3 4 5 6 7 8 Year Old Boys, Outdoor Toys for Kids Ages 4-8 Archery Set Birthday Gifts for 3-8 Year Old Boys Girls Kids Indoor & Outside Shooting Games Toys","https://m.media-amazon.com/images/I/61XHg9M-nyL._AC_UL320_.jpg","4.4","586","10.99","228"
"B08GBYKMD2","3 Pack 35 Inch Inflatable Cactus Set for Mexican Fiesta Party Decorations, Cinco de Mayo Supplies","https://m.media-amazon.com/images/I/71cKIB2X9WL._AC_UL320_.jpg","3.9","37","19.99","228"
"B01N1ZKXYH","JOYIN 18Pcs Diving Pool Toys for Kids, Swimming Pool Toy with Storage Bag Includes 4 Pool Rings, 4 Diving Sticks, 4 Toypedo Bandits, 6 Treasures Underwater Swim Pool Games for Ages 8-12","https://m.media-amazon.com/images/I/71U9xTjNQQL._AC_UL320_.jpg","4.7","3546","11.99","228"
"B07BX9G31B","Children’s Factory, AFB7950, Angeles 4-Rings Basketball Hoops with Storage Bag, Blue, Toddler and Kids Indoor – Outdoor Preschool & Daycare Mini Hoops","https://m.media-amazon.com/images/I/81u1v8r2OqL._AC_UL320_.jpg","3.6","66","166.54","228"
"B09HHFMXZZ","TOY Life Beach Toys for Kids, Sand Toys for Toddlers 1-3 with Sand Bucket and Shovel, Dino Sand Castle Molds and Sand Box, Travel Beach Toys for Toddlers 1-3","https://m.media-amazon.com/images/I/71RJYPwnvxL._AC_UL320_.jpg","4.4","242","21.99","228"
"B000KYQ406","Champion Sports Coated High Density Foam Balls, 4"", Model: HD4","https://m.media-amazon.com/images/I/61ocyKA6LxL._AC_UL320_.jpg","4.3","134","8.39","228"
"B0BZWTQYDZ","Hot Wheels DMC Delorean, HW The '80s 8/10","https://m.media-amazon.com/images/I/71V9UF5bHDL._AC_UL320_.jpg","4.9","18","6.77","228"
"B09DSMTK3W","POROHOM 12 PCS Trampoline Screws, Long Screw Trampoline Replacement Parts, Anti-Loose Trampoline Bolts and Nuts,Trampoline Accessories Trampoline Stability Tool- 3""(Length)","https://m.media-amazon.com/images/I/71Zs4yLIcVL._AC_UL320_.jpg","3.7","146","9.99","228"
"B08G1NL1LQ","Trounistro 20 Pieces Transparent Spinners Math Game Spinner with Rotating Arrow for School Math Home Party Using","https://m.media-amazon.com/images/I/61REWDs08aL._AC_UL320_.jpg","4.6","62","16.98","228"
"B08T6W3T3N","AKASO Kiddie Pools, 59'' x 13'', Inflatable Swimming Pools for Boys, Girls, Toddlers, Easy Set Up Inflatable Baby Ball Pit Pool for Ages 2+, Garden, Backyard, Outdoor Summer Water Party","https://m.media-amazon.com/images/I/71iuG-IBE4L._AC_UL320_.jpg","4.3","1385","15.99","228"
"B01CEEO8ZM","World Footbag Sir Hemp Hacky Sack Footbag, Black/Green/Grey/Red/Tan/Yellow","https://m.media-amazon.com/images/I/81E-pP9fhIL._AC_UL320_.jpg","4.6","979","10.0","228"
"B002HW9M94","Champion Sports Soft Foam Mini Football, Blue/White, 8""","https://m.media-amazon.com/images/I/711ji8Iv1NL._AC_UL320_.jpg","4.0","45","11.49","228"
"B0192EOOS8","NDN LINE Bouncy Horse - Hopper Horse Inflatable Jumping Animal with Pump …","https://m.media-amazon.com/images/I/61RDRS9vz9L._AC_UL320_.jpg","4.5","1592","15.99","228"
"B09LRM7GDG","Sunny Days Entertainment Humvee Pop Up Tent - Children's Camo Pop Up Playhouse | Camouflaged Military Toy for Kids","https://m.media-amazon.com/images/I/71UoMC+CMWL._AC_UL320_.jpg","4.3","112","29.52","228"
"B07TBZPWCK","Fishing Net, TSYAN 3 Pack Bug Net Catching Crab Insect Nets Beach Toys Floating Bait Butterflies Colorful Nets for Kids Outdoor Playing 16 inches","https://m.media-amazon.com/images/I/712JnpF+wgL._AC_UL320_.jpg","3.9","237","14.69","228"
"B002VM41YG","Inflatable World Globe 20""","https://m.media-amazon.com/images/I/61jW1jjVFqL._AC_UL320_.jpg","4.4","614","17.0","228"
"B09PBQW5RQ","Honoson 30 Pieces 20 Inch Inflatable Beach Balls Large Blow up Pool Game Toys for Summer Swimming Party Supplies","https://m.media-amazon.com/images/I/71zvfIBgp7L._AC_UL320_.jpg","4.1","61","32.99","228"
"B09263LJNL","OR OR TU 6 Pcs Foldable Sand Buckets Beach Toys Set for Kids Collapsible Bucket Castle Molds Shovels Rake Tool Kits, Gifts for 1 2 3 4 5 6 Baby Toddler Kids Boys and Girls","https://m.media-amazon.com/images/I/81P+-ur7XML._AC_UL320_.jpg","4.6","516","16.99","228"
"B08QV3GFTF","Flying Orb Ball 2023,Flying Ball Toys, Fly Orb Hover Ball Floating Boomerang Spinner Spinner Drone Flying Boomerang Balls, Cool Toys Gifts for 6 7 8 9 10 12 13 14 15 Year Old Boys Girls Teens(Blue)","https://m.media-amazon.com/images/I/71bckCJZjbL._AC_UL320_.jpg","4.1","1414","32.0","228"
"B09NSMJPRN","6 Pieces Inflatable Beach Ball Swimming Pool Balls 24 Inches Bouncy Glitter Jelly Ball Confetti Beach Ball Glitter Beach Ball Floating Confetti Ball for Summer Beach, Pool Party Favor (Silver)","https://m.media-amazon.com/images/I/81UYq-rUgDL._AC_UL320_.jpg","3.9","81","19.99","228"
"B00009B1SF","Airzooka Air Blaster- Blows 'Em Away - Air Toy for Adults and Children Ages 6 and Older - Blue","https://m.media-amazon.com/images/I/61qkKxOZMrL._AC_UL320_.jpg","4.3","4936","24.99","228"
"B09WX5MVFQ","The Dreidel Company Mini Beach Day Playsets (Pack of 6) 3.25"" Sand Bucket Play Set Box Includes, Pail, Shovel, Rake, Sifter Scoop, Dolphin Fish Sand Trays Toy for Boys and Girls Birthday Party Favor","https://m.media-amazon.com/images/I/81-GALFDp1L._AC_UL320_.jpg","3.7","88","9.99","228"
"B0B3RY2145","Trampoline Ladder, Upgrade Wide-Step Ladder for Trampoline, Universal Trampoline Accessories and Parts, Heavy-Duty Steel Ladder with Non-Slip Plastic Steps, Durable and Easy Install (Three-Steps)","https://m.media-amazon.com/images/I/51KilJGOdDL._AC_UL320_.jpg","4.5","172","25.99","228"
"B09BG4F8MM","Marvel The Falcon and The Winter Soldier Captain America Magnetic Shield & Gauntlet Roleplay Set","https://m.media-amazon.com/images/I/61MDMU3aEoL._AC_UL320_.jpg","4.3","48","15.99","228"
"B096DS39G8","Hyponix Zip Lines for Kids and Adults Outdoor up to 350 Lbs - 120 ft / 200 ft - 100% Rust Proof W/Safety Harness Zip Line Kit | Zipline for Backyard Kids and Adults | Zipline Kits for Backyard","https://m.media-amazon.com/images/I/815HKl7nvxL._AC_UL320_.jpg","4.5","707","189.79","228"
"B0C3H9K53Y","IAGBIBUI Ball Pit Balls for Toddlers 100 pcs, BPA Free Plastic Pool Ball for Kids Children, 2.16“ Crush Proof Ocean Balls Fun Toys Gift for Ball Pit, Kids Play Tent, Bounce House, White","https://m.media-amazon.com/images/I/61VCP-LrnYL._AC_UL320_.jpg","4.6","7","17.99","228"
"B08T21NF6Z","Croude Nickelodeon Bubble Guppies Activity Book Bundle - Bubble Guppies Sound Book with Bubble Guppies Tattoos (Bubble Guppies Toys for Toddlers)","https://m.media-amazon.com/images/I/91JdiSFzb2L._AC_UL320_.jpg","4.6","146","19.95","228"
"B09JWWTD2J","Zcaukya Inflatable Pool Float, Colorful Inflatable Pool Lounger for Adults, Swimming Pool Inflatable Floating Mat for Summer Parties","https://m.media-amazon.com/images/I/71T-jrQtc1L._AC_UL320_.jpg","4.2","1781","22.99","228"
"B07N1VZW1F","edxeducation Fun2 Play Tray - Infinite Black - Mini Tuff Tray for Kids - Ages 18m+ - Portable Sensory Play for Toddlers","https://m.media-amazon.com/images/I/61dyyFUhXfL._AC_UL320_.jpg","4.6","97","30.9","228"
"B01L8GHS8G","Kangaroo Marble Set - 160; Marbles Game, in a Tin Box","https://m.media-amazon.com/images/I/816uYtpLfbL._AC_UL320_.jpg","4.6","2561","9.95","228"
"B00VITUNTA","Duncan Yo-Yo Imperial Gift Set Bundle - 6 Pack (Assorted Colors)","https://m.media-amazon.com/images/I/81nkn54NiJL._AC_UL320_.jpg","4.5","485","24.75","228"
"B07JXQYB4V","HENGDA KITE Large Power Snake Kites with Flying Line Outdoor Fun Sports Kite","https://m.media-amazon.com/images/I/71w9pTfwJlL._AC_UL320_.jpg","4.5","1126","16.99","228"
"B09DG229XF","Princess Castle Play Tent with Glow in The Dark Stars, Foldable Pink Pop up Kids Tent Playhouse Toys, for Indoor Outdoor Toddler Children Girls Gifts Tent Girls Toys Age 3/4/5/6/7/8/9 Years Old","https://m.media-amazon.com/images/I/612QnSnCIGL._AC_UL320_.jpg","4.3","335","23.99","228"
"B096K3J5QB","Water Skipping Ball Summer Beach Ball 2-Pack Water Bouncing Balls Grip Ball for Beach Swimming Pool River Lake","https://m.media-amazon.com/images/I/81zoU1bu9qS._AC_UL320_.jpg","4.4","108","10.99","228"
"B0B49NFGYG","AÖARLO Princess Play Tent with Rainbow Rug and Lights, Odorless Princess Tent for Girls 3-7, Indoor Play Tent Toy House, ASTM Certified Mosquito Prevention, 55'' X 53'' (DxH)","https://m.media-amazon.com/images/I/71L2jjkTOUL._AC_UL320_.jpg","4.4","640","49.98","228"
"B0BS3H4P6W","NHBTYKL 28 Pcs Colorful Diving Gem Pool Toys Set with Treasure Pirate Box Summer Swimming Gem Pirate Diving Toys Underwater Toy for Pool Use Treasures Gift Sets (Multicolor 30-40mm)","https://m.media-amazon.com/images/I/81+udz6uQqL._AC_UL320_.jpg","4.5","14","13.99","228"
"B0C5NNNNH2","Galvanox Replacement Net for Little Tikes Easy Score Basketball Hoop","https://m.media-amazon.com/images/I/81hNJI71VnL._AC_UL320_.jpg","4.5","13","12.94","228"
