"asin","title","imgUrl","stars","reviews","price","category_id"
"B08316P6R9","CPSYUB Matching Eggs Toys Color & Shape Recognition Sorter Puzzle, Montessori Toys for Baby Easter Travel Bingo Game, Sensory Early Learning Fine Motor Skills for Year Old Kids","https://m.media-amazon.com/images/I/61kLEH3N63L._AC_UL320_.jpg","4.8","4227","17.99","230"
"B099F1C39B","KLT Lacing Toy for Toddlers, Wooden Threading Toy Kids Travel Car Airplane Activities, Road Trip Essentials Games, Educational learning Fine Motor Skills Montessori Toys 1 Apple,1 Watermelon, 1 Cheese","https://m.media-amazon.com/images/I/71fEFSt3nvL._AC_UL320_.jpg","4.7","372","15.99","230"
"B01MSX574S","Taggies Patches Pig Lovey Soft Toy , 12 Inch (Pack of 1)","https://m.media-amazon.com/images/I/91Lhbpx1XsL._AC_UL320_.jpg","4.8","926","21.99","230"
"B074V6M74C","green sprouts Molar Teether made from Silicone | Soothes & massages baby's molar gums & teeth | Soft, flexible silicone eases pain, Easy to hold, gum, & chew, 1 Count (Pack of 1)","https://m.media-amazon.com/images/I/71Y8vq+PnYL._AC_UL320_.jpg","4.6","2744","8.99","230"
"B08DD1CTZZ","TOP BRIGHT Montessori Toys for 1 Year Old Boy Girl Toddlers, Wooden Activity Cube Toys, First Birthday Gift, Baby Toy for 12-18 Months with Bead Maze Shape Sorter","https://m.media-amazon.com/images/I/71KbulwbzNL._AC_UL320_.jpg","4.5","1572","19.99","230"
"B0CDGTBCG3","Joyreal Black and White High Contrast Baby Toys for 0 1 2 3 Months Newborn, Sensory Toys for Babies 0-6 Months with Black and White Cards for Brain Development, Montessori Toys for Infants Baby Gifts","https://m.media-amazon.com/images/I/71tcXZdeBiL._AC_UL320_.jpg","4.8","6","25.99","230"
"B00CQHYZ6K","Fisher-Price Laugh & Learn Baby Toy, Magical Musical Mirror, Pretend Vanity Set with Light Sounds and Learning Songs for Infant to Toddler","https://m.media-amazon.com/images/I/61uUjJfpu8L._AC_UL320_.jpg","4.8","4858","34.99","230"
"B09K7K2BP9","Aizweb 240pcs C-Clips Hooks Plastic Chain Links - Counting & Linking Activity Kit, Sensory Toys for Toddlers, Develops Kid's Fine Motor and Color Recognition & Sorting Skills,Educational Learning Toys","https://m.media-amazon.com/images/I/817gM8-blGL._AC_UL320_.jpg","4.6","89","19.99","230"
"B07NQ3NYXQ","Bright Starts John Deere 4-in-1 Gator Green Baby Activity Center & Push Walker with Removable Interactive Steering Wheel Toy, 6 Months and up","https://m.media-amazon.com/images/I/81FchWDneDL._AC_UL320_.jpg","4.7","1446","85.0","230"
"B09MCS29GQ","NiToy Spinning Stacking Toy for Kids, Rainbow Tower Dual-Color Spinning Wheels Premium Strong BPA-Free ABS Plastic Early Education Fun Learning and Engaging Brain Development Toys (Large 6th Floor)","https://m.media-amazon.com/images/I/61r+hJzC1zL._AC_UL320_.jpg","4.7","197","17.99","230"
"B09XHHTG4N","SYAOMUNLY Baby Toys for 1 Year Old Boy Girl Musical Learning Workbench for 2 Years Old Child Toddlers Early Education Sound Shape Toys Christmas Birthday Gift for Kids 12-18 Months","https://m.media-amazon.com/images/I/71+WNeqgDoL._AC_UL320_.jpg","4.6","261","32.99","230"
"B01MS1SYM5","Bendon Piggy Toes Press Storybook (Ten Little Ladybugs)","https://m.media-amazon.com/images/I/A1TbLEUqA9L._AC_UL320_.jpg","4.9","576","9.99","230"
"B07DB81CZQ","3pcs Bath Swimming Turtle Toy for Baby Toddler, Wind Up Chain Bathing Water Toy, Swimming Bathtub Pool Cute Swimming Turtle Toys for Boys Girls.","https://m.media-amazon.com/images/I/51k8xRxYSkL._AC_UL320_.jpg","4.4","1918","8.99","230"
"B0BMLGGR73","1 Year Old Toys for Boys - Baby Toddler Toys for Boy Gifts Pop up Toy with Music and Light for Toddlers 1-3, Early Developmental Montessori Cause and Effect Toys for Babies, Baby Gift for Boy Girls","https://m.media-amazon.com/images/I/71zGCIC53yL._AC_UL320_.jpg","4.6","209","21.99","230"
"B0BX4MC45F","Creative Kids Pull Along Sensory Box Montessori Edition - High-Contrast Black and White First Colors Plush Tissue Box 5M+","https://m.media-amazon.com/images/I/81pFZN2qFwL._AC_UL320_.jpg","4.7","28","19.99","230"
"B09GKQT7Z7","Sophie by Me 60th Anniversary Edition Teether Sensory Developmental Toy SOPHIE LA GIRAFE Beige","https://m.media-amazon.com/images/I/51u3uCXz2DL._AC_UL320_.jpg","4.6","484","21.37","230"
"B0BZT2JWPL","Learning Resources Number Nails Activity Set - 102 Pieces, Ages 4+ Toddler Learning Activities, Fine Motor Games for Kids, Math Games for Kids, for Kids","https://m.media-amazon.com/images/I/81RxoSlCtAL._AC_UL320_.jpg","4.5","49","21.99","230"
"B09NF2ZVRJ","JERICETOY Baby Car Seat Toys Stroller Toys Crib Toys Infant Activity Spiral Plush Toys Hanging Stroller Toys for Baby Car Seat Stroller Bar Crib Bassinet Mobile with Music Squeaker Rattles (Elephant)","https://m.media-amazon.com/images/I/71-psUF0TvL._AC_UL320_.jpg","4.5","495","16.99","230"
"B07G7H911N","Melissa & Doug First Play Children’s Jungle Wooden Activity Table for Toddlers Multi-color 1 EA","https://m.media-amazon.com/images/I/71KckTx4wyL._AC_UL320_.jpg","4.5","2184","45.17","230"
"B00TXQP6J2","Haba Bubble Bath Whisk, Yellow, Create Fun Bubbles in The Bathtub, Bath Toys for Toddlers, 301298, Multicolour","https://m.media-amazon.com/images/I/61lhXdLTqQL._AC_UL320_.jpg","4.5","365","11.99","230"
"B01N996VZ0","Chew Necklace, Silicone Chew Necklaces for Sensory Kids and Adults, 4 Pack Mouth Fidgets Chewy Necklace Sensory Chew Toys for Boys Girls with Autism Anxiety ADHD, BPA Free","https://m.media-amazon.com/images/I/61W8QjouuxL._AC_UL320_.jpg","4.4","844","9.98","230"
"B000GZGE3Q","Melissa & Doug Deluxe Chomp and Clack Alligator Push Toy and Activity Walker - Wooden Baby Push Walker For Ages 1+","https://m.media-amazon.com/images/I/717+YBhCPpL._AC_UL320_.jpg","4.6","2677","59.99","230"
"B06XG2LFJL","Infantino Whale Bubble Inflatable Bath Tub and Ball Set Blue, Pack of 1","https://m.media-amazon.com/images/I/71cKPCw4-4L._AC_UL320_.jpg","4.5","1527","13.99","230"
"B0C6X5GRMR","NDMUS Montessori Busy Board for Toddler | 12 LED Light Switches Wooden Sensory Board Travel Toy, Baby Road & Airplane Trip Essentials, Christmas & Birthday Gift for 1 2 3 Year Old Boys and Girls","https://m.media-amazon.com/images/I/81he436foxL._AC_UL320_.jpg","4.7","41","29.99","230"
"B000F8XF86","Learning Resources Three Bear Family Counters - 96 Pieces. Ages 3+ Preschool Learning Toys, Counting Toys for Toddler, Social Emotional Learning Toys, Therapy Tool","https://m.media-amazon.com/images/I/81j5oDYNtSL._AC_UL320_.jpg","4.9","2097","24.99","230"
"B0BZJ56ZMV","MINGKISI Toddler Montessori Toys Learning Activities Educational Dinosaur,Birthday Gifts for Baby Boys Girls 12 18 Month One Year Old,Baby Sensory Fine Motor Skills for Age 1 2","https://m.media-amazon.com/images/I/61pqr9juUML._AC_UL320_.jpg","4.6","25","8.99","230"
"B019ICGBOO","VTech Spin & Learn Color Flashlight","https://m.media-amazon.com/images/I/710z9TmeD2L._AC_UL320_.jpg","4.7","8528","14.99","230"
"B0BVYK1BGB","2 Pack Silicone Baby Teething Toys,Pacifiers for Toddlers Infant,Remote Control Shape Baby Teething Toys for Babies 6-12&12-18&18-24 Months,Remote Teether for Baby Chew Toys,Black+White","https://m.media-amazon.com/images/I/61hqT5lmE3L._AC_UL320_.jpg","4.7","124","5.99","230"
"B07DHD6FNG","QZMTOY Bead Maze Toy for Toddlers Wooden Colorful Roller Coaster Educational Circle Toys for Kids Sliding Beads On Twists Wire Training Child Attention Count and Grasping Ability (QZM-0135-Toys)…","https://m.media-amazon.com/images/I/71AZJ+ESzpL._AC_UL320_.jpg","4.5","3424","18.99","230"
"B07HQ63NBC","ETI Toys, 19 Piece Unique Educational Sorting & Matching Toy for Toddlers. Colorful Sorter Cube Box & Shapes, 100 Percent Safe, Promotes Fun Learning, Creativity & Skills Development","https://m.media-amazon.com/images/I/81IXYOypQDL._AC_UL320_.jpg","4.7","617","19.97","230"
"B0C9TMRZFL","Busy Board for Toddlers Sensory Toys - Montessori Toys for 1 Year Old - Airplane Travel Essentials for 1-4 Year Old Boys Educational Games - Preschool Learning Toys Quiet Book for Basic Dress Skills","https://m.media-amazon.com/images/I/81mCoNEEPUL._AC_UL320_.jpg","5.0","70","17.99","230"
"B08LKVN1HG","VTech Grip and Go Steering Wheel Small","https://m.media-amazon.com/images/I/71HQ7nVmoeL._AC_UL320_.jpg","4.7","539","11.89","230"
"B0BQRLV781","Wooden Activity Cube for 12-18 Month, 1 Year old Boys & Girls, 7-in-1 STEM Montessori Early Developmental Learning Toys for Kids Aged 1-2, Ideal 1st Birthday Gift Toys for Baby, Toddlers (Pink)","https://m.media-amazon.com/images/I/81XeP0K44EL._AC_UL320_.jpg","4.2","91","35.99","230"
"B0B4G13T78","Baby Toys 6 to 12 Months Dancing Music Light Toys for 1 Year Old Girl Boy, 9 6 Month Old Baby Toys 12-18 Months Baby Crawling Infant Toys 6-12 Months, 1 Year Old Toys for 1 + Year Old Girl Boy Gifts","https://m.media-amazon.com/images/I/71R13fZMLlL._AC_UL320_.jpg","4.6","881","19.99","230"
"B0C7858H8K","Whack A Mole Game, Toys for 3+ Year Old Boys/Girls, Interactive Educational Pounding Toys for Toddlers with Music & Light, PK Mode with 2 Hammers, Birthday Xmas Gifts for Boys Girls Age 3, 4, 5, 6+","https://m.media-amazon.com/images/I/81UeoVPJqTL._AC_UL320_.jpg","4.6","51","29.99","230"
"B0BVBQDVX8","Winblo Toddler Busy Board - Montessori Toys Birthday Gifts for 2 Year Old Girls, Educational Learning Sensory Book for Two Yr Old Girl, Airplane Car Travel Activities Toy for Kids Ages 2","https://m.media-amazon.com/images/I/71C1UnAE7bL._AC_UL320_.jpg","4.5","105","22.99","230"
"B0BXNP2M7C","Wooden Activity Cube Montessori Toys for 18M+ Toddlers 1-3 Learning Toys for 1 + Year Old Boys Girls Baby Sensory Interactive Toys Birthday Gift","https://m.media-amazon.com/images/I/71RO0cXq4zL._AC_UL320_.jpg","4.4","164","21.99","230"
"B08T61M735","Orbeez Water Beads, Soothing Foot Spa with 2,000 Orbeez, The One and Only, Kids Spa Sensory Toys","https://m.media-amazon.com/images/I/91GVzi4s4FL._AC_UL320_.jpg","4.1","1805","19.99","230"
"B0BW6X78Y6","TOYTELLINI Soothe & Sense Soft Security Blanket for Babies - Security Blanket with Rattle, Teether, Bunny Elephant Security Blanket Baby Boy Girl Gift, Sensory Newborn Toys 0-6 Months (Pink Bunny)","https://m.media-amazon.com/images/I/61dUfJGBngL._AC_UL320_.jpg","4.9","10","13.99","230"
"B0BC19S3R1","Ouriky Busy Board Montessori Toys for 1 2 3 Year Old Toddler Toys, Wooden Travel Toys with Light Up LED Buttons, Sound Sensory Toys for Toddlers 1-3, Educational Learning Fidget Toys Toddler Gifts","https://m.media-amazon.com/images/I/71sCaezcfAL._AC_UL320_.jpg","4.2","326","19.99","230"
"B0BZVL5TNM","ISMETACU Wooden Montessori Number Blocks for Toddlers, Counting Peg Board for Kids Age 3 4 5,Preschool Learning Toys","https://m.media-amazon.com/images/I/510FrTMWKiL._AC_UL320_.jpg","4.7","16","23.99","230"
"B07Y2Q674P","MAGIKON Wooden Counting Number Frame, 10 Rows Abacus for Kids Learning Math (11-1/2-Inch)","https://m.media-amazon.com/images/I/81371IbPVtL._AC_UL320_.jpg","4.3","922","10.9","230"
"B09TJTH5HZ","Jumble Dream Busy Cube Sensory Toys for Toddlers is a Handmade Montessori Fidget Cube - Wooden Sensory Board Activity Cube for Travel & Children with Autism & ADHD 1 2 3","https://m.media-amazon.com/images/I/81apw00mqrL._AC_UL320_.jpg","4.6","216","16.99","230"
"B093FFMQ4V","Koosh Minis 3-Pack - The Easy to Catch, Hard to Put Down Ball! - Fidget Toy - for Ages 3+ - Individual Colors May Vary","https://m.media-amazon.com/images/I/71BhLNApXjL._AC_UL320_.jpg","4.5","124","10.99","230"
"B09NLKKGQR","Coogam Unicorn Uppercase & Lowercase Letters Matching Game,13pcs Double-Sided ABC Letter Toys with 26 Alphabet Recognition Match Games Preschool Educational Montessori Toys for Toddlers Boys Girls","https://m.media-amazon.com/images/I/81seP51AxwL._AC_UL320_.jpg","4.4","245","21.99","230"
"B0BZ3ZLZZX","Letters Learning Matching Game | Fine Motor Skills Toy Set for Toddlers | 26 Alphabet Learning Toys with 52 pcs Nuts and Bolts Sorting & Stacking Toys, ABC learning Educational Montessori Toy for Kids","https://m.media-amazon.com/images/I/71zvsAlhCZL._AC_UL320_.jpg","4.7","17","18.95","230"
"B0BVHZJZJD","zaddgiuuy Dinosaur Bubble Machine Bath Toys,Automatic Bubble Maker for Toddlers,Blows Bubbles and Plays 12 Children’s Songs,Sing-Along Bath Bubble Machine Baby, Toddler Kids Bath Toys","https://m.media-amazon.com/images/I/51ExPtt9EYL._AC_UL320_.jpg","3.7","195","15.99","230"
"B09QJVG3B7","UAHAPY Baby Montessori Toddlers Toys for 1 2 3 Year Old Boy & Girl,1 Year Old Girl Gifts 1st One Christmas Birthday Gift,Wooden Preschool Educational Sensory Toys for 12-18 Months 1-3 Yr","https://m.media-amazon.com/images/I/71n6N1lz0xL._AC_UL320_.jpg","4.6","228","24.99","230"
"B09BX5C9XK","ArtCreativity 2 Inch Zombie Rubber Duckies for Kids, Pack of 12, Variety of Designs and Colors, Trick or Treat Supplies, Goodie Bag Fillers, Party Favors, Halloween Themed Bathtub Toys","https://m.media-amazon.com/images/I/61s4HabgKJL._AC_UL320_.jpg","4.6","2743","9.99","230"
"B00D3IMESM","Melissa & Doug Stack & Count Wooden Parking Garage With 10 Cars","https://m.media-amazon.com/images/I/71IouoclOnL._AC_UL320_.jpg","4.8","1398","14.99","230"
"B003N9G7AM","Nuby IcyBite Soother Ring Teether, Colors May Vary, 1 Count","https://m.media-amazon.com/images/I/61QCFzFkYRL._AC_UL320_.jpg","4.4","1411","5.78","230"
"B09KZKTY87","48 Piece Suction Cup Toys Construction Set, Silicone Building Blocks DIY Blocks Toys - Sucker Toys are Fun Bath Toys,Sensory Toy for Toddlers 3 Year Old Boys and Girls","https://m.media-amazon.com/images/I/71UYVUjscAL._AC_UL320_.jpg","4.7","228","22.99","230"
"B0CBPYSKWK","Baby Sensory Teething Toys - Baby Teether Rattle Toys - Infant Newborn Montessori Toys - Baby Gifts for Boys Girls 0 3 6 9 12 18 Months 1 One Year Old Birthday Toddlers - Baby Tummy Time Toys","https://m.media-amazon.com/images/I/71k2t9iSnEL._AC_UL320_.jpg","4.7","22","16.99","230"
"B07FZYLFHG","6pc Sensory Balls for Kids - Textured Multi Ball Set for Babies & Toddlers, Squeezy Tactile Sensory Toys with Stacking Cup, Stress Relief Toy for Kids, Easter Basket Stuffers Party Favors Gifts","https://m.media-amazon.com/images/I/61WJQjsxnhL._AC_UL320_.jpg","4.7","3388","16.98","230"
"B0BPK2GM2R","LKYOXS Montessori Toys 1 2 3 4 Years Old Boys Girls, Pull Along Walking Toys, Wooden Walking Pull Dog Toy for Baby Toddler, Walk Along Puppy Pull, Wooden Pull & Push Toy, Running Mechanical Dog MT5022","https://m.media-amazon.com/images/I/71oSE0u0MzL._AC_UL320_.jpg","4.9","53","26.99","230"
"B0BB99ND5L","Smartwo Double-Sided Busy Board, 20+ Montessori Activities Wooden Sensory Toy for Preschool Educational Learning, Train Kid’s Fine Motor, Concentration, and Life Skill Abilities","https://m.media-amazon.com/images/I/71MaWT27B0L._AC_UL320_.jpg","4.5","205","29.99","230"
"B00MIBUZHW","Baby Banana - Corn Cob Toothbrush, Training Teether Tooth Brush for Infant, Baby, and Toddler Green/Yellow Cornelius","https://m.media-amazon.com/images/I/61kruuSPtrL._AC_UL320_.jpg","4.8","1413","8.53","230"
"B08NSF7ZC9","Battat Education – Fine Motor Peg Toy for Toddlers, Kids – Montessori Toy with Pegs – Educational & Developmental Toy – Learning Ladybug – 18 Months + – Learning Ladybug","https://m.media-amazon.com/images/I/71wjX-cbalL._AC_UL320_.jpg","4.8","264","8.49","230"
"B09T2RY5XP","Teething Toys for Babies 0-6 Months 6-12 Months, Baby Teething Toys, Silicone Baby Teether Toys, Baby Chew Toys, Molar Teether, Hammer Wrench Spanner Pliers Shape Teething Toys for Boys Girls","https://m.media-amazon.com/images/I/71-vuE90VJL._AC_UL320_.jpg","4.8","643","9.99","230"
"B0BX3D6H2T","Plunack 4 in 1 Baby Toys 6 to 12-18 Months, Montessori Toys for Babies, Pull String Baby Teether, Stacking Blocks Infant Bath Toys, Color Shape Bin Sensory Toys for Toddlers 1-3 Boys Girls Gifts","https://m.media-amazon.com/images/I/714l3OyTG-L._AC_UL320_.jpg","4.4","133","32.99","230"
"B00MFP6GII","Bright Starts Giggling Gourmet 4-in-1 Shop ‘n Cook Walker Shopping Cart Push-Toy, Ages 6 months +","https://m.media-amazon.com/images/I/81F7OdalWLL._AC_UL320_.jpg","4.6","2144","49.99","230"
"B088H914CW","Bath Toys, 6 Packs Light up Boat Floating Rubber Set, Flashing Color Changing Light in Water, Tub Gift for Baby Infant Toddler Child Kid, Bathtub Ship Toy for Bathroom Shower Game Swimming Pool Party","https://m.media-amazon.com/images/I/71t+S5ZkZtL._AC_UL320_.jpg","4.5","1300","11.95","230"
"B0BHNDNBNX","Kitchen Busy Board for Toddlers 1-3 Travel Toys Light Up Musical Baby Toys 12-18 Months Toddler Toys Age 1-2 2-4 Autism Children Sensory Montessori Fine Motor Skills Car Seat Toys for 1 Year Old","https://m.media-amazon.com/images/I/71xi+wjDboL._AC_UL320_.jpg","4.3","122","27.99","230"
"B0BRPQ6BFW","KMTJT Montessori Toys for 2 Year Old | Color Sorting & Stacking Matching Toys | Learning Sorting Toys for Toddlers 1-3 Year Olds | Educational Toy Gift for 1 2 3 Year Old Boy Girl","https://m.media-amazon.com/images/I/71VN3QOmWSL._AC_UL320_.jpg","4.6","53","21.99","230"
"B09C86WC1L","Baby [Spinning, Stacking] [Toy] for Babies and [Toddler]s – Educational Interactive Learning] [Toy]s – Rainbow [Spinning] Wheel for Focus, Dexterity, Brain Development","https://m.media-amazon.com/images/I/61s+1peYo-L._AC_UL320_.jpg","4.7","469","19.19","230"
"B0BWDMP9PM","Baby Toys 6 to 12 Months - Ocean Projector Baby Light Up Toys Musical Tummy Time Infant Toys 3-6 6-12 12-18 Months 6 7 8 9 Month Old Baby Must Have Crawling Toys One Year Old Birthday Gifts Boys Girls","https://m.media-amazon.com/images/I/71WzHpDOLTL._AC_UL320_.jpg","4.5","78","21.99","230"
"B0C6DR35LF","POLKRANE Toddler Montessori Travel Toys - Wooden Busy Board with LED Light,Switch Toy for Baby Sensory Play, Educational & Learning Toys for Kids (1+), Perfect Travel Toy,Gifts for 1-3 Year Old Kids","https://m.media-amazon.com/images/I/71mAWKQJBcL._AC_UL320_.jpg","4.4","84","16.99","230"
"B0B2WKK2RP","Wdmiya Space Wooden Toys for Baby，Activity Cube for Toddlers 1-3，Sensory and Montessori Toys for Boy and Girl Educational Birthday Gifts","https://m.media-amazon.com/images/I/71JdSsabBnL._AC_UL320_.jpg","4.6","63","29.99","230"
"B0BPHWG626","Baby Car Seat Toys for Travel 6 to 12 Months, Adjustable with Musical Pedal Piano, Baby Mirror and Hanging Squeaky Sensory Soft Infant Toys, Rear Facing","https://m.media-amazon.com/images/I/71B5G0Oj2GL._AC_UL320_.jpg","3.9","88","35.99","230"
"0994606796","DITTY BIRD Learning Songs | Nursery Rhymes Book for Babies | Sound Books for Toddlers 1-3 and 2-4 | ABC Song | Musical Toys for Toddlers 1-3","https://m.media-amazon.com/images/I/71p802pqwvL._AC_UL320_.jpg","4.7","1346","20.99","230"
"B0B7P42X7V","Halloween Rubber Ducks Bulk - 24 Pack, 6 Variety Themes, 2.5"" for Halloween Party Favors for Kids, Goodie Bag Fillers, Jeep Ducking, Trick or Treat Toys for Toddlers by 4E's Novelty","https://m.media-amazon.com/images/I/81ysWy0HFyL._AC_UL320_.jpg","4.6","80","16.99","230"
"B009B73M0S","Melissa & Doug Animal Rescue Shape-Sorting Truck - Wooden Toy With 7 Animals and 2 Play Figures -Vehicle Toys For Toddlers","https://m.media-amazon.com/images/I/71yMzk7StOL._AC_UL320_.jpg","4.8","770","15.99","230"
"B09NRBQGZP","Aizweb Montessori, Stacking Toys- Wooden Burger for 3 Year Old Toddlers and Kids Preschool, Fine Motor Skill Educational Learning Toy, Blocks for Toddlers Gift","https://m.media-amazon.com/images/I/71lGIo+JM-L._AC_UL320_.jpg","4.8","340","15.99","230"
"B08T7HK1H7","30 Pcs Slingshot Dinosaur Finger Toys, Catapult Toys as Fun as Slingshot Chicken, Cute Shapes, More Colors, Great for Flying Games and Party Favors.","https://m.media-amazon.com/images/I/71yIPTOReQL._AC_UL320_.jpg","4.6","378","16.99","230"
"B0BQVJRQRZ","75 PCS Magnetic Number Bonds Set - Magnetic Numbers for Whiteboard, Number Bonds Games, Magnetic Number Line, Math Aids Accessories Supplies for Classroom, Magnetic Math Manipulatives - Simply Magic","https://m.media-amazon.com/images/I/71Y-EGYV-ZL._AC_UL320_.jpg","4.8","55","26.97","230"
"B0BG3C32X2","[8 PC] Stacking Cups for Rabbits - Wheat Straw Rabbit Toys with Cute Animal Designs - Bunny Stacking Cups to Play with Rabbits - Nesting Toys for Rabbits to Keep Busy - Graduated Sized Stackable Toys","https://m.media-amazon.com/images/I/91ogVVlj9wL._AC_UL320_.jpg","4.9","141","14.99","230"
"B00H4IQ3P2","Fat Brain Toys pipSquigz","https://m.media-amazon.com/images/I/61YzyycY-NL._AC_UL320_.jpg","4.7","2039","21.95","230"
"B0871M32D7","Baby Bath Toys, Wind up Swimming Turtle Toys for Toddlers, Floating Water Bathtub Shower Toys, Bathroom Pool Play Sets Fun Bathtime Gift for Kids Infants Boys Girls (3 Pack)","https://m.media-amazon.com/images/I/41Iu7ACKNuL._AC_UL320_.jpg","4.5","677","8.99","230"
"B0BM3S5LBZ","Silicone Baby Teething Toys,TV Remote Control Shape Teething Toys,Remote Teether for Babies 0-18 Months,BPA Free(Black)","https://m.media-amazon.com/images/I/6152qgluS+L._AC_UL320_.jpg","4.7","777","6.99","230"
"B09FZQMD6S","COLVWOFA 24 Pack Baby Rings Link Toys for Hanging Toys, Connecting Rings Toys for Infant Boy Girl, Early Learning Toys Car Seat and Stroller Travel Accessory Set with Storage Box","https://m.media-amazon.com/images/I/61DupYNVdAL._AC_UL320_.jpg","4.8","674","9.99","230"
"B0BVPMB1NK","SASSY Crinkle Ball","https://m.media-amazon.com/images/I/71v841dcBtL._AC_UL320_.jpg","4.6","34","10.99","230"
"B07WJ1FJVQ","Factory Direct Partners 11619-CTGN SoftScape Toddler Playtime Corner Climber, Indoor Active Play Structure (4-Piece Set) - Contemporary/Green","https://m.media-amazon.com/images/I/712o6PAXlSL._AC_UL320_.jpg","4.8","3834","123.1","230"
"B0845MPGHS","Educational Insights Kanoodle Flip 3-D Brain Teaser Puzzle Game for Kids, Teens And Adults, Featuring 100 Challenges, Ages 7+","https://m.media-amazon.com/images/I/71+W8xx6RJL._AC_UL320_.jpg","4.5","442","13.97","230"
"B0B6J2FJ8M","Montessori Toys for 1 Year Old, Baby Sensory Toys 6-12-18 Months, Octopus Silicone Pull String Learning Toys, Bath Travel Teething Toys for Toddlers 1-3, Christmas Birthday Gifts for Boys and Girls","https://m.media-amazon.com/images/I/71D-EQ8arUL._AC_UL320_.jpg","4.7","358","7.99","230"
"B0C9PDSGGL","Toddler Busy Board Montessori Toys for 1 2 3 4 5 Year Old Boys Girls, Busy Board Educational Travel Toys 1-3, Sensory Toys for Toddlers, Activities Learning Fine Motor Skills(3 Pages)","https://m.media-amazon.com/images/I/81WQpfvbcQL._AC_UL320_.jpg","4.5","29","16.98","230"
"B08DKN1KZV","Smart Steps by Baby Trend STEM Jerry Giraffe Rattle and Teether","https://m.media-amazon.com/images/I/61clCnUocLL._AC_UL320_.jpg","4.7","4801","5.65","230"
"B09QWZ85VX","Baoniu Foldable Climbing Triangle Ladder Toys with Ramp for Sliding or Climbing, Set of 3 Wooden Safety Sturdy Kids Play Gym, Indoor Outdoor Playground Climbing Toys for Toddlers","https://m.media-amazon.com/images/I/61+hEV6DVLL._AC_UL320_.jpg","4.4","738","169.99","230"
"B0BQ8GF4XL","Learning Resources Mini Number Treats, 40 Pieces, Ages 3+, Cookies Toys, Counting and Colors Recognition, Fine Motor Skills Toys, Montessori Toys for Kids","https://m.media-amazon.com/images/I/61UNHDYEv3L._AC_UL320_.jpg","4.5","99","17.99","230"
"B00I0CEEOI","Learning Resources Smart Snacks Rainbow Color Cones - 12 Pieces, Ages 18+ months Toddler Pretend Play Toys, Fine Motor Skills Toys, Preschool Learning Toys","https://m.media-amazon.com/images/I/81qTtAVqL1L._AC_UL320_.jpg","4.6","2257","24.98","230"
"B0BXL4FC7D","ERSIHUA 2-Pack Silicone Baby Teething Toys, TV Remote Teethers for 6-12-18 Months Infant, Fire Remote Shape Toddlers Silicone Teethers for Boys and Girls Sensory Toy(Black+Blue)","https://m.media-amazon.com/images/I/611fWHW8xuL._AC_UL320_.jpg","4.8","305","8.29","230"
"B0BRYVK7Z1","Sesame Street 5 Piece Finger Puppet Set - Party Favors, Educational, Bath Toys, Floating Pool Toys, Beach Toys, Finger Toys, Playtime","https://m.media-amazon.com/images/I/71N1QHDVGVL._AC_UL320_.jpg","5.0","5","7.75","230"
"B0BWFDRCQ6","Oarifun Tummy Time Mirror, Baby Tummy Time Toys 0-6 Months with Soft Book, Black and White High Contrast Baby Toys, 3D Activity Sensory Montessori Toys Crawling Activity Mat for Boys Girls","https://m.media-amazon.com/images/I/81XE+A2l1AL._AC_UL320_.jpg","4.6","23","17.99","230"
"B088K9YVFV","Battat – 10 Bath Boats – Numbered & Stackable Bathtime Toys – Floating Toy Boats for The Bath, Pool, Beach – Educational Toys – 6 Months + – Stackin’ Boats","https://m.media-amazon.com/images/I/71e5lj0oAwL._AC_UL320_.jpg","4.7","632","6.99","230"
"B09HW6BKLR","The Peanutshell Tummy Time Water Play Mat for Baby Girls | Inflatable Sensory Development Toy & Tummy Time Mat","https://m.media-amazon.com/images/I/7181sWwzs1L._AC_UL320_.jpg","4.4","332","14.99","230"
"B01NANLCT1","Learning Resources Birds in a Nest Sorting Set, Fine Motor Set, Color Sorting Set for Toddlers, 36 Pieces, Ages 3+","https://m.media-amazon.com/images/I/81wU-VLrp1L._AC_UL320_.jpg","4.8","2501","15.2","230"
"B0BVPB1PP8","SASSY Mischievous Matching Mushrooms Toy","https://m.media-amazon.com/images/I/611hUmbWbTL._AC_UL320_.jpg","4.8","117","14.77","230"
"B0BRT15GSZ","PUTSKA Busy Board for Toddlers 2-4, Sensory Toys Montessori Busy Book for Toddlers 1-3, Airplane Travel Essentials Kids, Quiet Book, Educational Toys for 2 Year Old","https://m.media-amazon.com/images/I/71CwlxhwZBL._AC_UL320_.jpg","4.6","164","21.99","230"
"B08TTCTTK1","Kidoozie Press 'n Tumble Activity Dome - Colorful Spinning Faces Activity Toy for Children 9-24 Months – Perfect for Fine Motor Skills and Visual Development!","https://m.media-amazon.com/images/I/71nYS1vCCYL._AC_UL320_.jpg","4.5","68","14.99","230"
"B0C9LPHFYR","Wolmund Toy Learning Play Cell Phone with 8 Functions and Dazzling Lights Interactive Toy for Toddler Baby Kids Boys Girls","https://m.media-amazon.com/images/I/61cAhdzblOL._AC_UL320_.jpg","4.3","281","8.99","230"
