"asin","title","imgUrl","stars","reviews","price","category_id"
"B0BTC3XLWP","Lobyoh Baby Piano Mat with 38 Sounds, Musical Toys Floor Piano Play Mat Keyboard Dance Mat for Toddlers Boys Girls 1 2 3 4 5 Years Old","https://m.media-amazon.com/images/I/71r5sHu1VyL._AC_UL320_.jpg","4.3","259","19.99","270"
"B0BFHT1CHC","12V Kids Charger for Ride On Toys Car 12 Volt Battery Class 2 Power Supply for Best Choice Products Electric Ride On Car Farm Tractor SUV","https://m.media-amazon.com/images/I/71C7idT5iqL._AC_UL320_.jpg","4.2","68","12.98","270"
"B0B1J3CL3J","KaeKid Birthday Cake Toy Pretend Play Tea Set with Lights & Music, DIY Cutting Play Food with Bread Roll, Chocolate, Sandy & Dessert, Gift for Girls Boys 3 4 5 Years Old (82 PCS)","https://m.media-amazon.com/images/I/71Y-6yXG7IL._AC_UL320_.jpg","4.1","64","15.99","270"
"B095W9HS3N","BBtinker Wooden Fire Station Playset, Multicolor 3-Level Pretend Play Dollhouse with Figures, Truck, Helicopter and Accessories, Preschool Learning Educational Toys for Toddlers Kids Age 3 and up","https://m.media-amazon.com/images/I/61SLA8ZnzZS._AC_UL320_.jpg","4.3","90","36.99","270"
"B08CTCBHPW","OZMI Upgrade Kids Camera for Boys, Christmas Birthday Gift for Boys Age 3-12, 2 Inch HD Video Digital Cameras for Kids Toddler, Toy for 3 4 5 6 7 8 9 10 Year Old Boy with 32GB SD Card - Blue","https://m.media-amazon.com/images/I/61x73osMN5L._AC_UL320_.jpg","4.3","835","29.99","270"
"B094J2R97K","Kids Doctor Kit for Toddlers 3-5 Boys Girls,32 Pcs Toddler Dress Up Pretend Play Dentist Medical Kit Kids Doctor Playset with Stethoscope Costume Gifts Educactional Toys for 3 4 5 Year Old Boys Girls","https://m.media-amazon.com/images/I/71joIOCjsxL._AC_UL320_.jpg","4.6","196","24.99","270"
"B0C4KHDL1Q","pxton Waterproof walkie talkies Long Range for Adults, Work,and Outdoor with earpieces and Fast Charger Dock，Handheld Two Way Radio Rechargeable NOAA walkie Talkie (6 Pack)","https://m.media-amazon.com/images/I/61N-E4CgKLL._AC_UL320_.jpg","4.3","157","84.99","270"
"B09NRXJF1Z","Matchbox Cars, Mbx Electric Drivers Toy Electric Vehicles in 1:64 Scale, Plastic Free Packaging (Styles May Vary), Medium, Multicolor, Set of 12","https://m.media-amazon.com/images/I/91q6rdaMfQL._AC_UL320_.jpg","4.7","218","15.97","270"
"B09PH4SGY9","Ziegoal Kids Smart Watch for 3-12 Year Old Girls HD Dual Camera with Game Toddler Unicorn Birthday Multifunction Touch Screen Learning Educational Toys for Girls Age 3 4 5 6 7 8 9 10","https://m.media-amazon.com/images/I/71J-Z3Up+OL._AC_UL320_.jpg","4.3","296","31.98","270"
"B00362TVN6","DELUXE BAG OF CLASSIC TOY GREEN ARMY SOLDIERS - 36 Pc.","https://m.media-amazon.com/images/I/613lVDYkkbL._AC_UL320_.jpg","4.4","2893","6.25","270"
"B09JDJZQS5","Spider-Man Marvel Vs Venom Battle Packs, 6-Inch-Scale and Venom Action Figure 2-Pack, Toys for Kids Ages 4 and Up","https://m.media-amazon.com/images/I/51OET3AHVOL._AC_UL320_.jpg","4.7","228","21.02","270"
"B0B6CBC285","Baby Sensory Toys, Montessori Pull String Airplane Travel Toys for Toddlers 1-3, Montessori Toys for Babies 6-12 Months UFO Silicone Pull String Activity Toy Dawnier Pull Toy","https://m.media-amazon.com/images/I/71NZA2urTsL._AC_UL320_.jpg","4.6","356","12.49","270"
"B07PY4QTN9","Osmo - Super Studio Disney Frozen 2 - Ages 5-11 - Learn to Draw - For iPad or Fire Tablet Educational Learning Games - STEM Toy Gifts for Kids, Boy & Girl - Ages 5 6 7 8 9 10 11 (Osmo Base Required)","https://m.media-amazon.com/images/I/91SJQup1fqL._AC_UL320_.jpg","4.6","4505","29.99","270"
"B010LD0QTA","Juvale 100 Pack Colorful Bouncy Balls Party Favors for Kids Aged 5+, Rubber Super Bounce Balls Bulk for Birthday, Prizes, Gifts (Neon Colors, 1 inch)","https://m.media-amazon.com/images/I/61xehP57xwL._AC_UL320_.jpg","4.6","481","14.99","270"
"B0B5MK41X4","Finger Skateboards, MOMSIV Mini Finger Toy Skateboard Park Ramp Kit Fingerboard Half Pipe Ultimate Parks Training Props Accessories for Kids Adult 6 in 1","https://m.media-amazon.com/images/I/81Lxt1YoUXL._AC_UL320_.jpg","4.3","2456","48.99","270"
"B0C5RDGYS3","Mostop Medieval Castle Knight Toy Solider Army Figures Toy, DIY Assembled Castle Model Knight Game Soldier Building Kit with Castle,Cavalry and Arrow Tower Simulated Siege War of Attack","https://m.media-amazon.com/images/I/71jY43DUrXL._AC_UL320_.jpg","4.2","15","31.99","270"
"B09QVGDNX6","Power Rangers Dino Fury Spiral Strike Red Ranger, 12-inch Action Figures, Electronic Spinning and Light FX, Toys for 4 Year Old Boys and Girls and Up","https://m.media-amazon.com/images/I/714qXhNWBxL._AC_UL320_.jpg","4.6","96","19.75","270"
"B0C38GVKP4","Kidsciety Pretend Play Kitchen Accessories, 52pc Kids Kitchen Playset with Play Food, Stainless Steel Cookware, Kitchen Toys Pots and Pans, Toddler Kitchen Set with Cuttable Toy Food, Boys Girls Gift","https://m.media-amazon.com/images/I/81PBnPf9eDL._AC_UL320_.jpg","4.5","36","21.99","270"
"B085WSQGXF","Wall Clock for Kids with Silent Non Ticking Sweep Quartz Mechanism Easy to Read Learn to Tell Time 12 Inch Diameter","https://m.media-amazon.com/images/I/71r7qysfIGL._AC_UL320_.jpg","4.5","2138","15.88","270"
"B09JLRKHW7","30Pcs Squishies Mochi Squishy Toy Kids Party Favors Kawaii Squishy Animal Squishy Stress Relief Toy Easter Egg Fillers Kid Birthday Party Favor Goodie Bag Xmas Stocking Stuffer Piñata Class Prize Gift","https://m.media-amazon.com/images/I/71uZbcQtXkL._AC_UL320_.jpg","4.6","557","9.99","270"
"B09PGS2RKK","L.O.L. Surprise Tweens Babysitting Sleepover Party (2 Dolls) with 20 Surprises- 1 Fashion Doll & 1 Collectible Doll, Holiday Toy Playset, Great Gift for Kids Ages 4","https://m.media-amazon.com/images/I/61NiJSSOEqL._AC_UL320_.jpg","4.8","909","29.99","270"
"B01FAPXJ2A","Fisher-Price Little People Toddler Race Track Playset Sit ‘n Stand Skyway, 34+ Inches Tall, 2 Toy Cars for Ages 18+ Months (Amazon Exclusive)","https://m.media-amazon.com/images/I/51CWb0iw1sL._AC_UL320_.jpg","4.7","3017","42.99","270"
"B00JEWFJJC","4M 5576 Table Top Robot - DIY Robotics Stem Toys, Engineering Edge Detector Gift for Kids & Teens, Boys & Girls (Packaging May Vary)","https://m.media-amazon.com/images/I/81Bkx72QK6L._AC_UL320_.jpg","4.4","6073","17.99","270"
"B0BR5BZ2FJ","Kids Makeup Kit for Girl Toys - 52PCS Toys for Girls,Real Washable Makeup Little Girls Princess Gift,Toddler Play Make Up Toys Makeup Vanities for Princess Girls Children Age 4 5 6 7 8 9 Birthday Toy","https://m.media-amazon.com/images/I/81cwwC816qL._AC_UL320_.jpg","4.8","47","19.99","270"
"B07J4ZFMDD","AIXINI Plush Unicorn Stuffed Animal Pillows Toy, 11.8 Inch Cute Soft Pink Unicorn Plushie with Rainbow Wings Gifts for Girls","https://m.media-amazon.com/images/I/51X76IsnRuL._AC_UL320_.jpg","4.3","2670","13.99","270"
"B0C58GFH4Z","OUOZZZ Soft Baby Doll for Girls - My First Baby Doll Birthday Gifts for Girls Plush Rag Dolls Tulip Pink Dress Toy for Toddlers Kids Infants 10""","https://m.media-amazon.com/images/I/71okOl8f7iL._AC_UL320_.jpg","4.8","836","18.99","270"
"B08HYV9D1C","Temi Kitchen Playset for Kids, 56 PCS Play Kitchen Toys Accessories Set with Realistic Lights & Sounds Pretend Play Birthday Gift for 3+ Year Old Toddlers Girls - Pink","https://m.media-amazon.com/images/I/713pxHKMr7L._AC_UL320_.jpg","4.3","1866","39.99","270"
"B08TTJ7LWX","Gabby's Dollhouse, Sweet Dreams Bedroom with Pillow Cat Figure and 3 Accessories, 3 Furniture and 2 Deliveries, Kids Toys for Ages 3 and up","https://m.media-amazon.com/images/I/7175qRIYOhL._AC_UL320_.jpg","4.8","1881","15.8","270"
"B0C5SHLW24","CYHO World Globe, DIY Self-Assembly Constellation Globe for Kids Learning, 8 Inch Metal Bracket Children's Puzzle 360° Rotating Globe for Classroom, USB Power Supply","https://m.media-amazon.com/images/I/81Q8G6PsMeL._AC_UL320_.jpg","4.4","373","39.99","270"
"B0CB1MR6DQ","SunnyMemory Halloween Party Favors, 228PCS Halloween Toys Bulk, Halloween Goodie Bag Fillers, Halloween Party Supplies Decorations, Halloween Gifts Crafts for Kids Games Prizes Pinata","https://m.media-amazon.com/images/I/81HRA+lrTPL._AC_UL320_.jpg","4.7","9","17.99","270"
"B0C89X3V1C","Pop Tubes, Telescopic Suction Cup Robot Toys, Robot Pop Tubes, Fidget Tubes, Sensory Toys Pack, Shape Changing Telescopic Tube Imaginative Play Stimulating Creative Learning Fidget Toys for Girls Boys","https://m.media-amazon.com/images/I/71sjYT771dL._AC_UL320_.jpg","4.2","22","16.59","270"
"B0B9PW6MPS","Hot Wheels Batman 5-Pack, Set Of 5 Batman-Themed Toy Cars In 1:64 Scale (Styles May Vary)","https://m.media-amazon.com/images/I/71phsL4uzBL._AC_UL320_.jpg","4.8","206","11.99","270"
"B09BKBPZDZ","L.O.L. Surprise! Me & My Lil Sis & Lil Pet Color Change Surprise™ with 10 Surprises - Great Gift for Kids Ages 4+","https://m.media-amazon.com/images/I/81BmYhLg3mL._AC_UL320_.jpg","4.7","1452","14.99","270"
"B086VGR86Q","JC Toys - La Newborn Nursery | 7 Piece Doll Gift Set | 12"" Life-Like Asian Doll with Accessories | Purple | Ages 2+ (18346)","https://m.media-amazon.com/images/I/51TT4xdQgsL._AC_UL320_.jpg","4.7","2042","15.99","270"
"B0933B2KHJ","BEESTECH Montessori Toddler Wooden Puzzles, Education Learning Toys Shapes Puzzles for Toddlers Boys Girls 2, 3, 4, 5, 6 Years Old, Sorting and Stacking Toddler Games, IQ Puzzles Toddler Toy","https://m.media-amazon.com/images/I/61q3lHa3FmL._AC_UL320_.jpg","4.7","179","8.88","270"
"B0C38F4DGG","OMGJS Shovelwares Brain Game Plush,Soft Banana Plush Toy for Fans Gift,Soft Stuffed Animal Figure Doll for Kids and Adult","https://m.media-amazon.com/images/I/71jCWLfKTQL._AC_UL320_.jpg","4.4","16","43.99","270"
"B0922XL5F7","TEKFUN Toddler Toys for Boys 3 4 5 6 7 Year Old, 8.5"" LCD Writing Tablet Doodle Board, Color Drawing Pad for Kids Doodle Board, Educational Boys Gifts Toys for 3-8 Year Old Girls Boys (Blue Dinosaur)","https://m.media-amazon.com/images/I/71jgBLVCXhL._AC_UL320_.jpg","4.5","4761","15.99","270"
"B0BBF7F4WY","Galaxy Slime Kit 12 Pack, Mini Slime Easter Party Favor for Kids Goodie Bag Stuffers, Smooth, Soft and Non Sticky, Stress & Anxiety Relief Colorful Slime Pack Toy for Girls Boys","https://m.media-amazon.com/images/I/716v1NWJiWL._AC_UL320_.jpg","4.3","192","9.98","270"
"B08W23374X","National Geographic Kids Tub of Realistic Dinosaur Toy Figures, Packaging from Recycled Material, Storage Container, Kids Toys for Ages 3 Up, Amazon Exclusive","https://m.media-amazon.com/images/I/81MxJOaeM0L._AC_UL320_.jpg","4.8","481","6.95","270"
"B0C99BJ42P","JoyCat Gemstone Dig Kit, Excavate 18 Gems from The Solar System, Gem Digging Kit for Kids Age 6-8-12, Space Planet Toys STEM Science Kits Christmas Birthday Gift for Boys Girls","https://m.media-amazon.com/images/I/81Hz1rX0xfL._AC_UL320_.jpg","4.8","10","19.99","270"
"B0C48TRG9M","Outer Space Party Favors Galaxy Theme Slap Bracelet Temporary Tattoos Gift Bags Plastic Straws Rocket Flashlights Keychain Bouncy Ball Spaceship Car Toys for Kids Astronaut Theme Birthday Party Goodies Bag Fillers","https://m.media-amazon.com/images/I/91eODKKB7+L._AC_UL320_.jpg","3.7","7","18.99","270"
"B0BZCMYCVK","Montessori Toys for 1 2 3 Year Old, Stacking Toys for Toddlers Infant Beach Toys Shape Sorter Counting, Matching & Sorting Early Learning Christmas Birthday Gift for Boys Girls Age 12-18 Months","https://m.media-amazon.com/images/I/71Ouvy28gEL._AC_UL320_.jpg","4.6","33","8.99","270"
"B09B2LDGC5","Gabby's Dollhouse, Purr-ific Plush Toys 2-Pack with Cakey Cat and Mercat, Kids Toys for Ages 3 and up","https://m.media-amazon.com/images/I/81gufSfcr5L._AC_UL320_.jpg","4.8","5480","20.99","270"
"B099ZZ89M4","Disney Frozen 2 Queen Elsa Shimmer Fashion Doll, Removable Clothes and Accessories, Long Blonde Hair, Toy for Kids 3 Years Old and Up","https://m.media-amazon.com/images/I/61HKiAAY0PL._AC_UL320_.jpg","4.5","229","12.95","270"
"B09LYLNWCV","Funto Washable Finger Paint for Kids, Safe & Non-Toxic Finger Painting for Toddlers 1-3, Bath Paint, Toddler Art Supplies, Age 1 2 3 4 5 6+, 10 Assorted Colors(2.1 fl.oz)","https://m.media-amazon.com/images/I/71+fuGvk2IL._AC_UL320_.jpg","4.6","444","24.99","270"
"B0C72GXL24","OUOZZZ 15"" Soft Baby Doll for Girls - First Baby Doll Plush Doll Sleeping Cuddle Buddy Doll Black Braided Mermaid Toy Doll for Kids","https://m.media-amazon.com/images/I/71upasL7lOL._AC_UL320_.jpg","4.8","805","19.99","270"
"B0BRRGL6RR","MIAODAM Bunny Stuffed Animal, Children Songs & Lullabies Peek-A Boo Toy Repeats What You Say, Talking Toys Singing with Floppy Ears for 0-6 6-12 Months 1-3 4+ Year Old Boys Girls Toddler (Pink)","https://m.media-amazon.com/images/I/71Gl7c78QBL._AC_UL320_.jpg","4.3","55","22.99","270"
"B0C3L5P7MZ","VIAMAZ Toy Cars 1:55 Scale Die-Casting Car Metal Alloy for Boy and Kids Toy, Color Box Packing for Your Son Birthday Gift, Safety Toy Cars for 3 4 5 6 7 8 Years Old Kid (The_Piston Cup)","https://m.media-amazon.com/images/I/31QvWdT64+L._AC_UL320_.jpg","4.4","58","11.99","270"
"B0BYNQMV1X","Slot Car Race Track Sets for Boys Kids High-Speed Battery or Electric Race Car Track with 4 Cars, Dual Racing Game 2 Controllers Lap Counter Circular Overpass Track, Toys Gifts for 6 7 8-12 Boys Girls","https://m.media-amazon.com/images/I/81Xgo+ziH7L._AC_UL320_.jpg","3.7","697","49.99","270"
"B09N8JZFQG","AONGAN Interactive Robot Toy - Remote Control, Dancing, Singing, LED Eyes, USB Charging, Engaging Gift for Kids 3-9 Years (Green)","https://m.media-amazon.com/images/I/61iM9BK4lgL._AC_UL320_.jpg","4.4","286","26.99","270"
"B012E7Q7C6","TOWO Wooden Giraffe Alphabet Blocks and Number Blocks Jigsaw Puzzle 41 cm Large Size 2 in 1 ABC Number Puzzle - Wooden Letter Blocks Puzzle Number Puzzles Educational Toys for 3 Year olds","https://m.media-amazon.com/images/I/81V4UqRB9iL._AC_UL320_.jpg","4.6","2834","13.99","270"
"B0C7M8NYLH","Wbzle Space Shuttle Rocket Toys - Rocket Ship Toy with Astronaut Figure and Spray Effects, Aerospace Toys with Lights and Sounds - Fun Space Gifts Toys for Space Exploration, Space Knowledge Toys","https://m.media-amazon.com/images/I/81zl6ZqeqmL._AC_UL320_.jpg","4.3","20","36.99","270"
"B07QD74JDK","CatToysOfficial Gazillion Cat Construction Tough Rigs 15"" Dump Truck & Excavator Toys 2 Pack, Ages 3+, Yellow","https://m.media-amazon.com/images/I/71Qb7cbr4IL._AC_UL320_.jpg","4.7","1003","39.99","270"
"B087P1MGZF","Dinosaur Toys, 260 Pcs Dinosaur Car Race Track Toy with 3 Cars Playset, Includes 250 Flexible Train Track, 7 Dinosaur and 2 Dinosaur Head Best Gift for Boys Girls Ages 3 4 5 6 7Years Old and Up","https://m.media-amazon.com/images/I/81mNJtpfe7L._AC_UL320_.jpg","4.4","1238","37.98","270"
"B07BF2KCZQ","Battat - Musical Tea Playset - Kids Tea Party Set and Teapot with Sounds for Kids Age 3 Years+","https://m.media-amazon.com/images/I/71-P8cn-8LL._AC_UL320_.jpg","4.7","1060","10.95","270"
"B01LXODXIF","Radio Flyer 500 With Ramp, Toddler Ride On Toy, Ages 3-5, Red Kids Ride On Toy","https://m.media-amazon.com/images/I/71NVSFNTCnL._AC_UL320_.jpg","4.7","2086","109.99","270"
"B0BC12Q6WP","BEZGAR Dinosaur Monster Trucks for Boys 4-7, 2.4Ghz Amphibious Remote Control Car with Light & Spray Function,Waterproof RC Boat Summer Beach Pool Gift,Dinosaur Toys for 3 4 5 6 7 8 Year Old Boy Girl","https://m.media-amazon.com/images/I/91nukt96U6L._AC_UL320_.jpg","4.4","132","34.99","270"
"B00005BVRQ","Melissa & Doug Abacus - Classic Wooden Educational Counting Toy With 100 Beads","https://m.media-amazon.com/images/I/816QOABcJUL._AC_UL320_.jpg","4.8","21009","15.99","270"
"B0BX9D7QLT","Bey Battling Tops Burst Toy Game Set 4 Spinning Metal Fusion Tops 2 Launchers Battle Gyro Battling Tops 1 Arena Great Birthday Gift for Children Kids Boys Ages 6+","https://m.media-amazon.com/images/I/819hrx5jvqL._AC_UL320_.jpg","4.2","145","19.99","270"
"B0BSB6KPMZ","ForeverElla 12Pcs Silicone Tea Party Set for Little Girls - Pretend Play Eco-Friendly, BPA Free Kids Tea Set - Dishwasher Safe Tea Set for Toddlers - Won't Break Like Plastic or Porcelain Toys","https://m.media-amazon.com/images/I/71YcPiv-AfL._AC_UL320_.jpg","4.5","17","32.99","270"
"B087M8BS1L","NINE CUBE Kids Camera Little Toys Camera for 3-7 Year Old Girls,Toddler Video Recorder 1080P 2 Inch,Children Digital Camera Birthday Festival Gift for 3 4 5 6 7 Year Old Boys(32G SD Card)","https://m.media-amazon.com/images/I/61WEOCMaGmL._AC_UL320_.jpg","4.2","2928","29.99","270"
"B07TT7LRR6","JC Toys - Lots to Love Babies 14"" All Vinyl Doll | 4 Piece Bath Time Gift Set | Posable & Waterproof | Ages 2+ Pink","https://m.media-amazon.com/images/I/61koiaSi19L._AC_UL320_.jpg","4.6","396","17.87","270"
"B0BBQJL974","Japace Montessori Toys for Toddlers 1-3-5, Travel Toys Road Trip Airplane Activities with 2 Busy Books, Learning & Education Toys Gifts for Kids","https://m.media-amazon.com/images/I/81Rr2tdPKZL._AC_UL320_.jpg","4.2","85","19.99","270"
"B0858MYF21","LEGO DC Batboat The Penguin Pursuit! 76158 Top Batman Building Toy for Kids, with Super-Hero Minifigures, 2 Boats, a Batarang and an Umbrella, Great Holiday or Birthday Gift (54 Pieces)","https://m.media-amazon.com/images/I/81df9hjDumL._AC_UL320_.jpg","4.8","4900","34.97","270"
"B0BBGMS1YT","100 Piece Halloween Puzzles for Kids Ages 4-8, 8-10, Halloween Night Pumpkin Vampire Witch Puzzles for Kids, Children Learning Educational Puzzles Toys Family Game Halloween Toys Gift for Boys Girls","https://m.media-amazon.com/images/I/71gFG8edj2L._AC_UL320_.jpg","4.6","74","10.99","270"
"B0BKH8ZRRS","Teenage Mutant Ninja Turtles: Mutant Mayhem Pizza Fire Delivery Van by Playmates Toys","https://m.media-amazon.com/images/I/81-fZbYyhZL._AC_UL320_.jpg","4.6","97","37.99","270"
"B0C6T9TY3N","24V Charger for Kids Ride On Car Toys 24 Volt Battery Charger Wrangler SUV Kid Trax Dynacraft Toy Car Jeep ATV Quad Disney Electric Ride-On Charger 24V Battery Charger","https://m.media-amazon.com/images/I/81gYEfT0KDL._AC_UL320_.jpg","3.9","8","14.88","270"
"B09NSN7Z6M","Canuan 20-in-1 Busy Board for Toddlers 2-4 Travel Toy Activity Board for Fine Motor Skills Busy Board Toys for 3 Years Old Kids with Switch, Locks, Shoe Laces, Music Box","https://m.media-amazon.com/images/I/8199Tr9LGGL._AC_UL320_.jpg","4.5","23","56.89","270"
"B09NQMS152","Animal Island Aila Sit & Play Plus Preschool Learning System Essential for Toddlers 12-36 Months Letters (Aila Plus 250 Words Book)","https://m.media-amazon.com/images/I/71yod7inOmL._AC_UL320_.jpg","4.4","1891","229.0","270"
"B09KS7SWJP","Tooty Transparent Train Toy - Fun and Interactive Electric Train Toy for Kids - Music Train with LED Light up - Colorful Moving Gears -Tummy Time Crawling BabyToys for Boys Girls","https://m.media-amazon.com/images/I/71pSnyiDwPL._AC_UL320_.jpg","4.6","33","15.98","270"
"B0B4J6DC58","Arulis Amphibious Remote Control Car, 2.4Ghz 4WD Double Sided 360° Rotating RC Stunt Car, Remote Control Boat with Gesture Sensor, Toy Cars Gifts for 3 4 5 6 7 8+ Year Old Boys, Pool Water Beach Toy","https://m.media-amazon.com/images/I/81LJfLcHCRL._AC_UL320_.jpg","4.0","516","27.99","270"
"B0842SVVJ7","Fisher-Price Laugh & Learn Baby To Toddler Toy Play & Go Keys With Lights & Music For Pretend Play Ages 6+ Months,Yellow/ Green/ Black","https://m.media-amazon.com/images/I/61gtyZO5qmL._AC_UL320_.jpg","4.7","1564","9.97","270"
"B0BNMZXJJN","Wvowgrh Anime Cartoon Throw Blanket Ultra Soft Micro Fleece Blanket Lightweight Cozy Air Conditioner Blanket for Kids Adults for Couch Bed Sofa(50x60inch)","https://m.media-amazon.com/images/I/71BWAgiZO0L._AC_UL320_.jpg","4.8","13","28.99","270"
"B07VN75JFC","Science Kit for Kids - 21 Experiments Science Set, Great Gifts for Kids Ages 4-8","https://m.media-amazon.com/images/I/81rL6WqwhML._AC_UL320_.jpg","4.5","7102","13.71","270"
"B091M43XW3","Learning Resources Pocket Animal Playsets, Imaginative Play, Three Sets in one—Ocean Animals, Farm Animals, and Dinosaurs!, Encourages Imaginative Play, Ages 3+","https://m.media-amazon.com/images/I/81Em2u7QqpL._AC_UL320_.jpg","4.7","301","18.39","270"
"B09685CCDZ","COSUSKET Kids Spiderman Throw Blanket, Signed Jointly 3D Cartoon Embroidery Sherpa Blanket Boys Gifts","https://m.media-amazon.com/images/I/61E-ne1upOL._AC_UL320_.jpg","4.8","2802","32.99","270"
"B07VVH6GGW","Wacky Tracks Sensory Fidget Toys Snap and Click Fidget Cube Puzzles Bulk Set of 6 by Neliblu- ADHD, Autism, Stress Relief Therapy - Fidget Toys for Sensory Kids, Keeps Fingers Busy and Minds Focused","https://m.media-amazon.com/images/I/71GhlOaUWnL._AC_UL320_.jpg","4.6","1631","6.99","270"
"B0B7JR2PCD","FUNLIO 7-in-1 Wood Indoor Playground for Toddlers 2-5, Montessori Climbing Toys with Solid Pine Wood, Indoor Jungle Gym for Kids with Swing/Slide/Climbing Rock/Net/Ladder/Monkey Bars/Gymnastic Rings","https://m.media-amazon.com/images/I/718HuIBonrL._AC_UL320_.jpg","3.9","43","179.99","270"
"B0BXJPF549","AthomBear Wooden Busy Board for Toddlers 1 2 3 4, Montessori Toy with Gift Box & Sticker, Travel Toddler Busy Board for 1 Year Old, Montessori Activity Board with 10 Learning Activities","https://m.media-amazon.com/images/I/91+6-21UWKL._AC_UL320_.jpg","4.4","46","29.95","270"
"B0969LML5H","Garden Rake Leaf, 1.1"" Diameter Pole & 6 FT Tall Stainless Steel Heavy Duty Adjustable Long Handle Garden Rake , Use for Yard Garden Lawn and Window Leaves（25 Tines）","https://m.media-amazon.com/images/I/51c4W-LtFsL._AC_UL320_.jpg","4.5","431","25.99","270"
"B079KDM7GW","Imaginext DC Super Friends Batman Toy, Wayne Manor Batcave Playset with Batman Figure & Accessories (Amazon Exclusive)","https://m.media-amazon.com/images/I/71954SzREzL._AC_UL320_.jpg","4.8","2732","49.68","270"
"B07NNPQW4R","Hoovy Inflatable Bouncy Unicorn with Pump | Bouncing Unicorn Ride on Toy for Kids | Unicorn Jumping Hopper Gift for Toddlers & Children | Portable & Travel Friendly (White)","https://m.media-amazon.com/images/I/61-1VaKZXAL._AC_UL320_.jpg","4.5","719","29.99","270"
"B08BSJFY4N","Disney Junior Mickey Mouse Handy Helper Tool Bucket Construction Role Play Set, 25-pieces, Officially Licensed Kids Toys for Ages 3 Up by Just Play","https://m.media-amazon.com/images/I/81A6gxRxtpL._AC_UL320_.jpg","4.6","3809","9.84","270"
"B09RV92FN3","Atlasonix Giant Bubble Wand, Giant Bubble Maker, Big Bubble Wand, Large Bubble Wand, Bubble Sticks, Outdoor Toys for Kids, Bubble Kit, 4 Wands & Bubble Mix for Making 2 Gallons of Bubble Solution","https://m.media-amazon.com/images/I/71GFwXgdduL._AC_UL320_.jpg","4.2","2480","26.99","270"
"B0BKL31P5R","Spidey & Friends Stickers for Kids -27 Sheets Different Make a Face Crafts Sticker Sheets,Birthday Party Favor Supplies and Toys Gifts","https://m.media-amazon.com/images/I/91J9CfiyEDL._AC_UL320_.jpg","4.8","265","13.99","270"
"B0BW46DMWX","Kids Tool Set with Electric Toy Drill Chainsaw Jigsaw Toy Tools, Realistic Kids Power Construction Pretend Play Tools Set Toddler Toys Playset Kit for Toddler Boy Girl Kid Child Tool Toy Blue","https://m.media-amazon.com/images/I/7185843yObL._AC_UL320_.jpg","4.6","27","45.99","270"
"B0C22LF6SR","Underwater Spy Puzzle with Flashcards and Magnifying Glass 2ft x 3ft - Large 48 Piece Floor Puzzle for Kids Ages 4-8 Years Old- Kids Puzzles - Educational Gift for Boys and Girls 3,4,5,6,7,8","https://m.media-amazon.com/images/I/812fzgV0euL._AC_UL320_.jpg","4.9","41","21.99","270"
"B0BYNXDGDM","Baby Sensory Tissue Box Toy - Montessori Toys for Babies 0 6 9 12 18 Month - Infant Gifts for 1 2 3 One Year Old Boys Girls Newborn - High Contrast Crinkle Toys Toddler Educational Learning Activities","https://m.media-amazon.com/images/I/81FSgBYUf7L._AC_UL320_.jpg","4.8","65","17.99","270"
"B0BPJBNXX1","TEOAYEAH 12V Lithium Battery Powered Licensed Land-Rover Electric Car for Kids, Longer Playtime, Parent Remote Control Ride on Car, Wireless Music, Luxury Ride on Toys","https://m.media-amazon.com/images/I/71-zpfVW8pL._AC_UL320_.jpg","4.4","136","179.99","270"
"B0BYJ86Z2W","Tool Building Toy Educational DIY STEM Pretend Play for Toddler 3 4 5 6 7 Year Old, Montessori Creative Construction Kit, Preschool Learning Gift Birthday Present for Kids, Boy, Girl (67Pcs)","https://m.media-amazon.com/images/I/61aFj0HG0dL._AC_UL320_.jpg","4.4","5","25.99","270"
"B0BZT4Z1XP","Chuckle & Roar - 4 Pack Tray Puzzles - USA Animal Map, Polar Animals, Adventure Awaits, Fair - Larger Pieces Designed for Preschool Hands - 36 & 48 PC Tray Puzzles","https://m.media-amazon.com/images/I/9175yKGsesL._AC_UL320_.jpg","5.0","8","9.99","270"
"B0C1HCPJ9V","Toys for 1 Year Old Boy Gifts 2PCS Baby Phone& Remote Control Pack Music 1 Year Old Toys for Boys Baby Toys 12-18 Months Baby Toys 6 to 12 Months 1 2 Year Old Boy Birthday Gift Toys for 1 + Year Old","https://m.media-amazon.com/images/I/71ciaddEBaL._AC_UL320_.jpg","4.7","68","19.99","270"
"B08TW7CFGW","Play Sink with Running Water, Geyiie Kitchen Sink Toys for Girls Boys Kids Toddlers Pets with Automatic Water Cycle System, Dish Rack, Cutting Food, Tableware Accessories, Pretend Role Playset","https://m.media-amazon.com/images/I/71hhQMryRIL._AC_UL320_.jpg","4.2","1364","32.99","270"
"B09P8LGRRJ","SONOMO Remote Control Robot Dog Toy for Kids, Programmable Robotic Puppy, Smart Interactive Stunt Robot Dog Toy for Kids 3-8 Year Gift","https://m.media-amazon.com/images/I/61LP4lC1F-L._AC_UL320_.jpg","4.5","245","54.99","270"
"B07VGVX44G","Rechargeable Walkie Talkies for Kids, 22 Channels FRS Walkie Talkies, Long Range Kids Walkie Talkies for Boys/Girls Toys Gifts,Outdoor Activities, Camping, Hiking - 2 Pack","https://m.media-amazon.com/images/I/71GvQ7WaUhL._AC_UL320_.jpg","4.5","353","38.99","270"
"B0BRHCDH1M","Mini Foosball Games 2022 New Tabletop Football Soccer Pinball for Indoor Game Room, Table Top Foosball Desktop Sport Board Game for Adults Kids Family Game","https://m.media-amazon.com/images/I/81NJ+LJB9zL._AC_UL320_.jpg","4.5","19","39.99","270"
"B0BH6XXRPK","Squishmallows 5"" Set Nightmare Before Christmas 4 asst Great Gift for Kids - Ages 2+ Jack,Oogie,Zero,Sally","https://m.media-amazon.com/images/I/61uKpfhNJLL._AC_UL320_.jpg","4.7","71","68.9","270"
