"asin","title","imgUrl","stars","reviews","price","category_id"
"B08CXN9XYM","Kruta BT183482 BT283482 Cordless Phone Battery for Vtech DS6401 DS6421 DS6422 DS6472 LS6405 LS6425 LS6426 LS6475 LS6476 89-1348-01-00 Cordless Phone Handset (Pack 4)","https://m.media-amazon.com/images/I/71VRK1XtQIL._AC_UL320_.jpg","4.6","383","14.89","72"
"B01CUYH4JI","Polycom VVX 601 Corded Business Media Phone System - 16 Line PoE - 2200-48600-025 - AC Adapter (Not Included) - Replaces VVX 600","https://m.media-amazon.com/images/I/51XMB-rm8HL._AC_UL320_.jpg","3.8","44","150.0","72"
"B09NKR71QD","BINKSYLER 940XL Ink Cartridges Replacement for HP 940XL 940 XL Use for HP Officejet Pro 8000 8500 8500A 8500A Plus Printer (1 Black,1 Cyan,1 Magenta,1 Yellow) 4 Pack","https://m.media-amazon.com/images/I/71xv907y1OL._AC_UL320_.jpg","4.0","112","26.89","72"
"B09WYH6QSZ","S SMARTOMNI 240XL 241XL Combo Pack Remanufactured Replacement for Canon Ink Cartridges 240 and 241 for Canon PIXMA MG3620 MG2120 MG2220 MG4120 MG4220 MX372 MX392 MX432 MX439 (Black Tri-Color)","https://m.media-amazon.com/images/I/71K+K3+iFVL._AC_UL320_.jpg","4.5","16","38.99","72"
"B07V2S43MG","KCMYTONER Compatible Toner Cartridge Replacement for Canon 125 CRG 125 CRG-125 3484B001AA Work with ImageClass LBP6000 LBP6030w MF3010 Printer - Black, 2 Pack","https://m.media-amazon.com/images/I/71MJCnDZF4L._AC_UL320_.jpg","4.1","32","27.45","72"
"B08ZJ3HRML","Coopaty Thermal Laminating Pouches, 5mil, 300-Pack,9 x 11.5 Inches, Letter Size Sheets","https://m.media-amazon.com/images/I/41rDWbv5N+L._AC_UL320_.jpg","4.9","42","36.99","72"
"B0995WP2TP","satukeji Sponge pad Waste Ink Tank for Epson XP520 XP530 XP540 XP600 XP700 XP800 Inkjet Inks -Part 1611102 Tray Porous PAD Ink Eject (Color : Waste Ink Tank)","https://m.media-amazon.com/images/I/31HTUUHOIVS._AC_UL320_.jpg","4.5","90","16.99","72"
"B078JSQV27","Brother Genuine Innobella LC203BK High Yield Black Ink Cartridge","https://m.media-amazon.com/images/I/616ROTdR9CL._AC_UL320_.jpg","3.7","25","47.56","72"
"B00HYU1UC6","Jabra BIZ 2300 QD Mono Headset","https://m.media-amazon.com/images/I/61ucAqqoCVL._AC_UL320_.jpg","3.8","13","68.49","72"
"B08X2MD19D","Aomya Black Ink Refill Kit 250ml Universal Dye Bulk Ink for Canon HP Epsn Brother Inkjet Printers Refillable Cartridge CISS CIS System (9 oz) with Syringe&Glove","https://m.media-amazon.com/images/I/61RLWCw+9qL._AC_UL320_.jpg","4.2","304","11.99","72"
"B0746JKK9X","S-Union Replacement Scanner Brake and Pick Roller Set Compatible with Fujitsu Fi-7160 Fi-7180 Fi-7260 Fi-7280 Part NO: PA03670-0001 PA03670-0002 Model: FI-C728PR FI-C728BR","https://m.media-amazon.com/images/I/61YR8FFk5VL._AC_UL320_.jpg","4.7","21","23.99","72"
"B001GER1NI","Genuine Xerox Smart Kit Drum Cartridge For Phaser 4250 /4260, 113R00755","https://m.media-amazon.com/images/I/7194cVA1GJL._AC_UL320_.jpg","4.2","17","181.09","72"
"B084VK8X6F","(2 Black Toner Cartridges, 1 Drum Unit) Compatible High Yield TN-580 TN580 Toner Cartridge and DR-520 Drum Unit Used for Brother DCP-8065DN HL-5240 5250DN 5340D MFC-8890DW 8460N Printer, by EasyPrint","https://m.media-amazon.com/images/I/918gXz-wQEL._AC_UL320_.jpg","4.3","74","43.99","72"
"B003VDGK8O","Xerox WorkCentre 3550 Black High Capacity Toner Cartridge (11,000 Pages) - 106R01530","https://m.media-amazon.com/images/I/71CtKcZC1XL._AC_UL320_.jpg","4.4","16","150.25","72"
"B07H3GFMRT","BAOBIAN BT-446 BT446 BT-1005 Replacement Battery Compatible with Uniden Cordless Phone BBTY0503001 BT-1004 GE-TL26402 BT-504 CPH-488B Handset Phone Rechargeable 3.6V 800mAh (4 Pack)","https://m.media-amazon.com/images/I/71iV3cd6X0L._AC_UL320_.jpg","4.6","267","10.85","72"
"B0176LDJJO","Scotch Thermal Laminating Pouches, 2.4 x 4.2-Inches, ID Badge Without Clip, 2 Pack, 200-Pouches Total (TP5852-100)","https://m.media-amazon.com/images/I/81i9gDkPrpL._AC_UL320_.jpg","5.0","10","22.99","72"
"B0BTYRK6KZ","KALOKING Remanufactured Ink Cartridges Replacement for HP 962XL 962 XL for OfficeJet Pro 9010 9015 9018 9025 Printer (1 Black 1 Cyan 1 Magenta 1 Yellow, 4P Combo Pack)","https://m.media-amazon.com/images/I/61EcO7mO7aL._AC_UL320_.jpg","4.2","21","49.99","72"
"B0B6TL35XP","NEXTPAGE CLI42 Black Ink Cartridges Replacement for Canon CLI 42 CLI-42 Work for Canon Pixma Pro 100 Pro-100S Printer (CLI42BK 4 Pack)","https://m.media-amazon.com/images/I/61lg46rRRxL._AC_UL320_.jpg","4.3","13","14.59","72"
"B000I3C4EY","Casio Inc. HR-100TM mini desktop printing Calculator,Multicolor","https://m.media-amazon.com/images/I/81ZXRlWRLZL._AC_UL320_.jpg","4.5","3885","188.51","72"
"B000VKXXVM","LD Products Ink Cartridge Replacement for HP 20 C6614DN (Black) for use in Apollo: P2100U P2200 P2300U P2500 P2600 | DeskJet: 610 610C 610CL 612 612C 630 630C 632 632C 640 640C & 642","https://m.media-amazon.com/images/I/610kNnc1uRL._AC_UL320_.jpg","4.2","302","14.99","72"
"B09DQ292Y5","Lamtetur Thermal Laminating Pouches 9"" x 11.5"" Inches,3-Mil 100/200Pack,Laminator Sheets,Letter Size ,Clear (3MIL-200sheets)","https://m.media-amazon.com/images/I/71+SpzQdQsL._AC_UL320_.jpg","4.7","209","26.99","72"
"B07PNKGJBC","Sotek Toner Cartridge TN760 TN-760 TN730 TN-730,Work with DCP L2550DW, HL L2350DW, HL L2370DW, HL L2390DW, HL L2395DW, HL L2370DWXL, MFC L2710DW, MFC L2750DW, MFC L2750DW(2 Black)","https://m.media-amazon.com/images/I/61rM-p9cpSL._AC_UL320_.jpg","4.2","373","25.79","72"
"B0CC2N8LC3","Palmtree Compatible 508X Toner Cartridge Replacement for HP 508A 508X Toner for HP Color Enterprise M553 M553dn M553n M553x MFP M577dn M577f M577c Printer (BCMY, 4-Pack) | CF360X CF361X CF362X CF363X","https://m.media-amazon.com/images/I/51mdN7iWtOL._AC_UL320_.jpg","4.8","178","141.28","72"
"B09TR3N3C7","2D Handsfree Barcode Scanner QR Omnidirectional Desktop Bar Code Reader Scanner, USB Wired Automatic Sensing Big Scan Window Barcode Reader for Supermarket Library Retail Store","https://m.media-amazon.com/images/I/610z0Ts8g7L._AC_UL320_.jpg","4.4","27","69.99","72"
"B09CDWPNNP","Brother Genuine LC401XLM High Yield Magenta Ink Cartridge","https://m.media-amazon.com/images/I/71v7iwNjXsL._AC_UL320_.jpg","3.8","65","17.49","72"
"B07G55FTWL","Texas Instruments TI-30X IIS 2-Line Scientific Calculator, Black with Blue Accents 2 Pack","https://m.media-amazon.com/images/I/81jOq2A8ZiL._AC_UL320_.jpg","4.7","168","32.95","72"
"B07338D3WQ","SuperInk 2 Pack Compatible for Brother DR360 Drum Unit TN360 Toner Cartridge (1 Drum,1 Toner ) use in DCP-7030 DCP-7040 HL-2140 HL-2150N HL-2170W MFC-7340 MFC-7840W MFC-7440N MFC-7345N Printer","https://m.media-amazon.com/images/I/713x-QEWAyL._AC_UL320_.jpg","4.3","96","33.99","72"
"B09S6GPT7G","Aomya Waste Ink Collector Unit 1 Pack for SAWGRASS SG400 SG500 SG800 SG1000 Ricoh GC41 Printer Waste Ink Collection Waste Ink Tank","https://m.media-amazon.com/images/I/71dn-ttn2qS._AC_UL320_.jpg","4.5","8","10.99","72"
"B09LHDMHKP","YOUTOP 2PK TN626 TN-626 (ACV1130) Black Toner Cartridge Compatible for Konica Minolta bizhub C450i/C550i /C650i 28000pages","https://m.media-amazon.com/images/I/712Knoz4xfL._AC_UL320_.jpg","5.0","6","119.99","72"
"B07PLYPDZ6","DOUBLE D LC3033 Ink Cartridges Upgraded Compatible Replacement for Brother LC3033 LC3033XXL 3033 LC3035 3035 for Brother MFC-J995DW MFC-J805DW MFC-J815DW MFC-J995DWXL MFC-J805DWX (BK/C/M/Y, 4 Pack)","https://m.media-amazon.com/images/I/71-AIzGXgSL._AC_UL320_.jpg","3.8","127","26.99","72"
"B086QQS1BF","Fellowes LX210 P-4 Micro-Cut Paper Shredder, Jam-Proof Heavy-Duty Paper Shredder for Office, 16 Sheet Capacity, Black","https://m.media-amazon.com/images/I/617t3KTW+fL._AC_UL320_.jpg","4.0","15","274.21","72"
"B07TXRHFYS","Kyocera 1102TT2US0 ECOSYS Model P3145dn B/W Laser Printer, 47 Pages per Minute B/W, 600 x 600 dpi and Up To Fine 1200 dpi, 600 Sheets Input Capacity, 200000 Pages Per Month Print Capacity","https://m.media-amazon.com/images/I/61tbeGOmS9L._AC_UL320_.jpg","4.4","74","865.0","72"
"B09VNW28R3","ESTON Compatible LC3019 XXL Ink Cartridges Replacement for Brother LC3019XXL for MFC-J6930DW MFC-J6530DW MFC-J5330DW MFC-J6730DW (2 Black 2 Cyan 2 Magenta 2 Yellow) 8-Pack","https://m.media-amazon.com/images/I/71heP+8CGzL._AC_UL320_.jpg","4.3","31","26.99","72"
"B0018IBLQK","Legal Laminating Pouches 5 Mil 9 X 14-1/2 Qty 100","https://m.media-amazon.com/images/I/51yYzAL7JOL._AC_UL320_.jpg","4.5","100","42.57","72"
"B001FT8NNQ","Epson Projector PowerLite Replacement Air Filter (V13H134A21)","https://m.media-amazon.com/images/I/71vkm8VKr8L._AC_UL320_.jpg","4.4","280","31.99","72"
"B075FX6D92","Avery Self-Adhesive Laminating Sheets, 9 x 12, Box of 50, Multi Pack of 2 (73601)","https://m.media-amazon.com/images/I/81vt47ZmDgL._AC_UL320_.jpg","4.7","204","41.56","72"
"B07K9J2WTL","Yanzeo B5L37A B5L37-67901 for Color Laserjet Ent M552 M553 M577 Toner Collection Unit","https://m.media-amazon.com/images/I/71M-uq67NYL._AC_UL320_.jpg","4.4","17","49.0","72"
"B0BXKXZL82","Mini Sticker Printer, HD Thermal Label Printer, Rechargeable Pocket Inkless Printer for iPhone, Smartphone, Bluetooth Portable Photo Printer, Travel Mini Sticker Note Printer Max Print Width 2.2""","https://m.media-amazon.com/images/I/61Ek3jpWnKL._AC_UL320_.jpg","3.9","9","25.99","72"
"B00I9OK9DM","Okidata 45439001 Black Toner Cartride 36K Yield For Oki B731dn","https://m.media-amazon.com/images/I/61BYR0j8bUL._AC_UL320_.jpg","4.7","14","336.57","72"
"B08W8M13Z2","Synergy Digital Wireless Headset Battery, Compatible with Sony BP-HP800-11 Wireless Headset, (Ni-MH, 2.4V, 700mAh) Ultra High Capacity, Replacement for Sony BP-HP800-11 Battery","https://m.media-amazon.com/images/I/51JDSdFrygL._AC_UL320_.jpg","4.0","81","14.95","72"
"B0748ZCG45","BCH Refill Ink Kit for Cartridges PG-243 CL-244 PG-245 CL-246 PG-210 CL-211 Inkjet Printer Cartridges - First-Timer Kit All 4 Colors - EZ30-KCMY-S","https://m.media-amazon.com/images/I/714Ligb-dVL._AC_UL320_.jpg","4.3","630","11.29","72"
"B095BXG9F3","H&BO TOPMAE Remanufactured Ink Cartridges Replacement for HP 67 67XL 3YM57AN for HP DeskJet 2755 1255 2732 2752 Envy Pro 6055 6400 6455 6458 DeskJet Plus 4100 4155 4158 Printer (2 Black)","https://m.media-amazon.com/images/I/614EHqLVdBL._AC_UL320_.jpg","3.8","224","26.99","72"
"B07C9BHZ6C","NEUPO 24 Volt Power Supply | Compatible with Allworx IP Phones | VOIP IP Replacement Phone Adapter | 24V DC for IP 9202, 9204, 9212, 9224, 9308, 9312","https://m.media-amazon.com/images/I/71XOjRXdPeL._AC_UL320_.jpg","4.1","76","13.5","72"
"B004N76618","HP HP10bII+ Calculatrice financière","https://m.media-amazon.com/images/I/61q+Btneu5L._AC_UL320_.jpg","4.6","876","29.0","72"
"B006DICL28","Ricoh 406686 Printer Maintenance Kit Type SP 5200","https://m.media-amazon.com/images/I/81ImmLs3+9L._AC_UL320_.jpg","4.7","12","120.0","72"
"B08B3LBVVY","TEINO TN760 Toner for Brother Printer Replacement for Brother TN730 TN-760 TN 760 to use with Brother DCP-L2550DW MFC-L2710DW MFC-L2750DW HL-L2370DW HL-L2395DW HL-L2350DW Printer (Black, 3 Pack)","https://m.media-amazon.com/images/I/71PL6Dgw1rL._AC_UL320_.jpg","4.5","1278","43.99","72"
"B08132BVXM","HOTCOLOR 664XL Ink Cartridge F6V30AB Work for HP 664 XL Black Ink for HP deskjet 1115 2136 3636 3836 4536 4676 Printer (2-Black)","https://m.media-amazon.com/images/I/71rhPv5f1GL._AC_UL320_.jpg","4.2","3590","35.99","72"
"B09VPJ79GG","lexmate TN514 TN-514 TN514K TN514 K TN512 TN513 TN515 TN516 TN324 TN326 A9E8130 Compatible Toner Cartridge for Konica Minolta bizhub C458 C558 C658 (28,000 Pages, Black, 2 Pack )","https://m.media-amazon.com/images/I/71IDfsBr0dL._AC_UL320_.jpg","4.6","42","108.99","72"
"B0861121T5","GREENBOX Remanufactured Ink Cartridge Replacement for HP 64 XL 64XL High-Yield for HP Envy Photo 7855 7155 6255 6230 6252 6258 7120 6220 7130 7132 7158 7164 7820 7830 7858 7864 7800 Printer (2 Black)","https://m.media-amazon.com/images/I/71DZ6WOHcQL._AC_UL320_.jpg","4.2","299","53.99","72"
"B0C3CPPDB3","4-Pack TN225 Toner Cartridges Set - High Yield TN-225 Replacement for Brother TN221 TN225BK/C/M/Y Toner MFC-9130CW HL-3180CDW HL-3140CW DCP-9015CDW DCP-9020CDN Printer","https://m.media-amazon.com/images/I/71roDUDJffL._AC_UL320_.jpg","4.5","41","73.1","72"
"B07SPFZ5DF","Clover Flex Printer Roller","https://m.media-amazon.com/images/I/71Z5LZ7QfYL._AC_UL320_.jpg","4.3","75","12.5","72"
"B0C3CXC3QT","myCartridge 141A Toner Cartridge Replacement for HP 141A W1410A 141X W1410X (with Chip) Compatible for HP MFP M140w M110w M139w Printer","https://m.media-amazon.com/images/I/617P+q1pwbL._AC_UL320_.jpg","4.1","385","46.99","72"
"B092XYTL5Y","Brother Genuine LC404C Cyan INKvestment Tank Ink Cartridge","https://m.media-amazon.com/images/I/71-p-i4C9gS._AC_UL320_.jpg","4.3","34","15.49","72"
"B00EEDICRC","Cleaning Kit for Epson Desktop Printers","https://m.media-amazon.com/images/I/714IhxRgfHL._AC_UL320_.jpg","4.0","211","22.95","72"
"B08ND4ZMNC","Vasco M3 Language Translator Device | The Only Translator with Free and Unlimited Internet in 200 Countries | Photo Translation | European Brand","https://m.media-amazon.com/images/I/61YWUPN34vL._AC_UL320_.jpg","3.8","492","299.0","72"
"B09D3FC11S","Run Star 2 Pack 220XL Cyan Remanufactured Ink Cartridge Replacement for Epson 220XL T220XL use for Epson Workforce WF-2760 2750 2660 2650 2630 Expression Home XP-320 420 424 Printer (2 Cyan)","https://m.media-amazon.com/images/I/81E88XZfWjL._AC_UL320_.jpg","4.2","134","16.95","72"
"B07XNX3YVX","Uvital Telephone Phone Handset Cable Cord, Coiled Length 0.72 to 6 Feet Uncoiled Landline Phone Handset Cable Cord RJ9/RJ10/RJ22 4P4C(Black,4 PCS)","https://m.media-amazon.com/images/I/61SXht4b88L._AC_UL320_.jpg","4.4","281","11.99","72"
"B0054ZWGVW","Honeywell 1300G-2 Hyperion 1300g Linear Imaging Scanner for 1D Barcode, RS232/USB/KBW/IBM, Black","https://m.media-amazon.com/images/I/61dor9nJqZL._AC_UL320_.jpg","3.9","16","62.68","72"
"B079RJTXBS","Honeywell Voyager 1452g 2D Wireless Area-Imaging Scanner Kit (1D, PDF417, and 2D), Includes Cradle, Power Supply, RS232 Cable and USB Cable","https://m.media-amazon.com/images/I/81tTgdnN1pL._AC_UL320_.jpg","4.4","24","276.99","72"
"B0BN2L76BJ","DoorStepInk Remanufactured in The USA Ink Cartridges for Canon 275XL, PG-275XL Black","https://m.media-amazon.com/images/I/61NyZYNFqtL._AC_UL320_.jpg","3.5","62","19.99","72"
"B08XPBYBG8","GREENBOX Remanufactured Ink Cartridge Replacement for HP 61XL 61 XL for HP Envy 4500 5530 5534 5535, Deskjet 2540 1000 1010 1512 1510 3050, Officejet 4630 2620 4635 Printer (2 Tri-Color)","https://m.media-amazon.com/images/I/718T7lquETL._AC_UL320_.jpg","4.2","77","39.99","72"
"B004MBBIIG","Kodak 30B/30C Combo Ink Cartridge - Black/Color - 1 Year Limited Warranty","https://m.media-amazon.com/images/I/81k3CobGDAL._AC_UL320_.jpg","4.5","1384","54.93","72"
"B07MQPZKBV","Genuine Compatible PB 601-9 Easy Seal Sealing Solution Compatible (4 Bottles/Box)","https://m.media-amazon.com/images/I/81Cwa3mbdpL._AC_UL320_.jpg","3.7","28","24.89","72"
"B0BYDG52NT","storcfe DTF Pigment Ink, Transfer Ink Refill for All DTF Transfer Printers Epson ET-8550 XP-15000 L1800 L800 R2400 P400 P800, Heat Transfer Printing Direct to Film (6-Pack, 2 White + BKCMY)","https://m.media-amazon.com/images/I/613yyCCageL._AC_UL320_.jpg","4.4","42","39.99","72"
"B0C7Z85B22","Projector with Wifi and Bluetooth, TOWOND 4K Supported Smart Projector with Android 9.0, 15000 Lumens Native 1080P Projector with Netflix/Prime Video/YouTube, 8000+ Apps Built-in for Outdoor Movie Use","https://m.media-amazon.com/images/I/71+Ycvj0+VL._AC_UL320_.jpg","4.5","49","169.99","72"
"B017WSLIZS","DELL N7DWF HY Black Toner CART (593-BBSB)","https://m.media-amazon.com/images/I/61JFfsnnVBL._AC_UL320_.jpg","4.5","10","85.26","72"
"B09Y5MJHNK","【with Chip】 4 Packs 215A Compatible Toner Cartridges W2310A W2311A W2312A W2313A 1050 Pages Black & 850 Pages for CMY for HP Color Laserjet Pro M155a M155nw MFP M182nw M183fw Printers","https://m.media-amazon.com/images/I/71MNwjTQmFL._AC_UL320_.jpg","3.7","13","114.8","72"
"B08Z35GF3W","JoyPrinting Compatible Canon CLI 226 Ink Cartridges Replacement for Canon PGI-225 CLI-226C CLI226 Cyan Use with PIXMA MX882 MX892 MG5320 MG6220 MG5220 MG6120 MG8220 MX712 IP4820 IP4920 IX6520 Printer","https://m.media-amazon.com/images/I/71KyrpmAsoL._AC_UL320_.jpg","4.5","102","10.99","72"
"B09SG5CF94","S SMARTOMNI 812XL Ink Cartridges Combo Pack Latest Version Remanufactured Replacement for Epson 812 T812 XL Ink Cartridge for Workforce Pro WF-7820 WF-7840 WF-7310 EC-C7000 (Black Cyan Magenta Yellow)","https://m.media-amazon.com/images/I/71hYBdS1yWL._AC_UL320_.jpg","4.7","16","54.99","72"
"B08BKJCM3L","Cosmo COPY STAND, Mini 100, to Digitize Pictures, Documents, Checks (for Deposit), Jewelries and Collectibles with Your Smartphone, Made in The USA","https://m.media-amazon.com/images/I/71KPa0lejlL._AC_UL320_.jpg","4.2","120","89.95","72"
"B0837DDV25","VICTORSTAR Remanufactured Toner Cartridge 3330 3335 3345 【Extra High Capacity】 15000 Pages Black for Xerox Phaser 3330 3330dni Xerox WorkCentre 3335 3335dni 3345 3345dni Laser Printers","https://m.media-amazon.com/images/I/71ehdxoRJ6L._AC_UL320_.jpg","4.2","30","34.8","72"
"B093KBVTFL","Goupchn Two Way Telephone Splitters RJ11 Male to Dual Female Cable 6P4C Telephone Wall Adaptor Separator White for Landline 2-Pack","https://m.media-amazon.com/images/I/51LWnv4iceS._AC_UL320_.jpg","4.5","50","6.99","72"
"B0BBD2QD3T","Scan Reader Pen Language Translator Smart Pen OCR Dictionary Scanner Real-time Translation Learning & Education Assistant with LCD Touchscreen Camera Support 112 Languages for Travel & Business","https://m.media-amazon.com/images/I/51LFaz1eMxL._AC_UL320_.jpg","3.6","157","129.99","72"
"B01JJ6WYJU","Digium D62 IP Phone 2-Line SIP with HD Voice, Gigabit, 4.3 Inch Color Display, Icon Keys","https://m.media-amazon.com/images/I/51sCaEVj7FL._AC_UL320_.jpg","4.6","7","144.95","72"
"B00OUFEN5E","LD Compatible Toner Cartridge Replacements for HP 05A (Black, 2-Pack)","https://m.media-amazon.com/images/I/71CUTrKeFsL._AC_UL320_.jpg","4.4","67","27.98","72"
"B06WWH2N7T","InstallerParts (10 Pack RJ11 Modular Telephone Cord Extension- Straight Wiring, Silver (7FT)","https://m.media-amazon.com/images/I/31nbsYBpFmL._AC_UL320_.jpg","4.5","374","16.88","72"
"B0BW5RCKMZ","Retro Landline Telephone,Old Fashioned Landline Phones with Classic Metal Bell, 1960s Vintage Wire Telephone, Retro Rotary Dial Telephone,Classic Black Corded Phone Redial for Home Office (Black-1)","https://m.media-amazon.com/images/I/61W2Ab9vRUL._AC_UL320_.jpg","4.5","22","30.98","72"
"B0BCQS2BM2","Wesfuner 3 Pack Foam Airplane Launcher Toys, 2 Flight Mode Glider Plane,Kids Flying Toy,3 4 5 6 7 8 9 10 11 12 Year Old Boys Girls Gifts,Outdoor Sport Party Favor","https://m.media-amazon.com/images/I/71gO5ArxqPL._AC_UL320_.jpg","4.6","1439","24.99","228"
"B0BD54894L","Eyoyo Bluetooth QR Code Scanner, 2D Wireless Back Clip Phone UPC USB Barcode Scanner Reader with Battery Level Indicator Compatible with 4.7""-7.2"" Android Phone, iPhone for Book Library Inventory","https://m.media-amazon.com/images/I/619up-Ic6DL._AC_UL320_.jpg","3.9","53","59.99","72"
"B0C85STJ29","TEINO 206A Toner Cartridges 4 Pack Set 206X (with Chip) Compatible with HP 206A 206X for HP Color Pro MFP M283fdw M283cdw M283 Pro M255dw M255 Printer W2110A W2110X Ink High Yield","https://m.media-amazon.com/images/I/71jA1hEfBWL._AC_UL320_.jpg","4.3","23","219.99","72"
"B00EUMTAM8","Voyager General Duty Single-Line Wireless Bluetooth Handheld Barcode Scanner (1202g)","https://m.media-amazon.com/images/I/51MKzx81I+L._AC_UL320_.jpg","3.7","58","187.88","72"
"B0C6XBDVVN","Clorisun 280XXL 281XXL Compatible for Canon Ink 280 and 281 Cartridges Replacement for Canon 281 Ink Cartridges Use to TR8520 PIXMA TR8620 TS6320 TS9120 TS8320 TS6320 TR7520 TS6120 Printer (5 Pack)","https://m.media-amazon.com/images/I/7125CFMm7HL._AC_UL320_.jpg","5.0","17","29.99","72"
"B09993HV2T","Kids Play Tunnel Tent for Toddlers, Colorful Pop Up Crawl Tunnel Toy for Baby or Pet with Breathable Mesh, Collapsible Gift for Boy and Girl Play Tunnel Indoor and Outdoor Game","https://m.media-amazon.com/images/I/61VUgF4tOhL._AC_UL320_.jpg","4.8","886","21.36","228"
"B00CHADK6W","""Package of Three"" Sharp VX-2652H Calculator Ribbon, Black and Red, Compatible","https://m.media-amazon.com/images/I/51QWk0IjcTL._AC_UL320_.jpg","4.4","83","7.15","72"
"B0859BS991","KL KLB Sport Metal Swing Set w/Slide","https://m.media-amazon.com/images/I/81On8KWwqGL._AC_UL320_.jpg","4.2","198","293.99","228"
"B09P3FNLQ8","Large Button Phone, Image Phone for The Elderly with 10 one Button Image Memory Keys (Need to Enter Mode), Amplification Phone for The Elderly with Alzheimer's Disease and Hearing Impairment","https://m.media-amazon.com/images/I/51+ZWAa4x9L._AC_UL320_.jpg","3.9","37","29.99","72"
"B00AFTQ8SO","GBC Thermal Laminator Machine, Fusion 1000L, 12 Inch, 4 Min Warm-up, 3 Mil, with 10 EZUse Laminating Pouches (1703073) Black","https://m.media-amazon.com/images/I/61dExVP6zQL._AC_UL320_.jpg","4.4","262","58.21","72"
"B087FCMPWW","YEEBAY Shooting Game Toy for Age 6, 7, 8,9,10+ Years Old Kids, Boys - 2pk Air Guns & Shooting Target & 24 Foam Balls - Ideal Gift - Compatible with Toy Guns","https://m.media-amazon.com/images/I/71psM3gJHSL._AC_UL320_.jpg","4.4","6394","39.99","228"
"B07KYG7MNJ","KLB Sport A-Frame Metal Swing Set w/Slide (Blue, Green, Orange)","https://m.media-amazon.com/images/I/811ktnbXZnL._AC_UL320_.jpg","4.0","72","249.49","228"
"B09B1QZLXW","iPlay, iLearn Bouncy Pals Dinosaur Hopper Toy 2 Year Old Boy, Toddler Plush Bounce Animals, Ride on Bouncing Triceratops for Kids 2-4, Outdoor Hopping Horse Bouncer, Cool Birthday Gifts 3 5 6 Yr Girls","https://m.media-amazon.com/images/I/713bG2XqvNL._AC_UL320_.jpg","4.6","3658","33.99","228"
"B0B3486X4W","Electric Gel Ball Blaster, Splatter Ball Blaster with 50000 Water Beads, Rechargeable, Automatic Gel Ball Blaster for Kids Adults, Outdoor Games Toys for Activities Team Game, Ages 12+","https://m.media-amazon.com/images/I/91mf-tqv-BL._AC_UL320_.jpg","4.3","522","21.99","228"
"B07FT2CXLM","MoonxHome Ball Pit Balls for Toddlers, BPA Free Crush Proof Plastic Toy Balls for Ball Pit, Children's Pool Water Toys, Macaron Ocean Balls for Play Tent 2.15 Inch Pack of 100","https://m.media-amazon.com/images/I/71A3n6BUCZL._AC_UL320_.jpg","4.2","3055","19.99","228"
"B08C7ZW4BM","Toy Rocket Launcher for Kids: Best Outdoor Toys Slingshot Rockets Launchers Air Foam Rockets Games for Boys & Girls All Ages. Party Favors Easter Basket Stuffers & Great Gifts for Ages 8 9 10 11 & Up","https://m.media-amazon.com/images/I/71ApaCT7FUL._AC_UL320_.jpg","4.4","554","16.97","228"
"B08P286Q26","NERF Pro Grip Football, Blue, Classic Foam Ball, Easy to Catch & Throw, Balls for Kids, Kids Sports Toys","https://m.media-amazon.com/images/I/813S8ofhO8L._AC_UL320_.jpg","4.7","4955","11.99","228"
"B01J28LDVU","Sportspower My First Jump N' Slide Bounce House with Blower, 165.6"" L x 141.6"" W x 94.8""","https://m.media-amazon.com/images/I/81eHrqum0ZL._AC_UL320_.jpg","4.5","45","363.99","228"
"B00GAC6470","Stomp Rocket Original Dueling Rocket Launcher for Kids - Soars 200 Ft - 4 Rockets and Multi-Player Adjustable Launcher Stand - Fun Outdoor Toy and Gift - Boys or Girls Age 5+ Years Old","https://m.media-amazon.com/images/I/81i0sKLAx4L._AC_UL320_.jpg","4.6","14927","19.97","228"
"B08GH933VW","HAHAKEE Kids Basketball Hoop, Height-Adjustable 2.9 FT-6.1 FT, Indoor and Outdoor Basketball Set with Ball and Pump for Kids Age 3-8","https://m.media-amazon.com/images/I/714R3GiMfeL._AC_UL320_.jpg","4.0","91","42.99","228"
"B07Y1257KV","BooTaa 4 Pack Airplane/Flying Toys, 17.5"" Large Throwing Foam Plane/Gliders, 2 Flight Mode, Birthday Gifts for Girls Kids 3 4 5 6 7 8 9 10 11 12 Year Old Boys,Outdoor Sport Game Toys","https://m.media-amazon.com/images/I/61aym4Fs96S._AC_UL320_.jpg","4.5","12037","19.99","228"
"B09X21N1MH","Tudaymol Nerf Bullets 500 Official Dart for Nerf N-Elite Series Guns Darts Gun Refill Bullets Ammo Packs","https://m.media-amazon.com/images/I/71mahV6vTML._AC_UL320_.jpg","4.8","510","19.99","228"
"B0BTSX25KP","Veemuaro 5 in 1 Slide and Swing Set, Toddler Slide Swing Set with Bus Play Structure, Freestanding Slide Set with Climber and Basketball Hoop, Toddler Playground Indoor Outdoor (Red)","https://m.media-amazon.com/images/I/61Tu+7Rq+sL._AC_UL320_.jpg","4.6","12","179.99","228"
"B0C2TJ96Z9","3-Pack LED Airplane Toy, Airplane Launcher Toy - 2 Flight Modes, Foam Glider Planes, Outdoor Toys for Kids Ages 3 4 5 6 7 8 9 10 11 12 Year Old Boys & Girls Birthday Gift, Educational Flying Kids Toys","https://m.media-amazon.com/images/I/71mt84bYRnL._AC_UL320_.jpg","4.8","261","19.99","228"
"B07VVXHH4J","Kids Tactical Vest Kit for Nerf Guns Series with Refill Darts,Dart Pouch, Reload Clips, Tactical Mask, Wrist Band and Protective Glasses,Nerf Vest Toys for 8 9 10 11 12 Year Boys","https://m.media-amazon.com/images/I/814t6jX+QdL._AC_UL320_.jpg","4.6","8547","19.99","228"
"B009JBJ142","GlowCity Glow in The Dark Basketball for Teen Boy - Glowing Red Basket Ball, Light Up LED Toy for Night Ball Games - Sports Stuff & Gadgets for Kids Age 8 Years Old and Up","https://m.media-amazon.com/images/I/81qI5mGTg6L._AC_UL320_.jpg","4.5","16940","41.99","228"
"B00PYLU3GG","Click N' Play Plastic Balls for Ball Pit, Phthalate & BPA Free, Crush Proof Play Balls for Ball Pit, Pit Balls in Assorted Colors in Reusable and Durable Storage Mesh Bag with Zipper | 200, 1000 count","https://m.media-amazon.com/images/I/A1pY-XoA9VL._AC_UL320_.jpg","4.7","39748","18.56","228"
"B08J2S7T6Y","PigPigPen 3pc Kids Play Tent for Boys with Ball Pit, Crawl Tunnel, Princess Tents for Toddlers, Baby Space World Playhouse Toys, Boys Indoor& Outdoor Play House, Perfect Kid’s Gifts","https://m.media-amazon.com/images/I/71BqTT2HpCL._AC_UL320_.jpg","4.5","3837","39.99","228"
