"asin","title","imgUrl","stars","reviews","price","category_id"
"B09TGRY9NP","FestiCorp Non Slip Rug Pads 5x7 Ft Non Skid Rug Pad Gripper, Anti-Slip Carpet Rug Mats for Under Rugs and Hard Surface Floors","https://m.media-amazon.com/images/I/81C91uQyZwL._AC_UL320_.jpg","4.5","775","19.99","165"
"B07DPMBGL2","FUTUREPLUSX 1LB Flat Glass Marbles, Blue Mixed Gemstone Vase Fillers Beads Decorative Glass Pebbles Floral Fish Tank Rocks for Vases Table Scatter Aquarium Decor","https://m.media-amazon.com/images/I/71aObslSqGS._AC_UL320_.jpg","4.5","2791","7.99","165"
"B01MSSOW7F","Golden State Art, 11x14 Diploma Frame for 8.5x11 Document & Certificates with Mat, Or 11x14 Without Mat, Real Glass, Double Mat (Black with White/Black, 1 Pack, Solid Wood)","https://m.media-amazon.com/images/I/71GXtK2NIZL._AC_UL320_.jpg","4.8","4013","15.19","165"
"B08LVK4S7V","INDRESSME XXXLarge Woven Rope Basket 21"" x 14"" Blanket Storage Basket with Long Handles Decorative Clothes Hamper Basket Extra Large Baskets for Blankets Pillows","https://m.media-amazon.com/images/I/81xFkeFF8oL._AC_UL320_.jpg","4.8","5581","29.99","165"
"B0BGPB68Z6","Gifts for Women Friends, Birthday Gifts for Women,Friendship Gifts for Women, Sister Gifts from Sister, Lavender Scented Candles Funny Gifts for Women BFF Sister Mom Wife Girlfriend","https://m.media-amazon.com/images/I/81uCDlT+98L._AC_UL320_.jpg","4.4","139","9.99","165"
"B0C371K2NY","BAPPEY Pumpkin Decor - 16PCS Foam Pumpkins Harvest Set - Fake Pumpkins with Realistic Maple Leaves for Halloween, Thanksgiving, Fall, DIY, Home, Indoor Outdoor Decor","https://m.media-amazon.com/images/I/81ETfwQF6kL._AC_UL320_.jpg","4.7","40","14.99","165"
"B09VS1YP7D","WOODEXPE Sympathy Gift LED Memorial Shadow Box Memorial Gifts for Loss of Loved One - A Limb Has Fallen","https://m.media-amazon.com/images/I/81F4na96OCL._AC_UL320_.jpg","4.8","458","17.99","165"
"B0C4N9BBZG","PACKISM Clear Backpack for School - 17"" Heavy Duty PVC Transparent Backpacks with Multi-pockets for College Workplace Security, Black(for age 12 above)","https://m.media-amazon.com/images/I/813Nap+yxbL._AC_UL320_.jpg","4.6","829","27.99","165"
"B08W2R4267","Glade Candle Jar, Air Freshener, Pumpkin Spice Things Up, 3.4 Oz","https://m.media-amazon.com/images/I/81bDfY7mcUL._AC_UL320_.jpg","4.4","545","9.99","165"
"B0C1Z8XFNC","HUAESIN 2 Pack 24'' Prelit Fall Maple Tree with 48 LEDs Timer Battery Operated Lighted Pumpkins Artificial Autumn Fall Tabletop Tree Acorns for Thanksgiving Fall Harvest Home Indoor Halloween Decor","https://m.media-amazon.com/images/I/71i2nvPZyeL._AC_UL320_.jpg","4.4","8","22.99","165"
"B099FF9TTQ","4 Pack Magnetic Curtain Tiebacks Convenient Drape Tie Backs Weave Holder for Window Draperies Hold Curtains Drape Ties Backs 16 inch Holdback (Silver Gray)","https://m.media-amazon.com/images/I/71ryNz1ZRfL._AC_UL320_.jpg","4.6","1055","6.99","165"
"B07VXL2G9F","Aromascape PT41917 2-Wick Scented Jar Candle, Jasmine & Gardenia, 19-Ounce, White","https://m.media-amazon.com/images/I/71uWrH6X+3L._AC_UL320_.jpg","4.4","1903","13.99","165"
"B09YY5KBN5","Pauwer Hallway Runner Rug 10Ft, Non-Slip & Non-Shedding, Traditional Vintage Carpet Runner, Faux Wool Soft Fuzzy Rug, Washable Low-Pile Floor Carpet for Kitchen Living Bathroom (Grey,1.7x10Ft)","https://m.media-amazon.com/images/I/81P4Z9gqTaL._AC_UL320_.jpg","4.3","1193","39.99","165"
"B08CBJXKJV","Drapery Holdback,Quality Metal Decorative Curtain Holdbacks with Zinc Alloy Cap Finials,Rust-Proof, Set of 2 Window Curtain Holdbacks,Matte Black","https://m.media-amazon.com/images/I/41mEuHfzCkL._AC_UL320_.jpg","4.6","1116","9.99","165"
"B08R5W5LY1","DOWELL Window Privacy Film, Stained Glass Window Film, Rainbow Decorative Window Clings, Static Cling Window Sticker, Non-Adhesive Window Decals for Home UV Protection, 17.5 x 78.7 inches","https://m.media-amazon.com/images/I/91aDkfel3gL._AC_UL320_.jpg","4.6","4681","7.99","165"
"B081SFV33L","Genuine Fred Fancy That Party Candles, 3 inches, Old AF","https://m.media-amazon.com/images/I/71i+iaZQmWL._AC_UL320_.jpg","4.8","906","9.99","165"
"B0B2JMS1DZ","YUJUN 6 Sheets Thanksgiving Fall Window Clings, Maple Leaves Pine Cones Window Decals Stickers for Autumn Glass Home Decor and Thanksgiving Fall Window Decoration","https://m.media-amazon.com/images/I/71FK2I9o6jL._AC_UL320_.jpg","4.4","183","6.99","165"
"B0B741FCGB","Esur Fall Decorations for Home, Rustic Fall Tabletop Counter Decor, Thanksgiving Decor Gifts - Thankful Grateful Blessed","https://m.media-amazon.com/images/I/71p1YklEUAL._AC_UL320_.jpg","4.6","24","20.99","165"
"B00GVM04D4","Tiny Ideas Baby Handprint or Footprint DIY Keepsake Ornament Kit, Nursery Décor, Creative Baby Gift, Addition to Baby Registry, White","https://m.media-amazon.com/images/I/7142f-wzsjL._AC_UL320_.jpg","4.1","1404","7.99","165"
"B07BWBWC43","Urban Naturals Eucalyptus & Sage Oil Reed Diffuser Refill | Eucalyptus, Sage, Mint, Lime and Cedarwood| Includes a Free Set of Reed Sticks! 4 oz","https://m.media-amazon.com/images/I/61+tYXXUO+L._AC_UL320_.jpg","3.9","9067","14.99","165"
"B0BPNWMDV7","Americanflat 13x19 Picture Frame in Black - Set of 2 - Use as 11x17 Picture Frame with Mat or 13x19 Frame Without Mat - Includes Sawtooth Hanging Hardware for Horizontal or Vertical Display","https://m.media-amazon.com/images/I/71upVgHgeOL._AC_UL320_.jpg","4.5","447","24.99","165"
"B001G43BEG","HEM White Sage Tubes Incense, 20g, Box of Six","https://m.media-amazon.com/images/I/51iVNzl3VnL._AC_UL320_.jpg","4.6","6341","6.79","165"
"B09DVW4GR6","SLCARACC Full Length Door Mirror Tiles,12""x 12"" x 4 Pcs Acrylic Wall-Mounted, Non Glass Safety Mirror Great for Baby Kids Playroom,Gym, Used as Dorm Mirror…","https://m.media-amazon.com/images/I/61HQQvzvLqL._AC_UL320_.jpg","4.0","828","17.89","165"
"B0BBBZ3MNP","Be Kind to Your Mind Vintage Tin Signs Hippie Boho Wall Art Encouragement Gifts for Women Home Office Bedroom Living Room Cafes Wall Decor 8x12 Inch","https://m.media-amazon.com/images/I/71siuT4C81L._AC_UL320_.jpg","4.4","113","9.79","165"
"B0BCVTPC9V","21PCS Jungle Animals Window Clings Stickers for Kids Safari Window Gel Clings Decals Thick Gel Clings Toddlers and Adults Classroom Home Nursery Airplane Birthday Party Supplies Decorations (Jungle animals)","https://m.media-amazon.com/images/I/71oeQcmr5CL._AC_UL320_.jpg","4.0","157","7.99","165"
"B078GX5FNX","Poo-Pourri Lavender Vanilla 16-Ounce Refill Bottle,","https://m.media-amazon.com/images/I/41q7fglCDEL._AC_UL320_.jpg","4.8","2123","29.95","165"
"B0BM41KSG3","Funny Dark Humor Goth Halloween Wall Decor Live Laugh Lobotomy Sign For Gothic Room, Home, Bedroom, Bathroom, Office 8 x 12 Inch (942)","https://m.media-amazon.com/images/I/81Pu9xlywJL._AC_UL320_.jpg","4.8","92","9.99","165"
"B0B5KG429C","3D Halloween Window Clings Double-Side Removable Halloween Window Stickers 3D Stereo Pumpkin Halloween Window Decals Halloween Glass Decals for Party Decorations Halloween Window Decorations for Kids","https://m.media-amazon.com/images/I/71Ybja1gwfL._AC_UL320_.jpg","4.5","54","7.99","165"
"B095H95DX6","Gehydy 2Pcs Fall Gnomes Plush Thanksgiving Decorations for Home Autumn Harvest Maple Leaf Handmade Tomte Ornaments Tabletop Party Figurines","https://m.media-amazon.com/images/I/815Rh2SpOtL._AC_UL320_.jpg","4.7","158","7.99","165"
"B0C5QWH1TB","Fall Decor-Fall Decorations for Home-4 Artificial Pumpkins,Wooden Sign & Bead Garland and Fall Wooden Blocks-Farmhouse Rustic Fall Tiered Tray Items for Autumn Thanksgiving Harvest Decoration","https://m.media-amazon.com/images/I/81Xis9db2oL._AC_UL320_.jpg","4.2","43","7.99","165"
"B0C39T4XZ9","Horaldaily 129 PCS Fall Window Cling Sticker, Thanksgiving Autumn Harvest Watercolor Pumpkin Leaf for Home Party Supplies Shop Window Glass Display Decoration","https://m.media-amazon.com/images/I/712wN62VQ1L._AC_UL320_.jpg","4.4","8","7.99","165"
"B098XHTXL4","Amoowis Set of 6 Silicone Coasters for Drinks, Thickened Coaster with Holder for Wooden Coffee Table, Cup, Desk, Bar, Office, Anti-Slip, Non-Stick, Easy to Clean","https://m.media-amazon.com/images/I/61qUhQ0AcjL._AC_UL320_.jpg","4.7","1398","9.99","165"
"B093BYY94F","bigantss 6 Pack Clear Acrylic Vinyl Record Floating Shelves, 12"" Wall Shelf Mount & Holder for Vinyl Album Display and Storage Frame Show Your Favorite LP (Clear)","https://m.media-amazon.com/images/I/81v2hwrc9NL._AC_UL320_.jpg","4.7","838","19.99","165"
"B07B2KDHVD","Ivilon Drapery Eyelet Curtain Rings - 1.7"" Ring for Curtain Hook Pins, Set of 14 - Warm Gold","https://m.media-amazon.com/images/I/51lviyYsCAL._AC_UL320_.jpg","4.6","1470","7.9","165"
"B07RCVJQDW","raajsee Wooden Brown Incense Holder -Incense Burner Holder –Ash Catcher - Incense Stick Holder - Meditation & Yoga - Great Gift for Any Occasion Size 11x4 inch","https://m.media-amazon.com/images/I/71S4+UqCvLL._AC_UL320_.jpg","4.7","2757","8.44","165"
"B0C6T6FG4X","Fall Decor - Fall Decorations for Home - Set of 3 Book Pumpkins - for Thanksgiving Autumn Farmhouse Room Kitchen Tiered Tray Table Centerpieces","https://m.media-amazon.com/images/I/81nE3cWl2fL._AC_UL320_.jpg","4.2","15","19.99","165"
"B09CYS9BFB","Gresorth 8pcs Assorted Size Fake Handmade Champagne Velvet Pumpkins Artificial Fall Harvest Halloween Decoration for Home Kitchen Farmhouse Thanksgiving Wedding Festival","https://m.media-amazon.com/images/I/816qZtw4DtL._AC_UL320_.jpg","4.5","183","21.99","165"
"B076F37T1V","Satya Nag Champa 250 GMS Incense Stick by Shrinivas Sugandhalaya LLP Mumbai","https://m.media-amazon.com/images/I/818y-NitBAL._AC_UL320_.jpg","4.7","4797","9.49","165"
"B094Z9ZVW1","Tepook Super Soft Fluffy Rug for Bedroom, Modern Shaggy Rug Fuzzy Kids Rug for Living Room, Plush Indoor Nursery Home Decor Rug with Non-Slip Bottom, Black, 4 X 6 Feet","https://m.media-amazon.com/images/I/91PvbLOT3SL._AC_UL320_.jpg","4.4","2207","17.96","165"
"B06Y62H2LB","Vivaplex, 12, Amber, 4 oz Glass Bottles, with Lids","https://m.media-amazon.com/images/I/416ZkYhAE4L._AC_UL320_.jpg","4.7","1967","16.99","165"
"B09FZ1K4FK","Alarm Clock for Bedroom, Modern Digital Clock for Living Room, 8.7"" LED Mirror Alarm Clock with 2 USB Charger,Snooze,12/24H,7 Adjustable Dimmer & Volume Aesthetic Bedside Clock for Teens Kids Adults","https://m.media-amazon.com/images/I/710xKhWYA5L._AC_UL320_.jpg","4.4","1909","19.99","165"
"B07PWYNF8J","Mantello 4x6 Inch Front Loading Picture Frames Set of 12 Black - Art Wall Hanging Table Desk - Family Gallery Multi Photo Frame","https://m.media-amazon.com/images/I/91ZUT0-nAvL._AC_UL320_.jpg","4.6","3741","20.99","165"
"B0C4SS3TK2","Viyffo 12 Inch Green Taper Candles Set of 4 Unscented Smokeless Long Tall Tapered Candle for Candlesticks Sticks Wedding Advent Home Decor Dinner Christmas","https://m.media-amazon.com/images/I/61obSCdWyFL._AC_UL320_.jpg","4.7","83","12.99","165"
"B09MM2CSWG","Healing Crystal Candle, 12oz - 3 Wick Aquarius, Gemini, Libra Zodiac Candles with Crystals Inside. Zodiac Gifts for Women, Real Crystals and Healing Stones Manifestation Candle, Meditation Candle","https://m.media-amazon.com/images/I/61oWlL5zNLL._AC_UL320_.jpg","4.8","557","32.95","165"
"B0BHW2YJ7S","BlingKingdom Black Folding Hand Classic Style Fan Silk Fabric Bamboo Ribs Hand Held Chines/Spanish Foldable Fan for Wedding, Party Favor, Performance, Dance, Home Decorations, Festival, Gift","https://m.media-amazon.com/images/I/61Z4l+mB5EL._AC_UL320_.jpg","4.1","86","5.49","165"
"B07NZ91PC3","My Lumina Purification Sage Lavender Candle - Smudging Chakra Balancing Healing Candle Natural Soy Wax - White Sage Natural Scented Purifying Candle for Aromatherapy","https://m.media-amazon.com/images/I/71p-BFWizoL._AC_UL320_.jpg","4.5","3369","17.99","165"
"B098NH8VSF","LA JOLIE MUSE Woody Jasmine Candles for Home Scented - Luxury Jar Candles with Aesthetic Glass, Candles Gifts for Women, 80 Hours Long Burning","https://m.media-amazon.com/images/I/61AiwymRixL._AC_UL320_.jpg","4.5","494","22.49","165"
"B0B6SJGM39","wybcfp 50PCS Resin Mini Ghost Pumpkin Halloween Miniature Grimace Pumpkin Artificial Pumpkin Beads Material for Halloween Party Craft DIY Table Scatter Decoration","https://m.media-amazon.com/images/I/61o9ZAOt04L._AC_UL320_.jpg","4.9","36","8.99","165"
"B0B17TPK57","FUN LITTLE TOYS Halloween Clown Curtain Halloween Hanging Window Cover Decoration for Halloween Party","https://m.media-amazon.com/images/I/71tpBb1E1tL._AC_UL320_.jpg","4.6","460","12.99","165"
"B0BTHMJCTF","KAMANINA 3/4 Inch Curtain Rods for Windows, Splicing Adjustable Single Drapery Rod 32 to 58 Inches (2.6-4.8ft), Twisted Cage Finial,Antique Bronze","https://m.media-amazon.com/images/I/61Tn4sHRAaL._AC_UL320_.jpg","4.5","242","19.99","165"
"B084WL2R65","Mega Candles 50 pcs Unscented Assorted Colors Tea Lights Candle, Great for Casting Chimes, Chakra, Rituals, Spells, Vigil, Witchcraft, Wiccan Supplies, Vibrant Fun Colors","https://m.media-amazon.com/images/I/71FXCFS3EmL._AC_UL320_.jpg","4.6","1595","27.97","165"
"B09JZ9XDNS","Clear Acrylic Display Riser Shelf for Funko Pops & Toys Figures, Champagne Wall, Cupcake Stand for Shot Glasses, Perfume & Cologne Organizer Holder, Crystals Collectibles Decoration on Tabletop 9 in","https://m.media-amazon.com/images/I/61795mnLDlL._AC_UL320_.jpg","4.6","1400","12.79","165"
"B09FR95X1L","ANDALUCA Orange Decorative Vase Filler Bag with Mini Pumpkins, Orbs, Balls & Flowers Bowl Filler Decor (Pumpkin Orange)","https://m.media-amazon.com/images/I/714lmOdr4XL._AC_UL320_.jpg","4.6","1942","22.99","165"
"B0BQM1J74Q","90 Pcs 3 Kinds Mixed Eucalyptus Leaves Stems Bulk Artificial Silver Dollar Eucalyptus Leaves Picks Dried Eucalyptus Bundle Faux Spray for Wedding Vase Bouquet Floral Arrangement Decor (Green)","https://m.media-amazon.com/images/I/81tDxhTyS2L._AC_UL320_.jpg","4.3","76","35.99","165"
"B0B45YD9QQ","6PCS Halloween Wooden Decor - Halloween Wooden Signs Include Pumpkin Ghost Bat Black Cat Witch Hat Candy Corn Freestanding Table Signs, Halloween Tiered Tray Decor for Rustic Farmhouse Home Mantle","https://m.media-amazon.com/images/I/71cBG5Y5JKL._AC_UL320_.jpg","4.6","98","22.99","165"
"B0B6QRPB64","Telling Time Teaching Clock - Learning Clock for Kids - Kids Wall Clocks for Bedrooms - Kids Wall Clock- Silent Analog Kids Clock for Teaching Time ,for School Classrooms Playrooms and Kids Bedrooms","https://m.media-amazon.com/images/I/71tJa9QGb8L._AC_UL320_.jpg","4.6","683","17.69","165"
"B07TYJHXQX","JAKY-Global Babys Breath Silk Artificial Flowers Burgundy 6 Bundle Fall Stems Fake Plants Decor Wedding Party Decoration Bouquets Real Touch DIY Home Garden (Autumn Red-6pcs)","https://m.media-amazon.com/images/I/71f13knPoKL._AC_UL320_.jpg","4.3","7374","16.99","165"
"B077TP5QNM","11.5” Digital Wall Clock with Date,Time,Week,Indoor Temperature,3 Alarms,5 Dimmer,2 USB Chargers,Battery Backup,Snooze,12/24H for Elderly,Parents,Impaired Vision,Dementia,Memory Loss,Office,Bedroom","https://m.media-amazon.com/images/I/61VYOrDz9HL._AC_UL320_.jpg","4.7","6756","32.99","165"
"B0B4DVVW3R","Hananona 50 Pcs Marigold Flower Heads Bulk, Silk Marigold Heads with Stems Artificial Marigold Flowers for Dia De Los Muertos Home Decor DIY Marigold Garland Craft Day of Dead Decoration (50, Orange)","https://m.media-amazon.com/images/I/81aTzYK6KHL._AC_UL320_.jpg","4.5","145","9.98","165"
"B0B24DQP43","Halloween Wood Book Stack, Hocus Pocus Mini Faux Books Bundle, Halloween Tiered Tray Decor for Home Table Mantle Fireplace Shelf","https://m.media-amazon.com/images/I/71OxuDYcOrL._AC_UL320_.jpg","4.5","118","16.99","165"
"B0BPXYLMJD","Frankincense Resins | Boswellia Sacra Frankincense Incense |Chruch Incense Olibanum Gum Bulk |Luban 100 Grams (3.5 Ounce)","https://m.media-amazon.com/images/I/81q7OUfNh2L._AC_UL320_.jpg","4.4","54","11.99","165"
"B09R1F8RTC","ZIFTY 7-Pcs 38""/3.1FT Faux Pampas Grass Large Tall Fluffy Artificial Fake Flower Boho Decor Bulrush Reed Grass for Vase Filler Farmhouse Home Wedding Decor (Beige Mixed)","https://m.media-amazon.com/images/I/71Bi1tqnKML._AC_UL320_.jpg","4.6","4037","19.99","165"
"B01NBESOZ2","Baby Tooth Fairy Box Keepsake for Lost Tooth Boys| Tooth Holder for Kids | Baby Shower & Birthday Gift","https://m.media-amazon.com/images/I/71eX8az6xdL._AC_UL320_.jpg","4.6","4610","6.49","165"
"B0B7NVQL73","Halloween skull statue with spooky LED light for holiday decorations,Halloween decor with romantic skeleton couple on swing tombstone tree,Grinning skull decor,Halloween props haunted collectible gift","https://m.media-amazon.com/images/I/91z8yM92NUL._AC_UL320_.jpg","4.7","42","19.99","165"
"B08MVJGP56","5x5 Picture Frames with 4x4 Opening Mat. 5x5 Black Square Photo Frame. Solid Wood, Plastic Panel.The Protective Film Must be Removed.The Tabletop or The Wall.","https://m.media-amazon.com/images/I/61KvfyVnO2L._AC_UL320_.jpg","4.2","961","6.59","165"
"B07QZY7LX2","MUMUXI Marquee Light Up Letters | Large Light Up Numbers | Battery Powered and Bright with Every Letter of the Alphabet | For Wedding, Birthday, Party, Celebration, Christmas or Home Decoration (A)","https://m.media-amazon.com/images/I/61dhrc+myGL._AC_UL320_.jpg","4.6","7290","6.87","165"
"B07DJ2GH2S","Woodwick Ellipse Scented Candle, Frasier Fir, 16oz | Up to 50 Hours Burn Time","https://m.media-amazon.com/images/I/71K1JpgR90L._AC_UL320_.jpg","4.7","1303","24.79","165"
"B0B6FF918S","PHAREGE Moon Phase Floating Shelf Black, Set of 3 Small Shelves for Book Plant, Wall Mounted Storage Shelves for Decor Bedroom Bathroom Living Room, Brown Board","https://m.media-amazon.com/images/I/71nJBaL5CrL._AC_UL320_.jpg","4.7","152","19.99","165"
"B0B5KKHSMS","Agusbagli 10Pcs Artificial Fall Flowers Outdoor Autumn Fake Flowers UV Resistant Faux Plastic Greenery Shrub Plant for Wedding Home Garden Window Box Fireplace Thanksgiving Christmas Decor Orange","https://m.media-amazon.com/images/I/91BJIb1+jdL._AC_UL320_.jpg","4.3","46","18.99","165"
"B09R436FQJ","LIFFY 10 inches Yoga Statues Home Decor Ornaments,Set of 3 Resin Meditation Lady Yoga Pose Figurine Table Decorative Decorations for Living Room Bedroom Office,Gift for Yoga Lover","https://m.media-amazon.com/images/I/61mRcomFRcL._AC_UL320_.jpg","4.5","34","34.99","165"
"B082HDBBKY","ONE WALL Kids Art Frames Pack of 2 Front Opening 8.5x11 Kids Artwork Frames Changeable with Mat and Display 10x12.5 Pictures Without Mat, Kids Drawings Storage Frame Holds 80 Pcs, for Children Art Projects Hanging Art A4","https://m.media-amazon.com/images/I/71Td4izHW0L._AC_UL320_.jpg","4.5","405","29.99","165"
"B099ZM5ZQK","COCOBOO 3 Packs Fake Plants, Small Artificial Plants with Plastic Pots, Fake Potted Desk Plants for Office Home Shelf Decor Indoor Outdoor","https://m.media-amazon.com/images/I/71zTkmxFEVL._AC_UL320_.jpg","4.3","710","19.99","165"
"B0BWXQ9WC8","Amber Glass Bud Vases -Set of 20 for Flowers, Small Amber Bud Vases in Bulk for Centerpieces Decor, Amber Mini Glass Vase,Home Table Decorations Bud Vases","https://m.media-amazon.com/images/I/81cafMS8T6L._AC_UL320_.jpg","4.7","285","35.99","165"
"B07SYVLVFX","F-color Clear Backpack Heavy Duty - Large Clear Backpacks for School PVC Transparent Bookbag for Students Work Stadium Travel","https://m.media-amazon.com/images/I/81x6hCs0lwL._AC_UL320_.jpg","4.6","6823","18.49","165"
"B09TWF381C","ANJANK Digital Alarm Clock Radios for Bedroom 0-100% Dimmer, Weekday/Weekend Dual Alarm, USB Charging Port, Battery Backup,FM Radio with Sleep Timer, Easy to Set for Kids, Bedside, Nightstand, Desk","https://m.media-amazon.com/images/I/61A1-JxhivL._AC_UL320_.jpg","4.3","1196","25.99","165"
"B074V7MGKJ","Hophen Scary Halloween Mask Terror Ghost Devil Mask Dance Party Scary Biochemical Alien Zombie Caps Mask","https://m.media-amazon.com/images/I/71oqXsajL9L._AC_UL320_.jpg","4.4","2713","16.99","165"
"B0BLHJZSX8","Hutha 4x6 Large Area Rugs for Living Room, Super Soft Fluffy Modern Bedroom Rug, Tie-Dyed Light Grey Indoor Shag Fuzzy Carpets for Girls Kids Nursery Room Home Decor","https://m.media-amazon.com/images/I/81zuQ1M96GL._AC_UL320_.jpg","4.4","809","16.99","165"
"B00FB6N4VA","Umbra 244923-410-REM Chroma Tension Rod – Adjustable Tension Curtain Rod for Curtains and Sheer Curtains, 36 to 54 Inches, Nickel","https://m.media-amazon.com/images/I/61j9i6eqYLL._AC_UL320_.jpg","4.5","3928","12.5","165"
"B09VG2PKKC","FAMICOZY 4.5"" No Ticking Analog Alarm Clock,Silent Readable for Seniors,Easy to Set,Gradual Rise Alarm,Big Numbers,On/Off Switch on Side,Gentle Wake,Snooze Soft Backlight,Battery Operated,Black","https://m.media-amazon.com/images/I/51RupDcg-lL._AC_UL320_.jpg","4.2","785","14.99","165"
"B0BY263D22","AMQTSLM Rave Fan,Festival Fan Hand Fans for Women Foldable,Large Hand Fan,Clack Fan,Silver Hand Fan,Hand Fan Large Folding Fans Craft Hand Fans for Party","https://m.media-amazon.com/images/I/71jSfnIwqyL._AC_UL320_.jpg","4.5","10","15.99","165"
"B09ZHS5Q2C","ROGENA Halloween Gnomes Halloween Decorations Halloween Home Decor","https://m.media-amazon.com/images/I/71xVHTZly4L._AC_UL320_.jpg","4.3","65","5.99","165"
"B0BYHHY8ZP","HappyHapi 4x6 Picture Frame 2 Pack Photo Picture Frame with Real Glass for Wall or Tabletop Display Decor 4x6 Frames Collage for Photos/Artwork/Paintings (Black)","https://m.media-amazon.com/images/I/71hvALvi-mL._AC_UL320_.jpg","4.5","106","7.99","165"
"B0C6XHYK2P","[Timer] Halloween Decor 18 Inch Black Halloween Tree with 24 LED Pumpkin Bat Spider Light, USB/Battery Operated Lighted Birch Tree Spooky Halloween Table Decorations Indoor Outdoor for Home Room Party","https://m.media-amazon.com/images/I/81aAOxal1GL._AC_UL320_.jpg","4.4","121","19.99","165"
"B09KTYD3BK","Lightarea Curtain Rod Brackets No Drilling, 8 PCS Self Adhesive Curtain Rod Holder Hooks, Hangers for Bathroom Kitchen Home Bathroom & Hotel Use","https://m.media-amazon.com/images/I/71CZ+ukMsvL._AC_UL320_.jpg","3.7","1263","9.99","165"
"B08QRW3M5T","What If You Fly Home Wall Decor - Metal Wall Art Fall Decor Aluminum Tin Signs for Home Decor Vintage Wall Decor - Fall Sign for Home Decor Tin Sign Vintage Posters Coffee Bar Sign Funky Decor","https://m.media-amazon.com/images/I/71bZ0Ut4+nL._AC_UL320_.jpg","4.7","1355","9.49","165"
"B00T5YSGWQ","Sun Zero Becca Energy Efficient Grommet Curtain Panel, 40"" x 84"", Tangerine","https://m.media-amazon.com/images/I/813eETo6D6L._AC_UL320_.jpg","4.5","8001","10.87","165"
"B0817BWPNB","Happy Trees 12 Pcs Artificial Floating Foam Lotus Flower with Water Lily Pad, Lifelike Ornanment Perfect for Home Garden Pond Decoration","https://m.media-amazon.com/images/I/81kpLydbeBL._AC_UL320_.jpg","4.1","1830","11.98","165"
"B07D3F6GP5","Kids Rug Carpet Playmat City Life Learn Have Fun Safe, Children's Educational, Road Traffic System, Multi Color Activity Centerpiece Play Mat! for Playing with Cars for Bedroom Playroom","https://m.media-amazon.com/images/I/81lRCDE-AQL._AC_UL320_.jpg","4.6","9030","18.99","165"
"B09MF164W1","Viking Factory Decorative Box Set with Combination Lock - Premium Large Bamboo Storage Box Removable Tray Brush, Wooden Storage Roll Kit with All Accessories (Sliding Tray)","https://m.media-amazon.com/images/I/71JzuYpUQ3L._AC_UL320_.jpg","4.5","472","43.99","165"
"B00JYBXIPA","UCO 12-Hour Natural Beeswax Candles - Candle Lantern","https://m.media-amazon.com/images/I/7160EI8ivFL._AC_UL320_.jpg","4.6","5078","54.99","165"
"B0B3WPNSD6","6 Pieces Mini Decor Trees Small Holiday Branch Village Trees Artificial Model Trees Miniature Trees Village Displays Tree for House Garden Festival Decorations, 3 Sizes (Crows Tree Figurine)","https://m.media-amazon.com/images/I/71VlsbG5aaL._AC_UL320_.jpg","4.4","124","24.99","165"
"B08HYS1Z93","64Pcs 3D bat Stickers, Halloween Party Scary bat murals DIY Home Window Decoration, Removable bat Stickers for Indoor and Outdoor Halloween Wall Decorations","https://m.media-amazon.com/images/I/61JDneZktOL._AC_UL320_.jpg","4.4","778","6.99","165"
"B0B9Y3VX69","Hodao Fall Thanksgiving Scarecrow Couple Table Decorations Indoor, Resin Thanksgiving Scarecrow Figurines-Fall Thanksgiving Gifts-Fall Decorations for Home","https://m.media-amazon.com/images/I/71GeYjl9lPL._AC_UL320_.jpg","4.7","58","17.55","165"
"B0BRT2C165","Tectocker-DOU 2 Pc Deep Floating Shelves ; 15.7” Long x 11.8” Deep Wall Mounted Hanging Shelves for Living Room, Kitchen, Office, Bathroom and Bedroom Decor; Storage and Display Shelf Set","https://m.media-amazon.com/images/I/71IwaTaQKxL._AC_UL320_.jpg","4.6","172","35.99","165"
"B06XSLCKRG","Drink Coasters,PU Leather Bar Beer Beverage Coasters for Drinks Set of 6 with Holder Coasters for Wooden Table Coffee Table Absorbent Drink Coasters,Easy Clean Cup Coasters Easter Housewarming Gifts","https://m.media-amazon.com/images/I/71o+tDDL-ML._AC_UL320_.jpg","4.7","4460","7.99","165"
"B0C7W5DPXD","Sggvecsy Artificial Fall Wreath 22’’ Autumn Front Door Wreath Harvest Wreath with Pumpkin Daisy Berry Maple Leaves Fall Decorations for Outside Indoor Wall Window Festival Thanksgiving Autumn Decor","https://m.media-amazon.com/images/I/91VoxBjRVcL._AC_UL320_.jpg","4.4","51","26.99","165"
"B0C6GLGC5X","SODWEF 7Pcs Artificial Pumpkins Fake Pumpkins Foam Pumpkins Simulation Halloween Pumpkins for Thanksgiving Decor Halloween Party Kitchen Home Decoration (Orange)","https://m.media-amazon.com/images/I/71+bIhFf1XL._AC_UL320_.jpg","4.8","13","15.99","165"
"B09TF7LHB1","BGment Pure White 100% Blackout Curtains for Bedroom, Black Out Living Room 84 inch Panels with Thermal Liner, Rod Pocket and Back Tab Double Layer Room Darkening Drapes, 2 Panels, Each 52 x 84 Inch","https://m.media-amazon.com/images/I/61vxAL3EgTL._AC_UL320_.jpg","4.7","817","29.97","165"
"B08H3STVWG","SHARP Digital Clock with Alarm and Dual USB FastCharge Charging Ports - Charge Your Phone Bedside - Battery Back-up - Easy to Use - Green Display","https://m.media-amazon.com/images/I/719eVraHGRL._AC_UL320_.jpg","4.3","1373","15.99","165"
