"asin","title","imgUrl","stars","reviews","price","category_id"
"B09YQ26Q29","ORIENTAL CHERRY Halloween Decor - Halloween Decorations Indoor - Set of 3 Apothecary Potion Bottles - Black And White Scary Witch Farmhouse Decoration For Tiered Tray Table Home Party Supplies","https://m.media-amazon.com/images/I/81DPLJRMo5L._AC_UL320_.jpg","4.8","155","11.99","165"
"B09WYMMHMY","Set of 3 Assorted Small Potted Succulent Plants Fake Aloe String of Pearls Hops Succulents in Gray Geometric Concrete Ceramic Pots for Gifts Modern Home Office Desk Table Indoor Outdoor Greenery Decor","https://m.media-amazon.com/images/I/81LmY7MCg3L._AC_UL320_.jpg","4.8","290","21.99","165"
"B0812Z7M4L","NCYP Gold Glass Cards Box with Slot and Lock for Wedding Reception - 10.2x5.9x7.9 Inches - Birthdays Party Card Holder, Home Geometric Decorative Box, Large Clear Terrarium (Glass Box Only)","https://m.media-amazon.com/images/I/71uxbPiIglL._AC_UL320_.jpg","4.7","999","39.9","165"
"B0874QLJS5","Coasters for Drinks, Absorbent Ceramic Stone Coasters Set with Metal Holder Stand, Cork Base, Marble Surface Pattern, Cups Place Mats for Home Decor, Set of 6 - White","https://m.media-amazon.com/images/I/51ZStCmD-bL._AC_UL320_.jpg","4.6","4495","11.99","165"
"B08JTLHRV7","2 Pcs Black 4.3 Inch Iron Candle Holder for Taper Candles, Wedding, Dinning, Party Decoration (11cm Black 2pcs)","https://m.media-amazon.com/images/I/61WIfqXF42L._AC_UL320_.jpg","4.7","426","6.99","165"
"B091YZ1L87","DomeStar 38PCS Pine Cone Set, Artificial Acorns Berry Craft and Natural Pinecones Ornament Pine Picks Fake Fruit Decor Fall Decorating Kit","https://m.media-amazon.com/images/I/81YdLBXpTcL._AC_UL320_.jpg","4.3","654","11.99","165"
"B09YHD36G5","Hituiter Halloween Wax melt Warmer Metal Wax Warmer for Scented Wax with 7 Colors LED Changing Wax Burner Melter and Scentsy Warmer for Halloween Decorations Indoor","https://m.media-amazon.com/images/I/819hfJFqgxL._AC_UL320_.jpg","4.5","143","16.99","165"
"B08NYRZWS9","COOLUCK 84Ft 12 Pack Artificial Ivy Leaf Plants Vine with 80 LED String Light,Green Vines Garland, Hanging for Home Kitchen Office Wedding Wall Décor","https://m.media-amazon.com/images/I/81aixUe8JML._AC_UL320_.jpg","4.3","1162","14.99","165"
"B0C5X4CHF4","LANDNEOO 5x7 Picture Frame Set of 4, Wood Farmhouse Style Frames, Display Pictures 5x7 with Mat or 4x6 Without Mat for Wall Mounting or Table Top Display, Multicolour","https://m.media-amazon.com/images/I/81uqB5iRfvL._AC_UL320_.jpg","4.6","355","11.99","165"
"B09W1X4GXG","LURKA Stretch Sofa Slipcovers 1 Piece Couch Covers for 3 Cushion Couch Sofa Furniture Protector Full Sofa Covers with Elastic Bottom for Kids and Dog (Large, Black)","https://m.media-amazon.com/images/I/61egWa6UxJL._AC_UL320_.jpg","4.3","2024","21.99","165"
"B07VRLQXVJ","Mocoosy 50Pcs Artificial Flowers Rose, Ivory White Fake Roses for Decorations, Real Looking Foam Rose Bulk with Stems for DIY Wedding Bouquets Bridal Shower Mothers Day Party Home Decor","https://m.media-amazon.com/images/I/912IGTiGFwL._AC_UL320_.jpg","4.7","3102","21.99","165"
"B098NHW9SW","YGON Digital Alarm Clock with Large Mirror Display, Dual USB Charger Ports, Auto/Custom Brightness, Modern Home Decor for Bedroom, Living Room, Office Desk-Gold","https://m.media-amazon.com/images/I/61s4uyx52jL._AC_UL320_.jpg","4.2","3213","22.59","165"
"B0CBX16K7W","QimCoor Nursery Book Shelves Set of 4+1, 16.5inch Floating Wall Bookshelf for Kids Room, Natural Solid Wood Book Shelf for Baby Nursery Room, Wall Shelves for Bedroom Decor, Toy Storage Shelves","https://m.media-amazon.com/images/I/71vknUuKxeL._AC_UL320_.jpg","4.7","23","23.99","165"
"B09C26XVG7","DearHouse 7Pcs Thanksgiving Artificial Pumpkin Home Decoration Sets, Artificial Vegetables Pumpkin for Fall Halloween Home Decor","https://m.media-amazon.com/images/I/81GZDq9HtYL._AC_UL320_.jpg","4.0","158","25.99","165"
"B076DLSSTS","Creative Hobbies® - Bulk Value Pack of 25 pcs - 67mm (2-5/8 Inch) Round Clear Plastic Ball Ornaments - Great for Crafting DIY Christmas Ornaments","https://m.media-amazon.com/images/I/41hVr7Eh5QL._AC_UL320_.jpg","4.7","1780","19.99","165"
"B086L65TBW","DALIX 82.5"" White Vertical Blinds Replacement Slats Sliding Door Window (4 Pack)","https://m.media-amazon.com/images/I/61DfcqfFI1L._AC_UL320_.jpg","4.5","677","19.99","165"
"B01BO41OUK","Bath and Body Works Japanese Cherry Blossom 3-Wick Candle 14.5 Ounce","https://m.media-amazon.com/images/I/61KZ1R4oMCL._AC_UL320_.jpg","4.6","2122","21.97","165"
"B094Q691VQ","SPACEKEEPER Backflow Incense Holder Ceramic Incense Burner Waterfall, Aromatherapy Ornament Home Decor with 120 Backflow Incense Cones & 30 Incense Stick, Jet Black","https://m.media-amazon.com/images/I/71+lSuGPW1L._AC_UL320_.jpg","3.9","39951","19.99","165"
"B00XKMJZY2","hito 10 Inch Silent Wall Clock Battery Operated Non ticking Glass Cover Silver Aluminum Frame, for Kitchen, Bedroom, Home Office, Living Room Decor (White)","https://m.media-amazon.com/images/I/81D15upHcgL._AC_UL320_.jpg","4.5","10755","15.99","165"
"B0C61LP71Q","21 PCS Halloween Ghost Candles Spooky Candles White Floating Candles Halloween Decorative Tabletop Candle White Dripless Wax Burning Candles for Halloween Party","https://m.media-amazon.com/images/I/71ZiCIiR1sL._AC_UL320_.jpg","4.6","6","24.99","165"
"B0CBWMBN49","Please Dont Summon Demons In The Bathroom - Gothic Bathroom Decor, Funny Halloween Decorations Outdoor, Goth Room, Witchy Décor, Aluminum Sign Rust Free 9"" X 11"", Pre-Drilled Holes, Weather Resistant","https://m.media-amazon.com/images/I/71uU7rrsfaL._AC_UL320_.jpg","4.3","8","9.95","165"
"B08XY2FKQM","LINXTAR 2 Panels White Wedding Arch Drapery 6 Yards Long and 30'' Wide Sheer Chiffon Wedding Arch Draping Fabric for Party Backdrop Ceremony Decoration","https://m.media-amazon.com/images/I/61WBGDxTZCL._AC_UL320_.jpg","4.6","113","24.99","165"
"B0C1YKW2M6","TR-LIFE 3 Pack 10 Inch Large Plate Stands for Display - Metal Plate Holder Display Stand + Picture Frame Holder Stand + Small Easels for Decorative Plate, Platter, Book, Plaques, Photo, Tabletop Art (3 Pack)","https://m.media-amazon.com/images/I/71K6nenRXEL._AC_UL320_.jpg","4.7","48","18.99","165"
"B07YBZWZL9","KISEER 100 Pcs Artificial Acorns Bulk Small Fake Lifelike Simulation Acorn with Natural Cap for Crafts, Wedding, Home Vase Filler Decor","https://m.media-amazon.com/images/I/817JEoMu97L._AC_UL320_.jpg","4.3","484","12.99","165"
"B0C4DX5YDK","KAMANINA 1 Inch Single Curtain Rod 32 to 58 Inch(2.6-4.8Ft), Antique Bronze Adjustable Drapery Rod for Windows, Decorative Netted Texture End","https://m.media-amazon.com/images/I/61lQFrTbTtL._AC_UL320_.jpg","4.7","44","18.99","165"
"B0BZQQ7S1Y","Hallmark Keepsake Christmas Ornament 2023, Frosty Friends 2023, Snowman Gifts","https://m.media-amazon.com/images/I/A1xzio4ZYLL._AC_UL320_.jpg","4.9","393","16.99","165"
"B07MJ9PLVS","MaxMau 24pcs Mini Glass Bottles with Cork Stoppers 5ml DIY Art Crafts Storage Container,Tiny Glass Vials Cork for Wedding Decoration,Small Glass Corks Jars Party Favor","https://m.media-amazon.com/images/I/91PiQ2wrJyL._AC_UL320_.jpg","4.7","1321","7.99","165"
"B0C6KHZ3BK","CALCHELE Curtain Rods, Black Curtain Rods 28 to 62 Inch, 5/8 Inch Small Curtain Rod Set, Heavy Duty Drapery Rods with Brackets, Rustic Matte","https://m.media-amazon.com/images/I/71XyXbc3FrL._AC_UL320_.jpg","4.3","24","13.95","165"
"B07XQ2V2KX","128 Pieces Photo Clips Mini Plastic Clear Clips Clothespins Transparent for String Fairy Lights Color Clear Picture Polaroid Clips as","https://m.media-amazon.com/images/I/71LKgUx8amL._AC_UL320_.jpg","4.7","1768","7.79","165"
"B08HXV7NC1","Halloween Metal Signs No Trespassing We're Tired of Hiding the Bodies Metal Sign Retro Fashion Chic Funny Metal Tin Sign for Halloween Decorations","https://m.media-amazon.com/images/I/A1-SRhFdCWL._AC_UL320_.jpg","4.6","277","6.99","165"
"B01D1HEP0E","LA JOLIE MUSE Candles Gifts for Women, Candles for Women with Gift Box, Jasmine Scented Candle, Candles for Home Scented, Natural Soy Candles, 70 Hours 10 oz","https://m.media-amazon.com/images/I/71tEaiNNonL._AC_UL320_.jpg","4.5","11279","23.99","165"
"B0C77N87TN","3 Sheets Glow in The Dark Halloween Window Clings Luminous Halloween Window Stickers Removable Pumpkin Ghost Wall Decor Glowing Window Clings for Scary Halloween Theme Party Decorations","https://m.media-amazon.com/images/I/71gKVTOO7NL._AC_UL320_.jpg","3.8","14","13.99","165"
"B0CBWL2ND2","Funny Black Goth Sign Skull Let That Shit Go Metal Signs for Skeleton Halloween Goth Bathroom Decor 8x12 Inch","https://m.media-amazon.com/images/I/61fE8H1XhxL._AC_UL320_.jpg","4.9","25","12.98","165"
"B08FM2V9T9","SESEAT 4x6 Wall Hanging Picture Frames Collage with 4 Opening Distressed White Frames","https://m.media-amazon.com/images/I/71+UQ3-pv8L._AC_UL320_.jpg","4.8","2288","11.99","165"
"B011MYXY9G","Malden International Designs Silkscreened Corinthians Verse Mr & Mrs Wood Picture Frame, 5x7, Off White","https://m.media-amazon.com/images/I/91dNJ5MMW7L._AC_UL320_.jpg","4.8","1771","20.1","165"
"B009U20FI6","Kenney KN71604 Rachel Fluted Knob End Standard Decorative Window Curtain Rod, 28-48"" Adjustable Length, Antique White Finish, 5/8"" Diameter Steel Tube","https://m.media-amazon.com/images/I/71A73drXp8L._AC_UL320_.jpg","4.7","2984","14.41","165"
"B016MB5K0A","Deconovo 100% Blackout Curtains Solid Room Darkening Thermal Insulated Grommet Window Black Curtain Living Room, 42x63 Inch,1 Panel","https://m.media-amazon.com/images/I/61dhzAmqvOL._AC_UL320_.jpg","4.6","38447","9.99","165"
"B00UTXYVTY","Westclox 72028 Fold-Up Travel Alarm Clock, Medium, Black","https://m.media-amazon.com/images/I/81l1DdCwALL._AC_UL320_.jpg","4.0","379","12.17","165"
"B08M8Z2NZS","VASAGLE Corner Shelf Wall Mount, 5-Tier Floating Corner Bookshelf, Plant Shelf for Bedroom, Living Room, Bathroom, Home Office, Simply Black ULBC072B01","https://m.media-amazon.com/images/I/41opI5ruVPL._AC_UL320_.jpg","4.6","3369","29.99","165"
"B0833Y7MS4","Static Cling Total Blackout Window Film 100% UV Blocking Window Darkening Film Black Opaque Privacy Window Tint Removable Plastic Glass Covering(17.7x78.7 inches)","https://m.media-amazon.com/images/I/71UTEhFRUzL._AC_UL320_.jpg","4.1","3521","9.49","165"
"B003WCQOCG","Kenney 506AP Classic 2.5 Adjustable Projection, 28 to 48-Inch Wide Pocket Curtain Rod, White","https://m.media-amazon.com/images/I/61LxDSg66LL._AC_UL320_.jpg","4.3","1476","14.99","165"
"B00H6V8O4K","DW Home Medium Single Wick Candle, Warm Tobacco Pipe,Black,10.35 Oz.","https://m.media-amazon.com/images/I/81zl+cmj1cL._AC_UL320_.jpg","4.3","586","18.0","165"
"B0C9C4B4NS","12pack Floating LED Candles with Remote Control, Indoor Halloween Decorations for Home, Battery Operated Window Tabler Candle Set for Parties, Birthdays, Weddings, and Church Supplies","https://m.media-amazon.com/images/I/818v6RLViDL._AC_UL320_.jpg","3.8","96","21.99","165"
"B098PYNJ18","Campsis Wedding Corsage Boutonniere Set Pink Rose Flower Wrist Bride Buttonholes Flower Decor Bride Girls Lady Accessories for Prom and Dinner Party(2pcs)","https://m.media-amazon.com/images/I/612xq-2cOwS._AC_UL320_.jpg","4.1","155","13.99","165"
"B09KV1VX3P","smtyle Black Candlestick Holders for Taper Candles Set of 5 Candelabra with Iron-0.8"" Diameter Ideal for Halloween Decor","https://m.media-amazon.com/images/I/6164ZyQ8SgL._AC_UL320_.jpg","4.4","305","21.9","165"
"B01145L2JM","MIER Portable Thermal Insulated Cooler Bag Mini Lunch Bag for Kids, Black","https://m.media-amazon.com/images/I/71Nwo7HQilL._AC_UL320_.jpg","4.5","4917","10.49","165"
"B00B5XNR8S","Swan Creek Candle Soy Drizzle Melt 4.75 Oz. - Pumpkin Vanilla","https://m.media-amazon.com/images/I/51D1Ykxd9YL._AC_UL320_.jpg","4.7","543","8.99","165"
"B01LZVKQ1X","Photo Booth Frames - 4x6 Inch Clear Acrylic Plastic Display, Slanted Back Vertical Standing Picture or Display Sign Holder with Inserts - 12 Count","https://m.media-amazon.com/images/I/51izXba7ZWL._AC_UL320_.jpg","4.5","715","16.88","165"
"B0BHYZ1PDM","Der Rose 2 Packs Small Fake Plants Artificial Plants for Home Bedroom Aesthetic Living Room Bathroom Farmhouse Decor Indoor","https://m.media-amazon.com/images/I/81QXFQke5aL._AC_UL320_.jpg","4.4","417","8.49","165"
"B0BC6BFXVV","Honeymoon Sand Keepsake Jar, Romantic Honeymoon Gifts for Newlywed Couple, Bride & Groom, Bridal Shower Gifts, Wedding Registry, Engagement, Unique Travel Gift Ideas, Honeymoon Essentials (Heart Shaped Jar-2023)","https://m.media-amazon.com/images/I/81n7n5xWTFL._AC_UL320_.jpg","4.8","199","9.99","165"
"B086BF1KX5","Creative Hobbies Electric Window Candle Lamp with Brass Plated Base, Dusk to Dawn Sensor Turns Candle on in Dark and Off in Light, Ready to Use!","https://m.media-amazon.com/images/I/71CiiSIvkiL._AC_UL320_.jpg","4.4","1828","8.95","165"
"B07BM9ZCSB","Pearhead Heart Thumbprint Keepsake Photo Frame And Ink Kit, Tabletop And Wall Mount Picture Frame, Wedding Registry, Wedding Reception Or Bridal Shower Gifts, 4x6 Photo, White","https://m.media-amazon.com/images/I/81+BRGb-vPL._AC_UL320_.jpg","4.7","2372","14.99","165"
"B07WLXXDQ4","Music Box Hand Crank Engraved Musical Box-U R My Sunshine Mechanism Antique Vintage Personalizable Gift for Mom from Daughter","https://m.media-amazon.com/images/I/71kOBkEr9pL._AC_UL320_.jpg","4.6","18172","13.99","165"
"B0C5MF59WK","Sending Sunshine Gift, 11 Pcs Sunflower Gifts for Women, Care Package, Get Well Soon Gifts Basket Unique Birthday Gifts Box with Inspirational Blanket Candle for Thinking of You Her Sister Best Friend","https://m.media-amazon.com/images/I/81MXBzbozeL._AC_UL320_.jpg","4.4","33","59.99","165"
"B0BPYQVRFN","EOSAHR Farmhouse Wood Riser for Room Decor : Decorative Pedestal Stand For Display Your Home Decorations and Uniquely Soap Stand - Rustic Bathroom Counter Tray and Kitchen Counter Decor (Natural Wood)","https://m.media-amazon.com/images/I/81aIxlOA0+L._AC_UL320_.jpg","4.7","264","15.98","165"
"B01LY8C4RI","Iconikal 24-Photo Clear Cover Photo Album, 4 x 6-Inch, 5-Pack","https://m.media-amazon.com/images/I/71mffyKMttL._AC_UL320_.jpg","4.5","1330","7.29","165"
"B0C4MXX22B","CIR OASES Thanksgiving Fall Wreath Berries Pumpkins Lamb Ears Leaves Autumn Wreaths for Front Door, Fall Decor, Porch Wall, Home Outdoor Holiday Decorations, Wreath for Autumn Halloween Thanksgiving","https://m.media-amazon.com/images/I/81HSe7CoV7L._AC_UL320_.jpg","4.4","15","35.99","165"
"B0B4DDGHRR","Amootek Tabletop Fountain Waterfall Fountain Office Tabletop Fountain Includes Many Natural River Rocks Decorated with Colorful Light 6.3"" L x 5.12"" W x 8.66"" H","https://m.media-amazon.com/images/I/61eATaAT6lL._AC_UL320_.jpg","4.3","270","23.95","165"
"B0BR6ZSZ6D","Vision Home Natural Pinch Pleated Full Blackout Curtains Linen Blended Room Darkening Window Curtains 95 inch for Living Room Bedroom Thermal Insulated Pinch Pleat Drapes with Hooks 2 Panel 40""Wx95""L","https://m.media-amazon.com/images/I/8115S8kEQyL._AC_UL320_.jpg","4.8","64","74.99","165"
"B09X9QPJSF","Coferset 40pcs Silk Sunflower Heads with Stems, 4"" Artificial Sunflower Heads,Fake Sunflower for Baby Shower Wedding Decoration Bridal Bouquet DIY Handicrafts (Yellow)","https://m.media-amazon.com/images/I/81Wo0q0iwqL._AC_UL320_.jpg","4.6","65","14.99","165"
"B09JSBYWZ7","Kayfia Artificial Plants for Home Decor Indoor Faux Plant Fiddle Leaf Fig Tree 31.5"" Tall with 24 Leaves & Pot Large Fake Plant for Office Modern Decoration Housewarming Gift","https://m.media-amazon.com/images/I/61AJq7+xE4L._AC_UL320_.jpg","4.3","160","18.89","165"
"B0BHYW885R","Der Rose 6 Packs Fake Plants Small Realistic Succulents Plants Artificial for Home Room Decor Indoor","https://m.media-amazon.com/images/I/71uTp4pdexL._AC_UL320_.jpg","4.6","174","9.99","165"
"B08BKM4M1T","ZeeDix 2 Pcs Halloween Lace Skull Window Curtain- Black Tassel Door Curtain for Halloween Home Party Decorations, Halloween Party Supplies","https://m.media-amazon.com/images/I/810RluDYNkL._AC_UL320_.jpg","4.6","701","9.99","165"
"B0753HH1JT","Americanflat 11x14 Floating Picture Frame in Black - Use as 11x14 Frame, 8x10 Floating Frame, or 5x7 Floating Frame with Polished Glass and Hanging Hardware - Horizontal and Vertical Formats for Wall","https://m.media-amazon.com/images/I/71MBmUCRWKL._AC_UL320_.jpg","4.7","1933","16.99","165"
"B006VE59QO","White Votive Candles - Box of 72 Unscented Candles - 10 Hour Burn Time - Bulk Candles for Weddings, Parties, Spas and Decorations","https://m.media-amazon.com/images/I/61S1zPEiI2L._AC_UL320_.jpg","4.4","2170","27.99","165"
"B0BHHG6ZGC","Grovind Plastic Ashtrays for Cigarettes and Cigars, Indoor Outdoor Ash Tray Large Size Tabletop Ashtray Decor for Home Office Restaurant Patio Bar - Pack of 4 Colors Mixed (Black/Blue/Green/Red)","https://m.media-amazon.com/images/I/71-eP9367lL._AC_UL320_.jpg","4.3","460","8.49","165"
"B07LH6B9C6","AK TRADING CO. 10 feet x 10 feet Polyester Backdrop Drapes Curtains Panels with Rod Pockets - Wedding Ceremony Party Home Window Decorations - Black","https://m.media-amazon.com/images/I/61XvosckVxL._AC_UL320_.jpg","4.5","3085","29.71","165"
"B001F8TLLU","Baby Briefcase Baby Paperwork Organizer, Mint/Periwinkle","https://m.media-amazon.com/images/I/91didHaLWHL._AC_UL320_.jpg","4.8","1666","29.95","165"
"B09BDXPQBN","PALANCHY Wax Melt Warmer Ceramic 3-in-1 Oil Burner Electric Candle Wax Warmer Burner Melter Fragrance Warmer for Scented Waxs Home Office Bedroom Aromatherapy Gift& Décor","https://m.media-amazon.com/images/I/71SBCtAtHuL._AC_UL320_.jpg","4.5","2134","12.99","165"
"B071XZ3748","Photo Booth Frames - 5x7 Inch Clear Acrylic Display, Slanted Back Vertical Standing Plastic Picture or Display Sign Holder with Inserts - 12 Count","https://m.media-amazon.com/images/I/51EFOIgAi5L._AC_UL320_.jpg","4.7","631","19.95","165"
"B08YRKB84H","Magnetic Curtain Tiebacks, 2 Pack Colorful Agate Tassel Curtain Drapery Holdbacks, Boho Curtain Ties for Home Office Decorative","https://m.media-amazon.com/images/I/81Oo2OvQUZL._AC_UL320_.jpg","4.6","1516","16.99","165"
"B0CB5BWQ4F","3D Halloween Wall Decals, Ghost Halloween Wall Stickers Halloween Floor Decals Removable, Scary Wall Decals Stickers Decorations for Bedroom, Halloween Wall Window Stickers Clings for Glass Window","https://m.media-amazon.com/images/I/61ahyvLiIpL._AC_UL320_.jpg","3.9","10","9.99","165"
"B077PNKL7T","junovo Ultra Soft Rug for Nursery Children Room Baby Room Home Decor Dormitory Hexagon Carpet for Playhouse Princess Tent Kids Play Castle, Diameter 4.6 ft, Pink","https://m.media-amazon.com/images/I/81pcBs1+BqL._AC_UL320_.jpg","4.7","7748","21.49","165"
"B0BG236DLB","CADNLY Mini Artificial Plants Set - Faux Plants Indoor Small Fake Plants for Bathroom Office Desk - Green Plants Fake Potted Plants - Plastic Small Plants Decor for Shelf Shelves 3 Pack","https://m.media-amazon.com/images/I/71WHdOJ2MFL._AC_UL320_.jpg","4.3","291","8.99","165"
"B07F8LJJHK","kennethan Rustic Brown 11x14 Picture Frame Wide Molding - Wall Mounting Material Included…","https://m.media-amazon.com/images/I/81cmhZpMwHL._AC_UL320_.jpg","4.7","8598","14.95","165"
"B09376QMCN","HIIMIEI Clear Acrylic Display Risers 2 Sets, 3-Tier Risers Stands Showcase for Amiibo Funko Pop Figures, Dessert, Jewelry-3""x4""x5""","https://m.media-amazon.com/images/I/513oHwoirOS._AC_UL320_.jpg","4.6","491","20.99","165"
"B09KGC9KFC","QBestry Stud Earring Organizer for Girls Stud Box for Earrings Necklace Jewelry Organizer Studs,Girls Earring Box for Womens, Holder Rings Organizer Jewelry Earring Storage Box,Pink","https://m.media-amazon.com/images/I/81px4zTMLKL._AC_UL320_.jpg","4.6","2841","22.99","165"
"B09MD7T5MS","Double-Sided Printing - to My Bestie Because of You I Laugh a Little Harder Thank You for Being My Unbiological Sisters Personalized Friendship Birthday Gift Bestie Friend Candle Holder Sister Candle","https://m.media-amazon.com/images/I/71iUVSe8fyL._AC_UL320_.jpg","4.5","1598","11.99","165"
"B09XJV4RTS","Gold Glass Card Box Wedding - Card Holder Wedding Box Gold Glass Wedding Envelope Box Rectangle Shape with Slot and Foot Perfect for Wedding Reception, Party Ceremony Centerpiece","https://m.media-amazon.com/images/I/71LbPNI4nmL._AC_UL320_.jpg","4.7","231","39.99","165"
"B0CB3KTZ1W","Krissing Artificial Fall Flowers with Metal Pot Faux Autumn Hydrangea Silk Flowers Bouquets with Fall Floral Stems Fall Flowers Arrangements for Table Centerpieces Vase Mantle Home Fall Decor","https://m.media-amazon.com/images/I/71886WzMx8L._AC_UL320_.jpg","4.2","35","27.99","165"
"B0BNX67DKG","YNL Tension Curtain Rod - No Drill, Non-Slip Spring Tension Rods for Window & Closet & Door, 30 to 48 inches(2.5-4ft), Closet Rod Stainless Steel, Warm Gold","https://m.media-amazon.com/images/I/614EDr7nqZL._AC_UL320_.jpg","4.6","407","25.99","165"
"B0B8NG95J7","Set of 20 White Spell & Chime – Premium Mini Taper Candles for Rituals, Prayer, Birthdays, Meditation, Altar - 4 Inch Tall, Unscented (White)","https://m.media-amazon.com/images/I/618q6wI2ZUL._AC_UL320_.jpg","4.5","468","9.99","165"
"B0B1ZP645F","Natural Linen Back Tab Curtains 84 Inch Length for Living Room 2 Panel Pocket Drape Light Filtering Semi Sheer Neutral Country Rustic Farmhouse Boho Curtain for Bedroom Muslin Look Ivory Cream Colored","https://m.media-amazon.com/images/I/81-CE330lnL._AC_UL320_.jpg","4.6","1715","25.99","165"
"B0B2QMKRBX","Cute Mushroom Ashtray with Stainless Steel Tray for Cigarette, Natural Resin Ash Tray for Indoor or Outdoor use, Ash Holder for Home and Garden Decor","https://m.media-amazon.com/images/I/71f9nCDA5SL._AC_UL320_.jpg","4.7","304","7.99","165"
"B07P7FCQWG","LaVie Home 5x7 Picture Frames (3 Pack, Distressed White Wood Grain) Rustic Photo Frame Set with High Definition Glass for Wall Mount & Table Top Display","https://m.media-amazon.com/images/I/71nykIs62KL._AC_UL320_.jpg","4.7","7310","15.29","165"
"B07F1Q1SVP","U'Artlines 2Bouquet 10Heads Artificial Peony Silk Flower Leaf Home Office Wedding Party Festival Bar Decor (White)","https://m.media-amazon.com/images/I/61KPnC7kSWL._AC_UL320_.jpg","4.6","1271","16.58","165"
"B00XA4S19A","Redi Shade No Tools Original Room Darkening Pleated Paper Shade Gray, 36 in x 72 in, 6 Pack","https://m.media-amazon.com/images/I/51hJFg6vDYL._AC_UL320_.jpg","4.1","2351","32.4","165"
"B08VHJX54F","42 Pack Curtain Rings with Clips 1.26"" Interior Diameter,Metal Drapery Ring with Clips Compatible with up to 1 inch Drapery Rod,Strong Vintage Decorative Rustproof Drapery Ring with Hooks(Black)","https://m.media-amazon.com/images/I/81T34PRvLKL._AC_UL320_.jpg","4.7","1162","8.99","165"
"B09FF6QK5C","WARecorderM 8x10 Picture Frames Set of 4 - High Definition Glass New Patten Frame - Wall Mounting Frame Horizontal Vertical Format, White","https://m.media-amazon.com/images/I/81qsiQJpvqL._AC_UL320_.jpg","4.6","623","23.58","165"
"B06XWJ4BWY","The Wreath Depot Highland Silk Fall Door Wreath 24 Inch, Full Handcrafted Autumn Front Door Wreath, Designed in USA, Beautiful White Gift Box Included","https://m.media-amazon.com/images/I/81mvUiis8VL._AC_UL320_.jpg","4.6","564","79.99","165"
"B0C5JRP2VQ","Artmag Artificial Pumpkins Bulk 12Pcs Assorted Sizes Harvest Lifelike Pumpkin Fake Foam Pumpkin for Fall Autumn Halloween Home Party Thanksgiving Party Holiday Decor Caramel","https://m.media-amazon.com/images/I/61z45x+eB7L._AC_UL320_.jpg","4.1","21","15.99","165"
"B0875GRVJ6","Set of 48 Unscented Floating Candles for Centerpieces, 2 Inch Small Floating Candles for Holiday, Weddings, Parties, Special Occasions and Christmas Home Decorations","https://m.media-amazon.com/images/I/41qXWsE-ymL._AC_UL320_.jpg","4.5","1079","20.99","165"
"B078WYBNMD","Satya Sai Baba Super Hit Incense Sticks, 100-gram (Pack of 2)","https://m.media-amazon.com/images/I/81jHXRlY79L._AC_UL320_.jpg","4.7","662","8.98","165"
"B08P51DPYK","Shelving Solution Wall Sconce, with Tea Light Candle Holder Antique Bronze Style Metal Wall Art Decorations for Living Room, Bathroom, Dining Room and Office, Set of 2","https://m.media-amazon.com/images/I/81RNbqgUqmL._AC_UL320_.jpg","4.5","5308","25.98","165"
"B0BVVTLYYV","Homsolver Scented Candles, Black Cedar & Sandwood Candles for Men, Candles for Home Scented, Aromatherapy Soy Candles, 50 Hour Burn, Ideal Gifts for Men","https://m.media-amazon.com/images/I/712thtvmA2L._AC_UL320_.jpg","4.1","281","17.99","165"
"B09Y5DT3ZZ","SXboxing Absorbent Car Cupholder Coaster 2 Pack,Ceramic Stone with a Finger Notch for Women & Lady,Cork Base Drink Coasters 2.56 Inch,Cute Auto Accessories Gifts - Cute Black Polka Dot","https://m.media-amazon.com/images/I/61XYzRMtzoL._AC_UL320_.jpg","4.7","158","6.99","165"
"B001TO8KN0","Hem Precious Lavender Incense Cones - Pack of 12 - 120 Count - Hem Incense of India","https://m.media-amazon.com/images/I/714glagGemL._AC_UL320_.jpg","4.5","1480","7.93","165"
"B09PG8DKHY","XUANLUO 3 Pack 5x7 Inch Picture Frames Farmhouse Rustic Vintage Distressed Wood Grain Photo Frame with Tempered Glass for Table Top Display and Wall Hanging","https://m.media-amazon.com/images/I/81qZY21cmGL._AC_UL320_.jpg","4.6","577","24.99","165"
"B0B1MSPYYJ","Cocomong Fall Decor - Fall Decorations for Home, Fall Tiered Tray Decor, 11 PC Pumpkin Fall Decorative Signs, Farmhouse Fall Gnome Plush for Table Decor, Farm Fresh Truck for Serving Tray","https://m.media-amazon.com/images/I/81bwT8Q2hhL._AC_UL320_.jpg","4.7","37","20.99","165"
"B0C5DFKF4N","WATINC Fall Thanksgiving Wooden Maple Leaves Burlap Buffalo Plaid Faux Foam Pumpkins Mini Crate Table Centerpiece, Autumn Farm Fresh Pumpkins Sign Tiered Tray Table Home Decor Supplies(62Pcs)","https://m.media-amazon.com/images/I/91kCFLLbH7L._AC_UL320_.jpg","3.8","14","13.99","165"
"B000JGDLLU","Screaming Meanie 220 Alarm Clock and Timer | Extremely Loud for Deep Sleepers | Multi-Purpose| 3 Sound Levels | Assorted Colors","https://m.media-amazon.com/images/I/71oDUzAirIL._AC_UL320_.jpg","4.4","2541","41.99","165"
