"asin","title","imgUrl","stars","reviews","price","category_id"
"B0BJTTC5YQ","Oun Nana 144 PCS Playdough Tools Set for Kids, Playdough Accessories Various Shape Molds, Animal, Dinosaur, Stamps, Letters, Numbers, Extruder, Scissors, Cutters, Rollers, Dough Mat with Storage Bag","https://m.media-amazon.com/images/I/81e83Zv1ldL._AC_UL320_.jpg","4.9","18","39.99","219"
"B0C9L3TWG4","Monster Truck Party Favors Serve 12 including Drinking Straws, Mini Pull Cars, Keychains, Gift Bags, DIY Stickers, Temporary Tattoos, Monster Truck Party Supplies for Kids, Boys, Birthday, School Pirze","https://m.media-amazon.com/images/I/81yKWX2uekL._AC_UL320_.jpg","4.4","21","19.99","219"
"B0BL12L7SZ","Wedding Stickers - Cute Stickers,50 Pcs Cartoon Kawaii Decals for Girls,Happy Birthday Party Supplies,Waterproof Vinyl Stickers,Decorations for Phone Guitar Laptop Water Botter,Gift to Family Friends (Wedding sticker)","https://m.media-amazon.com/images/I/81Z-hhxgf6L._AC_UL320_.jpg","4.5","40","6.99","219"
"B08NKB3W5W","JoJo Siwa Painting Craft Kit for Girls, Paint Your Own Bow Figurines Arts & Crafts Plaster Activity Set for Kids Include Paint, Paintbrush & Glitter for Decorating","https://m.media-amazon.com/images/I/91o-VuVpiwL._AC_UL320_.jpg","4.4","357","15.95","219"
"B01C688X70","Nightmare Before Christmas Temporary Tattoos and Stickers Party Supplies Pack","https://m.media-amazon.com/images/I/71ZyuATjbXL._AC_UL320_.jpg","4.4","35","7.95","219"
"B08JF6DX8N","Halloween Magic Scratch Crafts for Kids and Adults - DIY Halloween Decorations - Haunted House Arts and Crafts Ornaments - Includes 24 Haunted House Ornaments, 24 Scratch Sticks, 24 Satin Cord Ribbons","https://m.media-amazon.com/images/I/71PCyViOxsL._AC_UL320_.jpg","4.6","156","5.99","219"
"B0875Z9QNV","Made By Me Mixy Squish Rainbow Mega Pack by Horizon Group USA, Includes 12 oz. of Pre-Made Air Dry Clay, Sensory Play, 12 Colors, 5 Different Crunchy, Bumpy, Soft Textures, Dries Squishy & Smooth","https://m.media-amazon.com/images/I/81euBUev4MS._AC_UL320_.jpg","4.3","198","11.99","219"
"B01N240CLA","Play-Doh Star Wars BB-8 and R2-D2 (Amazon Exclusive)","https://m.media-amazon.com/images/I/81J300h2ahL._AC_UL320_.jpg","4.7","1395","27.99","219"
"B0BGD8N11Z","DaoChuang 100 Cute Water Bottle Animal Stickers Kids Love. Aesthetic Small Stickers for Computer, Laptop, Guitar, Skateboards for Kids Teen Girls.Waterproof Vinyl Various Stickers, Sticker Packs","https://m.media-amazon.com/images/I/81N81M8vF-L._AC_UL320_.jpg","4.5","5","7.99","219"
"B084L4YQHB","TINYMILLS 24 Pcs Narwhal Multi Point Pencils Stackable Stacking Push Pencils Assortment with Eraser for Girl Birthday Party Favor Goodie Bag Stuffers Carnival Prizes Classroom Rewards","https://m.media-amazon.com/images/I/71FXSYEsHoL._AC_UL320_.jpg","4.6","130","12.99","219"
"B00W4A094Q","Shark Photo Realistic ROLL Sticker - Stationery - 1 Piece","https://m.media-amazon.com/images/I/718sHmm-LrL._AC_UL320_.jpg","4.6","432","5.27","219"
"B0C3CWPNX8","145 Pcs Cute Temporary Tattoos for Kids, 8 Sheets Birthday Party Supplies Cartoon Party Decorations Fake Tattoos Stickers Party Favors for Kids Boys Girls Party Gifts Rewards Stickers Party Decor","https://m.media-amazon.com/images/I/61JzJM+7ZJL._AC_UL320_.jpg","4.3","5","7.99","219"
"B00DCH4WAM","Harrisville Designs Friendly Loom Potholder Cotton Loops 10 Inch Pro Size Loops Make 2 Potholders, Weaving Crafts for Kids and Adults-Peacock","https://m.media-amazon.com/images/I/81oRD0K4cAL._AC_UL320_.jpg","4.4","39","16.99","219"
"B0BL5MS9RB","Aqua Gelz™ 3D Magic Gel | Create Unique Crafts Soft Figures | Craft Kit | Unique Arts & Crafts for Kids | Squishy Maker Machine | Water Toys | Kid Toys Girls Boys| Make Your Own (GLOWZ Park Playset)","https://m.media-amazon.com/images/I/81knvXQyFUL._AC_UL320_.jpg","3.7","44","29.99","219"
"B0C36ZYXT8","GSSHBR Sidewalk Chalk With Holder for kids, 12Pack Non-toxic Dust-free Washable Chalks Pastel Drawing Writing for Outdoor Art Play,Blackboard,Toys Gift","https://m.media-amazon.com/images/I/61QLTDOKKJL._AC_UL320_.jpg","3.6","17","7.76","219"
"B0BBQ7254C","Large Stickers (24 pcs 2.5""x3.5"") Vintage Vampires Thriller Movies Posters Halloween Dracula","https://m.media-amazon.com/images/I/814Z+ZZLABL._AC_UL320_.jpg","4.8","9","9.95","219"
"B014VGJZ7W","Silly Germ Stickers - Prizes and Giveaways - 100 per Pack","https://m.media-amazon.com/images/I/71kmmPF69AL._AC_UL320_.jpg","4.6","171","11.99","219"
"B005EYY274","Foam Silly Monsters Magnet Craft Kit - Crafts for Kids and Fun Home Activities","https://m.media-amazon.com/images/I/71eiDSq+muL._AC_UL320_.jpg","4.3","185","9.99","219"
"B075FB3ZL9","Mimtom Drawing Stencil Kit for Kids, 58 PC Art Set with 370+ Shapes, Sketch Pad, and Colored Pencils for DIY Arts and Crafts for Boys and Girls, Draw with Letter, Animal and Car Stencils, Pink","https://m.media-amazon.com/images/I/81ovuvJhgZS._AC_UL320_.jpg","4.7","466","26.98","219"
"B097MM9YN1","Outus Wooden DIY Craft Doodle Small Bird House Set Include Unfinished Wood Mini Bird House to Paint and Watercolor Paint Pen and 3D Butterfly Wall Sticker Decals for Kids Adults (37)","https://m.media-amazon.com/images/I/81FQySuG5xL._AC_UL320_.jpg","3.7","96","25.99","219"
"B08XBPVW3M","Westcott Student Non-Stick Scissors, 7"" (17832)","https://m.media-amazon.com/images/I/71oyLTyMoKL._AC_UL320_.jpg","4.8","36","5.32","219"
"B0BZD8H77S","Fuutreo 64 Pcs Sea Theme DIY Scratch Cards Set Birthday Party Supplies Favor Rainbow Color Scratch Art with Wooden Styluses Ribbon Craft Kit for Kid Birthday DIY Art Themed Party Classroom Decor","https://m.media-amazon.com/images/I/71RDz+1xpzL._AC_UL320_.jpg","5.0","6","9.99","219"
"B09N4PT2B6","Zagtoon Miraculous Ladybug Sticker Pack Bundle ~ 295+ Superhero Stickers Featuring Miraculous Ladybug (Miraculous Ladybug Party Favors)","https://m.media-amazon.com/images/I/81C7SU3a4KL._AC_UL320_.jpg","4.4","78","6.95","219"
"B09NQ57F96","Wooden Tree Toy Pack of 8 Wood Miniature Tree Set Various Sizes Natural Wooden Trees Mini Trees for Home Decor and Crafts Garden Accessories Creative Gift for 36+ Months","https://m.media-amazon.com/images/I/71NyzgZba-L._AC_UL320_.jpg","4.7","32","18.95","219"
"B0BR3LRXMM","Jenaai 3 Pcs Lemon Kids Apron with Pockets Adjustable Strap Toddlers Waterproof Apron for Boys and Girls Cooking, Baking, Painting, Kitchen Apron, 6-12 Years","https://m.media-amazon.com/images/I/71u5XKXTvML._AC_UL320_.jpg","4.7","16","16.99","219"
"B0BYRGF749","100 Pcs Cute Cartoon Ocean Animal Stickers, Waterproof Vinyl Sea Life Sticker Pack, Stickers for Kids Water Bottles Laptop Phone Guitar Bike Teen and Girls","https://m.media-amazon.com/images/I/71RJMCttRQL._AC_UL320_.jpg","5.0","15","8.99","219"
"B09DL6GD2V","HYUGF Moving Sand Art Picture Decor, 3D Deep Sea Sandscape Liquid Motion, Round Glass Frame Display Flowing Sand Relaxing Gift for Kids Adults Home Office Work Desktop Decoration Toy (Black, 7"")","https://m.media-amazon.com/images/I/7163AAZyJXL._AC_UL320_.jpg","4.2","394","14.95","219"
"B07QFC1VDR","Fun Express Base Ten Place Value Mat - 10 Pieces - Educational and Learning Activities for Kids","https://m.media-amazon.com/images/I/61scKTLlRmL._AC_UL320_.jpg","4.4","26","19.88","219"
"B003AH8APC","Fun Express Mini Zoo Sarfari Animal Coloring Book and Crayon Sets - 12 Books and 12 Boxes of Crayons - Party Favors, Daycare and Classroom Supplies","https://m.media-amazon.com/images/I/81Yd3+kixeL._AC_UL320_.jpg","4.2","174","13.97","219"
"B001BCCA4A","Perler Beads Ocean Buddies Ocean Bead Activity Crafts for Kids, 2400 pcs","https://m.media-amazon.com/images/I/71ljZWr4LKL._AC_UL320_.jpg","4.7","193","11.6","219"
"B0B6V3MH82","53 PCS Pirate Stickers,Jolly Roger Stickers Decals for Pirate Party,Skull and Crossbones Stickers for Water Bottles,Laptop,Cellphone,Skateboard,Suitcase - Perfect Gifts for Kids,Teens, Adults","https://m.media-amazon.com/images/I/914cFRNXCvL._AC_UL320_.jpg","4.5","62","7.99","219"
"B0BKG75JNR","100 Pcs Warning Sign Stickers Waterproof Stickers for Laptop,Guitar,Motorcycle,Bike,Skateboard,Luggage,Phone,Hydro Flask, Gift for Kids Teen Birthday Party","https://m.media-amazon.com/images/I/81rsiwZof1L._AC_UL320_.jpg","3.7","18","7.99","219"
"B088K33ZZ9","Unicorn Pillow Sewing kit for Kids Ages 8-12 - Easy Kids Crafts for Girls & Boys - Unicorns Gifts for Girls 8-10 Unicorn Toys, Arts and Crafts- No Sewing Machine Kit","https://m.media-amazon.com/images/I/71cps79uDML._AC_UL320_.jpg","4.3","507","19.95","219"
"B00FJQ8JLM","Rainbow Loom Refill - Jelly Lime Green","https://m.media-amazon.com/images/I/81aputGDkAL._AC_UL320_.jpg","4.7","167","5.39","219"
"B0BZ83P724","Kalysky 20Pack Bulk Dinosaur Coloring Books for Kids Ages 2-4, 4-8,School Classroom Activity Supplies,Kids Party Favors Gifts,Goodie Bags Stuffer,Kids Gift,5.1 x 7 inch,Design on Kalysky","https://m.media-amazon.com/images/I/91BtnJ3HFPL._AC_UL320_.jpg","4.7","25","12.99","219"
"B08MDZB69H","50 pcs Mountain Bike Stickers Pack Funny Decals for Helmet Cars Bike, Waterproof Mountain Biking Stickers with iBike Outdoors Adventure Stickers for Water Bottle Laptop Scrapbooking","https://m.media-amazon.com/images/I/71YDYAQlxuL._AC_UL320_.jpg","4.4","98","6.99","219"
"B09SYRVSQH","Stackable Colored Crayons Pencils, 11 Interchangeable Colors Mini Rainbow Stacking Crayon Pen Colorful Stacker Crayon Favor for Kids Preschool Painting Toy Home School Office Supplies(100 Pieces)","https://m.media-amazon.com/images/I/81XuRtr8a0L._AC_UL320_.jpg","4.3","50","19.99","219"
"B09TWW9F6T","Jurassic World CAPTIVZ Clash Edition Slime Egg (2 Pack) with 2 Gosutoys Stickers","https://m.media-amazon.com/images/I/71RDwNWEQuL._AC_UL320_.jpg","4.6","12","11.99","219"
"B001DRRICM","READY 2 LEARN CE6736 LEARN Giant Stampers - Geometric Shapes - Outlines - Set of 10 - Easy to Hold Foam Stamps for Kids - Arts and Crafts Stamps for Displays, Posters, Signs and DIY Projects","https://m.media-amazon.com/images/I/816Q4qmyyRL._AC_UL320_.jpg","4.4","37","16.99","219"
"B0815BJZGL","Disney The Jungle Book Stickers Party Favors Set ~ Bundle Includes Over 100 Jungle Book Stickers Featuring Mowgli, Baloo, Kaa, and More (Jungle Book Party Supplies)","https://m.media-amazon.com/images/I/91lTd50LgWL._AC_UL320_.jpg","4.2","35","6.95","219"
"B09JSCN6WM","Reusable Sticker Toys for 2 3 4 5 Year Old Girls Boys Gifts, Toddler Toys Age 2-4, Sticker Books Learning Toys for Kids, Animal, Farm, Vehicles Stickers, Christmas Birthday Gift for Boys Girls","https://m.media-amazon.com/images/I/812MN+PGjsL._AC_UL320_.jpg","4.6","79","11.99","219"
"B0B3N4GDT6","Unicorn Toys Gifts for Girls Toys - CHEERFUN LCD Writing Tablet for Kids Drawing Doodle Board 8.5"" Learning Toddler Toys for 1 2 3 4 5 6 7 8 Year Old Girls Christmas Birthday Gifts Stocking Stuffers","https://m.media-amazon.com/images/I/71zeGyRPlGL._AC_UL320_.jpg","4.4","3250","16.99","219"
"B01CEY3NPI","Alex DIY Knot-A-Quilt Pattern Kids Art and Craft Activity","https://m.media-amazon.com/images/I/91qOfW-QPmL._AC_UL320_.jpg","4.5","576","19.77","219"
"B08CGSMH14","Gooji DIY Make Your Own Stickers for Kids, 60 Sheets Over 1,200 Stickers, 20 Funny Characters and Animals, Customizable Faces with Accessories, Reusable for Party Favors or Arts and Crafts Projects","https://m.media-amazon.com/images/I/81FGbe6VhwL._AC_UL320_.jpg","4.7","136","12.99","219"
"B0B5RKLN4B","36 Sheets Make a Dinosaur Sticker for Kids Pink Dinosaur Stickers Make Your Own Dinosaur Face Stickers DIY Craft Project Girl Kids Dino Theme Birthday Party Favor","https://m.media-amazon.com/images/I/81oUfnty5bL._AC_UL320_.jpg","4.9","56","7.99","219"
"B0BNHC4KRF","2-Pack Pocket Watercolor Painting Book, Travel Pocket Watercolor Kit, Mini Watercolor Paint Bookmark Paint with Water Books for Kids 3+3 year+","https://m.media-amazon.com/images/I/71lE2MoC4QL._AC_UL320_.jpg","4.5","6","12.99","219"
"B09N4161P6","Woodenland Easel for Kids, Double Sided Wooden Easel with Magnetic Chalkboard &Painting Board, Foldable Art Easel for Toddlers 2-8 Years Old Height Adjustable","https://m.media-amazon.com/images/I/71Gzxmc3qyL._AC_UL320_.jpg","4.0","61","89.99","219"
"B001BR8AU8","Green Stuff (4""Strip) RPR 75006","https://m.media-amazon.com/images/I/71MQRHi5M4L._AC_UL320_.jpg","4.7","405","11.32","219"
"B0CBZ5X3RX","Sontanbao 100PCS Cute Water Bottle Stickers for Kids, Stickers for Water Bottles, Waterproof Stickers Vinyl Stickers Laptop Stickers Inspirational Stickers Pack","https://m.media-amazon.com/images/I/91xpCUGm9aL._AC_UL320_.jpg","4.7","20","7.99","219"
"B00000J0SI","Crayola Washable Glitter Glue, Bold Blazes, Colors may vary, 5 Count, 1.75 oz","https://m.media-amazon.com/images/I/81kYf2Ly83L._AC_UL320_.jpg","4.6","538","5.41","219"
"B001GRL4K6","Sargent Art 22-1108 8-Count Water Color-Crayons","https://m.media-amazon.com/images/I/618wOTfKMaL._AC_UL320_.jpg","4.4","69","7.35","219"
"B07998VRVB","Beistle Party Supplies, Blue/Gold/White, 5"" x 3.5""","https://m.media-amazon.com/images/I/91lXONZR4rL._AC_UL320_.jpg","4.5","136","9.98","219"
"B095SWC3NR","200 Neon Sticker Pack Waterproof Stickers Notebook Stickers Skateboard Stickers Water Bottle Stickers Vinyl Stickers Teen Stickers Kids Stickers","https://m.media-amazon.com/images/I/81zbYKqpQCS._AC_UL320_.jpg","4.5","735","8.97","219"
"B000WDQ83S","Weddingstar, Deep Black Crystalline Quartz Sand, 1.1lb","https://m.media-amazon.com/images/I/71e9o-xXziL._AC_UL320_.jpg","4.3","81","11.18","219"
"B07DBPLZ2B","Watercolor Pad – 8.5"" x 11"" Premium Cold Pressed Acid Free Watercolor Paper (30 Sheets) – Perfect for Blending, Layering, Watercolor & Mixed Media - for Professionals and Students – Mozart","https://m.media-amazon.com/images/I/81bC34573JL._AC_UL320_.jpg","4.5","684","12.97","219"
"B07WZF12DF","ceiba tree Snowman Stickers Scene Roll Perforation Line Design for Kids Christmas Party Favor Holiday Craft Kit 200Pcs","https://m.media-amazon.com/images/I/61NL-EWHuIL._AC_UL320_.jpg","4.6","188","8.99","219"
"B0BYSSJ9WM","JOAOYO Paint by Numbers for Kids Ages 8-12 Easy Acrylic Paint by Number Kits for Kids Adults with Wooden Frame Oil Painting Kits for Kids Ages 4-8 Perfect for Gift Home Decoration 8X8in(Butterfly)","https://m.media-amazon.com/images/I/710vgpPdyTL._AC_UL320_.jpg","4.7","14","8.99","219"
"B09NNL21GQ","Orbeez Water Beads, One and Only Feature Multi-Pack, with a Combined 2,000 Glow in The Dark, Shimmer and Marble, Sensory Toy for Kids Ages 5 and up","https://m.media-amazon.com/images/I/81rGyCXvPeL._AC_UL320_.jpg","4.3","193","16.99","219"
"B09RYGVC2B","Educational Insights Playfoam Pizza Parlor, With 5 Colors Of Playfoam, Non-Toxic, Sensory Toy, Gift For Boys & Girls, Ages 3+","https://m.media-amazon.com/images/I/819h7RI7k3L._AC_UL320_.jpg","4.5","60","9.36","219"
"B01HZMODT4","Colorations Individual Tempera Cake Classroom Pack Classroom Supplies for Arts and Crafts Multicolor Variety Pack, Model:TEMPAK, Blue,Green,Multicolor,Orange,Purple,Red, 36 Piece Set","https://m.media-amazon.com/images/I/61-hd2--GoS._AC_UL320_.jpg","3.9","12","99.99","219"
"B07QLC62JP","Sylfairy Aprons for Kids Girls Rainbow Galaxy Unicorn Apron with Pockets for Children Kitchen Chef Aprons for Cooking Baking Painting and Party(Medium,6-12Years)","https://m.media-amazon.com/images/I/71fJailbxeL._AC_UL320_.jpg","4.7","2804","11.98","219"
"B017M18JLG","Mimtom Drawing Stencil Kit for Kids, 58 PC Art Set with 370+ Shapes, Sketch Pad, and Colored Pencils for DIY Arts and Crafts for Boys and Girls, Draw with Letter, Animal and Car Stencils, Green","https://m.media-amazon.com/images/I/81O6DS9vIZS._AC_UL320_.jpg","4.6","1193","27.93","219"
"B08LKKRWZ1","Disney Cars Stickers for Toddlers Kids Adults Set ~ Bundle Includes 150 Disney Cars Stickers on 6 Party Favor Sheets (Disney Cars Party Supplies Decorations)","https://m.media-amazon.com/images/I/81VMFCp6gQL._AC_UL320_.jpg","4.6","24","7.95","219"
"B0BHY25S8M","Colors-in-Motion Twist-up Set Crayons (12 Colors)","https://m.media-amazon.com/images/I/514xVj6k7ZL._AC_UL320_.jpg","4.6","38","7.99","219"
"B09LNYYF2S","WikkiStix Dinosaur Kids Toys, 13 Dinosaur Party Favors Plus Dinosaur Footprint Sheets for Added Dino Decor. Ages 3 & Up","https://m.media-amazon.com/images/I/81P-I8AgL9L._AC_UL320_.jpg","4.7","38","15.5","219"
"B0BY8FF7VK","8 Sheets (96PCS) Butterfly Temporary Tattoos Butterflies Theme Birthday Party Decorations Supplies Favors Stickers For Women Kids Gifts Classroom School Prizes Rewards","https://m.media-amazon.com/images/I/91vAvK2LNHL._AC_UL320_.jpg","3.9","8","9.99","219"
"B07Y4C4NZ1","Aylifu Foam Stickers, 260 Pieces Self-Adhesive Foam Alphabet Letters and Numbers Sticker for Kid's Arts Craft Supplies - Assorted Colors","https://m.media-amazon.com/images/I/71TUxBoYV+L._AC_UL320_.jpg","3.9","89","7.98","219"
"B07ZWLF5WW","Creativity for Kids Sensory Sticker Playset - Sweetsville - 100+ Sensory Stickers and Play Scenes - Gifts for Boys and Girls Ages 4+, Multi","https://m.media-amazon.com/images/I/91WZTkML4ZL._AC_UL320_.jpg","3.9","59","7.5","219"
"B0BBMM15QP","48 Pieces Christmas Nativity Scene Craft Kit for Kids Make Your Own Nativity Scene Sticker Ornament Christmas DIY Nativity Stickers Christmas Tree Ornament Kit for Party Home Class Game Activities","https://m.media-amazon.com/images/I/8128OxVWmbL._AC_UL320_.jpg","3.8","13","11.99","219"
"B08XN41Y3D","Disney Doc McStuffins Stickers 4 Pack ~ 100 Doc McStuffins Stickers for Kids Party Supplies Party Favors Birthdays and More (Disney Junior Stickers)","https://m.media-amazon.com/images/I/91C04ltq3VS._AC_UL320_.jpg","4.8","41","6.95","219"
"B08742B3PX","Westcott 17196 8-Inch Stainless Steel Gold Scissors For Office and Home","https://m.media-amazon.com/images/I/71UeGjnnwRL._AC_UL320_.jpg","4.8","5360","25.17","219"
"B00T3IANW0","Dora the Explorer Activity Pack ~ Coloring Book, Board Book, and Stickers!","https://m.media-amazon.com/images/I/81UMDm6vIgS._AC_UL320_.jpg","4.3","107","10.95","219"
"B0B6Z5MX4H","Bumble Bee Stickers Summer Spring Happy Honey Bee Decal Sticker 660 Counts Party Cute Gifts Goodie Bags Decor School Reward Birthday Party Favors Water Bottle Sticker Laptop Invitation Decor","https://m.media-amazon.com/images/I/81tiu8jV8rL._AC_UL320_.jpg","4.9","36","7.77","219"
"B008N0BD6Y","Arches 400014958 Watercolor Pad, Hot Press, 10"" x 14""","https://m.media-amazon.com/images/I/61hrxb9FPmL._AC_UL320_.jpg","4.7","135","24.36","219"
"B07588S77Z","HEY CLAY Monsters - Colorful Kids Modeling Air-Dry Clay, 18 Cans with Fun Interactive App","https://m.media-amazon.com/images/I/61NUWWNED1L._AC_UL320_.jpg","4.7","287","23.12","219"
"B0BVF3HSKS","Cute Unicorn Stickers 200 PCS, Waterproof Vinyl Unicorn Stickers for Water Bottles, Notebooks, Laptops, Phone, Pad, Skateboards and Luggage, Colorful Cartoon Sticker for Girls Teens Adults","https://m.media-amazon.com/images/I/91zijlZ1EaL._AC_UL320_.jpg","4.7","238","9.99","219"
"B0851HTRN7","Disney Junior Advent Calendar, 32 pieces, figures, decorations, and stickers, by Just Play","https://m.media-amazon.com/images/I/91dprgfTfTS._AC_UL320_.jpg","4.3","678","35.0","219"
"B088LZRTWC","Scissor Skills Activity Book For Kids Ages 3-5,Paper Cutting Art,Kids Scissor Craft Kits,Kid's DIY Scissor Skills Early Learning Development Toy for Kindergarten preschool Boys and Girls,100 Pages","https://m.media-amazon.com/images/I/61v3YyKB6tS._AC_UL320_.jpg","4.2","220","9.99","219"
"B07Z6M51YM","Toy Story 4 Giant Size Coloring and Activity Book - 10.5 x 16 Inches","https://m.media-amazon.com/images/I/71yiMq5quXL._AC_UL320_.jpg","4.1","52","5.99","219"
"B00B75JUSU","Bug Stampers - Classroom Handouts and Party Favor Stationery - 24 Pieces","https://m.media-amazon.com/images/I/61aMgAhCKAL._AC_UL320_.jpg","4.5","13","13.99","219"
"B08XXG5Y8D","Craft DIY Bird House Kit 2 Pack DIY Unfinished Wood Bird House Build and Paint Your Backyard Birdhouse, Art Craft Wood Toys for Kids Girls Boys Includes Paints Brushes","https://m.media-amazon.com/images/I/71LRtLHBgqL._AC_UL320_.jpg","3.9","22","13.99","219"
"B0CFFJTC1J","Cool Witch Stickers for Kids, 50pcs Aesthetic Waterproof Stickers,Vinyl Stickers for Teens and Adults, Witchy Stickers, Witchy Gifts, Witch Gifts, Witch Party Favors, Witch Party Decorations, Witchy Items, Witchy Things, Witchy Accessories (witch)","https://m.media-amazon.com/images/I/816R-t9zNUL._AC_UL320_.jpg","4.3","7","5.99","219"
"B095844268","MFJL Marbling Paint Crafts Kit for Kids - Arts and Crafts for Girls & Boys - Ideas Art Kits for Kids Age 3-5 4-8 8-12 (Paint on Water)","https://m.media-amazon.com/images/I/81abVZGlJAL._AC_UL320_.jpg","4.4","255","15.99","219"
"B09ZKC91YQ","Haooryx 60PCS Halloween Candy Corn Shaped Mini Eraser for Kids Bulk, Novelty Corn Pencil Erasers 3D Desk Puzzle Erasers Pet for Student Homework Classroom Prizes Trick or Treat Party Gift Filler Favor","https://m.media-amazon.com/images/I/71bobwy-dhL._AC_UL320_.jpg","4.9","18","12.99","219"
"B09HDMJJKC","Nick Shop Paw Patrol Stickers Variety Set for Kids Toddlers ~ Bundle with Over 650 Paw Patrol Stickers for Birthday Party Favors, Sticker Rewards, and More","https://m.media-amazon.com/images/I/81yAgS3e5GL._AC_UL320_.jpg","4.6","47","9.95","219"
"B0048ELGCK","AMAV Sand Art Glitter & Glow Activity Kit - DIY Make Your Own Beautiful Colorful Sand Art in Bottle","https://m.media-amazon.com/images/I/61Rkr6Y0EGL._AC_UL320_.jpg","4.5","577","11.99","219"
"B00LAFO47E","DC Comics BATMAN Coloring & Activity Book Set with Stickers (2 Coloring Books, Over 300 Pages Total)","https://m.media-amazon.com/images/I/71dm-Oq497L._AC_UL320_.jpg","4.5","105","9.95","219"
"B0BKGKBL31","Tennis Stickers - 50 Pcs Cartoon Sports Activities Decals Ball Vinyl Decoration DIY Funny Creative Decor for Teens Party Supplies for Adults (Tennis Sticker)","https://m.media-amazon.com/images/I/71Q8jIxtNZL._AC_UL320_.jpg","4.0","41","6.99","219"
"B0B86KKYXJ","BulbaCraft 100Pcs Watermelon Stickers, Melon Stickers, One in a Melon sticker - Watermelon Party Favors, Watermelon Goodie Bags Fillers, Watermelon Gifts, Watermelon Party Decorations, Window Stickers","https://m.media-amazon.com/images/I/91eCrJjLQcL._AC_UL320_.jpg","4.9","12","8.99","219"
"B07QZT8BQX","Marvel Avengers Jumbo Coloring and Activity Book - Character Patterned Tool for Brain Stimulation 80-Page Creativity-Focused Gadget Quality Travel and Educational Boys Kids Art Material (2 Items)","https://m.media-amazon.com/images/I/71Cj90LL-yL._AC_UL320_.jpg","4.7","57","6.99","219"
"B07ZV6LFGH","Fork Creativity Set, 100 Sets Forky DIY Creative Crafts Pack Plastic Sporks Red Pipe Cleaners Googly Eyes Popsicle Stick","https://m.media-amazon.com/images/I/71PtQavBgoL._AC_UL320_.jpg","4.4","169","19.99","219"
"B000U4ARIG","Melissa & Doug Decorate-Your-Own Wooden Race Car Craft Kit","https://m.media-amazon.com/images/I/81j2oGIk80L._AC_UL320_.jpg","4.6","292","8.72","219"
"B001UH50MU","Alex Little Hands Paper Plate Bugs Kids Toddler Art and Craft Activity","https://m.media-amazon.com/images/I/91mz4cC+fLL._AC_UL320_.jpg","4.6","1037","17.54","219"
"B01MQJZHVL","Large Wood Peg Dolls 3-1/2 inch, Mom/Angel Shape Peg People, Pack of 25 Birch Unfinished Wooden Dolls to Paint","https://m.media-amazon.com/images/I/915FEC+G3SL._AC_UL320_.jpg","4.8","2231","39.99","219"
"B09NKPLM6X","YKW 3D Deep Sea Moving Sand Art,Relaxing Kinetic Sandscape Art Table Desk Top to Decor for Any Home, Office Desktop, Mantle,Bookshelf Making It Ideal for Any Setting (7inches, Blue)","https://m.media-amazon.com/images/I/61N95dVgWeL._AC_UL320_.jpg","4.1","246","26.99","219"
"B07KCXPL6V","Horizon Group USA Made by Me Assorted Suncatchers Refill Pack 12 pk, Multicolor, one Size (95241)","https://m.media-amazon.com/images/I/81tu-1c3-WL._AC_UL320_.jpg","4.6","889","5.99","219"
"B09B9MQZ74","Felt Christmas Tree, 3.3 FT DIY Felt Christmas Tree Set for Kids, Wall Hanging Christmas Tree for Christmas Party Decor, Felt Xmas Tree Gift","https://m.media-amazon.com/images/I/819WzJ1h+vL._AC_UL320_.jpg","4.5","165","14.99","219"
"B0BPX5BYL8","8 Sheets (96PCS) Candy Tattoos Tattoo Stickers Temporary Theme Birthday Party Decorations Party Favors Supplies For Kids Girls Boys Gifts Classroom School Prizes Rewards","https://m.media-amazon.com/images/I/81wqFwT3TqL._AC_UL320_.jpg","4.2","9","9.99","219"
"B07F183MVV","SmileMakers Glow in The Dark Cute X-Ray Stickers - Prizes and Giveaways - 75 per Pack","https://m.media-amazon.com/images/I/71WddSzr6EL._AC_UL320_.jpg","4.5","47","11.99","219"
"B07ZTXC7ZJ","Handy Art Little Masters Washable Tempera Paint, Pink, Gallon, 128 oz.","https://m.media-amazon.com/images/I/61J68HPEuFL._AC_UL320_.jpg","4.9","12","27.76","219"
"B013FPMABI","Crayola White Chalk 12 Ea (Pack of 36)","https://m.media-amazon.com/images/I/61K+aW0KEJL._AC_UL320_.jpg","4.3","148","33.44","219"
"B0BGQMKN3T","Play-Doh Nickelodeon Slime Violet Purple Gooey Tub, 30 Ounce Bulk Container, Sensory Toys for Girls & Boys 3 Years & Up, Kids Gifts","https://m.media-amazon.com/images/I/81en6gPAINL._AC_UL320_.jpg","4.6","9","14.99","219"
"B0995VWDS9","Halloween Stickers for Kids,200Pcs Cute Aesthetic Vinyl Waterproof Halloween Stickers for Laptop Water Bottle Envelopes Crafts Scrapbooking,Halloween Decorations,Halloween Gifts…","https://m.media-amazon.com/images/I/91uYuCckrYL._AC_UL320_.jpg","4.6","1650","9.99","219"
"B0BQ3CX8QH","38 Pieces Pin The Bee on The Honeycomb Party Games Give The Honeycomb Bees Pin The Bees Poster for Kids with Blindfolds and Stickers Bee Themed Birthday Party Supplies Yellow Bee Party Game","https://m.media-amazon.com/images/I/812aRNpSwDL._AC_UL320_.jpg","4.4","7","9.99","219"
"B07V7BWKMP","Creammuffin Stickers Party Supplies Kits for Toddlers, Children 3D Puffy Animal Stickers Tiger Sticker- Over 180 Stickers (Real Animal)","https://m.media-amazon.com/images/I/91BuYliMetL._AC_UL320_.jpg","4.3","297","5.99","219"
"B0197TY1EA","Aquabeads Theme Pack, Craft Sets, Aquabeads Dazzling Ring Set","https://m.media-amazon.com/images/I/91slDRCfoUL._AC_UL320_.jpg","4.5","613","6.99","219"
