"asin","title","imgUrl","stars","reviews","price","category_id"
"B07ND1VPJX","Yehuda 3 Hour White Shabbos Candles, 72 Count (2 Pack - Total 144 Candles) Traditional Shabbat Candles, Dinner Table Candles, Household Candles","https://m.media-amazon.com/images/I/91Qd+3DPeeL._AC_UL320_.jpg","4.6","457","22.39","165"
"B0C7FHSDL1","12 PCS Fall Decorations for Home, Fall Tiered Tray Decor, Rustic Farmhouse Autumn Wooden Signs Plush Gnome Bead Garland Pumpkins Maple Leaves Banner Hello Fall Ornament for Harvest Table Centerpieces","https://m.media-amazon.com/images/I/81xDyf9RDZL._AC_UL320_.jpg","4.6","119","16.99","165"
"B0C73QQZQP","Anditoy 12 Pack Halloween Floating Candles Battery Operated LED Witch Candle for Home Halloween Decorations Indoor Outdoor Halloween Décor","https://m.media-amazon.com/images/I/61NZry84-1L._AC_UL320_.jpg","4.0","10","19.99","165"
"B0B8STBMNB","HTVRONT Window Privacy Film - Non Adhesive Frosted Glass Window Film, Heat Blocking Window Cling Privacy Film for Home, Office, Bathroom, Door Decoration (17.5""×6.5ft, Matte White)","https://m.media-amazon.com/images/I/617adFrQ4AL._AC_UL320_.jpg","4.2","202","6.29","165"
"B00DJAUUBW","Willow Tree Warm Embrace, Sculpted Hand-Painted Figure","https://m.media-amazon.com/images/I/71tqYMzjrBL._AC_UL320_.jpg","4.9","4531","34.95","165"
"B01N8P6DSE","Satya Nag Champa White Sage incense sticks-12packs x 15grams by Satya","https://m.media-amazon.com/images/I/61uZ90pdv4L._AC_UL320_.jpg","4.7","1864","9.99","165"
"B00LJWNOAG","Pioneer Photo Albums EV-246CHLK Happiness Photo Album 4 x 6 Inch","https://m.media-amazon.com/images/I/91f0yNaxDeL._AC_UL320_.jpg","4.7","5509","10.9","165"
"B0BKTD9BTS","Leafy Incense Sticks Variety Pack - 120 Insence Sticks (6 Incents x 20 Insenses) - Citronella Lemongrass Eucalyptus Peppermint Pine Cedar - Natural Incense Set Inciensos with Stick Incense Holder","https://m.media-amazon.com/images/I/91iDEvo0c3L._AC_UL320_.jpg","4.3","1617","11.99","165"
"B00VUJ6X1A","tiny ideas Baby's First Year Picture Frame, 0-12 Month Baby Pictures, Newborn Baby Registry, Classic Gender Neutral Nursery Decor, Silver","https://m.media-amazon.com/images/I/81QMS1pDG5L._AC_UL320_.jpg","4.7","3371","9.99","165"
"B0C2T1ZQWP","8x10 Photo Album 152 Pockets Hold 8x10 Photos, Photo Album 8x10, Large Capacity Leather Cover Family Wedding Baby Photo Album for 8x10 Pictures, 8x10 Photo Album Book with Black Inner Pages (Black)","https://m.media-amazon.com/images/I/61XYN+9vZaL._AC_UL320_.jpg","4.7","116","19.99","165"
"B07S7V94TF","Ageomet 3pcs 19.5ft White Rose Artificial Floral [Garland] White, Vines Fake Silk Flower Hanging Rose Ivy for Wedding Arch Garden Background Engagement Ceremony Reception Decor","https://m.media-amazon.com/images/I/71HqLVoGkmL._AC_UL320_.jpg","4.6","4000","18.99","165"
"B08FYK7ZQH","COCOBOO 7pcs 41Ft Artificial Eucalyptus Garland Greenery Faux Garland Bulk Silver Dollar Eucalyptus Leaves Vines Plants for Wedding Arch Wall Garden Christmas Decoration","https://m.media-amazon.com/images/I/81D3YUXYkqL._AC_UL320_.jpg","4.4","2123","29.99","165"
"B09TNKHYPC","LOYWREE 2 Pack Flower Vase Acrylic Rectangular Floral Centerpiece for Dining Table - Total 24 Inches Long Rectangle Vase - Clear Vases for Home Decor Wedding(Flowers not Included)","https://m.media-amazon.com/images/I/61wbdpMo5hL._AC_UL320_.jpg","4.2","163","19.99","165"
"B0BMQTR54W","Koogel Explosion Gift Box, Handmade Exploding Photo Album Preassembled Surprise Picture Pop Up Love Box with Creative DIY Scrapbooking Accessories for Anniversary Birthday Wedding Memory Party","https://m.media-amazon.com/images/I/71BBe5HSOHL._AC_UL320_.jpg","4.0","87","7.99","165"
"B01N6Y6BDZ","SmartChoice Urn for Human Ashes Adult Memorial Funeral Cremation Large Burial Urns (Adult Cremation Urn)","https://m.media-amazon.com/images/I/81y5gXQLlHL._AC_UL320_.jpg","4.8","4913","59.99","165"
"B09SZ4KBCH","88 Pack Palm Leaves Tropical Luau Party Monstera Stems for Safari Jungle Hawaiian Birthday Theme (88 Leaves)","https://m.media-amazon.com/images/I/71y3dIqV4uL._AC_UL320_.jpg","4.7","467","17.99","165"
"B0BZ3PJJ5L","Winlyn 4 Pcs Faux Decorative Blue and White Fabric Pumpkins Chinoiserie Chic Pumpkins Foam Pumpkins for Gifts Farmhouse Thanksgiving Halloween Fall Wedding Table Centerpiece Mantel Bowl Decorations","https://m.media-amazon.com/images/I/816icJiTMhL._AC_UL320_.jpg","4.6","26","16.99","165"
"B0BTM53K8R","AINAHYVA Picture Frames 8x10 Picture Frame Set of 3, Made of High Definition Plastic Glass for 5x7 with Mat or 8x10 Without Mat, Table Top and Wall Mounting Decor (Black)","https://m.media-amazon.com/images/I/61ZyhJ+gJtL._AC_UL320_.jpg","4.4","173","9.99","165"
"B06Y194RBN","8.5x11 Black Gallery Certificate and Document Frame - Wide Molding - Includes Both Attached Hanging Hardware and Desktop Easel - Award, Certificates, Documents, a Diploma, or a Photo 8.5 x 11","https://m.media-amazon.com/images/I/91ULIxIp3EL._AC_UL320_.jpg","4.6","4079","12.89","165"
"B07RRH1X3N","BGment Rod Pocket Blackout Curtains for Bedroom - Thermal Insulated Short Room Darkening Curtain Window Drapes for Cafe Kitchen, 42 x 45 Inch, 2 Panels, Navy Blue","https://m.media-amazon.com/images/I/61IzB-Y2K1L._AC_UL320_.jpg","4.5","17981","13.58","165"
"B0C5RCP48Z","193 PCS Thanksgiving Window Clings Stickers Fall Decor, Double-Side Turkey Cling for Glass Window Thanksgiving Decorations for Home Party","https://m.media-amazon.com/images/I/81Pf7n+yXKL._AC_UL320_.jpg","4.7","15","5.99","165"
"B0BTLJWNVL","Auruge Area Rug - 5x7 Indoor Vintage Rugs Soft Fuzzy Shaggy Carpet Distressed Pink Accent Rug Non-Slip Non Shedding & Machine Washable Rug for Dining Room Living Room Bedroom Office","https://m.media-amazon.com/images/I/81iT1J-q6cL._AC_UL320_.jpg","4.7","81","79.99","165"
"B01KJBWOI0","Godinger Round Coasters Gold Edge, Marble Coaster Set, Table Protection, Set of 4","https://m.media-amazon.com/images/I/81tFfc8OkfL._AC_UL320_.jpg","4.7","2844","20.95","165"
"B0C7KH72ML","Fixwal 15.8in Floating Shelves, Rustic Wood Finish Wall Shelves Set of 4, Shelves for Wall Decor, with Invisible Brackets for Bathroom, Living Room,Bedroom and Kitchen(Black)","https://m.media-amazon.com/images/I/71NQlY5-lUL._AC_UL320_.jpg","4.2","22","32.99","165"
"B07G9F3TVM","Maple Leaves Artificial Fall Leaves Bulk 400Pcs Assorted Mixed Faux Fall Color Maple Leaves Decoration Fake Maple Left Art for Craft, Wedding, Festival, Party, Thanks-Giving and Outdoor Decorating","https://m.media-amazon.com/images/I/91vx4DQg4jS._AC_UL320_.jpg","4.5","399","9.99","165"
"B08CD3CPT6","Black Magic Witch Moon Mirror – Announcing Love Gothic and Boho Home Wall Decor - Glass Moon Phase Mirror Set with Crystal Clear Reflection - Moon Mirror Wall Decor for Living Room Bedroom Nursery","https://m.media-amazon.com/images/I/61T1KPWBjpL._AC_UL320_.jpg","4.3","2922","29.99","165"
"B01F4NJOAE","MCS Original Poster Frame, 20 x 28 Inch, Black, Set of 2","https://m.media-amazon.com/images/I/91FzA0gtmpL._AC_UL320_.jpg","4.0","753","29.99","165"
"B08C77R2SR","Buffalo Plaid Outdoor Rug, 24""x36"" Non-Slip Rubber Backing Checkered Door Mat, Machine Washable Doormat Indoor for Front Porch Decor, Absorbent Low Profile Black and White Rug for Farmhouse Entryway","https://m.media-amazon.com/images/I/718+1C43NFL._AC_UL320_.jpg","4.6","725","25.99","165"
"B07BKRSMRM","2 Pounds Natural Decorative Real Sand - for Interior Decor, Vase Filler, Sand Crafts and More","https://m.media-amazon.com/images/I/91shgSsg8qL._AC_UL320_.jpg","4.6","3196","12.96","165"
"B07G24L6PZ","BESTTOYHOME 8 Pcs Realistic 4"" Fall Harvest Small Off White Mini Artificial Pumpkins for Halloween, Fall and Thanksgiving Decorating","https://m.media-amazon.com/images/I/51T2ZNzQKDL._AC_UL320_.jpg","4.6","702","14.99","165"
"B089QCBW79","ZOROSY Wood Table Vanity Makeup Mirrors - Rectangle Wall-Mounted Mirrors Desk Mirrors for Living Room Bedroom Birthday Gifts","https://m.media-amazon.com/images/I/51yCrG6im8L._AC_UL320_.jpg","4.5","894","18.99","165"
"B07G5Y8699","DomeStar 42 PCS Artificial Pumpkins Sets, 12PCS Mini Fake Pumpkins with 30PCS Lifelike Maple Leaves Faux Pumpkins for Decorating Fall Harvest Garland Halloween DIY for Crafts Thanksgiving Decorations","https://m.media-amazon.com/images/I/41puUq7CnCL._AC_UL320_.jpg","4.4","2732","8.99","165"
"B01MG49XLI","White Sand - Fine Sand for Zen Garden, Resin Incense Burner, Smudge Bowl, Ritual Incense, Cast Iron Cauldron, Unity Ceremony, Sensory Bin Table, Mandalas, Crafts by Alternative Imagination (1 Pound)","https://m.media-amazon.com/images/I/71mwEm5r-nL._AC_UL320_.jpg","4.6","1606","10.99","165"
"B0C6JSTQ9L","ZYRW Black Curtain Rods, Room Darkening Curtain Rods for Windows 48 to 90 Inches(4-7.5Ft), Wrap Around Curtain Rods, Heavy Duty Blackout Drapery Rod,Modern Decorative Window Treatment Rod, Matte Black","https://m.media-amazon.com/images/I/61+Kd6mcABL._AC_UL320_.jpg","4.5","108","31.99","165"
"B0036U6MOO","Willow Tree Grandmother, sculpted hand-painted keepsake box","https://m.media-amazon.com/images/I/81g3-Nd2gbL._AC_UL320_.jpg","4.9","4820","26.94","165"
"B08B3PQK2B","LAMORGIFT Rose Gold Votive Candle Holders Set of 12 - Mercury Glass Votives Candle Holder - Tealight Candle Holder for Home Decor and Weddings/Parties Table Centerpieces","https://m.media-amazon.com/images/I/81+JxwtAK5L._AC_UL320_.jpg","4.7","3849","21.99","165"
"B07ZL1WNPQ","Bear Coasters Set – 6 Full Size Rustic Coasters in Handmade Canoe with Adorable Black Bear Figurines | Black Bear Log Cabin Decorations, Rustic Lodge Decor for The Home","https://m.media-amazon.com/images/I/71RqlWL5JaL._AC_UL320_.jpg","4.8","2058","27.99","165"
"B09QKFLQPS","Herncptar Wall Shelves, Rustic Wood Floating Shelves Set of 4, Hanging Storage Shelf with Invisiable Metal Brackets for Bathroom, Living Room, Kitchen, Bedroom","https://m.media-amazon.com/images/I/71rBtFWgGSL._AC_UL320_.jpg","4.3","1132","29.99","165"
"B09QCTVCSS","Welgo 7.5 Inches Large Digital Alarm Clock for Seniors & Kids, 0-100% Dimmable Display, USB Charging Port, Adjustable Volume, Easy Operation, Snooze, Outlet Powered for Bedroom","https://m.media-amazon.com/images/I/61PV1Irdv6L._AC_UL320_.jpg","4.7","3432","20.99","165"
"B017HUFQY0","FIREFLY Fiberglass Tiki Torch Wicks - Made in USA - 1/2-inch x 6-inches for Tiki Torches - 6 Per Package","https://m.media-amazon.com/images/I/61s2F7PDbmL._AC_UL320_.jpg","4.5","1443","10.99","165"
"B0B3GVCWKM","HomeKaren Fall Wreaths for Front Door 22 Inch, Fall Wreath with Pumpkin Maple Leaf Berry, Autumn Wreath for Thanksgiving Harvest Festival Decorations Indoor and Outdoor","https://m.media-amazon.com/images/I/814qA26Wd0L._AC_UL320_.jpg","4.9","38","32.99","165"
"B0B92K7VBW","Evil Clown Ghost Door Cover Halloween Door Decorations 79 x 35 Inches Scary Clown Ghost Window Decals Creepy Photo Posters Banner Backdrop Halloween Wallpaper Sticker for Door Window (Clown)","https://m.media-amazon.com/images/I/81qIfMtyAWL._AC_UL320_.jpg","4.5","34","11.99","165"
"B0983HTY7Z","FORCHEER Office Desk Chair Seat Covers Stretch Water Resistant Jacquard Computer Chair Seat Cushion Slipcovers-Black","https://m.media-amazon.com/images/I/71ljZFc1iZS._AC_UL320_.jpg","4.3","3076","10.99","165"
"B018UPHTSM","Americanflat Hinged 5x7 Picture Frame in Black - Double Picture Frame with Engineered Wood and Shatter Resistant Glass for Tabletop Display","https://m.media-amazon.com/images/I/51QqVGH6e2L._AC_UL320_.jpg","4.7","2962","9.99","165"
"B07WJ92FCF","Deloky 250 PCS Christmas Natural Mini Pine Cones-Thanksgiving Pinecones Ornaments for DIY Crafts, Home Decorations,Fall and Christmas,Wedding Decor","https://m.media-amazon.com/images/I/81Qe0+dUWAL._AC_UL320_.jpg","4.4","1193","13.99","165"
"B075Q8RBWM","Judaica Unlimited 10-Piece Set of Assorted Sukkah Decorations.","https://m.media-amazon.com/images/I/71QhrpfvUfL._AC_UL320_.jpg","4.4","59","29.0","165"
"B09X719C4F","Amazon Basics Artificial Mini Succulent Fake Indoor Plants with Plastic Planter Pots, 3 Pack, Green","https://m.media-amazon.com/images/I/810Mfgg6jKL._AC_UL320_.jpg","4.4","1202","9.61","165"
"B01MRQSFG1","HAKACC Bedside Storage Organizer,Remote Control Holder Armchair Couch Caddy Sofa Armrest Bag for tablet Magazine Phone , Black","https://m.media-amazon.com/images/I/81vUMoo4SvS._AC_UL320_.jpg","4.4","8416","6.99","165"
"B0C6SZP6NC","Wall Clock Modern 9 Inch Battery Operated Wall Clocks - Silent Non Ticking Classic Small Analog Clock for Office, Home, Bathroom, Kitchen, Bedroom, School, Living Room(Black)","https://m.media-amazon.com/images/I/61jEzJvwZAL._AC_UL320_.jpg","4.7","72","8.99","165"
"B0B153H4MW","Fall Decor - Fall Tiered Tray Decor Bundle 6 PCS - 3 Fall Wooden Signs - Plush Gnome - Wood Beads Garland - Mini Wooden Banner - Rustic Farmhouse Home Autumn Harvest Kitchen Table Shelf Decorations","https://m.media-amazon.com/images/I/81h1R0H3SDL._AC_UL320_.jpg","4.6","46","21.99","165"
"B08CKP7XN2","Giftgarden 5x7 Picture Frame Set of 4, 6x8 Matted to Display 5 by 7 Photo with Mat or 6 by 8 without Mat for Wall or Tabletop, Black","https://m.media-amazon.com/images/I/61N3GzxSPhL._AC_UL320_.jpg","4.6","12357","18.99","165"
"B095C5S1D4","SLDIYWOW Acrylic Full Length Wall Mirror Tiles,12""x 12"" x 4 Pcs Shatterproof Mirror Wall-Mounted, Safety Mirror Great for Baby Kids Toddler, Full Body Mirror Tiles for Bedroom, Home Gym, Living Room","https://m.media-amazon.com/images/I/61cH+9svRHS._AC_UL320_.jpg","3.9","977","18.99","165"
"B095JLV7FN","XLFAQXM Artificial Plants Flowers Grass Shrubs 8 Pack No Fade Faux Plastic Flowers Outdoor for Farmhouse Garden Porch Patio Indoor Wedding Decoration Greenery Fake Plants uv Resistant","https://m.media-amazon.com/images/I/81VBBOIG1sS._AC_UL320_.jpg","4.4","520","12.89","165"
"B0B24GS4LQ","Office Wall Decor Inspirational Office Decoration for Work Rustic Wall Hanging Ctrl Alt Del Motivational Wall Art Wooden Signs with Sayings Motivational Wall Plaques Living Room Decoration 10 x 4 Inch","https://m.media-amazon.com/images/I/71bp+qxYZeL._AC_UL320_.jpg","4.7","217","10.99","165"
"B01CTBL236","Rug Gripper Non Slip Rug Pad Underlay Liner for Hardwood Floors Supper Grip Thick Padding Adds Cushion Prevents Sliding Size 5 X 7","https://m.media-amazon.com/images/I/911o+K6UxuL._AC_UL320_.jpg","4.6","9759","19.99","165"
"B0823D8G43","Handmade Crystal Window Car Hanging Ornaments 7 Chakra Home Decoration Feng Shui Ornament Yoga Meditation Car Decoration Tumbled Palm Stones Christmas Decorations Ornaments","https://m.media-amazon.com/images/I/41FY10B8GdL._AC_UL320_.jpg","4.7","8402","9.98","165"
"B08BR453MS","ZNSAYOTX Super Stretch Couch Cover Universal Sofa Covers for Living Room Dogs Pet Friendly Furniture Protector Fitted Spandex Sofa Slipcovers with Anti Slip Foam Sticks (Dark Grey, Sofa)","https://m.media-amazon.com/images/I/71P-pM-tfFL._AC_UL320_.jpg","4.3","1715","17.79","165"
"B0C9Q7S2ZV","Fall Decorations for Home - Fall Candles, Fall Gifts for Women, Natural Soy Wax Autumn Morning Scented Candles","https://m.media-amazon.com/images/I/61qTp1Zg8aL._AC_UL320_.jpg","4.6","57","14.99","165"
"B08Y5H8FFS","SPACEKEEPER Incense Burner, Backflow Holder Waterfall 2 Sides, with 120 Cones, 30 Sticks, Aromatcherapy Ornamen","https://m.media-amazon.com/images/I/81lWDXXPDAS._AC_UL320_.jpg","4.1","1822","24.99","165"
"B0BK3MNYHX","AMADA HOMEFURNISHING Floating Shelves, Wood Hanging Wall Shelves for Storage, Wall Mounted Shelves for Bathroom, Living Room, Kitchen, Bedroom, Office, Wall Shelf Set of 2, AMFS25","https://m.media-amazon.com/images/I/61PG7iTW3aL._AC_UL320_.jpg","4.2","220","19.99","165"
"B07ZPP52WJ","Mocoosy 6 Pack 3 Size Upgraded Anti-Slip Plate Stands for Display, Black Iron Easel Plate Holder Display Stand for Pictures, Photo Frames, Decorative Plate and Tabletop Artworks (4, 6, 8 inch)","https://m.media-amazon.com/images/I/61P5XrrsD6L._AC_UL320_.jpg","4.4","4388","14.99","165"
"B07RR5YJVW","WORTH IMPORTS 60"" Life Size Harvest Sitting Scarecrow, Blue, Brown, Yellow, Cream, Black, Orange","https://m.media-amazon.com/images/I/817uxIATQuL._AC_UL320_.jpg","4.4","162","38.0","165"
"B0C7HFRZBZ","Sggvecsy 6 Pcs Artificial Fall Eucalyptus Stems Fall Eucalyptus Leaves Autumn Foam Leaf Branches Fall Decorations with Berries Pumpkins for Home Floral Arrangement Autumn Festival Thanksgiving Decor","https://m.media-amazon.com/images/I/81Gl13YNtJL._AC_UL320_.jpg","4.7","23","14.51","165"
"B09GV8NXF5","2 Pieces Wall Decor , Bathroom Rules Flower Wall Art, Funny Ocean Beach Farmhouse Toilet Rustic Wooden Signs (Chic Style)","https://m.media-amazon.com/images/I/81D38eIgNcL._AC_UL320_.jpg","4.5","2611","9.99","165"
"B09959WC8L","Der Rose 6 Packs Small Fake Plants Artificial Plants in Pots for Home Bathroom Bedroom Living Room Decor Indoor","https://m.media-amazon.com/images/I/81HaC5XJngL._AC_UL320_.jpg","4.5","1005","14.99","165"
"B0C7MYXGGV","Sggvecsy Artificial Fall Wreath 18’’ Autumn Front Door Wreath Harvest Wreath with Various Pumpkin Cluster of Berries Maple Leaves Pine Cones for Outside Indoor Wall Thanksgiving Fall Autumn Decor","https://m.media-amazon.com/images/I/91-jsPuXXGL._AC_UL320_.jpg","4.5","31","25.99","165"
"B0943MQSHD","Graman Metal Vintage Tin Sign Be Kind to Your Mind, Land Lady Gift, Floral Woman Gift for Plant Lovers Funny Retro Wall Art Sign 8X 12inch","https://m.media-amazon.com/images/I/71fAnK1n4vS._AC_UL320_.jpg","4.5","890","8.99","165"
"B07YTS1KWP","I·CODE Time to Wake Alarm Clock for Kids, Children's Sleep Trainer, Kids Wake Up Light, Sleep Sound Machine","https://m.media-amazon.com/images/I/61AoO4XReNL._AC_UL320_.jpg","4.2","5512","34.99","165"
"B092JRYMJ6","Glass Candy Corn Ornaments - Set of 6, 2 3/4"", Halloween Décor Mini Tree","https://m.media-amazon.com/images/I/41-pzDmHMgS._AC_UL320_.jpg","4.7","173","15.99","165"
"B07RQVSL77","Natural Vase Fillers Mini Pumpkins for Decorating & Crafts | Miniature Pumpkins Home Decor (Mini Pumpkins)","https://m.media-amazon.com/images/I/71su+nDqi5L._AC_UL320_.jpg","4.5","681","14.99","165"
"B07MBNMJHC","Giftgarden Multi Black Picture Frames with Mat for Multiple Sizes Photos, Four 4x6, Four 5x7, Two 8x10 for Gallery Photo Frame Collage Wall or Tabletop Display, Assortment Pack of 10","https://m.media-amazon.com/images/I/71woS9HExhL._AC_UL320_.jpg","4.6","2999","33.99","165"
"B07NPCCCWY","Asge Backpack for Girls Kids Schoolbag Children Bookbag Women Casual Daypack","https://m.media-amazon.com/images/I/71i+scVCuIL._AC_UL320_.jpg","4.6","16615","25.0","165"
"B07RPLHP13","LaVie Home 5x7 Picture Frames (6 Pack, Silver) Simple Designed Photo Frame with High Definition Glass for Wall Mount & Table Top Display, Set of 6 Classic Collection","https://m.media-amazon.com/images/I/71RLnYSbpHL._AC_UL320_.jpg","4.5","10748","13.99","165"
"B0C5VY63X5","Ainswei Halloween Decorations Indoor,117Pcs Potion Bottles Halloween Decor,Witch Halloween Tiered Tray Decorations,Black And White Witch Lables Decoration For Home Room Party Supplies","https://m.media-amazon.com/images/I/91+89trnTRL._AC_UL320_.jpg","4.6","40","14.99","165"
"B073W9K6Y5","OUTUXED 1000pcs 0.4inch Clear Diamonds Crystals Acrylic Gems Wedding Table Scattering Gemstones Christmas Party Decorations Bridal Shower Vase Fillers","https://m.media-amazon.com/images/I/81roYAKidXL._AC_UL320_.jpg","4.6","6288","6.99","165"
"B004MSMUGI","Clocky Alarm Clock on Wheels (Original) |Extra Loud for Heavy Sleeper (Adult or Kid Bed-Room Robot Clockie) Funny, Rolling, Run-away, Moving, Jumping (Black)","https://m.media-amazon.com/images/I/51LtTqypmkL._AC_UL320_.jpg","4.1","6900","39.99","165"
"B07K2TZ7VH","Stadium Approved Clear Mini Backpack, Heavy Duty Cold-Resistant Transparent PVC Backpack with Work, Security Travel & Stadium(Black)","https://m.media-amazon.com/images/I/61zKjoq2iOL._AC_UL320_.jpg","4.4","2759","10.99","165"
"B07NSFTBP3","Alternative Imagination Colored Candles, 4 Inch Mini Taper Chime Candles, Great for Birthday Parties, Spells, Witchcraft Supplies, Wiccan Decor, Altar Candles, Unscented Meditation Candles, Box of 20","https://m.media-amazon.com/images/I/71xRB4V2wlL._AC_UL320_.jpg","4.4","3653","9.99","165"
"B01NBNF1DH","American Lifetime 【New 2023】 Dementia Clock Large Digital Clock for Seniors, Digital Clock Large Display with Custom Alarms, Clock with Day & Date for Elderly, Large Number Digital Clock Black","https://m.media-amazon.com/images/I/61BNNnvOq5L._AC_UL320_.jpg","4.7","5894","59.95","165"
"B0957BGTM1","winemana Thanksgiving Artificial Pumpkins, 16 Pcs Rustic Foam Fall Autumn Decorations, White Golden Fake Pumpkins, Seasonal Tabletop Centerpieces for Home Indoor Outdoor","https://m.media-amazon.com/images/I/71-aCcBpbuL._AC_UL320_.jpg","4.4","1409","24.99","165"
"B0BPLXYQ1N","AhaGo Floating Picture Frame (Gold, 8""x10"", 1 Set), For Photo Sizes (7x9, 6x8, 5x7), ""Vertical"" Adjustable Tabletop/Shelf Photo Frame, Classy Gift Choice for Halloween, Thanksgiving, Christmas, Home or Wedding Decoration","https://m.media-amazon.com/images/I/61PzSHLPo4L._AC_UL320_.jpg","4.6","256","19.99","165"
"B08LNCJ2H6","CRUGLA Floating Shelves Wall Mounted Set of 3, Hanging Storage Shelf for Bathroom, Living Room, Bedroom, Kitchen Home Decor","https://m.media-amazon.com/images/I/71CF+VMWSIL._AC_UL320_.jpg","4.7","3920","17.29","165"
"B07NZTHCKL","Icona Bay 5x7 White Picture Frame Beautifully Detailed Molding, Contemporary Picture Frame Set, Wall Mount or Table Top, Inspirations Collection","https://m.media-amazon.com/images/I/71-ek9J13RL._AC_UL320_.jpg","4.5","10074","5.98","165"
"B0758YZ7SK","Primitives by Kathy 37176 Wood Photo Holder Block, The WIFI Password Is","https://m.media-amazon.com/images/I/710O+GFQP4L._AC_UL320_.jpg","4.8","2794","7.07","165"
"B09YD1Y6YF","8 Sheet Self Adhesive Letters Stick on Vinyl Letters Capital Letter Stickers Alphabet Sticker Letter for Craft Door Car (Black, 2 Inch, 3 Inch)","https://m.media-amazon.com/images/I/71LHM0bk0TL._AC_UL320_.jpg","4.5","319","11.99","165"
"B0BCFG1NMP","8.2Ft Cat Carpet Protector, Heavy Duty Plastic Pets Scratch Stopper for Carpet, Easy to Cut, Clear Non-Slip Floor Runner Prevent Carpets Rugs from Scratching Tearing Wearing at Doorway","https://m.media-amazon.com/images/I/71UOLCyVCZL._AC_UL320_.jpg","4.3","430","26.99","165"
"B0BYNBGFC9","Room Decor Aesthetic Wall Decor Daily Gratitude Inspirational Metal Tin Sign, Green Boho Home Coffee Room Wall Office Decor 8X12Inch","https://m.media-amazon.com/images/I/7192r6gxMZL._AC_UL320_.jpg","4.7","152","9.99","165"
"B0C4P9181V","Juegoal 2 Pack Fall Tabletop Decorations Plush Scarecrows, Thanksgiving Harvest Handmade Doll, Autumn Shelf Sitters Figurine Gifts, Home Table Centerpieces Housewarming Present Holiday Decor","https://m.media-amazon.com/images/I/81GAVf+JxJL._AC_UL320_.jpg","4.5","5","21.99","165"
"B0BYNG79V3","BOZYBO Digital Clock with 6 Alarm Clocks: Atomic Clock with Indoor Temperature Self Time Correction Clock with Day and Date for Elderly Adjustable Brightness Wall Clock or Desk Clock for Bedroom","https://m.media-amazon.com/images/I/81oCaR++D7L._AC_UL320_.jpg","4.2","213","29.99","165"
"B01MRVOI90","Royal Imports Candle Holder Hanging Oyster Votive Tealight Glass for Wedding, Birthday, Holiday & Home Decoration, Set of 6","https://m.media-amazon.com/images/I/61oiCnemWzS._AC_UL320_.jpg","4.5","1384","7.99","165"
"B09487RVFQ","Orgrimmar 12PCS Realistic Artificial Pumpkins Lifelike Fake Pumpkins Table Fireplace Decor for Fall Harvest Wedding Halloween Thanksgiving (White, 12PCS)","https://m.media-amazon.com/images/I/51kLkLZ62mS._AC_UL320_.jpg","4.5","181","13.99","165"
"B09VP7RHVR","DomeStar 10PCS White Foam Pumpkins with Gold Lines, Artificial Pumpkins Harvest Pumpkins Fake Maple Leaves for Decorating Fall Farmhouse Thanksgiving Home","https://m.media-amazon.com/images/I/71-uucB2gOL._AC_UL320_.jpg","4.4","49","13.99","165"
"B0BS6LD34K","Wooden Fucks 200PCS, Bag of Fuck to Give DIY Jar of Fucks Mini Unfinished Wood Fuck Letters Funny Little Gift for Office Anniversary Birthday Valentines Day","https://m.media-amazon.com/images/I/81Yh4jDyFBL._AC_UL320_.jpg","4.9","79","9.99","165"
"B0C7B1L68J","OAKOA Concrete Fruit Bowl for Kitchen Counter - Large Decorative Bowl for Home Decor - Modern Pedestal Bowl - Key Bowl for Entry Table - Footed Bowl - Entryway Bowl for Keys","https://m.media-amazon.com/images/I/61vjeAriF3L._AC_UL320_.jpg","4.6","33","44.99","165"
"B0BPLN4S8C","YYST Type A 16"" to 39.5"" Swivel End Sash Rod for Top & Bottom Doors & Sidelights Window Curtain Rod Sash Curtain Rod Petite Café Sidelight Rods W Screws (Black-2)","https://m.media-amazon.com/images/I/5152SL3crVL._AC_UL320_.jpg","4.6","162","10.99","165"
"B09T91GZTB","Joyberg 2 Pack 5x7 Picture Frame, Picture Frame Black, Plastic 5x7 Frame for Tabletop Display, Photo Frame with Clear Plexiglass for Vertical or Horizontal Display","https://m.media-amazon.com/images/I/71zJq3OJoqL._AC_UL320_.jpg","4.3","243","5.99","165"
"B0BNDLCRCQ","CEWOR 4 Pack Small Fake Plants Eucalyptus Rosemary Succulents Plants Artificial in Pots for Shelf Artificial Greenery Eucalyptus Plant Indoor for Home Bedroom Living Room Decoration","https://m.media-amazon.com/images/I/81t4afy8J3L._AC_UL320_.jpg","4.6","157","14.99","165"
"B0C9JRSHTG","Halloween Window Clings Bloody Handprint - Bloody Footprints Halloween Window Decorations Stickers, Llewyn 12 Sheets Double Sided Static Window Wall Floor Decals for Horror Bathroom Zombie Party","https://m.media-amazon.com/images/I/81GygYTrTPL._AC_UL320_.jpg","4.7","25","9.99","165"
"B07X2YCDB4","Unicorn Wall Decal,Large Size Unicorn Wall Sticker Decor for Gilrs Kids Bedroom Birthday Party","https://m.media-amazon.com/images/I/81MyXjrBupS._AC_UL320_.jpg","4.7","1840","13.98","165"
"B09KRDF947","Sugar Skull Couple Statue, Sugar Skull Figurine, Resin Crafts Cute Statue Skull - Resin Skull Statue Home Decor, Adorable Skull Sculpture Memorial Statue Halloween Skull Statues Gifts (C)","https://m.media-amazon.com/images/I/71B8qsHtozL._AC_UL320_.jpg","4.7","365","16.66","165"
