"asin","title","imgUrl","stars","reviews","price","category_id"
"B0BFHXPPX5","Comirth Baby Tissue Box Toy, Montessori Toys for Babies 6-12 Months - Premium Cotton Play Scarves Infant Toys with 3 Sensory Balls, Newborn Educational Baby Toys 6 to 12 Months, STEM Toddler 1-3 Gift","https://m.media-amazon.com/images/I/81VWbgAKu1L._AC_UL320_.jpg","4.8","117","21.99","230"
"B09C2DPWD2","Rubber Duck Bath Toys , 50Pack Mini Rubber Ducky Rubber Duck Bulk Float Duck Baby Bath Toy, Shower Birthday Party Favors Gift Classroom Summer Beach Pool Party Games","https://m.media-amazon.com/images/I/710F6x+TbkL._AC_UL320_.jpg","4.7","296","9.99","230"
"B018HGUR9W","Taggies Crinkle Me Toy, Elephant","https://m.media-amazon.com/images/I/81OMhr4un6L._AC_UL320_.jpg","4.8","3102","11.99","230"
"B0CBS3KWRT","Chewy Necklace for Sensory Kids, Seeway Silicone Sensory chew Necklace Oral Motor Aids for Boys Girls, Autism Chew Toys for Kids Teens Adults with Anxiety ADHD SPD or Other Sensory Needs","https://m.media-amazon.com/images/I/51FUpjVMTjL._AC_UL320_.jpg","4.5","22","6.99","230"
"B081DX5XV8","NASHRIO Baby Teething Toys Pack of 5 - Silicone BPA Free Natural Organic Freezer Safe Teethers for Newborn Infant, Soft & Textured - Babies Shower Gift","https://m.media-amazon.com/images/I/71rtdyUAqsL._AC_UL320_.jpg","4.7","2894","9.99","230"
"B0BWDNF166","Wooden Farm Animals Toys for 1 2 3 Year Old Girl Boy, Take-Along Sorting Barn Toy with Baby Chunky Puzzles, Montessori Learning Toys for Fine Motor Games, Christmas Birthday Gifts for Toddlers 1-3","https://m.media-amazon.com/images/I/816RtBmPVLL._AC_UL320_.jpg","4.4","67","23.99","230"
"B0C5H5PL3Y","PHEZAPA Baby Wrist Rattles Foot Finder Socks Set, Infant Rattle Socks and Baby Hand rattles Wrist, Newborn Soft Sensory Toys,Infant Wrist Rattles for Babies 0-6 Months,Baby Gifts 6-12 Months（Purple）","https://m.media-amazon.com/images/I/711zAkDlIBL._AC_UL320_.jpg","4.5","73","6.99","230"
"B00H56I05O","Learning Resources Mini Muffin Match Math Activity Set - 76 Pieces, Ages 3+ Counting Games for Kids, Preschool Learning Toys, Homeschool Learning Toys, Math for Preschoolers","https://m.media-amazon.com/images/I/81-dtg+HyDL._AC_UL320_.jpg","4.8","3734","17.7","230"
"B00F1UPFF4","Melissa & Doug K's Kids Match and Build Soft Blocks Set For Toddlers, Building Blocks, Sensory Baby Stacking Toys","https://m.media-amazon.com/images/I/71-wp6V4h4L._AC_UL320_.jpg","4.7","2590","26.99","230"
"B0915SJRMJ","Asweets Wooden Baby Walker Push and Pull Learning Activity Walker for Boys and Girls Sit to Stand Learning Walker Toddler Toy (Natural)","https://m.media-amazon.com/images/I/71Qc+TfbboS._AC_UL320_.jpg","4.0","236","59.99","230"
"B0CBX9P46X","18 Pcs Halloween Rubber Ducks Soft Rubber Cars Toys Bath Toy Vehicles for Babies Kids Birthday Gifts,Halloween Party Favors(Halloween)","https://m.media-amazon.com/images/I/71IPIyP-62L._AC_UL320_.jpg","4.5","11","9.99","230"
"B0BSMWLWQS","Skoolzy AlphaTracks Alphabet Race Car Track 41-Piece Set with Flexible Felt Racing Tracks ABC Montessori Toys Preschool Activities Includes Letters & Numbers for Kids Recognition Skills Includes eBook","https://m.media-amazon.com/images/I/91cHlxcvAgL._AC_UL320_.jpg","4.3","35","21.99","230"
"B00SM2S7TE","Fisher-Price Little Snoopy Toy","https://m.media-amazon.com/images/I/61yi6NqM5HS._AC_UL320_.jpg","4.7","3395","16.94","230"
"B07DLC2RVC","Big Mo's Toys Baby Cars - Soft Rubber Toy Vehicles for Babies and Toddlers - 12 Pieces","https://m.media-amazon.com/images/I/71kyIJKo-uL._AC_UL320_.jpg","4.5","2952","16.99","230"
"B0B4C7RPJT","WTUST Montessori Toys for 1 2 3 Years Old Boys Girls,Toddler Learning Educational Wooden Sorting & Stacking Toys,Shape Sorter Color Stacker Toy Preschool Kid Puzzles Gifts 1-3","https://m.media-amazon.com/images/I/61Xfj3vbsqL._AC_UL320_.jpg","4.6","203","9.99","230"
"B01DO08B30","Infantino Baby Wrist Rattles, Butterfly and Lady Bug-Themed, 1-Piece Set for Babies 0M+","https://m.media-amazon.com/images/I/81fosenv68L._AC_UL320_.jpg","4.3","8333","5.65","230"
"B0C5WFCK43","24 PCS Halloween Rubber Ducks in Bulk for Kids, Assorted Rubber Duck Toy Duckies for Fun Bath Toys, Trick or Treat Fillers, Halloween Party Favors, Halloween Themed Bathtub Toys","https://m.media-amazon.com/images/I/81-JQK12DCL._AC_UL320_.jpg","5.0","6","23.95","230"
"B0BTYRWYFS","Baby Toy 0-6 Months,Baby Musical Stuffed Animal Soft Toy with Multi-Sensory Crinkle, Rattle & Textures,Baby Girl Toy for 6-12 Months Birthday Gift(Caterpillar)","https://m.media-amazon.com/images/I/61wAsw--PQL._AC_UL320_.jpg","4.7","475","16.95","230"
"B07F3X8Q6N","Shumee Colorful Handmade Wooden Spinning Tops/Spin Tops 3 Pcs, Easy To Spin, Gyroscope, Kindergarten Toys, Educational Toys, Sensory Toys, Fidget Spinner, Gifts For Kids/Toddlers | Baby Birthday Gifts","https://m.media-amazon.com/images/I/61hdDnsq6bL._AC_UL320_.jpg","4.6","1535","11.99","230"
"B0CDLNZ9MY","Crawling Toys for 1 Year Old Boys Gifts Baby Toys 6 to 12-18 Months Musical Learning Car Toys for Toddlers 1-3 Educational Infant Bus with Animal Sounds/Blocks Birthday Christmas for Girls Kids 2 3 4","https://m.media-amazon.com/images/I/71KD7qUbo5L._AC_UL320_.jpg","4.6","123","29.99","230"
"B0BGMQVSKF","Itzy Ritzy - Itzy Pop Sensory Silicone Popper with Raised Textures to Soothe Sore Gums, Mushroom (POP8497)","https://m.media-amazon.com/images/I/410TFXVbFsL._AC_UL320_.jpg","4.9","191","6.98","230"
"B0CFL2XKJP","KUANGO 3 Pcs Newborn Toys Black and White Baby Toys 0-3 Months High Contrast Baby Toys for Newborn - High Contrast Baby Soft Book Infant Tummy Time Toys Crinkle Sensory Toys for Brain Development","https://m.media-amazon.com/images/I/81YRq7l68xL._AC_UL320_.jpg","4.2","9","13.99","230"
"B0B292FHN1","Peppa Pig Peppa’s Alphabet Case, ABC Toys, Puzzle Preschool Toys for 3 Year Olds and Up","https://m.media-amazon.com/images/I/71mY8N5uM0L._AC_UL320_.jpg","4.6","68","17.99","230"
"B0CCMGP843","Bath Toys - Bathtub Basketball Hoop for Kids Toddlers - Bath Toys Shower Toys for Kids Ages 4-8,Suction Cup Basketball Hoop & 3 No Holes Balls Set for Boys Girls,Mold Free No Mold Bath Toys","https://m.media-amazon.com/images/I/71wnX3cmIaL._AC_UL320_.jpg","4.1","17","8.99","230"
"B08CF3YYCG","Mini Zoo Animals - (Pack of 12) Vinyl Rubber Jungle Safari Animal Figures, Squeezable Bath Tub Toys for Kids, Baby Shower, Birthday Party Supplies, Favors, Cake Decor, Table Decorations","https://m.media-amazon.com/images/I/81nxgz5goeL._AC_UL320_.jpg","4.7","900","12.89","230"
"B076PV14BZ","Infantino Aquarium Bath Squirters, 8 Piece Set","https://m.media-amazon.com/images/I/61snYrcrMpL._AC_UL320_.jpg","4.8","1691","11.49","230"
"B09J15459K","Mothby Teething Sticks for Babies Pack of 5, 6.3 Inches Long with 2 Pcs of Cleaning Brushes Straws for 3-12 Months Old Babies, Premium Food Grade Silicone, Refrigerator & Dishwasher Safe","https://m.media-amazon.com/images/I/71VVPHBHYcL._AC_UL320_.jpg","4.7","237","7.99","230"
"B071WSC9RT","Hape Put-Stay Rattle Set | Three Sea Animal Suction Rattle Toys, Baby Educational Toy Set, Multi, 5'' x 2'' (E0330)","https://m.media-amazon.com/images/I/416Mxo3WrXL._AC_UL320_.jpg","4.5","6151","14.41","230"
"B00004WKPP","Learning Resources Plastic Pattern Blocks - Set of 250, Ages 3+, Shape Games for Preschoolers, Homeschool Supplies, Shape Manipulatives for Kids,Back to School Supplies,Teacher Supplies","https://m.media-amazon.com/images/I/81WwMoG2SeL._AC_UL320_.jpg","4.8","4701","17.44","230"
"B074CTZJX8","KarberDark Bath Toy, Fishing Floating Squirts Toy and Water Scoop with Organizer Bag(8 Pack), Fish Net Game in Bathtub Bathroom Pool Bath Time for Kids Toddler Baby Boys Girls, Bath Tub Spoon","https://m.media-amazon.com/images/I/71aAzFi9CEL._AC_UL320_.jpg","4.6","9218","11.95","230"
"B09H1ZVKVD","Inertia Baby Toy Cars Gifts with Storage Bag, 6 Pcs Push and Go Kids Early Educational Toys for 1 2 3 Year Old Boys Girls, Birthday Gift for Toddlers","https://m.media-amazon.com/images/I/81UB+NMpXlL._AC_UL320_.jpg","4.4","443","15.99","230"
"B07H7RGM89","NATIONAL GEOGRAPHIC Stepping Stones for Kids – 10 Soft Durable Stones Encourage Toddler Balance & Gross Motor Skills, Indoor & Outdoor Toys, Balance Stones, Obstacle Course (Amazon Exclusive)","https://m.media-amazon.com/images/I/914iA0sAFiL._AC_UL320_.jpg","4.5","2330","49.99","230"
"B003KN277S","World of Eric Carle, The Very Hungry Caterpillar Jack in the Box","https://m.media-amazon.com/images/I/71du82WMt-L._AC_UL320_.jpg","4.5","1677","27.5","230"
"B07ND3679K","Bath Crayons Super Set - Set of 12 Draw in the Tub Colors with Bathtub Storage Mesh Bag -Non-Toxic, Safe for Children, Won't Disintegrate in Water -Art Project for Kids and Toddlers","https://m.media-amazon.com/images/I/61wb-932ajL._AC_UL320_.jpg","4.0","3264","9.99","230"
"B07N15L6ZH","Taggies Sensory Stuffed Animal Soft Rattle with Teether Ring, Molasses Sloth","https://m.media-amazon.com/images/I/91KJhQJkuzL._AC_UL320_.jpg","4.8","3217","9.99","230"
"B0CD5RN2SB","Kerundo 210Pcs Number Education Teaching Math Play Prop Sets Realistic Pretend Early Math Nubmer Skills Develop Set","https://m.media-amazon.com/images/I/818OaPRA0+L._AC_UL320_.jpg","5.0","12","9.99","230"
"B0BFKMBHTQ","Crinkle Soft Baby Books, 3D Touch Feel High Contrast Cloth Book Sensory Baby Toys 0-6-12 Months, Early Learning Stroller Toys for Infants Toddler Gifts, Forest Jungle Tails","https://m.media-amazon.com/images/I/71naUQRe5BL._AC_UL320_.jpg","4.7","197","7.99","230"
"B07Y925Z8T","Best Ride On Cars Baby Toddler 3 in 1 Little Tikes Toy Push Vehicle Stroller, Walking Push Car and Ride On, Red","https://m.media-amazon.com/images/I/71xrzi+QIdL._AC_UL320_.jpg","4.7","381","57.85","230"
"B0BFFHVNMB","Nuby All Silicone Chocolate Chip Cookie & Milk Carton Teether – 2 Pack, 3+ Months","https://m.media-amazon.com/images/I/61uT1ihLWYL._AC_UL320_.jpg","4.8","132","9.99","230"
"B089QHWF76","MONT PLEASANT Sensory Bin Toys for Toddlers Montessori Toys, Waldorf Toys, Pretend Play Dish and Tongs- Fine Motor Learning Toys for Sensory Table Activities","https://m.media-amazon.com/images/I/812KlUNkOvS._AC_UL320_.jpg","4.4","639","21.99","230"
"B0C9QZFF8P","Baby Sensory Teething Toys for Babies 0-6 Months, Montessori Toys Baby Teether, Infant Toys Gifts for Boys Girls 0 3 6 9 12 Months 1 One Year Old, Newborn Essentials Must Haves","https://m.media-amazon.com/images/I/6196McRuYZL._AC_UL320_.jpg","4.8","21","9.99","230"
"B0CC7D4DT2","Nature Bound Stick Horse | Plush Handcrafted Hobby Horse | Stick Pony Provides Fun Pretend Play for Toddlers & Preschoolers | Handsewn, Wood, Sound Effects | Pinto Style","https://m.media-amazon.com/images/I/81qh7c6fH0L._AC_UL320_.jpg","4.7","131","39.99","230"
"B0BNKQKPYJ","PandaEar 2 Pack Silicone Baby Teething Toys| Baby Hand Teether Mitten for Sucking Needs| Baby Chew Toys Hand Pacifier for Soothing Teething Pain Relief (White/Pink)","https://m.media-amazon.com/images/I/51qpIcnT7wL._AC_UL320_.jpg","4.7","168","8.48","230"
"B07T3J4T9K","Mighty Bee Bath Toy - Toddler Bath Toys for Kids Ages 4-8, Engaging STEM Bathtub Toys - Original Pipes N Valves Set - 12 Pieces","https://m.media-amazon.com/images/I/81OY-wtH6AL._AC_UL320_.jpg","4.1","2180","15.95","230"
"B002M09F8Y","World of Eric Carle, The Very Hungry Caterpillar Apple Play Set and Shape Sorter Developmental Toy","https://m.media-amazon.com/images/I/91jWjLEJ+oL._AC_UL320_.jpg","4.8","1087","26.0","230"
"B09HWLH313","eKids Disney Encanto Toy Microphone for Kids, Built-in Music and Flashing Lights for Fans of Disney Toys for Girls","https://m.media-amazon.com/images/I/711DDPEHPXL._AC_UL320_.jpg","4.5","820","12.99","230"
"B079X91J5M","KIDS PREFERRED Princess Belle Soft Book for Babies 81131 Multicolor","https://m.media-amazon.com/images/I/71J9iQ08+FL._AC_UL320_.jpg","4.9","1261","10.5","230"
"B07FY97GK2","Joyshare 4 PCS Baby Soft Hanging Rattle Crinkle Squeaky Toy - Baby Toys for 0 3 6 9 to 1 Animal Ring Plush Stroller Infant Car Bed Crib Travel Activity Hanging Wind Chime with Teether for Boys Girls","https://m.media-amazon.com/images/I/61gVJ8XsCtL._AC_UL320_.jpg","4.7","1560","17.99","230"
"B0BQQBG9FW","Montessori Toys for 1 Year Old,Travel Pull String Activity Toy for Babies 6-12 Months,Sensory Toys Fine Motor Skills Toys,Food Grade Silicone Fidget Infants Toys Gifts for Toddlers Boys Girls","https://m.media-amazon.com/images/I/71xpvMiNd-L._AC_UL320_.jpg","4.7","115","11.97","230"
"B0C7F4TW99","Kids Preferred Harry Potter Sorting Hat Mirror On The Go Rattle Plush Toy","https://m.media-amazon.com/images/I/712npXoqGfL._AC_UL320_.jpg","4.8","7","8.0","230"
"B08T6TZS3H","YowellGo Baby Simple Sensory Toys Silicone Fidget Toy Stress Relieving Fidgeting Game Educational Gifts for Kids Babies and Toddlers Age 6 Months and up","https://m.media-amazon.com/images/I/61kTld2rnnL._AC_UL320_.jpg","4.6","555","6.99","230"
"B0B6184ZSX","Sensory Chew Toys for Autistic Children, 5 Pack Silicone Chew Tube Teething Sticks Toys for Autism, ADHD, SPD, Chewies with Special Needs, Oral Motor Chewy Tool for Sensory Kids Chewer (Colorful B)","https://m.media-amazon.com/images/I/71WQIkBTf9L._AC_UL320_.jpg","4.6","141","12.98","230"
"B09TL16XRM","JUZBOT Montessori Toys Wooden Educational Learning Toys for 1 2 3 4 Year Old, Toddler Boy Girl Toy Gift Wood Preschool Fine Motor Skills Learning Games","https://m.media-amazon.com/images/I/61UCVARvebL._AC_UL320_.jpg","4.7","219","24.99","230"
"B0BG395C2W","Baby Einstein Ocean Explorers Opus Spin & Sea Activity Toy, Ages 3 Months and up","https://m.media-amazon.com/images/I/61HmmmgjXwL._AC_UL320_.jpg","4.0","68","12.19","230"
"B08XY4JPGS","Disney Wooden Toys Winnie the Pooh Balance Blocks, 17-Piece Set Features Winnie the Pooh, Piglet, Tigger, and Eeyore, Officially Licensed Kids Toys for Ages 18 Month by Just Play","https://m.media-amazon.com/images/I/81W3K1p8umL._AC_UL320_.jpg","4.7","316","19.97","230"
"B087TQDCLQ","Caterbee Travel Arch Bassinet Toys for Infant & Toddlers, Baby Stroller Toy Crib Accessory & Pram Activity Bar Toy for Indoor and Outdoor (Elephant)","https://m.media-amazon.com/images/I/61mDFi+8z5L._AC_UL320_.jpg","4.6","1050","22.8","230"
"B085VPGMLZ","VERTOY Flower Garden Building Toy Set for 3, 4, 5, 6 Year Old Girls, STEM Educational Activity Toys and Girls Birthday Gift for Age 3+ yr Toddlers and Kids, 143 pcs","https://m.media-amazon.com/images/I/81py-4aa-1L._AC_UL320_.jpg","4.8","2740","32.97","230"
"B01M5IW4EO","Bumkins Teething Freezer Toys (Nintendo Remote) Teether for Babies - Relief for Gums, For 3 Months Up, Freezable Silicone","https://m.media-amazon.com/images/I/61g-QEADfYL._AC_UL320_.jpg","4.8","11207","9.95","230"
"B0BMTJNYM7","Asweets 2 in 1 Wooden Baby Walker Push and Pull Doll Stroller,Shopping Cart Learning Walker for Boys and Girls Sit Stand Learning Walker Toddler Toy","https://m.media-amazon.com/images/I/61tsqQpAlHL._AC_UL320_.jpg","4.1","79","49.99","230"
"B097PTKYJH","Ulanik Balls in Cups Large Montessori Toy Wooden Sorter Game 12 Balls 35 mm Age 1+ Color Sorting and Counting Preschool Learning Education","https://m.media-amazon.com/images/I/615eHN+jeUS._AC_UL320_.jpg","4.7","487","32.5","230"
"B096QLVXP7","OKGIUGN Ferry Boat Toys Set with 4 Cars and 4 Wind Up Bath Swimming Toys, Kids Bath Toy Floating Vehicle Whales Submarines Swans Rockets, Bathtub Bathroom Pool Beach Toys for Toddlers Boys Girls Kids","https://m.media-amazon.com/images/I/71EEFMt+iNL._AC_UL320_.jpg","4.6","353","28.95","230"
"B07N13MXTQ","Taggies Soothing Sensory Stuffed Animal Security Blanket, Flora Fawn, 13 x 13-Inches","https://m.media-amazon.com/images/I/81OB0k181JL._AC_UL320_.jpg","4.8","1019","20.08","230"
"B0BLJ4SPJ1","LEGO DUPLO My First Organic Garden Brick Box 10984, Stacking Toys for Babies and Toddlers 1.5+ Years Old, Learning Toy with Ladybug, Bumblebee, Fruit & Veg","https://m.media-amazon.com/images/I/71GRuOXGHKL._AC_UL320_.jpg","4.6","41","38.36","230"
"B09729GL7T","Hollow Teether Tubes, Honboom 5 Packs Soft Silicone Teething Tubes, Baby Soothing Teether Toy, Chew Straw Toy for Babies 0-12 Months with a Cleaning Brush, Dishwasher Safe (6.6in)","https://m.media-amazon.com/images/I/5160kTW8wWL._AC_UL320_.jpg","4.7","2121","7.49","230"
"B0BQ88BYPL","Learning Resources Big Feelings Nesting Fruit Friends, 9 Pieces, Ages 18+ Months, Social Emotional Learning Toys, Sensory Toys, Speech Therapy Materials","https://m.media-amazon.com/images/I/610C7W+o94L._AC_UL320_.jpg","4.7","102","15.29","230"
"B0B5L4KD2W","pigipigi Montessori Toys Toddler Gift - Wooden Blocks Sorting Stacking Toy for 1 2 3 4 Years Old Baby Boys Girls Learning Shape Color Preschool Kid Educational Activity Game Christmas Birthday Gift","https://m.media-amazon.com/images/I/61YONO236xL._AC_UL320_.jpg","4.6","529","12.99","230"
"B07NJQHH17","edxeducation Transparent Pattern Blocks - Mini Jar Set of 120 - Plastic Pattern Blocks - Practice Sorting, Patterns, Measurement and Fractions - Sensory Play - Math Manipulative for Kids","https://m.media-amazon.com/images/I/91kPOL4XymL._AC_UL320_.jpg","4.6","66","12.8","230"
"B0BCL53FS1","Hapinest Montessori Wooden Musical Toy Instruments 9 Piece Set for Kids Boys and Girls for Babies and Toddlers","https://m.media-amazon.com/images/I/81FpFoxPXXL._AC_UL320_.jpg","4.8","44","19.99","230"
"B0BBKH77M3","Baby Suction Cup Spinning Tops Toy, Suction Spinner Toys for Babies, Window Suction Toys for Baby High Chair Tray Bath Table Airplane Travel, Sensory Toys & Best Gift for Toddlers 1-3(Group B)","https://m.media-amazon.com/images/I/61zdB7Y7h1L._AC_UL320_.jpg","4.4","102","7.98","230"
"B0C39TQJB5","26 Pcs Alphabet Suction Toys Bath Toy Family Game for Kids Toddlers Preschool Learning Spelling Games ABC Suction Cup Toys Classroom Toys for Kids Bathtub Wall Window Toys for Autism/ADD/ADHD","https://m.media-amazon.com/images/I/71q-Cl+qKvL._AC_UL320_.jpg","4.1","79","11.99","230"
"B09LCKVLVS","xinlong 2 Pcs Wooden Rubber Band Gun Quality Wood & Handmade Kids Outdoor Toy 9 Inches Length","https://m.media-amazon.com/images/I/71VTApWBE3L._AC_UL320_.jpg","4.1","150","6.5","230"
"B08NX4CXRH","Mini Tudou 6 PCS Baby Stacking & Nesting Toys, Soft Stacking Blocks Ring Stacker, Baby Sensory Teether Toys with Letter, Animal and Shape, Early Learning Toys for Babies Toddlers Kids 6 Months","https://m.media-amazon.com/images/I/514Wgoxj9RL._AC_UL320_.jpg","4.5","2235","13.99","230"
"B09HW3BH3N","RaZbaby Silicone Infant & Baby Teething Toy, Textured BerryBumps Soothe Babies’ Sore Gums, RaZberry Bites Relief Teether, Back & Front Teeth, BPA Free, Easy to Hold, Fruit Shape for Babies 3M+ - Red","https://m.media-amazon.com/images/I/61HTOAnaCpL._AC_UL320_.jpg","4.8","515","9.99","230"
"B0BZN5CXMS","Sticks for Kids Travel Size, Montessori Toddler Toys, Toys for 1-3 Year Old, 1 Year Old Gift, Wooden Toddler Toys, Toddlers Stay Busy, Sensory Toys, Learning Toys for Toddlers, Educational Games","https://m.media-amazon.com/images/I/611rmZY3LDL._AC_UL320_.jpg","4.2","45","23.99","230"
"B0BBWNYY9Q","RaZbaby Soft Silicone Infant & Baby 3M+ Teether Toy Massaging Bristles Teething Relief Pacifier - Soothes Sore Gums - Hands-Free & Easy-to-Hold Chompy Teether, BPA Free (RED/Blue)","https://m.media-amazon.com/images/I/614gWCKpj6L._AC_UL320_.jpg","4.6","428","9.99","230"
"B0B844D3J8","Nuby IcyBite Sea Teether for Teething Relief - 3+ Months - Baby Teething Toy","https://m.media-amazon.com/images/I/71-p1-uwtSL._AC_UL320_.jpg","4.6","249","5.99","230"
"B08GHD7TPC","Baby Bath Toys-Wind up Turtle Bathtub Toys,Toy for Babies 6-12 Months Floating Swimming Turtles for Boys Girls,Baby Shower Bathtime Fun Pool Toys for Toddlers,Gift for 1 2 3 4 Year Old Boys Girls","https://m.media-amazon.com/images/I/71NQ3gWZhvL._AC_UL320_.jpg","4.3","387","8.39","230"
"B0CC5MHTMT","URMYWO Busy Board - Toddlers Backpack for 1 2 3 4 Year Old - Montessori Sensory Toys with Numbers Buckles - Develop Life Skills Learning Activity Fine Motor Skills Toddler Travel Toys Birthday Gifts","https://m.media-amazon.com/images/I/81BD-x8f1KL._AC_UL320_.jpg","5.0","20","24.99","230"
"B0B25LNFMJ","Taf Toys Newborn Soft Activity Book Black & White High Contrast Baby Book Infant Sensory Toys Tummy Time Soft Cloth Books for Babies Textured Fabric Crinkling Shapes Patterns 0-12 Months Newborn Toys","https://m.media-amazon.com/images/I/71GTyVOesRL._AC_UL320_.jpg","4.9","120","17.95","230"
"B09QWBBTH4","Baby Toys Musical Instruments, Rundad All-in-one Wooden Montessori Musical Set for 1&2Y (Includes Xylophone Drum Cymbal Guiro Gears), Gifts for 1+ Year Old Girl Preschool","https://m.media-amazon.com/images/I/61QQqyr94NL._AC_UL320_.jpg","4.6","140","31.86","230"
"B0B5F79JXH","Dr. Brown’s Flexees Beaded Baby Teether Rings, Soft 100% Silicone, 3 Pack, Pink, White, Gray, BPA Free, 3m+","https://m.media-amazon.com/images/I/618J2A2WEAL._AC_UL320_.jpg","4.7","868","6.0","230"
"B07ST9YLR3","Play22 Montessori Toys for 1 2 3 Years Old Toddlers Boys Girls - Wooden Sorting & Stacking Educational Kids Learning Toys Color Recognition Stack and Sort 20Pc, Great Gift – Original","https://m.media-amazon.com/images/I/71M26PRMnGL._AC_UL320_.jpg","4.7","716","8.99","230"
"B07RKZ21BD","Baby Fruit Feeder Pacifier (2 Pack), Fresh Food Feeding Teether for Toddler, BPA Free, Soothing Gum Relief, Infant Silicone Teething Toy, Includes All The Sizes of The Silicone Nipple Pouches","https://m.media-amazon.com/images/I/81XDs1AeWvL._AC_UL320_.jpg","4.6","1529","12.97","230"
"B08TMHXMYC","Ahua Bath Duck Toys 5 Pcs Rubber Duck Family Squeak Ducks Baby Shower Toy for Toddlers Boys Girls (Yellow Duck Family)","https://m.media-amazon.com/images/I/41xLFRhSgRL._AC_UL320_.jpg","4.7","859","8.49","230"
"B07NVL3FLQ","BabyBjörn Toy for Bouncer, Soft Friends","https://m.media-amazon.com/images/I/71wBRSOP8BL._AC_UL320_.jpg","4.7","277","59.99","230"
"B0C1TJ2Z5B","6PCS Suction Cup Spinner Toy for Toddlers 1-3 Year Old,Sensory Bath Toys Gift for 18 Months,Window Suction Spinner Toys,Boys and Girls Sensory Toys Gifts,Travel Baby Spinning Toys","https://m.media-amazon.com/images/I/716eg9HxlUL._AC_UL320_.jpg","4.4","66","13.98","230"
"B07PB1MH4B","Learning Resources Hoot the Fine Motor Owl, Color, Shapes and Number Development, 6 Pieces, Ages 18 Months +","https://m.media-amazon.com/images/I/81wRq7kjAfL._AC_UL320_.jpg","4.3","2954","15.99","230"
"B0BCP316BR","Hooku Busy Board for 1 Year Old, Montessori Toys for 2 Year Old, Baby Sensory Toys for Toddlers 1-3, Fine Motor Toys, Toddler Travel Toys, Toddler Learning Activities,Birthday Gifts for Baby Boy Girl","https://m.media-amazon.com/images/I/71iwnWaRokL._AC_UL320_.jpg","4.7","311","19.99","230"
"B083HJYXFY","Taggies Crinkle Me Toy with Baby Paper & Squeaker, 6.5 X 6.5"", Sleepy Seas Octopus","https://m.media-amazon.com/images/I/81b1JjgtaVS._AC_UL320_.jpg","4.8","729","11.99","230"
"B084Q4SGDZ","Radio Flyer Classic Push & Play, Toddler Walker with Activity Play, Ages 1-4, Red Walker Toy","https://m.media-amazon.com/images/I/81gS-oM+5+L._AC_UL320_.jpg","4.8","5295","67.39","230"
"B07MDJ2BB8","8 Pieces Monkey Stringy Balls Sensory Fidget Stringy Balls Soft Rainbow Pom Bouncy Stress Balls with Storage Bag, Multicolor (2.75 Inch 8 Pieces)","https://m.media-amazon.com/images/I/91OI-LUE7CL._AC_UL320_.jpg","4.4","309","13.99","230"
"B0BQMCVV4J","Montessori Toys for Babies 6-12 Months, Food Grade Silicone Pull String |Baby Sensory Teething Toys, Fine Motor Skill, Travel Toys, Birthday Gifts for Infant Boys Girls 7 8 9 10 11-18 Months","https://m.media-amazon.com/images/I/61K0ZiIlgqL._AC_UL320_.jpg","4.7","292","9.99","230"
"B09NSH4BHD","Skylety Musical Smart Remote Key Toy Fake Car Toy Keys with Sound and Lights Fun and Educational Key Toys for Travel Play (Batteries Not Included)","https://m.media-amazon.com/images/I/71raHREMSIL._AC_UL320_.jpg","4.4","232","8.99","230"
"B09D3F18HF","144-Pack Mini Rubber Ducks Set, Mini Colorful Rubber Duckies Bath Toy for Child,Float & Squeak Tiny Ducks Pool Toy Set for Kids Party Favors,Birthday Party Supplies,Prize Rewards","https://m.media-amazon.com/images/I/91oVdXBWA3L._AC_UL320_.jpg","4.6","285","20.99","230"
"B0C1FWRZ1P","TURKIDS Infant Baby Girls Musical Stuffed Animal Activity Soft Toys with Multi-Sensory Crinkle, Mirror, Rattle and Textures for 0-3-6-12 Months Developmental Toys, Octopus","https://m.media-amazon.com/images/I/71kRX3jEiLL._AC_UL320_.jpg","4.9","16","16.89","230"
"B087TLMWJ9","KIDS PREFERRED Disney Baby Minnie Mouse Jack in The Box Musical Toys for Babies and Toddlers, Plays “Somewhere Over The Rainbow” Minnie Springs Out from A Colorful Box, Pink","https://m.media-amazon.com/images/I/51nZ1nHRs9L._AC_UL320_.jpg","4.4","3890","24.95","230"
"B01I0E3W84","Excellerations Shapes Walking Rope for Kids Classroom Supplies(14-1/2' Long) (Item # WALKROPE)","https://m.media-amazon.com/images/I/81Utc-yK0SS._AC_UL320_.jpg","4.8","127","44.99","230"
"B0BC9BS4YS","Baby Toys 6 to 12 Months,4 in 1 Silicone Pull String Montessori Toys for Babies 6-12 Months, Sensory Toys for 1 Year Old Boy Girl Birthday Gifts, Baby Essentials Toys for Travel,Bath,Motor Skills","https://m.media-amazon.com/images/I/61ytjJEZRWL._AC_UL320_.jpg","4.8","150","9.99","230"
"B09S6VKDFM","Tiny Love Musical Nature Stroller Arch, Treasure The Ocean","https://m.media-amazon.com/images/I/71+pcxQ6ftL._AC_UL320_.jpg","4.7","7684","27.93","230"
"B08NNWCTV1","Munchkin® ColorMix Fish™ Color Changing Baby and Toddler Bath Toy","https://m.media-amazon.com/images/I/71SVVrYwt9L._AC_UL320_.jpg","4.6","1225","8.31","230"
"B00BN6QAWM","Green Toys Shape Sorter for 6 months +, Green/Blue","https://m.media-amazon.com/images/I/71gUFjOWdKL._AC_UL320_.jpg","4.7","2602","14.99","230"
"B085ND3TSW","haakaa Silicone Teether Combo -Baby Freezer Teething Toy - Soft Cold Teether - Soothe Teething Pain & Itching Gum -Perfect Size-Palm & Ferris Wheel Shape for 3M+ Babies BPA Free - 2 pk","https://m.media-amazon.com/images/I/51qjb9FJKAL._AC_UL320_.jpg","4.7","2193","19.82","230"
