"asin","title","imgUrl","stars","reviews","price","category_id"
"B0B87X7W6L","Fort Building Kit for Kids,STEM Construction Toys, Educational Gift for 4 5 6 7 8 9 10 11 12 Years Old Boys and Girls,Ultimate Creative Set for Indoor & Outdoors Activity,140 Pcs","https://m.media-amazon.com/images/I/81Gyuza4XpL._AC_UL320_.jpg","4.6","94","49.99","228"
"B08YNNZRQV","Little Kids Disney Mickey Mouse Light and Sound Musical Bubble Wand, Includes Bubble Solution, Multi (20511)","https://m.media-amazon.com/images/I/81sCwKJF-EL._AC_UL320_.jpg","4.2","2595","12.79","228"
"B0B156MJ3D","3 Pack Airplane Launcher Toy,2 Flight Mode Catapult Plane Boy Toys with 3 DIY Stickers,Outdoor Sport Flying Toys for Kids Gifts for 4 5 6 7 8 9 10 12 Year Old Boys Girls","https://m.media-amazon.com/images/I/81TjFOCCIkL._AC_UL320_.jpg","4.3","881","19.99","228"
"B0C4RDZ368","Light-Up Air Tent, Inflatable Blow Up Tent - 30 Seconds Setup - Kids Toys, Age 3 4 5 6 7 8 Years Old - Fort Building - Birthday Gift Idea for Boys and Girls Ages 4-6, Dinosaur Toys (Fan NOT Included)","https://m.media-amazon.com/images/I/71kyh9iU6-L._AC_UL320_.jpg","4.3","40","39.99","228"
"B01N6IKSSZ","Toddler Sensory Kids Table with Lid | Sensory Bin | Kidoozie | Mega Block Compatible Lid | Indoor Outdoor Use , Red, G02521 17 x 12.5 x 11 inches","https://m.media-amazon.com/images/I/51NkM0yA1EL._AC_UL320_.jpg","4.4","4295","29.94","228"
"B071935J8Z","Duncan Toys Imperial Yo-Yo, Beginner Yo-Yo with String, Steel Axle and Plastic Body, Blue","https://m.media-amazon.com/images/I/91yooHYp2TL._AC_UL320_.jpg","4.2","7206","5.99","228"
"B0933HKGG8","Vanland Ball Pit Balls for Baby and Toddler Phthalate Free BPA Free Crush Proof Plastic - 7 Bright Colors in Reusable Play Toys for Kids with Storage Bag","https://m.media-amazon.com/images/I/71p-ztVkPdS._AC_UL320_.jpg","4.4","2504","22.16","228"
"B0C4SM2DN8","HopeRock Indoor Basketball Hoop for Kids, Indoor Over The Door Mini Basketball Hoops, LED Light Mini Hoop with Electronic Scoreboard, Basketball Game Toys Gifts for 5 6 7 8 9 10 11 12+ Year Old Boys","https://m.media-amazon.com/images/I/81KzBncHg1L._AC_UL320_.jpg","4.8","51","33.99","228"
"B01NBKYBTG","Husqvarna 589289601 Toy Lawn Mower for HU800AWD","https://m.media-amazon.com/images/I/61FoGgozHuL._AC_UL320_.jpg","4.7","6698","36.62","228"
"B09PYLQ9LK","ATHLERIA Mini Drone Toys for Age 8-13,2023 UFO Magic Flying Orb Ball with Lights,Hover Boomerang,Fidget Flying Spinner,Cool Stuff Gadgets Christmas Birthday Gift Ideas for Boys Girls 6 7 8 9 10+ Year","https://m.media-amazon.com/images/I/61IXz6XkZeL._AC_UL320_.jpg","4.2","1708","32.0","228"
"B08V5LPVPK","Sunny Days Entertainment Bubble Solution 128oz - Made in USA","https://m.media-amazon.com/images/I/71jcAWS1VNL._AC_UL320_.jpg","4.5","183","11.42","228"
"B07VFCQ3BT","JOYIN 2 Bubble Guns with 2 Bottles Bubble Refill Solution (10 oz Total), Bubble Machine for Toddlers 1-3, Bubble Blaster Party Favors, Summer Toy, Outdoors Activity, Easter, Birthday Gift","https://m.media-amazon.com/images/I/81EntHBHC6L._AC_UL320_.jpg","4.3","12409","21.99","228"
"B01FI4GSLM","JOYIN 14.6’’ Big Bubble Wands for Kids, 1 Dozen Bubble Wand Bulk with Bubbles Refill Solution for Summer Toy Party Favor, Outdoors Activity, Easter Basket Stuffers, Birthday Gift","https://m.media-amazon.com/images/I/71+JUrPYreL._AC_UL320_.jpg","4.8","9920","17.99","228"
"B08V18922X","Shooting Game Toy for Boys - 2 Player Toy Foam Blaster Air Guns, 24 Foam Bullet Balls Popper & Standing Shooting Target, Birthday Gifts for Age 3 4 5 6 7 8 9 10-12 Years Old Kids, Girls","https://m.media-amazon.com/images/I/81tSifsqnXL._AC_UL320_.jpg","4.4","2151","26.99","228"
"B0006O8Q7Y","Stomp Rocket Original Ultra Rocket Launcher for Kids - Soars 200 Ft - 4 High Flying Rockets and Adjustable Launcher - Fun Outdoor Toy and Gift for Boys or Girls Age 5+ Years Old","https://m.media-amazon.com/images/I/81qwIMIAcZL._AC_UL320_.jpg","4.6","16089","19.99","228"
"B0897MNC8J","Tiny Land Kids-Fort-Building-Kit-130 Pieces-Creative Fort Toy for 5,6,7,8 Years Old Boy & Girls-STEM Building Toys DIY Castles Tunnels Play Tent Rocket Tower Indoor & Outdoor","https://m.media-amazon.com/images/I/71OV9WU5RbL._AC_UL320_.jpg","4.1","5386","47.99","228"
"B0791V329G","Sunny Days Entertainment Maxx Bubbles 4oz Bubble Wands – 6 Pack Bubble Wand Toy | Summer Fun, Outdoor Birthday Party Favors for Kids, 101799","https://m.media-amazon.com/images/I/71es91vI+jL._AC_UL320_.jpg","4.4","1791","7.99","228"
"B00091RWN8","WAKA Official Kickball - Adult 10","https://m.media-amazon.com/images/I/91eGplysQuL._AC_UL320_.jpg","4.7","6520","14.99","228"
"B0BSJQGJS4","BLUEY Dance Mode Bubble Machine and Toy Microphone | Bluey Toy for Baby, Toddlers and Kids | Includes Bubble Solution","https://m.media-amazon.com/images/I/61l4CdYwi-L._AC_UL320_.jpg","3.7","137","15.9","228"
"B000OV0X4S","INTEX 58859EP Sit 'N Float Inflatable Lounge: Built-In Cup Holders – Heavy-Duty Handles – 220lb Weight Capacity – 58"" x 39"" – Colors May Vary","https://m.media-amazon.com/images/I/61IGIJvN3cL._AC_UL320_.jpg","4.1","11839","9.83","228"
"B076T9W19V","ArmoGear Laser Tag – Laser Tag Guns with Vests Set of 4 – Multi Player Lazer Tag Set for Kids Toy for Teen Boys & Girls – Outdoor Game for Kids, Adults and Family – Ages 8+","https://m.media-amazon.com/images/I/91fa4ESyneL._AC_UL320_.jpg","4.6","10300","89.99","228"
"B0CF433FLK","Light Up Soccer Ball - Glow in the Dark - NO 5 - Sports Gear Gifts for Boys & Girls 8-15+ Year Old - Kids, Teens Gift Ideas - Cool Boy Toys Ages 8 9 10 11 12 13 14 15 Glowing Night Activity","https://m.media-amazon.com/images/I/815Tfpp++oL._AC_UL320_.jpg","4.5","9","34.99","228"
"B0B1PSTPZV","CoComelon NO Spill Musical Bubble Machine | Bubble Toy for Baby, Toddlers and Kids | Amazon Toys Exclusive with 16 oz of Extra Bubble Solution (Bubble Solution Bottle Colors Will Vary)","https://m.media-amazon.com/images/I/81AGBQTPSjL._AC_UL320_.jpg","4.2","1400","17.85","228"
"B09XDW7YDF","Pokiiulk Refill Darts Bullets Compatible with Nerf Guns N-Strike Elite Series, 300PCS Refill Darts Premium Foam Bullets Pack with Portable Storage Bucket","https://m.media-amazon.com/images/I/81s7Xu5ZEnL._AC_UL320_.jpg","4.8","486","13.95","228"
"B08P27R539","NERF Weather Blitz Foam Football for All-Weather Play - Easy-to-Hold Grips – Great for Indoor and Outdoor Games - Green","https://m.media-amazon.com/images/I/81P79h28VlL._AC_UL320_.jpg","4.7","1355","13.99","228"
"B08CVVN3L4","Rettebovon Princess Castle Tents Kids' Fairy Play Tents Girls Toys Hexagon Playhouse with Star Lights Toys for Children Indoor or Outdoor Game Girls Gift","https://m.media-amazon.com/images/I/71JPCpmwH6L._AC_UL320_.jpg","4.1","356","79.99","228"
"B0BXF8W8BM","John Deere Bubble-N-Go Mower – Toy Lawn Mower with Bubble Solution | Green Automatic Bubble Machine | No Batteries Required – Sunny Days Entertainment","https://m.media-amazon.com/images/I/81-Olpec9EL._AC_UL320_.jpg","4.5","115","29.99","228"
"B0029VVMS2","Champion Sports Rhino Playground Balls","https://m.media-amazon.com/images/I/918z4tet-9L._AC_UL320_.jpg","4.4","3763","7.68","228"
"B01KK0D448","MAGICYOYO Responsive YoYo K1-Plus for Kids Beginners with Yoyo Sack + 12 Strings and Yo-Yo Glove Gift (Blue)","https://m.media-amazon.com/images/I/71IlzRzkt6L._AC_UL320_.jpg","4.4","5469","13.99","228"
"B0BXX1GKS8","Bubble Machine Automatic Bubble Blower, 10000+ Bubbles Per Minute with 2 Speeds, 8 Wands Bubble Maker, Plug-in or Batteries Bubbles Summer Toys for Outdoor Indoor Party Birthday (Black)","https://m.media-amazon.com/images/I/719gzSxWkjL._AC_UL320_.jpg","4.3","1008","24.99","228"
"B074XB3S8F","Little Tikes Easy Score Basketball Set, Pink- Amazon Exclusive 22.00 L x 23.75 W x 61.00 H Inches","https://m.media-amazon.com/images/I/71F012O6UdL._AC_UL320_.jpg","4.8","12072","35.99","228"
"B085ZZ5L59","Crayline Pop Up Princess Tent with Star Light, Toys for 1 Year Old Girl Birthday Gift, Ball Pit for Babies, Toddlers Girls Toys, Easy to Pop Up and Assemble","https://m.media-amazon.com/images/I/613upy8h20L._AC_UL320_.jpg","4.6","3877","20.99","228"
"B09W1BYYR2","LANGXUN Soft Plastic Ball Pit Balls, Plastic Toy Balls for Kids, Ideal Gift for Baby Toddler Birthday Christmas, Ball Pit Play Tent, Baby Kiddie Pool Water Toys, Party Decoration 50pcs /100pcs","https://m.media-amazon.com/images/I/71oeWbcJerL._AC_UL320_.jpg","4.5","5170","16.99","228"
"B0C1XQ2R9K","RACPNEL Collapsible Beach Toys for Kids Toddlers, Sand Bucket and Shovels Set with Mesh Bag, Sand Castle Toys for Beach, Travel Sand Toys, Sandbox Toys for Toddlers Kids Age 3-10","https://m.media-amazon.com/images/I/81yjhjql9NL._AC_UL320_.jpg","4.5","194","16.99","228"
"B0B2NM5LX1","BOHIYAHOO Party Favors Mini Bubble Wands Tube Bulk Toys 32piece 8colour Themed Birthday Wedding Bath Time Summer Best Gift Family Outdoor Use Safe for Boys Girls Bubble Solution Bubble Maker","https://m.media-amazon.com/images/I/71DJx8w9l3L._AC_UL320_.jpg","4.6","291","12.88","228"
"B0BQCY2JRV","LEGACY KIDS Reusable Water Balloons For Kids 12 Pack | Refillable Water Balloons For Kids | Reusable Water Balls | Magnetic Water Balloons | Silicone Reusable Water Balloons Quick Fill","https://m.media-amazon.com/images/I/81nfmovmCJL._AC_UL320_.jpg","4.5","446","16.49","228"
"B0120XRWLE","FoxPrint Princess Castle Play Tent with Glow In The Dark Stars, Conveniently Folds in To A Carrying Case, Your Kids Will Enjoy This Foldable Pop Up Pink Play Tent/House Toy for Indoor & Outdoor Use","https://m.media-amazon.com/images/I/810V-KPoFiL._AC_UL320_.jpg","4.6","38077","19.99","228"
"B07SDD936K","ABUSA Heavy Duty Black Swing Hangers Screws Bolts Included Over 5000 lb Capacity Playground Porch Yoga Seat Trapeze Wooden Sets Indoor Outdoor 2 Pack","https://m.media-amazon.com/images/I/51AZNVCnofL._AC_UL320_.jpg","4.7","5484","25.99","228"
"B0BRPSSMHV","Collapsible Beach Toys Set for Kids Toddlers Girls, Collapsible Sand Bucket and Shovels Set with Mesh Bag & Sand Molds, Ice Cream Travel Sand Toys for Beach, Sandbox Toys for Toddlers Kids Age 3-10","https://m.media-amazon.com/images/I/81BXUlhHO4L._AC_UL320_.jpg","4.6","441","12.99","228"
"B07F7B493R","Bedwina Knobby Balls - (Pack of 6) Bulk 7 Inch Sensory Balls and Spiky Massage Stress Balls, with Pump, Fun Bouncy Ball Party Favors, Stocking Stuffers for Kids, Toddlers","https://m.media-amazon.com/images/I/71J67ulN2qL._AC_UL320_.jpg","4.6","3923","11.89","228"
"B0B5ZLCBJM","Liberry Toddler Golf Set, Upgraded Kids Golf Cart with Unique Shoulder Strap Design, Indoor and Outdoor Golf Toys for Boys and Girls Aged 1-5 Years Old","https://m.media-amazon.com/images/I/71j5ntRY6sL._AC_UL320_.jpg","4.6","386","29.99","228"
"B08XB8T7LS","12 Packs Water Gun for Kids Squirt Toys Outdoor Beach Swimming Pool Game Summer Party Favor","https://m.media-amazon.com/images/I/714d3QOfPzL._AC_UL320_.jpg","4.0","1039","8.99","228"
"B01AD1TDNU","Melissa & Doug Sunny Patch Giddy Buggy Flashlight With Easy-Grip Handle - Toddler Flashlight, Flashlight For Kids Ages 3+","https://m.media-amazon.com/images/I/710uml0MttL._AC_UL320_.jpg","4.4","4111","8.89","228"
"B07GSXV39K","MAGICYOYO Professional Yoyo Responsive Yoyo V3, Alloy YoYo for Kids Beginner, Replacement Unresponsive Yoyo Bearing for Advanced Yoyo Player + Removal Bearing Tool + Axle + Yoyo Case + 12 Yoyo Strings","https://m.media-amazon.com/images/I/71OmwvO6XHL._AC_UL320_.jpg","4.5","6145","17.99","228"
"B0C4P3L382","Garbo Star 148PCS Flower Garden Building Toys for Girls, Educational Activity Preschool Birthday Gifts for 2 3 4 5 Year Old Girls, Toddler Building Stem Toys for Kids Toddlers Ages 1-3 3-5","https://m.media-amazon.com/images/I/81Nnbjmbw1L._AC_UL320_.jpg","4.7","81","22.94","228"
"B09BG36V9N","Swurfer Coconut Toddler Swing – Comfy Baby Swing Outdoor, 3- Point Adjustable Safety Harness, Secure, Safe Quick Click Locking System, Blister-Free Rope, Easy Installation, Ages 6-36 Months","https://m.media-amazon.com/images/I/71RMFhnExnL._AC_UL320_.jpg","4.7","1761","39.99","228"
"B01M0V474Y","B. toys - Bug Bungalow,Observation Skills, 36 months to 96 months","https://m.media-amazon.com/images/I/81011Ib0PRL._AC_UL320_.jpg","4.8","2993","7.99","228"
"B07QN1YBGT","Gator Golf - Putt The Ball into The Gator's Mouth to Score Game by Goliath, Single, Gator Golf, 27 x 27 x 12.5 cm for age 3+ years","https://m.media-amazon.com/images/I/718PbkVcj1L._AC_UL320_.jpg","4.4","4165","15.19","228"
"B07D8QFBK7","Atlasonix Giant Bubble Solution 7 Gallons - Bubble Refill, Giant Bubble Mix for Big Bubble Solution Refill for Kids, All Natural Bubble Concentrate Bottle for Bubble Machine","https://m.media-amazon.com/images/I/61IbimLq-+L._AC_UL320_.jpg","4.4","5323","16.99","228"
"B08SY8H1S5","NERF Fortnite B-AR Motorized Dart Blaster -- Fortnite Converge Wrap, Motorized 10-Dart Blasting, 10-Dart Clip, 10 Official Elite Darts","https://m.media-amazon.com/images/I/61BUkfy1koL._AC_UL320_.jpg","4.5","2891","20.99","228"
"B07DQFW6TH","Bubble Wands Party Favors Pack of 64, Mini Neon Bubble Wands | Odor-Free Non-Toxic Kids’ Bath Toy/Birthday Treats Bubble Maker Toys for Kids | Outdoor Summer Events & Celebration Toy Gift","https://m.media-amazon.com/images/I/71QLkxSBZPL._AC_UL320_.jpg","4.5","3088","13.98","228"
"B0977M3SMB","Large Burlap Potato Sack Race Bags, 23x40"", Outdoor Lawn Easter Games for Kids & Adults , 4th of July BBQ, Picnic, Block Party, Family Reunion, Birthday , Halloween - Set of 6","https://m.media-amazon.com/images/I/81YEE461YbL._AC_UL320_.jpg","4.5","2599","25.99","228"
"B07Q4NFMNS","Meland Kids Camping Set with Tent 30pcs - Outdoor Campfire Toy Set for Toddlers Kids Boys Girls - Pretend Play Camp Gear Tools for Birthday Christmas (Green)","https://m.media-amazon.com/images/I/71uRTP8LjjL._AC_UL320_.jpg","4.7","7644","34.99","228"
"B08MJPM646","NERF Fortnite 6-SH Dart Blaster - Camo Pulse Wrap, Hammer Action Priming, 6-Dart Rotating Drum, Includes 6 Official Elite Darts","https://m.media-amazon.com/images/I/81mGWfNPdML._AC_UL320_.jpg","4.7","7422","14.97","228"
"B0796JVBJ8","Max Liquidator 6-Pack Water Blaster Set","https://m.media-amazon.com/images/I/716g9YkIVaL._AC_UL320_.jpg","4.7","9325","27.0","228"
"B0BZKQN129","SHCKE Automatic Bubble Machine Upgrade Bubble Blower with 2 Fans, 20000+ Bubbles Per Minute Bubbles for Kids Portable Bubble Maker Operated by Plugin or Batteries for Indoor Outdoor Birthday Party","https://m.media-amazon.com/images/I/810YI58d3bL._AC_UL320_.jpg","4.3","719","27.99","228"
"B00AYLLFWC","Rhode Island Novelty 7 Inch Knobby Balls Assorted Colors 5 Pack","https://m.media-amazon.com/images/I/61ntmmaWWpL._AC_UL320_.jpg","4.3","2834","6.38","228"
"B09Q4JP1XL","Bluey Ultimate Lights & Sounds Playhouse & Toy Box, 2.5-3 inch Figures - Amazon Exclusive","https://m.media-amazon.com/images/I/71jNtKGpc4L._AC_UL320_.jpg","4.7","1416","98.52","228"
"B0B3XGGD1S","Chridark Ankle Skip Ball for Kids - Foldable Flash Wheel Skip Ball, Outside Game Toys for Kids & Adults, Gift for Boys & Girls Age 5 6 7 8 9 10 Years Old","https://m.media-amazon.com/images/I/71O3LaYLESL._AC_UL320_.jpg","4.2","677","19.99","228"
"B071WP41M2","Scotamalone Kids Binoculars Shock Proof Toy Binoculars Set for Age 3-12 Years Old Boys Girls Bird Watching Educational Learning Hunting Hiking Birthday Presents","https://m.media-amazon.com/images/I/61bIC+081yL._AC_UL320_.jpg","4.4","12269","7.99","228"
"B08LGCP5DC","JOYIN White Rocket Ship Pop up Play Tent with Tunnel and Playhouse Kids Indoor Outdoor Spaceship Tent Set","https://m.media-amazon.com/images/I/81GNcuh-A1L._AC_UL320_.jpg","4.3","1462","39.99","228"
"B005QIYUMU","Intex Inflatable Jump-O-Lene Playhouse Trampoline Bounce House for Kids Ages 3-6 Pool Red/Yellow, 68-1/2"" L x 68-1/2"" W x 44"" H","https://m.media-amazon.com/images/I/71h9cpypvmL._AC_UL320_.jpg","4.3","5191","49.43","228"
"B00DIHAGS8","Intex 42"" Jumbo Ball - 2-Pack","https://m.media-amazon.com/images/I/610gpUAJ97L._AC_UL320_.jpg","4.5","1470","9.47","228"
"B07GZ3ZJBY","Bunch O Balloons Water Slide Wipeout 2 Lane + 5 Balloon Bunches (165+ Water Balloons) by ZURU Rapid-Filling Self-Sealing Balloons, for Outdoor, Family, Friends, Children Summer Fun","https://m.media-amazon.com/images/I/71hpGLCbMSL._AC_UL320_.jpg","4.4","1248","28.31","228"
"B000SN61UC","Intex Crystal Blue Inflatable Pool, 45 x 10""","https://m.media-amazon.com/images/I/61RJDq0eoZL._AC_UL320_.jpg","4.2","12825","9.53","228"
"B0BLZD45M3","Hover Soccer Ball Toys for Boys, 2 Soccer Balls with Soft Foam Bumpers﻿, Indoor Outdoor Air Floating Hover Ball Football Game Kids Gifts Toys for Age 3 4 5 6 7 8 9 10-16 Year Old Boys","https://m.media-amazon.com/images/I/81nwr+RkQ8L._AC_UL320_.jpg","4.4","961","19.99","228"
"B08P29SYJ3","NERF Nerfoop - The Classic Mini Foam Basketball and Hoop - Hooks On Doors - Indoor and Outdoor Play - A Favorite Since 1972","https://m.media-amazon.com/images/I/71rcRLQRlyL._AC_UL320_.jpg","4.0","1062","8.99","228"
"B08SY6LGBL","Nerf Elite 2.0 Shockwave RD-15 Dart Blaster, 30 Nerf Elite Darts, 15-Dart Rotating Drum, Kids Outdoor Toys for 8 Year Old Boys & Girls and Up","https://m.media-amazon.com/images/I/81SkxfslViL._AC_UL320_.jpg","4.6","11055","27.99","228"
"B07BG7VMY4","Champion Sports Rhino Skin Basic Dodgeball Set With Mesh Storage Bag","https://m.media-amazon.com/images/I/81u6oGT3VAL._AC_UL320_.jpg","4.7","571","42.7","228"
"B0BJ6WPT8N","SHJADE Foam Ball Pit, 35.4""x 11.8"" Ball Pits for Toddlers, Soft Round Kiddie Baby Playpen Ball Pool for Kids, Ideal Gift for Babies Indoor and Outdoor Game, Balls not Included (Grey)","https://m.media-amazon.com/images/I/71KgncgF20L._AC_UL320_.jpg","4.7","101","36.99","228"
"B07LG8NRQP","Jasonwell Inflatable Diamond Ring Pool Float - Engagement Ring Bachelorette Party Float Stagette Decorations Swimming Tube Floaty Outdoor Water Lounge for Adults & Kids","https://m.media-amazon.com/images/I/61hfqXZkAlL._AC_UL320_.jpg","4.8","4694","19.99","228"
"B09QRKX2MB","NERF Minecraft Sabrewing Motorized Blaster Bow, 8 Elite Darts, 8-Dart Clip, Electric Full Auto Toy Foam Blasters, Minecraft Toys for 8 Year Old Boys and Girls and Up","https://m.media-amazon.com/images/I/61uYZnH4ThL._AC_UL320_.jpg","4.6","1307","19.97","228"
"B0B8C47YTQ","Lamnhin 16'' Beach Balls for Kids - 3 Pack Beach Ball Bulk Inflatable Pool Beach Balls Bulk Hawaiian Tropical Theme Party Decorations Favors Supplies","https://m.media-amazon.com/images/I/51rEKGi5wtL._AC_UL320_.jpg","4.1","328","6.98","228"
"B0C56XM8QX","37 Pcs Nano Tape Bubble Kit , Luxe Glitter and Tri-Color 10ft Nano Tape, Super Elastic Bubble Balloons, Party Favors and Fidget Toys for Girls, Boys, Kids","https://m.media-amazon.com/images/I/71mE0meDOvL._AC_UL320_.jpg","4.5","1032","12.99","228"
"B08Z3CTCBF","BAODLON Shooting Games Toy for Age 5, 6, 7, 8, 9, 10+ Years Old Kids, Boys - Glow in The Dark Floating Ball Target with Foam Dart Toy Gun, 10 Balls/5 Targets - Ideal Gift","https://m.media-amazon.com/images/I/61goTfbDSNS._AC_UL320_.jpg","4.3","1269","27.99","228"
"B00ELSOLAC","Banzai Spring & Summer Toys Pool Time Dive Rings 6-Pack","https://m.media-amazon.com/images/I/61v4B5K74xL._AC_UL320_.jpg","4.5","1908","5.75","228"
"B087RCPGBD","100 Nerf N Strike Blaster Compatible Dart Bullets, 100Pcs Nerf Bullet Refill Darts Ammo Premium Foam Bullets Pack Compatible for Nerf N-Strike Elite Guns","https://m.media-amazon.com/images/I/71dGAxabVzL._AC_UL320_.jpg","4.7","1317","8.99","228"
"B081KKK8BR","Bubble-N-Go Deluxe Toy Bubble Lawn Mower with 4 oz Bubble Solution | No Batteries Required | Amazon Exclusive - Maxx Bubbles","https://m.media-amazon.com/images/I/71-SdJU7n6L._AC_UL320_.jpg","4.4","8841","19.13","228"
"B0B1D49BVD","Tiny Land Play Tent with Mat and Lights, Kids Tent Indoor | Kids Playhouse Outdoor, Kids Play Tent with Windows, 52"" x35"" x 53"", Large Toddler Tent for Kids Aged 3+, Kids Room Furniture","https://m.media-amazon.com/images/I/7129G5P+1HL._AC_UL320_.jpg","4.7","468","59.99","228"
"B0871VNSBM","KKONES Kids Toys Hover Soccer Ball (Set of 2), Battery Operated Air Floating Soccer Ball with LED Light and Soft Foam Bumper for Indoor Outdoor Game, Gifts for Age 3 4 5 6 7 8-16 Year Old Boys Girls","https://m.media-amazon.com/images/I/71vXRoAxPAL._AC_UL320_.jpg","4.3","1593","19.99","228"
"B003KJ7BWS","Neato! Classics 160 Marbles In A Tin Box by Toysmith - Retro Nostalgia Glass Shooter, Marble Games Are Timeless Play For Kids - Boys & Girls","https://m.media-amazon.com/images/I/91hP929Vv6L._AC_UL320_.jpg","4.5","10865","12.99","228"
"B0B34RZJ3C","nutty toys Parachute Toys for Kids - Tangle Free Outdoor Flying Parachute Men, Best Small Outside Toys for 3 4 5 6 7 8 9 10 Year Old Top Christmas Stocking Stuffers Idea 2023 Unique Boy & Girl Gifts","https://m.media-amazon.com/images/I/81Wa--vlQhL._AC_UL320_.jpg","4.3","873","8.97","228"
"B0006MY7GK","SWIMLINE ORIGINAL Inflatable UFO Spaceship Pool Float Ride On With Fun Constant Flow Laser Ray Gun Water Squirter For Kids , Cool Retro Style, For Beach Ocean Pool Lake , Extra Thick Large Floatie","https://m.media-amazon.com/images/I/71B+TzDQXvL._AC_UL320_.jpg","3.8","4435","9.09","228"
"B091TJHWL9","HelloJoy Bean Bag Toss Game Kids Outdoor Toys,Double-Sided Foldable Cornhole Board Backyard Beach Yard Outdoor Toys for Toddler, Outside Lawn Party Activities Toy Gift for Boys Girls Age 3 4 5 6 7 8","https://m.media-amazon.com/images/I/81KO+wWctKS._AC_UL320_.jpg","4.4","1941","20.99","228"
"B07HQ2FG9T","Liberry Kids Exercise Hoop, Detachable & Size Adjustable Toy Hoop, Professional Hoola Rings for Kids, Blue,pink","https://m.media-amazon.com/images/I/51kcUpBdyLL._AC_UL320_.jpg","4.1","3666","12.99","228"
"B07MP36931","Victostar Bubble Machine, Automatic Bubble Machine for Kids with Bubbles Solutions (17 oz Total) Bubble Blowing for Outdoor Indoor","https://m.media-amazon.com/images/I/71RSc3pDCcL._AC_UL320_.jpg","4.1","1982","11.99","228"
"B0BNNCQ47T","Kid Odyssey Bubble Machine, Dog Bubble Blower with 4 fl oz Bubble Solution Refill, Non-Toxic Bubbles for Kids, Automatic Bubble Machine for Parties, Bubble Toys for Indoor Outdoor","https://m.media-amazon.com/images/I/71sDHEAgvyL._AC_UL320_.jpg","3.9","221","7.99","228"
"B09V1W1K91","4E's Novelty 4 Pack Beach Shovels 8 Inch, Heavy Duty Plastic Sand Shovel for Kids, - Great for Beach Toys for Kids 3-10, Planting Shovels for Toddlers, Outdoor Digging Sandbox Toys","https://m.media-amazon.com/images/I/615K37bGJYL._AC_UL320_.jpg","4.6","444","12.99","228"
"B0C2TXCVM7","Huge Wave Unicorn Rocket Launcher for Kids, Stomp Launch up Toys, Birthday Gifts for Girls Ages 2 3 4 5 6 7 8 Years Old, Outdoor Toys","https://m.media-amazon.com/images/I/71nCSV6DunL._AC_UL320_.jpg","4.2","41","24.99","228"
"B00DW1JT5G","Nerf N Strike Elite Strongarm Toy Blaster With Rotating Barrel (Amazon Exclusive)","https://m.media-amazon.com/images/I/618LQZjaFHL._AC_UL320_.jpg","4.6","29055","15.95","228"
"B0C1BK595K","Bennol Outdoor Toys Gifts for 3 4 5 6 Year Old Boys Kids, Dinosaur Outdoor Games Dart Board Toys for Kids Ages 3-5 6-8, Birthday for 3 4 5 6 Year Old Boys Kids","https://m.media-amazon.com/images/I/81MIJafQNrL._AC_UL320_.jpg","4.5","60","14.99","228"
"B08LGD7TMH","JOYIN Rocket Ship Play Tent Pop up Play Tent Kids Indoor Outdoor Spaceship Playhouse Tent Set","https://m.media-amazon.com/images/I/71OPJ5wb-nL._AC_UL320_.jpg","4.3","2203","29.99","228"
"B0B8TKM91Q","MindSprout Pogo Saurus | Foam Pogo Jumper for Kids 3, 4, 5, 6, 7, Years Old, Dinosaur Toys, Birthday for Boys or Girls up to 250Ibs, Pogo Stick, Indoor & Outdoor Toys","https://m.media-amazon.com/images/I/71oUXniNesL._AC_UL320_.jpg","4.2","798","15.99","228"
"B00BG417HY","Crayola MyFirst Jumbo Crayons - Assorted Colours (Pack of 24) | Easy-Grip Colouring Crayons Perfect for Toddlers Hands | Ideal for Kids Aged 12+ Months","https://m.media-amazon.com/images/I/71jNTSx6DPL._AC_UL320_.jpg","4.3","9368","15.41","228"
"B00DW1JT3I","Nerf Rampage N-Strike Elite Toy Blaster with 25 Dart Drum Slam Fire for Kids, Teens, & Adults (Amazon Exclusive)","https://m.media-amazon.com/images/I/71UXi6eLm-L._AC_UL320_.jpg","4.5","8581","36.0","228"
"B07GPGTP9S","Kids Tactical Vest Kit for Nerf Guns N-Strike Elite Series with Refill Darts Dart Pouch, Reload Clip Tactical Mask Wrist Band and Protective Glasses for kids Boys & girls","https://m.media-amazon.com/images/I/81t1OIJhgcL._AC_UL320_.jpg","4.6","19342","19.99","228"
"B0C3M9BGFR","Laser Tag Guns Set of 2 Laser Tag Guns with Digital LED Score Display Vests,Gifts for Teens and Adults, Family and Adults Fun,Birthday Gift Toys for Kids Ages 6 7 8 9 10 11 12+Year Old Boy & Girls","https://m.media-amazon.com/images/I/815oQxNWNGL._AC_UL320_.jpg","4.5","1129","35.99","228"
"B07H92CBM3","Jet Creations Inflatable Horse 38"" Long Great for Pool Party Decoration, Birthday Kids and Adult Stuffed Animals an-Horse, Multicolor","https://m.media-amazon.com/images/I/81kNz5TYlFL._AC_UL320_.jpg","4.3","1484","18.59","228"
"B09JHBQ8Y4","NERF Vortex Ultra Grip Football, Designed for Easy Catching, Howling Whistle Sound, Distance-Optimizing Tail, Water-Resistant, All-Weather Play","https://m.media-amazon.com/images/I/71C0fjB+XrL._AC_UL320_.jpg","4.4","1127","13.99","228"
"B07X5TCWTP","Swehouse Clubhouse Tent Kids Play Tents for Boys School Toys for Indoor and Outdoor Games Children Playhouse with Roll-up Door and Windows","https://m.media-amazon.com/images/I/81VyUJC1uzL._AC_UL320_.jpg","4.4","4548","29.99","228"
"B0BXLGVHBT","Toddler Basketball Hoop Indoor Mini Adjustable Poolside Basketball Goals with Ball Pump for Boys Girls Outdoor Toys for Backyard Games Outside Swimming Pool Basketball Toy for Kids Age 2-4 3-5 6","https://m.media-amazon.com/images/I/61ddnnTiRyL._AC_UL320_.jpg","3.9","280","39.59","228"
