"asin","title","imgUrl","stars","reviews","price","category_id"
"B09KMY2WPR","Fort-Building-Kit-for-Kids-130 Pcs -Glow in The Dark Kids Fort- Creative Fort Building Toys for 5,6,7 8,9,10 Years Old Boy & Girls- Kids Gifts Toys, STEM Toys Tunnels Play Tent Indoor & Outdoor","https://m.media-amazon.com/images/I/81TFIlXb9LL._AC_UL320_.jpg","4.4","773","52.99","228"
"B071KD1W2C","Flybar Pogo Trick Ball for Kids, Trick Bounce Board for Boys and Girls Ages 6+, Up to 160 lbs, Includes Pump, Easy to Carry Handle, Durable Plastic Deck Indoor, Outdoor Toy Pogo Jumper","https://m.media-amazon.com/images/I/81niBol1s7L._AC_UL320_.jpg","4.3","4893","24.99","228"
"B0C16NDR8S","【4 Pack】 Inflatable Swimming Pool Float for Adult, 4-in-1 Multi-Purpose Pool Hammock(Hammock,Saddle,Drifter,Lounge Chair),Summer Pool Chair,Portable Water Hammock Lounge","https://m.media-amazon.com/images/I/91e5FLWQ98L._AC_UL320_.jpg","4.4","533","19.99","228"
"B07C5F2TNG","Playz Ball Pit Balls 50 Count, Crush Proof Ball Pit Balls for Babies, Kids & Toddlers in 8 Bright Colors, Soft & Safe, Non Toxic Plastic Balls for Ball Pit, BPA Free Baby Toddler Pit Balls 2.1 Inch","https://m.media-amazon.com/images/I/81D8Ujg2BML._AC_UL320_.jpg","4.4","14572","18.99","228"
"B07MC3144W","Sunnyglade 2PCS Swings Seats Heavy Duty with 66"" Chain, Playground Swing Set Accessories Replacement with Snap Hooks, Support 250lb (Green)","https://m.media-amazon.com/images/I/61yFZjOpy4L._AC_UL320_.jpg","4.8","4693","39.99","228"
"B09B9STC31","LEMATRIX 2023 Flying Orb Ball Toy, Hover Ball Boomerang Fly Fidget Spinner, Cool Toys Gifts for 6 7 8 9 10 11 12+ Years Old boy Girls Teens, Hand Mini Drone Cosmic Globe, Indoor Outdoor Toys(Blue)","https://m.media-amazon.com/images/I/81yOsv2Uv5L._AC_UL320_.jpg","4.4","2322","32.0","228"
"B0BBLF94VW","UTEX 3 in 1 Pop Up Kids Play Tent with Tunnel and Ball Pit for Kids, Boys, Girls, Babies and Toddlers, Indoor/Outdoor Playhouse,Orange Pink/Light Green","https://m.media-amazon.com/images/I/71bl1IWgYZL._AC_UL320_.jpg","4.6","11553","34.95","228"
"B087P47WKG","2 Pack Toy Color Hoop for Kids, Size Adjustable & Detachable Length Kids Adjustable Hoop Plastic Toys for Kids Adults Party Games, Gymnastics, Dog Agility Equipment, Christmas Wreath","https://m.media-amazon.com/images/I/61L37cnn76L._AC_UL320_.jpg","4.0","1205","15.99","228"
"B09ZQ8Y948","Dart-Blasting Hammer Toys for Nerf Guns-Toys for 5 6 7 8+ Year Old Boys,Kids Roleplay Toy Thunder Mjolnir for with Lights, with 30 Darts","https://m.media-amazon.com/images/I/612UO8Q-uxL._AC_UL320_.jpg","4.6","486","29.98","228"
"B07XSFFJTB","T-Ball Set / Tee Ball - Toddlers and Kids Batting Tee Game with 10 Balls. Develops and Improves Baseball, Softball, Wiffle Ball Skills - Sports Toy for Boys & Girls, Children Ages 3-12","https://m.media-amazon.com/images/I/61Y9+vEbxDL._AC_UL320_.jpg","4.3","2872","19.99","228"
"B092M7VPQS","YAMIPROBI Ninja-Twister Swing Spins Set: Slackline Attachments - 360° Handle Twist-Spin Flips Toy Activate Ninja Powers - Ninja Warrior Accessories - Kids Ninja Hang Toys for Playground Backyard Blue","https://m.media-amazon.com/images/I/71myQ2CGa3L._AC_UL320_.jpg","4.6","762","21.85","228"
"B07XJ9ZRBQ","NERF Trick Shot Golf Set - Indoor & Outdoor Putting Trick Shot Kids Golf Set - Includes Putter, Balls, Ramp & Cups - All-in-One Golf Set for Kids","https://m.media-amazon.com/images/I/81Q8D0AqrBL._AC_UL320_.jpg","4.2","192","16.31","228"
"B087N8Q8QG","SpringFlower Shooting Game Toy for 5 6 7 8 9 10+ Years Olds Boys,2pk Foam Ball Popper Air Toy Guns with Standing Shooting Target,24 Foam Balls, Ideal Gift","https://m.media-amazon.com/images/I/71puJhifj1L._AC_UL320_.jpg","4.4","5195","39.99","228"
"B000PXP3DQ","Toysmith Get Outside GO! Pro-Ball Set, Pack of 3 (5-inch soccer ball,6.5-inch football and 5-inch basketball) (2709)","https://m.media-amazon.com/images/I/61K7y4gX7KL._AC_UL320_.jpg","4.7","4799","11.99","228"
"B0BS4C2YDX","X-Shot Insanity Bezerko by ZURU with 48 Darts, Air Pocket Technology Darts and Dart Storage, Outdoor Toy for Boys and Girls, Teens and Adults","https://m.media-amazon.com/images/I/91FsUueNomL._AC_UL320_.jpg","4.3","111","14.99","228"
"B0B1VWF3LJ","NERF Fortnite Dual Pack Includes 2 Blasters (Flint-Knock & LP) and 6 Elite Foam Darts","https://m.media-amazon.com/images/I/717Bcq9co6L._AC_UL320_.jpg","4.5","77","14.99","228"
"B0BXKR76KK","2 Pack Float Hammock,Pool Float Lounger,Water Swimming Floating Bed Hammock,Comfortable Inflatable Lounger, for Adults Vacation Fun and Rest","https://m.media-amazon.com/images/I/81T-Df9zkEL._AC_UL320_.jpg","4.3","611","18.88","228"
"B07G9TKB4W","Hide N Side 6ft Crawl Through Play Tunnel Toy, Pop up Tunnel for Kids Toddlers Dogs Babies Infants & Children Gift Indoor & Outdoor Action Toy Tunnel","https://m.media-amazon.com/images/I/71kVa7zgdbL._AC_UL320_.jpg","4.6","5756","19.95","228"
"B0713WSHLZ","Duncan Toys Reflex Auto Return Yo-Yo, Beginner String Trick Yo-Yo, Blue","https://m.media-amazon.com/images/I/91vFsPvdvxL._AC_UL320_.jpg","4.3","8031","9.38","228"
"B00AT6TYG6","INSCRAFT Bubble Wand, 90 Pack Mini Bubble Wands Bulk 15 Colors for Halloween, Summer Toys, Wedding, Outdoor Indoor Activity Use, Bubbles Party Favors, Gifts for Kids Toddlers","https://m.media-amazon.com/images/I/81bQOd+P8bL._AC_UL320_.jpg","4.4","1175","15.99","228"
"B07S2R1Q6J","Kids Telescopic Butterfly Fishing Nets for Kids Catching Insect Net Outdoor Tools for Catching Bugs Fish Insect Ladybird, Extendable 34 Inches and Anti Slip Grip","https://m.media-amazon.com/images/I/81kxlqLa+bL._AC_UL320_.jpg","4.4","369","8.99","228"
"B099FGV77J","Melissa & Doug Let's Explore Campfire S'Mores Play Set - Play Campfire Sets For Kids Ages 3+","https://m.media-amazon.com/images/I/71N4q8bQQ6L._AC_UL320_.jpg","4.8","1059","19.06","228"
"B09P41CBZD","Lamnhin 12'' Beach Ball for Kids - 14 Pack Beach Balls Bulk Inflatable Pool Beach Balls Bulk Hawaiian Tropical Theme Party Decorations Favors Supplies","https://m.media-amazon.com/images/I/51LocPnEHUL._AC_UL320_.jpg","4.3","459","10.98","228"
"B01897IK7A","Bunch O Balloons Pink (3 Bunches) by ZURU, 100+ Rapid-Filling Self-Sealing Pink Colored Instant Water Balloons for Outdoor Family, Friends, Children Summer Fun (3 Bunches, 100 Balloons)","https://m.media-amazon.com/images/I/71YdiKH+0+L._AC_UL320_.jpg","4.6","6825","7.65","228"
"B078SL8R2Q","GoSports Inflatable Dodgeball - No Sting Balls - Includes Ball Pump & Mesh Bag","https://m.media-amazon.com/images/I/91QXE3FWAiL._AC_UL320_.jpg","4.6","3525","22.95","228"
"B08NFCR1J1","NERF DinoSquad Rex-Rampage Motorized Dart Blaster, 10-Dart Clip, 20 Official Darts, 10-Dart Storage- T-Rex Dinosaur Design","https://m.media-amazon.com/images/I/71QDce-DldL._AC_UL320_.jpg","4.5","3182","25.49","228"
"B0009F4YR6","Step2 Naturally Playful Sand Table, Kids Sand Activity Sensory Table, 5 Piece Accessory Kit, Toddler Summer Outdoor Toys, 2+ Years Old","https://m.media-amazon.com/images/I/61CWySWvQ1L._AC_UL320_.jpg","4.7","4700","69.99","228"
"B08DXFCVK8","Spiderman Spider-Man Inflatable Bop Bag & Bop Gloves Set Kids Punching Bag with Gloves, Freestanding Superhero Blow Up Bouncing Boxing Bag for Exercise, Durable Heavy Duty Indoor and Outdoor - 34.5""","https://m.media-amazon.com/images/I/41iN685RdVL._AC_UL320_.jpg","3.9","2821","15.57","228"
"B0B6Z53GQR","Kroyedfuw Hover Soccer Ball Set with 2 Goals, Rechargeable Indoor Air Floating Soccer Ball with LED Light and Foam Bumper, Perfect Birthday Xmas Gifts for Age 3 4 5 6 7 8-12 Year Old Kids Boys Girls","https://m.media-amazon.com/images/I/81y00PqbjkL._AC_UL320_.jpg","4.2","366","19.99","228"
"B086KZHKC2","Kids Basketball Hoop Adjustable Height 2.9 ft-6.2 ft Toddler Basketball Hoop for Kids Indoor Outdoor Play Mini Portable Kids Basket Ball Goal Backyard Outside Toys for Boys Girls Age 3 4 5 6 7 8 Gift","https://m.media-amazon.com/images/I/61l5q-sO73L._AC_UL320_.jpg","4.2","3517","41.99","228"
"B06W5WP5KL","Intex, 43234-2327 3 Pack 59220EP - Animal Head Split Ring Pool Floats Bundle Includes Frog, Duck, Penguin, Giraffe, Frog, Penguin","https://m.media-amazon.com/images/I/51pedUdwHtL._AC_UL320_.jpg","4.5","3053","9.97","228"
"B08KDKKFSX","Mint's Colorful Life Delta Kite for Kids & Adults, Extremely Easy to Fly Kite, Best Kite for Beginner","https://m.media-amazon.com/images/I/51vBrPG5iML._AC_UL320_.jpg","4.5","4984","15.99","228"
"B09V5RBQ2Z","PLAYBEA40 Inch Tree Swing Saucer - 800Lb Weight Capacity, 900D Oxford Waterproof, With Hanging Straps Swings for Kids Outdoor For Tire Adults Disc, Multicolor","https://m.media-amazon.com/images/I/71+c6nxYPWL._AC_UL320_.jpg","4.7","1787","44.99","228"
"B0C4SM5YT1","HopeRock Indoor Mini Basketball Hoop for Kids, Basketball Hoops Over The Door with LED Lighting, Mini Hoop with Scoreboard & 3 Balls, Basketball Toys Gifts for 5 6 7 8 9 10 11 12 Year Old Boys Girls","https://m.media-amazon.com/images/I/81Wk3ShmcTL._AC_UL320_.jpg","4.5","60","39.99","228"
"B0C946BBSW","3 Pack Upgrated XL Water Pool Floats, 4-in-1 (Hammock, Saddle, Lounge Chair, Drifter) Multi-Purpose Water Pool Float, Non-Stick PVC Material","https://m.media-amazon.com/images/I/814HmKfSyTL._AC_UL320_.jpg","4.1","295","15.99","228"
"B0B151NLB5","Jishi Retro Magic Rail Twirler 3Pcs Light Up Glow Magnetic Gyro Wheel, Kids Classic Vintage Trick Yoyo Sensory Fidget Toys, Cool Unique Nostalgia Gifts Fun Stocking Stuffers for 3+ Year Old Boys Girls","https://m.media-amazon.com/images/I/711HL0TOOkL._AC_UL320_.jpg","3.7","405","12.74","228"
"B08NF8VB5Q","NERF Elite 2.0 Echo CS-10 Blaster - 24 Official Darts, 10-Dart Clip, Removable Stock and Barrel Extension, 5 Tactical Rails","https://m.media-amazon.com/images/I/713WOlS1c+L._AC_UL320_.jpg","4.5","3293","33.99","228"
"B09TXGP4JQ","JANNIRESS Electric Gel Ball Blaster Toy,Eco-Friendly Splatter Ball Blaster Automatic, with 60000+ Water Beads and Goggles, for Outdoor Activities - Team Game, Ages 12+,Green, unisex-children","https://m.media-amazon.com/images/I/81702Mwjw0L._AC_UL320_.jpg","4.5","2434","19.99","228"
"B0BQSH412F","Bluey Vehicle and Figure Pack Bingo's Helicopter with 2.5 Inch Bingo Figure and Tool Accessories","https://m.media-amazon.com/images/I/61x5yWVcKJL._AC_UL320_.jpg","4.9","54","12.99","228"
"B08M38NJXN","WillingHeart Rocket Ship Play Tent for Kids, Astronaut Spaceship Space Themed Pretend Playhouse Indoor Outdoor Games Party Children Pop Up Foldable Tent Birthday Toy for Boys Girls Toddler Baby","https://m.media-amazon.com/images/I/71ctVc+Yu2L._AC_UL320_.jpg","4.5","2189","29.99","228"
"B00AY2KDS8","Intex King Kool Lounge Swimming Pool Lounger with Headrest - Set of 2 (Pair)","https://m.media-amazon.com/images/I/61px4eTpBHL._AC_UL320_.jpg","4.5","7347","21.99","228"
"B00LMJBPCK","JustForKids Kids Garden Tool Set Toy, Rake, Spade, Hoe and Leaf Rake, reduced size , made of sturdy steel heads and real wood handle, 4-Piece, Multicolored, 5yr+","https://m.media-amazon.com/images/I/71wjNay-uBL._AC_UL320_.jpg","4.8","15166","21.77","228"
"B0B4WFHDW9","SOPPYCID Reusable Water Bomb Balloons, Latex-Free Silicone Water Splash Ball with Mesh Bag, Self-Sealing Water Bomb for Kids Adults Outdoor Activities Water Games Toy Summer Fun Party Supplies (16Pcs)","https://m.media-amazon.com/images/I/81wPCYrDKiL._AC_UL320_.jpg","4.7","3999","32.99","228"
"B0BBRGJTD7","Rocket Launcher for Kids, Self-Launching Motorized Air Rocket Toy, Outdoor Toys for Ages 8-12, Model Rockets with Parachute Safely Land, Launch up to 200 ft Birthday Gifts for Boys","https://m.media-amazon.com/images/I/71Xco2Sl6bL._AC_UL320_.jpg","4.6","158","35.99","228"
"B0016P4ARW","Champion Sports Rhino Playground Balls 8.5"" D - Two Ply, Nylon Wound, RED","https://m.media-amazon.com/images/I/91aDd44oo6L._AC_UL320_.jpg","4.4","694","7.64","228"
"B09R1XFNZ6","Shooting Games Toys for Age 5-6 7 8 9 10 + Year Old Boys, Kids Toy Sports & Outdoor Game with Moving Shooting Target & 2 Popper Air Toy Guns & 24 Foam Balls, Gifts for Boys and Girls","https://m.media-amazon.com/images/I/71Rkk7mtTEL._AC_UL320_.jpg","4.1","549","49.99","228"
"B00BWB61C2","INTEX Sit 'n Float Classic Inflatable Raft Swimming Pool Lounge - (Set of 2)(Colors May Vary)","https://m.media-amazon.com/images/I/6174msZ+oKL._AC_UL320_.jpg","4.3","2076","18.76","228"
"B01DKKHRZM","AMOSTING 100PCS Refill Darts for Nerf N Strike Elite 2.0 Series Glow in The Dark Bullets Pack – Compatible with All Elite Blasters White","https://m.media-amazon.com/images/I/618HhDB84AL._AC_UL320_.jpg","4.6","3116","9.99","228"
"B089GVL3HT","Duckura Bubble Leaf Blower for Toddlers, Kids Bubble Blower Machine with 3 Bubble Solution, Summer Outdoor Toys, Halloween Party Favors Birthday Gifts Toys for Boys Girls Age 2 3 4 5+ Year Old","https://m.media-amazon.com/images/I/711gT5rZH7L._AC_UL320_.jpg","4.4","2904","26.99","228"
"B085KVP2G4","Hover Soccer Ball Toys, Indoor Floating Rechargeable Soccer with Colorful LED Light and Soft Foam Bumper, Upgrade Air Training Soccer Ball for 3 4 5 6 7 8-16 Years Old Boys Girls Adults","https://m.media-amazon.com/images/I/71j9NqU+d5L._AC_UL320_.jpg","4.3","1450","13.99","228"
"B007GQ0YKC","Eezy Peezy Monkey Bars Climbing Tower - Active Indoor/Outdoor Fun for Kids Jungle Gym Ages 3 to 8 Years Old","https://m.media-amazon.com/images/I/71eUau89I9L._AC_UL320_.jpg","4.4","5969","127.99","228"
"B01K15UQ4I","Monobeach Baby Beach Tent Pop Up Portable Shade Pool UV Protection Sun Shelter for Infant","https://m.media-amazon.com/images/I/6103YlWQqoS._AC_UL320_.jpg","4.4","4161","32.27","228"
"B07P7F7XH6","Coogam Inflatable Beach Ball Classic Rainbow Color Birthday Pool Party Favors Summer Water Toy Fun Play Beachball Game for Kid Boys Girls 8 to 12 Inches from Inflated to Deflated (10 PCS)","https://m.media-amazon.com/images/I/61866+YHZXL._AC_UL320_.jpg","4.3","3019","9.99","228"
"B0C7R6GTK6","48 Pcs Halloween Bubble Wands Mini Pumkin Bubble Toys Bulk for Kids Halloween Party Favor,Outdoor Indoor Activity Use, (Halloween)","https://m.media-amazon.com/images/I/7152f7FZjSL._AC_UL320_.jpg","4.6","17","11.99","228"
"B07BMHXH6W","4 Big Bubble Wands: Making Giant Bubbles. Great Birthday Activity and Party Favor. Giant Bubble Solution Not Included.","https://m.media-amazon.com/images/I/81k-eOg1z0L._AC_UL320_.jpg","4.4","3200","15.95","228"
"B0B4SGMFW4","Bubble Machine Gun,69 Holes Bubbles Gun Kids Toys for Boys Girls Age 3 4 5 6 7 8 9 10 11 12 Year Old,Christmas Birthday Wedding Party Favors Gifts","https://m.media-amazon.com/images/I/71mnl-pIyJL._AC_UL320_.jpg","4.4","2375","35.99","228"
"B08P2BX9DJ","NERF Weather Blitz Foam Football, All Weather Play, Water-Resistant, Easy to Hold Grips, Indoor & Outdoor Sports Toys for 5 Year Old Kids","https://m.media-amazon.com/images/I/819-4WWQzXL._AC_UL320_.jpg","4.7","1185","13.99","228"
"B0CB3WZZS9","Halloween Treats Non Candy,Goodie Bag Stuffer Fillers for Kids,Mini Party Bubble Wands 32 Pack,Halloween Birthday Pinata Party Favors Supplies,Classroom Treasure Box Toys Gifts Prizes for Boys & Girls","https://m.media-amazon.com/images/I/719qtobSglL._AC_UL320_.jpg","4.6","22","9.89","228"
"B00BXIKO54","Jet Creations Inflatable Alligator, 49"" Realistic Alligator Float for Pool, Vinyl Inflatable for Garden Pool Halloween Decoration, Safari Theme Birthday Decoration, Bird Deterrent","https://m.media-amazon.com/images/I/71Qw3NSseiL._AC_UL320_.jpg","4.2","2042","16.62","228"
"B08729DS4K","EagleStone Dinosaur Shooting Toys for Boys Girls, Kids Target Shooting Games w/ Air Pump Gun Birthday Party Supplies & LCD Score Record, Sound, 24 Foam Balls, Electronic Target Gift for Toddlers","https://m.media-amazon.com/images/I/515XOumu86L._AC_UL320_.jpg","4.5","4172","35.99","228"
"B07H9DTPJ7","ArtCreativity Halloween Bubble Wand, 14"" Illuminating Bubble Wand for Kids, Halloween Light up Pumpkin Bubble Blower Wand with Thrilling LED & Sound Effect, Halloween Toys for Kids","https://m.media-amazon.com/images/I/81QukrSZw3L._AC_UL320_.jpg","4.5","446","13.99","228"
"B0BRCX5X25","BALLFUN Dodgeballs Playground Balls, Dodge Ball Set for Kids & Adults, Bouncing Kickballs Handball for Outdoor & Indoor Games - Includes Pump & Mesh Storage Bag","https://m.media-amazon.com/images/I/71-ir15-rNL._AC_UL320_.jpg","4.5","214","22.99","228"
"B01BGHMXIW","Mini Foam Footballs 12 Pcs Pack | 3.25” Inch Party Favor Balls for Kids | Mini Football Stress Ball Bulk | Toy Sports Little Footballs | Big Game Party Decoration Balls | Small Foam Football for Kids","https://m.media-amazon.com/images/I/81A21kKQcNL._AC_UL320_.jpg","4.7","3666","10.99","228"
"B08QLRTLKM","BANZAI Dive Mermaids 4pc Colors May Vary","https://m.media-amazon.com/images/I/91IE13P8CVL._AC_UL320_.jpg","4.6","2858","8.99","228"
"B09SGMBVNC","NLFGUW Electric Gel Ball Blaster Toys,Eco-Friendly Splatter Ball Blaster with 60000+ Water Beads,Automatic Outdoor Toys for Activities Team Game,for Adults and Kids Ages 12+(Blue)","https://m.media-amazon.com/images/I/81J+-VEInCL._AC_UL320_.jpg","4.4","3473","21.99","228"
"B01IQAMN4G","(300 Pack) Ray Squad Blue Nerf Darts, Nerf Darts Bulk - Nerf Bullet, Nerf Elite 2.0 Foam Darts, Nerf Ammo Bullets, Nerf Refill Darts, Nerf Bullets","https://m.media-amazon.com/images/I/817HphkOdHL._AC_UL320_.jpg","4.8","6047","13.99","228"
"B01926896Y","Fubbles Bubbles No-Spill Bubble Tumbler for Babies Toddlers and Kids | Includes 6oz Bubble Solution and Bubble Wand (Tumbler Colors May Vary)","https://m.media-amazon.com/images/I/81wP0a-UKFL._AC_UL320_.jpg","4.6","3996","33.18","228"
"B07XDLXHHT","Island Genius Inflatable Football Toss Target Party Game, Sports Toys Gear and Gifts for Kids Boys Girls and Family","https://m.media-amazon.com/images/I/81+BRA+MuBL._AC_UL320_.jpg","4.2","2453","24.99","228"
"B083B296BC","Sunny Days Entertainment Scooby Doo Mystery Machine Tent – Kids Pop Up Play Tent | Scooby Doo Toy","https://m.media-amazon.com/images/I/71ItBGBTCuL._AC_UL320_.jpg","4.5","4224","19.99","228"
"B00SEYOWIA","Intex, 43227-2120 Pack of 3: 30"" Transparent Tubes, Colors May Vary, Multi","https://m.media-amazon.com/images/I/61O7atnoyxL._AC_UL320_.jpg","4.2","3878","9.87","228"
"B0B82DRVFN","DX DA XIN Dinosaur LED Headlamp T-Rex for Kids Flashlights Camping Gear - Dinosaur Toys for Boys Girls Toddlers Outdoor Toys for Kids Birthday Christmas Gifts Stocking Stuffers","https://m.media-amazon.com/images/I/71BcOQmd9fL._AC_UL320_.jpg","4.6","308","19.99","228"
"B09NLK167V","Inscraft 40 Pack 14’’ Big Bubble Wands, 8 Colors Bubbles Bulk for Summer Toy, Outdoor / Indoor Activity Use, Easter, Birthday, Graduation, Shower, Bubbles Party Favors Supplies for Kids Toddlers","https://m.media-amazon.com/images/I/81YunUsIFDL._AC_UL320_.jpg","4.6","129","28.99","228"
"B00C1U0430","Intex Inflatable 36"" Giant Tire Tubes for Swimming Pool/Lake/Ocean (4 Pack)","https://m.media-amazon.com/images/I/71NMqQdoZlL._AC_UL320_.jpg","4.4","2574","19.97","228"
"B0BXZ3C822","GoSports Tot Shot Modern Kids Basketball Set - Indoor & Outdoor Toy Hoop for Toddlers","https://m.media-amazon.com/images/I/71Sohh7jFOL._AC_UL320_.jpg","4.8","66","39.99","228"
"B071G6B3Q1","PGXT Parachute Toy, Tangle Free Throwing Toy Parachute, Outdoor Children's Flying Toys, No Battery nor Assembly Required (4 Pieces Set) (A)","https://m.media-amazon.com/images/I/718ijJHnW2L._AC_UL320_.jpg","4.4","7323","8.99","228"
"B0BY2HR8SQ","Bubble Party Favors for Kid, 30 Pack Mini Bubbles Bulk with Display Box, Pastel Bubble Wand Sticks Toy for Party Supplies, Birthday, Wedding Decorations, Goody Bag Fillers Stuffers, Carnival Prizes","https://m.media-amazon.com/images/I/71nnhANbIeL._AC_UL320_.jpg","4.3","43","9.98","228"
"B08H1KJV9V","COOP Hydro Waterproof Football, 9.25 Inches","https://m.media-amazon.com/images/I/81dcqjYkPYL._AC_UL320_.jpg","4.6","1702","11.52","228"
"B07XH4Y3F7","WowWee Baby Shark Official - Singing Bath Time Bubble Maker","https://m.media-amazon.com/images/I/61uBS7gXblL._AC_UL320_.jpg","4.0","2634","19.99","228"
"B075FRM4QN","Pangda 2 Pack Inflatable Globe Blow up World Globe Beach Ball Globe for Party Bags, PVC Material","https://m.media-amazon.com/images/I/81K9aoR-ZBL._AC_UL320_.jpg","4.2","1467","6.99","228"
"B00004WCI0","The Big Dig Sandbox Digger Excavator Crane with 360 Degree Rotation with Base Great for Sand, Dirt and Snow, Steel Outdoor Play Toy, Yellow","https://m.media-amazon.com/images/I/6128Yv6vXAL._AC_UL320_.jpg","4.7","8681","44.99","228"
"B0B1CRNPFJ","Pop and Catch Ball Game with 10 Balls and 4 Catch Launcher Baskets - Outdoor Indoor Game Activities for Boys & Girls, Halloween Beach Yard Sport Toy for Kids Age 5 6 7 8 9 10 11 12+","https://m.media-amazon.com/images/I/71sujw2FX0L._AC_UL320_.jpg","4.4","466","14.39","228"
"B07HZ6SJP5","ToyVelt TBall Set for Toddlers 9 Balls - Kids Baseball Tee Game","https://m.media-amazon.com/images/I/61fKF1wHaDL._AC_UL320_.jpg","4.4","5520","23.29","228"
"B072L6MNX1","Kidzlane Bubble Maker Machine for Kids - Big Bubbles Speed Blower for Toddler's Outdoor Party Play - Makes 500 to 1000 per Minute (Bubble Dolphin)","https://m.media-amazon.com/images/I/81pAZE7qBnL._AC_UL320_.jpg","4.3","11618","26.99","228"
"B01MUG97H4","6 Pack: Toy Hoop Bundle Pack - Snap Together Detachable Adjustable Weight Size Plastic Hoops - Kids Hula Rings for Sports, Exercise, Playing, 32-Inch","https://m.media-amazon.com/images/I/713HDeHJarL._AC_UL320_.jpg","4.0","1007","29.95","228"
"B078QDRZ39","2 Little Tikes EasyScore Mini Basketballs, Toddler & Kids, Set of 2","https://m.media-amazon.com/images/I/71bmZpl8TbL._AC_UL320_.jpg","4.5","3534","11.99","228"
"B08CVTDRTB","Scientoy Flower Garden Building Toys, Girl Toys Build a Garden, 130 PCS Flower Pretend Gardening Gift for Kids, Floral Arrangement Playset for Age 3-7 Year Old Child Educational Activity","https://m.media-amazon.com/images/I/71T+S9xh5iL._AC_UL320_.jpg","4.7","2224","32.99","228"
"B0BNTZCWTV","Woplagyreat Summer Pool Diving Swimming Toys for Kids, Fun Swim Games Sinking Set, Underwater Dive Gifts with Storage Bag Include Torpedo Gems Shark Rings Sea Animals for Boys Girls Toddlers 20 Packs","https://m.media-amazon.com/images/I/71jtpLDNTVL._AC_UL320_.jpg","4.5","514","13.99","228"
"B0B49HTJMZ","HBTower Trampoline Ladder, 3-Step Trampoline Steps with Horizontal Wide Steps, Skid-Proof Steps Universal Hook, UV Treated Steel, 220Lbs Capacity Trampoline Stairs Accessories for Kids/Children","https://m.media-amazon.com/images/I/618VypbPCnL._AC_UL320_.jpg","4.7","1324","29.99","228"
"B0B7K8DZKZ","80 Pack Halloween Bubble Wands,Mini Bubble Wands for Halloween Party Favors,Hlalloween Toys Gift for Girls Boys Kids Toddler Adults","https://m.media-amazon.com/images/I/81kKliVTo5L._AC_UL320_.jpg","4.8","60","17.98","228"
"B08LGBH3BD","Princess Tent for Kids, Ball Pits for Toddlers 1-3 with Star Light, Girl Toys, 1/2/3 Year Old Girl Gifts, Toys for Girls with Carrying Bag, Indoor & Outdoor Play Tent, 49'' X 33'' (DxH)","https://m.media-amazon.com/images/I/71xqqyxGdRL._AC_UL320_.jpg","4.6","2363","26.77","228"
"B07MVNSQNN","Kiddey Fire Truck Tent for Kids | Firetruck Play Tents with Sirens and Fireman Sound Button for Girls, Boys, & Toddlers Gifts | Red Fire Engine Pop Up Playhouse | Indoor & Outdoor Baby Tent","https://m.media-amazon.com/images/I/719Ms33C+RL._AC_UL320_.jpg","4.5","3599","39.98","228"
"B09FNBWM2C","SplatRball SRB1200 Full Auto Rechargeable Battery Powered Water Bead Gel Ball Blaster Kit. Splatter Ball Gun.Electric Water Blaster able to Shoot 11 Rounds per Second!","https://m.media-amazon.com/images/I/61iWaxm5V4L._AC_UL320_.jpg","4.6","3194","58.0","228"
"B0BGNZM875","Meland Kids Basketball Hoop - Adjustable Height 2.9ft-6.2ft Toddler Basketball Hoop for Kids, Kids Basketball Goal Indoor & Outdoor Toys Backyard Outside Toys for Boys Age 3 4 5 6 7 8 Years Gift","https://m.media-amazon.com/images/I/71bQBSnHk2L._AC_UL320_.jpg","4.0","896","31.99","228"
"B0CBR3JGXY","Pop Up Princess Tent with Star Lights, Toys for 1 2 3 Year Old Girl Birthday Gifts, Ball Pit for Babies 12-18 Months, Foldable Kids Play Tent for Toddler 1-3, One Year Old Girl Toys Indoor & Outdoor","https://m.media-amazon.com/images/I/71DACnD8cuL._AC_UL320_.jpg","4.1","26","20.99","228"
"B09FG9T8ZX","SpringFlower Gifts Toys for Girls 3 4 5 6 7 Years Old, Flower Garden Building Kit with Storage case,Educational STEM Toy and Preschool Garden Play Set for Toddlers, 148pcs","https://m.media-amazon.com/images/I/81KEZQmSn9L._AC_UL320_.jpg","4.7","1116","39.99","228"
"B0BVZ463D2","Bath Toys - Bath Basketball Hoop for Kids - Bathtub Basketball Hoop for Toddlers,Fun Bath Toys Shower Toys for Kids Ages 4-8,Suction Cup Basketball Hoop & 4 Soft Balls Set for Boys Girls","https://m.media-amazon.com/images/I/716rsNzXMeL._AC_UL320_.jpg","4.2","97","7.98","228"
"B0B1Q49XW3","ShyLizard Punching Bag for Kids Included 2 Pack Boxing Gloves, Boxing Toys for Boys, Boxing Bag Sets with Height Adjustable Stand, Gifts for Boys & Girls Age 5,6,7,8,9,10 Years Old","https://m.media-amazon.com/images/I/71kc8-nJyRL._AC_UL320_.jpg","4.3","329","30.99","228"
"B0B68RRHYL","Tiny Land Teepee Tent for Kids Tent Indoor, Canvas Toddler Tent - Kids Teepee Tent for Girls & Boys, Washable Tipi Tent Kids Boho Tent - Fodable Kids Play Tent","https://m.media-amazon.com/images/I/71WHMaXXHaL._AC_UL320_.jpg","4.7","1286","45.99","228"
"B08CJL7DN7","ArtCreativity Ranger Hand-Gun Toy Set with Flashing Lights & Sounds, 2 Cool Futuristic Handguns, Pretend Play Toy Gun, Great Party Favor, Gift for Boys and Girls, Batteries Included- Colors May Vary","https://m.media-amazon.com/images/I/61weiL7aKnS._AC_UL320_.jpg","4.5","1966","13.97","228"
"B08LKV2BB6","YIDESTARS Play Construction Sand Kit,2.2lbs Magic Sand W/4 Large Take Apart Construction Trucks,1 Sandbox,8 Worker Figures and Road Signs,8 Molds,Toys for 2-8 Years Old Boys Girls","https://m.media-amazon.com/images/I/818ox8qQXAL._AC_UL320_.jpg","4.6","743","26.99","228"
