"asin","title","imgUrl","stars","reviews","price","category_id"
"B0B5QCG93T","TIZIKCON Reusable Water Balloons, Latex-Free Silicone Water Bomb Summer Fun Outdoor Toys, Pool Beach Toys for Kids Adults, Quick Fill Self-Sealing Water Splash Balls Party Supplies(6PCS）","https://m.media-amazon.com/images/I/7115wiG6cUL._AC_UL320_.jpg","4.7","612","13.99","228"
"B01BW2CRDM","GiftExpress 1 Dozen 4"" Foam Mini Football Stress Balls, Mini Sport Balls, Superbowl Decoration Party Favor, Football Themed Party Supplies and Giveaways (Football)","https://m.media-amazon.com/images/I/714zWcuwt6L._AC_UL320_.jpg","4.6","862","12.99","228"
"B0C6CRF3SN","Kids Basketball Hoop with Stand, Adjustable Basketball Set Height 3.5ft-6.2ft, Toddler Basketball Toys for Boys Age 3 4 5 6 7 8, Mini Portable Basketball Goals for Indoor Outdoor Backyard Sport Game","https://m.media-amazon.com/images/I/71pc-r57UQL._AC_UL320_.jpg","4.0","43","39.99","228"
"B092D61FTY","IJO 4 Pack LED Light Airplane Toys-17.5"" Large Throwing Foam Plane-2 Flight Modes Glider Plane-Outdoor Flying Toys for Kids-Flying Toys Gift for Boys Girls 3 4 5 6 7 8 9 Years Old","https://m.media-amazon.com/images/I/91ZbMzP3ioS._AC_UL320_.jpg","4.6","892","19.99","228"
"B0BR57LB1B","Bubble Wand for Kids, Princess Heart Bubble Machine Blower Maker Wands with Light, Easter Basket Stuffers Outdoor Toys Gifts for 1 2 3 4 5 6 7 8 Years Old Toddlers Little Girls Include Bubble Solution","https://m.media-amazon.com/images/I/71URY1N9aNL._AC_UL320_.jpg","4.1","180","17.99","228"
"B09P1VZMQ3","Spidey and His Amazing Friends Marvel Spidey Water Web Glove, Fun Kids Halloween Costume Add-On, Preschool Water Toy with Green Goblin Target, 3+","https://m.media-amazon.com/images/I/61hiijzgDRL._AC_UL320_.jpg","4.2","398","10.99","228"
"B001DNHYC0","Crazy Forts! 69 Piece Buildable Indoor/Outdoor Play Fort Playset, DIY, Build Your Own, STEM Toy","https://m.media-amazon.com/images/I/616vYV0aojL._AC_UL320_.jpg","4.4","11085","34.97","228"
"B0BJ6CTN52","Duncan Toys First Yo! The Ultimate Beginner Yo-Yo for Kids - Purple/Yellow","https://m.media-amazon.com/images/I/91bGhcYbXCL._AC_UL320_.jpg","4.3","208","8.99","228"
"B094R3FHNW","GeerWest 3PC Princess Tent for Girls with Kids Ball Pit and Crawl Tunnel for Toddlers, Pink Pop Up Playhouse Toys Indoor& Outdoor for Birthday Gifts","https://m.media-amazon.com/images/I/81k2NJ6OBCS._AC_UL320_.jpg","4.5","1525","39.99","228"
"B0BQ2QFGDT","5Pcs Non-Slip Plastic Balance Stepping Stones for kids,up to 220 Ibs for PomotingChildren's Coordination Skills Obstacle Courses Sensory Toys for Toddlers,Indoor or Outdoor Play","https://m.media-amazon.com/images/I/61J4suWHkrL._AC_UL320_.jpg","4.6","146","36.99","228"
"B08HPMZW9X","MODEREVE 100 Pack Balls for Ball Tent, BPA Free Colorful Plastic Balls Baby Play Balls for Ball Pit, Bounce House, Baby Pool & Playhouse","https://m.media-amazon.com/images/I/71UzCFmQYeL._AC_UL320_.jpg","4.2","1099","18.99","228"
"B015JGPJNM","Kiddey Play Tunnel for Kids | Crawl Tunnels with See Through Sides | Outdoor & Indoor Multicolored Tent for Dogs, Toddlers, and Babies | Pop Up Baby Crawling Backyard Tunnel | Balls NOT Included","https://m.media-amazon.com/images/I/81nwWds-qyL._AC_UL320_.jpg","4.6","1493","17.98","228"
"B00C2P6VWW","Little Tikes Activity Garden Playhouse for Babies, Infants and Toddlers - Easy Set Up Indoor Toys with Playtime Activities, Sounds, Games for Boys Girls Ages 6 Months to 3 Years","https://m.media-amazon.com/images/I/71UuqVNBi0L._AC_UL320_.jpg","4.6","10252","91.12","228"
"B0928LBM8C","AppleRound 8.5 Inch Playground Ball with Air Pump, Pack of 1 Ball with 1 Pump, Official Size for Dodge Ball, Handball, Camps and Schools","https://m.media-amazon.com/images/I/813ND6wxPkL._AC_UL320_.jpg","4.5","622","7.9","228"
"B07RTJDTBX","NINOSTAR Large Play Balls Set - Fun Indoor and Outdoor Gift - Can Use for Play/Room Decor/Party Decor/Pool Inflatable Water Toys","https://m.media-amazon.com/images/I/71zDN6KvaWL._AC_UL320_.jpg","4.5","2574","17.55","228"
"B00STL38RE","Spikeball The Original Spikeball Kit 1-Ball - Spikeball Game Set - Outdoor Sports & Outdoor Family Games - Includes 1 Ball, 1 Ball Net, Drawstring Bag & Rulebook - Spikeball Set for Lawn & Yard Games","https://m.media-amazon.com/images/I/818eR412++L._AC_UL320_.jpg","4.7","6364","63.99","228"
"B08FJ9WSYS","TOY Life Kids Cornhole Set Bean Bags Toss Outdoor Games for Kids Outdoor Toys for Kids 4-8 8-12 Bean Bag Toss Kids Games Outside Toys for Kids Backyard Games with Bean Bag Toss Kids Games Ages 4-8","https://m.media-amazon.com/images/I/71RogotweOL._AC_UL320_.jpg","4.3","1478","26.97","228"
"B08H5QRGNP","SwimWays Spring Float Papasan Pool Lounger for Swimming Pool, Inflatable Pool Floats Adult with Fast Inflation for Ages 15 & Up, Blue","https://m.media-amazon.com/images/I/91m9OzIwixL._AC_UL320_.jpg","4.6","3135","19.98","228"
"B0BVZFT4CL","SCIONE 36pack Football Party Favors for Kids 4-8 8-12 Football Sports Fidget Spinner Goodie Bag Stuffers Treasure Box Toys for Classroom Prizes Return Gifts for Kids Birthday Party Favors","https://m.media-amazon.com/images/I/51T2lSyxRaL._AC_UL320_.jpg","4.3","63","16.99","228"
"B0B2Z9KWDT","Nerf Elite Junior Ultimate Starter Set, 2 Easy Play Blasters, 15 Darts for Kids Outdoor Games, Ages 6 & Up","https://m.media-amazon.com/images/I/71ukXBfKc3L._AC_UL320_.jpg","4.5","76","16.99","228"
"B0BY29WRGR","【4 Pack】 Inflatable Pool Floats Hammock, Water Hammock Lounges, Multi-Purpose Swimming Pool Accessories(Saddle, Lounge Chair, Hammock, Drifter) Suitable for Swimming Pool, Beach, Outdoor","https://m.media-amazon.com/images/I/81gUjtxHV3L._AC_UL320_.jpg","4.4","157","25.99","228"
"B0C2CXZYPL","Toys for 3-8 Year Old Girls: LET'S GO! Waterproof Binoculars for Kids Bird Watching 4 5 6 7 8 Year Old Girl Boy Birthday Gifts Outdoor Learning Toy for Kid Ages 4-8 Toddler Gift Stocking Stuffers","https://m.media-amazon.com/images/I/71SKZeCIrVL._AC_UL320_.jpg","4.3","51","8.99","228"
"B000197NXM","Gazillion Bubbles Hurricane Machine, Colors May Vary","https://m.media-amazon.com/images/I/71IRzUppN7L._AC_UL320_.jpg","4.0","8166","12.66","228"
"B07NSPX66B","BATTOP Bubble Machine for Kids and Toddlers Automatic Bubble Maker Blower with Bubbles Solutions for Parties Outdoor Indoor Age 3+","https://m.media-amazon.com/images/I/71wLVmst2BL._AC_UL320_.jpg","4.2","1432","11.99","228"
"B0BYJDTBN5","Zerhunt Bubbles for Kids Toddlers 1-3: 33.8OZ Bubble Concentrate Solution for Bubble Machine| Bubble Solution Refill for Giant Bubble Wand, Bubble Gun Blower, Birthday Party Favors Wedding(Blue)","https://m.media-amazon.com/images/I/71M+xM7n-KL._AC_UL320_.jpg","4.6","139","12.99","228"
"B0CBK69ZZ6","Neoot Toy Airplane, 3 Pack Airplane Launcher Toys 2 Flight Mode Glider Plane Outdoor Toys for Kids Ages 3 4 5 6 7 8 9 10 11 12 Year Old Boys & Girls Birthday Gift, Educational Flying Kids Toys","https://m.media-amazon.com/images/I/715XZbCCnuL._AC_UL320_.jpg","4.9","33","19.99","228"
"B00004YRPF","Flybar Maverick Pogo Stick for Kids Ages 5+, 40 to 80 Pounds, Perfect for Beginners, Easy Grip Handles, Anti-Slip Pegs, Outdoor Toys for Boys, Jumper Toys for Girls, Outside Toys for Kids","https://m.media-amazon.com/images/I/41Fo2kIk+NL._AC_UL320_.jpg","4.4","5369","27.27","228"
"B09YDF8RGP","REZUCREY Beach Toys, Ice Cream Sand Toys for Toddlers, with Collapsible Bucket and Shovels for Kids with Bag, Travel Toys for Boys Baby Girls Age 3 4 5 6 7 8+","https://m.media-amazon.com/images/I/81f+GycCVML._AC_UL320_.jpg","4.7","439","15.99","228"
"B076MB1N4P","Nerf Zipfire 2 Pack Combat Blaster","https://m.media-amazon.com/images/I/71zahlQtn0L._AC_UL320_.jpg","4.4","1639","18.01","228"
"B01EG7LV50","Intex, 43234-2336 59574EP My Baby Float, Yellow","https://m.media-amazon.com/images/I/51iwL6tQl9L._AC_UL320_.jpg","4.4","467","5.37","228"
"B0031D0JZE","Little Tikes Bouncing Fun! Red Hopper 9301A - Mega 18"" Inflatable Heavy Gauge Durable Vinyl Ball - Deflates Easily for Storage - Exercise Learning Fun? YES - Use That Energy! for Kids Ages 4-8","https://m.media-amazon.com/images/I/51IPMxkuOBL._AC_UL320_.jpg","4.5","2116","14.96","228"
"B08MWWGH62","Premium High Back Full Bucket Toddler Swing Seat with Finger Grip, Plastic Coated Chains for Safety and Carabiners for Easy Install - Green - Squirrel Products","https://m.media-amazon.com/images/I/51JgJSH+VvL._AC_UL320_.jpg","4.8","2566","54.99","228"
"B0CCNMGJB2","Inflatable Pool Floats Adult Size Water Hammock,Floats for Swimming Pool,4-in-1 Multi-Purpose Pool Floating Toys,Pool Rafts Lounge Chairs Floaties,for Adults Vacation Fun and Rest","https://m.media-amazon.com/images/I/81rdKtdsayL._AC_UL320_.jpg","4.5","28","19.99","228"
"B088ZPVQP3","Hely Cancy Portable Shooting Practice Target Toy Storage Mesh Bag Compatible with Nerf Darts for Kids 6+","https://m.media-amazon.com/images/I/71BwDqhEEgL._AC_UL320_.jpg","4.3","2284","11.99","228"
"B004JMG0H2","Duncan Toys Limelight LED Light-Up Yo-Yo, Beginner Level Yo-Yo with LED Lights, Mystery Color","https://m.media-amazon.com/images/I/81rI9iM2JyL._AC_UL320_.jpg","4.5","3357","11.99","228"
"B0BM7HSWMP","EDRLAITY Colourful Sports Balls Playground Ball for Kids and Toddlers, Soft Kickball Dodgeball Handball Set Indoor and Outdoor Play Toy, 7”, Yellow Series (Pack of 3)","https://m.media-amazon.com/images/I/81sv7BHSiIL._AC_UL320_.jpg","3.8","10","12.99","228"
"B09QKYGKWM","Water Gun, WOLKEK Water Guns for Kids, 4 Pack Long Range High Capacity for Water, Swimming Pool Beach Sand Outdoor, Summer Gifts for Boys Girls","https://m.media-amazon.com/images/I/71V-s3uqA7L._AC_UL320_.jpg","4.4","1175","19.99","228"
"B0BCHC8HQ9","Nerf Pro Gelfire Refill, 20,000 Dehydrated Gelfire Rounds, 1x 800 Round Hopper, Use with Nerf Pro Gelfire Blasters, Ages 14 & Up","https://m.media-amazon.com/images/I/81fKiX+5zRL._AC_UL320_.jpg","4.7","290","5.99","228"
"B09T2QKS13","FLAMDYNO Pool Toys - 4 Pack Light Up Beach Balls for Kids w/ 8 Light Modes, Pool Beach Games Balls for Outdoor or Indoor Activities, Glow in The Dark Pool Beach Decorations for Kids and Adults","https://m.media-amazon.com/images/I/71yrSUa95NL._AC_UL320_.jpg","4.0","477","27.99","228"
"B086KQGKKS","Fworld 100 pcs Color Mixing Glass Marbles 16mm/0.63inch Kids Marble Games DIY and Home Decoration","https://m.media-amazon.com/images/I/61jgi-QBiEL._AC_UL320_.jpg","4.6","1761","7.79","228"
"B09XJZ7Q9J","EPPO Tee Ball Set for Kids 3-5|5-8, Kids Baseball Tee, T-Ball Set for Toddlers 2-6, 6 Balls, Teeball Batting Tee, Pitching Machine, Nice Gift Outdoor Sport Toy Games for Kids 3-12 Years Boys & Girls","https://m.media-amazon.com/images/I/61yJNzn7ohL._AC_UL320_.jpg","4.2","331","25.99","228"
"B003AH6NII","Melissa & Doug Sunny Patch Seaside Sidekicks Sand Baking Play Set,White","https://m.media-amazon.com/images/I/71R0-HWJjbS._AC_UL320_.jpg","4.8","4817","18.99","228"
"B07MSCSGV8","Gift for Toddler Boys & Girls, Ball Pit, Play Tent and Tunnels for Kids, Best Birthday Gift for 3 4 5 Year Old Pop Up Baby Play Toy, Target Game w/ 4 Darts Indoor & Outdoor","https://m.media-amazon.com/images/I/81H5-mZiIQL._AC_UL320_.jpg","4.6","9812","69.95","228"
"B0BP62G1D7","Bubble Machine, Bubble Machine for Kids Toddlers, Make Extra Large Bubbles (10 Times Larger) & Bubbles Inside Bubble, 1000+ Bubbles Per Minute, Bubbles Toys for Kids Indoor Outdoor Birthday Party","https://m.media-amazon.com/images/I/81XZnCPxoRL._AC_UL320_.jpg","4.2","118","25.99","228"
"B071NLK1MZ","Duncan Toys Butterfly Yo-Yo, Beginner Yo-Yo with String, Steel Axle and Plastic Body, Blue","https://m.media-amazon.com/images/I/91wdL-hTg6L._AC_UL320_.jpg","4.4","1028","5.99","228"
"B09MDM5JKC","Spider-Man Marvel Web Shots Spiderbolt NERF Powered Blaster Toy Perfect for Halloween Costume, Fires Darts, 3 Darts, Kids 5+ (Amazon Exclusive)","https://m.media-amazon.com/images/I/71q3xwXXrTL._AC_UL320_.jpg","4.5","661","21.05","228"
"B07DK73YW1","Bubble Wand, 14"" Big Bubble Wand Set(14 Pack 7 Colour), Non-toxic Smelless Bubble Toy For Kids Child Birthday Party Favor Wedding Summer Outdoor Activity Bathroom Bath Toys, by MAPIXO","https://m.media-amazon.com/images/I/71bd426dtqL._AC_UL320_.jpg","4.6","2116","16.95","228"
"B07H32P9V3","Iyoyo Mini Basketballs, 5 Pack 6"" Basketball Set with Pump Durable PVC Basketballs for Mini Basketball Hoop for Toddlers Kids Teenagers for Pool, Indoors, Outdoors","https://m.media-amazon.com/images/I/81TGil80x6L._AC_UL320_.jpg","4.5","1151","14.38","228"
"B08H5R94MW","SwimWays Spring Float Original Pool Lounge Chair, Inflatable Pool Floats Adult with Fast Inflation & Head Rest for Ages 15 & Up, Aqua","https://m.media-amazon.com/images/I/91IYAO-lsqL._AC_UL320_.jpg","4.6","1736","17.97","228"
"B07BC4W9ZR","NERF Elite Digital Target Blue/Orange","https://m.media-amazon.com/images/I/81D7MM1QEBL._AC_UL320_.jpg","4.5","3871","20.03","228"
"B0C8P14PSF","OSALON Laser Tag Guns Set of 4 with Digital LED Score Display Vest Infrared Multi-Function Laser Tag Guns,Fun Outdoor Toys for Kids Ages 6 7 8 9 10 11 12+ Years Old Boys Girls Teens Birthday Gift","https://m.media-amazon.com/images/I/812o1phrbxL._AC_UL320_.jpg","4.8","42","53.99","228"
"B083QZLZW7","NERF Fortnite BASR-L Bolt Action, Clip Fed Blaster - Includes Removable Scope, 6-Dart Clip and 12 Official Elite Darts","https://m.media-amazon.com/images/I/71UVeXpwa+L._AC_UL320_.jpg","4.6","7347","29.99","228"
"B08CS6KX62","JOYIN Halloween Carnival Can Bean Bag Toss Games for Kids & Adults Trick or Treat Decoration, Home Decor Party Favors Supplies, Homeschooling Backyard Game","https://m.media-amazon.com/images/I/81VjDeU8nGL._AC_UL320_.jpg","4.6","375","21.99","228"
"B01M28VV0N","Eastern Jungle Gym Easy 1-2-3 A-Frame 2 Brackets for Swing Set with All Mounting Hardware, Green","https://m.media-amazon.com/images/I/71b8UxnwD0L._AC_UL320_.jpg","4.8","8533","69.98","228"
"B011S71UX4","36 Inch Green Alien Inflate One Piece","https://m.media-amazon.com/images/I/714JRl6XxHL._AC_UL320_.jpg","4.2","707","5.72","228"
"B0BN39DQ6K","BaLaM Hover Soccer Ball Toys for 3-8 Year Old Kids Toddler Boys Girls, Christmas Birthday Gifts for Kids Age 3 4 5 6 7 8, with 2 Goals and Nets, Blue.","https://m.media-amazon.com/images/I/71V+9ZcNtuL._AC_UL320_.jpg","4.3","72","19.99","228"
"B0192MB5RS","My Critter Catcher - Spider and Insect Catcher","https://m.media-amazon.com/images/I/51XIe09nIWL._AC_UL320_.jpg","4.1","5679","22.95","228"
"B0B1PSGNZY","FUBBLES NO Spill Funfiniti Bubble Machine | Blows One Hour of Non Stop Bubbles |Amazon Exclusive Toy Set Includes 36oz of Non Toxic Refill Solution (Bubble Solution Bottle Colors Will Vary) Pack of 1","https://m.media-amazon.com/images/I/81c3a2pCbNL._AC_UL320_.jpg","4.1","350","18.18","228"
"B09YR3BWFT","X-Shot Skins Dread Foam Dart Blaster (12 Dart) by ZURU x Sonic The Hedgehog Toy Dart Blaster for Kids, Teens, Adults","https://m.media-amazon.com/images/I/91vLV11V-jL._AC_UL320_.jpg","4.7","507","14.99","228"
"B09CDCTNQF","IGINOA Bubble Machine Blower Lawn Maker Pink Mower Toy Easter Basket Stuffers Portable Handheld Automatic Electric Outdoor Summer Birthday Best Gift Light for Girls Kids Toddler 1 2 3 Year Old Unicorn","https://m.media-amazon.com/images/I/719rmTWhIGL._AC_UL320_.jpg","4.2","1837","23.99","228"
"B078JFSH8P","LET'S GO! Binocular for Kids, Compact High Resolution Shockproof Binoculars","https://m.media-amazon.com/images/I/61sGjw+TtYL._AC_UL320_.jpg","4.4","8331","19.99","228"
"B07K2N4CXC","INPANY Bouncy Horse Hopper- Brown Inflatable Jumping Horse, Ride on Rubber Bouncing Animal Toys for Kids/Toddlers/Children/Boys/Girls (Pump Included)","https://m.media-amazon.com/images/I/61BgXZOyv2L._AC_UL320_.jpg","4.6","3490","23.99","228"
"B08HCNYC3J","2 Pack Inflatable Bopper, 47 Inches Kids Punching Bag with Bounce-Back Action, Inflatable Punching Bag for Kids","https://m.media-amazon.com/images/I/71ayNrXLddL._AC_UL320_.jpg","3.9","1527","21.69","228"
"B08C7MG8F4","Outdoor Indoor Game Activities for Kids, Pop-Pass-Catch Ball Game with 4 Catch Launcher Baskets and 6 Balls, Halloween Christmas Party Favors Gift Beach Sport Toys for Kids Age 5 6 7 8 9 10+ and Adult","https://m.media-amazon.com/images/I/71at2Qn3FvL._AC_UL320_.jpg","4.4","3129","16.99","228"
"B01CK78BLA","WOWmazing Giant Bubble Wands Kit: (4-Piece Set) | Incl. Wand, Big Bubble Concentrate and Tips & Trick Booklet | Outdoor Toy for Kids, Boys, Girls | Bubbles Made in The USA","https://m.media-amazon.com/images/I/61wyH6j2rNL._AC_UL320_.jpg","4.4","12792","15.95","228"
"B0C814PXTN","40Pcs Halloween Bubble Wands, Mini Bubble Wands for Halloween Party Favors, Toys for Girls Boys Kids Toddler Adults, Party Bag Stuffers Goodie Bag Filler, Classroom Prizes","https://m.media-amazon.com/images/I/71iP6zLnMJL._AC_UL320_.jpg","4.0","20","11.99","228"
"B07PXM9BF9","GiftExpress Adjustable Size Colorful Jump Rope for Kids and Teens - Outdoor Indoor Fun Games Skipping Rope Exercise Fitness Activity and Party Favor - Assorted Colors Pack of (6)","https://m.media-amazon.com/images/I/81GEZp3erEL._AC_UL320_.jpg","4.3","760","14.99","228"
"B0BZXZ4RRR","REGUICORP 2 Pack Beach Balls, 20 Inch Beach Balls for Kids, Rainbow Color Pool Toys Pool Balls for Swimming Pool, Beach Toys Inflatable Ball for Summer Parties and Water Games","https://m.media-amazon.com/images/I/51RXbeVjqfL._AC_UL320_.jpg","4.7","31","6.99","228"
"B08CMRCF3P","Sustainable Bubble Tree Original Refillable Bubble System Aluminum Bottles (2 Pack of Bubble Solution Made in The USA)","https://m.media-amazon.com/images/I/81CVZcxzJwL._AC_UL320_.jpg","4.7","362","9.99","228"
"B09L5YQTDP","Bean Bag Toss Game Toys for Kids,Ocean Double-Sided Foldable Board Kids Cornhole Summer Outdoor Play Game and Party Supplies Toy Birthday Gifts for Toddler Boys Girls Age 2 3 4 5 6","https://m.media-amazon.com/images/I/91h4cSJiJ6L._AC_UL320_.jpg","4.5","457","19.99","228"
"B08XYBTSS6","Waboba Moon Ball - Gradient (Two Pack) (Colors May Vary)","https://m.media-amazon.com/images/I/71ALPZV0rzL._AC_UL320_.jpg","4.7","986","19.99","228"
"B07HZHJGPS","Franklin Sports Oversized Foam Baseballs - Foam Softballs","https://m.media-amazon.com/images/I/91l9kBjnPvL._AC_UL320_.jpg","4.7","2506","12.99","228"
"B07T2GFL7V","Water Gun for Kids,2Pack Soaker Squirt Summer Squirt Shooter Gun Toys Swimming Pool Beach Water Fighting Toy Pool Party Beach for Boys Girls Adults","https://m.media-amazon.com/images/I/61nI6U1m1WL._AC_UL320_.jpg","3.5","879","9.99","228"
"B01HTIET3Y","Tiny Land Large Kids Teepee Tent with Padded Mat & Light String & Carry Case-Kids Foldable Play Tent -Toys for 3,4,5,6 Year Old Girls, White Canvas Teepee Indoor Outdoor Games-Kids Playhouse-Kids Tent","https://m.media-amazon.com/images/I/81WhQ1u76UL._AC_UL320_.jpg","4.7","9559","59.99","228"
"B08WRBN5CZ","Hedstrom Marvel Spider-Man Hopper, 15-Inch, Yellow (55-97063)","https://m.media-amazon.com/images/I/71CuOy5AvyS._AC_UL320_.jpg","4.5","7138","14.14","228"
"B073PTVDCQ","Playz 5pc Kids Playhouse Jungle Gym Ball Pit with Dart Board & 5 Sticky Balls - Fold Up Pop Up Tents, Tunnels & Basketball Pit Play Center for Boys, Girls, Baby, Toddlers w/Travel Zipper Storage Bag","https://m.media-amazon.com/images/I/81ZO3kku5eL._AC_UL320_.jpg","4.5","4165","59.95","228"
"B000030000","Intex Giant Gator Ride-On, 80"" X 45"", for Ages 3+","https://m.media-amazon.com/images/I/81NkkUgrQRL._AC_UL320_.jpg","4.7","7688","17.68","228"
"B09GNQD678","NERF Mini Foam Sports Ball Set - Foam Football, Soccer Ball + Basketball Set - NERF Soft Foam Sports Set for Kids - Multicolor","https://m.media-amazon.com/images/I/91wZ5MtyS7L._AC_UL320_.jpg","4.6","339","19.99","228"
"B084FSYC1B","W&O Dinosaur Discovery Kids Tent with Roar Button, an Extraordinary Dinosaur Tent, Pop Up Tent for Kids, Dinosaur Toys for Kids Girls & Boys, Kids Play Tent, Kids Tent Indoor & Outdoor","https://m.media-amazon.com/images/I/91XU829LRNL._AC_UL320_.jpg","4.6","12583","34.99","228"
"B07T8XQXCQ","Eurmax USA Universal Easy-to-Assemble Trampoline Ladder Trampoline Slide with Horizontal and Wide Steps,Heavy Duty Trampoline Accessories for Children Kids","https://m.media-amazon.com/images/I/81Hz0pFY3ZL._AC_UL320_.jpg","4.4","3202","19.85","228"
"B09X75MD3L","Husqvarna Toy Bubble Backpack Leaf Blower","https://m.media-amazon.com/images/I/71xgK6ufCnL._AC_UL320_.jpg","4.7","218","69.95","228"
"B082ST1RN6","TOPNEW 32 Rock Climbing Holds Multi Size for Kids, Adult Rock Wall Holds Climbing Rock Wall Grips for Indoor and Outdoor Playground Play Set - Includes 2 Inch Mounting Hardware","https://m.media-amazon.com/images/I/91JsQt+lmyL._AC_UL320_.jpg","4.5","895","37.28","228"
"B07X84BCZ1","LED Light Up Yo Yo Yoyo for Kids Beginner Yoyo for Kids Responsive Ball Bearing Yoyo 4 Pack","https://m.media-amazon.com/images/I/616DxYjrYDL._AC_UL320_.jpg","3.5","1604","8.98","228"
"B0B4PJDMRZ","Boerfmo Bubble Gun Machine for Kids - Bubble Blower with 8-Hole Wands & LED Light - Bubble Maker/Blaster Include Bubble Solution & Batteries - Boys Toys Gifts, for Birthday, Parties","https://m.media-amazon.com/images/I/71aEko05TqL._AC_UL320_.jpg","4.4","798","14.99","228"
"B0C1ZMXGJJ","Babyhome Movable Dinosaur Shooting Toys for Kids 3 4 5 6 7+ Years, Tyrannosaurus Target with Water Mist Spray and Pterosaur Air Pump Foam Blaster(Green)","https://m.media-amazon.com/images/I/714zEFtOPrL._AC_UL320_.jpg","4.0","327","16.99","228"
"B0C4L29LXV","SOFITEN Toy Foam Blaster Automatic Sniper Rifle with Scope, Motorized Foam Dart Toys with 120 Darts, IR and Flashlight. The Shooting Activity Game for Boys and Girls (Vector)","https://m.media-amazon.com/images/I/71TZbfVA6wL._AC_UL320_.jpg","4.2","57","44.98","228"
"B09H3JP8R1","JOYIN Turtle Balance Stepping Stones, 6 Pcs Kids Turtle Jumping Stones Steps Stones Up to 265 Ibs, Toddler Obstacle Course Coordination Game Toys for Ages 3 Years and UP Indoor or Outdoor Play","https://m.media-amazon.com/images/I/71QK8+CHovL._AC_UL320_.jpg","4.8","720","39.99","228"
"B09GLSM7H2","Duckura 6pcs Kids Garden Tools Set, Gardening Tool for Kids, Shovel, Rake, Hoe, Leaf Rake, Outdoor Backyard Farm Lawn Digging Weed Toys, Halloween Birthday Gifts for Boys Girls Age 3 4 5 Years Old","https://m.media-amazon.com/images/I/81U0ElCx3XL._AC_UL320_.jpg","4.6","755","24.99","228"
"B07T2TQVHM","5 Piece 8"" Kids Gardening Tools, Made of Metal with Sturdy Wooden Handle, Safe Beach Sandbox Toy Gardening Equipment Spoon, Fork, Trowel, Rake & Shovel for Children","https://m.media-amazon.com/images/I/51QXptabLJL._AC_UL320_.jpg","4.7","1788","9.99","228"
"B08T1L46JB","Kids Play Tunnel for Toddlers, Pop Up Crawl Through Tunnel Play Tent for Baby Infant Children or Dog with 2 Mesh Sides, Kids Tunnel Toys or Gift Indoor & Outdoor (Colorful Crawling Tunnel)","https://m.media-amazon.com/images/I/61ssBYK-bnL._AC_UL320_.jpg","4.5","1584","17.99","228"
"B0BHCV4H2B","Bennol Upgraded Kids Toddler Golf Set, Indoor Outdoor Outside Golf Toys Gifts for 2 3 4 5 Year Old Boys, 1 2 3 4 5 Year Old Boys Toys Birthday Gifts Ideas, Outdoor Golf Set Toys Game for Kids Boys","https://m.media-amazon.com/images/I/71BXe2uaHzL._AC_UL320_.jpg","4.0","158","37.99","228"
"B0B9FY1BWL","Kids Toys Gifts for 4 5 6 7 8 9 10 11 12 + Year Old Boys Girls Cool Birthday Outdoor Educational Airplane Launcher Toy 3 Pack Led Light Foam Glider Planes Airplanes with 3 Sets of Themed DIY Stickers","https://m.media-amazon.com/images/I/71yNSiHKC8L._AC_UL320_.jpg","4.5","426","17.99","228"
"B098NHBNR6","JOYIN Halloween Toss Game Board with Bean Bag for Kids Outdoor Toys, Halloween Party Favor, Beach Yard Outdoor Activities, Family Party Supplies，Camping Outside Play Toy","https://m.media-amazon.com/images/I/91EKvj8-tFL._AC_UL320_.jpg","4.3","159","22.99","228"
"B018KLHT5O","Nerf HyperFire Motorized Elite Blaster, 25-Dart Drum, Fires Up To 5 Darts Per Second, Includes 25 Official Nerf Elite Darts (Amazon Exclusive)","https://m.media-amazon.com/images/I/71IOhKJiFSL._AC_UL320_.jpg","4.6","6435","55.99","228"
"B06WRN2WJW","Maxx Bubbles Toy Bubble Leaf Blower with Refill Solution – Bubble Toys for Boys and Girls - Outdoor Summer Fun for Kids and Toddlers - Sunny Days Entertainment","https://m.media-amazon.com/images/I/71HnbMoGVwL._AC_UL320_.jpg","3.9","4785","22.87","228"
"B09T39W736","SANTA CASA Mini Golf Set, Golf Pen Set, Mini Desktop Golf Gift Golf Ball Club Pen Game for Men Dad Boss Coworker Teen Boys with Putting Green, Flag, 3 Golf Clubs Pens, Balls Office Desk Toys","https://m.media-amazon.com/images/I/71R8kwHTLxL._AC_UL320_.jpg","4.5","106","9.34","228"
"B0C6LJHQ3K","2 Pack LED Light Airplane,17.5"" Large Throwing Foam Plane,2 Flight Mode Glider Plane,Flying Toy for Kids,Gifts for 3 4 5 6 7 8 9 Years Old Boy,Outdoor Sport Toys Birthday Party Favors Foam Airplane","https://m.media-amazon.com/images/I/71UGLtkdo5S._AC_UL320_.jpg","4.4","8426","13.99","228"
"B07P1KGH9L","Surfer Dudes Classics Wave Powered Mini-Surfer and Surfboard Toy - Bali Bobbi","https://m.media-amazon.com/images/I/61xziOBkfpS._AC_UL320_.jpg","4.7","5297","19.99","228"
"B07MHWVTFR","Thomas & Friends Tent – Pop Up Play Tent for Kids - Big Thomas The Train Toys – Sunny Days Entertainment","https://m.media-amazon.com/images/I/81GOTHKgMBL._AC_UL320_.jpg","4.7","3804","29.99","228"
"B07NXB77RH","JOYIN 30 Pcs Diving Pool Toys for Kids Ages 3-12 Jumbo Set with Storage Bag Pool Games Summer Swim Water FishToys","https://m.media-amazon.com/images/I/91HEcy+tjsL._AC_UL320_.jpg","4.7","4799","16.99","228"
"B09QKCCZRT","Maxx Bubbles Super Bubble Jet | Green Automatic Bubble Blowing Machine for Kids | Bubble Solution Included - Sunny Days Entertainment","https://m.media-amazon.com/images/I/71UPrJ-gRnL._AC_UL320_.jpg","4.0","234","7.98","228"
"B08197V9P3","Harborii Bean Bag Toss Games for Kids, Carnival Games for Family Party, Easter Games 10 Funny Face Metal Cans with 4 Bean Bags","https://m.media-amazon.com/images/I/61+jiuw3tVL._AC_UL320_.jpg","4.4","398","23.59","228"
