"asin","title","imgUrl","stars","reviews","price","category_id"
"B0C89VJHQF","Stroller Arch Toy: Car Seat Toys Stroller Toys CarSeat Toys for Babies 0-6 Months Baby Bjorn Bouncer Toy Bar Baby Arch Toy Crib Toys for Infants 0-6 Months - Spiral Newborn Hanging Toys for Babies","https://m.media-amazon.com/images/I/71s823CWYrL._AC_UL320_.jpg","4.8","45","18.99","230"
"B09LCC1TNB","XPIY Montessori Toys for Babies 6-12 Months, Educational Shape Sorting Toys for Toddler Fine Motor Skill Development, Carrots Harvest Wooden Puzzle, Gift for Kids First Birthday","https://m.media-amazon.com/images/I/61rNtvN-moL._AC_UL320_.jpg","4.7","245","17.99","230"
"B098BJLBTY","Baby Einstein Together in Tune Drums Safe Wireless Wooden Musical Toddler Toy, Magic Touch Collection, Age 12 Months+","https://m.media-amazon.com/images/I/71iBlCL6fmL._AC_UL320_.jpg","4.8","604","39.99","230"
"B08D98B897","Dimple Fun Egg Matching Toy (Total 24 Eggs) - Toddler STEM Easter Eggs Toys, Shape Recognition Toys for Kids, Educational Color Sorting Toys, Play Egg Shapes Puzzle Set","https://m.media-amazon.com/images/I/71OO-eJxiiL._AC_UL320_.jpg","4.8","1100","13.98","230"
"B00KJNRBQ4","caaocho Pure Natural Rubber Sensory Ball Rainbow 4"" - Baby Ball Toy, Promotes Sensory Development, Rainbow Colors, Perfect Bouncer, Gentle Squeaking, BPA Free, PVC Free, Food-Grade Paint","https://m.media-amazon.com/images/I/71ppS1jyarL._AC_UL320_.jpg","4.4","962","17.99","230"
"B08PB4NKH4","GOGOSO Ball Pit Balls 100 - Soft Plastic Balls for Babies Toddlers Kids Children with Storage Bag for 1 2 3 Years Old, 3 Colors (100 Balls) White Beige Transparent","https://m.media-amazon.com/images/I/81cwdSrUxJL._AC_UL320_.jpg","4.2","190","21.89","230"
"B0917CHJS7","Lacing Farm Toy Wooden Block Set, Early Educational Toys String & Lacing Beads Games for Toddlers Kids Farm Animal Learning Play Set (16 Pieces)","https://m.media-amazon.com/images/I/71iAnMQGGTL._AC_UL320_.jpg","4.4","629","9.99","230"
"B00X4OCIUO","hand2mind Interlocking UniLink Math Linking Cubes, Plastic Cubes, Color Sorting, Connecting Cubes, Math Manipulatives, Counting Cubes for Kids Math, Math Cubes, Counters for Kids Math (Set of 100)","https://m.media-amazon.com/images/I/51z21-Uv9lS._AC_UL320_.jpg","4.8","552","9.16","230"
"B0C4Y3BP4Q","Baby Toys 6 to 12 Months, Musical Pop-Up Cause and Effect Toys with Light & Music for 12-18 Months, Early Learning Educational Infant Toys for Toddler Boy Girl 7 8 9 10 11 Month 1-2 Year Old Gifts","https://m.media-amazon.com/images/I/71lmlIeNZzL._AC_UL320_.jpg","4.4","13","21.99","230"
"B000FPHGW0","Manhattan Toy Skwish Color Burst Rattle and Teether Grasping Activity Toy","https://m.media-amazon.com/images/I/61LOp-a2ewL._AC_UL320_.jpg","4.8","1853","20.99","230"
"B09V52GJQK","200 Pcs Mini Rubber Ducks in Bulk Yellow Tiny Baby Shower Ducks Float Squeak Bathtub Duckies Preschool Bath Toy for Birthday Party Gift(1.57 x 1.57 x 1.18 Inch,Yellow)","https://m.media-amazon.com/images/I/71V-EpC3aGL._AC_UL320_.jpg","4.6","142","27.99","230"
"B09QNHK9S9","Tonies Disney Baby Lullabies Audio Play Character","https://m.media-amazon.com/images/I/61smKDrU19L._AC_UL320_.jpg","4.5","239","17.99","230"
"B017U39XFM","Bear Rattle Bell Toy with Music Song Light Yellow for Boys and Girls 6 Months","https://m.media-amazon.com/images/I/71j8tL4SJHL._AC_UL320_.jpg","4.4","500","12.99","230"
"B07KYH67DL","Ubbi Starfish Stretch and Suction Bath Toys, Baby Bath Accessory, Water Toys for Toddler Bath Time, Fun Baby Water Toys, Set of 3","https://m.media-amazon.com/images/I/71ysNcCx1uL._AC_UL320_.jpg","4.7","2488","11.77","230"
"B0786H9SZ6","BettRoom Wooden Educational Preschool Toddler Toys for 3 4-5 Year Old Boys Girls Shape Color Recognition Geometric Board Blocks Stack Sort Kids Children Non-Toxic Toy(14IN)","https://m.media-amazon.com/images/I/61Zh2K7WldL._AC_UL320_.jpg","4.8","4839","9.98","230"
"B08B4PR7ZT","Baby Teething Toys for Babies 0-6 Months Baby Toys 0-6 Months Baby Toys 6 to 12 Months 4 Textures Infant Toys Baby Toys 0-3-6-12 Months Baby Teether Teethers for Babies Baby Rattle Girl Boy Gifts Toys","https://m.media-amazon.com/images/I/71tAWacHpYS._AC_UL320_.jpg","4.7","3190","9.99","230"
"B08QW9XJYT","Fisher-Price Baby To Toddler Learning Toy 2-In-1 Servin’ Up Fun Jumperoo Activity Center With Music Lights And Shape Sorting Puzzle Play","https://m.media-amazon.com/images/I/71CcmPgB5HL._AC_UL320_.jpg","4.8","545","135.99","230"
"B094JHR6HJ","8 Pieces Glow in the Dark Stress Balls Ceiling Balls Sticky Balls That Stick to the Ceiling Glowing Balls for Relax Toy Teens and Adults (Pink, Yellow, Blue, Green, 1.8 Inches)","https://m.media-amazon.com/images/I/6146fcPoL9S._AC_UL320_.jpg","3.5","3130","8.99","230"
"B07ZKLF3B1","Ancaixin Montessori Toys for Babies 6-12 Months, Wooden Toys for 1 Year Old Boys and Girls, Educational Carrot Harvest Toy for Toddlers, Shape Sorting Matching Puzzle, Developmental Birthday Gifts","https://m.media-amazon.com/images/I/71ubuoq3qZL._AC_UL320_.jpg","4.7","3236","18.99","230"
"B0992XQ7C6","Skoolzy Peg Board 30 Piece Toys_and_Games Set, Montessori Toys for Baby, Toddlers, Fine Motor Color Matching Pegs for Sorting Counting Learning Toy Includes eBook","https://m.media-amazon.com/images/I/71aLyftS5gL._AC_UL320_.jpg","4.6","8330","19.97","230"
"B0C1N8Y1NG","Eascrozn Baby Teething Toys Set of 2, Remote Control Shape Teethers for Babies 6-12 Months Chew Toys, BPA Free, Soft Silicone Teether Sensory Exporation and Teething Relief Baby Toys","https://m.media-amazon.com/images/I/71EFTcU9mNL._AC_UL320_.jpg","4.5","64","5.45","230"
"B01AC914YO","Le Toy Van - Wooden Petilou Forest Stacker Puzzle & Bag Educational Balancing Activities Toy | Great Gift for Kids and Toddlers | Suitable for Age 18+ Months Old","https://m.media-amazon.com/images/I/81YEIunv1IL._AC_UL320_.jpg","4.7","2465","24.99","230"
"B08TB5JGJ1","Waboba Gradient Moon Ball, 1 EA","https://m.media-amazon.com/images/I/61srTiVXp7L._AC_UL320_.jpg","4.7","986","7.99","230"
"B08PC231KZ","NUOBESTY Learn to Tie Shoes Wooden Lacing Shoe Toy Shoelaces Tying Toy Teaching Kit for Kids, Blue","https://m.media-amazon.com/images/I/51yCpZr5zvL._AC_UL320_.jpg","4.3","307","11.99","230"
"B01N4PRNB9","Green Toys Airplane & Board Book (color may vary)","https://m.media-amazon.com/images/I/71dIiKHRcwL._AC_UL320_.jpg","4.8","2310","19.95","230"
"B0C5RGFFBF","Alsatic Suction Cup Spinner Toys for 1 Year Old Boys Girls, Sensory Fine Motor Infant Travel Toys Montessori for Babies 6-12-18 Months, Birthday Gifts for 1-3 One Year Old, Newborn Toddler Bath Toys","https://m.media-amazon.com/images/I/71GkFuagKuL._AC_UL320_.jpg","4.3","45","11.99","230"
"B094D7DDY2","Outgeek Suction Cup Spinner Toys: 3PCS Kids Spinning Top Toys Baby Dimple Toy Sensory Toys Fidget Spinners Suction Cup Babies Bath Toys Gift Toys for Toddlers (3 Pcs)","https://m.media-amazon.com/images/I/61Of-pdxGgL._AC_UL320_.jpg","4.6","693","9.99","230"
"B09KTLXWBH","B. Baby – Musical Light-Up Baby Toy – Hedgehog Toy with Lights & Sounds – Sensory Toy for Newborns, Babies – Music & Glowing Lights – 0 Months + – RainGlow Buddy","https://m.media-amazon.com/images/I/71xahG3r8GL._AC_UL320_.jpg","4.5","60","14.99","230"
"B08FGCRCYZ","Baby Jack & Co 10x10” Wizard Lovey Owl Tag Toy for Babies Witches - House Colors - Learn Wizardry - Soft & Safe - Learn Shapes & Colors - Ideal Baby Toy & Muggle Gift - BPA Free w/ Stroller Clip","https://m.media-amazon.com/images/I/71G1NEOBDnL._AC_UL320_.jpg","4.7","361","19.98","230"
"B00COQZMGA","(Elephant) - Hape Elephant Wooden Push and Pull Toddler Toy,Grey","https://m.media-amazon.com/images/I/41Po3VqCmaL._AC_UL320_.jpg","4.7","1971","10.99","230"
"B0C4L5D87J","20 Pcs Duck Plugs, Black Plastic Duck Plug Holder for Car Dash, Duck Holder Mount for Car Lover ( Excluding Rubber Duck","https://m.media-amazon.com/images/I/7117d51Z9QL._AC_UL320_.jpg","4.1","26","8.95","230"
"B0869CW6KJ","KIDS PREFERRED Disney Baby Minnie Mouse Plush Stuffed Animal Snuggler Lovey Security Blanket - Pink,13.18"" x 13.18"" x 3.62""","https://m.media-amazon.com/images/I/618PptghWFL._AC_UL320_.jpg","4.8","1518","16.99","230"
"B08F1WR4V6","Baby Books Toys,Touch Feel Soft Cloth Crinkle Books for Babies Infants Toddler, Elephant Baby Gifts Teething Toys, Jungle Education Bunny Toys for 0-6 Months 1 Year Old Boy Girl,Stuffed Plush Book","https://m.media-amazon.com/images/I/818I1NYZZIL._AC_UL320_.jpg","4.8","655","19.99","230"
"B0C54T2CSH","pcnearty Toys for 3 4 5 Year Old Boys Girls，3 4 5 Year Old Girl Boy Birthday Gifts, 240 Pieces Number Learning Education Toys, Ages 3+ Develops Early Math Skills, Preschool Math Games","https://m.media-amazon.com/images/I/81ZinOcqlaL._AC_UL320_.jpg","5.0","9","19.99","230"
"B003HS5JSA","LAMAZE Bitty Bite Bug Rattle 4.5 Inch (Pack of 1)","https://m.media-amazon.com/images/I/81KUXxfLwRL._AC_UL320_.jpg","4.8","6275","5.99","230"
"B0014ZA6F4","Schylling Mini Tin Tops","https://m.media-amazon.com/images/I/81R9q5JM+oL._AC_UL320_.jpg","4.2","2893","13.5","230"
"B0BZVVQDX4","OKOOKO Car Seat Toy Rear Facing Car Seat Toy Baby Travel Toy Double-Sided with Baby Mirror Plush Toys Rattle Teether Thickened Pad Adjustable Sensory Toy for Newborn Baby Infant","https://m.media-amazon.com/images/I/71j4zOv9m9L._AC_UL320_.jpg","4.5","75","19.99","230"
"B077SVYQ3Y","Fisher-Price Laugh & Learn Baby & Toddler Playset Smart Learning Home Interactive Playhouse with Smart Stages Content for Ages 6+ Months (Amazon Exclusive)","https://m.media-amazon.com/images/I/71RwCyFD8SL._AC_UL320_.jpg","4.7","2830","173.12","230"
"B014V1D4R4","edxeducation Linking Cubes - Set of 100 - Connecting and Counting Snap Blocks for Construction and Early Math - For Preschool and Elementary Aged Kids","https://m.media-amazon.com/images/I/614NProuz5L._AC_UL320_.jpg","4.8","8897","17.45","230"
"B0C68QHVNM","OleOletOy 40pcs Duck Plug - Rubber Duck Mount, Rubber Duck Holder for Jeep Dash and Fixed Display, Gift for Jeep Lover, Black (Excluding Rubber Duck)","https://m.media-amazon.com/images/I/712S5AMpO9L._AC_UL320_.jpg","4.5","34","16.99","230"
"B07CZJLWWT","Infantino Cuddly Teether, Fox Character, 3 Textured Teething Places to Soothe Sore Gums, BPA-Free Silicone, Soft Fabric Textures to Explore, Crinkle Sounds to Discover, for Babies 0M+","https://m.media-amazon.com/images/I/91V9eTu7c-L._AC_UL320_.jpg","4.8","8975","15.18","230"
"B096T6TJV5","Nuby Jackie The Giraffe Super Soft Teether Toy with Squeaker, 100% Natural Rubber","https://m.media-amazon.com/images/I/61IeCSk6XeS._AC_UL320_.jpg","4.7","312","12.98","230"
"B001AMK6G0","Edushape The Original Sensory Balls for Baby - 4” Transparent Color Baby Balls That Help Enhance Gross Motor Skills for Kids Aged 6 Months and Up - Pack of 4 Vibrant and Unique Toddler Ball for Baby","https://m.media-amazon.com/images/I/81srSHj9E3L._AC_UL320_.jpg","4.8","3068","21.99","230"
"B0BW7YP362","Tub Works™ Bathtub Finger Paint Soap, 24 Pack | Non-Toxic, Washable Bath Paint for Toddlers & Kids Bath | Ideal Toddler Bath Toys for Creative Play","https://m.media-amazon.com/images/I/91dJwkHeYEL._AC_UL320_.jpg","4.8","71","34.99","230"
"B08R1R2GBQ","Grechi Dinosaur Bath Toys,Baby Bath Toys for The Baby Bathtub,Toddler Bath Toys Automatic Bubble Machine,Plays 12 Children’s Songs,Bath Toy Makes Great Gifts for Toddlers Age 2 3 Year Old Girl Boy","https://m.media-amazon.com/images/I/71Pd4kH6C1L._AC_UL320_.jpg","3.6","863","16.99","230"
"B08LDV57DW","edxeducation Translucent Linking Cubes - Construction Toy for Early Math - Set of 100 - 0.8 Inch - Light Table Toy - Elementary + Preschool Learning","https://m.media-amazon.com/images/I/81Zh9R9xTEL._AC_UL320_.jpg","4.7","300","15.99","230"
"B073X45JPG","Pegs Board Game Set Jumbo Pack | 48 Pegs + 2 Boards & Storage Bag W/Handle Easy to Carry. for Motor Skills Sorting Counting Color Recognition Occupational Therapy Toddler and Preschool by Twinkle me","https://m.media-amazon.com/images/I/81iW0OBY91L._AC_UL320_.jpg","4.7","193","19.99","230"
"B08FBXT2KP","Baby Einstein Musical Mix ‘N Roll 4-in-1 Push Walker, Activity Center, Toddler Table and Floor -Toy for 6 Months+, Blue","https://m.media-amazon.com/images/I/81UXA4DMKsS._AC_UL320_.jpg","4.4","929","39.98","230"
"B0BCPCTB75","MAGIBX Toys for 1 Year Old Boys Gifts, Crawling Turtle Baby Toys 6 to 12 Months, Musical Light Infant Toys for 8 9 Months, One Year Old Girl 1st Birthday Gifts for Boy Educational Toys for Age 1-2","https://m.media-amazon.com/images/I/61FooTyKpZL._AC_UL320_.jpg","4.5","236","20.99","230"
"B07YVNH7W6","Nuby Chewy Chums All Silicone Soothing Teether, Shark - 3M+","https://m.media-amazon.com/images/I/71-ZstLhuVL._AC_UL320_.jpg","4.8","2606","10.99","230"
"B08XV33VT4","iPlay, iLearn Bouncy Pals White Hopping Horse, Inflatable Bouncing Animal Hopper Toy W/Pump, Plush Ride on Bouncer, Indoor Outdoor Birthday Gifts for 18 24 Month 2 3 4 5 Year Old Toddler Kid Boy Girl","https://m.media-amazon.com/images/I/71c+lF1NGFL._AC_UL320_.jpg","4.6","3658","33.99","230"
"B0C33C92PG","Chewy Necklaces for Sensory Kids, Building Block Chew Necklace Bundle for Boys and Girls with Chewing, Teething, Biting, ADHD, Autism, Silicone Oral Motor Chewy Teether Fidget Toys for Adults 5 Pack","https://m.media-amazon.com/images/I/61gr+zRNntL._AC_UL320_.jpg","4.2","18","8.99","230"
"B0BBZZFN75","Oukzon Tummy Time Toys, Baby Toys 0-6 Months with Crinkle Book and Teethers, 6-12 Months Infant Mirror Toys High Contrast Baby Gift Toys for Newborn Brain Development, Montessori Sensory Toy","https://m.media-amazon.com/images/I/816ctHQBSUL._AC_UL320_.jpg","4.7","120","14.99","230"
"B08C3MQ616","Baby Einstein Rattle & Jingle Trio High Chair Suction Toys Take-Along Musical Rattle Set Age 6 Months +, Multicolor, 3 Count","https://m.media-amazon.com/images/I/71BxzpbKz8L._AC_UL320_.jpg","4.5","430","10.99","230"
"B089YSZ6X7","Shark Tooth Chew Necklace, Sensory Chew Necklace Bundle for Kids with Chewing, Teething, ADHD, Autism, Biting Needs, Oral Motor Chewy Teether, Made from Food Grade Silicone Safety, for Boys&Girls","https://m.media-amazon.com/images/I/51kqgvlH6XL._AC_UL320_.jpg","4.5","1579","8.99","230"
"B07RV2SG61","Lilly's Love Bath Toy Storage - Large 14 x 20 inch Bathtub Toy Holder + 2 Locking Hooks, Quick Dry & Easy for Kids to Put Bath Toys Away","https://m.media-amazon.com/images/I/811O8S3XbSL._AC_UL320_.jpg","4.3","1413","9.99","230"
"B0CB69PLSF","MOSKAV 500 Pieces Number Learning Education Toys, Toys for 3 4 5 Year Old Boy Girl, 3-8 Year Old Girls Boys Birthday Gifts, Ages 3+ Develops Early Math Skills, Preschool Math Game","https://m.media-amazon.com/images/I/81DQ38ohexL._AC_UL320_.jpg","4.7","15","19.99","230"
"B0CD3XD29T","Busy Board Toddler Travel Toys: Sensory Toys for Toddlers 1 2 3 4 Year Old Boy Gifts Montessori Activity - Toddler Airplane Travel Essentials & Road Trip Must Haves , Age 12 18 Month Baby Abacus Toy","https://m.media-amazon.com/images/I/81BX0QnzjEL._AC_UL320_.jpg","5.0","12","23.99","230"
"B0C3CJDYYN","Interactive Pop Up Animals Toy for Toddlers with Music, Animal Sound,Educational STEM Early Developmental Cause and Effect Montessori Toys for Ages12-18 Months & 1 Year Old Kids, Babies C- Green","https://m.media-amazon.com/images/I/71mli5u8xGL._AC_UL320_.jpg","4.6","57","15.99","230"
"B0891KJ13Q","Disney Baby Minnie Mouse Teething Ring Toy (79676)","https://m.media-amazon.com/images/I/71Sr6K20FmL._AC_UL320_.jpg","4.8","951","7.0","230"
"B0BBV5KPP9","20PCS Starhig Light Up Spinning Tops for Kids, LED Flashing Tops，Gyroscope Novelty Bulk Toys Party Favors","https://m.media-amazon.com/images/I/718sqgwcnrL._AC_UL320_.jpg","4.2","172","16.99","230"
"B001RCJDIU","Teether Rattle, World of Eric Carle The Very Hungry Caterpillar Teething Toy for Babies","https://m.media-amazon.com/images/I/51AO7tB4JCL._AC_UL320_.jpg","4.8","2870","10.3","230"
"B09F2MXMSF","NVHH Baby Toys 12-18 Months Hammer Pounding Xylophone Kids Gifts for 1 2 3+ Year Old Boys Girls, Early Educational with Music Balls, Christmas Birthday Toys for 6 to 12 Months","https://m.media-amazon.com/images/I/715CMyMk+cL._AC_UL320_.jpg","4.5","510","21.97","230"
"B000YI9UO0","Casdon Toy Car Booster Seat | Pink Dolls Toy Car Booster Seat | Suits Dolls Up To 46cm In Size, Little Kid, Big Kid","https://m.media-amazon.com/images/I/716qTS+pN3L._AC_UL320_.jpg","4.3","5120","25.64","230"
"B07RJ38NBH","Toddlers Baby Music Shake Dancing Ball Toy, Move and Crawl Ball Toys for Kids,Bouncing Sensory Learning Ball Toys Ideal Gift for Baby Boys and Girls, Endless Fun for Children","https://m.media-amazon.com/images/I/61q8signFnL._AC_UL320_.jpg","4.3","3847","26.69","230"
"B098PVYKNJ","WISHTIME Baby Rattles Teethers with Phone Toy Set, 10PCS Infant Grab Spin Rattle Shaker with Storage Box, Newborn Baby Toys 6 to 12 Months, Teething Toys for Toddlers Boys Girls","https://m.media-amazon.com/images/I/71v3e4555SL._AC_UL320_.jpg","4.7","727","24.39","230"
"B08FQ694M8","Baltic Wonder Baltic Amber Necklace (Baroque Honey) Unisex - 100% Certified Authentic Baltic.","https://m.media-amazon.com/images/I/81RTBX6w94L._AC_UL320_.jpg","4.3","6379","22.99","230"
"B0C2JGHZN7","Skip Hop Press & Spin Baby Toy, Farmstand What's Poppin Corn Spinner","https://m.media-amazon.com/images/I/61dowRfZsyL._AC_UL320_.jpg","4.8","11","15.99","230"
"B0C5Y1DWS1","Cosaway Baby Bath Toys 6 to 12-18 Months, Stackable Floating Boat Toys for Toddlers, 6Packs","https://m.media-amazon.com/images/I/71tNFxCiXlL._AC_UL320_.jpg","4.6","7","7.99","230"
"B095SMT222","ibwaae Wooden Peg Board Beads Game Color Sorting Toys Counting Matching Game Bead Counting Fine Motor Skill Montessori Toys for Toddlers (Rainbow)","https://m.media-amazon.com/images/I/710ijOd2uUS._AC_UL320_.jpg","4.6","577","19.99","230"
"B09ST91XF3","JOCHA Color Sorting and Counting Animals Toys for Toddlers 3 5 4 Years Old Preschool Matching Learning Educational Game Montessori Sensorys Math Classification Activities Toys for Kids Boys Girls","https://m.media-amazon.com/images/I/61S1nYJQpSL._AC_UL320_.jpg","4.7","303","9.99","230"
"B083M9V96S","Kicko Assorted Rubber Ducks with Mesh Bag - 50 Ducklings, 2 Inch - for Kids, Sensory Play, Stress Relief, Novelty, Stocking Stuffers, Classroom Prizes, Decorations, Supplies, Holidays, Pinata Fillers","https://m.media-amazon.com/images/I/81IfVxcUz7L._AC_UL320_.jpg","4.7","2475","31.99","230"
"B0937443N5","SUPER JOY 3 in 1 Baby Walker,Sit to Stand Learning Walkers & Removable Play Panel, Kids Early Activity Center with Lights & Sounds, Music Learning Play Toys Gift for Infant Boys Girls","https://m.media-amazon.com/images/I/71zmkFgjtoS._AC_UL320_.jpg","4.6","484","39.99","230"
"B07BF1H6K7","Battat – Sensory Toys – Pretend Phone & Keychain – Toddler Light-Up Phone – Toy Car Keys & Phone – 18 Months + – Light & Sound Phone + Light & Sound Keys","https://m.media-amazon.com/images/I/7197ZeHDuXL._AC_UL320_.jpg","4.6","4372","14.2","230"
"B0BQ8KPKSV","Learning Resources Snap-n-Learn Surprise Squirrels, 15 Pieces, Ages 18 Months+, Fine Motor Skills Toys, Colors and Numbers Recognition, Learning & Education Toys, Baby and Toddler Toys","https://m.media-amazon.com/images/I/71w0DyBb7BL._AC_UL320_.jpg","4.7","1578","15.99","230"
"B0773P3FG8","Baby Teething Mitten Panda Hand Teether Soothing Glove, Teething Toy with Crinkle Sound, Multi Textured Wearable Teether to Soothe Sore and Swollen Gums, for Infants 3-12M (1 Pair)","https://m.media-amazon.com/images/I/910ABaQJVYL._AC_UL320_.jpg","4.4","1130","10.99","230"
"B0831N8PWL","Baby Teething Toys 6 Packs BPA Free Silicone Baby Teethers, Freezer Safe Organic Infant Teething Toys Soft & Textured for Natural Brain Development","https://m.media-amazon.com/images/I/61vKNY7gqEL._AC_UL320_.jpg","4.7","1429","8.99","230"
"B0BR7JV96M","DFGEE Montessori Toys for 1 2 3 4 Year Old Boys & Girls Gifts, Toddler Travel Toys Sensory Fine Motor Skills Learning Educational Activities, Christmas Birthday Gift for Baby Boys Girls Age 18 Months","https://m.media-amazon.com/images/I/618S28RGx-L._AC_UL320_.jpg","3.9","295","8.99","230"
"B08L1S9QRL","Bath Duck Toys 15PCS Mini Rubber Ducks Squeak and Float Ducks Baby Shower Toy for Toddlers Boys Girls (2.2’’)","https://m.media-amazon.com/images/I/51XOk2A8qcL._AC_UL320_.jpg","4.7","1026","5.89","230"
"B0C85SBJXC","Toddler Busy Board Toys with LED Light Switch, Montessori Busy Board Toys with Sounds Buttons, Wooden Sensory Toys Busy Toys Travel Toys for Kids Activities for 3+ Year Old Boys & Girls Gifts","https://m.media-amazon.com/images/I/81RVNjLyEtL._AC_UL320_.jpg","4.3","137","30.99","230"
"B085RKYJ9X","QZMTOY Wooden Peg Board Beads Game, Puzzle Color Sorting Stacking Art Toys for Toddlers, Counting Toy for Kids, Toddler Educational Montessori Games for Math Learning, Great Gift for Girls and Boys","https://m.media-amazon.com/images/I/71j+AHJXGFL._AC_UL320_.jpg","4.6","676","18.99","230"
"B08T377MX5","Skip Hop Developmental Learning Crawl Toy Beetbox, Farmstand Grow & Play","https://m.media-amazon.com/images/I/71h3hc1z7aL._AC_UL320_.jpg","4.5","1306","9.99","230"
"B0C1C1PQ9N","Andywoo Teething Toys for Babies 0-6 Months 6-12 Months, Baby Teething Remote Control Teether Toys, Cell Phone Teether for Babies, Chew Toy for Baby, Silicone Sensory Baby Teethers Toys - Black","https://m.media-amazon.com/images/I/71VUSwJg8wL._AC_UL320_.jpg","4.7","107","8.99","230"
"B08CXH8ZHZ","Baby Silicone Teether,Sensory Chew Toys,BPA Free Soft and Effective Infant Teething Pain Relief Toys,Freezer Safe,Food Grade Silicone,Best Shower Gift for Boys and Girls (Cow)","https://m.media-amazon.com/images/I/41ZiQvwnf4L._AC_UL320_.jpg","4.7","520","6.98","230"
"B0C4CV9J79","Libima 100 Pcs Breast Cancer Rubber Duck Pink Ribbon Gifts Ducks Hope Faith Strength Courage Ducks Small Rubber Ducky Bath Toy for Breast Cancer Awareness Party (Pink, Rose Red)","https://m.media-amazon.com/images/I/71k9Z8tSgrL._AC_UL320_.jpg","5.0","6","24.99","230"
"B07G5LNZWP","VATOS Baby Toys for 1 Year Old Baby Hammer Toy - Light& Musical Toys for 12 to 18 Months up | Infant Toys Funny Baby Hammer Toddler Toys for 1 Year Old + | 12 Months + Baby","https://m.media-amazon.com/images/I/61hJQTLufLL._AC_UL320_.jpg","4.6","3753","14.99","230"
"B09H5VCZNY","Montessori Toys for Babies 6-12 Months 1 year old Shape Sorter Cause And Effect Toys for Toddlers 1-3 Color Sorting Sensory Bin Sensory Toys for 9-12-18 Months Stacking Toy for Boy Girl Birthday Gifts","https://m.media-amazon.com/images/I/71TBPXNc2YL._AC_UL320_.jpg","4.5","557","18.99","230"
"B0CBTKK1XN","NPET Halloween Baby Teething Toy for 3-12 Months, Halloween Cute Skull & Bat Themed Gifts Infant Teething Toy, Baby Theether Toy Holiday Gifts, Halloween Baby Teethers Toy Soft Silicone Baby Girl Boy","https://m.media-amazon.com/images/I/61IeKBXrfHL._AC_UL320_.jpg","4.4","19","7.99","230"
"B09NP8CD4R","Fisher-Price Linkimals Toddler Learning Toy Puzzlin’ Shapes Polar Bear with Interactive Lights & Music for Ages 18+ Months","https://m.media-amazon.com/images/I/61iHc2Y3o4L._AC_UL320_.jpg","4.8","329","17.79","230"
"B0CDBSCWF6","Montessori Busy Board - Toddler Toys Wooden Busy Board with LED Light Switch Toys Sensory Toys Travel Toys Toddler Busy Board Montessori Toys for 1 2 3 4 Year Old Baby Toddler Boy Girl","https://m.media-amazon.com/images/I/81SMaMY-hFL._AC_UL320_.jpg","4.8","68","24.98","230"
"B07W7CHK62","Tummy Time Water Play Mat - Activity Play Mat for Infants 3 6 9 Months - Sensory Baby Toy Gift for Girls and Boys","https://m.media-amazon.com/images/I/71itZXbBn3L._AC_UL320_.jpg","4.4","1127","9.97","230"
"B0C2TYHMW3","6 in 1 Baby Toys 6 to 12 Months, Montessori Toys for Babies 6-18 Months, Pull String Baby Teething Toys, Soft Stacking Blocks and Rings, Color Shape Bin Sensory Toys, Bath Toys for Infants Toddlers","https://m.media-amazon.com/images/I/71RgHGo+v9L._AC_UL320_.jpg","4.4","12","29.99","230"
"B09B9N59NN","FOPNETS Wooden Toys for 1 2 Year Old Boys Girls Activity Cube Gift Set Developmental Montessori Learning Educational Toys for Toddlers Removable Bead Maze Shape Sorter 6 in 1 First Birthday Gifts","https://m.media-amazon.com/images/I/71L3m4cOm-L._AC_UL320_.jpg","4.5","671","65.11","230"
"B083PLB6LS","Shape Sorter Truck","https://m.media-amazon.com/images/I/51ojYYJRmBL._AC_UL320_.jpg","4.8","581","18.89","230"
"B0C6ZWP6YN","BIGSPINACH Halloween Baby Toy Gothic Baby Teether Ring Baby Stuff Teething Toy (Bat)","https://m.media-amazon.com/images/I/61QbGe+20oL._AC_UL320_.jpg","4.8","33","6.99","230"
"0692164308","Bao Bao Learns Chinese Vol. 1 | Musical Chinese Book & Bilingual Toy Gift for Babies & Toddlers; Learn Chinese Nursery Rhymes for Kids; Mandarin Chinese Board Book for Learning Chinese","https://m.media-amazon.com/images/I/719Mj3AQSML._AC_UL320_.jpg","4.8","1504","24.99","230"
"B07J287SHF","BabyNoms ® Teething Mitten | The Original Teething Paw | Safe Silicone Teething Toys or Teething Ring Provides Self-Soothing Teething Relief | Pink Teether","https://m.media-amazon.com/images/I/71gXsdbN2eL._AC_UL320_.jpg","4.3","780","13.99","230"
"B07WT49RSK","2 Rolls 2in x 150ft Baby Shower Measuring Tape Tummy Measure Belly Game for Baby Shower Party Supplies","https://m.media-amazon.com/images/I/71+rts0FRfL._AC_UL320_.jpg","4.7","2465","6.99","230"
"B08V54C4CF","Nippii Freezable Teething Pacifier Ice Cube Tray Refills","https://m.media-amazon.com/images/I/71uVVEFtu4L._AC_UL320_.jpg","4.6","444","9.99","230"
"B0BFFQ3QCN","Nuby All Silicone Pumpkin & Chocolate Bar Teether – 2 Pack, 3+ Months","https://m.media-amazon.com/images/I/61hAbliK7UL._AC_UL320_.jpg","4.9","32","9.99","230"
"B0BRYX2D2F","LeapFrog Spin and Change Apple Shape Sorter","https://m.media-amazon.com/images/I/61Kf4r1XKaL._AC_UL320_.jpg","4.6","31","12.99","230"
"B0BZ4K8B65","2 in 1 Baby Walker, Sit-to-Stand Learning Walker, Early Educational Child Activity Center, Multifunctional Removable Play Panel, Baby Music Learning Baby Walker Toys for 1 Year Old Girls Boys,Blue","https://m.media-amazon.com/images/I/61x6SpqJeRL._AC_UL320_.jpg","5.0","6","31.99","230"
