"asin","title","imgUrl","stars","reviews","price","category_id"
"B0BBG295GW","40 Pcs Christmas Reindeer Craft Kit for Kids Christmas Arts and Crafts DIY Christmas Tree Ornament Kit Make Your Own Xmas Reindeer Christmas Decoration Self Adhesive Sticker Sheets for Tree Decoration","https://m.media-amazon.com/images/I/7197BfiE-GL._AC_UL320_.jpg","4.4","14","11.99","219"
"B0BCXG7G4F","Sonic The Hedgehog 2 - Mini Stickerland Pad (6-Page)","https://m.media-amazon.com/images/I/71s-WHb7nUL._AC_UL320_.jpg","4.3","12","5.13","219"
"B01BYTGUA4","Dinotrux Coloring Book Set with Over 40 Stickers and Jumbo Toddler Crayons","https://m.media-amazon.com/images/I/71f6xX6c+hL._AC_UL320_.jpg","4.6","184","7.95","219"
"B006GE7JI0","7"" Loops, Makes Two POTHOLDERS - Blue","https://m.media-amazon.com/images/I/71XIxPGH4UL._AC_UL320_.jpg","4.6","188","11.95","219"
"B07CVTRW7T","BBTO 20 Pieces Stackable Crayons for Kids Buildable Rainbow Glitter Crayon 20 in 1 Stacking Point Crayons for Drawing Learning and Art Class Supplies, 4 Shell Colors","https://m.media-amazon.com/images/I/81-kbMlYpYL._AC_UL320_.jpg","3.8","285","13.99","219"
"B0BJTKP77L","WATINC 24pcs Mardi Gras Halloween Scratch Masks for Kids, Carnival Prom Rainbow Art Craft Kit, Masquerade Party DIY Magic Color Scratch Paper Mask, Costumes Dress Up Scratch Off Cards Supplies","https://m.media-amazon.com/images/I/81sD-uuDy0L._AC_UL320_.jpg","4.3","6","11.99","219"
"B00MFZPYX6","Beadery Handy Wonder Loom, Lime","https://m.media-amazon.com/images/I/91W17Yvn40L._AC_UL320_.jpg","4.6","449","14.0","219"
"B09D7YBF99","50 Pcs Daisy Stickers for Water Bottles Cute Vsco Trendy Chrysanthemum Stickers for Hydroflask Laptop Water Bottles Skateboard Phone,Motivational Stickers for Boys Girls Teens Adults","https://m.media-amazon.com/images/I/71PyazsTZfL._AC_UL320_.jpg","4.5","55","5.97","219"
"B01N4FIGJV","SmileMakers Rachael Hale Cats Stickers - 100 Per Pack","https://m.media-amazon.com/images/I/71ub6tJjIcL._AC_UL320_.jpg","4.8","39","11.26","219"
"B08HVW5P1G","Land of Dough - All Natural 7 oz. Handcrafted Modeling Dough - Treasure Island, X Marks The Spot for Glittering Gold! - Soft Feel, Calming Scent & Whimsical Design - Eco-Friendly Reusable Container","https://m.media-amazon.com/images/I/71GMuxCaFrS._AC_UL320_.jpg","4.4","8","14.95","219"
"B09CLPJ94K","Finding Dory Finding Nemo Party Supplies Favor Bundle Pack Includes Loot Bags, Pencils, Tattoos, Stickers","https://m.media-amazon.com/images/I/81IapZO9WzL._AC_UL320_.jpg","4.7","44","19.99","219"
"B0B5D5CGS3","38 Pcs Pin The Shield on The Fireman Party Games, Fire Truck Party Games Poster with Blindfolds and Stickers for Kids Firefighter Birthday Theme Party Decorations Supplies","https://m.media-amazon.com/images/I/81+7stkX0YL._AC_UL320_.jpg","4.2","19","11.99","219"
"B0B3ZP24M8","Nature's Way Bird Products DIY First Butterfly Garden House, Wood","https://m.media-amazon.com/images/I/71hp5hUeFaL._AC_UL320_.jpg","4.6","10","14.98","219"
"B0C49R2VSW","36 Pack Make Your Own Baby Yoda Party Toy Stickers Yoda Theme Birthday Party Favors Decoration Supplies(Yoda)","https://m.media-amazon.com/images/I/815UyyqzrtL._AC_UL320_.jpg","5.0","6","13.99","219"
"B0BN54QCSK","GemZono 4 Pack Paint by Numbers for Kids Colorful Unicorn DIY Oil Painting by Number Kits on Canvas for Kids Beginner Home Wall Decor Arts (7.8 x 7.8 inch/ 20 * 20 cm)","https://m.media-amazon.com/images/I/71mdl+CtLnL._AC_UL320_.jpg","4.4","30","8.99","219"
"B0025YT9SS","Art 101 USA Budding Artist 154 Pc Junior Artist Trifold Easel Set, Includes markers, crayons, oil pastels, watercolor paints, and colored pencils, Case, pop up easel, Portable Art Studio , White","https://m.media-amazon.com/images/I/91sz2OGxffL._AC_UL320_.jpg","4.7","3222","26.44","219"
"B0BX99S1LK","100Pcs Cute Rabbit Stickers Bunny Sticker Vinyl Waterproof Stickers for Teens Adults Decals for Loptop Water Bottles Skateboard Phone (Rabbit)","https://m.media-amazon.com/images/I/81RPyZOeZtL._AC_UL320_.jpg","4.4","30","7.99","219"
"B00DCH980Q","Harrisville Designs Friendly Loom Potholder Cotton Loops 10 Inch Pro Size Loops Make 2 Potholders, Weaving Crafts for Kids and Adults - Yellow","https://m.media-amazon.com/images/I/71m2-tWy4jL._AC_UL320_.jpg","4.8","162","16.99","219"
"B006GEQSUU","7"" Loops, Makes Two POTHOLDERS - Peacock","https://m.media-amazon.com/images/I/81hkWg9RfzL._AC_UL320_.jpg","4.8","66","11.95","219"
"B0BW3WNVS5","PERFECTSIGHT Cute 5D Diamond Painting Kits,4 Pack Cartoon DIY Painting Art for Kids Ages 4-8,Diamond Arts and Crafts Sets - Big Gem Full Drill Diamond Dots for Girls Boys Children Ages 8-12 (A)","https://m.media-amazon.com/images/I/81ZT95t5ghL._AC_UL320_.jpg","4.9","15","13.99","219"
"B0B6RPRNH4","50Pcs Cute Dolphin Stickers,Ocean Whale Animal Waterproof Stickers for Laptop,Bumper,Skateboard,Water Bottles,Phone,Vinyl Stickers for Kids Teens (Dolphins)","https://m.media-amazon.com/images/I/81bNnVpJpIL._AC_UL320_.jpg","4.8","77","5.79","219"
"B0B49SWB64","50 Count of 2"" Round A Little Butterfly is On The Way Stickers Butterfly Stickers for Baby Shower Party Girls Birthday Party","https://m.media-amazon.com/images/I/71O1DRshh9L._AC_UL320_.jpg","4.8","21","6.98","219"
"B07NN3CMDB","imnext2u 3D Puffy Stickers for Kids Reusable Car Sticker for Toddler, Boys, Girls includes Truck Construction Tractor - 4 Sheets (Vehicle)","https://m.media-amazon.com/images/I/71CID0nPjwL._AC_UL320_.jpg","4.5","216","8.99","219"
"B0B57JW347","LIVTEK4LYFE Disposable Kids Aprons - Kids Aprons Bulk - Kids Cooking Aprons - Kids Painting Aprons -Kids White Plastic Aprons for Kids - 50 Count Pack Science Lab Aprons…","https://m.media-amazon.com/images/I/51sHKyqhf1L._AC_UL320_.jpg","4.1","13","15.49","219"
"B07S1ST582","Lebze Large Crayons for Kids Age 2-4, 12 Colors Non Toxic Toddler Crayons Ages 1-3, Easy to Hold Washable Toddler Crayons, Safe for Babies, Kids Ages 2-4 and Children Flower Monaco","https://m.media-amazon.com/images/I/61xxRJXevVL._AC_UL320_.jpg","4.5","576","10.9","219"
"B0B99R3NBR","Happy makers Bead Pets, Pony Beads Kit Multicolor Pony Beads Animals Keychain Kit with Instruction, Keyring & Key Clasp, Made Ultimate Bead Pets Bead Keychain Kit, Art Craft Toys for Kids Beginners","https://m.media-amazon.com/images/I/81RvBiioRiL._AC_UL320_.jpg","4.0","72","18.99","219"
"B07ZYCB7S2","Play-Doh Kitchen Creations Candy Delight Playset for Kids 3 Years and Up with 5 Cans, Non-Toxic","https://m.media-amazon.com/images/I/61PO1JRxX-L._AC_UL320_.jpg","4.6","9538","29.43","219"
"B08DHT4Y69","60 Pieces Halloween Foam Pumpkin Craft Kit Foam Pumpkin Shapes Decorating Craft Kit for Halloween Kids Craft Party Decorations","https://m.media-amazon.com/images/I/71-CGfNQyvL._AC_UL320_.jpg","4.2","28","19.99","219"
"B084ZQK15Y","Crayola Eraser Maker, DIY Craft Kit, Gift for Kids, 8, 9, 10, 11","https://m.media-amazon.com/images/I/91kZvIAyaIL._AC_UL320_.jpg","4.4","38","18.39","219"
"B0BQ9QY92D","8 Pcs 12 Inch LCD Writing Tablet for Kids Bulk Doodle Board Colorful Doodle Pad Writing Board Electronic Drawing Tablet for Kids Toddlers Learning Birthday Day Gifts for Girls Boys (White Trim)","https://m.media-amazon.com/images/I/81UFKUSD05L._AC_UL320_.jpg","4.8","22","35.99","219"
"B09ZDZVZF8","50 Pcs Doctor Stickers, Medical Equipment Stickers, Doctor Appreciation Gifts","https://m.media-amazon.com/images/I/81DtLZ2XGBL._AC_UL320_.jpg","4.8","39","5.99","219"
"B07NPHG8J1","Disney Magic Ink Coloring Book Set for Girls Toddlers Kids - Bundle of 3 Imagine Ink Books Featuring Disney Junior Vampirina, Puppy Dog Pals, and Nella The Princess Knight with Invisible Ink Pens","https://m.media-amazon.com/images/I/71-qthwNh5L._AC_UL320_.jpg","4.5","178","14.95","219"
"B07HJDKBGG","Halloween Owl Stickers / 8 Alternating Halloween Designs / 500 Halloween Stickers","https://m.media-amazon.com/images/I/71Q6eekoY7L._AC_UL320_.jpg","4.5","23","11.99","219"
"B0B2NFKXX8","FANCY LAND Halloween Assorted Stamps for Kids Self-Ink Stampers for Party Favor Prizes 50Pcs","https://m.media-amazon.com/images/I/81Cksc3JJ+L._AC_UL320_.jpg","4.6","5","8.99","219"
"B0873CT6XT","I Washed My Hands Sticker / 250 Kids Stickers/Children Reward 2"" Stickers","https://m.media-amazon.com/images/I/81ACnPKUsUL._AC_UL320_.jpg","4.9","33","11.5","219"
"B07RS579L5","Fun Express Baby Moses Floating Craft Kit - Makes 12 - Religious Crafts for Kids and Sunday School Activities","https://m.media-amazon.com/images/I/717NBk5GUrL._AC_UL320_.jpg","4.8","19","9.99","219"
"B07FTY119V","Turkey Talk Stickers- Set of 60 Kids Thanksgiving and Fall Holiday Stickers, Pumpkins, Pilgrams Sticker Activity","https://m.media-amazon.com/images/I/511oV9UkoeL._AC_UL320_.jpg","4.6","102","5.99","219"
"B0BBK8WXH3","Cra-Z-Art CRA-Z-Sand Make and Create Bakery Set","https://m.media-amazon.com/images/I/91Q4QpAjzHL._AC_UL320_.jpg","4.3","29","23.55","219"
"B0BKPZV28L","Tongjoy 4FT Mosaic Letters for Balloons, Mosaic Balloon Frame, DIY Marquee Light Up Letters, Large Giant Letters for Birthday Engagement Party Decorations Wedding Backdrop, Balloon Arch Kit, Letter S","https://m.media-amazon.com/images/I/71jXstLKQKL._AC_UL320_.jpg","3.7","61","29.99","219"
"B0BZ3NX3Y1","Motorcycle Erasers for Kids, 18Pcs 3D Mini Motorbike Vehicle Puzzle Take Apart Erasers for Party Favors Classroom Rewards","https://m.media-amazon.com/images/I/71deNZxsjpL._AC_UL320_.jpg","4.6","5","7.99","219"
"B0C83B9F71","Zugar Land Huge 42"" Neon Color Inflatable Crayons (Set of 4 Colors) Jumbo-Sized Blow-Up Inflate Decoration Giant Prop For Birthday Party (1 Set (4 Pack))","https://m.media-amazon.com/images/I/61Ay5kOXP0L._AC_UL320_.jpg","4.7","7","10.99","219"
"B0BL5RBXRV","Aqua Gelz™ 3D Magic Gel | Create Soft Figures | Craft Kit | Unique Arts & Crafts for Kids | Squishy Maker Machine | Water Toys | Kid Toys for Girls Boys | Make Your Own Squishies (Core Deluxe Playset)","https://m.media-amazon.com/images/I/61N6++9fIbL._AC_UL320_.jpg","3.9","22","29.99","219"
"B08Y8RBMRM","50000PCS Non-Toxic Water Beads Kit Includes 50 Large Jumbo Water beads, 1 Hollowed-Out Spoon,2 Funnels,1 Spatula for Tactile Sensory Toys,1 Spoon，5 Balloons,1 Mesh Bag,Vases，Plant and Home Décor","https://m.media-amazon.com/images/I/81b0FrOVZ9L._AC_UL320_.jpg","4.5","336","9.99","219"
"B0B6VBBXS5","MIAHART Pin The Tongue on The Ghost Game Halloween Game for Kids Halloween Party Supplies Holiday Home Wall Decorations School Party Favors Activities","https://m.media-amazon.com/images/I/71Lz+kIDddL._AC_UL320_.jpg","3.9","9","5.98","219"
"B084P5CQS4","Gejoy 40 Pieces Wild Animal Stampers Multicolor Jungle Safari Animals Stamps Self-Ink Stampers for Party Supplies (Classic Style)","https://m.media-amazon.com/images/I/81GIAJSZ6LL._AC_UL320_.jpg","4.1","290","13.99","219"
"B08DKFTGH1","Halloweens Pumpkins Stickers Roll 1,000 Pieces 8 Fces Stickers for Jack O Lantern Trick or Treat Indoor Art Crafts Scrapbooking Thanksgiving Seasonal Decor Party Decorations Decals - 1.5x1.5 inchi","https://m.media-amazon.com/images/I/71JUaWr2YRL._AC_UL320_.jpg","4.6","93","9.99","219"
"B01M0YBR3V","Fun Express Nativity Craft Stick Ornament Craft Kit - Makes 12 - Christmas Crafts for Kids","https://m.media-amazon.com/images/I/61rQMNIQzPL._AC_UL320_.jpg","4.3","132","9.9","219"
"B08QZRK4H2","Play-Doh Wheels Tractor Farm Truck Toy for Kids 3 Years and Up with Horse Trailer Mold and 3 Cans of Non-Toxic Modeling Compound","https://m.media-amazon.com/images/I/51UbOtmaddL._AC_UL320_.jpg","4.6","782","9.99","219"
"B0BNQ8CSL4","Mini Watercolor Paint Sets 12 Colors Watercolor with 3 x 3'' Painting Canvas Panel with Wooden Easel Set Stretched Canvas Display Easel Painting Brush Kit for Kids School Art Party Favors (24 Pcs)","https://m.media-amazon.com/images/I/71US-pZTUyL._AC_UL320_.jpg","3.9","32","24.59","219"
"B083B2S4ZM","Craft-tastic DIY Wall Collage – Craft Kit – Personalize Your Space with Inspiring Quotes, Pre-cut Designs & Pictures","https://m.media-amazon.com/images/I/61FFeHaaRmL._AC_UL320_.jpg","4.6","569","27.44","219"
"B08YYWY614","Bear Gender Reveal Stickers, 40 2 Inch Team Girl Team Boy Baby Shower Party Sticker Labels","https://m.media-amazon.com/images/I/719V-2o4HbL._AC_UL320_.jpg","4.6","73","10.99","219"
"B0BGPDJB8J","FLYAB Make a Nativity Scene Stickers Ornament Craft Kit Christian DIY Nativity Stickers for Kids Religious Party Games Activities for Christmas Vacation Bible School Classroom Party Supplies","https://m.media-amazon.com/images/I/81EXpN67dkL._AC_UL320_.jpg","4.5","17","9.99","219"
"B0BDDYY6P8","SAVORI Diamond Painting Stickers for Kids Gem Painting Kit Diamond Art Kits for Girls Boys Flower and Vase","https://m.media-amazon.com/images/I/81IhQY3iQWL._AC_UL320_.jpg","4.5","64","6.99","219"
"B07BMJD536","EvolveFISH Destroy The Patriarchy Not The Planet Bumper Sticker - [11"" x 3""]","https://m.media-amazon.com/images/I/61NvnvElTQL._AC_UL320_.jpg","4.7","351","7.99","219"
"B09LH3TJJV","ELTNEGSA Children's Artists Aprons,Cooking Painting Gardening Baking Baby Toddler Bib Aprons¡­","https://m.media-amazon.com/images/I/510ITTAzZWL._AC_UL320_.jpg","4.8","80","8.99","219"
"B0BPP4QH2G","Ainrvteers Calm Stickers for Anxiety Sensory Stickers Textured Strips Anti Stress Textured Strips Combined with Breathing for Tension Tactile Gradient Ramp Stickers (10 Pierces) (Blue Gradient)","https://m.media-amazon.com/images/I/71GN4GQhvuL._AC_UL320_.jpg","4.3","77","7.99","219"
"B08MY199GP","50 Pack The Grinch stickers","https://m.media-amazon.com/images/I/81+XWAPjitL._AC_UL320_.jpg","4.3","115","5.99","219"
"B0BKWNCTJS","50Pcs Fallout Stickers Pack, Cute Cool Game Vinyl Waterproof Decals for Water Bottle, Laptop, Phone, Scrapbook, Journal, Bumper Gifts for Kids Teens Adults","https://m.media-amazon.com/images/I/71NPQ2indzL._AC_UL320_.jpg","4.5","44","6.99","219"
"B0BS8MY417","hand2mind Create Your Play Sensory Tray, Loose Parts Play, Fine Motor Skills Toys for 3 Year Old, Scissor Skills, Occupational Therapy Tools, Sensory Trays with Lids, Preschool Learning Activities","https://m.media-amazon.com/images/I/81vd9OuyRnL._AC_UL320_.jpg","4.4","118","24.49","219"
"B0B5RLL2ZZ","107 Pcs Wooden Birdhouse DIY Kits, Includes 21 Unfinished Wood Mini Bird House 24 Watercolor Pen 50 Bird Butterfly Flower Slices 12 Cute Animal Stickers for Kids Adults DIY Craft Making Supplies","https://m.media-amazon.com/images/I/813XYKEs34L._AC_UL320_.jpg","4.2","10","30.99","219"
"B00N785Z66","Just For Laughs Dr. Stinky's Scratch n Sniff Stickers 15 Pack- Fish, Cow, Campfire, Zombie, Wet Dog, Garbage, Bacon, Hot Wings, Smelly Cheese, Race Car, Black2","https://m.media-amazon.com/images/I/71WN2bq-zxL._AC_UL320_.jpg","4.5","124","25.49","219"
"B00DCH6TU8","Harrisville Designs Friendly Loom Potholder Cotton Loops 10 Inch Pro Size Loops Make 2 Potholders, Weaving Crafts for Kids and Adults-Lime","https://m.media-amazon.com/images/I/81Uezq0Lj6L._AC_UL320_.jpg","4.8","129","16.99","219"
"B00HROWNZM","Stamps by Impression Happy Halloween Rubber Stamp","https://m.media-amazon.com/images/I/416Ju2C08gL._AC_UL320_.jpg","4.7","36","9.99","219"
"B099QP88LQ","8 Pack Halloween Crafts Kits for Kids Halloween Arts and Crafts Supplies Halloween Toys Monster DIY Assorted Pumpkins Frankenstein","https://m.media-amazon.com/images/I/71v9zieQyiL._AC_UL320_.jpg","4.3","67","12.99","219"
"B0C6KD2Z9T","Reusable Fire Truck Sticker Book for Toddlers and Kids | Ages 2-4, 3-5 | Fire Rescue Stickers Activity for Boys and Girls 1-3,4-8 | Quiet Busy | Road Trip Car Airplane Travel Essentials.","https://m.media-amazon.com/images/I/71KLvrlVfcL._AC_UL320_.jpg","3.8","7","6.99","219"
"B005EGKXD4","Fun Express Bulk Crayon Packs (48 boxes of 6 colors) Daycare, Party Favors and School Supplies","https://m.media-amazon.com/images/I/71yF-KoB1EL._AC_UL320_.jpg","4.6","183","19.99","219"
"B000EB55RS","Crayola Pip-Squeaks Mini Washable Felt Tip Colouring Pens, Pack of 14 - Ideal for Little Fingers","https://m.media-amazon.com/images/I/81zZpNhEU+L._AC_UL320_.jpg","4.7","4777","11.11","219"
"B07TYCNZ3M","AUGSUN Halloween Mask Crafts, 42pcs Halloween Rainbow Scratch Masks Crafts for Kids Magic Scratch Paper Art Mask for Halloween Party","https://m.media-amazon.com/images/I/71W19yV64zL._AC_UL320_.jpg","4.6","224","13.99","219"
"B09QYP3GS7","Svance 5D Diamond Art for Kids - 30Pcs Mermaid Diamond Painting Stickers Gem Art Diamond Painting Kits Diamond Paint by Numbers Arts and Crafts for Girls Ages 6-8-12","https://m.media-amazon.com/images/I/81C+UDmFA4L._AC_UL320_.jpg","4.6","150","9.77","219"
"B008F9UCPG","Owl Stampers Set (24 pack)","https://m.media-amazon.com/images/I/81ItIcTLwrL._AC_UL320_.jpg","4.5","139","9.99","219"
"B097MQSTPY","Lucleag Halloween Scratch Art Paper Crafts Kit, 36 Pieces Rainbow Halloween Pumpkins for Halloween Decoration Halloween Colorful DIY Pumpkins Ornaments for Kids, Include 36 Ribbons and 24 Sticks","https://m.media-amazon.com/images/I/61qBIVWJlfL._AC_UL320_.jpg","4.5","10","8.99","219"
"B09WW2WSWX","50Pcs Ball Sports Stickers, Cartoon Ball Games Stickers Pack for Sports Fan, Waterproof Vinyl Stickers Decals for Skateboard Laptop Water Bottle Phone Scrapbook Helmet (Basketball)","https://m.media-amazon.com/images/I/81IsU8IRKaL._AC_UL320_.jpg","4.1","18","6.99","219"
"B07348VPD2","Cars 3 Disney Self-Inking Stamps / Stampers Party Favors (10 Counts)","https://m.media-amazon.com/images/I/71+rN0MFL7L._AC_UL320_.jpg","4.6","103","7.99","219"
"B09Q5M8JD8","Primevolve LCD Writing Tablet for Kids, Doodle Board Gifts for Learning Sensory Toys-8.5 inch Drawing Board for Birthday, Colorful Drawing Tablet for Boys Girls Dinosaur Toys","https://m.media-amazon.com/images/I/71HNMiq2pqL._AC_UL320_.jpg","4.5","245","15.99","219"
"B01LNBMLQ0","KUUQA Waterproof Children's Art Smock Kids Painting Aprons with 3 Roomy Pockets,Art Painting Supplies (Paints and brushes not included)","https://m.media-amazon.com/images/I/61n0IhqmgrL._AC_UL320_.jpg","4.6","429","9.98","219"
"B0BXL141LY","B Bascolor Flower Crowns Craft Kit Floral Garland Handmade Arts and Crafts Making Kit DIY Fairy Flower Headbands and Bracelets Craft Kit Hair Accessories Gift for Kids Girls Women","https://m.media-amazon.com/images/I/81ByKkAsMaL._AC_UL320_.jpg","4.4","5","18.99","219"
"B071Y57GMM","Craft-tastic – I Love Mermaids Kit – Craft Kit Includes 6 Mermaid-Themed Projects","https://m.media-amazon.com/images/I/718jW8pvLXL._AC_UL320_.jpg","4.5","1058","19.98","219"
"B00A0LDG50","Conte Crayon 18 Box Set","https://m.media-amazon.com/images/I/71jW4eVXHUL._AC_UL320_.jpg","4.5","228","21.29","219"
"B09PZKGC92","Marvel Spidey and His Amazing Friends Stickers - 60 Spiderman Stickers Featuring Peter Parker, Miles Morales, and Gwen Stacy (Spiderman Party Supplies)","https://m.media-amazon.com/images/I/71RsSzOqdfL._AC_UL320_.jpg","4.5","75","6.99","219"
"B0BNXTXXHB","Horse Stickers for Water Bottles Laptop 100Pcs Cannity Western Stickers Bulk Horse Toys Gifts for Girls Women Cowboy Stickers Horse Party Favors Decorations","https://m.media-amazon.com/images/I/81VQ71LBhLL._AC_UL320_.jpg","4.9","13","5.99","219"
"B0B55Y3CDV","SPOKKI 25 PCS Paper Crown Golden Party Hats with 2208 Pieces Gem Stickers Jewels Stickers Rhinestone Numbers Crafts, Crown Party Making Kit and Crystal Stickers Self for Kids Adults","https://m.media-amazon.com/images/I/81kuK8bFpHL._AC_UL320_.jpg","4.7","26","12.99","219"
"1690211172","Disney Pixar 192-Page Coloring and Activity Book; Dory Nemo Toy Story Monsters Inc Inside Out Cars; Bendon 49935","https://m.media-amazon.com/images/I/61oaYB8nVSL._AC_UL320_.jpg","4.6","10","9.99","219"
"B00GKI0XAS","Harrisville Designs Friendly Loom Potholder Cotton Loops 10 Inch Pro Size Loops Make 2 Potholders, Weaving Crafts for Kids and Adults-Pink","https://m.media-amazon.com/images/I/81vSRYVOQcL._AC_UL320_.jpg","4.8","30","16.99","219"
"B09L3YHDW9","YOFUN Make Your Own Unicorn Snow Globe, Unicorn Craft Kit for Kids, Water Globe Making Kit with Rainbow Lights & Music, Unicorn Gifts for Girls, Unicorn Toys for 5 6 7 8 9 10 Year Old Girl Gifts","https://m.media-amazon.com/images/I/81LJKKXIaML._AC_UL320_.jpg","4.2","281","22.96","219"
"B07PP8GH4J","Crayola Sketchbook 9""X9"", 40 Sheets, 6 Pack","https://m.media-amazon.com/images/I/91vvH8PfZtL._AC_UL320_.jpg","4.7","56","20.98","219"
"B09BNZYGZ3","HTTYD How to Train Your Dragon Ultimate Party Favors Packs -- 12 Sets with Stickers, Coloring Books and More (Party Supplies)","https://m.media-amazon.com/images/I/81Ex383eMKL._AC_UL320_.jpg","4.8","34","26.95","219"
"B072MHQZT1","Elmer's Liquid School Glue, White, Washable, 16 Ounces - Great for Making Slime","https://m.media-amazon.com/images/I/51bu4W7E3TL._AC_UL320_.jpg","4.6","233","11.75","219"
"B0BZ496VXF","20PCS Water Bottle Labels hello cat kity Birthday Party Supplies The me Party Supplies Stickers Decorations for Kids Birthday Party Favors","https://m.media-amazon.com/images/I/51g-pvINyQL._AC_UL320_.jpg","4.3","9","9.99","219"
"B09C8CPRV9","Nativity Stickers Make a Nativity Scene Sticker Jesus Birth Stickers Religious Sticker Mix Match Decal for Christmas Party Favor Holiday Religious Education Present Supplies (36 Sheets)","https://m.media-amazon.com/images/I/818fdqd3-YL._AC_UL320_.jpg","4.7","77","8.99","219"
"1505077338","My Little Pony 48-Page Coloring and Activity Book with 50 Jewel Stickers, 45774 Bendon","https://m.media-amazon.com/images/I/91PdjK6dY9L._AC_UL320_.jpg","4.3","83","6.99","219"
"B076HZ5PNH","Number 1 in Gadgets Paint Your Own Tea Set for Kids, Decorate Your Own 11 Piece Craft Set of Porcelain Dishes, Includes Six Paint Pots and Paint Brush","https://m.media-amazon.com/images/I/81JZLDUooCL._AC_UL320_.jpg","4.3","326","16.95","219"
"B096FHB8XT","30 Pieces Animal Stampers for Kids Dinosaur Ocean Life and Zoo Animal Stampers Self Inking Stamps for Kids Birthday Gift, Party Supplies, Teacher Stamps","https://m.media-amazon.com/images/I/81yZK0LDCxS._AC_UL320_.jpg","4.1","74","10.99","219"
"B08NPM9F4J","PROLOSO 15 Pcs Puzzle Cube Pencil Erasers Kids Party Favors Classroom Student Prizes Brain Teasers","https://m.media-amazon.com/images/I/81qBzgqyOGL._AC_UL320_.jpg","4.5","20","12.99","219"
"B0C8N16WSG","EMUFOOK 200pcs DIY Kids Sunglasses Making Kit Kids Birthday Gifts for 5-12 Year Old Girls Flower Sunglasses with Daisy Letter Candy Beads Party Favors Arts and Crafts for Kids Ages 5 6 7 8 9 10 11 12","https://m.media-amazon.com/images/I/81vVtmZDL0L._AC_UL320_.jpg","4.5","9","19.99","219"
"B07HBP9NQ1","Playhouse Rainbow Unicorns Micro Mini Sticker Sheet - 1 Pack","https://m.media-amazon.com/images/I/61SbE8mVb9L._AC_UL320_.jpg","4.6","46","6.45","219"
"B0B636F6G7","KINBOM 100pcs Kids Stickers, Transportation Vehicle Stickers Vehicles Puffy Stickers Car Stickers Truck Stickers Transportation Stickers for Children DIY Crafts Party Supplies (Airplane, Train, Helico","https://m.media-amazon.com/images/I/81E7MSDRJlL._AC_UL320_.jpg","4.5","7","6.79","219"
"B09PNCNG8J","150PCS Camping Stickers for Water Bottles, Outdoor Adventure Stickers Vinyl Waterproof Stickers Packs Laptop Decals Travel Hiking Stickers for Bike Bumper Suitcase Luggage Car Wilderness Nature Decals","https://m.media-amazon.com/images/I/91lp2t1VD1L._AC_UL320_.jpg","4.6","403","7.89","219"
"B094C71C8L","500 Pieces Summer Stickers for Kids Hawaii Tropical Beach Label Decals Different Design Luau Summer Party Favors Decoration for Scrapbooking Bottles Computer Luggage","https://m.media-amazon.com/images/I/81PE3QtCbiS._AC_UL320_.jpg","4.5","92","5.99","219"
"B00YVB7PDY","HAPPY DEALS ~ Fireman Coloring Books with Crayons - 12 Sets Fire Fighter Party Favors","https://m.media-amazon.com/images/I/51AOhGcRUPL._AC_UL320_.jpg","4.3","73","9.95","219"
"B0B4NFNKQ6","Ynybusi 5 Pack Magnetic Drawing Board Party Favors for Kids 4-8，Mini Erasable Doodle Board Small Drawing Painting Sketch Pad，Kids Party Favors Supplies & Classroom Prizes & Birthday Gifts","https://m.media-amazon.com/images/I/717D3PRb+VL._AC_UL320_.jpg","4.2","33","15.99","219"
"B0B5N8XRQH","Glittery Garden Mosaic Craft Kit - Decorate Your Own Unicorn and Rainbow Design Coaster with Glass Tiles. Birthday Gift, Fun DIY Art and Craft Supplies. Girls, Kids & Teens Activity Kit","https://m.media-amazon.com/images/I/81looYC00HL._AC_UL320_.jpg","4.2","86","19.95","219"
"B00PPU9LG4","Make a Nativity Scene Sticker Sheets Religious Education - - Set of 24 - VBS Christmas Party Classroom Activity Favors","https://m.media-amazon.com/images/I/71uMdNWCWjL._AC_UL320_.jpg","4.6","541","7.49","219"
"B08C5FTY55","Alpha Chi Omega - Sticker Sheet - Girl Power","https://m.media-amazon.com/images/I/91DJdIDBIUL._AC_UL320_.jpg","4.7","18","11.99","219"
"B092R3PT2X","GET FRESH Scratch Off Lunch Notes for Kids – 50-pcs Scratch-Off lunch stickers for Children – Metallic Scratch-Off Stickers Set for Kids Lunch Box – Cute Shiny Scratch-off Shaped Bento Box Notes","https://m.media-amazon.com/images/I/71Pw3jpBR4L._AC_UL320_.jpg","4.5","94","5.99","219"
"B07FXP86B1","Oktoberfest - German Beer Festival Funny Name Tags - Party Badges Sticker Set of 12","https://m.media-amazon.com/images/I/81xZIiasHkS._AC_UL320_.jpg","4.3","11","12.99","219"
"B09L2FTFXH","(3-Pack) Oval Bumper Stickers, Fuck Biden and Fuck You for Voting for Him! (Anti Joe Biden Stickers), 6"" x 4"" Stickers","https://m.media-amazon.com/images/I/618D47OfO5L._AC_UL320_.jpg","4.8","55","7.99","219"
"B08N5HXL2M","Educational Insights Playfoam Putty 4-Pack, Fidget, Sensory Toy, Easter Basket Stuffers for Boys & Girls, Ages 3+","https://m.media-amazon.com/images/I/816qTvmVdhL._AC_UL320_.jpg","3.5","256","12.99","219"
"B01KB7B5PU","Shimmer and Shine Coloring Book Bundle Set -- 2 Books, Over 50 Stickers, Crayons and Licensed ""Little Princess"" Stickers (Shimmer and Shine Party Supplies)","https://m.media-amazon.com/images/I/71aNI+jprhL._AC_UL320_.jpg","4.4","82","9.95","219"
