"asin","title","imgUrl","stars","reviews","price","category_id"
"B07GPCXR9N","BASEMAN Wired Headphones with Microphone - Foldable Wired On-Ear Headphones for Laptops Computer Cellphone Tablet, Stereo Bass Headsets with 3.5mm Jack No-Tangle Cord for Boys Girls Women Men - Black","https://m.media-amazon.com/images/I/71L40sWlUvL._AC_UL320_.jpg","4.3","839","18.99","71"
"B073334616","CN-Outlet Wholesale Bulk Earbuds Headphones 100 Pack Kids Earphones for School Classroom Students Children and Adults - White","https://m.media-amazon.com/images/I/41XNOe9eztL._AC_UL320_.jpg","4.1","30","42.95","71"
"B015RWQAWC","TFD Supplies Wholesale Bulk Earbuds Headphones 50 Pack for iPhone, Android, MP3 Player - Black","https://m.media-amazon.com/images/I/81OSiO3ldhL._AC_UL320_.jpg","4.0","365","26.32","71"
"B08HHKKKCD","Bosttor Bluetooth Beanie Hat with Light, Headlamp Cap with Headphones and Built-in Speaker Mic, Gifts for Men Women Teen","https://m.media-amazon.com/images/I/71ogJOykTsL._AC_UL320_.jpg","4.5","2342","31.99","71"
"B00NLLKRVC","Yurbuds Signature Series ITX-1000 In-Ear Headphones","https://m.media-amazon.com/images/I/61J1Dd6zAvL._AC_UL320_.jpg","4.2","95","69.69","71"
"B08HMY1C6F","TOPEPOP Kids Headphones with Microphone On Ear Wired Headphone Volume Limit Earphones Headband Headsets 3.5mm Jack Headphones for Kids Children Boys Girls Online Learning School PC Tablet (White)","https://m.media-amazon.com/images/I/61MXt-bYsQL._AC_UL320_.jpg","4.3","327","14.99","71"
"B0B1HLHFKK","HTC Bluetooth Wireless Earbuds 2 Plus Touch Control Bluetooth 5.3 with USB-C Charging Case IPX4 Splashproof in-Ear Stereo Earbuds Bulit-in Microphones-White&Black","https://m.media-amazon.com/images/I/61hl2zVgpdL._AC_UL320_.jpg","4.5","851","29.99","71"
"B07BDQGSWW","Plantronics BackBeat GO 600 Noise-Isolating Headphones, Over-The-Ear Bluetooth Headphones, Navy (211139-99)","https://m.media-amazon.com/images/I/61yxUb8vdFL._AC_UL320_.jpg","4.2","1086","29.29","71"
"B0C65J8N4P","BORAYDA Bluetooth Headband, HD Stereo, Built-in Microphone, Workout, Running, Sports, Men/Women Gift","https://m.media-amazon.com/images/I/71BDtsnsTxL._AC_UL320_.jpg","4.5","36","22.99","71"
"B01I4JRBBE","Maxell 190319 Stereo Headphone, Black (Packaging May Vary)","https://m.media-amazon.com/images/I/81Khcj5O0nL._AC_UL320_.jpg","3.9","736","8.63","71"
"B0BHN8NZ4G","Sleep Headphones Bluetooth Headband Wireless - Upgraded Ergonomic ASMR Headphone Cool Gadget, Soft Sleeping Mask Music Sport Headband, Sleep headphones Gifts for Men Women Side Sleeper (Black)","https://m.media-amazon.com/images/I/81RUhcmtx7L._AC_UL320_.jpg","3.9","175","12.99","71"
"B0BL8VKXTT","AUOUA Life On Music Wireless Bluetooth Headphones with Mic, Over Ear Headset with Microphone for PC, Lightweight Wired Headphone for iPad PC Laptop, Black","https://m.media-amazon.com/images/I/710BGOaevDL._AC_UL320_.jpg","4.0","29","15.39","71"
"B0C7GKVW62","YQ77 Wireless Kids Headphones, Cute Cat Ear LED Light Up Foldable Over-Ear Bluetooth Headphones with Microphone for iPad/Smartphones/PC/Kindle/Tablet/Laptop, Best Gifts for Kids Teens Adults (Pink)","https://m.media-amazon.com/images/I/51S4rw3zcIL._AC_UL320_.jpg","3.9","8","16.99","71"
"B09YY82SZB","Link Dream Kids Bluetooth Headphones with Microphone for School On-Ear Headphone Toddler Children Wireless Headphone Headset with LED Lights Compatible with Cellphone/Computer/Tablet/iPad (Pink)","https://m.media-amazon.com/images/I/61YkSOv12xL._AC_UL320_.jpg","4.8","103","23.99","71"
"B016YHQGFK","Maxell 191569 Soft Rubber Body Comfort Fit Jelleez Soft Ear Buds Black With Built In Microphone","https://m.media-amazon.com/images/I/51bB43goJoL._AC_UL320_.jpg","3.9","82","6.99","71"
"B0BGYD1ZPD","Urbanista True Wireless Earbuds, Bluetooth 5.2 Earphones with Touch Controls & Noise Cancelling Microphone, 32 Hr Total Playtime, USB C Charging Case, IPX4 Water Resistant, Copenhagen, Midnight Black","https://m.media-amazon.com/images/I/51wtYz6cbIL._AC_UL320_.jpg","4.2","73","69.0","71"
"B06Y4MR1MB","Wicked Audio Bandido Wireless — Bluetooth Earbuds with Microphone and Track Control — Wireless Headset with Metal Housing, Loop and Fin Attachments and Enhanced Bass — Black","https://m.media-amazon.com/images/I/51nxjxVNuWL._AC_UL320_.jpg","4.1","77","29.99","71"
"B0B8X8DFZQ","Wireless Headphones for Side Sleepers Noise Cancelling Eye Mask Sports Adjustable Headband Headset with HD Stereo Speakers for Sleeping Workout Jogging Yoga Insomnia Air Travel Meditation","https://m.media-amazon.com/images/I/61YKgtB2FaL._AC_UL320_.jpg","4.2","15","9.99","71"
"B00WO2S38S","AiAiAi E02 PU Leather On Ear Earpads","https://m.media-amazon.com/images/I/81EKzNVaFlL._AC_UL320_.jpg","4.5","73","35.0","71"
"B09ZVH1TYZ","EPOS SENNHEISER C20 Bluetooth Headset with Microphone | Wireless Headphones with up to 27 Hours Battery Life BrainAdapt™ Technology,Black","https://m.media-amazon.com/images/I/615CdXXSJBL._AC_UL320_.jpg","4.3","31","184.16","71"
"B0BCXF1HVB","Cubitt True Wireless Earbuds Generation 2, 5.3 Bluetooth, IPX5 Water reistance, Premium Sound, Touch Control, Built in Microphone, Voice Assistance, Game Mode for Men and Women (Black)","https://m.media-amazon.com/images/I/51Lou7A8h+L._AC_UL320_.jpg","4.6","17","34.95","71"
"B0BL73CF6M","Soundcore by Anker Life Note 3S True Wireless Earbuds, Powerful Sound, 4 Mics for Clear Calls, Superior Comfort, Wireless Charging, 35H Playtime with Fast Charging, Soundcore App (Renewed)","https://m.media-amazon.com/images/I/51RCWaNJ2mL._AC_UL320_.jpg","3.7","33","29.99","71"
"B0B9RY7R8N","Bluetooth Earpiece Trucker Bluetooth Headset with Microphone Phone Earpiece Wireless Bluetooth for Cell Phones ENC Single Ear Waterproof Bluetooth Headset Hands Free for Office Business Driving Black","https://m.media-amazon.com/images/I/51mbwksVD4L._AC_UL320_.jpg","4.4","5","29.99","71"
"B08FWQK82C","harman/kardon Fly True Wireless IE Headphones Black (Renewed)","https://m.media-amazon.com/images/I/61IaYK77w9L._AC_UL320_.jpg","3.5","8","55.99","71"
"B0CG5Z35WS","Sleep Headphones 2023 Version Bluetooth Headband Headphones for Sleeping with Ultra-Thin HD Speaker&Mic, Best Gift for Side Sleepers/Yoga/Travel/Running and Insomniac - Unisex","https://m.media-amazon.com/images/I/81yFSbdTGpL._AC_UL320_.jpg","4.3","16","19.88","71"
"B0BZL5MBKJ","LEAGLEE Kids Headphones Open Ear Headphones Wireless Bluetooth Air Conduction Headphones with Mic Ultra-Light, Portable Wireless Headphones for Kids/Children (Black)","https://m.media-amazon.com/images/I/51vc6QWEGKL._AC_UL320_.jpg","4.8","15","19.99","71"
"B06XY9NNNN","SoundMAGIC HP151 Over-Ear Wired Headphones for Monitoring & Recording, Closed-Back HiFi Stereo Headsets for Audiophiles, Work with All Audio Devices, Adjustable & Collapsible Design, Black","https://m.media-amazon.com/images/I/61w5SJat1VL._AC_UL320_.jpg","3.9","76","89.98","71"
"B0BZC9H74L","Houstic Open Ear Headphones Clip On Wirelss Earbuds Bone Conduction Sport Earbuds Bluetooth 5.3 Built-in Microphone LED Power Display for Workout Cycling Running Gym Black","https://m.media-amazon.com/images/I/61cUfNod3FL._AC_UL320_.jpg","3.6","43","15.99","71"
"B09CJJ883M","UrbanX R2 Wired in-Ear Headphones with Mic for Samsung Galaxy Tab A7 Lite / A8 10.5 / s6 Lite / A7 10.4 / with Tangle-Free Cord, Noise Isolating Earphones, Deep Bass, in-Ear Bud Silicone Tips","https://m.media-amazon.com/images/I/61ZsLhlWNWL._AC_UL320_.jpg","3.7","40","9.63","71"
"B07CTSN3M1","Minelab ML 80 Wireless Headphones","https://m.media-amazon.com/images/I/61ImBuHb49L._AC_UL320_.jpg","4.3","58","139.0","71"
"B0C85G1SCP","Kinboofi TANGZU WAN'ER S.G in Ear Monitor Headphone, HiFi Quality Wired IEM Earbuds with Micphone,Sport Noise Isolation Wried Headphone with Detachaable 2pin Cable for Audiophile Musician…","https://m.media-amazon.com/images/I/61Pz2MQyP+L._AC_UL320_.jpg","4.2","28","25.99","71"
"B09CTKP823","Tayogo Bone Conduction Headphones - Open-Ear Bluetooth Sport Headphones with Built-in Mic - Sweatproof Wireless Earphone for Running, Cycling, Hiking, and Driving, with Earplugs - Grey","https://m.media-amazon.com/images/I/51L605UW6zL._AC_UL320_.jpg","4.0","134","29.99","71"
"B07YQ5JPWP","JBL JR300 Kids Folding On-Ear Headphones - Blue - JBLJR300BLU (Renewed)","https://m.media-amazon.com/images/I/71ZHwGNA1eL._AC_UL320_.jpg","4.4","56","19.99","71"
"B0C2BCCHV9","AUOUA Life On Music Bluetooth Headphones Over Ear, Stereo Bass Wireless Headset with Mic, Bluetooth 5.2 Headphone for iPad/Travel/Gym/Tablet/Cell Phone/PC (Silver +Black)","https://m.media-amazon.com/images/I/71PkWQcnfgL._AC_UL320_.jpg","3.8","120","14.49","71"
"B07Z89CGS5","Philips Audio Performance TAPH805BK Bluetooth 5.0 Active Noise Cancelling Over-Ear Headphones with Google Assistant (Black)","https://m.media-amazon.com/images/I/819T07gqH2L._AC_UL320_.jpg","4.2","1521","99.99","71"
"B0BM4CJ6KZ","Skicuwim Open Ear Headphones Wireless Earbuds Bluetooth Earbuds Sport Earbuds Running Earbuds Music Earbuds,Clip-on Earphones,Headphones for Small Ear.not in Your Ear","https://m.media-amazon.com/images/I/61RWfrYhyEL._AC_UL320_.jpg","3.5","154","19.99","71"
"B0C3GBS8YR","GIEC True Wireless Earbuds with 4 Mics for Clear Calls Noise Cancelling Bluetooth Headphones 50H Playback with Translucent Charging case IPX7 Waterproof Stereo Sound Earphones Semi-in-Ear Ear Buds","https://m.media-amazon.com/images/I/51rUpH3qNXL._AC_UL320_.jpg","3.9","53","19.99","71"
"B0CGJ38BMK","2 Pack USB C Headphones, Type C Earbuds Wired for Samsung S21 S22 S23 Ultra, HiFi Stereo Earphones with Mic & Volume Control Compatible with iPad Pro, Android Galaxy S20 Google Pixel 7 Pro 7A 6A 6","https://m.media-amazon.com/images/I/51Z7WLoLXYL._AC_UL320_.jpg","4.9","49","11.99","71"
"B0BWRD1CGZ","QLXAQLX Clip Bone Conduction Headphones Clip-on Wireless Earbuds Built-in Mic Sweat Resistant Noise Cancelling Earphones Open Ear Design Earphones Headset for Cycling Driving led Display Black","https://m.media-amazon.com/images/I/61vDqtQIuXL._AC_UL320_.jpg","4.3","5","15.99","71"
"B0C4GX7KTV","Linsoul Raptgo Bridge 2BA+2DD+PZT Tribrid in-Ear Monitor, HiFi IEM with Tuning Switch, Interchangeable Metal Filters, 4 Way Crossover for Musician Audiophile DJ Studio (Purple, Bridge)","https://m.media-amazon.com/images/I/61ULyosp6+L._AC_UL320_.jpg","4.7","5","159.0","71"
"B09B38JWML","Bluedio BT5 Wireless Headphone and Wired Stereo Bluetooth Over-Ear Headphone with Built-in Microphone, Suitable for Cell Phones Computer TV Laptop Travel and Work","https://m.media-amazon.com/images/I/41OCq+BTJZL._AC_UL320_.jpg","4.0","221","17.99","71"
"B085HBBG66","Etymotic Research Saf-T-Ear Bluetooth Earphones (Protect hearing with up to 25dB of noise reduction and stream music and calls), black/yellow","https://m.media-amazon.com/images/I/71sdtykESqL._AC_UL320_.jpg","3.9","238","39.95","71"
"B0C3TT9183","YINYOO KBEAR Storm in-Ear Headphones, 1DD Wired Earphones Professional Wired Earbuds IEM with Crystal Clear Sound, 3.5mm Plug in Ear Monitor Headphones for Musician Singer Music (Black, Without mic)","https://m.media-amazon.com/images/I/61QAg1rdzoL._AC_UL320_.jpg","4.3","1054","19.99","71"
"B09QKNW4N1","Tribit True Wireless Earbuds, Active Noise Cancelling Bluetooth Earphones Transparency Mode 6Mics ENC Hearing Compensation Audiodo Personal Sound 36H Playtime Headphones in Ear, FlyBuds C1 Pro","https://m.media-amazon.com/images/I/51H2+BJGAjL._AC_UL320_.jpg","3.8","63","89.99","71"
"B0BNWYDGB7","Revolutionary 6-in-1 Cleaner Kit for Airpods 1/2/3/ Pro Headphones Earbuds and Case & Keyboard, Deep Cleaning Tools with Brush for iPhone, Keyboard, Wireless Bluetooth Earphones,Laptop and Camera","https://m.media-amazon.com/images/I/61loSejFKiL._AC_UL320_.jpg","4.4","2200","7.99","71"
"B0B63TPK5K","Wireless Earbud, Bluetooth 5.1 Headphones Mini Bluetooth Earbud with HD Mic, Bluetooth Earphones in Ear with USB C Charging Case, IP7 Waterproof Wireless Headphones, Deep Bass, 30H Headset for Sports","https://m.media-amazon.com/images/I/71on1MUgCvL._AC_UL320_.jpg","4.3","168","17.99","71"
"B0BRMZQ4HS","SQRMINI Mini Headphones Ear Buds, Wireless Bluetooth Earbuds for Small Ear Canals, Sleep Earbuds Noise Isolating, Invisible Earphone for iPhone PC Laptop Tablets Sports(Nude)","https://m.media-amazon.com/images/I/51SZgQtgNHL._AC_UL320_.jpg","3.5","81","32.99","71"
"B09P7TWZHV","Lopnord Wireless Earbuds Bluetooth Headphones with Charging Case, IPX7 Waterproof Sports True Wireless Earbuds with Ear Hook, Earbuds Noise Cancelling with Microphone for Outdoor Running","https://m.media-amazon.com/images/I/61hgrhPsTGL._AC_UL320_.jpg","4.3","61","13.99","71"
"B07RST86WQ","Paww SilkSoundX Bluetooth Workout Headphones - Unisex Lightweight & Sweat Proof Wireless Headphone w/Equalizer, Retractable Earbuds & Microphone - Mobile Music Accessory for Sports & Gym Exercise","https://m.media-amazon.com/images/I/61-foyerwfL._AC_UL320_.jpg","4.2","463","49.99","71"
"B07JCDWXWH","Artix CL650 Wired Headphones for Kids & Adults — Noise Cancelling Computer Headphones Wired with Mic & Volume Control, Plug In Headphones for Laptop, Corded Headphone On / Over Ear with Wire 3.5mm","https://m.media-amazon.com/images/I/717nCFNBYWL._AC_UL320_.jpg","4.1","3561","18.99","71"
"B09ZV8X3V4","Neck-Mounted Earphones Wireless Sports Bluetooth Earbuds bass Boost in-Ear Noise Isolation,Magnetic Neckband earhooks Bluetooth Headphones with mic,80 Hours Playback,LED，USB-C (Blue)","https://m.media-amazon.com/images/I/51m7N2n-FOL._AC_UL320_.jpg","3.6","37","21.99","71"
"B07RN8L8MK","SIMOLIO Digital 2.4GHz Dual Wireless TV Headphones w/100ft Long-Distance, Hearing Protection Wireless Headphone for TV Watching, TV Listening Device for Seniors and Hard of Hearing SM-8245","https://m.media-amazon.com/images/I/71zMi1wxCAL._AC_UL320_.jpg","4.1","78","169.0","71"
"7546221978","(朗声旧版)金庸作品集套装（套装全36册）附白马啸西风、鸳鸯刀、越女剑","https://m.media-amazon.com/images/I/71k52FbRGwL._AC_UL320_.jpg","5.0","12","200.0","71"
"B0BC28RKZD","GXNNDYMY Wireless Earbuds Bluetooth Headphones Neckband Sport Earbuds with 100 H Playtime, Noise Cancelling, HiFi Stereo Earbuds with Microphone, USB-C Fast Charging, Foldable (Black)","https://m.media-amazon.com/images/I/61Qo07o7HjL._AC_UL320_.jpg","3.5","27","18.99","71"
"B01IOECY5C","Sennheiser HD 2.30G White Ear Headphones (Discontinued by Manufacturer)","https://m.media-amazon.com/images/I/71-EH17bYoL._AC_UL320_.jpg","4.2","470","69.99","71"
"B09G2F6G6L","Vsonus Noise Cancelling Headphones Wireless Bluetooth, Over Ear Bluetooth Headphones Noise Canceling with Microphone for Adults, 30H Playtime, Deep Bass Sound, Folding, Comfortable Earpads","https://m.media-amazon.com/images/I/51VGxHM9uiL._AC_UL320_.jpg","4.2","72","25.99","71"
"B0C61Y8X85","Wireless Earbuds, 2pack 50Hrs Playtime Bluetooth Earbuds Built in Noise Cancellation Mic with Charging Case, Bluetooth Headphones with Stereo Sound, IPX7 Waterproof Ear Buds for iPhone and Android","https://m.media-amazon.com/images/I/61Ovm9nKVGL._AC_UL320_.jpg","4.1","30","19.99","71"
"B0989PZ9V3","Bluetooth Neckband Headphones Retractable, Wireless Headset Retractable Earphones Noise Cancelling Sweatproof Stereo Earbuds with Mic by NVOPERANG","https://m.media-amazon.com/images/I/61nmYh9lwvL._AC_UL320_.jpg","3.8","177","25.99","71"
"B08HT41MJY","COOYA USB C Earbuds & in-Ear Headphones with Mic for iPhone 15 Plus iPad Pro,Magnetic USB C Headphone for Samsung Galaxy S23 S22 Ultra S21 S20 A54 Note 20 Flip5 DAC Type C Earphone Pixel 7 6a OnePlus","https://m.media-amazon.com/images/I/61gbrOuO1tL._AC_UL320_.jpg","4.2","748","14.99","71"
"B08DL52D6X","Spoontiques Harry Potter I Solemnly Swear I am Up to No Good Mischief Managed Eyeglass Case","https://m.media-amazon.com/images/I/6127vmptiHL._AC_UL320_.jpg","4.7","196","14.15","71"
"B09QPXGPWF","Sony WH-CH710N/H Wireless Bluetooth Noise Cancelling Headphones with Microphone (Renewed)","https://m.media-amazon.com/images/I/51KD+b1ovpL._AC_UL320_.jpg","4.0","10","119.49","71"
"B06XMRQQCD","iFrogz InTone Folding Wireless Over-The-Ear Headphones, White, IFITNW-WH0 OPEN BOX","https://m.media-amazon.com/images/I/61-45ReMmeL._AC_UL320_.jpg","4.0","146","19.99","71"
"B07DNQY4FR","（10 pcs） Hearing Amplifier Dome Open Fit Ear Tip Earplug Earbuds for RIC Hearing Aids (M φ9mm)","https://m.media-amazon.com/images/I/61Bs7QEAfPL._AC_UL320_.jpg","4.2","90","9.9","71"
"B0BRXY6DQ7","Wired Earbuds for iPhone 14/14 Pro Max - iPhone Headphones in-Ear with Microphone, Noise Isolating, Bluetooth, Compatible with iPhone 14 Pro/13/13 Pro Max/12/11/X/XR (2 Pack)","https://m.media-amazon.com/images/I/51FQRyOMJfL._AC_UL320_.jpg","4.0","10","8.99","71"
"B0B8HZ36JB","adorer Wired Earphones, EM20 Ergonomic Comfort-Fit in-Ear Headphones with Microphone and Volume Control, Powerful Bass Noise Isolating Earbuds for iPhone iPad iPod Samsung MP3/MP4 Player","https://m.media-amazon.com/images/I/711qiF+ySsL._AC_UL320_.jpg","4.3","120","13.99","71"
"B01GU4BHII","Bastex Universal Earphone/Ear Buds 3.5mm Stereo Headphones in-Ear Tangle Free Cable with Built-in Microphone Earbuds for iPhone iPod iPad Samsung Android Mp3 Mp4 and More-Black/Black","https://m.media-amazon.com/images/I/61Uz7nMvR0L._AC_UL320_.jpg","3.9","327","6.99","71"
"B078WJ2QFP","Beats by Dr. Powerbeats3 Wireless In-Ear Headphone W/MKK Car Adapter (Renewed) (Siren Red)","https://m.media-amazon.com/images/I/61lu77h8GgL._AC_UL320_.jpg","4.4","8","69.87","71"
"B0BL77K78L","WFOELVR Open Ear Headphones Wireless Earbuds Bluetooth Earbuds Wireless Headphones Bluetooth Headphones Wireless Earphones Bluetooth Earphones (B66-Black)","https://m.media-amazon.com/images/I/51o+E5kb8RL._AC_UL320_.jpg","3.9","36","9.99","71"
"B0BX9BYXTT","ASMRBAND Sleep Headphones, Sleep Headband Headband Headphones - Headphones For Sleep - Headband Headphones Built in Speakers Perfect for Workout,Running,Yoga,Travel,Insomnia","https://m.media-amazon.com/images/I/71eG1vvS9FL._AC_UL320_.jpg","4.5","23","16.99","71"
"B08CL84L8D","Philips T2205 In-ear True Wireless Headphones with IPX4 Splash Resistant, Super-small Portable Charging Case, Built-in Microphone, Up to 12 Hours (4+8) Playtime, Works with Voice Assistants, TAT2205BK","https://m.media-amazon.com/images/I/410tsDitUyL._AC_UL320_.jpg","3.6","773","49.99","71"
"B07JM12GJ6","Uclear Motion 6 - Single","https://m.media-amazon.com/images/I/619nWxgrd5L._AC_UL320_.jpg","3.7","68","214.95","71"
"B0852HR3MW","iCanonic Wireless Earbuds with Bluetooth 5.0 in-Ear Headphones and Charging Case, HD Sound/Quick-Pairing Stereo Calls/Built-in Microphones/IPX5 Sweatproof/Acoustic Bass for Sports - Black (ZT000030)","https://m.media-amazon.com/images/I/51k1nzIvtUL._AC_UL320_.jpg","4.3","1455","19.97","71"
"B07JQ9383G","SIMGOT MT3 Hi-Res in Ear Monitor Headphones with Detachable Cable, Dynamic Driver Crystal Sound Stereo IEM Earphone for Musicians Singer, HiFi Wired Earbuds for Smartphones and Audio Players (Black)","https://m.media-amazon.com/images/I/51xHXzydCcL._AC_UL320_.jpg","4.4","542","69.99","71"
"B09PYJQQW9","DeLUX True Wireless Earbuds - Dual Mode in-Ear Headphones with BT 5.0, Wireless Charging Case, 30 Hrs Playtime, IPX5 Waterproof, Built-in Mic, Immersive Deep Bass, Touch Control (DT3-Black)","https://m.media-amazon.com/images/I/51LWi0ivM1L._AC_UL320_.jpg","4.4","60","19.99","71"
"B0BG1FTVZK","Wireless Earbuds, Bluetooth 5.3 Headphones Stereo Bass, 48H Playtime Earphones with LED Power Display, Over-Ear Buds with Earhooks Built-in Mic, IP7 Waterproof Headset for Sport Running Workout","https://m.media-amazon.com/images/I/71NexWBndwL._AC_UL320_.jpg","4.2","2886","29.99","71"
"B07HRHM8F3","Sennheiser Momentum True Wireless in-Ear Headphones (M3IETW/Black)","https://m.media-amazon.com/images/I/61-glRBmsFL._AC_UL320_.jpg","3.8","3142","183.0","71"
"B0BXWX8PZW","Bluetooth Headphones,Open Ear Air Conduction Headphones Bluetooth 5.2 Wireless Headsets with Built-in Mic,10 Hrs Playtime, Waterproof Sport Headset for Running, Cycling, Hiking, Driving-Black 2023","https://m.media-amazon.com/images/I/41AGEJ+CmwL._AC_UL320_.jpg","3.9","20","25.99","71"
"B0BVM7J63D","Hspro Bluetooth Headphones, Wireless Sports Earbuds IPX7 Waterproof with Mic, Stereo Sweatproof in-Ear Earphones, Noise Cancelling Headsets for Gym Running Workout, 15 Hours Playtime - BlackGrey","https://m.media-amazon.com/images/I/61I6v5Xb5TL._AC_UL320_.jpg","4.3","840","13.32","71"
"B09TGWFL6B","QKSHZHZQ LED Lighting Unicorn Cat Ear Wired Headphones, Kids Headphones Safe Volume Limit 85DB, Headphones for Girls Boys for Online Learning/School/Travel/TabletPurple","https://m.media-amazon.com/images/I/61MOlczfdFL._AC_UL320_.jpg","3.7","83","16.88","71"
"B0CJHTYTSQ","Wireless Earbuds Bluetooth Headphones 40Hrs Playback IPX7 Waterproof Sports Earphones with Wireless Charging Case & LED Power Display TWS Stereo Headset Microphone for iOS Android Laptop Black CAP0X0","https://m.media-amazon.com/images/I/61108xUlPqL._AC_UL320_.jpg","5.0","155","39.99","71"
"B08PF93747","YLFASHION Kids Headphones Bluetooth Headphones, Colorful LED Lights Wireless Cartoon Headphones, Over Ear Headphones Built-in Mic for Children/School/iPad/Tablet/Airplane","https://m.media-amazon.com/images/I/618Ynh3FQrL._AC_UL320_.jpg","4.1","51","25.99","71"
"B07DG7XTH9","Plantronics BackBeat FIT 305 Sweatproof Sport Earbuds, Wireless Headphones, Dark Blue/Blue","https://m.media-amazon.com/images/I/61Wjih0IGTL._AC_UL320_.jpg","3.8","156","24.99","71"
"B09KC42ZQS","Aurasound 2022 Bluetooth 5.1 Noise Cancelling Earbuds, True Wireless Earphones, 4g Tiny Earbuds with 4 Microphone, Waterproof IPX4, Deep Bass, Stereo in Ear Earbuds Beans for Sleep and Work（White）","https://m.media-amazon.com/images/I/614bl-wy3NL._AC_UL320_.jpg","3.7","607","29.99","71"
"B0BV21M23N","CCA CRA in Ear Monitor Wired Earbuds with Microphone Powerful Bass Dynamic Earphones, Ultra-Thin Diaphragm Dynamic Driver IEM with Detachable Cable, Noise-Isolating in Ear Headphones","https://m.media-amazon.com/images/I/61l5aKaEx2L._AC_UL320_.jpg","4.1","10","21.99","71"
"B0BQM9F5YQ","zhhcyyds T32 True Wireless Earbuds with Charging Case, Ear Buds Wireless Bluetooth Earbuds, 5.3 Wireless Earphones Cool Gaming Earbuds Noise Cancelling (Black)","https://m.media-amazon.com/images/I/71cowb9UIpL._AC_UL320_.jpg","4.2","9","24.99","71"
"B08B1V8MDR","CozyPhones Sleep Headphones - Wireless Over Ear Headphones from Ultra Thin Cool Mesh Chordless Head Phones for Side Sleepers, Meditation, Running, Laptop, and Phone - Black Lycra","https://m.media-amazon.com/images/I/81I-yMtRIQL._AC_UL320_.jpg","3.6","38","24.99","71"
"B096M7N41S","Toonshare Neck Cooling Tube, Cool Neck Ring Ice Pillow Cooling Neck Wraps, Summer Heatstroke Prevention Wearable Cooling Neck Hanging Ice Pad, Hands Free Cold Gel Ice Pack (Blue)","https://m.media-amazon.com/images/I/51m7rUiAz4S._AC_UL320_.jpg","3.8","22","15.99","71"
"B07T626S29","ZANCHIE Wireless RF Headphones for TV Watching, Over-Ear Stereo Headsets for Hard of Hearing, 330ft Signal Range (Require Transmitter, Transmitter Not Included)","https://m.media-amazon.com/images/I/51fokXF27aL._AC_UL320_.jpg","3.9","30","28.99","71"
"B099F23RSJ","ACAGET USB C Earbuds, Magnetic Type C Earphone for iPhone 15 Pro Max Galaxy A54 A53 Wired Headphone with C Plug Noise Cancelling HiFi Stereo USB C Headset for Samsung S22 Ultra S23 S21 Plus Pixel 7 7a","https://m.media-amazon.com/images/I/61JBNyAtOrL._AC_UL320_.jpg","4.3","116","14.98","71"
"B083TJ16Y4","eKids Frozen 2 Wireless Bluetooth Portable Kids Headphones with Microphone, Volume Reduced to Protect Hearing Rechargeable Battery, Adjustable Kids Headband for School Frustration Free Packaging","https://m.media-amazon.com/images/I/71m04+so02L._AC_UL320_.jpg","4.5","109","19.99","71"
"B0C5R97H7V","Bluetooth Headphones Wireless Earbuds 48Hrs Playtime HiFi Stereo Ear Buds IP68 Waterproof Sports Earphones with Over-Ear Earhook Wireless Charging Case Headset LED Power Display for Workout Black","https://m.media-amazon.com/images/I/71H0a358o+L._AC_UL320_.jpg","4.5","45","15.89","71"
"B0CHRBM4LC","Replacement Ear Pads for Bose QuietComfort 35/Quiet Comfort 35 II (qc 35/QC35 ii), Headphone Ear Covers, High Density Memory Cotton, Soft Leather, Adaptive Noise Isolation Headphones Pads Cushions","https://m.media-amazon.com/images/I/71q28OV-yUL._AC_UL320_.jpg","4.9","13","14.99","71"
"B07HXPLY9V","Mackie CR Series, Professional Fit Earphones with Dual-Driver Sound, Black), Mic and Control (CR-BUDS+)","https://m.media-amazon.com/images/I/61EhQbY5z+L._AC_UL320_.jpg","3.9","194","22.86","71"
"B07FKSCYP5","Kinboofi TRN V80 HiFi Earphone 2 Dynamic & 2 Balanced Armature Driver Stereo Bass IEM, Metal in Ear Headphone, Stage/Studio in Ear Monitor with Detachable 2 Pin Cable (Black No Mic)","https://m.media-amazon.com/images/I/51xsbIQjLhL._AC_UL320_.jpg","4.4","293","41.99","71"
"B0BMTVV4ZP","MAIRDI Bone Conduction Headphone Bluetooth 5.3 - Open Ear Sport Headphones Wireless with AI Noise Canceling Microphone, 8H Hours Playtime, Headset Waterproof for Running Workouts Driving","https://m.media-amazon.com/images/I/51J2U0+jsoL._AC_UL320_.jpg","3.9","114","49.99","71"
"B07KB38BQP","KIDSDESIGN Spiderman Headphones (SM-V126)","https://m.media-amazon.com/images/I/81DWJ846WRL._AC_UL320_.jpg","4.1","145","19.8","71"
"B0BL91S5B8","QHQO [2023 New] Wireless Earbuds, True Wireless Bluetooth Earbuds 5.2 with Reduction Touch, IPX7 Waterproof Bluetooth Earbuds with Wireless Charging 36H Playtime for Android and iOS (Blue)","https://m.media-amazon.com/images/I/61fxZBxOqrL._AC_UL320_.jpg","4.0","66","8.99","71"
"B0BX251JYC","MGGZXR Bluetooth Neckband Headphones Neckband Headset 100 Hours Playtime,Built-in Noise Cancelling Microphone,Wireless Neck Headphones Semi-Ear Earbuds 3D Stereo Sportsfor iPhones Android","https://m.media-amazon.com/images/I/61px5dQrKZL._AC_UL320_.jpg","3.7","82","22.99","71"
"B008SOSE6M","JVC HAFR6B Gumy Plus Headphones (Black)","https://m.media-amazon.com/images/I/71YgCr6JNqL._AC_UL320_.jpg","4.4","1011","11.75","71"
